{
  "identify": "TYD-99-訴-1485-20110128-1",
  "court": {
    "name": "臺灣桃園地方法院",
    "code": "TYD"
  },
  "division": {
    "name": "民事",
    "code": "V"
  },
  "year": 99,
  "word": "訴",
  "number": "1485",
  "jcheck": "1",
  "reason": "拆屋還地",
  "content": "臺灣桃園地方法院民事判決              99年度訴字第1485號\n原      告  郭黃金\n            郭美珠\n上  1   人\n訴訟代理人  王偉成\n被      告  趙曉農\n訴訟代理人  張炳輝\n上列當事人間請求拆屋還地事件，本院於民國100 年1 月20日言\n詞辯論終結，判決如下：\n    主  文\n被告應將坐落桃園縣桃園市○路段一七一四地號土地上，如附圖\n所示編號Ａ部分，面積零點零四平方公尺之陽台拆除，並將該部\n分土地交還原告。\n被告應給付原告郭黃金新台幣陸佰零伍元，及自民國九十九年十\n月三日起至返還前開占用土地之日止，按月給付原告新台幣元\n。\n被告應給付原告郭美珠新台幣佰零元，及自民國九十九年十\n月三日起至返還前開占用土地之日止，按月給付原告新台幣貳元\n。\n原告其餘之訴駁回。\n訴訟費用由被告負擔千分之八，原告郭美珠負擔千分之三百三十\n，餘由原告郭黃金負擔。\n本判決第一項至第三項得假執行。\n原告其餘假執行之聲請駁回。\n  事實及理由\n一、本件原告主張：\n  (一)原告所有坐落於桃園縣桃園市○路段1714地號之土地（下稱\n    系爭土地，原告郭黃金之應有部分為3 分之2 、原告郭美珠\n    之應有部分為3 分之1 ），遭被告於30多年前無權占用，供\n    建造被告所有之加強磚造三層樓房（門牌號碼：桃園縣桃園\n    市○○路361 號，下稱系爭房屋）後方一樓RC造樓梯、二樓\n    、三樓陽台之用。原告直至民國99年5月27日、99年8 月2日\n    申請桃園縣桃園地政事務所複丈、再鑑界系爭土地，於99年\n    8 月30日收受該所函送系爭土地測量成果圖後，方知上開情\n    事，爰依民法第767 條物上返還請求權之規定，訴請被告拆\n    除上述無權占用部分，並將該部分土地返還原告。\n  (二)被告無權占有原告所有之系爭土地，致原告對之無法使用收\n    益，被告顯係無法律上原因受有利益而致原告有損害，原告\n    自得依民法第179 條之規定，對被告請求相當於租金之不當\n    得利。被告自30多年無權占有系爭土地迄今，以15年計算其\n    所得之不當得利應為新台幣（下同）531,585 元（計算式：\n    系爭土地申報地價70,878元×10％×占用面積5 ㎡×15年＝\n    531,585 元）。另被告應自99年9 月9 日起至交還土地止，\n    按月給付原告2,953 元（計算式：系爭土地申報地價70,878\n    元×10％×占用面積5 ㎡÷12月＝2,953 元，元以下四捨五\n    入）之不當得利。\n  (三)聲明：\n  1.被告應將系爭土地上，如附圖所示編號A ，面積為0.04平方\n    公尺，及編號B ，面積為2.96平方公尺之陽台及RC造樓梯拆\n    除，並將該部分土地返還原告。\n  2.被告應給付原告531,585 元，及自本件起訴狀繕本送達翌日\n    起至清償日止，按年息百分之5 計算之利息，暨自99年9 月\n    9 日起至返還第一項土地之日止，按月給付原告2,953元。\n  3.上開2項，願供擔保，請准宣告假執行。\n二、被告則抗辯：\n  (一)系爭房屋係於57年間興建完成，完成時該屋西北側為1 既成\n    巷道，被告於當時即利用該巷道進出，然因建商欲在系爭土\n    地上建屋，乃向被告父親協議廢除上開巷道，以興建原告目\n    前所有之房屋，並在系爭土地上加設1 樓梯，連接系爭房屋\n    2 樓陽台作為替代出入口，供系爭房屋2 樓利用此樓梯通達\n    後方防火巷出入。嗣因上開防火巷被該地上之建物所有權人\n    封堵，無法通行，故上開樓梯即廢棄不用。因該樓梯係廢巷\n    之交換條件，為上述建商自願興建，且於原告購屋前發生，\n    因此，該樓梯之產權應屬原告所有，任由原告自行處置。\n  (二)系爭房屋興建時，即已包含原告所述之陽台在內，受土地範\n    圍限制，該陽台深度僅約60餘公分。而原告所有之房屋在興\n    建前進行測量、放樣等工程，均未有發現地界不符之情形。\n    可知該陽台並未越界占用系爭土地。\n  (三)答辯聲明：駁回原告之訴。\n三、本院之判斷：\n  (一)原告主張其為系爭土地所有權人，其中郭黃金之應有部分為\n    3 分之2 、郭美珠之應有部分為3 分之1 等情，業據提出與\n    其所述相符之土地登記第2 類謄本1 件為證（參見本院卷第\n    9 至10頁），被告對此亦不爭執，是原告此部分主張堪信為\n    真實。\n  (二)原告復主張被告無權占用如其聲明所示部分之土地等語，為\n    被告所否認，並執前詞置辯。\n  1.經查，本院依原告聲請於99年11月10日及99年12月8 日前往\n    系爭土地履勘，並囑託桃園縣桃園地政事務所人員就系爭房\n    屋後方之陽台及RC造樓梯是否有占用到系爭土地一事進行測\n    量及製作土地複丈成果圖（即附圖），有勘驗筆錄2 件及附\n    圖1 件在卷可稽（參見本院卷第28頁及第36頁）。依該附圖\n    所示，可知編號A 部分，面積為0.04平方公尺之系爭房屋後\n    方陽台已占用到原告所有之系爭土地，被告對此復無其他反\n    證提出，是被告抗辯系爭房屋後方之陽台並未越界占用系爭\n    土地云云，與事實不符，自難採信。\n  2.原告另主張如附圖所示編號B 部分，面積為2.96平方公尺之\n    RC造樓梯為被告所有，且屬無權占有系爭土地云云，被告則\n    抗辯上開樓梯係為廢除既有巷道之交換條件，為原告所有之\n    房屋建商自願興建，且於原告購屋前發生，因此，該樓梯之\n    產權應屬原告所有，任由原告自行處置，另該樓梯早已廢棄\n    不用等語。查依被告所述，充其量僅足以認定被告曾有使用\n    該樓梯之權利，而未能逕予認定被告已取得該樓梯之所有權\n    ，而原告對於該樓梯係由被告所興建或被告已取得該樓梯之\n    所有權一事復未能舉證以實其說，是原告主張上開樓梯為被\n    告所有，並無權占有系爭土地云云，尚乏所據，不足採信。\n  3.綜上，原告主張被告無權占用如附圖所所示編號A 部分，面\n    積為0.04平方公尺之土地等情，堪信屬實。\n  (三)按土地所有人得依不當得利法則向無權占用其土地之人請求\n    返還相當於租金之損害金，惟其數額，除以申報地價為基礎\n    外，尚須斟酌基地之位置、工商業繁榮之程度及占用人利用\n    土地之經濟價值及所受利益等項，並與鄰地租金相比較，以\n    為決定，並非必達申報地價年息百分之10之最高額（最高法\n    院88年度台上字第3331號及88年度台上字第1894號判決意旨\n    參照）。查被告無權占用如附圖所所示編號A 部分，面積為\n    0.04平方公尺之土地一事，業經本院認定無訛，已如前述。\n    又被告未曾支付任何使用對價予原告，被告自受有相當於租\n    金之利益，原告則因而受有相當於租金之損害，被告占用原\n    告所有系爭土地，已符合不當得利之法律構成要件，原告自\n    得依不當得利之法律關係，請求被告返還自99年9 月8 日起\n    回溯15年間相當於租金之利益。次查，系爭房屋係供被告自\n    行居住使用，被告在該陽台放置熱水器及其他雜物，系爭土\n    地面臨桃園縣桃園市○○路，對面為台西水果行，旁邊有全\n    聯社，亦鄰近台灣電力公司，距振興中學及桃園縣政府分別\n    為2 分鐘及5 分鐘車程，系爭房屋週遭之生活機能便利，有\n    原告提供之現場照片10張在卷可佐（參見本院卷第19至22頁\n    ），復經本院會同兩造於99年11月10日履勘屬實，有勘驗筆\n    錄1 件附卷可稽（參見本院卷第28頁），本院審酌被告使用\n    土地之面積、現況等一切情事，認為原告因被告使用系爭土\n    地所受之損害以土地申報總價額年息百分之6 計算為適當。\n    又系爭土地中於86年、89年、93年、96年之申報地價均為每\n    平方公尺25,304元，99年1 月之申報地價則為每平方公尺25\n    ,093元，有系爭土地之土地登記第2 類謄本及本院公務電話\n    紀錄各1 件在卷可憑（參見本院卷第9 頁及第44頁）。從而\n    ，原告請求被告給付如附表所示相當於租金之不當得利，及\n    自99年9 月9 日起至返還如主文第1 項所示被告占用之土地\n    予原告之日止，按月計算之損害金（計算方式詳如附表），\n    均屬有據。\n  (四)綜上所述，原告請求1.被告應將系爭土地上，如附圖所示編\n    號A 部分，面積0.04平方公尺之陽台拆除，並將該部分土地\n    交還原告。2.被告應給付郭黃金605 元，及自99年10月3 日\n    起至返還前開占用土地之日止，按月給付原告3 元。3.被告\n    應給付郭美珠303 元，及自99年10月3 日起至返還前開占用\n    土地之日止，按月給付原告新台幣2 元，為有理由，應予准\n    許，逾此範圍所為之請求，為無理由，應予駁回。\n四、原告陳明願供擔保請准宣告假執行及免為假執行，就原告勝\n    訴部分，金額在500,000 元以下，應依職權宣告得假執行，\n    並酌定相當擔保金額宣告得免為假執行；至原告敗訴部分，\n    假執行之聲請已失依附，應予駁回。\n五、本件事證已臻明確，兩造間其餘攻擊防禦方法，核與本判決\n    結果不生任何影響，爰不一一予以論述，附此敘明。\n六、據上論結，本件原告之訴為一部有理由，一部無理由，依民\n    事訴訟法第79條、第85條第1 項但書、第389 條第1項第5款\n    ，判決如主文。\n中    華    民    國   100    年    1     月    28    日\n                  民事第一庭    法  官  林哲賢\n附表：（小數點以下均四捨五入）\n1.被告占用附圖所示編號A 部分，面積0.04平方公尺之土地：\n(1)84年9 月9 日至98年12月31日之不當得利為867 元【（0.04X2\n  5,304X6%X14 ）+ （0.04 X25,304X6% ÷12X ｛3 ＋9/30｝=8\n  67，元以下四捨五入】。\n(2)99年1 月1 日至99年9 月8 日之不當得利為41元（0.04X25,09\n  3X6%÷12X ｛8 ＋8/30｝=41 ，元以下四捨五入）。\n(3)84年9 月9 日至99年9 月8 日之不當得利合計為908 元（867+\n  41=908）。\n(4)99年9 月9 日起平均每月所受之不當得利為5 元（0.04X25,09\n  3X6%÷12=5，元以下四捨五入）。\n(5)因系爭土地中郭黃金之應有部分為3 分之2 、郭美珠之應有部\n  分為3 分之1 ，是以郭黃金得向被告請求15年之不當得利為60\n  5 元，並自99年9 月9 日起，按月得請求被告給付3 元，郭美\n  珠得向被告請求15年之不當得利為303 元，並自99年9 月9 日\n  起，按月得請求被告給付2元。\n以上正本證明與原本無異\n如對本判決上訴，須於判決送達後 20 日內向本院提出上訴狀。\n如委任律師提起上訴者，應一併繳納上訴審裁判費。\n中    華    民    國   100    年    1     月    28    日\n                                書記官  陳佳彬",
  "structure": {
    "main": "被告應將坐落桃園縣桃園市○路段一七一四地號土地上，如附圖\n所示編號Ａ部分，面積零點零四平方公尺之陽台拆除，並將該部\n分土地交還原告。\n被告應給付原告郭黃金新台幣陸佰零伍元，及自民國九十九年十\n月三日起至返還前開占用土地之日止，按月給付原告新台幣元\n。\n被告應給付原告郭美珠新台幣佰零元，及自民國九十九年十\n月三日起至返還前開占用土地之日止，按月給付原告新台幣貳元\n。\n原告其餘之訴駁回。\n訴訟費用由被告負擔千分之八，原告郭美珠負擔千分之三百三十\n，餘由原告郭黃金負擔。\n本判決第一項至第三項得假執行。\n原告其餘假執行之聲請駁回。",
    "fact": "一、本件原告主張：\n  (一)原告所有坐落於桃園縣桃園市○路段1714地號之土地（下稱\n    系爭土地，原告郭黃金之應有部分為3 分之2 、原告郭美珠\n    之應有部分為3 分之1 ），遭被告於30多年前無權占用，供\n    建造被告所有之加強磚造三層樓房（門牌號碼：桃園縣桃園\n    市○○路361 號，下稱系爭房屋）後方一樓RC造樓梯、二樓\n    、三樓陽台之用。原告直至民國99年5月27日、99年8 月2日\n    申請桃園縣桃園地政事務所複丈、再鑑界系爭土地，於99年\n    8 月30日收受該所函送系爭土地測量成果圖後，方知上開情\n    事，爰依民法第767 條物上返還請求權之規定，訴請被告拆\n    除上述無權占用部分，並將該部分土地返還原告。\n  (二)被告無權占有原告所有之系爭土地，致原告對之無法使用收\n    益，被告顯係無法律上原因受有利益而致原告有損害，原告\n    自得依民法第179 條之規定，對被告請求相當於租金之不當\n    得利。被告自30多年無權占有系爭土地迄今，以15年計算其\n    所得之不當得利應為新台幣（下同）531,585 元（計算式：\n    系爭土地申報地價70,878元×10％×占用面積5 ㎡×15年＝\n    531,585 元）。另被告應自99年9 月9 日起至交還土地止，\n    按月給付原告2,953 元（計算式：系爭土地申報地價70,878\n    元×10％×占用面積5 ㎡÷12月＝2,953 元，元以下四捨五\n    入）之不當得利。\n  (三)聲明：\n  1.被告應將系爭土地上，如附圖所示編號A ，面積為0.04平方\n    公尺，及編號B ，面積為2.96平方公尺之陽台及RC造樓梯拆\n    除，並將該部分土地返還原告。\n  2.被告應給付原告531,585 元，及自本件起訴狀繕本送達翌日\n    起至清償日止，按年息百分之5 計算之利息，暨自99年9 月\n    9 日起至返還第一項土地之日止，按月給付原告2,953元。\n  3.上開2項，願供擔保，請准宣告假執行。\n二、被告則抗辯：\n  (一)系爭房屋係於57年間興建完成，完成時該屋西北側為1 既成\n    巷道，被告於當時即利用該巷道進出，然因建商欲在系爭土\n    地上建屋，乃向被告父親協議廢除上開巷道，以興建原告目\n    前所有之房屋，並在系爭土地上加設1 樓梯，連接系爭房屋\n    2 樓陽台作為替代出入口，供系爭房屋2 樓利用此樓梯通達\n    後方防火巷出入。嗣因上開防火巷被該地上之建物所有權人\n    封堵，無法通行，故上開樓梯即廢棄不用。因該樓梯係廢巷\n    之交換條件，為上述建商自願興建，且於原告購屋前發生，\n    因此，該樓梯之產權應屬原告所有，任由原告自行處置。\n  (二)系爭房屋興建時，即已包含原告所述之陽台在內，受土地範\n    圍限制，該陽台深度僅約60餘公分。而原告所有之房屋在興\n    建前進行測量、放樣等工程，均未有發現地界不符之情形。\n    可知該陽台並未越界占用系爭土地。\n  (三)答辯聲明：駁回原告之訴。\n三、本院之判斷：\n  (一)原告主張其為系爭土地所有權人，其中郭黃金之應有部分為\n    3 分之2 、郭美珠之應有部分為3 分之1 等情，業據提出與\n    其所述相符之土地登記第2 類謄本1 件為證（參見本院卷第\n    9 至10頁），被告對此亦不爭執，是原告此部分主張堪信為\n    真實。\n  (二)原告復主張被告無權占用如其聲明所示部分之土地等語，為\n    被告所否認，並執前詞置辯。\n  1.經查，本院依原告聲請於99年11月10日及99年12月8 日前往\n    系爭土地履勘，並囑託桃園縣桃園地政事務所人員就系爭房\n    屋後方之陽台及RC造樓梯是否有占用到系爭土地一事進行測\n    量及製作土地複丈成果圖（即附圖），有勘驗筆錄2 件及附\n    圖1 件在卷可稽（參見本院卷第28頁及第36頁）。依該附圖\n    所示，可知編號A 部分，面積為0.04平方公尺之系爭房屋後\n    方陽台已占用到原告所有之系爭土地，被告對此復無其他反\n    證提出，是被告抗辯系爭房屋後方之陽台並未越界占用系爭\n    土地云云，與事實不符，自難採信。\n  2.原告另主張如附圖所示編號B 部分，面積為2.96平方公尺之\n    RC造樓梯為被告所有，且屬無權占有系爭土地云云，被告則\n    抗辯上開樓梯係為廢除既有巷道之交換條件，為原告所有之\n    房屋建商自願興建，且於原告購屋前發生，因此，該樓梯之\n    產權應屬原告所有，任由原告自行處置，另該樓梯早已廢棄\n    不用等語。查依被告所述，充其量僅足以認定被告曾有使用\n    該樓梯之權利，而未能逕予認定被告已取得該樓梯之所有權\n    ，而原告對於該樓梯係由被告所興建或被告已取得該樓梯之\n    所有權一事復未能舉證以實其說，是原告主張上開樓梯為被\n    告所有，並無權占有系爭土地云云，尚乏所據，不足採信。\n  3.綜上，原告主張被告無權占用如附圖所所示編號A 部分，面\n    積為0.04平方公尺之土地等情，堪信屬實。\n  (三)按土地所有人得依不當得利法則向無權占用其土地之人請求\n    返還相當於租金之損害金，惟其數額，除以申報地價為基礎\n    外，尚須斟酌基地之位置、工商業繁榮之程度及占用人利用\n    土地之經濟價值及所受利益等項，並與鄰地租金相比較，以\n    為決定，並非必達申報地價年息百分之10之最高額（最高法\n    院88年度台上字第3331號及88年度台上字第1894號判決意旨\n    參照）。查被告無權占用如附圖所所示編號A 部分，面積為\n    0.04平方公尺之土地一事，業經本院認定無訛，已如前述。\n    又被告未曾支付任何使用對價予原告，被告自受有相當於租\n    金之利益，原告則因而受有相當於租金之損害，被告占用原\n    告所有系爭土地，已符合不當得利之法律構成要件，原告自\n    得依不當得利之法律關係，請求被告返還自99年9 月8 日起\n    回溯15年間相當於租金之利益。次查，系爭房屋係供被告自\n    行居住使用，被告在該陽台放置熱水器及其他雜物，系爭土\n    地面臨桃園縣桃園市○○路，對面為台西水果行，旁邊有全\n    聯社，亦鄰近台灣電力公司，距振興中學及桃園縣政府分別\n    為2 分鐘及5 分鐘車程，系爭房屋週遭之生活機能便利，有\n    原告提供之現場照片10張在卷可佐（參見本院卷第19至22頁\n    ），復經本院會同兩造於99年11月10日履勘屬實，有勘驗筆\n    錄1 件附卷可稽（參見本院卷第28頁），本院審酌被告使用\n    土地之面積、現況等一切情事，認為原告因被告使用系爭土\n    地所受之損害以土地申報總價額年息百分之6 計算為適當。\n    又系爭土地中於86年、89年、93年、96年之申報地價均為每\n    平方公尺25,304元，99年1 月之申報地價則為每平方公尺25\n    ,093元，有系爭土地之土地登記第2 類謄本及本院公務電話\n    紀錄各1 件在卷可憑（參見本院卷第9 頁及第44頁）。從而\n    ，原告請求被告給付如附表所示相當於租金之不當得利，及\n    自99年9 月9 日起至返還如主文第1 項所示被告占用之土地\n    予原告之日止，按月計算之損害金（計算方式詳如附表），\n    均屬有據。\n  (四)綜上所述，原告請求1.被告應將系爭土地上，如附圖所示編\n    號A 部分，面積0.04平方公尺之陽台拆除，並將該部分土地\n    交還原告。2.被告應給付郭黃金605 元，及自99年10月3 日\n    起至返還前開占用土地之日止，按月給付原告3 元。3.被告\n    應給付郭美珠303 元，及自99年10月3 日起至返還前開占用\n    土地之日止，按月給付原告新台幣2 元，為有理由，應予准\n    許，逾此範圍所為之請求，為無理由，應予駁回。\n四、原告陳明願供擔保請准宣告假執行及免為假執行，就原告勝\n    訴部分，金額在500,000 元以下，應依職權宣告得假執行，\n    並酌定相當擔保金額宣告得免為假執行；至原告敗訴部分，\n    假執行之聲請已失依附，應予駁回。\n五、本件事證已臻明確，兩造間其餘攻擊防禦方法，核與本判決\n    結果不生任何影響，爰不一一予以論述，附此敘明。\n六、據上論結，本件原告之訴為一部有理由，一部無理由，依民\n    事訴訟法第79條、第85條第1 項但書、第389 條第1項第5款\n    ，判決如主文。",
    "reason": "一、本件原告主張：\n  (一)原告所有坐落於桃園縣桃園市○路段1714地號之土地（下稱\n    系爭土地，原告郭黃金之應有部分為3 分之2 、原告郭美珠\n    之應有部分為3 分之1 ），遭被告於30多年前無權占用，供\n    建造被告所有之加強磚造三層樓房（門牌號碼：桃園縣桃園\n    市○○路361 號，下稱系爭房屋）後方一樓RC造樓梯、二樓\n    、三樓陽台之用。原告直至民國99年5月27日、99年8 月2日\n    申請桃園縣桃園地政事務所複丈、再鑑界系爭土地，於99年\n    8 月30日收受該所函送系爭土地測量成果圖後，方知上開情\n    事，爰依民法第767 條物上返還請求權之規定，訴請被告拆\n    除上述無權占用部分，並將該部分土地返還原告。\n  (二)被告無權占有原告所有之系爭土地，致原告對之無法使用收\n    益，被告顯係無法律上原因受有利益而致原告有損害，原告\n    自得依民法第179 條之規定，對被告請求相當於租金之不當\n    得利。被告自30多年無權占有系爭土地迄今，以15年計算其\n    所得之不當得利應為新台幣（下同）531,585 元（計算式：\n    系爭土地申報地價70,878元×10％×占用面積5 ㎡×15年＝\n    531,585 元）。另被告應自99年9 月9 日起至交還土地止，\n    按月給付原告2,953 元（計算式：系爭土地申報地價70,878\n    元×10％×占用面積5 ㎡÷12月＝2,953 元，元以下四捨五\n    入）之不當得利。\n  (三)聲明：\n  1.被告應將系爭土地上，如附圖所示編號A ，面積為0.04平方\n    公尺，及編號B ，面積為2.96平方公尺之陽台及RC造樓梯拆\n    除，並將該部分土地返還原告。\n  2.被告應給付原告531,585 元，及自本件起訴狀繕本送達翌日\n    起至清償日止，按年息百分之5 計算之利息，暨自99年9 月\n    9 日起至返還第一項土地之日止，按月給付原告2,953元。\n  3.上開2項，願供擔保，請准宣告假執行。\n二、被告則抗辯：\n  (一)系爭房屋係於57年間興建完成，完成時該屋西北側為1 既成\n    巷道，被告於當時即利用該巷道進出，然因建商欲在系爭土\n    地上建屋，乃向被告父親協議廢除上開巷道，以興建原告目\n    前所有之房屋，並在系爭土地上加設1 樓梯，連接系爭房屋\n    2 樓陽台作為替代出入口，供系爭房屋2 樓利用此樓梯通達\n    後方防火巷出入。嗣因上開防火巷被該地上之建物所有權人\n    封堵，無法通行，故上開樓梯即廢棄不用。因該樓梯係廢巷\n    之交換條件，為上述建商自願興建，且於原告購屋前發生，\n    因此，該樓梯之產權應屬原告所有，任由原告自行處置。\n  (二)系爭房屋興建時，即已包含原告所述之陽台在內，受土地範\n    圍限制，該陽台深度僅約60餘公分。而原告所有之房屋在興\n    建前進行測量、放樣等工程，均未有發現地界不符之情形。\n    可知該陽台並未越界占用系爭土地。\n  (三)答辯聲明：駁回原告之訴。\n三、本院之判斷：\n  (一)原告主張其為系爭土地所有權人，其中郭黃金之應有部分為\n    3 分之2 、郭美珠之應有部分為3 分之1 等情，業據提出與\n    其所述相符之土地登記第2 類謄本1 件為證（參見本院卷第\n    9 至10頁），被告對此亦不爭執，是原告此部分主張堪信為\n    真實。\n  (二)原告復主張被告無權占用如其聲明所示部分之土地等語，為\n    被告所否認，並執前詞置辯。\n  1.經查，本院依原告聲請於99年11月10日及99年12月8 日前往\n    系爭土地履勘，並囑託桃園縣桃園地政事務所人員就系爭房\n    屋後方之陽台及RC造樓梯是否有占用到系爭土地一事進行測\n    量及製作土地複丈成果圖（即附圖），有勘驗筆錄2 件及附\n    圖1 件在卷可稽（參見本院卷第28頁及第36頁）。依該附圖\n    所示，可知編號A 部分，面積為0.04平方公尺之系爭房屋後\n    方陽台已占用到原告所有之系爭土地，被告對此復無其他反\n    證提出，是被告抗辯系爭房屋後方之陽台並未越界占用系爭\n    土地云云，與事實不符，自難採信。\n  2.原告另主張如附圖所示編號B 部分，面積為2.96平方公尺之\n    RC造樓梯為被告所有，且屬無權占有系爭土地云云，被告則\n    抗辯上開樓梯係為廢除既有巷道之交換條件，為原告所有之\n    房屋建商自願興建，且於原告購屋前發生，因此，該樓梯之\n    產權應屬原告所有，任由原告自行處置，另該樓梯早已廢棄\n    不用等語。查依被告所述，充其量僅足以認定被告曾有使用\n    該樓梯之權利，而未能逕予認定被告已取得該樓梯之所有權\n    ，而原告對於該樓梯係由被告所興建或被告已取得該樓梯之\n    所有權一事復未能舉證以實其說，是原告主張上開樓梯為被\n    告所有，並無權占有系爭土地云云，尚乏所據，不足採信。\n  3.綜上，原告主張被告無權占用如附圖所所示編號A 部分，面\n    積為0.04平方公尺之土地等情，堪信屬實。\n  (三)按土地所有人得依不當得利法則向無權占用其土地之人請求\n    返還相當於租金之損害金，惟其數額，除以申報地價為基礎\n    外，尚須斟酌基地之位置、工商業繁榮之程度及占用人利用\n    土地之經濟價值及所受利益等項，並與鄰地租金相比較，以\n    為決定，並非必達申報地價年息百分之10之最高額（最高法\n    院88年度台上字第3331號及88年度台上字第1894號判決意旨\n    參照）。查被告無權占用如附圖所所示編號A 部分，面積為\n    0.04平方公尺之土地一事，業經本院認定無訛，已如前述。\n    又被告未曾支付任何使用對價予原告，被告自受有相當於租\n    金之利益，原告則因而受有相當於租金之損害，被告占用原\n    告所有系爭土地，已符合不當得利之法律構成要件，原告自\n    得依不當得利之法律關係，請求被告返還自99年9 月8 日起\n    回溯15年間相當於租金之利益。次查，系爭房屋係供被告自\n    行居住使用，被告在該陽台放置熱水器及其他雜物，系爭土\n    地面臨桃園縣桃園市○○路，對面為台西水果行，旁邊有全\n    聯社，亦鄰近台灣電力公司，距振興中學及桃園縣政府分別\n    為2 分鐘及5 分鐘車程，系爭房屋週遭之生活機能便利，有\n    原告提供之現場照片10張在卷可佐（參見本院卷第19至22頁\n    ），復經本院會同兩造於99年11月10日履勘屬實，有勘驗筆\n    錄1 件附卷可稽（參見本院卷第28頁），本院審酌被告使用\n    土地之面積、現況等一切情事，認為原告因被告使用系爭土\n    地所受之損害以土地申報總價額年息百分之6 計算為適當。\n    又系爭土地中於86年、89年、93年、96年之申報地價均為每\n    平方公尺25,304元，99年1 月之申報地價則為每平方公尺25\n    ,093元，有系爭土地之土地登記第2 類謄本及本院公務電話\n    紀錄各1 件在卷可憑（參見本院卷第9 頁及第44頁）。從而\n    ，原告請求被告給付如附表所示相當於租金之不當得利，及\n    自99年9 月9 日起至返還如主文第1 項所示被告占用之土地\n    予原告之日止，按月計算之損害金（計算方式詳如附表），\n    均屬有據。\n  (四)綜上所述，原告請求1.被告應將系爭土地上，如附圖所示編\n    號A 部分，面積0.04平方公尺之陽台拆除，並將該部分土地\n    交還原告。2.被告應給付郭黃金605 元，及自99年10月3 日\n    起至返還前開占用土地之日止，按月給付原告3 元。3.被告\n    應給付郭美珠303 元，及自99年10月3 日起至返還前開占用\n    土地之日止，按月給付原告新台幣2 元，為有理由，應予准\n    許，逾此範圍所為之請求，為無理由，應予駁回。\n四、原告陳明願供擔保請准宣告假執行及免為假執行，就原告勝\n    訴部分，金額在500,000 元以下，應依職權宣告得假執行，\n    並酌定相當擔保金額宣告得免為假執行；至原告敗訴部分，\n    假執行之聲請已失依附，應予駁回。\n五、本件事證已臻明確，兩造間其餘攻擊防禦方法，核與本判決\n    結果不生任何影響，爰不一一予以論述，附此敘明。\n六、據上論結，本件原告之訴為一部有理由，一部無理由，依民\n    事訴訟法第79條、第85條第1 項但書、第389 條第1項第5款\n    ，判決如主文。"
  },
  "search": "臺灣桃園地方法院民事判決99年度訴字第1485號原告郭黃金郭美珠上1人訴訟代理人王偉成被告趙曉農訴訟代理人張炳輝上列當事人間請求拆屋還地事件，本院於民國100年1月20日言詞辯論終結，判決如下：主文被告應將坐落桃園縣桃園市○路段一七一四地號土地上，如附圖所示編號Ａ部分，面積零點零四平方公尺之陽台拆除，並將該部分土地交還原告。被告應給付原告郭黃金新台幣陸佰零伍元，及自民國九十九年十月三日起至返還前開占用土地之日止，按月給付原告新台幣元。被告應給付原告郭美珠新台幣佰零元，及自民國九十九年十月三日起至返還前開占用土地之日止，按月給付原告新台幣貳元。原告其餘之訴駁回。訴訟費用由被告負擔千分之八，原告郭美珠負擔千分之三百三十，餘由原告郭黃金負擔。本判決第一項至第三項得假執行。原告其餘假執行之聲請駁回。事實及理由一、本件原告主張：(一)原告所有坐落於桃園縣桃園市○路段1714地號之土地（下稱系爭土地，原告郭黃金之應有部分為3分之2、原告郭美珠之應有部分為3分之1），遭被告於30多年前無權占用，供建造被告所有之加強磚造三層樓房（門牌號碼：桃園縣桃園市○○路361號，下稱系爭房屋）後方一樓RC造樓梯、二樓、三樓陽台之用。原告直至民國99年5月27日、99年8月2日申請桃園縣桃園地政事務所複丈、再鑑界系爭土地，於99年8月30日收受該所函送系爭土地測量成果圖後，方知上開情事，爰依民法第767條物上返還請求權之規定，訴請被告拆除上述無權占用部分，並將該部分土地返還原告。(二)被告無權占有原告所有之系爭土地，致原告對之無法使用收益，被告顯係無法律上原因受有利益而致原告有損害，原告自得依民法第179條之規定，對被告請求相當於租金之不當得利。被告自30多年無權占有系爭土地迄今，以15年計算其所得之不當得利應為新台幣（下同）531,585元（計算式：系爭土地申報地價70,878元×10％×占用面積5㎡×15年＝531,585元）。另被告應自99年9月9日起至交還土地止，按月給付原告2,953元（計算式：系爭土地申報地價70,878元×10％×占用面積5㎡÷12月＝2,953元，元以下四捨五入）之不當得利。(三)聲明：1.被告應將系爭土地上，如附圖所示編號A，面積為0.04平方公尺，及編號B，面積為2.96平方公尺之陽台及RC造樓梯拆除，並將該部分土地返還原告。2.被告應給付原告531,585元，及自本件起訴狀繕本送達翌日起至清償日止，按年息百分之5計算之利息，暨自99年9月9日起至返還第一項土地之日止，按月給付原告2,953元。3.上開2項，願供擔保，請准宣告假執行。二、被告則抗辯：(一)系爭房屋係於57年間興建完成，完成時該屋西北側為1既成巷道，被告於當時即利用該巷道進出，然因建商欲在系爭土地上建屋，乃向被告父親協議廢除上開巷道，以興建原告目前所有之房屋，並在系爭土地上加設1樓梯，連接系爭房屋2樓陽台作為替代出入口，供系爭房屋2樓利用此樓梯通達後方防火巷出入。嗣因上開防火巷被該地上之建物所有權人封堵，無法通行，故上開樓梯即廢棄不用。因該樓梯係廢巷之交換條件，為上述建商自願興建，且於原告購屋前發生，因此，該樓梯之產權應屬原告所有，任由原告自行處置。(二)系爭房屋興建時，即已包含原告所述之陽台在內，受土地範圍限制，該陽台深度僅約60餘公分。而原告所有之房屋在興建前進行測量、放樣等工程，均未有發現地界不符之情形。可知該陽台並未越界占用系爭土地。(三)答辯聲明：駁回原告之訴。三、本院之判斷：(一)原告主張其為系爭土地所有權人，其中郭黃金之應有部分為3分之2、郭美珠之應有部分為3分之1等情，業據提出與其所述相符之土地登記第2類謄本1件為證（參見本院卷第9至10頁），被告對此亦不爭執，是原告此部分主張堪信為真實。(二)原告復主張被告無權占用如其聲明所示部分之土地等語，為被告所否認，並執前詞置辯。1.經查，本院依原告聲請於99年11月10日及99年12月8日前往系爭土地履勘，並囑託桃園縣桃園地政事務所人員就系爭房屋後方之陽台及RC造樓梯是否有占用到系爭土地一事進行測量及製作土地複丈成果圖（即附圖），有勘驗筆錄2件及附圖1件在卷可稽（參見本院卷第28頁及第36頁）。依該附圖所示，可知編號A部分，面積為0.04平方公尺之系爭房屋後方陽台已占用到原告所有之系爭土地，被告對此復無其他反證提出，是被告抗辯系爭房屋後方之陽台並未越界占用系爭土地云云，與事實不符，自難採信。2.原告另主張如附圖所示編號B部分，面積為2.96平方公尺之RC造樓梯為被告所有，且屬無權占有系爭土地云云，被告則抗辯上開樓梯係為廢除既有巷道之交換條件，為原告所有之房屋建商自願興建，且於原告購屋前發生，因此，該樓梯之產權應屬原告所有，任由原告自行處置，另該樓梯早已廢棄不用等語。查依被告所述，充其量僅足以認定被告曾有使用該樓梯之權利，而未能逕予認定被告已取得該樓梯之所有權，而原告對於該樓梯係由被告所興建或被告已取得該樓梯之所有權一事復未能舉證以實其說，是原告主張上開樓梯為被告所有，並無權占有系爭土地云云，尚乏所據，不足採信。3.綜上，原告主張被告無權占用如附圖所所示編號A部分，面積為0.04平方公尺之土地等情，堪信屬實。(三)按土地所有人得依不當得利法則向無權占用其土地之人請求返還相當於租金之損害金，惟其數額，除以申報地價為基礎外，尚須斟酌基地之位置、工商業繁榮之程度及占用人利用土地之經濟價值及所受利益等項，並與鄰地租金相比較，以為決定，並非必達申報地價年息百分之10之最高額（最高法院88年度台上字第3331號及88年度台上字第1894號判決意旨參照）。查被告無權占用如附圖所所示編號A部分，面積為0.04平方公尺之土地一事，業經本院認定無訛，已如前述。又被告未曾支付任何使用對價予原告，被告自受有相當於租金之利益，原告則因而受有相當於租金之損害，被告占用原告所有系爭土地，已符合不當得利之法律構成要件，原告自得依不當得利之法律關係，請求被告返還自99年9月8日起回溯15年間相當於租金之利益。次查，系爭房屋係供被告自行居住使用，被告在該陽台放置熱水器及其他雜物，系爭土地面臨桃園縣桃園市○○路，對面為台西水果行，旁邊有全聯社，亦鄰近台灣電力公司，距振興中學及桃園縣政府分別為2分鐘及5分鐘車程，系爭房屋週遭之生活機能便利，有原告提供之現場照片10張在卷可佐（參見本院卷第19至22頁），復經本院會同兩造於99年11月10日履勘屬實，有勘驗筆錄1件附卷可稽（參見本院卷第28頁），本院審酌被告使用土地之面積、現況等一切情事，認為原告因被告使用系爭土地所受之損害以土地申報總價額年息百分之6計算為適當。又系爭土地中於86年、89年、93年、96年之申報地價均為每平方公尺25,304元，99年1月之申報地價則為每平方公尺25,093元，有系爭土地之土地登記第2類謄本及本院公務電話紀錄各1件在卷可憑（參見本院卷第9頁及第44頁）。從而，原告請求被告給付如附表所示相當於租金之不當得利，及自99年9月9日起至返還如主文第1項所示被告占用之土地予原告之日止，按月計算之損害金（計算方式詳如附表），均屬有據。(四)綜上所述，原告請求1.被告應將系爭土地上，如附圖所示編號A部分，面積0.04平方公尺之陽台拆除，並將該部分土地交還原告。2.被告應給付郭黃金605元，及自99年10月3日起至返還前開占用土地之日止，按月給付原告3元。3.被告應給付郭美珠303元，及自99年10月3日起至返還前開占用土地之日止，按月給付原告新台幣2元，為有理由，應予准許，逾此範圍所為之請求，為無理由，應予駁回。四、原告陳明願供擔保請准宣告假執行及免為假執行，就原告勝訴部分，金額在500,000元以下，應依職權宣告得假執行，並酌定相當擔保金額宣告得免為假執行；至原告敗訴部分，假執行之聲請已失依附，應予駁回。五、本件事證已臻明確，兩造間其餘攻擊防禦方法，核與本判決結果不生任何影響，爰不一一予以論述，附此敘明。六、據上論結，本件原告之訴為一部有理由，一部無理由，依民事訴訟法第79條、第85條第1項但書、第389條第1項第5款，判決如主文。中華民國100年1月28日民事第一庭法官林哲賢附表：（小數點以下均四捨五入）1.被告占用附圖所示編號A部分，面積0.04平方公尺之土地：(1)84年9月9日至98年12月31日之不當得利為867元【（0.04X25,304X6%X14）+（0.04X25,304X6%÷12X｛3＋9/30｝=867，元以下四捨五入】。(2)99年1月1日至99年9月8日之不當得利為41元（0.04X25,093X6%÷12X｛8＋8/30｝=41，元以下四捨五入）。(3)84年9月9日至99年9月8日之不當得利合計為908元（867+41=908）。(4)99年9月9日起平均每月所受之不當得利為5元（0.04X25,093X6%÷12=5，元以下四捨五入）。(5)因系爭土地中郭黃金之應有部分為3分之2、郭美珠之應有部分為3分之1，是以郭黃金得向被告請求15年之不當得利為605元，並自99年9月9日起，按月得請求被告給付3元，郭美珠得向被告請求15年之不當得利為303元，並自99年9月9日起，按月得請求被告給付2元。以上正本證明與原本無異如對本判決上訴，須於判決送達後20日內向本院提出上訴狀。如委任律師提起上訴者，應一併繳納上訴審裁判費。中華民國100年1月28日書記官陳佳彬",
  "characters": {
    "judges": [
      "林哲賢"
    ],
    "prosecutors": [

    ],
    "lawyers": [
      "如委任"
    ],
    "clerks": [

    ],
    "plaintiffs": [
      "郭黃金"
    ],
    "defendants": [
      "趙曉農"
    ],
    "prosecutor_office": [

    ],
    "creditors": [

    ],
    "debtors": [

    ],
    "judicial_associate_officer": [

    ]
  },
  "adjudged_at": "2011-01-28",
  "created_at": "2016-02-13 04:53:06",
  "updated_at": "2016-02-13 04:53:06"
}