{
  "identify": "KSD-94-親-30-20050729-1",
  "court": {
    "name": "臺灣高雄地方法院",
    "code": "KSD"
  },
  "division": {
    "name": "民事",
    "code": "V"
  },
  "year": 94,
  "word": "親",
  "number": "30",
  "jcheck": "1",
  "reason": "確認親子關係存在",
  "content": "臺灣高雄地方法院民事判決                94年度親字第30號\n原      告  丙○○\n            戊○○\n兼訴訟代理  丁○○\n人\n            乙○○\n                        號\n被      告  甲○○\n上當事人間請求確認親子關係存在事件，本院於94年7 月25日言\n詞辯論終結，判決如下：\n  主  文\n確認原告丁○○、丙○○、戊○○、乙○○與被告間之親子關係\n存在。\n訴訟費用由被告負擔。\n  事  實及理  由\n一、被告未於言詞辯論期日到場，核無民事訴訟法第386 條所列\n    各款情形，爰依原告之聲請，由其一造辯論而為判決。\n二、按父母子女關係是否存在，不惟影響雙方身分，且有關於雙\n    方因該身分而產生之法律關係亦將隨之而變動，故非婚生子\n    女，經生父認領或視同認領者，為使其親子關係明確，該父\n    母、子女或其他利害關係人，自得提起確認親子關係存在之\n    訴，且訴訟當事人間縱使就身分關係之存否不爭執，如有辦\n    理戶籍登記，使身分關係明確之必要時，亦得認為有受確認\n    判決之法律上利益，是本件原告依法即得提起確認子女之訴\n    ，先予敘明。\n三、原告起訴主張：原告之生母郭秀英於民國37年間，為被告甲\n    ○○納為側室（妾），生育原告丁○○、丙○○、戊○○、\n    乙○○4 人，被告並撫育原告4 人成年。嗣原告生母郭秀英\n    不幸於80年12月23日病逝，而被告雖出具認領同意書，已無\n    法辦理認領登記，使原告等之戶籍記載，迄今仍為父不詳。\n    然原告既與被告有自然血緣存在，為使原告得以釐清與被告\n    之親子關係，故提起本訴，請求確認原告與被告間之親子關\n    係存在等語。被告未於言詞辯論期日到場，惟以書狀主張：\n    原告丁○○、丙○○、戊○○、乙○○4 人，為其與側室郭\n    秀英所未婚生育之子女等語。\n四、本件原告主張其等為生母郭秀英自被告受胎所生之事實，為\n    被告所不否認，並經本院依職權囑託財團法人長庚紀念醫院\n    高雄分院為親子鑑定，經該鑑定機關依遺傳標記檢驗結果：\n    「1.不能排除甲○○與丁○○之親子關係。2.親子關係指數\n     (CPI)為：16943.17769 ；亦即\" 甲○○是丁○○的親生父\n    親\" 所必須具備的基因半型\" 這一個可能性相比，大約為：\n    16943.17769 倍。3.也就是說甲○○與丁○○之父子關係確\n    定率為99.0000000% ；因此甲○○是丁○○的親生父親，這\n    個假設由此次測試可以證實。」、「1. 不 能排除甲○○與\n    丙○○之親子關係。2.親子關係指數 (CPI)為：34032.2406\n    8 ；亦即\" 甲○○是丙○○的親生父親\" 所必須具備的基因\n    半型\" 這一個可能性相比，大約為：340 32.24068倍。3.也\n    就是說甲○○與丙○○之父子關係確定率為99.0000000% ；\n    因此甲○○是丙○○的親生父親，這個假設由此次測試可以\n    證實。」、「1.不能排除甲○○與戊○○之親子關係。2.親\n    子關係指數 (CPI)為：18652.20452 ；亦即\" 甲○○是戊○\n    ○的親生父親\" 所必須具備的基因半型\"這 一個可能性相比\n    ，大約為：18652. 20452倍。3.也就是說甲○○與戊○○之\n    父女關係確定率為99.0000000% ；因此甲○○是戊○○的親\n    生父親，這個假設由此次測試可以證實。」、「1.不能排除\n    甲○○與乙○○之親子關係。2.親子關係指數 (CPI)為：72\n    95.65087；亦即\" 甲○○是乙○○的親生父親\" 所必須具備\n    的基因半型\" 這一個可能性相比，大約為：7295.65087倍。\n    3.也就是說甲○○與乙○○之父子關係確定率為99.0000000\n    % ；因此甲○○是乙○○的親生父親，這個假設由此次測試\n    可以證實。」，有上開醫院94年7 月4 日（94）長庚院高字\n    第461033號函附親子鑑定報告4 紙在卷可稽，堪認原告主張\n    其等均為生母郭秀英自被告受胎所生為真實。再者，原告主\n    張其等生母郭秀英與被告並未結婚，惟郭秀英為被告之側室\n    ，且原告4 人均經被告撫育成年之事實，業據原告提出被告\n    戶籍謄本及訃聞各1 紙為證，並為被告所是認，是原告此部\n    分主張亦可信為真。則原告4 人與被告既均有自然血緣之親\n    子關係存在，且原告4 人曾受被告撫育，揆諸上開規定，原\n    告4 人已因視為認領而取得婚生子女身分。又原告主張其等\n    戶籍登載均為父不詳等情，業據原告提出戶籍謄本4 紙為證\n    ，原告此部分之主張，亦堪信為真實。從而，故原告請求確\n    認原告與被告間親子關係存在，洵屬有據。被告為原告丁○\n    ○、丙○○、戊○○、乙○○之生父，故原告依法提起確認\n    與被告間之親子關係存在，為有理由，應予准許。\n五、訴訟費用負擔之依據：民事訴訟法第78條。\n中    華    民    國    94    年    7     月    29    日\n                  家事法庭法  官  郭佳瑛\n上為正本係照原本作成。\n如對本判決上訴，須於判決送達後20日內向本院提出上訴狀並表\n明上訴理由，如於宣示後送達前提出上訴者須於送達後10日內補\n提上訴理由書（須附繕本）。\n中    華    民    國    94    年    8     月     1    日\n                          書記官  陳惠玲\n",
  "structure": {
    "main": "確認原告丁○○、丙○○、戊○○、乙○○與被告間之親子關係\n存在。\n訴訟費用由被告負擔。",
    "fact": "一、被告未於言詞辯論期日到場，核無民事訴訟法第386 條所列\n    各款情形，爰依原告之聲請，由其一造辯論而為判決。\n二、按父母子女關係是否存在，不惟影響雙方身分，且有關於雙\n    方因該身分而產生之法律關係亦將隨之而變動，故非婚生子\n    女，經生父認領或視同認領者，為使其親子關係明確，該父\n    母、子女或其他利害關係人，自得提起確認親子關係存在之\n    訴，且訴訟當事人間縱使就身分關係之存否不爭執，如有辦\n    理戶籍登記，使身分關係明確之必要時，亦得認為有受確認\n    判決之法律上利益，是本件原告依法即得提起確認子女之訴\n    ，先予敘明。\n三、原告起訴主張：原告之生母郭秀英於民國37年間，為被告甲\n    ○○納為側室（妾），生育原告丁○○、丙○○、戊○○、\n    乙○○4 人，被告並撫育原告4 人成年。嗣原告生母郭秀英\n    不幸於80年12月23日病逝，而被告雖出具認領同意書，已無\n    法辦理認領登記，使原告等之戶籍記載，迄今仍為父不詳。\n    然原告既與被告有自然血緣存在，為使原告得以釐清與被告\n    之親子關係，故提起本訴，請求確認原告與被告間之親子關\n    係存在等語。被告未於言詞辯論期日到場，惟以書狀主張：\n    原告丁○○、丙○○、戊○○、乙○○4 人，為其與側室郭\n    秀英所未婚生育之子女等語。\n四、本件原告主張其等為生母郭秀英自被告受胎所生之事實，為\n    被告所不否認，並經本院依職權囑託財團法人長庚紀念醫院\n    高雄分院為親子鑑定，經該鑑定機關依遺傳標記檢驗結果：\n    「1.不能排除甲○○與丁○○之親子關係。2.親子關係指數\n     (CPI)為：16943.17769 ；亦即\" 甲○○是丁○○的親生父\n    親\" 所必須具備的基因半型\" 這一個可能性相比，大約為：\n    16943.17769 倍。3.也就是說甲○○與丁○○之父子關係確\n    定率為99.0000000% ；因此甲○○是丁○○的親生父親，這\n    個假設由此次測試可以證實。」、「1. 不 能排除甲○○與\n    丙○○之親子關係。2.親子關係指數 (CPI)為：34032.2406\n    8 ；亦即\" 甲○○是丙○○的親生父親\" 所必須具備的基因\n    半型\" 這一個可能性相比，大約為：340 32.24068倍。3.也\n    就是說甲○○與丙○○之父子關係確定率為99.0000000% ；\n    因此甲○○是丙○○的親生父親，這個假設由此次測試可以\n    證實。」、「1.不能排除甲○○與戊○○之親子關係。2.親\n    子關係指數 (CPI)為：18652.20452 ；亦即\" 甲○○是戊○\n    ○的親生父親\" 所必須具備的基因半型\"這 一個可能性相比\n    ，大約為：18652. 20452倍。3.也就是說甲○○與戊○○之\n    父女關係確定率為99.0000000% ；因此甲○○是戊○○的親\n    生父親，這個假設由此次測試可以證實。」、「1.不能排除\n    甲○○與乙○○之親子關係。2.親子關係指數 (CPI)為：72\n    95.65087；亦即\" 甲○○是乙○○的親生父親\" 所必須具備\n    的基因半型\" 這一個可能性相比，大約為：7295.65087倍。\n    3.也就是說甲○○與乙○○之父子關係確定率為99.0000000\n    % ；因此甲○○是乙○○的親生父親，這個假設由此次測試\n    可以證實。」，有上開醫院94年7 月4 日（94）長庚院高字\n    第461033號函附親子鑑定報告4 紙在卷可稽，堪認原告主張\n    其等均為生母郭秀英自被告受胎所生為真實。再者，原告主\n    張其等生母郭秀英與被告並未結婚，惟郭秀英為被告之側室\n    ，且原告4 人均經被告撫育成年之事實，業據原告提出被告\n    戶籍謄本及訃聞各1 紙為證，並為被告所是認，是原告此部\n    分主張亦可信為真。則原告4 人與被告既均有自然血緣之親\n    子關係存在，且原告4 人曾受被告撫育，揆諸上開規定，原\n    告4 人已因視為認領而取得婚生子女身分。又原告主張其等\n    戶籍登載均為父不詳等情，業據原告提出戶籍謄本4 紙為證\n    ，原告此部分之主張，亦堪信為真實。從而，故原告請求確\n    認原告與被告間親子關係存在，洵屬有據。被告為原告丁○\n    ○、丙○○、戊○○、乙○○之生父，故原告依法提起確認\n    與被告間之親子關係存在，為有理由，應予准許。\n五、訴訟費用負擔之依據：民事訴訟法第78條。",
    "reason": "一、被告未於言詞辯論期日到場，核無民事訴訟法第386 條所列\n    各款情形，爰依原告之聲請，由其一造辯論而為判決。\n二、按父母子女關係是否存在，不惟影響雙方身分，且有關於雙\n    方因該身分而產生之法律關係亦將隨之而變動，故非婚生子\n    女，經生父認領或視同認領者，為使其親子關係明確，該父\n    母、子女或其他利害關係人，自得提起確認親子關係存在之\n    訴，且訴訟當事人間縱使就身分關係之存否不爭執，如有辦\n    理戶籍登記，使身分關係明確之必要時，亦得認為有受確認\n    判決之法律上利益，是本件原告依法即得提起確認子女之訴\n    ，先予敘明。\n三、原告起訴主張：原告之生母郭秀英於民國37年間，為被告甲\n    ○○納為側室（妾），生育原告丁○○、丙○○、戊○○、\n    乙○○4 人，被告並撫育原告4 人成年。嗣原告生母郭秀英\n    不幸於80年12月23日病逝，而被告雖出具認領同意書，已無\n    法辦理認領登記，使原告等之戶籍記載，迄今仍為父不詳。\n    然原告既與被告有自然血緣存在，為使原告得以釐清與被告\n    之親子關係，故提起本訴，請求確認原告與被告間之親子關\n    係存在等語。被告未於言詞辯論期日到場，惟以書狀主張：\n    原告丁○○、丙○○、戊○○、乙○○4 人，為其與側室郭\n    秀英所未婚生育之子女等語。\n四、本件原告主張其等為生母郭秀英自被告受胎所生之事實，為\n    被告所不否認，並經本院依職權囑託財團法人長庚紀念醫院\n    高雄分院為親子鑑定，經該鑑定機關依遺傳標記檢驗結果：\n    「1.不能排除甲○○與丁○○之親子關係。2.親子關係指數\n     (CPI)為：16943.17769 ；亦即\" 甲○○是丁○○的親生父\n    親\" 所必須具備的基因半型\" 這一個可能性相比，大約為：\n    16943.17769 倍。3.也就是說甲○○與丁○○之父子關係確\n    定率為99.0000000% ；因此甲○○是丁○○的親生父親，這\n    個假設由此次測試可以證實。」、「1. 不 能排除甲○○與\n    丙○○之親子關係。2.親子關係指數 (CPI)為：34032.2406\n    8 ；亦即\" 甲○○是丙○○的親生父親\" 所必須具備的基因\n    半型\" 這一個可能性相比，大約為：340 32.24068倍。3.也\n    就是說甲○○與丙○○之父子關係確定率為99.0000000% ；\n    因此甲○○是丙○○的親生父親，這個假設由此次測試可以\n    證實。」、「1.不能排除甲○○與戊○○之親子關係。2.親\n    子關係指數 (CPI)為：18652.20452 ；亦即\" 甲○○是戊○\n    ○的親生父親\" 所必須具備的基因半型\"這 一個可能性相比\n    ，大約為：18652. 20452倍。3.也就是說甲○○與戊○○之\n    父女關係確定率為99.0000000% ；因此甲○○是戊○○的親\n    生父親，這個假設由此次測試可以證實。」、「1.不能排除\n    甲○○與乙○○之親子關係。2.親子關係指數 (CPI)為：72\n    95.65087；亦即\" 甲○○是乙○○的親生父親\" 所必須具備\n    的基因半型\" 這一個可能性相比，大約為：7295.65087倍。\n    3.也就是說甲○○與乙○○之父子關係確定率為99.0000000\n    % ；因此甲○○是乙○○的親生父親，這個假設由此次測試\n    可以證實。」，有上開醫院94年7 月4 日（94）長庚院高字\n    第461033號函附親子鑑定報告4 紙在卷可稽，堪認原告主張\n    其等均為生母郭秀英自被告受胎所生為真實。再者，原告主\n    張其等生母郭秀英與被告並未結婚，惟郭秀英為被告之側室\n    ，且原告4 人均經被告撫育成年之事實，業據原告提出被告\n    戶籍謄本及訃聞各1 紙為證，並為被告所是認，是原告此部\n    分主張亦可信為真。則原告4 人與被告既均有自然血緣之親\n    子關係存在，且原告4 人曾受被告撫育，揆諸上開規定，原\n    告4 人已因視為認領而取得婚生子女身分。又原告主張其等\n    戶籍登載均為父不詳等情，業據原告提出戶籍謄本4 紙為證\n    ，原告此部分之主張，亦堪信為真實。從而，故原告請求確\n    認原告與被告間親子關係存在，洵屬有據。被告為原告丁○\n    ○、丙○○、戊○○、乙○○之生父，故原告依法提起確認\n    與被告間之親子關係存在，為有理由，應予准許。\n五、訴訟費用負擔之依據：民事訴訟法第78條。"
  },
  "search": "臺灣高雄地方法院民事判決94年度親字第30號原告丙○○戊○○兼訴訟代理丁○○人乙○○號被告甲○○上當事人間請求確認親子關係存在事件，本院於94年7月25日言詞辯論終結，判決如下：主文確認原告丁○○、丙○○、戊○○、乙○○與被告間之親子關係存在。訴訟費用由被告負擔。事實及理由一、被告未於言詞辯論期日到場，核無民事訴訟法第386條所列各款情形，爰依原告之聲請，由其一造辯論而為判決。二、按父母子女關係是否存在，不惟影響雙方身分，且有關於雙方因該身分而產生之法律關係亦將隨之而變動，故非婚生子女，經生父認領或視同認領者，為使其親子關係明確，該父母、子女或其他利害關係人，自得提起確認親子關係存在之訴，且訴訟當事人間縱使就身分關係之存否不爭執，如有辦理戶籍登記，使身分關係明確之必要時，亦得認為有受確認判決之法律上利益，是本件原告依法即得提起確認子女之訴，先予敘明。三、原告起訴主張：原告之生母郭秀英於民國37年間，為被告甲○○納為側室（妾），生育原告丁○○、丙○○、戊○○、乙○○4人，被告並撫育原告4人成年。嗣原告生母郭秀英不幸於80年12月23日病逝，而被告雖出具認領同意書，已無法辦理認領登記，使原告等之戶籍記載，迄今仍為父不詳。然原告既與被告有自然血緣存在，為使原告得以釐清與被告之親子關係，故提起本訴，請求確認原告與被告間之親子關係存在等語。被告未於言詞辯論期日到場，惟以書狀主張：原告丁○○、丙○○、戊○○、乙○○4人，為其與側室郭秀英所未婚生育之子女等語。四、本件原告主張其等為生母郭秀英自被告受胎所生之事實，為被告所不否認，並經本院依職權囑託財團法人長庚紀念醫院高雄分院為親子鑑定，經該鑑定機關依遺傳標記檢驗結果：「1.不能排除甲○○與丁○○之親子關係。2.親子關係指數(CPI)為：16943.17769；亦即\"甲○○是丁○○的親生父親\"所必須具備的基因半型\"這一個可能性相比，大約為：16943.17769倍。3.也就是說甲○○與丁○○之父子關係確定率為99.0000000%；因此甲○○是丁○○的親生父親，這個假設由此次測試可以證實。」、「1.不能排除甲○○與丙○○之親子關係。2.親子關係指數(CPI)為：34032.24068；亦即\"甲○○是丙○○的親生父親\"所必須具備的基因半型\"這一個可能性相比，大約為：34032.24068倍。3.也就是說甲○○與丙○○之父子關係確定率為99.0000000%；因此甲○○是丙○○的親生父親，這個假設由此次測試可以證實。」、「1.不能排除甲○○與戊○○之親子關係。2.親子關係指數(CPI)為：18652.20452；亦即\"甲○○是戊○○的親生父親\"所必須具備的基因半型\"這一個可能性相比，大約為：18652.20452倍。3.也就是說甲○○與戊○○之父女關係確定率為99.0000000%；因此甲○○是戊○○的親生父親，這個假設由此次測試可以證實。」、「1.不能排除甲○○與乙○○之親子關係。2.親子關係指數(CPI)為：7295.65087；亦即\"甲○○是乙○○的親生父親\"所必須具備的基因半型\"這一個可能性相比，大約為：7295.65087倍。3.也就是說甲○○與乙○○之父子關係確定率為99.0000000%；因此甲○○是乙○○的親生父親，這個假設由此次測試可以證實。」，有上開醫院94年7月4日（94）長庚院高字第461033號函附親子鑑定報告4紙在卷可稽，堪認原告主張其等均為生母郭秀英自被告受胎所生為真實。再者，原告主張其等生母郭秀英與被告並未結婚，惟郭秀英為被告之側室，且原告4人均經被告撫育成年之事實，業據原告提出被告戶籍謄本及訃聞各1紙為證，並為被告所是認，是原告此部分主張亦可信為真。則原告4人與被告既均有自然血緣之親子關係存在，且原告4人曾受被告撫育，揆諸上開規定，原告4人已因視為認領而取得婚生子女身分。又原告主張其等戶籍登載均為父不詳等情，業據原告提出戶籍謄本4紙為證，原告此部分之主張，亦堪信為真實。從而，故原告請求確認原告與被告間親子關係存在，洵屬有據。被告為原告丁○○、丙○○、戊○○、乙○○之生父，故原告依法提起確認與被告間之親子關係存在，為有理由，應予准許。五、訴訟費用負擔之依據：民事訴訟法第78條。中華民國94年7月29日家事法庭法官郭佳瑛上為正本係照原本作成。如對本判決上訴，須於判決送達後20日內向本院提出上訴狀並表明上訴理由，如於宣示後送達前提出上訴者須於送達後10日內補提上訴理由書（須附繕本）。中華民國94年8月1日書記官陳惠玲",
  "characters": {
    "judges": [
      "郭佳瑛"
    ],
    "prosecutors": [

    ],
    "lawyers": [

    ],
    "clerks": [
      "陳惠玲"
    ],
    "plaintiffs": [
      "丙"
    ],
    "defendants": [
      "甲○○"
    ],
    "prosecutor_office": [

    ],
    "creditors": [

    ],
    "debtors": [

    ],
    "judicial_associate_officer": [

    ]
  },
  "adjudged_at": "2005-07-29",
  "created_at": "2016-02-07 09:12:37",
  "updated_at": "2016-02-07 09:12:37"
}