{
  "identify": "ILD-94-司-9-20050727-1",
  "court": {
    "name": "臺灣宜蘭地方法院",
    "code": "ILD"
  },
  "division": {
    "name": "民事",
    "code": "V"
  },
  "year": 94,
  "word": "司",
  "number": "9",
  "jcheck": "1",
  "reason": "選任臨時管理人",
  "content": "臺灣宜蘭地方法院民事裁定                 94年度司字第9號\n聲  請  人  財政部臺灣省北區國稅局羅東稽徵所\n法定代理人  乙○○\n相  對  人  九和通運有限公司\n上列聲請人聲請選任相對人九和通運有限公司臨時管理人事件，\n本院裁定如下：\n    主  文\n選任甲○○（民國○○○年○月○日生，身分證統一編號：Ｚ0\n00000000號）為九和通運有限公司之臨時管理人。\n聲請程序費用由相對人負擔。\n    理  由\n一、按董事或董事長不為或不能行使職權，致公司有受損害之虞\n    時，法院因利害關係人或檢察官之聲請，得選任一人以上之\n    臨時管理人，代行董事或董事長之職權，但不得為不利於公\n    司之行為，公司法第108條第4項準用同法第208條之1第1項\n    定有明文。\n二、本件聲請意旨略以：相對人九和通運有限公司（以下簡稱「\n    九和公司」）積欠聲請人稅款，惟相對人之負責人陳慶義已\n    於民國89年6月24日死亡，相對人迄未重新選任負責人，致\n    相對人積欠稅款之文書無法送達，故聲請人乃依利害關係人\n    身分，依公司法第108條第4項準用同法第208條之1第1項規\n    定，聲請選任臨時管理人等語。\n三、經查，上開事實業據聲請人提出相對人營業稅稅籍資料查詢\n    作業、公司基本資料查詢、營利事業所得稅欠稅查詢情形表\n    、公司董事及股東名冊、公司章程各1件，及個人除戶戶籍\n    資料查詢1紙與個人資料查詢4紙等為證。爰審酌相對人除陳\n    慶義外，尚有股東甲○○、謝寶民、丙○○及丁○○等4人\n    ，各人出資額均相同，惟經本院傳喚後，僅甲○○到庭，亦\n    係從事運輸職業，應對相對人事務熟稔等情，爰依公司法第\n    108 條第4項準用同法第208條之1第1項選任甲○○為九和公\n    司之臨時管理人。\n四、依非訟事件法第8條第2項、民事訴訟法第78條，裁定如主文\n    。\n中    華    民    國    94    年    7     月    27    日\n                  臺灣宜蘭地方法院民事庭\n                      法  官  郭顏毓\n正本與原本無異。\n本件不得抗告。\n中    華    民    國    94    年    8     月     1    日\n                      書記官  陳憲文\n",
  "structure": {
    "main": "選任甲○○（民國○○○年○月○日生，身分證統一編號：Ｚ0\n00000000號）為九和通運有限公司之臨時管理人。\n聲請程序費用由相對人負擔。",
    "reason": "一、按董事或董事長不為或不能行使職權，致公司有受損害之虞\n    時，法院因利害關係人或檢察官之聲請，得選任一人以上之\n    臨時管理人，代行董事或董事長之職權，但不得為不利於公\n    司之行為，公司法第108條第4項準用同法第208條之1第1項\n    定有明文。\n二、本件聲請意旨略以：相對人九和通運有限公司（以下簡稱「\n    九和公司」）積欠聲請人稅款，惟相對人之負責人陳慶義已\n    於民國89年6月24日死亡，相對人迄未重新選任負責人，致\n    相對人積欠稅款之文書無法送達，故聲請人乃依利害關係人\n    身分，依公司法第108條第4項準用同法第208條之1第1項規\n    定，聲請選任臨時管理人等語。\n三、經查，上開事實業據聲請人提出相對人營業稅稅籍資料查詢\n    作業、公司基本資料查詢、營利事業所得稅欠稅查詢情形表\n    、公司董事及股東名冊、公司章程各1件，及個人除戶戶籍\n    資料查詢1紙與個人資料查詢4紙等為證。爰審酌相對人除陳\n    慶義外，尚有股東甲○○、謝寶民、丙○○及丁○○等4人\n    ，各人出資額均相同，惟經本院傳喚後，僅甲○○到庭，亦\n    係從事運輸職業，應對相對人事務熟稔等情，爰依公司法第\n    108 條第4項準用同法第208條之1第1項選任甲○○為九和公\n    司之臨時管理人。\n四、依非訟事件法第8條第2項、民事訴訟法第78條，裁定如主文\n    。"
  },
  "search": "臺灣宜蘭地方法院民事裁定94年度司字第9號聲請人財政部臺灣省北區國稅局羅東稽徵所法定代理人乙○○相對人九和通運有限公司上列聲請人聲請選任相對人九和通運有限公司臨時管理人事件，本院裁定如下：主文選任甲○○（民國○○○年○月○日生，身分證統一編號：Ｚ000000000號）為九和通運有限公司之臨時管理人。聲請程序費用由相對人負擔。理由一、按董事或董事長不為或不能行使職權，致公司有受損害之虞時，法院因利害關係人或檢察官之聲請，得選任一人以上之臨時管理人，代行董事或董事長之職權，但不得為不利於公司之行為，公司法第108條第4項準用同法第208條之1第1項定有明文。二、本件聲請意旨略以：相對人九和通運有限公司（以下簡稱「九和公司」）積欠聲請人稅款，惟相對人之負責人陳慶義已於民國89年6月24日死亡，相對人迄未重新選任負責人，致相對人積欠稅款之文書無法送達，故聲請人乃依利害關係人身分，依公司法第108條第4項準用同法第208條之1第1項規定，聲請選任臨時管理人等語。三、經查，上開事實業據聲請人提出相對人營業稅稅籍資料查詢作業、公司基本資料查詢、營利事業所得稅欠稅查詢情形表、公司董事及股東名冊、公司章程各1件，及個人除戶戶籍資料查詢1紙與個人資料查詢4紙等為證。爰審酌相對人除陳慶義外，尚有股東甲○○、謝寶民、丙○○及丁○○等4人，各人出資額均相同，惟經本院傳喚後，僅甲○○到庭，亦係從事運輸職業，應對相對人事務熟稔等情，爰依公司法第108條第4項準用同法第208條之1第1項選任甲○○為九和公司之臨時管理人。四、依非訟事件法第8條第2項、民事訴訟法第78條，裁定如主文。中華民國94年7月27日臺灣宜蘭地方法院民事庭法官郭顏毓正本與原本無異。本件不得抗告。中華民國94年8月1日書記官陳憲文",
  "characters": {
    "judges": [
      "郭顏毓"
    ],
    "prosecutors": [

    ],
    "lawyers": [

    ],
    "clerks": [
      "陳憲文"
    ],
    "plaintiffs": [

    ],
    "defendants": [

    ],
    "prosecutor_office": [
      "財政部臺灣省北區國稅局羅東稽徵所"
    ],
    "creditors": [

    ],
    "debtors": [

    ],
    "judicial_associate_officer": [

    ]
  },
  "adjudged_at": "2005-07-27",
  "created_at": "2016-02-07 08:38:09",
  "updated_at": "2016-02-07 08:38:09"
}