{
  "identify": "KLD-99-基簡-1008-20110324-1",
  "court": {
    "name": "臺灣基隆地方法院",
    "code": "KLD"
  },
  "division": {
    "name": "民事",
    "code": "V"
  },
  "year": 99,
  "word": "基簡",
  "number": "1008",
  "jcheck": "1",
  "reason": "給付票款",
  "content": "臺灣基隆地方法院民事判決            99年度基簡字第1008號\n原      告  李錦炎\n訴訟代理人  方心彤\n被      告  曾淑芬\n訴訟代理人  鐘寶桂\n上列當事人間請求給付票款事件，本院於民國100年3月10日言詞\n辯論終結，判決如下：\n    主  文\n原告之訴駁回。\n訴訟費用新臺幣壹仟元由原告負擔。\n    事實及理由\n一、原告經合法通知，未於最後言詞辯論期日到場，核無民事訴\n    訟法第386條各款所列情形，依民事訴訟法第436條第 2項、\n    第385條第1項前段之規定，准原告之聲請，由其一造辯論而\n    為判決。\n二、按訴狀送達後，原告不得將原訴變更或追加他訴，但請求之\n    基礎事實同一者，不在此限，民事訴訟法第 255條第1項第2\n    款定有明文。本件原告起訴時，係依據票據之法律關係請求\n    被告給付票款，之後於本院審理時，就請求權基礎部分變更\n    為消費借貸之法律關係，因請求之基礎事實同一，依據上開\n    規定，應予准許。\n三、原告起訴主張：被告前向原告借款，並經鑑轉交原告由被\n    告所簽發，發票日為民國90年10月20日、票面金額為新臺幣\n    （下同）10萬元、付款人為北投區農會關渡辦事處、支票號\n    碼為FA0000000之支票1紙，不料經原告屆期向付款人為付款\n    之提示，竟遭付款人以存款不足及拒絕往來戶為由予以退票\n    ，迭經原告催討，被告均置之不理，為此依消費借貸之法律\n    關係，請求被告給付10萬元，及自支票退票日即91年 7月25\n    日起至清償日止，按週年5%計算之利息。\n四、被告聲明駁回原告之訴，其抗辯略以：\n  (一)原告與被告素未相識，雙方並無借貸關係存在，原告雖執有\n    被告所簽發之支票 1紙，然該支票之發票日為90年10月20日\n    ，距今將近10年，已逾票據法第22條第1項所定之1年期間。\n  (二)又支票係文義證券及無因證券，與其基礎之原因關係各自獨\n    立，支票上權利之行使，不以其原因關係存在為前提，尚難\n    因執有支票，即得證明其所主張之原因關係為存在，故不能\n    以支票作為認定兩造間存有借貸關係之憑據。\n五、按稱消費借貸者，謂當事人一方移轉金錢或其他代替物之所\n    有權於他方，而約定他方以種類、品質、數量相同之物返還\n    之契約，民法第474條第1項定有明文；又稱消費借貸者，於\n    當事人間必本於借貸之意思合致，而有移轉金錢或其他代替\n    物之所有權於他方之行為，始得當之，是以消費借貸，因交\n    付金錢之原因多端，除有金錢之交付外，尚須本於借貸之意\n    思而為交付，方克成立，倘當事人主張與他方有消費借貸關\n    係存在者，自應就該借貸意思互相表示合致及借款業已交付\n    之事實，均負舉證之責任，其僅證明有金錢之交付，未能證\n    明借貸意思表示合致者，仍不能認為有該借貸關係存在（最\n    高法院98年度台上字第1045號判決意旨參照）。原告主張被\n    告向其借款10萬元，然為被告所否認，並以前揭內容抗辯，\n    揆諸上開說明，自應由原告就消費借貸契約之成立及金錢交\n    付之事實負舉證責任。原告雖提出系爭支票為證，然僅能證\n    明被告曾簽發或交付系爭支票予原告，尚不足以證明兩造間\n    就借貸之意思表示合致或原告有交付被告借款之事實，原告\n    復未能提出其他證據以實其說，所為主張自非可採。從而，\n    原告依據消費借貸之法律關係，請求被告給付借款10萬元及\n    自91年 7月25日起至清償日止，按週年5%計算之利息，為無\n    理由，應予駁回。\n六、本件訴訟費用即第1審裁判費1,000元，由原告負擔。\n中    華    民    國   100    年    3     月    24    日\n                  基隆簡易庭法  官  陳湘琳\n以上正本係照原本作成。\n對於本件判決如有不服，應於收受送達後20日內向本院提出上訴\n書狀，上訴於本院合議庭，並按他造當事人之人數附具繕本。\n中    華    民    國   100    年    3     月    24    日\n                            書記官  洪佳如",
  "structure": {
    "main": "原告之訴駁回。\n訴訟費用新臺幣壹仟元由原告負擔。",
    "fact": "一、原告經合法通知，未於最後言詞辯論期日到場，核無民事訴\n    訟法第386條各款所列情形，依民事訴訟法第436條第 2項、\n    第385條第1項前段之規定，准原告之聲請，由其一造辯論而\n    為判決。\n二、按訴狀送達後，原告不得將原訴變更或追加他訴，但請求之\n    基礎事實同一者，不在此限，民事訴訟法第 255條第1項第2\n    款定有明文。本件原告起訴時，係依據票據之法律關係請求\n    被告給付票款，之後於本院審理時，就請求權基礎部分變更\n    為消費借貸之法律關係，因請求之基礎事實同一，依據上開\n    規定，應予准許。\n三、原告起訴主張：被告前向原告借款，並經鑑轉交原告由被\n    告所簽發，發票日為民國90年10月20日、票面金額為新臺幣\n    （下同）10萬元、付款人為北投區農會關渡辦事處、支票號\n    碼為FA0000000之支票1紙，不料經原告屆期向付款人為付款\n    之提示，竟遭付款人以存款不足及拒絕往來戶為由予以退票\n    ，迭經原告催討，被告均置之不理，為此依消費借貸之法律\n    關係，請求被告給付10萬元，及自支票退票日即91年 7月25\n    日起至清償日止，按週年5%計算之利息。\n四、被告聲明駁回原告之訴，其抗辯略以：\n  (一)原告與被告素未相識，雙方並無借貸關係存在，原告雖執有\n    被告所簽發之支票 1紙，然該支票之發票日為90年10月20日\n    ，距今將近10年，已逾票據法第22條第1項所定之1年期間。\n  (二)又支票係文義證券及無因證券，與其基礎之原因關係各自獨\n    立，支票上權利之行使，不以其原因關係存在為前提，尚難\n    因執有支票，即得證明其所主張之原因關係為存在，故不能\n    以支票作為認定兩造間存有借貸關係之憑據。\n五、按稱消費借貸者，謂當事人一方移轉金錢或其他代替物之所\n    有權於他方，而約定他方以種類、品質、數量相同之物返還\n    之契約，民法第474條第1項定有明文；又稱消費借貸者，於\n    當事人間必本於借貸之意思合致，而有移轉金錢或其他代替\n    物之所有權於他方之行為，始得當之，是以消費借貸，因交\n    付金錢之原因多端，除有金錢之交付外，尚須本於借貸之意\n    思而為交付，方克成立，倘當事人主張與他方有消費借貸關\n    係存在者，自應就該借貸意思互相表示合致及借款業已交付\n    之事實，均負舉證之責任，其僅證明有金錢之交付，未能證\n    明借貸意思表示合致者，仍不能認為有該借貸關係存在（最\n    高法院98年度台上字第1045號判決意旨參照）。原告主張被\n    告向其借款10萬元，然為被告所否認，並以前揭內容抗辯，\n    揆諸上開說明，自應由原告就消費借貸契約之成立及金錢交\n    付之事實負舉證責任。原告雖提出系爭支票為證，然僅能證\n    明被告曾簽發或交付系爭支票予原告，尚不足以證明兩造間\n    就借貸之意思表示合致或原告有交付被告借款之事實，原告\n    復未能提出其他證據以實其說，所為主張自非可採。從而，\n    原告依據消費借貸之法律關係，請求被告給付借款10萬元及\n    自91年 7月25日起至清償日止，按週年5%計算之利息，為無\n    理由，應予駁回。\n六、本件訴訟費用即第1審裁判費1,000元，由原告負擔。",
    "reason": "一、原告經合法通知，未於最後言詞辯論期日到場，核無民事訴\n    訟法第386條各款所列情形，依民事訴訟法第436條第 2項、\n    第385條第1項前段之規定，准原告之聲請，由其一造辯論而\n    為判決。\n二、按訴狀送達後，原告不得將原訴變更或追加他訴，但請求之\n    基礎事實同一者，不在此限，民事訴訟法第 255條第1項第2\n    款定有明文。本件原告起訴時，係依據票據之法律關係請求\n    被告給付票款，之後於本院審理時，就請求權基礎部分變更\n    為消費借貸之法律關係，因請求之基礎事實同一，依據上開\n    規定，應予准許。\n三、原告起訴主張：被告前向原告借款，並經鑑轉交原告由被\n    告所簽發，發票日為民國90年10月20日、票面金額為新臺幣\n    （下同）10萬元、付款人為北投區農會關渡辦事處、支票號\n    碼為FA0000000之支票1紙，不料經原告屆期向付款人為付款\n    之提示，竟遭付款人以存款不足及拒絕往來戶為由予以退票\n    ，迭經原告催討，被告均置之不理，為此依消費借貸之法律\n    關係，請求被告給付10萬元，及自支票退票日即91年 7月25\n    日起至清償日止，按週年5%計算之利息。\n四、被告聲明駁回原告之訴，其抗辯略以：\n  (一)原告與被告素未相識，雙方並無借貸關係存在，原告雖執有\n    被告所簽發之支票 1紙，然該支票之發票日為90年10月20日\n    ，距今將近10年，已逾票據法第22條第1項所定之1年期間。\n  (二)又支票係文義證券及無因證券，與其基礎之原因關係各自獨\n    立，支票上權利之行使，不以其原因關係存在為前提，尚難\n    因執有支票，即得證明其所主張之原因關係為存在，故不能\n    以支票作為認定兩造間存有借貸關係之憑據。\n五、按稱消費借貸者，謂當事人一方移轉金錢或其他代替物之所\n    有權於他方，而約定他方以種類、品質、數量相同之物返還\n    之契約，民法第474條第1項定有明文；又稱消費借貸者，於\n    當事人間必本於借貸之意思合致，而有移轉金錢或其他代替\n    物之所有權於他方之行為，始得當之，是以消費借貸，因交\n    付金錢之原因多端，除有金錢之交付外，尚須本於借貸之意\n    思而為交付，方克成立，倘當事人主張與他方有消費借貸關\n    係存在者，自應就該借貸意思互相表示合致及借款業已交付\n    之事實，均負舉證之責任，其僅證明有金錢之交付，未能證\n    明借貸意思表示合致者，仍不能認為有該借貸關係存在（最\n    高法院98年度台上字第1045號判決意旨參照）。原告主張被\n    告向其借款10萬元，然為被告所否認，並以前揭內容抗辯，\n    揆諸上開說明，自應由原告就消費借貸契約之成立及金錢交\n    付之事實負舉證責任。原告雖提出系爭支票為證，然僅能證\n    明被告曾簽發或交付系爭支票予原告，尚不足以證明兩造間\n    就借貸之意思表示合致或原告有交付被告借款之事實，原告\n    復未能提出其他證據以實其說，所為主張自非可採。從而，\n    原告依據消費借貸之法律關係，請求被告給付借款10萬元及\n    自91年 7月25日起至清償日止，按週年5%計算之利息，為無\n    理由，應予駁回。\n六、本件訴訟費用即第1審裁判費1,000元，由原告負擔。"
  },
  "search": "臺灣基隆地方法院民事判決99年度基簡字第1008號原告李錦炎訴訟代理人方心彤被告曾淑芬訴訟代理人鐘寶桂上列當事人間請求給付票款事件，本院於民國100年3月10日言詞辯論終結，判決如下：主文原告之訴駁回。訴訟費用新臺幣壹仟元由原告負擔。事實及理由一、原告經合法通知，未於最後言詞辯論期日到場，核無民事訴訟法第386條各款所列情形，依民事訴訟法第436條第2項、第385條第1項前段之規定，准原告之聲請，由其一造辯論而為判決。二、按訴狀送達後，原告不得將原訴變更或追加他訴，但請求之基礎事實同一者，不在此限，民事訴訟法第255條第1項第2款定有明文。本件原告起訴時，係依據票據之法律關係請求被告給付票款，之後於本院審理時，就請求權基礎部分變更為消費借貸之法律關係，因請求之基礎事實同一，依據上開規定，應予准許。三、原告起訴主張：被告前向原告借款，並經鑑轉交原告由被告所簽發，發票日為民國90年10月20日、票面金額為新臺幣（下同）10萬元、付款人為北投區農會關渡辦事處、支票號碼為FA0000000之支票1紙，不料經原告屆期向付款人為付款之提示，竟遭付款人以存款不足及拒絕往來戶為由予以退票，迭經原告催討，被告均置之不理，為此依消費借貸之法律關係，請求被告給付10萬元，及自支票退票日即91年7月25日起至清償日止，按週年5%計算之利息。四、被告聲明駁回原告之訴，其抗辯略以：(一)原告與被告素未相識，雙方並無借貸關係存在，原告雖執有被告所簽發之支票1紙，然該支票之發票日為90年10月20日，距今將近10年，已逾票據法第22條第1項所定之1年期間。(二)又支票係文義證券及無因證券，與其基礎之原因關係各自獨立，支票上權利之行使，不以其原因關係存在為前提，尚難因執有支票，即得證明其所主張之原因關係為存在，故不能以支票作為認定兩造間存有借貸關係之憑據。五、按稱消費借貸者，謂當事人一方移轉金錢或其他代替物之所有權於他方，而約定他方以種類、品質、數量相同之物返還之契約，民法第474條第1項定有明文；又稱消費借貸者，於當事人間必本於借貸之意思合致，而有移轉金錢或其他代替物之所有權於他方之行為，始得當之，是以消費借貸，因交付金錢之原因多端，除有金錢之交付外，尚須本於借貸之意思而為交付，方克成立，倘當事人主張與他方有消費借貸關係存在者，自應就該借貸意思互相表示合致及借款業已交付之事實，均負舉證之責任，其僅證明有金錢之交付，未能證明借貸意思表示合致者，仍不能認為有該借貸關係存在（最高法院98年度台上字第1045號判決意旨參照）。原告主張被告向其借款10萬元，然為被告所否認，並以前揭內容抗辯，揆諸上開說明，自應由原告就消費借貸契約之成立及金錢交付之事實負舉證責任。原告雖提出系爭支票為證，然僅能證明被告曾簽發或交付系爭支票予原告，尚不足以證明兩造間就借貸之意思表示合致或原告有交付被告借款之事實，原告復未能提出其他證據以實其說，所為主張自非可採。從而，原告依據消費借貸之法律關係，請求被告給付借款10萬元及自91年7月25日起至清償日止，按週年5%計算之利息，為無理由，應予駁回。六、本件訴訟費用即第1審裁判費1,000元，由原告負擔。中華民國100年3月24日基隆簡易庭法官陳湘琳以上正本係照原本作成。對於本件判決如有不服，應於收受送達後20日內向本院提出上訴書狀，上訴於本院合議庭，並按他造當事人之人數附具繕本。中華民國100年3月24日書記官洪佳如",
  "characters": {
    "judges": [
      "陳湘琳"
    ],
    "prosecutors": [

    ],
    "lawyers": [

    ],
    "clerks": [

    ],
    "plaintiffs": [
      "李錦炎"
    ],
    "defendants": [
      "曾淑芬"
    ],
    "prosecutor_office": [

    ],
    "creditors": [

    ],
    "debtors": [

    ],
    "judicial_associate_officer": [

    ]
  },
  "adjudged_at": "2011-03-24",
  "created_at": "2016-02-13 21:04:04",
  "updated_at": "2016-02-13 21:04:04"
}