{
  "identify": "KSD-100-易-348-20110325-1",
  "court": {
    "name": "臺灣高雄地方法院",
    "code": "KSD"
  },
  "division": {
    "name": "刑事",
    "code": "M"
  },
  "year": 100,
  "word": "易",
  "number": "348",
  "jcheck": "1",
  "reason": "傷害",
  "content": "臺灣高雄地方法院刑事判決              100年度易字第348號\n公  訴  人  臺灣高雄地方法院檢察署檢察官\n被      告  柯明政\n上列被告因傷害案件，經檢察官提起公訴（99年度偵字第32978\n號），本院決如下：\n    主  文\n本件公訴不受理。\n    理  由\n一、公訴意旨如附件起訴書所載。\n二、按刑法第277 條第1 項之罪，須告訴乃論，刑法第287 條前\n    段定有明文。次按告訴乃論之罪，告訴人於第一審辯論終結\n    前，得撤回其告訴；又告訴經撤回者，法院應諭知不受理之\n    判決，且得不經言詞辯論為之。刑事訴訟法第238 條第1 項\n    、第303 條第3 款、第307 條分別定有明文。\n三、經查，本件被告柯明政因涉犯刑法第277 條第1 項傷害罪案\n    件，經檢察官提起公訴，惟被告上開所涉犯之罪，依同法第\n    287 條前段之規定須告訴乃論。茲因被告已與告訴人和解，\n    告訴人已具狀撤回本件傷害告訴，有刑事撤回告訴狀1 紙附\n    卷可稽（見院二卷第10頁），揆諸前開說明，爰不經言詞辯\n    論，逕諭知不受理之判決。\n據上論斷，應依刑事訴訟法第303 條第3 款、第307 條，判決如\n主文。\n中    華    民    國    100   年    3     月    25    日\n                  刑事第五庭  法  官  林永村\n以上正本證明與原本無異。\n如不服本判決，應於判決送達後10日內，向本院提出上訴狀。\n中    華    民    國    100   年    3     月    25    日\n                              書記官  王珮樺",
  "structure": {
    "main": "本件公訴不受理。",
    "reason": "一、公訴意旨如附件起訴書所載。\n二、按刑法第277 條第1 項之罪，須告訴乃論，刑法第287 條前\n    段定有明文。次按告訴乃論之罪，告訴人於第一審辯論終結\n    前，得撤回其告訴；又告訴經撤回者，法院應諭知不受理之\n    判決，且得不經言詞辯論為之。刑事訴訟法第238 條第1 項\n    、第303 條第3 款、第307 條分別定有明文。\n三、經查，本件被告柯明政因涉犯刑法第277 條第1 項傷害罪案\n    件，經檢察官提起公訴，惟被告上開所涉犯之罪，依同法第\n    287 條前段之規定須告訴乃論。茲因被告已與告訴人和解，\n    告訴人已具狀撤回本件傷害告訴，有刑事撤回告訴狀1 紙附\n    卷可稽（見院二卷第10頁），揆諸前開說明，爰不經言詞辯\n    論，逕諭知不受理之判決。\n據上論斷，應依刑事訴訟法第303 條第3 款、第307 條，判決如\n主文。"
  },
  "search": "臺灣高雄地方法院刑事判決100年度易字第348號公訴人臺灣高雄地方法院檢察署檢察官被告柯明政上列被告因傷害案件，經檢察官提起公訴（99年度偵字第32978號），本院決如下：主文本件公訴不受理。理由一、公訴意旨如附件起訴書所載。二、按刑法第277條第1項之罪，須告訴乃論，刑法第287條前段定有明文。次按告訴乃論之罪，告訴人於第一審辯論終結前，得撤回其告訴；又告訴經撤回者，法院應諭知不受理之判決，且得不經言詞辯論為之。刑事訴訟法第238條第1項、第303條第3款、第307條分別定有明文。三、經查，本件被告柯明政因涉犯刑法第277條第1項傷害罪案件，經檢察官提起公訴，惟被告上開所涉犯之罪，依同法第287條前段之規定須告訴乃論。茲因被告已與告訴人和解，告訴人已具狀撤回本件傷害告訴，有刑事撤回告訴狀1紙附卷可稽（見院二卷第10頁），揆諸前開說明，爰不經言詞辯論，逕諭知不受理之判決。據上論斷，應依刑事訴訟法第303條第3款、第307條，判決如主文。中華民國100年3月25日刑事第五庭法官林永村以上正本證明與原本無異。如不服本判決，應於判決送達後10日內，向本院提出上訴狀。中華民國100年3月25日書記官王珮樺",
  "characters": {
    "judges": [
      "林永村"
    ],
    "prosecutors": [

    ],
    "lawyers": [

    ],
    "clerks": [

    ],
    "plaintiffs": [

    ],
    "defendants": [
      "柯明政"
    ],
    "prosecutor_office": [
      "臺灣高雄地方法院檢察署檢察官"
    ],
    "creditors": [

    ],
    "debtors": [

    ],
    "judicial_associate_officer": [

    ]
  },
  "adjudged_at": "2011-03-25",
  "created_at": "2016-02-13 21:10:35",
  "updated_at": "2016-02-13 21:10:35"
}