{
  "identify": "TPD-100-司促-6179-20110324-1",
  "court": {
    "name": "臺灣臺北地方法院",
    "code": "TPD"
  },
  "division": {
    "name": "民事",
    "code": "V"
  },
  "year": 100,
  "word": "司促",
  "number": "6179",
  "jcheck": "1",
  "reason": "支付命令",
  "content": "臺灣臺北地方法院支付命令           100年度司促字第6179號\n聲  請  人\n即債權人    萬泰商業銀行股份有限公司\n法定代理人  盧正昕\n相  對  人\n即債務人    郭美玲\n一、債務人應向債權人清償新臺幣拾萬玖仟零壹拾伍元，及\n    其中新臺幣拾萬仟伍佰柒拾柒元自民國一百年二月十\n    五日起至清償日止，按年息百分之二十計算之利息，並賠償\n    督促程序費用新臺幣伍佰元，否則應於本命令送達後二十日\n    之不變期間內，向本院提出異議。\n二、債權人請求之原因事實如附件所載。\n三、如債務人未於第一項期間內提出異議，本命令與確定判決有\n    同一效力。\n中    華    民    國   100    年    3     月    24    日\n                  民事庭司法事務官  鄧仁誠\n附件：\n債權人請求之原因事實（100年度司促字第6179號）\n債務人郭美玲於民國八十九年十月十三日與債權人訂立小額循環\n信用貸款契約，約定以GEORGE＆MARY現金卡為工具循環使用。詎\n債務人未依約給付，尚積欠本金數額及利息計算說明如下：\n(一) 本金債權：新臺幣333,577 元整。\n(二) 利息計算：1 依契約書第三條及第七條約定分別計算，於\n     繳款期限前按年利率百分之一十七計算利息，延滯則按年\n     利率百分之二十計算利息。\n     2 繳款期限已計未收利息共新臺幣5,438 元整。\n(三) 延滯期間利息：自民國一百年二月十五日起至清償日止，\n     以本金新臺幣333,577 元按年利率百分之二十計算之利息\n     。\n(四) 帳務管理費用：新臺幣0 元整。又按契約第十一條，債務\n     人未依約繳納本息，已喪失期限利益，全部債務視為到期\n     ，詎料自民國一百年二月十四日起，債務人未依約履行給\n     付義務，且屢經催討，均置之不理，債權人為確保債權，\n     爰依民事訴訟法第五０八條之規定，狀請鈞院對債務人發\n     給支付命令，以保權益。",
  "structure": {
  },
  "search": "臺灣臺北地方法院支付命令100年度司促字第6179號聲請人即債權人萬泰商業銀行股份有限公司法定代理人盧正昕相對人即債務人郭美玲一、債務人應向債權人清償新臺幣拾萬玖仟零壹拾伍元，及其中新臺幣拾萬仟伍佰柒拾柒元自民國一百年二月十五日起至清償日止，按年息百分之二十計算之利息，並賠償督促程序費用新臺幣伍佰元，否則應於本命令送達後二十日之不變期間內，向本院提出異議。二、債權人請求之原因事實如附件所載。三、如債務人未於第一項期間內提出異議，本命令與確定判決有同一效力。中華民國100年3月24日民事庭司法事務官鄧仁誠附件：債權人請求之原因事實（100年度司促字第6179號）債務人郭美玲於民國八十九年十月十三日與債權人訂立小額循環信用貸款契約，約定以GEORGE＆MARY現金卡為工具循環使用。詎債務人未依約給付，尚積欠本金數額及利息計算說明如下：(一)本金債權：新臺幣333,577元整。(二)利息計算：1依契約書第三條及第七條約定分別計算，於繳款期限前按年利率百分之一十七計算利息，延滯則按年利率百分之二十計算利息。2繳款期限已計未收利息共新臺幣5,438元整。(三)延滯期間利息：自民國一百年二月十五日起至清償日止，以本金新臺幣333,577元按年利率百分之二十計算之利息。(四)帳務管理費用：新臺幣0元整。又按契約第十一條，債務人未依約繳納本息，已喪失期限利益，全部債務視為到期，詎料自民國一百年二月十四日起，債務人未依約履行給付義務，且屢經催討，均置之不理，債權人為確保債權，爰依民事訴訟法第五０八條之規定，狀請鈞院對債務人發給支付命令，以保權益。",
  "characters": {
    "judges": [

    ],
    "prosecutors": [

    ],
    "lawyers": [

    ],
    "clerks": [

    ],
    "plaintiffs": [

    ],
    "defendants": [

    ],
    "prosecutor_office": [

    ],
    "creditors": [
      "萬泰商業銀行股份有限公司"
    ],
    "debtors": [

    ],
    "judicial_associate_officer": [
      "鄧仁誠"
    ]
  },
  "adjudged_at": "2011-03-24",
  "created_at": "2016-02-13 21:07:52",
  "updated_at": "2016-02-13 21:07:52"
}