{
  "identify": "TPD-100-司聲-173-20110325-1",
  "court": {
    "name": "臺灣臺北地方法院",
    "code": "TPD"
  },
  "division": {
    "name": "民事",
    "code": "V"
  },
  "year": 100,
  "word": "司聲",
  "number": "173",
  "jcheck": "1",
  "reason": "確定訴訟費用額",
  "content": "臺灣臺北地方法院民事裁定            100年度司聲字第173號\n聲  請  人  台北大眾捷運股份有限公司\n法定代理人  林崇一\n相  對  人  余莓莓\n上列聲請人聲請確定訴訟費用額，本院裁定如下：\n    主  文\n聲請駁回。\n    理  由\n一、本件聲請人與相對人余莓莓間侵權行為損害賠償事件，前經\n    本院98年度訴字91號、臺灣高等法院(下稱高等法院)98年度\n    上易字905號判決確定。聲請人主張聲請人應負擔之訴訟費\n    用總額為新臺幣(下同)7,029元，而相對人應負擔訴訟費用\n    為18,156元，並提出費用計算書及自行收納款項收據等件影\n    本為證。\n二、按法院未於訴訟費用之裁判確定其費用額者，第一審受訴法\n    院於該裁判有執行力後，應依聲請以裁定確定之。又當事人\n    分擔訴訟費用者，法院為確定費用額之裁判時，除前條第二\n    項情形外，應視為各當事人應負擔之費用，已就相等之額抵\n    銷，而確定其一造應賠償他造之差額。民事訴訟法第91條第\n    1項及第93條分別定有明文。是聲請確定訴訟費用額之目的\n    在於確定應負擔訴訟費用之一造應賠償他造所支出訴訟費用\n    之數額。依確定終局判決應負擔訴訟費用之當事人既不得請\n    求他造賠償其支出之訴訟費用，即無聲請法院確定訴訟費用\n    額之必要，則其聲請因無實益，自不應准許。\n三、經本院調卷審查後，本件係相對人(即原告)向本院提起侵權\n    行為損害賠償訴訟(本院98年度訴字第91號)，經本院諭知兩\n    造一部勝訴、一部敗訴，訴訟費用由聲請人(即被告)負擔\n    1/8 ，餘由相對人(即原告)負擔；嗣聲請人(即被告)就第一\n    審敗訴部分上訴，而相對人(即原告)就第一審敗訴部分提起\n    一部上訴，經高等法院(98年度上易字第905號)諭知聲請人(\n    即被告、上訴人)上訴駁回，相對人(即原告、上訴人) 部分\n    勝訴，關於相對人上訴部分第一、二審訴訟費用，由相對人\n    負擔4/5，聲請人負擔1/5，聲請人上訴部分，訴訟費用由聲\n    請人負擔。\n四、查聲請人僅於第二審程序中繳納上訴裁判費用2,490元，而\n    該費用已高等法院諭知由聲請人自行負擔。相對人於歷審裁\n    判中所繳納之訴訟費用計有第一審裁判費12,385元、第二審\n    上訴裁判費10,410元。聲請人就第一審敗訴判決部分(含訴\n    訟費用裁判)上訴，由高等法院駁回確定，故相對人於第一\n    審所繳納之裁判費中之1/8，即1,548元(計算式：12,385×\n    1/8 ＝1,548)，應由聲請人負擔；相對人對第一審敗訴部分\n    一部(含訴訟費用裁判)上訴，由高等法院諭知第一、二審訴\n    訟費用之4/5由相對人負擔，1/5由聲請人負擔，故聲請人應\n    負擔之訴訟費用為4,249元(計算式：(10,410(二審上訴費)\n    ×1/5)＋((12,385(一審裁判費)－1,548(一審確定由聲請人\n    負擔部分))×1/5)＝4,249)，總計本件聲請人於兩造侵權行\n    為損害賠償事件中，應負擔之訴訟費用為5,797元(計算式：\n    1,548＋4,249＝5,797)，即聲請人應賠償相對人5,797元。\n    綜上所陳，聲請人既不得請求相對人賠償其支出之訴訟費用\n    ，揆諸前述二、所述意旨，即無聲請法院確定訴訟費用額之\n    必要。從而，本件聲請核無必要，自不應准許。\n五、如不服本裁定，應於裁定送達後10日內，以書狀向本院司法\n    事務官提出異議。\n中    華    民    國   100    年    3     月    25    日\n                  民事第五庭  司法事務官  涂承嗣",
  "structure": {
    "main": "聲請駁回。",
    "reason": "一、本件聲請人與相對人余莓莓間侵權行為損害賠償事件，前經\n    本院98年度訴字91號、臺灣高等法院(下稱高等法院)98年度\n    上易字905號判決確定。聲請人主張聲請人應負擔之訴訟費\n    用總額為新臺幣(下同)7,029元，而相對人應負擔訴訟費用\n    為18,156元，並提出費用計算書及自行收納款項收據等件影\n    本為證。\n二、按法院未於訴訟費用之裁判確定其費用額者，第一審受訴法\n    院於該裁判有執行力後，應依聲請以裁定確定之。又當事人\n    分擔訴訟費用者，法院為確定費用額之裁判時，除前條第二\n    項情形外，應視為各當事人應負擔之費用，已就相等之額抵\n    銷，而確定其一造應賠償他造之差額。民事訴訟法第91條第\n    1項及第93條分別定有明文。是聲請確定訴訟費用額之目的\n    在於確定應負擔訴訟費用之一造應賠償他造所支出訴訟費用\n    之數額。依確定終局判決應負擔訴訟費用之當事人既不得請\n    求他造賠償其支出之訴訟費用，即無聲請法院確定訴訟費用\n    額之必要，則其聲請因無實益，自不應准許。\n三、經本院調卷審查後，本件係相對人(即原告)向本院提起侵權\n    行為損害賠償訴訟(本院98年度訴字第91號)，經本院諭知兩\n    造一部勝訴、一部敗訴，訴訟費用由聲請人(即被告)負擔\n    1/8 ，餘由相對人(即原告)負擔；嗣聲請人(即被告)就第一\n    審敗訴部分上訴，而相對人(即原告)就第一審敗訴部分提起\n    一部上訴，經高等法院(98年度上易字第905號)諭知聲請人(\n    即被告、上訴人)上訴駁回，相對人(即原告、上訴人) 部分\n    勝訴，關於相對人上訴部分第一、二審訴訟費用，由相對人\n    負擔4/5，聲請人負擔1/5，聲請人上訴部分，訴訟費用由聲\n    請人負擔。\n四、查聲請人僅於第二審程序中繳納上訴裁判費用2,490元，而\n    該費用已高等法院諭知由聲請人自行負擔。相對人於歷審裁\n    判中所繳納之訴訟費用計有第一審裁判費12,385元、第二審\n    上訴裁判費10,410元。聲請人就第一審敗訴判決部分(含訴\n    訟費用裁判)上訴，由高等法院駁回確定，故相對人於第一\n    審所繳納之裁判費中之1/8，即1,548元(計算式：12,385×\n    1/8 ＝1,548)，應由聲請人負擔；相對人對第一審敗訴部分\n    一部(含訴訟費用裁判)上訴，由高等法院諭知第一、二審訴\n    訟費用之4/5由相對人負擔，1/5由聲請人負擔，故聲請人應\n    負擔之訴訟費用為4,249元(計算式：(10,410(二審上訴費)\n    ×1/5)＋((12,385(一審裁判費)－1,548(一審確定由聲請人\n    負擔部分))×1/5)＝4,249)，總計本件聲請人於兩造侵權行\n    為損害賠償事件中，應負擔之訴訟費用為5,797元(計算式：\n    1,548＋4,249＝5,797)，即聲請人應賠償相對人5,797元。\n    綜上所陳，聲請人既不得請求相對人賠償其支出之訴訟費用\n    ，揆諸前述二、所述意旨，即無聲請法院確定訴訟費用額之\n    必要。從而，本件聲請核無必要，自不應准許。\n五、如不服本裁定，應於裁定送達後10日內，以書狀向本院司法\n    事務官提出異議。"
  },
  "search": "臺灣臺北地方法院民事裁定100年度司聲字第173號聲請人台北大眾捷運股份有限公司法定代理人林崇一相對人余莓莓上列聲請人聲請確定訴訟費用額，本院裁定如下：主文聲請駁回。理由一、本件聲請人與相對人余莓莓間侵權行為損害賠償事件，前經本院98年度訴字91號、臺灣高等法院(下稱高等法院)98年度上易字905號判決確定。聲請人主張聲請人應負擔之訴訟費用總額為新臺幣(下同)7,029元，而相對人應負擔訴訟費用為18,156元，並提出費用計算書及自行收納款項收據等件影本為證。二、按法院未於訴訟費用之裁判確定其費用額者，第一審受訴法院於該裁判有執行力後，應依聲請以裁定確定之。又當事人分擔訴訟費用者，法院為確定費用額之裁判時，除前條第二項情形外，應視為各當事人應負擔之費用，已就相等之額抵銷，而確定其一造應賠償他造之差額。民事訴訟法第91條第1項及第93條分別定有明文。是聲請確定訴訟費用額之目的在於確定應負擔訴訟費用之一造應賠償他造所支出訴訟費用之數額。依確定終局判決應負擔訴訟費用之當事人既不得請求他造賠償其支出之訴訟費用，即無聲請法院確定訴訟費用額之必要，則其聲請因無實益，自不應准許。三、經本院調卷審查後，本件係相對人(即原告)向本院提起侵權行為損害賠償訴訟(本院98年度訴字第91號)，經本院諭知兩造一部勝訴、一部敗訴，訴訟費用由聲請人(即被告)負擔1/8，餘由相對人(即原告)負擔；嗣聲請人(即被告)就第一審敗訴部分上訴，而相對人(即原告)就第一審敗訴部分提起一部上訴，經高等法院(98年度上易字第905號)諭知聲請人(即被告、上訴人)上訴駁回，相對人(即原告、上訴人)部分勝訴，關於相對人上訴部分第一、二審訴訟費用，由相對人負擔4/5，聲請人負擔1/5，聲請人上訴部分，訴訟費用由聲請人負擔。四、查聲請人僅於第二審程序中繳納上訴裁判費用2,490元，而該費用已高等法院諭知由聲請人自行負擔。相對人於歷審裁判中所繳納之訴訟費用計有第一審裁判費12,385元、第二審上訴裁判費10,410元。聲請人就第一審敗訴判決部分(含訴訟費用裁判)上訴，由高等法院駁回確定，故相對人於第一審所繳納之裁判費中之1/8，即1,548元(計算式：12,385×1/8＝1,548)，應由聲請人負擔；相對人對第一審敗訴部分一部(含訴訟費用裁判)上訴，由高等法院諭知第一、二審訴訟費用之4/5由相對人負擔，1/5由聲請人負擔，故聲請人應負擔之訴訟費用為4,249元(計算式：(10,410(二審上訴費)×1/5)＋((12,385(一審裁判費)－1,548(一審確定由聲請人負擔部分))×1/5)＝4,249)，總計本件聲請人於兩造侵權行為損害賠償事件中，應負擔之訴訟費用為5,797元(計算式：1,548＋4,249＝5,797)，即聲請人應賠償相對人5,797元。綜上所陳，聲請人既不得請求相對人賠償其支出之訴訟費用，揆諸前述二、所述意旨，即無聲請法院確定訴訟費用額之必要。從而，本件聲請核無必要，自不應准許。五、如不服本裁定，應於裁定送達後10日內，以書狀向本院司法事務官提出異議。中華民國100年3月25日民事第五庭司法事務官涂承嗣",
  "characters": {
    "judges": [

    ],
    "prosecutors": [

    ],
    "lawyers": [

    ],
    "clerks": [

    ],
    "plaintiffs": [

    ],
    "defendants": [

    ],
    "prosecutor_office": [
      "台北大眾捷運股份有限公司"
    ],
    "creditors": [

    ],
    "debtors": [

    ],
    "judicial_associate_officer": [
      "涂承嗣"
    ]
  },
  "adjudged_at": "2011-03-25",
  "created_at": "2016-02-13 21:06:35",
  "updated_at": "2016-02-13 21:06:35"
}