{
  "identify": "KMD-100-司促-1048-20111205-1",
  "court": {
    "name": "福建金門地方法院",
    "code": "KMD"
  },
  "division": {
    "name": "民事",
    "code": "V"
  },
  "year": 100,
  "word": "司促",
  "number": "1048",
  "jcheck": "1",
  "reason": "支付命令",
  "content": "福建金門地方法院支付命令           100年度司促字第1048號\n債  權  人  花旗(台灣)商業銀行股份有限公司\n法定代理人  管國霖\n債  務  人  羅錦耀\n一、債務人應於本命令送達後二十日之不變期間內，向債權人給\n    付新台幣（下同）陸萬仟玖佰拾貳元，及自民國94年9\n    月9日起至清償日止，按年息百分之9計算之利息，並賠償督\n    促程序費用伍佰元。\n二、本件聲請意旨略以：債務人於民國94年3月8日與債權人（原\n    為華僑商業銀行股份有限公司，嗣因與花旗（臺灣）商業銀\n    行股份有限公司進行合併，由花旗（臺灣）商業銀行股份有\n    限公司為存續銀行）訂有「華僑銀行消費性借款契約（一次\n    動用專用）」，向債權人借款96,000元，並約定分期平均攤\n    還本息，惟債務人未依約清償等語。\n三、債務人對於本命令，得於第一項期間內向本院提出異議。\n四、如債務人未於第一項期間內提出異議，本命令與確定判決有\n    同一效力。\n中    華    民    國   100    年    12    月    5     日\n                    民事庭    司法事務官  莊嘉聆\n以上正本係照原本作成。\n中    華    民    國   100    年    12    月    5     日\n                              書  記  官  陳添發",
  "structure": {
  },
  "search": "福建金門地方法院支付命令100年度司促字第1048號債權人花旗(台灣)商業銀行股份有限公司法定代理人管國霖債務人羅錦耀一、債務人應於本命令送達後二十日之不變期間內，向債權人給付新台幣（下同）陸萬仟玖佰拾貳元，及自民國94年9月9日起至清償日止，按年息百分之9計算之利息，並賠償督促程序費用伍佰元。二、本件聲請意旨略以：債務人於民國94年3月8日與債權人（原為華僑商業銀行股份有限公司，嗣因與花旗（臺灣）商業銀行股份有限公司進行合併，由花旗（臺灣）商業銀行股份有限公司為存續銀行）訂有「華僑銀行消費性借款契約（一次動用專用）」，向債權人借款96,000元，並約定分期平均攤還本息，惟債務人未依約清償等語。三、債務人對於本命令，得於第一項期間內向本院提出異議。四、如債務人未於第一項期間內提出異議，本命令與確定判決有同一效力。中華民國100年12月5日民事庭司法事務官莊嘉聆以上正本係照原本作成。中華民國100年12月5日書記官陳添發",
  "characters": {
    "judges": [

    ],
    "prosecutors": [

    ],
    "lawyers": [

    ],
    "clerks": [

    ],
    "plaintiffs": [

    ],
    "defendants": [

    ],
    "prosecutor_office": [

    ],
    "creditors": [
      "花旗"
    ],
    "debtors": [
      "羅錦耀"
    ],
    "judicial_associate_officer": [
      "莊嘉聆"
    ]
  },
  "adjudged_at": "2011-12-05",
  "created_at": "2016-02-13 11:05:17",
  "updated_at": "2016-02-13 11:05:17"
}