{
  "identify": "TYD-100-司繼-1453-20111206-1",
  "court": {
    "name": "臺灣桃園地方法院",
    "code": "TYD"
  },
  "division": {
    "name": "民事",
    "code": "V"
  },
  "year": 100,
  "word": "司繼",
  "number": "1453",
  "jcheck": "1",
  "reason": "拋棄繼承",
  "content": "臺灣桃園地方法院民事裁定           100年度司繼字第1453號\n聲  明  人  張繼綿\n            張幼綿\n            張憶綿\n            張吉如\n相  對  人\n即被繼承人  張玉綿（亡）\n上列聲明人聲明拋棄繼承事件，本院裁定如下：\n    主  文\n聲明駁回。\n程序費用由聲明人負擔。\n    理  由\n一、本件聲明意旨略以：聲明人等4 人為被繼承人張玉綿之兄弟\n    姐妹，茲因被繼承人於民國（下同）100 年08月15日死亡，\n    聲明人等自願拋棄繼承，爰依法檢呈被繼承人除戶戶籍謄本\n    、聲明人戶籍謄本、繼承系統表、拋棄繼承權書、印鑑證明\n    等文件，具狀聲明拋棄繼承權，請准予備查等語。\n二、按繼承人得拋棄其繼承權，民法第1174條第1 項定有明文。\n    準此，非繼承人即無拋棄繼承權可言。次按「遺產繼承人，\n    除配偶外，依左列順序定之：一、直系血親卑親屬。二、父\n    母。三、兄弟姊妹。四、祖父母。」同法第1138條定有明文\n    ；又「先順序繼承人均拋棄其繼承權時，由次順序之繼承人\n    繼承。」亦為同法第1176條第6 項所明定。故如先順序繼承\n    人並未全部拋棄繼承時，後順序之繼承人並無繼承權，即無\n    拋棄繼承可言。\n三、經查：本件被繼承人張玉綿於100 年08月15日死亡時，除配\n    偶梁建民外，尚有其第一順序繼承人即其子女梁永杰、梁宜\n    婷、梁慧娟，及第二順序繼承人即其母張郭怨，而聲明人等\n    4 人為被繼承人之兄弟姐妹，係其第三順序繼承人等節，有\n    聲明人提供之除戶謄本、戶籍謄本及繼承系統表等件在卷可\n    按。又聲明人等4 人固於本件中與被繼承人之配偶、子女同\n    向本院聲明拋棄繼承，惟查被繼承人之母張郭怨並無向本院\n    為聲明拋棄繼承之表示，且其嗣於100 年10月18日死亡，此\n    有本院家事紀錄科查詢表及張郭怨之除戶謄本各1 紙附卷可\n    憑，是本件於繼承開始時，被繼承人之遺產已由其第二順序\n    法定繼承人即母張郭怨繼承甚明，本件聲明人等既屬第三順\n    序之繼承人，其繼承權顯然尚未發生，自無拋棄繼承之權利\n    可言，故聲明人等所為本件拋棄繼承之聲明，於法不合，應\n    予駁回。至於被繼承人之配偶梁建民、子女梁永杰、梁宜婷\n    、梁慧娟等人聲明拋棄繼承部分，經本院另以函文准予備查\n    在案，附此敘明。\n四、又張郭怨因先繼承被繼承人張玉綿之一切權利、義務，而後\n    死亡，所發生之再轉繼承部分，應依民法第1138條之法定順\n    序定繼承人；而張郭怨之法定繼承人若欲拋棄繼承，於未逾\n    知悉其得繼承之時起3 個月之期限內，得依民法第1174條規\n    定另案向法院聲明拋棄繼承，併予敘明。\n五、爰裁定如主文。\n六、如對本裁定抗告，須於裁定送達後10日內，向本院提出抗告\n    狀，並應繳納抗告費新臺幣1,000 元整。\n中    華    民    國   100    年    12    月    6     日\n                  家事法庭  司法事務官  蔡育庭\n以上正本係照原本作成。",
  "structure": {
    "main": "聲明駁回。\n程序費用由聲明人負擔。",
    "reason": "一、本件聲明意旨略以：聲明人等4 人為被繼承人張玉綿之兄弟\n    姐妹，茲因被繼承人於民國（下同）100 年08月15日死亡，\n    聲明人等自願拋棄繼承，爰依法檢呈被繼承人除戶戶籍謄本\n    、聲明人戶籍謄本、繼承系統表、拋棄繼承權書、印鑑證明\n    等文件，具狀聲明拋棄繼承權，請准予備查等語。\n二、按繼承人得拋棄其繼承權，民法第1174條第1 項定有明文。\n    準此，非繼承人即無拋棄繼承權可言。次按「遺產繼承人，\n    除配偶外，依左列順序定之：一、直系血親卑親屬。二、父\n    母。三、兄弟姊妹。四、祖父母。」同法第1138條定有明文\n    ；又「先順序繼承人均拋棄其繼承權時，由次順序之繼承人\n    繼承。」亦為同法第1176條第6 項所明定。故如先順序繼承\n    人並未全部拋棄繼承時，後順序之繼承人並無繼承權，即無\n    拋棄繼承可言。\n三、經查：本件被繼承人張玉綿於100 年08月15日死亡時，除配\n    偶梁建民外，尚有其第一順序繼承人即其子女梁永杰、梁宜\n    婷、梁慧娟，及第二順序繼承人即其母張郭怨，而聲明人等\n    4 人為被繼承人之兄弟姐妹，係其第三順序繼承人等節，有\n    聲明人提供之除戶謄本、戶籍謄本及繼承系統表等件在卷可\n    按。又聲明人等4 人固於本件中與被繼承人之配偶、子女同\n    向本院聲明拋棄繼承，惟查被繼承人之母張郭怨並無向本院\n    為聲明拋棄繼承之表示，且其嗣於100 年10月18日死亡，此\n    有本院家事紀錄科查詢表及張郭怨之除戶謄本各1 紙附卷可\n    憑，是本件於繼承開始時，被繼承人之遺產已由其第二順序\n    法定繼承人即母張郭怨繼承甚明，本件聲明人等既屬第三順\n    序之繼承人，其繼承權顯然尚未發生，自無拋棄繼承之權利\n    可言，故聲明人等所為本件拋棄繼承之聲明，於法不合，應\n    予駁回。至於被繼承人之配偶梁建民、子女梁永杰、梁宜婷\n    、梁慧娟等人聲明拋棄繼承部分，經本院另以函文准予備查\n    在案，附此敘明。\n四、又張郭怨因先繼承被繼承人張玉綿之一切權利、義務，而後\n    死亡，所發生之再轉繼承部分，應依民法第1138條之法定順\n    序定繼承人；而張郭怨之法定繼承人若欲拋棄繼承，於未逾\n    知悉其得繼承之時起3 個月之期限內，得依民法第1174條規\n    定另案向法院聲明拋棄繼承，併予敘明。\n五、爰裁定如主文。\n六、如對本裁定抗告，須於裁定送達後10日內，向本院提出抗告\n    狀，並應繳納抗告費新臺幣1,000 元整。"
  },
  "search": "臺灣桃園地方法院民事裁定100年度司繼字第1453號聲明人張繼綿張幼綿張憶綿張吉如相對人即被繼承人張玉綿（亡）上列聲明人聲明拋棄繼承事件，本院裁定如下：主文聲明駁回。程序費用由聲明人負擔。理由一、本件聲明意旨略以：聲明人等4人為被繼承人張玉綿之兄弟姐妹，茲因被繼承人於民國（下同）100年08月15日死亡，聲明人等自願拋棄繼承，爰依法檢呈被繼承人除戶戶籍謄本、聲明人戶籍謄本、繼承系統表、拋棄繼承權書、印鑑證明等文件，具狀聲明拋棄繼承權，請准予備查等語。二、按繼承人得拋棄其繼承權，民法第1174條第1項定有明文。準此，非繼承人即無拋棄繼承權可言。次按「遺產繼承人，除配偶外，依左列順序定之：一、直系血親卑親屬。二、父母。三、兄弟姊妹。四、祖父母。」同法第1138條定有明文；又「先順序繼承人均拋棄其繼承權時，由次順序之繼承人繼承。」亦為同法第1176條第6項所明定。故如先順序繼承人並未全部拋棄繼承時，後順序之繼承人並無繼承權，即無拋棄繼承可言。三、經查：本件被繼承人張玉綿於100年08月15日死亡時，除配偶梁建民外，尚有其第一順序繼承人即其子女梁永杰、梁宜婷、梁慧娟，及第二順序繼承人即其母張郭怨，而聲明人等4人為被繼承人之兄弟姐妹，係其第三順序繼承人等節，有聲明人提供之除戶謄本、戶籍謄本及繼承系統表等件在卷可按。又聲明人等4人固於本件中與被繼承人之配偶、子女同向本院聲明拋棄繼承，惟查被繼承人之母張郭怨並無向本院為聲明拋棄繼承之表示，且其嗣於100年10月18日死亡，此有本院家事紀錄科查詢表及張郭怨之除戶謄本各1紙附卷可憑，是本件於繼承開始時，被繼承人之遺產已由其第二順序法定繼承人即母張郭怨繼承甚明，本件聲明人等既屬第三順序之繼承人，其繼承權顯然尚未發生，自無拋棄繼承之權利可言，故聲明人等所為本件拋棄繼承之聲明，於法不合，應予駁回。至於被繼承人之配偶梁建民、子女梁永杰、梁宜婷、梁慧娟等人聲明拋棄繼承部分，經本院另以函文准予備查在案，附此敘明。四、又張郭怨因先繼承被繼承人張玉綿之一切權利、義務，而後死亡，所發生之再轉繼承部分，應依民法第1138條之法定順序定繼承人；而張郭怨之法定繼承人若欲拋棄繼承，於未逾知悉其得繼承之時起3個月之期限內，得依民法第1174條規定另案向法院聲明拋棄繼承，併予敘明。五、爰裁定如主文。六、如對本裁定抗告，須於裁定送達後10日內，向本院提出抗告狀，並應繳納抗告費新臺幣1,000元整。中華民國100年12月6日家事法庭司法事務官蔡育庭以上正本係照原本作成。",
  "characters": {
    "judges": [

    ],
    "prosecutors": [

    ],
    "lawyers": [

    ],
    "clerks": [

    ],
    "plaintiffs": [

    ],
    "defendants": [

    ],
    "prosecutor_office": [

    ],
    "creditors": [

    ],
    "debtors": [

    ],
    "judicial_associate_officer": [
      "蔡育庭"
    ]
  },
  "adjudged_at": "2011-12-06",
  "created_at": "2016-02-13 11:02:24",
  "updated_at": "2016-02-13 11:02:24"
}