{
  "identify": "TPB-94-訴-3062-20051124-1",
  "court": {
    "name": "臺北高等行政法院",
    "code": "TPB"
  },
  "division": {
    "name": "行政",
    "code": "A"
  },
  "year": 94,
  "word": "訴",
  "number": "3062",
  "jcheck": "1",
  "reason": "刑事",
  "content": "臺北高等行政法院裁定\n                                     94年度訴字第03062號\n原      告  甲○○\n上列原告因刑事事件，提起行政訴訟，本院裁定如下：\n    主  文\n原告之訴駁回。\n訴訟費用由原告負擔。\n    理  由\n一、按「公法上之爭議，除法律別有規定外，得依本法提起行政\n    訴訟。」「訴訟事件不屬行政法院之權限者，行政法院應以\n    裁定駁回之。」行政訴訟法第2條及第107條第1項第1款分別\n    定有明文。又行政法院係掌理行政訴訟審判事務之司法機關\n    ，至民、刑事訴訟以及公務員瀆職應受懲戒事件，均另有主\n    管機關管轄，不在本院職掌範圍以內，亦有改制前行政法院\n    40年度裁字第2號判例可資參照。\n二、本件原告起訴意旨略謂：桃園縣八德市○○段被徵收之4-72\n    號土地，實係83年9月14日領取發放地價補償，竟被桃園縣\n    政府矇混以80年度每平方公尺18,400元公告現值發給，而剋\n    扣圖利抑留孳息至今。又依土地法第239條及土地法施行法\n    第60條規定，被徵收土地應補償之地價，應依其最後移轉登\n    記之地價補償，被告乙○○蓄意不分交通用地核准時與徵收\n    時之地價，而未依法核發補償費，已涉有不法登載、偽證及\n    詐欺圖利罪嫌，爰依法提起告發等語。\n三、經查，原告告發被告乙○○所犯前揭不法登載、偽證及詐欺\n    圖利等罪，核屬刑事事件，揆諸首揭說明，原告應循刑事訴\n    訟程序向檢察機關提出告訴或告發，行政法院並無審判權，\n    原告提起本件行政訴訟，依法尚有未合，應予駁回。\n四、依行政訴訟法第107條第1項第1款、第104條、民事訴訟法第\n    95條、第78條，裁定如主文。\n中    華    民    國    94    年    11    月   24     日\n                       第四庭審判長法  官  徐瑞晃\n                                   法  官  吳慧娟\n                                   法  官  蕭惠芳\n上為正本係照原本作成。\n如不服本裁定，應於送達後10日內向本院提出抗告狀（須按他造\n人數附繕本）。\n中    華    民    國    94    年    11    月   28     日\n                                   書記官  李淑貞\n",
  "structure": {
    "main": "原告之訴駁回。\n訴訟費用由原告負擔。",
    "reason": "一、按「公法上之爭議，除法律別有規定外，得依本法提起行政\n    訴訟。」「訴訟事件不屬行政法院之權限者，行政法院應以\n    裁定駁回之。」行政訴訟法第2條及第107條第1項第1款分別\n    定有明文。又行政法院係掌理行政訴訟審判事務之司法機關\n    ，至民、刑事訴訟以及公務員瀆職應受懲戒事件，均另有主\n    管機關管轄，不在本院職掌範圍以內，亦有改制前行政法院\n    40年度裁字第2號判例可資參照。\n二、本件原告起訴意旨略謂：桃園縣八德市○○段被徵收之4-72\n    號土地，實係83年9月14日領取發放地價補償，竟被桃園縣\n    政府矇混以80年度每平方公尺18,400元公告現值發給，而剋\n    扣圖利抑留孳息至今。又依土地法第239條及土地法施行法\n    第60條規定，被徵收土地應補償之地價，應依其最後移轉登\n    記之地價補償，被告乙○○蓄意不分交通用地核准時與徵收\n    時之地價，而未依法核發補償費，已涉有不法登載、偽證及\n    詐欺圖利罪嫌，爰依法提起告發等語。\n三、經查，原告告發被告乙○○所犯前揭不法登載、偽證及詐欺\n    圖利等罪，核屬刑事事件，揆諸首揭說明，原告應循刑事訴\n    訟程序向檢察機關提出告訴或告發，行政法院並無審判權，\n    原告提起本件行政訴訟，依法尚有未合，應予駁回。\n四、依行政訴訟法第107條第1項第1款、第104條、民事訴訟法第\n    95條、第78條，裁定如主文。"
  },
  "search": "臺北高等行政法院裁定94年度訴字第03062號原告甲○○上列原告因刑事事件，提起行政訴訟，本院裁定如下：主文原告之訴駁回。訴訟費用由原告負擔。理由一、按「公法上之爭議，除法律別有規定外，得依本法提起行政訴訟。」「訴訟事件不屬行政法院之權限者，行政法院應以裁定駁回之。」行政訴訟法第2條及第107條第1項第1款分別定有明文。又行政法院係掌理行政訴訟審判事務之司法機關，至民、刑事訴訟以及公務員瀆職應受懲戒事件，均另有主管機關管轄，不在本院職掌範圍以內，亦有改制前行政法院40年度裁字第2號判例可資參照。二、本件原告起訴意旨略謂：桃園縣八德市○○段被徵收之4-72號土地，實係83年9月14日領取發放地價補償，竟被桃園縣政府矇混以80年度每平方公尺18,400元公告現值發給，而剋扣圖利抑留孳息至今。又依土地法第239條及土地法施行法第60條規定，被徵收土地應補償之地價，應依其最後移轉登記之地價補償，被告乙○○蓄意不分交通用地核准時與徵收時之地價，而未依法核發補償費，已涉有不法登載、偽證及詐欺圖利罪嫌，爰依法提起告發等語。三、經查，原告告發被告乙○○所犯前揭不法登載、偽證及詐欺圖利等罪，核屬刑事事件，揆諸首揭說明，原告應循刑事訴訟程序向檢察機關提出告訴或告發，行政法院並無審判權，原告提起本件行政訴訟，依法尚有未合，應予駁回。四、依行政訴訟法第107條第1項第1款、第104條、民事訴訟法第95條、第78條，裁定如主文。中華民國94年11月24日第四庭審判長法官徐瑞晃法官吳慧娟法官蕭惠芳上為正本係照原本作成。如不服本裁定，應於送達後10日內向本院提出抗告狀（須按他造人數附繕本）。中華民國94年11月28日書記官李淑貞",
  "characters": {
    "judges": [
      "徐瑞晃",
      "吳慧娟",
      "蕭惠芳"
    ],
    "prosecutors": [

    ],
    "lawyers": [

    ],
    "clerks": [
      "李淑貞"
    ],
    "plaintiffs": [
      "甲"
    ],
    "defendants": [

    ],
    "prosecutor_office": [

    ],
    "creditors": [

    ],
    "debtors": [

    ],
    "judicial_associate_officer": [

    ]
  },
  "adjudged_at": "2005-11-24",
  "created_at": "2016-02-07 01:01:12",
  "updated_at": "2016-02-07 01:01:12"
}