{
  "identify": "MLD-100-監宣-89-20111130-1",
  "court": {
    "name": "臺灣苗栗地方法院",
    "code": "MLD"
  },
  "division": {
    "name": "民事",
    "code": "V"
  },
  "year": 100,
  "word": "監宣",
  "number": "89",
  "jcheck": "1",
  "reason": "監護宣告",
  "content": "臺灣苗栗地方法院民事裁定             100年度監宣字第89號\n聲  請  人  洪文堂\n相  對  人  洪林春\n上列聲請人聲請對相對人為監護宣告事件，本院裁定如下：\n    主  文\n宣告相對人洪林春（民國二十三年一月二十日出生，身分證統一\n編號：Ｚ000000000號）為受監護宣告之人。\n選定聲請人洪文堂（民國五十一年十二月十九日出生，身分證統\n一編號：Ｚ000000000號）為受監護宣告之人之監護人\n。\n指定洪仁祥（民國四十一年七月二十六日出生，身分證統一編號\n：Ｚ000000000號）為會同開具財產清冊之人。\n程序費用新臺幣壹仟元由受監護宣告之人負擔。\n    理  由\n一、按對於因精神障礙或其他心智缺陷，致不能為意思表示或受\n    意思表示，或不能辨識其意思表示之效果者，法院得因本人\n    、配偶、四親等內之親屬、最近一年有同居事實之其他親屬\n    、檢察官、主管機關或社會福利機構之聲請，為監護之宣告\n    ，民法第14條第1 項定有明文。\n二、本件聲請意旨略以：聲請人為相對人之次子，相對人罹患失\n    智症，雖經送醫診治，仍不見起色，目前日常生活事務均無\n    法自理，為此請求宣告相對人為受監護宣告之人等語，並提\n    出戶籍謄本、相對人之中華民國身心障礙手冊等件為證。另\n    經本院於民國100 年11月18日實施鑑定程序，並於鑑定人即\n    財團法人為恭紀念醫院林玉財醫師前訊問相對人；相對人坐\n    輪椅，意識清醒，雖可回話但答非所問，且不認識身旁家人\n    ，有勘驗筆錄在卷可稽。另經鑑定人鑑定結果：相對人已呈\n    嚴重癡呆狀態，需整日有人照顧其日常生活，故目前相對人\n    對一般事物的理解、認知、判斷及自我控制能力極度受損，\n    因此其意思表示、受意思表示及辨識其意思表示效果之能力\n    已達完全不能之程度，其管理與處分財產需人協助等語，此\n    有財團法人為恭紀念醫院簡易精神鑑定報告書1 份在卷可稽\n    。從而，自堪認相對人確已達不能為意思表示或受意思表示\n    之狀態，爰宣告相對人為受監護宣告之人。\n三、又按受監護宣告之人應置監護人。法院為監護之宣告時，應\n    依職權就配偶、四親等內之親屬、最近一年有同居事實之其\n    他親屬、主管機關、社會福利機構或其他適當之人選定一人\n    或數人為監護人，並同時指定會同開具財產清冊之人。法院\n    為前項選定及指定前，得命主管機關或社會福利機構進行訪\n    視，提出調查報告及建議。監護之聲請人或利害關係人亦得\n    提出相關資料或證據，供法院斟酌。法院選定監護人時，應\n    依受監護宣告之人之最佳利益，優先考量受監護宣告之人之\n    意見，審酌一切情狀，並注意下列事項：一、受監護宣告之\n    人之身心狀態與生活及財產狀況。二、受監護宣告之人與其\n    配偶、子女或其他共同生活之人間之情感狀況。三、監護人\n    之職業、經歷、意見及其與受監護宣告之人之利害關係。四\n    、法人為監護人時，其事業之種類與內容，法人及其代表人\n    與受監護宣告之人之利害關係，民法第1110條、第1111條、\n    第1111條之1 分別定有明文。末按監護宣告之裁定，應同時\n    選定監護人及指定會同開具財產清冊之人，並附理由，民事\n    訴訟法第604 條第1 項亦有明文規定。本院審酌相對人之配\n    偶已死亡，相對人育有一女二男，其長女洪梅雀為重度肢障\n    人士，長男洪文正則行蹤不明，此經聲請人提出戶籍謄本、\n    苗栗縣竹南鎮公所函文等件在卷可參，而聲請人為相對人之\n    次子，其有意願擔任相對人之監護人，足認由其擔任相對人\n    之監護人，應可善盡保護相對人權益之責任，爰依前揭規定\n    ，選定聲請人為相對人之監護人。另洪仁祥（41年7 月26\n    日出生，身分證統一編號：Ｚ000000000號）為相對人之姪子\n    ，其有意願擔任會同開具財產清冊之人，並提出戶籍謄本及\n    同意書等件在卷可參，爰依前揭規定，併指定洪仁祥為會同\n    開具財產清冊之人。\n四、依民事訴訟法第608 條第1 項，裁定如主文。\n中    華    民    國    100   年     11   月    30    日\n                  家事法庭    法  官  曾明玉\n以上正本係照原本作成。\n如不服本裁定關於選定監護人及指定會同開具財產清冊之人等部\n分，應於送達後十日內向本院提出抗告狀，並繳納抗告費新臺幣\n壹仟元；其餘關於宣告監護之部分，不得抗告。\n                              書記官  黃惠雯\n中    華    民    國    100   年     11   月    30    日",
  "structure": {
    "main": "宣告相對人洪林春（民國二十三年一月二十日出生，身分證統一\n編號：Ｚ000000000號）為受監護宣告之人。\n選定聲請人洪文堂（民國五十一年十二月十九日出生，身分證統\n一編號：Ｚ000000000號）為受監護宣告之人之監護人\n。\n指定洪仁祥（民國四十一年七月二十六日出生，身分證統一編號\n：Ｚ000000000號）為會同開具財產清冊之人。\n程序費用新臺幣壹仟元由受監護宣告之人負擔。",
    "reason": "一、按對於因精神障礙或其他心智缺陷，致不能為意思表示或受\n    意思表示，或不能辨識其意思表示之效果者，法院得因本人\n    、配偶、四親等內之親屬、最近一年有同居事實之其他親屬\n    、檢察官、主管機關或社會福利機構之聲請，為監護之宣告\n    ，民法第14條第1 項定有明文。\n二、本件聲請意旨略以：聲請人為相對人之次子，相對人罹患失\n    智症，雖經送醫診治，仍不見起色，目前日常生活事務均無\n    法自理，為此請求宣告相對人為受監護宣告之人等語，並提\n    出戶籍謄本、相對人之中華民國身心障礙手冊等件為證。另\n    經本院於民國100 年11月18日實施鑑定程序，並於鑑定人即\n    財團法人為恭紀念醫院林玉財醫師前訊問相對人；相對人坐\n    輪椅，意識清醒，雖可回話但答非所問，且不認識身旁家人\n    ，有勘驗筆錄在卷可稽。另經鑑定人鑑定結果：相對人已呈\n    嚴重癡呆狀態，需整日有人照顧其日常生活，故目前相對人\n    對一般事物的理解、認知、判斷及自我控制能力極度受損，\n    因此其意思表示、受意思表示及辨識其意思表示效果之能力\n    已達完全不能之程度，其管理與處分財產需人協助等語，此\n    有財團法人為恭紀念醫院簡易精神鑑定報告書1 份在卷可稽\n    。從而，自堪認相對人確已達不能為意思表示或受意思表示\n    之狀態，爰宣告相對人為受監護宣告之人。\n三、又按受監護宣告之人應置監護人。法院為監護之宣告時，應\n    依職權就配偶、四親等內之親屬、最近一年有同居事實之其\n    他親屬、主管機關、社會福利機構或其他適當之人選定一人\n    或數人為監護人，並同時指定會同開具財產清冊之人。法院\n    為前項選定及指定前，得命主管機關或社會福利機構進行訪\n    視，提出調查報告及建議。監護之聲請人或利害關係人亦得\n    提出相關資料或證據，供法院斟酌。法院選定監護人時，應\n    依受監護宣告之人之最佳利益，優先考量受監護宣告之人之\n    意見，審酌一切情狀，並注意下列事項：一、受監護宣告之\n    人之身心狀態與生活及財產狀況。二、受監護宣告之人與其\n    配偶、子女或其他共同生活之人間之情感狀況。三、監護人\n    之職業、經歷、意見及其與受監護宣告之人之利害關係。四\n    、法人為監護人時，其事業之種類與內容，法人及其代表人\n    與受監護宣告之人之利害關係，民法第1110條、第1111條、\n    第1111條之1 分別定有明文。末按監護宣告之裁定，應同時\n    選定監護人及指定會同開具財產清冊之人，並附理由，民事\n    訴訟法第604 條第1 項亦有明文規定。本院審酌相對人之配\n    偶已死亡，相對人育有一女二男，其長女洪梅雀為重度肢障\n    人士，長男洪文正則行蹤不明，此經聲請人提出戶籍謄本、\n    苗栗縣竹南鎮公所函文等件在卷可參，而聲請人為相對人之\n    次子，其有意願擔任相對人之監護人，足認由其擔任相對人\n    之監護人，應可善盡保護相對人權益之責任，爰依前揭規定\n    ，選定聲請人為相對人之監護人。另洪仁祥（41年7 月26\n    日出生，身分證統一編號：Ｚ000000000號）為相對人之姪子\n    ，其有意願擔任會同開具財產清冊之人，並提出戶籍謄本及\n    同意書等件在卷可參，爰依前揭規定，併指定洪仁祥為會同\n    開具財產清冊之人。\n四、依民事訴訟法第608 條第1 項，裁定如主文。"
  },
  "search": "臺灣苗栗地方法院民事裁定100年度監宣字第89號聲請人洪文堂相對人洪林春上列聲請人聲請對相對人為監護宣告事件，本院裁定如下：主文宣告相對人洪林春（民國二十三年一月二十日出生，身分證統一編號：Ｚ000000000號）為受監護宣告之人。選定聲請人洪文堂（民國五十一年十二月十九日出生，身分證統一編號：Ｚ000000000號）為受監護宣告之人之監護人。指定洪仁祥（民國四十一年七月二十六日出生，身分證統一編號：Ｚ000000000號）為會同開具財產清冊之人。程序費用新臺幣壹仟元由受監護宣告之人負擔。理由一、按對於因精神障礙或其他心智缺陷，致不能為意思表示或受意思表示，或不能辨識其意思表示之效果者，法院得因本人、配偶、四親等內之親屬、最近一年有同居事實之其他親屬、檢察官、主管機關或社會福利機構之聲請，為監護之宣告，民法第14條第1項定有明文。二、本件聲請意旨略以：聲請人為相對人之次子，相對人罹患失智症，雖經送醫診治，仍不見起色，目前日常生活事務均無法自理，為此請求宣告相對人為受監護宣告之人等語，並提出戶籍謄本、相對人之中華民國身心障礙手冊等件為證。另經本院於民國100年11月18日實施鑑定程序，並於鑑定人即財團法人為恭紀念醫院林玉財醫師前訊問相對人；相對人坐輪椅，意識清醒，雖可回話但答非所問，且不認識身旁家人，有勘驗筆錄在卷可稽。另經鑑定人鑑定結果：相對人已呈嚴重癡呆狀態，需整日有人照顧其日常生活，故目前相對人對一般事物的理解、認知、判斷及自我控制能力極度受損，因此其意思表示、受意思表示及辨識其意思表示效果之能力已達完全不能之程度，其管理與處分財產需人協助等語，此有財團法人為恭紀念醫院簡易精神鑑定報告書1份在卷可稽。從而，自堪認相對人確已達不能為意思表示或受意思表示之狀態，爰宣告相對人為受監護宣告之人。三、又按受監護宣告之人應置監護人。法院為監護之宣告時，應依職權就配偶、四親等內之親屬、最近一年有同居事實之其他親屬、主管機關、社會福利機構或其他適當之人選定一人或數人為監護人，並同時指定會同開具財產清冊之人。法院為前項選定及指定前，得命主管機關或社會福利機構進行訪視，提出調查報告及建議。監護之聲請人或利害關係人亦得提出相關資料或證據，供法院斟酌。法院選定監護人時，應依受監護宣告之人之最佳利益，優先考量受監護宣告之人之意見，審酌一切情狀，並注意下列事項：一、受監護宣告之人之身心狀態與生活及財產狀況。二、受監護宣告之人與其配偶、子女或其他共同生活之人間之情感狀況。三、監護人之職業、經歷、意見及其與受監護宣告之人之利害關係。四、法人為監護人時，其事業之種類與內容，法人及其代表人與受監護宣告之人之利害關係，民法第1110條、第1111條、第1111條之1分別定有明文。末按監護宣告之裁定，應同時選定監護人及指定會同開具財產清冊之人，並附理由，民事訴訟法第604條第1項亦有明文規定。本院審酌相對人之配偶已死亡，相對人育有一女二男，其長女洪梅雀為重度肢障人士，長男洪文正則行蹤不明，此經聲請人提出戶籍謄本、苗栗縣竹南鎮公所函文等件在卷可參，而聲請人為相對人之次子，其有意願擔任相對人之監護人，足認由其擔任相對人之監護人，應可善盡保護相對人權益之責任，爰依前揭規定，選定聲請人為相對人之監護人。另洪仁祥（41年7月26日出生，身分證統一編號：Ｚ000000000號）為相對人之姪子，其有意願擔任會同開具財產清冊之人，並提出戶籍謄本及同意書等件在卷可參，爰依前揭規定，併指定洪仁祥為會同開具財產清冊之人。四、依民事訴訟法第608條第1項，裁定如主文。中華民國100年11月30日家事法庭法官曾明玉以上正本係照原本作成。如不服本裁定關於選定監護人及指定會同開具財產清冊之人等部分，應於送達後十日內向本院提出抗告狀，並繳納抗告費新臺幣壹仟元；其餘關於宣告監護之部分，不得抗告。書記官黃惠雯中華民國100年11月30日",
  "characters": {
    "judges": [
      "曾明玉"
    ],
    "prosecutors": [

    ],
    "lawyers": [

    ],
    "clerks": [
      "黃惠雯"
    ],
    "plaintiffs": [

    ],
    "defendants": [

    ],
    "prosecutor_office": [
      "洪文堂"
    ],
    "creditors": [

    ],
    "debtors": [

    ],
    "judicial_associate_officer": [

    ]
  },
  "adjudged_at": "2011-11-30",
  "created_at": "2016-02-13 01:38:07",
  "updated_at": "2016-02-13 01:38:07"
}