{
  "identify": "TYD-100-審訴-2365-20111130-1",
  "court": {
    "name": "臺灣桃園地方法院",
    "code": "TYD"
  },
  "division": {
    "name": "刑事",
    "code": "M"
  },
  "year": 100,
  "word": "審訴",
  "number": "2365",
  "jcheck": "1",
  "reason": "毒品危害防制條例",
  "content": "臺灣桃園地方法院宣示判決筆錄       100年度審訴字第2365號\n公  訴  人  臺灣桃園地方法院檢察署檢察官\n被      告  吳宗俱\n指定辯護人  本院公設辯護人  彭詩雯\n上列被告因違反毒品危害防制條例案件（起訴案號：100 年度毒\n偵字第4588號），於中華民國100 年11月30日下午5 時，在本院\n第14法庭宣示判決，出席職員如下：\n          法  官    蘇昌澤\n          書記官    石曉芸\n法官起立朗讀判決主文、犯罪事實要旨、處罰條文及告以上訴限\n制、期間並提出上訴狀之法院，且諭知記載其內容：\n一、主  文：\n    吳宗俱施用第一級毒品，處有期徒刑拾月，扣案之第一級毒\n    品海洛因壹包（驗餘淨重零點零柒公克）沒收銷燬之。\n二、犯罪事實要旨：\n    吳宗俱前於民國87年間，因施用毒品案件，經本院以87年度\n    毒聲字第35號裁定送觀察、勒戒後，認有繼續施用毒品傾向\n    ，再經本院以87年度毒聲字第406 號裁定令入戒治處所施以\n    強制戒治，嗣因戒治成效良好，經本院裁定停止戒治並交付\n    保護管束，在88年6 月21日保護管束期滿執行完畢，該次施\n    用毒品犯行，並經臺灣桃園地方法院檢察署檢察官以88年度\n    戒偵字第7 號為不起訴處分確定；復於前開強制戒治執行完\n    畢後5 年內之93年間，因施用毒品案件，經臺灣臺北地方法\n    院以93年度訴字第900 號判決判處應執行有期徒刑1 年2 月\n    確定（於本案不構成累犯）。詎仍基於施用第一級毒品之犯\n    意，於100 年8 月16日中午12時許，在桃園縣大園鄉南港村\n    16鄰許厝港18號之住所內，以注射針筒方式施用第一級毒品\n    海洛因1 次。嗣於同日晚間8 時許，為警在上址查獲，並扣\n    得其所有施用剩餘之第一級毒品海洛因1 包（驗餘淨重0.07\n    3 公克）。\n三、處罰條文：\n    毒品危害防制條例第10條第1 項、第18條第1 項前段。\n四、協商判決除有刑事訴訟法第455 條之4 第1 項第1 款於本訊\n    問程序終結前，被告撤銷協商合意或檢察官撤回協商聲請者\n    ；第2 款被告協商之意思非出於自由意志者；第4 款被告所\n    犯之罪非第455 條之2 第1 項所定得以協商判決者；第6 款\n    被告有其他較重之裁判上一罪之犯罪事實者；第7 款法院認\n    應諭知免刑或免訴、不受理者情形之一，及違反同條第2 項\n    「法院應於協商合意範圍內為判決；法院為協商判決所科之\n    刑，以宣告緩刑或2 年以下有期徒刑、拘役或罰金為限」之\n    規定者外，不得上訴。\n五、如有前項得上訴之情形，得自收受判決送達後10日內，向本\n    院提出上訴書狀，上訴於第二審法院。\n中    華    民    國  100     年    11    月    30    日\n                              刑事庭  法  官  蘇昌澤\n                                      書記官  石曉芸\n以上正本證明與原本無異。\n                                      書記官  石曉芸\n中    華    民    國  100     年    11    月    30    日\n附錄本案論罪科刑依據之法條：\n毒品危害防制條例第10條\n施用第一級毒品者，處6 月以上 5 年以下有期徒刑。\n施用第二級毒品者，處3 年以下有期徒刑。",
  "structure": {
  },
  "search": "臺灣桃園地方法院宣示判決筆錄100年度審訴字第2365號公訴人臺灣桃園地方法院檢察署檢察官被告吳宗俱指定辯護人本院公設辯護人彭詩雯上列被告因違反毒品危害防制條例案件（起訴案號：100年度毒偵字第4588號），於中華民國100年11月30日下午5時，在本院第14法庭宣示判決，出席職員如下：法官蘇昌澤書記官石曉芸法官起立朗讀判決主文、犯罪事實要旨、處罰條文及告以上訴限制、期間並提出上訴狀之法院，且諭知記載其內容：一、主文：吳宗俱施用第一級毒品，處有期徒刑拾月，扣案之第一級毒品海洛因壹包（驗餘淨重零點零柒公克）沒收銷燬之。二、犯罪事實要旨：吳宗俱前於民國87年間，因施用毒品案件，經本院以87年度毒聲字第35號裁定送觀察、勒戒後，認有繼續施用毒品傾向，再經本院以87年度毒聲字第406號裁定令入戒治處所施以強制戒治，嗣因戒治成效良好，經本院裁定停止戒治並交付保護管束，在88年6月21日保護管束期滿執行完畢，該次施用毒品犯行，並經臺灣桃園地方法院檢察署檢察官以88年度戒偵字第7號為不起訴處分確定；復於前開強制戒治執行完畢後5年內之93年間，因施用毒品案件，經臺灣臺北地方法院以93年度訴字第900號判決判處應執行有期徒刑1年2月確定（於本案不構成累犯）。詎仍基於施用第一級毒品之犯意，於100年8月16日中午12時許，在桃園縣大園鄉南港村16鄰許厝港18號之住所內，以注射針筒方式施用第一級毒品海洛因1次。嗣於同日晚間8時許，為警在上址查獲，並扣得其所有施用剩餘之第一級毒品海洛因1包（驗餘淨重0.073公克）。三、處罰條文：毒品危害防制條例第10條第1項、第18條第1項前段。四、協商判決除有刑事訴訟法第455條之4第1項第1款於本訊問程序終結前，被告撤銷協商合意或檢察官撤回協商聲請者；第2款被告協商之意思非出於自由意志者；第4款被告所犯之罪非第455條之2第1項所定得以協商判決者；第6款被告有其他較重之裁判上一罪之犯罪事實者；第7款法院認應諭知免刑或免訴、不受理者情形之一，及違反同條第2項「法院應於協商合意範圍內為判決；法院為協商判決所科之刑，以宣告緩刑或2年以下有期徒刑、拘役或罰金為限」之規定者外，不得上訴。五、如有前項得上訴之情形，得自收受判決送達後10日內，向本院提出上訴書狀，上訴於第二審法院。中華民國100年11月30日刑事庭法官蘇昌澤書記官石曉芸以上正本證明與原本無異。書記官石曉芸中華民國100年11月30日附錄本案論罪科刑依據之法條：毒品危害防制條例第10條施用第一級毒品者，處6月以上5年以下有期徒刑。施用第二級毒品者，處3年以下有期徒刑。",
  "characters": {
    "judges": [
      "蘇昌澤",
      "蘇昌澤"
    ],
    "prosecutors": [

    ],
    "lawyers": [

    ],
    "clerks": [
      "石曉芸",
      "石曉芸",
      "石曉芸"
    ],
    "plaintiffs": [

    ],
    "defendants": [
      "吳宗俱"
    ],
    "prosecutor_office": [
      "臺灣桃園地方法院檢察署檢察官"
    ],
    "creditors": [

    ],
    "debtors": [

    ],
    "judicial_associate_officer": [

    ]
  },
  "adjudged_at": "2011-11-30",
  "created_at": "2016-02-13 01:30:37",
  "updated_at": "2016-02-13 01:30:37"
}