{
  "identify": "TPH-100-聲-862-20110329-1",
  "court": {
    "name": "臺灣高等法院",
    "code": "TPH"
  },
  "division": {
    "name": "刑事",
    "code": "M"
  },
  "year": 100,
  "word": "聲",
  "number": "862",
  "jcheck": "1",
  "reason": "聲請解除限制出境",
  "content": "臺灣高等法院刑事裁定                  100年度聲字第862號\n    聲請人\n    即被告  本間伊都子\n上列聲請人因誣告等案件（本院99年度上訴字第3794號），聲請\n解除限制出境，本院裁定如下：\n    主  文\n聲請駁回。\n    理  由\n一、聲請意旨略以：\n（一）99年3 月11日，日本發生芮氏規模9.0 大地震，聲請人亟\n      需返日探視親人、整理家園，出境實有相當之人道理由，\n      並無逃亡意圖。聲請人本籍台灣，與台灣親友仍保有緊密\n      關係，無逃亡之虞，故無限制出境必要。\n（二）聲請人之前提出之告訴主張並非虛構，是因信賴高雄榮總\n      眼科部會診結果所致。若有不實也屬出於誤會或懷疑，聲\n      請人並無誣告的故意，不構成誣告罪云云。\n二、經查：\n（一）本案經檢察官起訴，歷原審、本院審理，均認定被告觸犯\n      誣告罪及偽證罪，而判處應執行有期徒刑1 年，已詳述論\n      罪的理由，刻正於最高法院審理中。\n（二）被告已歸化日本，具有日本國籍，持日本國護照，在日本\n      有住所，顯見被告有長期境外滯留、維持生活的能力。而\n      限制被告出境目的在於「保全審判程序進行及刑罰執行」\n      ，於本案未確定、執行前，被告極可能於出境後不再回國\n      接受審判或刑的執行。\n（三）日本東北地區於99年3月11日發生芮氏規模9.0大地震，為\n      週知的事實。被告於日本的居住地關西大阪地區，並無嚴\n      重受創災情。被告空言須返日整理家園，顯無必須解除限\n      制出境的急迫性及必要性。因認仍有限制被告出境之必要\n      。\n三、被告仍有限制出境必要，以保全審判之進行與刑罰執行。聲\n    請解除限制出境，為無理由，應予駁回。\n中    華    民    國    100    年    3    月    29    日\n                  刑事第六庭審判長法  官  邱同印\n                                  法  官  吳淑惠\n                                  法  官  郭豫珍\n以上正本證明與原本無異。\n如不服本裁定，應於收受送達後五日內向本院提出抗告狀。\n                                  書記官  陳采薇\n中    華    民    國   100    年    3     月    29    日",
  "structure": {
    "main": "聲請駁回。",
    "reason": "一、聲請意旨略以：\n（一）99年3 月11日，日本發生芮氏規模9.0 大地震，聲請人亟\n      需返日探視親人、整理家園，出境實有相當之人道理由，\n      並無逃亡意圖。聲請人本籍台灣，與台灣親友仍保有緊密\n      關係，無逃亡之虞，故無限制出境必要。\n（二）聲請人之前提出之告訴主張並非虛構，是因信賴高雄榮總\n      眼科部會診結果所致。若有不實也屬出於誤會或懷疑，聲\n      請人並無誣告的故意，不構成誣告罪云云。\n二、經查：\n（一）本案經檢察官起訴，歷原審、本院審理，均認定被告觸犯\n      誣告罪及偽證罪，而判處應執行有期徒刑1 年，已詳述論\n      罪的理由，刻正於最高法院審理中。\n（二）被告已歸化日本，具有日本國籍，持日本國護照，在日本\n      有住所，顯見被告有長期境外滯留、維持生活的能力。而\n      限制被告出境目的在於「保全審判程序進行及刑罰執行」\n      ，於本案未確定、執行前，被告極可能於出境後不再回國\n      接受審判或刑的執行。\n（三）日本東北地區於99年3月11日發生芮氏規模9.0大地震，為\n      週知的事實。被告於日本的居住地關西大阪地區，並無嚴\n      重受創災情。被告空言須返日整理家園，顯無必須解除限\n      制出境的急迫性及必要性。因認仍有限制被告出境之必要\n      。\n三、被告仍有限制出境必要，以保全審判之進行與刑罰執行。聲\n    請解除限制出境，為無理由，應予駁回。"
  },
  "search": "臺灣高等法院刑事裁定100年度聲字第862號聲請人即被告本間伊都子上列聲請人因誣告等案件（本院99年度上訴字第3794號），聲請解除限制出境，本院裁定如下：主文聲請駁回。理由一、聲請意旨略以：（一）99年3月11日，日本發生芮氏規模9.0大地震，聲請人亟需返日探視親人、整理家園，出境實有相當之人道理由，並無逃亡意圖。聲請人本籍台灣，與台灣親友仍保有緊密關係，無逃亡之虞，故無限制出境必要。（二）聲請人之前提出之告訴主張並非虛構，是因信賴高雄榮總眼科部會診結果所致。若有不實也屬出於誤會或懷疑，聲請人並無誣告的故意，不構成誣告罪云云。二、經查：（一）本案經檢察官起訴，歷原審、本院審理，均認定被告觸犯誣告罪及偽證罪，而判處應執行有期徒刑1年，已詳述論罪的理由，刻正於最高法院審理中。（二）被告已歸化日本，具有日本國籍，持日本國護照，在日本有住所，顯見被告有長期境外滯留、維持生活的能力。而限制被告出境目的在於「保全審判程序進行及刑罰執行」，於本案未確定、執行前，被告極可能於出境後不再回國接受審判或刑的執行。（三）日本東北地區於99年3月11日發生芮氏規模9.0大地震，為週知的事實。被告於日本的居住地關西大阪地區，並無嚴重受創災情。被告空言須返日整理家園，顯無必須解除限制出境的急迫性及必要性。因認仍有限制被告出境之必要。三、被告仍有限制出境必要，以保全審判之進行與刑罰執行。聲請解除限制出境，為無理由，應予駁回。中華民國100年3月29日刑事第六庭審判長法官邱同印法官吳淑惠法官郭豫珍以上正本證明與原本無異。如不服本裁定，應於收受送達後五日內向本院提出抗告狀。書記官陳采薇中華民國100年3月29日",
  "characters": {
    "judges": [
      "邱同印",
      "吳淑惠",
      "郭豫珍"
    ],
    "prosecutors": [

    ],
    "lawyers": [

    ],
    "clerks": [
      "陳采薇"
    ],
    "plaintiffs": [

    ],
    "defendants": [

    ],
    "prosecutor_office": [

    ],
    "creditors": [

    ],
    "debtors": [

    ],
    "judicial_associate_officer": [

    ]
  },
  "adjudged_at": "2011-03-29",
  "created_at": "2016-02-13 20:39:07",
  "updated_at": "2016-02-13 20:39:07"
}