{
  "identify": "PTD-94-交簡-212-20050420-1",
  "court": {
    "name": "臺灣屏東地方法院",
    "code": "PTD"
  },
  "division": {
    "name": "刑事",
    "code": "M"
  },
  "year": 94,
  "word": "交簡",
  "number": "212",
  "jcheck": "1",
  "reason": "公共危險",
  "content": "臺灣屏東地方法院刑事簡易判決         94年度交簡字第212號\n聲  請  人  臺灣屏東地方法院檢察署檢察官\n被      告  甲○○  男  55歲.\n上列被告因公共危險案件，經檢察官聲請以簡易判決處刑（94年\n度偵字第1219號），本院判決如下：\n    主  文\n甲○○服用酒類，不能安全駕駛動力交通工具而駕駛，處有期徒\n刑貳月，如易科罰金，以佰元折算壹日。緩刑貳年。\n    事  實  及  理  由\n一、本件犯罪事實、證據及應適用之法條，均引用檢察官聲請簡\n    易判決處刑書之記載（如附件）。\n二、爰審酌被告甲○○明知酒精成分對人之意識能力具有不良影\n    響，酒後駕車對一般往來之公眾及駕駛人自身皆具有高度危\n    險性，既漠視自己安危，尤枉顧公眾安全，且因而肇事，惟\n    犯罪後坦承犯行態度良好，及其犯罪之動機、目的、手段等\n    一切情狀，量處如主文所示之刑，並諭知易科罰金之折算標\n    準，以資懲儆。又被告前受有期徒刑以上刑之宣告，執行完\n    畢後，5 年以內未曾受有期徒刑以上刑之宣告，有臺灣高等\n    法院被告前案紀錄表1 紙附卷可稽，其因一時失慮，致罹刑\n    典，事後已坦承犯行，深具悔意，且已與被害人達成和解並\n    賠償損害，有協議書1 紙在卷足憑，經此刑之宣告後，應知\n    警惕而無再犯之虞，本院因認以暫不執行其刑為當，予以宣\n    告緩刑2 年。\n三、應依刑事訴訟法第449 條第1 項前段、第454 條第2 項，刑\n    法第185 條之3 、第41條第1 項前段、第74條第2 款，罰金\n    罰鍰提高標準條例第2 條，逕以簡易判決處如主文所示之刑\n    。\n中    華    民    國    94    年    4     月    20    日\n                    交通法庭    法  官  林家聖\n以上正本證明與原本無異。\n如不服本判決，得於判決書送達之翌日起十日內，以書狀敘述理\n由，向本庭提出上訴。\n                                書記官  莊正彬\n中    華    民    國    94    年    4     月    20    日\n附錄本判決論罪科刑法條全文\n刑法第185條之3：\n服用毒品、麻醉藥品、酒類或其他相類之物，不能安全駕駛動力\n交通工具而駕駛者，處一年以下有期徒刑、拘役或三萬元以下罰\n金。\n",
  "structure": {
    "fact": "一、本件犯罪事實、證據及應適用之法條，均引用檢察官聲請簡\n    易判決處刑書之記載（如附件）。\n二、爰審酌被告甲○○明知酒精成分對人之意識能力具有不良影\n    響，酒後駕車對一般往來之公眾及駕駛人自身皆具有高度危\n    險性，既漠視自己安危，尤枉顧公眾安全，且因而肇事，惟\n    犯罪後坦承犯行態度良好，及其犯罪之動機、目的、手段等\n    一切情狀，量處如主文所示之刑，並諭知易科罰金之折算標\n    準，以資懲儆。又被告前受有期徒刑以上刑之宣告，執行完\n    畢後，5 年以內未曾受有期徒刑以上刑之宣告，有臺灣高等\n    法院被告前案紀錄表1 紙附卷可稽，其因一時失慮，致罹刑\n    典，事後已坦承犯行，深具悔意，且已與被害人達成和解並\n    賠償損害，有協議書1 紙在卷足憑，經此刑之宣告後，應知\n    警惕而無再犯之虞，本院因認以暫不執行其刑為當，予以宣\n    告緩刑2 年。\n三、應依刑事訴訟法第449 條第1 項前段、第454 條第2 項，刑\n    法第185 條之3 、第41條第1 項前段、第74條第2 款，罰金\n    罰鍰提高標準條例第2 條，逕以簡易判決處如主文所示之刑\n    。"
  },
  "search": "臺灣屏東地方法院刑事簡易判決94年度交簡字第212號聲請人臺灣屏東地方法院檢察署檢察官被告甲○○男55歲.上列被告因公共危險案件，經檢察官聲請以簡易判決處刑（94年度偵字第1219號），本院判決如下：主文甲○○服用酒類，不能安全駕駛動力交通工具而駕駛，處有期徒刑貳月，如易科罰金，以佰元折算壹日。緩刑貳年。事實及理由一、本件犯罪事實、證據及應適用之法條，均引用檢察官聲請簡易判決處刑書之記載（如附件）。二、爰審酌被告甲○○明知酒精成分對人之意識能力具有不良影響，酒後駕車對一般往來之公眾及駕駛人自身皆具有高度危險性，既漠視自己安危，尤枉顧公眾安全，且因而肇事，惟犯罪後坦承犯行態度良好，及其犯罪之動機、目的、手段等一切情狀，量處如主文所示之刑，並諭知易科罰金之折算標準，以資懲儆。又被告前受有期徒刑以上刑之宣告，執行完畢後，5年以內未曾受有期徒刑以上刑之宣告，有臺灣高等法院被告前案紀錄表1紙附卷可稽，其因一時失慮，致罹刑典，事後已坦承犯行，深具悔意，且已與被害人達成和解並賠償損害，有協議書1紙在卷足憑，經此刑之宣告後，應知警惕而無再犯之虞，本院因認以暫不執行其刑為當，予以宣告緩刑2年。三、應依刑事訴訟法第449條第1項前段、第454條第2項，刑法第185條之3、第41條第1項前段、第74條第2款，罰金罰鍰提高標準條例第2條，逕以簡易判決處如主文所示之刑。中華民國94年4月20日交通法庭法官林家聖以上正本證明與原本無異。如不服本判決，得於判決書送達之翌日起十日內，以書狀敘述理由，向本庭提出上訴。書記官莊正彬中華民國94年4月20日附錄本判決論罪科刑法條全文刑法第185條之3：服用毒品、麻醉藥品、酒類或其他相類之物，不能安全駕駛動力交通工具而駕駛者，處一年以下有期徒刑、拘役或三萬元以下罰金。",
  "characters": {
    "judges": [
      "林家聖"
    ],
    "prosecutors": [

    ],
    "lawyers": [

    ],
    "clerks": [
      "莊正彬"
    ],
    "plaintiffs": [

    ],
    "defendants": [
      "甲○○  男  55歲."
    ],
    "prosecutor_office": [
      "臺灣屏東地方法院檢察署檢察官"
    ],
    "creditors": [

    ],
    "debtors": [

    ],
    "judicial_associate_officer": [

    ]
  },
  "adjudged_at": "2005-04-20",
  "created_at": "2016-02-06 19:20:09",
  "updated_at": "2016-02-06 19:20:09"
}