{
  "identify": "TCD-100-訴-2161-20111201-2",
  "court": {
    "name": "臺灣臺中地方法院",
    "code": "TCD"
  },
  "division": {
    "name": "民事",
    "code": "V"
  },
  "year": 100,
  "word": "訴",
  "number": "2161",
  "jcheck": "2",
  "reason": "確認債權不存在",
  "content": "臺灣臺中地方法院民事判決             100年度訴字第2161號\n原      告  鄭裕鍵\n被      告  詹萬\n上列當事人間確認債權不存在事件，本院於民國100年11月17日\n言詞辯論終結，判決如下：\n    主    文\n確認被告就原告所有坐落臺中市○○區○○段第七八九地號土地\n（應有部分四十八分之一），以臺中市豐原地政事務所於民國八\n十二年九月二十四日登記，收件字號民國八十二年豐登字第一三\n八○九○號，為鄭池設定之普通抵押權所擔保之債權新臺幣陸拾\n萬元不存在。\n訴訟費用由被告負擔。\n    事    實\n壹、程序方面：\n一、被告經合法通知，未於最後言詞辯論期日到場，核無民事訴\n    訟法第386條各款所列情形，爰依原告聲請，由其一造辯論\n    而為判決。\n二、按確認之訴非原告有即受確認判決之法律上利益者，不得提\n    起。所謂即受確認判決之法律上利益，係指法律關係之存否\n    不明確，原告主觀上認其在法律上之地位有不安之狀態存在\n    ，且此種不安之狀態，能以確認判決將之除去者而言（最高\n    法院52年臺上字第1240號判例意旨參照）。本件原告主張被\n    告與被繼承人鄭池即原告之祖父間並無任何債權債務關係，\n    然原告所有坐落臺中市○○區○○段第789地號土地（下稱\n    系爭土地；又原告就系爭土地之應有部分為48分之1），竟\n    以被告對鄭池有新臺幣（下同）60萬元之債權（下稱系爭60\n    萬元債權）為由，將系爭土地（鄭池之應有部分為12分之1\n    ）以臺中市豐原地政事務所於民國82年9月24日登記、收件\n    字號82年豐登字第138090號，設定抵押予被告（下稱系爭抵\n    押權），俾擔保系爭60萬元債權，且被告迄今仍未配合原告\n    辦理塗銷系爭抵押權登記，始提起本件訴訟。則系爭抵押權\n    所擔保之系爭60萬元債權是否存在，將致原告就其所有之系\n    爭土地（應有部分為48分之1）私法上地位有受侵害之危險\n    ，且此項不明確得以確認判決予以排除，本件原告自有提起\n    確認訴訟之訴之利益存在，合先敘明。\n貳、實體方面：\n一、原告起訴主張：系爭土地原為原告之祖父即被繼承人鄭池（\n    已於84年4月25日死亡）所有（應有部分為12分之1），鄭池\n    死亡後，原告之父即被繼承人鄭秋敏（嗣於100年1月29 日\n    死亡）因繼承而為系爭土地之所有權人（應有部分為48分之\n    1），嗣鄭秋敏死亡後，原告再因繼承而為系爭土地之所有\n    權人（應有部分為48分之1）。然原告就系爭土地辦理繼承\n    登記時，赫然發現鄭池與被告簽立抵押權設定契約書，將系\n    爭土地（應有部分12分之1）設定抵押權予被告，以擔保被\n    告對鄭池之系爭60萬元債權，原告經詢及家族中人，均稱鄭\n    池與被告間並無任何債權債務關係存在，且被告亦曾向原告\n    表示其不知有設定系爭抵押權登記及系爭60萬元債權之情事\n    ，然被告迄今仍未配合原告辦理塗銷系爭抵押權登記，為此\n    ，提起本件確認訴訟等語。並聲明：如主文所示。\n二、被告未於最後言詞辯論期日到場，其先前之聲明及陳述則以\n    ：我曾經因為辦理其他土地之設定扺押權登記，而將我的印\n    章及證件放在代書那邊，我不清楚我為何會成為系爭土地的\n    抵押權人，我與鄭池間亦無金錢往來關係，原告提起本件訴\n    訟前，希望我能同意塗銷系爭抵押權登記，但我並未持有系\n    爭抵押權設定之契約書等相關資料，故無從配合辦理等語。\n    並聲明：駁回原告之訴。\n三、得心證之理由：原告主張之前開事實，業據原告提出系爭土\n    地之土地所有權狀、土地登記謄本、系爭抵押權設定之契約\n    書、申請書、被繼承人鄭池、鄭秋敏之戶籍謄本及繼承系統\n    表為證，並有臺中市豐原地政事務所100年11月2日號復本院\n    函併附系爭抵押權設定登記及前開繼承登記等相關資料影本\n    在卷可稽。再參以被告自陳其與鄭池間並無金錢往來關係，\n    其亦不知為何會設定系爭抵押權等語，則原告之前開主張，\n    自堪信為真實。從而，本件原告請求確認系爭抵押權所擔保\n    之系爭60萬元債權不存在，為有理由，應予准許。\n參、訴訟費用負擔之依據：民事訴訟法第78條。\n中    華    民    國   100    年    12    月    1     日\n                  民事第一庭    法  官  何世全\n上正本係照原本作成。\n如對本判決上訴，須於判決送達後20日內向本院提出上訴狀。如\n委任律師提起上訴者，應一併繳納上訴審裁判費。\n提起上訴，應以上訴狀表明(一)對於第一審判決不服之程度，及\n應如何廢棄或變更之聲明，(二)上訴理由（民事訴訟法第441條\n第1項第3款、第4款），提出於第一審法院。\n中    華    民    國   100    年    12    月    1     日\n                                書記官  賴亮蓉",
  "structure": {
    "main": "確認被告就原告所有坐落臺中市○○區○○段第七八九地號土地\n（應有部分四十八分之一），以臺中市豐原地政事務所於民國八\n十二年九月二十四日登記，收件字號民國八十二年豐登字第一三\n八○九○號，為鄭池設定之普通抵押權所擔保之債權新臺幣陸拾\n萬元不存在。\n訴訟費用由被告負擔。",
    "fact": "壹、程序方面：\n一、被告經合法通知，未於最後言詞辯論期日到場，核無民事訴\n    訟法第386條各款所列情形，爰依原告聲請，由其一造辯論\n    而為判決。\n二、按確認之訴非原告有即受確認判決之法律上利益者，不得提\n    起。所謂即受確認判決之法律上利益，係指法律關係之存否\n    不明確，原告主觀上認其在法律上之地位有不安之狀態存在\n    ，且此種不安之狀態，能以確認判決將之除去者而言（最高\n    法院52年臺上字第1240號判例意旨參照）。本件原告主張被\n    告與被繼承人鄭池即原告之祖父間並無任何債權債務關係，\n    然原告所有坐落臺中市○○區○○段第789地號土地（下稱\n    系爭土地；又原告就系爭土地之應有部分為48分之1），竟\n    以被告對鄭池有新臺幣（下同）60萬元之債權（下稱系爭60\n    萬元債權）為由，將系爭土地（鄭池之應有部分為12分之1\n    ）以臺中市豐原地政事務所於民國82年9月24日登記、收件\n    字號82年豐登字第138090號，設定抵押予被告（下稱系爭抵\n    押權），俾擔保系爭60萬元債權，且被告迄今仍未配合原告\n    辦理塗銷系爭抵押權登記，始提起本件訴訟。則系爭抵押權\n    所擔保之系爭60萬元債權是否存在，將致原告就其所有之系\n    爭土地（應有部分為48分之1）私法上地位有受侵害之危險\n    ，且此項不明確得以確認判決予以排除，本件原告自有提起\n    確認訴訟之訴之利益存在，合先敘明。\n貳、實體方面：\n一、原告起訴主張：系爭土地原為原告之祖父即被繼承人鄭池（\n    已於84年4月25日死亡）所有（應有部分為12分之1），鄭池\n    死亡後，原告之父即被繼承人鄭秋敏（嗣於100年1月29 日\n    死亡）因繼承而為系爭土地之所有權人（應有部分為48分之\n    1），嗣鄭秋敏死亡後，原告再因繼承而為系爭土地之所有\n    權人（應有部分為48分之1）。然原告就系爭土地辦理繼承\n    登記時，赫然發現鄭池與被告簽立抵押權設定契約書，將系\n    爭土地（應有部分12分之1）設定抵押權予被告，以擔保被\n    告對鄭池之系爭60萬元債權，原告經詢及家族中人，均稱鄭\n    池與被告間並無任何債權債務關係存在，且被告亦曾向原告\n    表示其不知有設定系爭抵押權登記及系爭60萬元債權之情事\n    ，然被告迄今仍未配合原告辦理塗銷系爭抵押權登記，為此\n    ，提起本件確認訴訟等語。並聲明：如主文所示。\n二、被告未於最後言詞辯論期日到場，其先前之聲明及陳述則以\n    ：我曾經因為辦理其他土地之設定扺押權登記，而將我的印\n    章及證件放在代書那邊，我不清楚我為何會成為系爭土地的\n    抵押權人，我與鄭池間亦無金錢往來關係，原告提起本件訴\n    訟前，希望我能同意塗銷系爭抵押權登記，但我並未持有系\n    爭抵押權設定之契約書等相關資料，故無從配合辦理等語。\n    並聲明：駁回原告之訴。\n三、得心證之理由：原告主張之前開事實，業據原告提出系爭土\n    地之土地所有權狀、土地登記謄本、系爭抵押權設定之契約\n    書、申請書、被繼承人鄭池、鄭秋敏之戶籍謄本及繼承系統\n    表為證，並有臺中市豐原地政事務所100年11月2日號復本院\n    函併附系爭抵押權設定登記及前開繼承登記等相關資料影本\n    在卷可稽。再參以被告自陳其與鄭池間並無金錢往來關係，\n    其亦不知為何會設定系爭抵押權等語，則原告之前開主張，\n    自堪信為真實。從而，本件原告請求確認系爭抵押權所擔保\n    之系爭60萬元債權不存在，為有理由，應予准許。\n參、訴訟費用負擔之依據：民事訴訟法第78條。"
  },
  "search": "臺灣臺中地方法院民事判決100年度訴字第2161號原告鄭裕鍵被告詹萬上列當事人間確認債權不存在事件，本院於民國100年11月17日言詞辯論終結，判決如下：主文確認被告就原告所有坐落臺中市○○區○○段第七八九地號土地（應有部分四十八分之一），以臺中市豐原地政事務所於民國八十二年九月二十四日登記，收件字號民國八十二年豐登字第一三八○九○號，為鄭池設定之普通抵押權所擔保之債權新臺幣陸拾萬元不存在。訴訟費用由被告負擔。事實壹、程序方面：一、被告經合法通知，未於最後言詞辯論期日到場，核無民事訴訟法第386條各款所列情形，爰依原告聲請，由其一造辯論而為判決。二、按確認之訴非原告有即受確認判決之法律上利益者，不得提起。所謂即受確認判決之法律上利益，係指法律關係之存否不明確，原告主觀上認其在法律上之地位有不安之狀態存在，且此種不安之狀態，能以確認判決將之除去者而言（最高法院52年臺上字第1240號判例意旨參照）。本件原告主張被告與被繼承人鄭池即原告之祖父間並無任何債權債務關係，然原告所有坐落臺中市○○區○○段第789地號土地（下稱系爭土地；又原告就系爭土地之應有部分為48分之1），竟以被告對鄭池有新臺幣（下同）60萬元之債權（下稱系爭60萬元債權）為由，將系爭土地（鄭池之應有部分為12分之1）以臺中市豐原地政事務所於民國82年9月24日登記、收件字號82年豐登字第138090號，設定抵押予被告（下稱系爭抵押權），俾擔保系爭60萬元債權，且被告迄今仍未配合原告辦理塗銷系爭抵押權登記，始提起本件訴訟。則系爭抵押權所擔保之系爭60萬元債權是否存在，將致原告就其所有之系爭土地（應有部分為48分之1）私法上地位有受侵害之危險，且此項不明確得以確認判決予以排除，本件原告自有提起確認訴訟之訴之利益存在，合先敘明。貳、實體方面：一、原告起訴主張：系爭土地原為原告之祖父即被繼承人鄭池（已於84年4月25日死亡）所有（應有部分為12分之1），鄭池死亡後，原告之父即被繼承人鄭秋敏（嗣於100年1月29日死亡）因繼承而為系爭土地之所有權人（應有部分為48分之1），嗣鄭秋敏死亡後，原告再因繼承而為系爭土地之所有權人（應有部分為48分之1）。然原告就系爭土地辦理繼承登記時，赫然發現鄭池與被告簽立抵押權設定契約書，將系爭土地（應有部分12分之1）設定抵押權予被告，以擔保被告對鄭池之系爭60萬元債權，原告經詢及家族中人，均稱鄭池與被告間並無任何債權債務關係存在，且被告亦曾向原告表示其不知有設定系爭抵押權登記及系爭60萬元債權之情事，然被告迄今仍未配合原告辦理塗銷系爭抵押權登記，為此，提起本件確認訴訟等語。並聲明：如主文所示。二、被告未於最後言詞辯論期日到場，其先前之聲明及陳述則以：我曾經因為辦理其他土地之設定扺押權登記，而將我的印章及證件放在代書那邊，我不清楚我為何會成為系爭土地的抵押權人，我與鄭池間亦無金錢往來關係，原告提起本件訴訟前，希望我能同意塗銷系爭抵押權登記，但我並未持有系爭抵押權設定之契約書等相關資料，故無從配合辦理等語。並聲明：駁回原告之訴。三、得心證之理由：原告主張之前開事實，業據原告提出系爭土地之土地所有權狀、土地登記謄本、系爭抵押權設定之契約書、申請書、被繼承人鄭池、鄭秋敏之戶籍謄本及繼承系統表為證，並有臺中市豐原地政事務所100年11月2日號復本院函併附系爭抵押權設定登記及前開繼承登記等相關資料影本在卷可稽。再參以被告自陳其與鄭池間並無金錢往來關係，其亦不知為何會設定系爭抵押權等語，則原告之前開主張，自堪信為真實。從而，本件原告請求確認系爭抵押權所擔保之系爭60萬元債權不存在，為有理由，應予准許。參、訴訟費用負擔之依據：民事訴訟法第78條。中華民國100年12月1日民事第一庭法官何世全上正本係照原本作成。如對本判決上訴，須於判決送達後20日內向本院提出上訴狀。如委任律師提起上訴者，應一併繳納上訴審裁判費。提起上訴，應以上訴狀表明(一)對於第一審判決不服之程度，及應如何廢棄或變更之聲明，(二)上訴理由（民事訴訟法第441條第1項第3款、第4款），提出於第一審法院。中華民國100年12月1日書記官賴亮蓉",
  "characters": {
    "judges": [
      "何世全"
    ],
    "prosecutors": [

    ],
    "lawyers": [
      "委任"
    ],
    "clerks": [

    ],
    "plaintiffs": [
      "鄭裕鍵"
    ],
    "defendants": [
      "詹萬"
    ],
    "prosecutor_office": [

    ],
    "creditors": [

    ],
    "debtors": [

    ],
    "judicial_associate_officer": [

    ]
  },
  "adjudged_at": "2011-12-01",
  "created_at": "2016-02-13 12:18:07",
  "updated_at": "2016-02-13 12:18:07"
}