{
  "identify": "KSD-100-司家他-59-20110630-1",
  "court": {
    "name": "臺灣高雄地方法院",
    "code": "KSD"
  },
  "division": {
    "name": "民事",
    "code": "V"
  },
  "year": 100,
  "word": "司家他",
  "number": "59",
  "jcheck": "1",
  "reason": "依職權確定訴訟費用額",
  "content": "臺灣高雄地方法院民事裁定           100年度司家他字第59號\n原      告  董柏源\n法定代理人  董睿蘋\n被      告  吳自由\n上列當事人間請求確認親子關係存在事件（本院99年度親字第24\n號），聲請人經本院98年度家救字第184 號准予訴訟救助，因訴\n訟已終結，本院依職權確定訴訟費用額，裁定如下：\n    主  文\n被告應向本院繳納之訴訟費用額確定為新臺幣仟元，及自本裁\n定送達被告之翌日起至清償日止，按週年利率百分之五計算之利\n息。\n    理  由\n一、按經准予訴訟救助者，於終局判決確定或訴訟不經裁判而終\n    結後，第一審受訴法院應依職權以裁定確定訴訟費用額，向\n    應負擔訴訟費用之當事人徵收之。民事訴訟法第114 條第1\n    項前段定有明文；又同法第91條第3 項規定，法院依聲請以\n    裁定確定之訴訟費用額，應於裁定送達翌日起，加給按法定\n    利率計算之利息，其立法理由旨在促使當時人早日自動償付\n    其應賠償對造之訴訟費用，故在當事人無力支付訴訟費用時\n    ，雖由國庫暫時墊付，然依法院前揭民事訴訟法第114 條第\n    1 項規定，依職權裁定確定訴訟費用額，同屬確定訴訟費用\n    額之程序，亦應基於同一理由而類推適用同法第91條第3 項\n    規定加計法定遲延利息（參考臺灣高等法院暨所屬法院94年\n    度法律座談會民事類提案34號問題二、三討論結果）。\n二、經查，本院99年度親字第24號請求確認親子關係存在事件，\n    原告聲明確認兩造間父子關係存在，係因非財產權事件起訴\n    ，應徵裁判費新臺幣3,000 元，原告並聲請本院98年度家救\n    字第184 號准予訴訟救助確定在案；另該請求確認親子關係\n    存在事件，於民國99年12月21日經本院以99年度親字第24號\n    民事判決，諭知訴訟費用應由被告負擔，又被告吳自由提起\n    上訴，嗣經臺灣高等法院高雄分院於100 年4 月29日以100\n    年度家上字第9 號判決上訴駁回，並於100 年5 月30日判決\n    確定在案等情，業據本院依職權調取上開卷宗核閱屬實，爰\n    依職權確定被告應向本院繳納之訴訟費用額及其法定遲延利\n    息如主文所示。\n三、依民事訴訟法第114 條第1 項前段，裁定如主文。\n四、如不服本裁定，應於裁定送達後10日內，以書狀向本院司法\n    事務官提出異議。\n中    華    民    國    100    年    6    月    30    日\n                  家事法庭  司法事務官  宋佳蓁",
  "structure": {
    "main": "被告應向本院繳納之訴訟費用額確定為新臺幣仟元，及自本裁\n定送達被告之翌日起至清償日止，按週年利率百分之五計算之利\n息。",
    "reason": "一、按經准予訴訟救助者，於終局判決確定或訴訟不經裁判而終\n    結後，第一審受訴法院應依職權以裁定確定訴訟費用額，向\n    應負擔訴訟費用之當事人徵收之。民事訴訟法第114 條第1\n    項前段定有明文；又同法第91條第3 項規定，法院依聲請以\n    裁定確定之訴訟費用額，應於裁定送達翌日起，加給按法定\n    利率計算之利息，其立法理由旨在促使當時人早日自動償付\n    其應賠償對造之訴訟費用，故在當事人無力支付訴訟費用時\n    ，雖由國庫暫時墊付，然依法院前揭民事訴訟法第114 條第\n    1 項規定，依職權裁定確定訴訟費用額，同屬確定訴訟費用\n    額之程序，亦應基於同一理由而類推適用同法第91條第3 項\n    規定加計法定遲延利息（參考臺灣高等法院暨所屬法院94年\n    度法律座談會民事類提案34號問題二、三討論結果）。\n二、經查，本院99年度親字第24號請求確認親子關係存在事件，\n    原告聲明確認兩造間父子關係存在，係因非財產權事件起訴\n    ，應徵裁判費新臺幣3,000 元，原告並聲請本院98年度家救\n    字第184 號准予訴訟救助確定在案；另該請求確認親子關係\n    存在事件，於民國99年12月21日經本院以99年度親字第24號\n    民事判決，諭知訴訟費用應由被告負擔，又被告吳自由提起\n    上訴，嗣經臺灣高等法院高雄分院於100 年4 月29日以100\n    年度家上字第9 號判決上訴駁回，並於100 年5 月30日判決\n    確定在案等情，業據本院依職權調取上開卷宗核閱屬實，爰\n    依職權確定被告應向本院繳納之訴訟費用額及其法定遲延利\n    息如主文所示。\n三、依民事訴訟法第114 條第1 項前段，裁定如主文。\n四、如不服本裁定，應於裁定送達後10日內，以書狀向本院司法\n    事務官提出異議。"
  },
  "search": "臺灣高雄地方法院民事裁定100年度司家他字第59號原告董柏源法定代理人董睿蘋被告吳自由上列當事人間請求確認親子關係存在事件（本院99年度親字第24號），聲請人經本院98年度家救字第184號准予訴訟救助，因訴訟已終結，本院依職權確定訴訟費用額，裁定如下：主文被告應向本院繳納之訴訟費用額確定為新臺幣仟元，及自本裁定送達被告之翌日起至清償日止，按週年利率百分之五計算之利息。理由一、按經准予訴訟救助者，於終局判決確定或訴訟不經裁判而終結後，第一審受訴法院應依職權以裁定確定訴訟費用額，向應負擔訴訟費用之當事人徵收之。民事訴訟法第114條第1項前段定有明文；又同法第91條第3項規定，法院依聲請以裁定確定之訴訟費用額，應於裁定送達翌日起，加給按法定利率計算之利息，其立法理由旨在促使當時人早日自動償付其應賠償對造之訴訟費用，故在當事人無力支付訴訟費用時，雖由國庫暫時墊付，然依法院前揭民事訴訟法第114條第1項規定，依職權裁定確定訴訟費用額，同屬確定訴訟費用額之程序，亦應基於同一理由而類推適用同法第91條第3項規定加計法定遲延利息（參考臺灣高等法院暨所屬法院94年度法律座談會民事類提案34號問題二、三討論結果）。二、經查，本院99年度親字第24號請求確認親子關係存在事件，原告聲明確認兩造間父子關係存在，係因非財產權事件起訴，應徵裁判費新臺幣3,000元，原告並聲請本院98年度家救字第184號准予訴訟救助確定在案；另該請求確認親子關係存在事件，於民國99年12月21日經本院以99年度親字第24號民事判決，諭知訴訟費用應由被告負擔，又被告吳自由提起上訴，嗣經臺灣高等法院高雄分院於100年4月29日以100年度家上字第9號判決上訴駁回，並於100年5月30日判決確定在案等情，業據本院依職權調取上開卷宗核閱屬實，爰依職權確定被告應向本院繳納之訴訟費用額及其法定遲延利息如主文所示。三、依民事訴訟法第114條第1項前段，裁定如主文。四、如不服本裁定，應於裁定送達後10日內，以書狀向本院司法事務官提出異議。中華民國100年6月30日家事法庭司法事務官宋佳蓁",
  "characters": {
    "judges": [

    ],
    "prosecutors": [

    ],
    "lawyers": [

    ],
    "clerks": [

    ],
    "plaintiffs": [
      "董柏源"
    ],
    "defendants": [
      "吳自由"
    ],
    "prosecutor_office": [

    ],
    "creditors": [

    ],
    "debtors": [

    ],
    "judicial_associate_officer": [
      "宋佳蓁"
    ]
  },
  "adjudged_at": "2011-06-30",
  "created_at": "2016-02-13 18:13:28",
  "updated_at": "2016-02-13 18:13:28"
}