{
  "identify": "TND-94-自-45-20050825-1",
  "court": {
    "name": "臺灣臺南地方法院",
    "code": "TND"
  },
  "division": {
    "name": "刑事",
    "code": "M"
  },
  "year": 94,
  "word": "自",
  "number": "45",
  "jcheck": "1",
  "reason": "妨害自由",
  "content": "臺灣臺南地方法院刑事裁定                94年度自字第45號\n自  訴  人  乙○○\n被      告  甲○○\n上列被告因妨害自由案件，經自訴人提起自訴，本院裁定如下：\n    主  文\n自訴駁回。\n    理  由\n一、本件自訴意旨略稱：被告甲○○多年來將機車停放在自訴人\n    乙○○所有坐落臺南市○○○街23巷36號房屋之車庫前，阻\n    擋自訴人汽車出入之行動自由，每遇下雨天或颱風天均需淋\n    著雨去移動被告機車，經自訴人多次好言相勸，被告均置之\n    不理，更有變本加利之趨勢。自訴人於94年7月26日以存證\n    信函要求被告將機車停放適當處所，以免妨害自訴人汽車出\n    入之行動自由。詎被告仍未改善，接且故意將花盆往外，致\n    使巷道出入空間更小。西賢五街23巷為公共用地之巷道，非\n    被告所能支配，被告非法故意阻擋，使自訴人之行動自由遭\n    受侵害，所為顯涉有刑法第三百零二條之剝奪他人行動自由\n    之罪嫌。\n二、按法院或受命法官於自訴案件第一次審判期日前訊問及調查\n    結果，如認為案件有刑事訴訟法第252條至第254條之情形者\n    ，得以裁定駁回其自訴，同法第326條第3項定有明文。\n三、經查：\n（一）刑法第三百零二條第一項私行拘禁罪之「私行拘禁或以其\n      他非法之方法，剝奪人之行動自由」係指無正當理由而拘\n      束他人行動自由，使其處於特定之空間場所而難以任意離\n      去，如無故將人鎖禁於屋內之情形。至於刑法第三百零四\n      條之強制罪則以「強暴或脅迫之手段」，使人行「無義務\n      之事」或「妨害人行使權利」為要件。二罪均涉及妨害他\n      人之人身自由，惟行為的手法及造成妨害他人自由之程度\n      有所不同。\n（二）自訴人指被告任意將其機車停放在其汽車出入之巷道口，\n      造成其汽車出入不便，幾經勸導並未改善，即謂其行動自\n      由遭被告剝奪，遂自訴被告涉有妨害自由罪嫌。本院認為\n      被告雖將機車停放在自訴人汽車出入之巷道口，惟自訴人\n      如未使用汽車時，仍可自由進出自己家門，且在家或外出\n      ，均可自行決定，其個人仍保有充分之行動自由，足認自\n      訴人之人身自由，並未因此受有拘束。自訴人謂其行動自\n      由遭被告剝奪云云，與前揭刑法私行拘禁罪之要件未合，\n      尚難採憑。至於被告將機車停放在自訴人汽車出入之巷道\n      ，被告單純停放機車之動作，與刑法上對他人施以不法腕\n      力之「強暴」或以言語或動作鉗制他人意思自主空間之「\n      脅迫」概念均不相當，自難論究被告有何以強暴、脅迫妨\n      害人行使權利之強制罪責。\n（三）自訴人所指被告停放機車之巷道，如係禁止停放車輛之處\n      所，被告違規停放，自訴人自可依交通相關法規提出檢舉\n      或報請拖吊；如該巷道非禁止車輛停放處所，自訴人既可\n      將汽車停放在道巷盡頭處之自家門口，被告在圍牆外停放\n      機車，亦難指為違法。被告在巷道內放機車之行為，顯與\n      刑法第三百零二條之私行拘禁罪及三百零四條之強制罪要\n      件未合，實難對被告論以該二條罪之罪責。被告停放機車\n      之行為，有無違規尚待究明，縱有違規，亦屬行政違規，\n      均與刑責無涉。\n四、本件自訴人自訴人內容，本院認為被告犯罪嫌疑不足，合於\n    刑事訴訟法第252條第10款之情形，爰依同法第326條第3項\n    規駁回本件自訴。\n據上論結，應依刑事訴訟法第326條第3項、第252條第10裁定如\n主文。\n中    華    民    國    94    年    8     月    25    日\n                  刑事第二庭    法  官  陳振謙\n以上正本證明與原本無異。\n如不服本裁定，應於收受送達後5日內向本院提出抗告狀。（應\n附繕本）\n                                書記官  黃雅雲\n中    華    民    國    94    年    8    月     25    日\n",
  "structure": {
    "main": "自訴駁回。",
    "reason": "一、本件自訴意旨略稱：被告甲○○多年來將機車停放在自訴人\n    乙○○所有坐落臺南市○○○街23巷36號房屋之車庫前，阻\n    擋自訴人汽車出入之行動自由，每遇下雨天或颱風天均需淋\n    著雨去移動被告機車，經自訴人多次好言相勸，被告均置之\n    不理，更有變本加利之趨勢。自訴人於94年7月26日以存證\n    信函要求被告將機車停放適當處所，以免妨害自訴人汽車出\n    入之行動自由。詎被告仍未改善，接且故意將花盆往外，致\n    使巷道出入空間更小。西賢五街23巷為公共用地之巷道，非\n    被告所能支配，被告非法故意阻擋，使自訴人之行動自由遭\n    受侵害，所為顯涉有刑法第三百零二條之剝奪他人行動自由\n    之罪嫌。\n二、按法院或受命法官於自訴案件第一次審判期日前訊問及調查\n    結果，如認為案件有刑事訴訟法第252條至第254條之情形者\n    ，得以裁定駁回其自訴，同法第326條第3項定有明文。\n三、經查：\n（一）刑法第三百零二條第一項私行拘禁罪之「私行拘禁或以其\n      他非法之方法，剝奪人之行動自由」係指無正當理由而拘\n      束他人行動自由，使其處於特定之空間場所而難以任意離\n      去，如無故將人鎖禁於屋內之情形。至於刑法第三百零四\n      條之強制罪則以「強暴或脅迫之手段」，使人行「無義務\n      之事」或「妨害人行使權利」為要件。二罪均涉及妨害他\n      人之人身自由，惟行為的手法及造成妨害他人自由之程度\n      有所不同。\n（二）自訴人指被告任意將其機車停放在其汽車出入之巷道口，\n      造成其汽車出入不便，幾經勸導並未改善，即謂其行動自\n      由遭被告剝奪，遂自訴被告涉有妨害自由罪嫌。本院認為\n      被告雖將機車停放在自訴人汽車出入之巷道口，惟自訴人\n      如未使用汽車時，仍可自由進出自己家門，且在家或外出\n      ，均可自行決定，其個人仍保有充分之行動自由，足認自\n      訴人之人身自由，並未因此受有拘束。自訴人謂其行動自\n      由遭被告剝奪云云，與前揭刑法私行拘禁罪之要件未合，\n      尚難採憑。至於被告將機車停放在自訴人汽車出入之巷道\n      ，被告單純停放機車之動作，與刑法上對他人施以不法腕\n      力之「強暴」或以言語或動作鉗制他人意思自主空間之「\n      脅迫」概念均不相當，自難論究被告有何以強暴、脅迫妨\n      害人行使權利之強制罪責。\n（三）自訴人所指被告停放機車之巷道，如係禁止停放車輛之處\n      所，被告違規停放，自訴人自可依交通相關法規提出檢舉\n      或報請拖吊；如該巷道非禁止車輛停放處所，自訴人既可\n      將汽車停放在道巷盡頭處之自家門口，被告在圍牆外停放\n      機車，亦難指為違法。被告在巷道內放機車之行為，顯與\n      刑法第三百零二條之私行拘禁罪及三百零四條之強制罪要\n      件未合，實難對被告論以該二條罪之罪責。被告停放機車\n      之行為，有無違規尚待究明，縱有違規，亦屬行政違規，\n      均與刑責無涉。\n四、本件自訴人自訴人內容，本院認為被告犯罪嫌疑不足，合於\n    刑事訴訟法第252條第10款之情形，爰依同法第326條第3項\n    規駁回本件自訴。\n據上論結，應依刑事訴訟法第326條第3項、第252條第10裁定如\n主文。"
  },
  "search": "臺灣臺南地方法院刑事裁定94年度自字第45號自訴人乙○○被告甲○○上列被告因妨害自由案件，經自訴人提起自訴，本院裁定如下：主文自訴駁回。理由一、本件自訴意旨略稱：被告甲○○多年來將機車停放在自訴人乙○○所有坐落臺南市○○○街23巷36號房屋之車庫前，阻擋自訴人汽車出入之行動自由，每遇下雨天或颱風天均需淋著雨去移動被告機車，經自訴人多次好言相勸，被告均置之不理，更有變本加利之趨勢。自訴人於94年7月26日以存證信函要求被告將機車停放適當處所，以免妨害自訴人汽車出入之行動自由。詎被告仍未改善，接且故意將花盆往外，致使巷道出入空間更小。西賢五街23巷為公共用地之巷道，非被告所能支配，被告非法故意阻擋，使自訴人之行動自由遭受侵害，所為顯涉有刑法第三百零二條之剝奪他人行動自由之罪嫌。二、按法院或受命法官於自訴案件第一次審判期日前訊問及調查結果，如認為案件有刑事訴訟法第252條至第254條之情形者，得以裁定駁回其自訴，同法第326條第3項定有明文。三、經查：（一）刑法第三百零二條第一項私行拘禁罪之「私行拘禁或以其他非法之方法，剝奪人之行動自由」係指無正當理由而拘束他人行動自由，使其處於特定之空間場所而難以任意離去，如無故將人鎖禁於屋內之情形。至於刑法第三百零四條之強制罪則以「強暴或脅迫之手段」，使人行「無義務之事」或「妨害人行使權利」為要件。二罪均涉及妨害他人之人身自由，惟行為的手法及造成妨害他人自由之程度有所不同。（二）自訴人指被告任意將其機車停放在其汽車出入之巷道口，造成其汽車出入不便，幾經勸導並未改善，即謂其行動自由遭被告剝奪，遂自訴被告涉有妨害自由罪嫌。本院認為被告雖將機車停放在自訴人汽車出入之巷道口，惟自訴人如未使用汽車時，仍可自由進出自己家門，且在家或外出，均可自行決定，其個人仍保有充分之行動自由，足認自訴人之人身自由，並未因此受有拘束。自訴人謂其行動自由遭被告剝奪云云，與前揭刑法私行拘禁罪之要件未合，尚難採憑。至於被告將機車停放在自訴人汽車出入之巷道，被告單純停放機車之動作，與刑法上對他人施以不法腕力之「強暴」或以言語或動作鉗制他人意思自主空間之「脅迫」概念均不相當，自難論究被告有何以強暴、脅迫妨害人行使權利之強制罪責。（三）自訴人所指被告停放機車之巷道，如係禁止停放車輛之處所，被告違規停放，自訴人自可依交通相關法規提出檢舉或報請拖吊；如該巷道非禁止車輛停放處所，自訴人既可將汽車停放在道巷盡頭處之自家門口，被告在圍牆外停放機車，亦難指為違法。被告在巷道內放機車之行為，顯與刑法第三百零二條之私行拘禁罪及三百零四條之強制罪要件未合，實難對被告論以該二條罪之罪責。被告停放機車之行為，有無違規尚待究明，縱有違規，亦屬行政違規，均與刑責無涉。四、本件自訴人自訴人內容，本院認為被告犯罪嫌疑不足，合於刑事訴訟法第252條第10款之情形，爰依同法第326條第3項規駁回本件自訴。據上論結，應依刑事訴訟法第326條第3項、第252條第10裁定如主文。中華民國94年8月25日刑事第二庭法官陳振謙以上正本證明與原本無異。如不服本裁定，應於收受送達後5日內向本院提出抗告狀。（應附繕本）書記官黃雅雲中華民國94年8月25日",
  "characters": {
    "judges": [
      "陳振謙"
    ],
    "prosecutors": [

    ],
    "lawyers": [

    ],
    "clerks": [
      "黃雅雲"
    ],
    "plaintiffs": [

    ],
    "defendants": [
      "甲○○"
    ],
    "prosecutor_office": [

    ],
    "creditors": [

    ],
    "debtors": [

    ],
    "judicial_associate_officer": [

    ]
  },
  "adjudged_at": "2005-08-25",
  "created_at": "2016-02-06 22:16:03",
  "updated_at": "2016-02-06 22:16:03"
}