{
  "identify": "TPD-94-重勞訴-15-20051014-2",
  "court": {
    "name": "臺灣臺北地方法院",
    "code": "TPD"
  },
  "division": {
    "name": "民事",
    "code": "V"
  },
  "year": 94,
  "word": "重勞訴",
  "number": "15",
  "jcheck": "2",
  "reason": "給付退休金等",
  "content": "臺灣臺北地方法院民事裁定            94年度重勞訴字第15號\n聲  請  人  乙○○\n            甲○○\n上列聲請人因與相對人中華航空股份有限公司請求給付退休金等\n事件聲請訴訟救助，本院裁定如下：\n    主  文\n准予訴訟救助。\n    理  由\n一、按當事人無資力支出訴訟費用者，法院應依聲請，以裁定准\n    予訴訟救助，民事訴訟法第107條前段定有明文。\n二、本件聲請意旨略以：相對人分別於91年9月間及92年1月間片\n    面違約終止與聲請人之勞動契約，因聲請人為民航機機師之\n    工作特性，而國內航空業又為寡占市場，聲請人遭違法解雇\n    已年近50歲，並無其他航空公司願再錄用，目前仍無工作及\n    收入，聲請人乙○○並為台北市政府調查列冊之低收入戶，\n    故對鈞院諭知應繳交之訴訟費用實無力繳交，爰聲請准予訴\n    訟救助等語。\n三、經查，聲請人就無資力支出訴訟費用，業據提出財政部臺北\n    市國稅局93年度綜合所得稅納稅證明書、財產歸屬資料清單\n    、93年度綜合所得稅各類所得資料清單及臺北市低收入戶卡\n    等件為證，以為釋明，堪信為真實。\n四、本件聲請核無不合，應予准許，爰依民事訴訟法第107 條前\n    段，裁定如主文。\n中    華    民    國    94    年    10    月    14    日\n                        臺灣臺北地方法院勞工法庭\n                                法  官  黃書苑\n以上正本係照原本作成。\n如對本裁定抗告須於裁定送達後10日內向本院提出抗告狀，並繳\n納抗告費新臺幣1,000元。\n中    華    民    國    94    年    10    月    14    日\n                                書記官  趙郁涵\n",
  "structure": {
    "main": "准予訴訟救助。",
    "reason": "一、按當事人無資力支出訴訟費用者，法院應依聲請，以裁定准\n    予訴訟救助，民事訴訟法第107條前段定有明文。\n二、本件聲請意旨略以：相對人分別於91年9月間及92年1月間片\n    面違約終止與聲請人之勞動契約，因聲請人為民航機機師之\n    工作特性，而國內航空業又為寡占市場，聲請人遭違法解雇\n    已年近50歲，並無其他航空公司願再錄用，目前仍無工作及\n    收入，聲請人乙○○並為台北市政府調查列冊之低收入戶，\n    故對鈞院諭知應繳交之訴訟費用實無力繳交，爰聲請准予訴\n    訟救助等語。\n三、經查，聲請人就無資力支出訴訟費用，業據提出財政部臺北\n    市國稅局93年度綜合所得稅納稅證明書、財產歸屬資料清單\n    、93年度綜合所得稅各類所得資料清單及臺北市低收入戶卡\n    等件為證，以為釋明，堪信為真實。\n四、本件聲請核無不合，應予准許，爰依民事訴訟法第107 條前\n    段，裁定如主文。"
  },
  "search": "臺灣臺北地方法院民事裁定94年度重勞訴字第15號聲請人乙○○甲○○上列聲請人因與相對人中華航空股份有限公司請求給付退休金等事件聲請訴訟救助，本院裁定如下：主文准予訴訟救助。理由一、按當事人無資力支出訴訟費用者，法院應依聲請，以裁定准予訴訟救助，民事訴訟法第107條前段定有明文。二、本件聲請意旨略以：相對人分別於91年9月間及92年1月間片面違約終止與聲請人之勞動契約，因聲請人為民航機機師之工作特性，而國內航空業又為寡占市場，聲請人遭違法解雇已年近50歲，並無其他航空公司願再錄用，目前仍無工作及收入，聲請人乙○○並為台北市政府調查列冊之低收入戶，故對鈞院諭知應繳交之訴訟費用實無力繳交，爰聲請准予訴訟救助等語。三、經查，聲請人就無資力支出訴訟費用，業據提出財政部臺北市國稅局93年度綜合所得稅納稅證明書、財產歸屬資料清單、93年度綜合所得稅各類所得資料清單及臺北市低收入戶卡等件為證，以為釋明，堪信為真實。四、本件聲請核無不合，應予准許，爰依民事訴訟法第107條前段，裁定如主文。中華民國94年10月14日臺灣臺北地方法院勞工法庭法官黃書苑以上正本係照原本作成。如對本裁定抗告須於裁定送達後10日內向本院提出抗告狀，並繳納抗告費新臺幣1,000元。中華民國94年10月14日書記官趙郁涵",
  "characters": {
    "judges": [
      "黃書苑"
    ],
    "prosecutors": [

    ],
    "lawyers": [

    ],
    "clerks": [
      "趙郁涵"
    ],
    "plaintiffs": [

    ],
    "defendants": [

    ],
    "prosecutor_office": [
      "乙"
    ],
    "creditors": [

    ],
    "debtors": [

    ],
    "judicial_associate_officer": [

    ]
  },
  "adjudged_at": "2005-10-14",
  "created_at": "2016-02-07 10:03:52",
  "updated_at": "2016-02-07 10:03:52"
}