{
  "identify": "SCD-100-竹簡-346-20110915-2",
  "court": {
    "name": "臺灣新竹地方法院",
    "code": "SCD"
  },
  "division": {
    "name": "民事",
    "code": "V"
  },
  "year": 100,
  "word": "竹簡",
  "number": "346",
  "jcheck": "2",
  "reason": "返還消費借貸款",
  "content": "臺灣新竹地方法院民事裁定            100年度竹簡字第346號\n原      告  台新國際商業銀行股份有限公司\n法定代理人  蔡榮棟\n訴訟代理人  王晟瑋\n被      告  周培琳即周培淋\n上列當事人間請求返還消費借貸款事件，本院於民國100 年9 月\n6 日所為之判決，其原本及正本應更正如下：\n    主  文\n原判決原本及正本當事人欄中關於「被告周培淋」之記載，應更\n正為「被告周培琳即周培淋」。\n    理  由\n一、按判決如有誤寫、誤算或其他類此之顯然錯誤者，法院得隨\n    時或依聲請以裁定更正之，民事訴訟法第232 條第1 項定有\n    明文。而所謂錯誤，應包括當事人姓名或名稱之錯誤在內。\n    關於當事人姓名或名稱之錯誤，祇須為訴訟標的之法律關係\n    不變，實際上由該當事人參與訴訟，雖原告起訴所主張被告\n    之姓名或名稱錯誤，並經法院對於姓名或名稱錯誤之當事人\n    為裁判，仍應有上開法條之適用。（最高法院69年度台職字\n    第3 號判例要旨參照）。另判決中顯然之錯誤，得由法院自\n    行更正者，不以出於法院之過失為必要，即本於當事人之陳\n    述或書狀之記載所致之錯誤，亦得以裁定更正之。又關於當\n    事人之姓名或名稱，因表示不正確發生之顯然錯誤，苟未變\n    更該當事人之同一性，亦有民事訴訟法第232 條第1 項規定\n    之適用（最高法院72年度台抗字第490 號裁判要旨參照）。\n二、查本院前開之判決原本及正本，因當事人書狀之記載，致有\n    如主文所示之顯然錯誤，應予更正。\n三、依首開規定裁定如主文。\n中    華    民    國   100    年    9     月    15    日\n                  民事第一庭  法  官  朱美璘\n以上正本係照原本作成。\n如對本裁定抗告須於裁定送達後10日內向本院提出抗告狀。\n中    華    民    國   100    年    9     月    15    日\n                              書記官  王恬如",
  "structure": {
    "main": "原判決原本及正本當事人欄中關於「被告周培淋」之記載，應更\n正為「被告周培琳即周培淋」。",
    "reason": "一、按判決如有誤寫、誤算或其他類此之顯然錯誤者，法院得隨\n    時或依聲請以裁定更正之，民事訴訟法第232 條第1 項定有\n    明文。而所謂錯誤，應包括當事人姓名或名稱之錯誤在內。\n    關於當事人姓名或名稱之錯誤，祇須為訴訟標的之法律關係\n    不變，實際上由該當事人參與訴訟，雖原告起訴所主張被告\n    之姓名或名稱錯誤，並經法院對於姓名或名稱錯誤之當事人\n    為裁判，仍應有上開法條之適用。（最高法院69年度台職字\n    第3 號判例要旨參照）。另判決中顯然之錯誤，得由法院自\n    行更正者，不以出於法院之過失為必要，即本於當事人之陳\n    述或書狀之記載所致之錯誤，亦得以裁定更正之。又關於當\n    事人之姓名或名稱，因表示不正確發生之顯然錯誤，苟未變\n    更該當事人之同一性，亦有民事訴訟法第232 條第1 項規定\n    之適用（最高法院72年度台抗字第490 號裁判要旨參照）。\n二、查本院前開之判決原本及正本，因當事人書狀之記載，致有\n    如主文所示之顯然錯誤，應予更正。\n三、依首開規定裁定如主文。"
  },
  "search": "臺灣新竹地方法院民事裁定100年度竹簡字第346號原告台新國際商業銀行股份有限公司法定代理人蔡榮棟訴訟代理人王晟瑋被告周培琳即周培淋上列當事人間請求返還消費借貸款事件，本院於民國100年9月6日所為之判決，其原本及正本應更正如下：主文原判決原本及正本當事人欄中關於「被告周培淋」之記載，應更正為「被告周培琳即周培淋」。理由一、按判決如有誤寫、誤算或其他類此之顯然錯誤者，法院得隨時或依聲請以裁定更正之，民事訴訟法第232條第1項定有明文。而所謂錯誤，應包括當事人姓名或名稱之錯誤在內。關於當事人姓名或名稱之錯誤，祇須為訴訟標的之法律關係不變，實際上由該當事人參與訴訟，雖原告起訴所主張被告之姓名或名稱錯誤，並經法院對於姓名或名稱錯誤之當事人為裁判，仍應有上開法條之適用。（最高法院69年度台職字第3號判例要旨參照）。另判決中顯然之錯誤，得由法院自行更正者，不以出於法院之過失為必要，即本於當事人之陳述或書狀之記載所致之錯誤，亦得以裁定更正之。又關於當事人之姓名或名稱，因表示不正確發生之顯然錯誤，苟未變更該當事人之同一性，亦有民事訴訟法第232條第1項規定之適用（最高法院72年度台抗字第490號裁判要旨參照）。二、查本院前開之判決原本及正本，因當事人書狀之記載，致有如主文所示之顯然錯誤，應予更正。三、依首開規定裁定如主文。中華民國100年9月15日民事第一庭法官朱美璘以上正本係照原本作成。如對本裁定抗告須於裁定送達後10日內向本院提出抗告狀。中華民國100年9月15日書記官王恬如",
  "characters": {
    "judges": [
      "朱美璘"
    ],
    "prosecutors": [

    ],
    "lawyers": [

    ],
    "clerks": [

    ],
    "plaintiffs": [
      "台新國際商業銀行股份有限公司"
    ],
    "defendants": [
      "周培琳即周培淋"
    ],
    "prosecutor_office": [

    ],
    "creditors": [

    ],
    "debtors": [

    ],
    "judicial_associate_officer": [

    ]
  },
  "adjudged_at": "2011-09-15",
  "created_at": "2016-02-12 11:49:10",
  "updated_at": "2016-02-12 11:49:10"
}