{
  "identify": "TCD-100-司聲-1489-20110914-1",
  "court": {
    "name": "臺灣臺中地方法院",
    "code": "TCD"
  },
  "division": {
    "name": "民事",
    "code": "V"
  },
  "year": 100,
  "word": "司聲",
  "number": "1489",
  "jcheck": "1",
  "reason": "返還擔保金",
  "content": "臺灣臺中地方法院民事裁定           100年度司聲字第1489號\n聲  請  人  第一商業銀行股份有限公司\n法定代理人  蔡慶年\n代  理  人  劉筱妘\n相  對  人  林麗玲\n上列聲請人聲請返還擔保金事件，本院裁定如下：\n    主    文\n本院一○○年度存字第九號擔保提存事件，聲請人所提存之中央\n政府建設公債九十一年度甲類第四期登錄債券，面額新臺幣壹佰\n伍拾萬元壹張（債券代號：Ａ９１１０４），准予返還。\n    理      由\n一、按供擔保人證明受擔保利益人同意返還者，法院應依供擔保\n    人之聲請，以裁定命返還其提存物或保證書。前開規定，於\n    其他依法令供訴訟上之擔保者準用之。民事訴訟法第104條\n    第1項第2款及第106條前段分別定有明文。\n二、本件聲請意旨略以：聲請人與相對人間聲請假處分事件，聲\n    請人前遵本院99年度裁全字第159號民事裁定，為擔保假處\n    分，曾提供如主文所示之債券為擔保金，並以本院100年度\n    存字第9號擔保提存事件提存在案。茲因該事件受擔保利益\n    人即相對人業已同意聲請人取回上開擔保金，爰聲請返還等\n    語，並提出相對人同意書及印鑑證明書各1件為證。\n三、本院依職權調閱前開事件相關卷宗與審視聲請人提出之事證\n    ，核與聲請意旨所載事實相符，揆諸前揭說明，聲請人聲請\n    返還提存物，核無不合，應予准許。\n四、依民事訴訟法第104條第1項第2款、第106條，裁定如主文。\n五、如不服本裁定，應於裁定送達後10日之不變期間內，以書狀\n    向本院司法事務官提出異議。\n中    華    民    國   100    年    9     月    14    日\n                   民事庭司法事務官   湯家奕",
  "structure": {
    "main": "本院一○○年度存字第九號擔保提存事件，聲請人所提存之中央\n政府建設公債九十一年度甲類第四期登錄債券，面額新臺幣壹佰\n伍拾萬元壹張（債券代號：Ａ９１１０４），准予返還。",
    "reason": "一、按供擔保人證明受擔保利益人同意返還者，法院應依供擔保\n    人之聲請，以裁定命返還其提存物或保證書。前開規定，於\n    其他依法令供訴訟上之擔保者準用之。民事訴訟法第104條\n    第1項第2款及第106條前段分別定有明文。\n二、本件聲請意旨略以：聲請人與相對人間聲請假處分事件，聲\n    請人前遵本院99年度裁全字第159號民事裁定，為擔保假處\n    分，曾提供如主文所示之債券為擔保金，並以本院100年度\n    存字第9號擔保提存事件提存在案。茲因該事件受擔保利益\n    人即相對人業已同意聲請人取回上開擔保金，爰聲請返還等\n    語，並提出相對人同意書及印鑑證明書各1件為證。\n三、本院依職權調閱前開事件相關卷宗與審視聲請人提出之事證\n    ，核與聲請意旨所載事實相符，揆諸前揭說明，聲請人聲請\n    返還提存物，核無不合，應予准許。\n四、依民事訴訟法第104條第1項第2款、第106條，裁定如主文。\n五、如不服本裁定，應於裁定送達後10日之不變期間內，以書狀\n    向本院司法事務官提出異議。"
  },
  "search": "臺灣臺中地方法院民事裁定100年度司聲字第1489號聲請人第一商業銀行股份有限公司法定代理人蔡慶年代理人劉筱妘相對人林麗玲上列聲請人聲請返還擔保金事件，本院裁定如下：主文本院一○○年度存字第九號擔保提存事件，聲請人所提存之中央政府建設公債九十一年度甲類第四期登錄債券，面額新臺幣壹佰伍拾萬元壹張（債券代號：Ａ９１１０４），准予返還。理由一、按供擔保人證明受擔保利益人同意返還者，法院應依供擔保人之聲請，以裁定命返還其提存物或保證書。前開規定，於其他依法令供訴訟上之擔保者準用之。民事訴訟法第104條第1項第2款及第106條前段分別定有明文。二、本件聲請意旨略以：聲請人與相對人間聲請假處分事件，聲請人前遵本院99年度裁全字第159號民事裁定，為擔保假處分，曾提供如主文所示之債券為擔保金，並以本院100年度存字第9號擔保提存事件提存在案。茲因該事件受擔保利益人即相對人業已同意聲請人取回上開擔保金，爰聲請返還等語，並提出相對人同意書及印鑑證明書各1件為證。三、本院依職權調閱前開事件相關卷宗與審視聲請人提出之事證，核與聲請意旨所載事實相符，揆諸前揭說明，聲請人聲請返還提存物，核無不合，應予准許。四、依民事訴訟法第104條第1項第2款、第106條，裁定如主文。五、如不服本裁定，應於裁定送達後10日之不變期間內，以書狀向本院司法事務官提出異議。中華民國100年9月14日民事庭司法事務官湯家奕",
  "characters": {
    "judges": [

    ],
    "prosecutors": [

    ],
    "lawyers": [

    ],
    "clerks": [

    ],
    "plaintiffs": [

    ],
    "defendants": [

    ],
    "prosecutor_office": [
      "第一商業銀行股份有限公司"
    ],
    "creditors": [

    ],
    "debtors": [

    ],
    "judicial_associate_officer": [
      "湯家奕"
    ]
  },
  "adjudged_at": "2011-09-14",
  "created_at": "2016-02-12 12:04:07",
  "updated_at": "2016-02-12 12:04:07"
}