{
  "identify": "TPD-100-聲-420-20110914-1",
  "court": {
    "name": "臺灣臺北地方法院",
    "code": "TPD"
  },
  "division": {
    "name": "民事",
    "code": "V"
  },
  "year": 100,
  "word": "聲",
  "number": "420",
  "jcheck": "1",
  "reason": "變更提存物",
  "content": "臺灣臺北地方法院民事裁定              100年度聲字第420號\n聲  請  人  第一商業銀行股份有限公司\n法定代理人  蔡慶年\n相  對  人  英商雷曼兄弟國際（歐洲）公司（LEHMAN BROTHER\n            S INTERNA.\n法定代理人\n即清算人    AV LOMAS\n            SA PEARSO.\n            DY SCHWAR.\n上列當事人間就本院97年度裁全字第10188 號聲請假扣押事件，\n聲請人聲請變更提存物，本院裁定如下：\n    主  文\n本院九十七年度裁全字第一０一八八號聲請人所提供之擔保物，\n准以面額新臺幣柒佰柒拾萬元之中央政府建設公債九十七年度甲\n類第三期債票（債券代號：A九七一０三）代之。\n    理  由\n一、按供擔保之提存物或保證書，除得由當事人約定變換外，法\n    院得依供擔保人之聲請，以裁定准許其變換，民事訴訟法第\n    105條第1項定有明文。\n二、本件聲請意旨略以：聲請人前遵本院97 年度裁全字第10188\n    號裁定提供新臺幣（下同）770 萬元之中央政府重大交通建\n    設公債86年度乙類第3 期登錄公債（債券代號：A86403）為\n    擔保，並經本院以97年度存字第5247號提存事件提存在案，\n    茲以該定期存單將於101年3月11日屆期，為此聲請變換等值\n    之中央政府建設公債97年度甲類第3期債票（債券代號：A97\n    103）等語。\n三、查聲請人主張上情，業據本院調取97年度存字第5247號提存\n    卷核閱無誤，經核尚無不合，應予准許。\n四、依民事訴訟法第105條第1項，裁定如主文。\n中    華    民    國   100    年    9     月    14    日\n                  民事第八庭  法  官  羅郁婷\n以上正本係照原本作成。\n如不服本裁定應於送達後10日內向本院提出抗告狀，並繳納抗告\n費新臺幣1,000元。\n中    華    民    國   100    年    9     月    15    日\n                                    書記官  楊婷雅",
  "structure": {
    "main": "本院九十七年度裁全字第一０一八八號聲請人所提供之擔保物，\n准以面額新臺幣柒佰柒拾萬元之中央政府建設公債九十七年度甲\n類第三期債票（債券代號：A九七一０三）代之。",
    "reason": "一、按供擔保之提存物或保證書，除得由當事人約定變換外，法\n    院得依供擔保人之聲請，以裁定准許其變換，民事訴訟法第\n    105條第1項定有明文。\n二、本件聲請意旨略以：聲請人前遵本院97 年度裁全字第10188\n    號裁定提供新臺幣（下同）770 萬元之中央政府重大交通建\n    設公債86年度乙類第3 期登錄公債（債券代號：A86403）為\n    擔保，並經本院以97年度存字第5247號提存事件提存在案，\n    茲以該定期存單將於101年3月11日屆期，為此聲請變換等值\n    之中央政府建設公債97年度甲類第3期債票（債券代號：A97\n    103）等語。\n三、查聲請人主張上情，業據本院調取97年度存字第5247號提存\n    卷核閱無誤，經核尚無不合，應予准許。\n四、依民事訴訟法第105條第1項，裁定如主文。"
  },
  "search": "臺灣臺北地方法院民事裁定100年度聲字第420號聲請人第一商業銀行股份有限公司法定代理人蔡慶年相對人英商雷曼兄弟國際（歐洲）公司（LEHMANBROTHERSINTERNA.法定代理人即清算人AVLOMASSAPEARSO.DYSCHWAR.上列當事人間就本院97年度裁全字第10188號聲請假扣押事件，聲請人聲請變更提存物，本院裁定如下：主文本院九十七年度裁全字第一０一八八號聲請人所提供之擔保物，准以面額新臺幣柒佰柒拾萬元之中央政府建設公債九十七年度甲類第三期債票（債券代號：A九七一０三）代之。理由一、按供擔保之提存物或保證書，除得由當事人約定變換外，法院得依供擔保人之聲請，以裁定准許其變換，民事訴訟法第105條第1項定有明文。二、本件聲請意旨略以：聲請人前遵本院97年度裁全字第10188號裁定提供新臺幣（下同）770萬元之中央政府重大交通建設公債86年度乙類第3期登錄公債（債券代號：A86403）為擔保，並經本院以97年度存字第5247號提存事件提存在案，茲以該定期存單將於101年3月11日屆期，為此聲請變換等值之中央政府建設公債97年度甲類第3期債票（債券代號：A97103）等語。三、查聲請人主張上情，業據本院調取97年度存字第5247號提存卷核閱無誤，經核尚無不合，應予准許。四、依民事訴訟法第105條第1項，裁定如主文。中華民國100年9月14日民事第八庭法官羅郁婷以上正本係照原本作成。如不服本裁定應於送達後10日內向本院提出抗告狀，並繳納抗告費新臺幣1,000元。中華民國100年9月15日書記官楊婷雅",
  "characters": {
    "judges": [
      "羅郁婷"
    ],
    "prosecutors": [

    ],
    "lawyers": [

    ],
    "clerks": [

    ],
    "plaintiffs": [

    ],
    "defendants": [

    ],
    "prosecutor_office": [
      "第一商業銀行股份有限公司"
    ],
    "creditors": [

    ],
    "debtors": [

    ],
    "judicial_associate_officer": [

    ]
  },
  "adjudged_at": "2011-09-14",
  "created_at": "2016-02-12 11:50:20",
  "updated_at": "2016-02-12 11:50:20"
}