{
  "identify": "TCD-93-中簡上-359-20041119-1",
  "court": {
    "name": "臺灣臺中地方法院",
    "code": "TCD"
  },
  "division": {
    "name": "刑事",
    "code": "M"
  },
  "year": 93,
  "word": "中簡上",
  "number": "359",
  "jcheck": "1",
  "reason": "竊盜",
  "content": "臺灣臺中地方法院刑事判決                      九十三年度中簡上字第三五九號\n    上  訴  人  臺灣臺中地方法院檢察署檢察官\n    被      告  乙○○\n右列上訴人因被告竊盜案件，不服本院臺中簡易庭九十三年度中簡字第一三五一號中\n華民國九十三年六月七日第一審判決（聲請簡易處刑案號：臺灣臺中地方法院檢察署\n九十三年度速偵字第八五二號）提起上訴，及移\n七五、一一四三○、一一五三○、一二二七二號），本院管轄合議庭逕改依通常程序\n為第一審判決如左：\n    主  文\n原判決撤銷。\n乙○○連續攜帶兇器竊盜，累犯，處有期徒刑捌月。扣案之鑰匙貳支沒收。\n    犯罪事實\n一、乙○○前於民國八十八年間，因違反毒品危害防制條例案件，經臺灣苗栗地方法\n    院以八十八年訴字第一四三號判處有期徒刑八月，經臺灣高等法院臺中分院以八\n    十八年度上訴字第二六八五號駁回上訴確定；於八十八年間，因贓物案件，經臺\n    灣苗栗地方法院以八十八年易字第四四三號判處有期徒刑四月，經臺灣高等法院\n    臺中分院以八十八年度上易字第二六六一號駁回上訴確定；於八十八年間，因違\n    反毒品危害防制條例案件，經臺灣苗栗地方法院以八十八年易字第六一一號判處\n    有期徒刑六月確定；於八十八年間，因常業竊盜等案件，經臺灣高等法院臺中分\n    院以八十八年度上訴字第二○四七號判處有期徒刑二年六月確定，嗣上開案件經\n    定應執行刑為有期徒刑三年八月確定，於九十一年六月六日假釋付保護管束，於\n    九十二年四月二十七日假釋期滿執行完畢。詎仍不知悔改，基於意圖為自己不法\n    所有之概括犯意：\n（一）九十三年二月二日上午七時許，在臺中市○區○○街九十九號前，見丁○○所\n      有之車牌號碼ＭＳ—八三二八號自用小客車一部停放於該處，認有機可趁，乃\n      以持其所有之鑰匙一支（未扣案）撬開該自用小客車之車門，侵入該車內搜尋\n      財物，惟其於搜尋財物之，適為丁○○發覺而報警處理，乙○○趁隙逃離現場\n      而未得手。\n（二）於九十三年五月十三日某時，在臺中市○○區○○街某棟大樓前，見丙○○所\n      有之車牌號碼ＳＰＹ—一六八號機車一部停放於該處，認有機可趁，乃以持其\n      所有之鑰匙一支撬開該機車電門鎖之方式，竊取該機車，得手後供己代步之用\n      。嗣為警於九十三年五月二十日凌晨一時三十分許，在臺中市○○路與北平路\n      口查獲，並扣得其所有用供竊車所用之鑰匙一支。\n（三）於九十三年六月十五日凌晨二時許，在臺中市○區○○路中友停車場內，見甲\n      ○○所有之車牌號碼Ｘ六—○一三二號自用小客車一部停放於該處，認有機可\n      趁，乃以持其所有，客觀上足以危害人之生命、身體而可供作兇器使用之螺絲\n      起子一支（未扣案）撬開該車門後，再以其所有之鑰匙一支插入電門之方式，\n      竊取該自用小客車，得手後供己代步之用。嗣為警於九十三年六月二十二日二\n      十二時許，在臺中市○○○路一一八號地下三樓查獲，並扣得其所有用供竊車\n      所用之鑰匙一支。\n二、案經臺中市警察局移送臺灣臺中地方法院檢察署檢察官偵查後聲請以簡易判決處\n    刑，及臺中市警察局第一分局、臺中市警察局第二分局報告同署檢察官移送併案\n    審理。\n    理  由\n一、訊據被告乙○○對於右揭事實坦承不諱，核與被害人丁○○、丙○○、甲○○於\n    警詢中指述遭竊情節相符，並有贓物認領保管收據三張、現場圖一張、照片五張\n    及車輛竊盜車牌失竊資料個別查詢報表－查詢車輛認可資料三份在卷可稽，且有\n    上述鑰匙二支扣案足佐，足認被告自白確與事實相符，堪可採信。是本案事證明\n    確，被告犯行堪以認定，應予依法論科。\n二、核被告乙○○所為，就犯罪事實欄一（一）所示之竊盜犯行，係犯刑法第三百二\n    十條第三項、第一項之普通竊盜未遂罪；就犯罪事實欄一（二）所示之竊盜犯行\n    ，係犯刑法第三百二十一條第一項第三款攜帶兇器竊盜罪；就犯罪事實欄一（三\n    ）所示之竊盜犯行，則係犯刑法第三百二十條第一項普通竊盜罪。其先後三次竊\n    盜犯行，時間緊接，觸犯構成要件相同之罪名，顯係基於概括之犯意反覆為之，\n    為連續犯，應依刑法第五十六條規定，依情節較重之攜帶兇器竊盜罪論處，並加\n    重其刑。又被告如犯事實欄一（一）、（三）所示竊盜犯行，雖未據起訴，惟既\n    與經檢察官起訴部分，具有連續犯之裁判上一罪關係，而為起訴效力所及，且經\n    檢察官移送併辦，本院自應併予審理，附此敘明。被告前於八十八年間，因違反\n    毒品危害防制條例案件，經臺灣苗栗地方法院以八十八年訴字第一四三號判處有\n    期徒刑八月，經臺灣高等法院臺中分院以八十八年度上訴字第二六八五號駁回上\n    訴確定；於八十八年間，因贓物案件，經臺灣苗栗地方法院以八十八年易字第四\n    四三號判處有期徒刑四月，經臺灣高等法院臺中分院以八十八年度上易字第二六\n    六一號駁回上訴確定；於八十八年間，因違反毒品危害防制條例案件，經臺灣苗\n    栗地方法院以八十八年易字第六一一號判處有期徒刑六月確定；於八十八年間，\n    因常業竊盜等案件，經臺灣高等法院臺中分院以八十八年度上訴字第二○四七號\n    判處有期徒刑二年六月確定，嗣上開案件經定應執行刑為有期徒刑三年八月確定\n    ，於九十一年六月六日假釋付保護管束，於九十二年四月二十七日假釋期滿執行\n    完畢，有臺灣臺中地方法院檢察署刑案資料查註紀錄表及臺灣高等法院被告全國\n    前案紀錄表各一份在卷足憑，其於受有期徒刑執行完畢後，於五年以內再犯本件\n    有期徒刑以上之罪，為累犯，應依刑法第四十七條規定，遞加重其刑。原審就被\n    告如犯罪事實欄一（二）部分所示犯行，予以論罪科刑，固非無見，然原審未及\n    審酌被告右開經移送併辦部分即如犯罪事實欄一（一）、（三）部分所示竊盜犯\n    行，容有未洽，檢察官就此部分提起上訴為有理由，應由本院撤銷改判。爰審酌\n    被告素行非佳，其所竊得之財物為機車一部、自用小客車一部，及其犯罪後坦承\n    犯行之態度等一切情狀，量處如主文所示之刑。至扣案之鑰匙二支，為被告所有\n    ，供其犯罪所用之物，業據被告陳明在卷，是應依刑法第三十八條第一項第二款\n    之規定宣告沒收。至螺絲起子、鑰匙各一支，雖為被告所有，供其犯罪所用之物\n    ，業據被告陳明在卷，然未扣案，且無證據證明該等物品尚未滅失，為免日後執\n    行困難，就此部分不為沒收之宣告，併此敘明。\n三、按檢察官聲請以簡易判決處刑之案件，經法院認為有第四百五十一條之一第四項\n    但書之情形者，應適用通常訴訟程序審判之，刑事訴訟法第四百五十二條定有明\n    文；且對於簡易判決之上訴，準用刑事訴訟法第三編第一章及第二章之規定，管\n    轄第二審之地方法院合議庭受理簡易判決上訴案件，應依通常程序審理。其認案\n    件有刑事訴訟法第四百五十二條之情形者，應撤銷原判決，逕依通常程序為第一\n    審判決，法院辦理刑事訴訟簡易程序案件應行注意事項第十四項亦有規定。查本\n    案審判中發現被告尚有其他具裁判上一罪即併案部分之犯罪事實，足認被告所犯\n    之罪不合刑事訴訟法第四百四十九條所定得以簡易判決處刑之案件，且本院認定\n    之犯罪事實顯然與檢察官據以求處罪刑之事實不符，而有刑事訴訟法第四百五十\n    一條之一第四項但書第二款前段之情形，依前揭法律規定，原審適用簡易判決處\n    刑程序，尚有未合，應由本院合議庭改依通常程序審理後，逕為第一審之判決，\n    檢察官或被告如不服本判決，仍得於法定上訴期間內，向管轄之第二審法院提起\n    上訴，附此敘明。\n據上論斷，應依刑事訴訟法第四百五十五條之一第一項、第三項、第四百五十二條、\n第四百五十一條之一第四項但書第二款前段、第三百六十九條第一項前段、第三百六\n十四條、第二百九十九條第一項前段，刑法第五十六條、第三百二十一條第一項第三\n款、第四十七條、第三十八條第一項第二款，判決如主文。\n中      華      民      國    九十三    年      十一     月     十九    日\n                                     臺灣臺中地方法院刑事第五庭\n                                         審判長法  官  梁堯銘\n                                               法  官  林慧英\n                                               法  官  劉麗瑛\n右正本證明與原本無異。\n如不服本判決，應於送達後十日內向本院提出上訴狀（須附繕本），上訴於臺灣高等\n法院臺中分院。\n                                               書記官\n中      華      民      國    九十三    年      十一     月     十九    日\n附錄論罪科刑法條\n中華民國刑法第三百二十一條\n犯竊盜罪而有左列情形之一者，處六月以上、五年以下有期徒刑：\n一、於夜間侵入住宅或有人居住之建築物、船艦或隱匿其內而犯之者。\n二、毀越門扇、牆垣或其他安全設備而犯之者。\n三、攜帶兇器而犯之者。\n四、結夥三人以上而犯之者。\n五、乘火災、水災或其他災害之際而犯之者。\n六、在車站或埠頭而犯之者。\n前項之未遂犯罰之。\n",
  "structure": {
    "main": "原判決撤銷。\n乙○○連續攜帶兇器竊盜，累犯，處有期徒刑捌月。扣案之鑰匙貳支沒收。",
    "fact": "一、乙○○前於民國八十八年間，因違反毒品危害防制條例案件，經臺灣苗栗地方法\n    院以八十八年訴字第一四三號判處有期徒刑八月，經臺灣高等法院臺中分院以八\n    十八年度上訴字第二六八五號駁回上訴確定；於八十八年間，因贓物案件，經臺\n    灣苗栗地方法院以八十八年易字第四四三號判處有期徒刑四月，經臺灣高等法院\n    臺中分院以八十八年度上易字第二六六一號駁回上訴確定；於八十八年間，因違\n    反毒品危害防制條例案件，經臺灣苗栗地方法院以八十八年易字第六一一號判處\n    有期徒刑六月確定；於八十八年間，因常業竊盜等案件，經臺灣高等法院臺中分\n    院以八十八年度上訴字第二○四七號判處有期徒刑二年六月確定，嗣上開案件經\n    定應執行刑為有期徒刑三年八月確定，於九十一年六月六日假釋付保護管束，於\n    九十二年四月二十七日假釋期滿執行完畢。詎仍不知悔改，基於意圖為自己不法\n    所有之概括犯意：\n（一）九十三年二月二日上午七時許，在臺中市○區○○街九十九號前，見丁○○所\n      有之車牌號碼ＭＳ—八三二八號自用小客車一部停放於該處，認有機可趁，乃\n      以持其所有之鑰匙一支（未扣案）撬開該自用小客車之車門，侵入該車內搜尋\n      財物，惟其於搜尋財物之，適為丁○○發覺而報警處理，乙○○趁隙逃離現場\n      而未得手。\n（二）於九十三年五月十三日某時，在臺中市○○區○○街某棟大樓前，見丙○○所\n      有之車牌號碼ＳＰＹ—一六八號機車一部停放於該處，認有機可趁，乃以持其\n      所有之鑰匙一支撬開該機車電門鎖之方式，竊取該機車，得手後供己代步之用\n      。嗣為警於九十三年五月二十日凌晨一時三十分許，在臺中市○○路與北平路\n      口查獲，並扣得其所有用供竊車所用之鑰匙一支。\n（三）於九十三年六月十五日凌晨二時許，在臺中市○區○○路中友停車場內，見甲\n      ○○所有之車牌號碼Ｘ六—○一三二號自用小客車一部停放於該處，認有機可\n      趁，乃以持其所有，客觀上足以危害人之生命、身體而可供作兇器使用之螺絲\n      起子一支（未扣案）撬開該車門後，再以其所有之鑰匙一支插入電門之方式，\n      竊取該自用小客車，得手後供己代步之用。嗣為警於九十三年六月二十二日二\n      十二時許，在臺中市○○○路一一八號地下三樓查獲，並扣得其所有用供竊車\n      所用之鑰匙一支。\n二、案經臺中市警察局移送臺灣臺中地方法院檢察署檢察官偵查後聲請以簡易判決處\n    刑，及臺中市警察局第一分局、臺中市警察局第二分局報告同署檢察官移送併案\n    審理。\n    理  由\n一、訊據被告乙○○對於右揭事實坦承不諱，核與被害人丁○○、丙○○、甲○○於\n    警詢中指述遭竊情節相符，並有贓物認領保管收據三張、現場圖一張、照片五張\n    及車輛竊盜車牌失竊資料個別查詢報表－查詢車輛認可資料三份在卷可稽，且有\n    上述鑰匙二支扣案足佐，足認被告自白確與事實相符，堪可採信。是本案事證明\n    確，被告犯行堪以認定，應予依法論科。\n二、核被告乙○○所為，就犯罪事實欄一（一）所示之竊盜犯行，係犯刑法第三百二\n    十條第三項、第一項之普通竊盜未遂罪；就犯罪事實欄一（二）所示之竊盜犯行\n    ，係犯刑法第三百二十一條第一項第三款攜帶兇器竊盜罪；就犯罪事實欄一（三\n    ）所示之竊盜犯行，則係犯刑法第三百二十條第一項普通竊盜罪。其先後三次竊\n    盜犯行，時間緊接，觸犯構成要件相同之罪名，顯係基於概括之犯意反覆為之，\n    為連續犯，應依刑法第五十六條規定，依情節較重之攜帶兇器竊盜罪論處，並加\n    重其刑。又被告如犯事實欄一（一）、（三）所示竊盜犯行，雖未據起訴，惟既\n    與經檢察官起訴部分，具有連續犯之裁判上一罪關係，而為起訴效力所及，且經\n    檢察官移送併辦，本院自應併予審理，附此敘明。被告前於八十八年間，因違反\n    毒品危害防制條例案件，經臺灣苗栗地方法院以八十八年訴字第一四三號判處有\n    期徒刑八月，經臺灣高等法院臺中分院以八十八年度上訴字第二六八五號駁回上\n    訴確定；於八十八年間，因贓物案件，經臺灣苗栗地方法院以八十八年易字第四\n    四三號判處有期徒刑四月，經臺灣高等法院臺中分院以八十八年度上易字第二六\n    六一號駁回上訴確定；於八十八年間，因違反毒品危害防制條例案件，經臺灣苗\n    栗地方法院以八十八年易字第六一一號判處有期徒刑六月確定；於八十八年間，\n    因常業竊盜等案件，經臺灣高等法院臺中分院以八十八年度上訴字第二○四七號\n    判處有期徒刑二年六月確定，嗣上開案件經定應執行刑為有期徒刑三年八月確定\n    ，於九十一年六月六日假釋付保護管束，於九十二年四月二十七日假釋期滿執行\n    完畢，有臺灣臺中地方法院檢察署刑案資料查註紀錄表及臺灣高等法院被告全國\n    前案紀錄表各一份在卷足憑，其於受有期徒刑執行完畢後，於五年以內再犯本件\n    有期徒刑以上之罪，為累犯，應依刑法第四十七條規定，遞加重其刑。原審就被\n    告如犯罪事實欄一（二）部分所示犯行，予以論罪科刑，固非無見，然原審未及\n    審酌被告右開經移送併辦部分即如犯罪事實欄一（一）、（三）部分所示竊盜犯\n    行，容有未洽，檢察官就此部分提起上訴為有理由，應由本院撤銷改判。爰審酌\n    被告素行非佳，其所竊得之財物為機車一部、自用小客車一部，及其犯罪後坦承\n    犯行之態度等一切情狀，量處如主文所示之刑。至扣案之鑰匙二支，為被告所有\n    ，供其犯罪所用之物，業據被告陳明在卷，是應依刑法第三十八條第一項第二款\n    之規定宣告沒收。至螺絲起子、鑰匙各一支，雖為被告所有，供其犯罪所用之物\n    ，業據被告陳明在卷，然未扣案，且無證據證明該等物品尚未滅失，為免日後執\n    行困難，就此部分不為沒收之宣告，併此敘明。\n三、按檢察官聲請以簡易判決處刑之案件，經法院認為有第四百五十一條之一第四項\n    但書之情形者，應適用通常訴訟程序審判之，刑事訴訟法第四百五十二條定有明\n    文；且對於簡易判決之上訴，準用刑事訴訟法第三編第一章及第二章之規定，管\n    轄第二審之地方法院合議庭受理簡易判決上訴案件，應依通常程序審理。其認案\n    件有刑事訴訟法第四百五十二條之情形者，應撤銷原判決，逕依通常程序為第一\n    審判決，法院辦理刑事訴訟簡易程序案件應行注意事項第十四項亦有規定。查本\n    案審判中發現被告尚有其他具裁判上一罪即併案部分之犯罪事實，足認被告所犯\n    之罪不合刑事訴訟法第四百四十九條所定得以簡易判決處刑之案件，且本院認定\n    之犯罪事實顯然與檢察官據以求處罪刑之事實不符，而有刑事訴訟法第四百五十\n    一條之一第四項但書第二款前段之情形，依前揭法律規定，原審適用簡易判決處\n    刑程序，尚有未合，應由本院合議庭改依通常程序審理後，逕為第一審之判決，\n    檢察官或被告如不服本判決，仍得於法定上訴期間內，向管轄之第二審法院提起\n    上訴，附此敘明。\n據上論斷，應依刑事訴訟法第四百五十五條之一第一項、第三項、第四百五十二條、\n第四百五十一條之一第四項但書第二款前段、第三百六十九條第一項前段、第三百六\n十四條、第二百九十九條第一項前段，刑法第五十六條、第三百二十一條第一項第三\n款、第四十七條、第三十八條第一項第二款，判決如主文。"
  },
  "search": "臺灣臺中地方法院刑事判決九十三年度中簡上字第三五九號上訴人臺灣臺中地方法院檢察署檢察官被告乙○○右列上訴人因被告竊盜案件，不服本院臺中簡易庭九十三年度中簡字第一三五一號中華民國九十三年六月七日第一審判決（聲請簡易處刑案號：臺灣臺中地方法院檢察署九十三年度速偵字第八五二號）提起上訴，及移七五、一一四三○、一一五三○、一二二七二號），本院管轄合議庭逕改依通常程序為第一審判決如左：主文原判決撤銷。乙○○連續攜帶兇器竊盜，累犯，處有期徒刑捌月。扣案之鑰匙貳支沒收。犯罪事實一、乙○○前於民國八十八年間，因違反毒品危害防制條例案件，經臺灣苗栗地方法院以八十八年訴字第一四三號判處有期徒刑八月，經臺灣高等法院臺中分院以八十八年度上訴字第二六八五號駁回上訴確定；於八十八年間，因贓物案件，經臺灣苗栗地方法院以八十八年易字第四四三號判處有期徒刑四月，經臺灣高等法院臺中分院以八十八年度上易字第二六六一號駁回上訴確定；於八十八年間，因違反毒品危害防制條例案件，經臺灣苗栗地方法院以八十八年易字第六一一號判處有期徒刑六月確定；於八十八年間，因常業竊盜等案件，經臺灣高等法院臺中分院以八十八年度上訴字第二○四七號判處有期徒刑二年六月確定，嗣上開案件經定應執行刑為有期徒刑三年八月確定，於九十一年六月六日假釋付保護管束，於九十二年四月二十七日假釋期滿執行完畢。詎仍不知悔改，基於意圖為自己不法所有之概括犯意：（一）九十三年二月二日上午七時許，在臺中市○區○○街九十九號前，見丁○○所有之車牌號碼ＭＳ—八三二八號自用小客車一部停放於該處，認有機可趁，乃以持其所有之鑰匙一支（未扣案）撬開該自用小客車之車門，侵入該車內搜尋財物，惟其於搜尋財物之，適為丁○○發覺而報警處理，乙○○趁隙逃離現場而未得手。（二）於九十三年五月十三日某時，在臺中市○○區○○街某棟大樓前，見丙○○所有之車牌號碼ＳＰＹ—一六八號機車一部停放於該處，認有機可趁，乃以持其所有之鑰匙一支撬開該機車電門鎖之方式，竊取該機車，得手後供己代步之用。嗣為警於九十三年五月二十日凌晨一時三十分許，在臺中市○○路與北平路口查獲，並扣得其所有用供竊車所用之鑰匙一支。（三）於九十三年六月十五日凌晨二時許，在臺中市○區○○路中友停車場內，見甲○○所有之車牌號碼Ｘ六—○一三二號自用小客車一部停放於該處，認有機可趁，乃以持其所有，客觀上足以危害人之生命、身體而可供作兇器使用之螺絲起子一支（未扣案）撬開該車門後，再以其所有之鑰匙一支插入電門之方式，竊取該自用小客車，得手後供己代步之用。嗣為警於九十三年六月二十二日二十二時許，在臺中市○○○路一一八號地下三樓查獲，並扣得其所有用供竊車所用之鑰匙一支。二、案經臺中市警察局移送臺灣臺中地方法院檢察署檢察官偵查後聲請以簡易判決處刑，及臺中市警察局第一分局、臺中市警察局第二分局報告同署檢察官移送併案審理。理由一、訊據被告乙○○對於右揭事實坦承不諱，核與被害人丁○○、丙○○、甲○○於警詢中指述遭竊情節相符，並有贓物認領保管收據三張、現場圖一張、照片五張及車輛竊盜車牌失竊資料個別查詢報表－查詢車輛認可資料三份在卷可稽，且有上述鑰匙二支扣案足佐，足認被告自白確與事實相符，堪可採信。是本案事證明確，被告犯行堪以認定，應予依法論科。二、核被告乙○○所為，就犯罪事實欄一（一）所示之竊盜犯行，係犯刑法第三百二十條第三項、第一項之普通竊盜未遂罪；就犯罪事實欄一（二）所示之竊盜犯行，係犯刑法第三百二十一條第一項第三款攜帶兇器竊盜罪；就犯罪事實欄一（三）所示之竊盜犯行，則係犯刑法第三百二十條第一項普通竊盜罪。其先後三次竊盜犯行，時間緊接，觸犯構成要件相同之罪名，顯係基於概括之犯意反覆為之，為連續犯，應依刑法第五十六條規定，依情節較重之攜帶兇器竊盜罪論處，並加重其刑。又被告如犯事實欄一（一）、（三）所示竊盜犯行，雖未據起訴，惟既與經檢察官起訴部分，具有連續犯之裁判上一罪關係，而為起訴效力所及，且經檢察官移送併辦，本院自應併予審理，附此敘明。被告前於八十八年間，因違反毒品危害防制條例案件，經臺灣苗栗地方法院以八十八年訴字第一四三號判處有期徒刑八月，經臺灣高等法院臺中分院以八十八年度上訴字第二六八五號駁回上訴確定；於八十八年間，因贓物案件，經臺灣苗栗地方法院以八十八年易字第四四三號判處有期徒刑四月，經臺灣高等法院臺中分院以八十八年度上易字第二六六一號駁回上訴確定；於八十八年間，因違反毒品危害防制條例案件，經臺灣苗栗地方法院以八十八年易字第六一一號判處有期徒刑六月確定；於八十八年間，因常業竊盜等案件，經臺灣高等法院臺中分院以八十八年度上訴字第二○四七號判處有期徒刑二年六月確定，嗣上開案件經定應執行刑為有期徒刑三年八月確定，於九十一年六月六日假釋付保護管束，於九十二年四月二十七日假釋期滿執行完畢，有臺灣臺中地方法院檢察署刑案資料查註紀錄表及臺灣高等法院被告全國前案紀錄表各一份在卷足憑，其於受有期徒刑執行完畢後，於五年以內再犯本件有期徒刑以上之罪，為累犯，應依刑法第四十七條規定，遞加重其刑。原審就被告如犯罪事實欄一（二）部分所示犯行，予以論罪科刑，固非無見，然原審未及審酌被告右開經移送併辦部分即如犯罪事實欄一（一）、（三）部分所示竊盜犯行，容有未洽，檢察官就此部分提起上訴為有理由，應由本院撤銷改判。爰審酌被告素行非佳，其所竊得之財物為機車一部、自用小客車一部，及其犯罪後坦承犯行之態度等一切情狀，量處如主文所示之刑。至扣案之鑰匙二支，為被告所有，供其犯罪所用之物，業據被告陳明在卷，是應依刑法第三十八條第一項第二款之規定宣告沒收。至螺絲起子、鑰匙各一支，雖為被告所有，供其犯罪所用之物，業據被告陳明在卷，然未扣案，且無證據證明該等物品尚未滅失，為免日後執行困難，就此部分不為沒收之宣告，併此敘明。三、按檢察官聲請以簡易判決處刑之案件，經法院認為有第四百五十一條之一第四項但書之情形者，應適用通常訴訟程序審判之，刑事訴訟法第四百五十二條定有明文；且對於簡易判決之上訴，準用刑事訴訟法第三編第一章及第二章之規定，管轄第二審之地方法院合議庭受理簡易判決上訴案件，應依通常程序審理。其認案件有刑事訴訟法第四百五十二條之情形者，應撤銷原判決，逕依通常程序為第一審判決，法院辦理刑事訴訟簡易程序案件應行注意事項第十四項亦有規定。查本案審判中發現被告尚有其他具裁判上一罪即併案部分之犯罪事實，足認被告所犯之罪不合刑事訴訟法第四百四十九條所定得以簡易判決處刑之案件，且本院認定之犯罪事實顯然與檢察官據以求處罪刑之事實不符，而有刑事訴訟法第四百五十一條之一第四項但書第二款前段之情形，依前揭法律規定，原審適用簡易判決處刑程序，尚有未合，應由本院合議庭改依通常程序審理後，逕為第一審之判決，檢察官或被告如不服本判決，仍得於法定上訴期間內，向管轄之第二審法院提起上訴，附此敘明。據上論斷，應依刑事訴訟法第四百五十五條之一第一項、第三項、第四百五十二條、第四百五十一條之一第四項但書第二款前段、第三百六十九條第一項前段、第三百六十四條、第二百九十九條第一項前段，刑法第五十六條、第三百二十一條第一項第三款、第四十七條、第三十八條第一項第二款，判決如主文。中華民國九十三年十一月十九日臺灣臺中地方法院刑事第五庭審判長法官梁堯銘法官林慧英法官劉麗瑛右正本證明與原本無異。如不服本判決，應於送達後十日內向本院提出上訴狀（須附繕本），上訴於臺灣高等法院臺中分院。書記官中華民國九十三年十一月十九日附錄論罪科刑法條中華民國刑法第三百二十一條犯竊盜罪而有左列情形之一者，處六月以上、五年以下有期徒刑：一、於夜間侵入住宅或有人居住之建築物、船艦或隱匿其內而犯之者。二、毀越門扇、牆垣或其他安全設備而犯之者。三、攜帶兇器而犯之者。四、結夥三人以上而犯之者。五、乘火災、水災或其他災害之際而犯之者。六、在車站或埠頭而犯之者。前項之未遂犯罰之。",
  "characters": {
    "judges": [
      "梁堯銘",
      "林慧英",
      "劉麗瑛"
    ],
    "prosecutors": [

    ],
    "lawyers": [

    ],
    "clerks": [
      "中華民國九十三年十一月十九日"
    ],
    "plaintiffs": [

    ],
    "defendants": [
      "乙○○",
      "右列上訴人因被告竊盜案件，不服本院臺中簡易庭九十三年度中簡字第一三五一號中",
      "華民國九十三年六月七日第一審判決（聲請簡易處刑案號：臺灣臺中地方法院檢察署",
      "九十三年度速偵字第八五二號）提起上訴，及移",
      "七五、一一四三○、一一五三○、一二二七二號），本院管轄合議庭逕改依通常程序",
      "為第一審判決如左："
    ],
    "prosecutor_office": [

    ],
    "creditors": [

    ],
    "debtors": [

    ],
    "judicial_associate_officer": [

    ]
  },
  "adjudged_at": "2004-11-19",
  "created_at": "2016-02-06 03:24:11",
  "updated_at": "2016-02-06 03:24:11"
}