{
  "identify": "TCD-100-聲-66-20110317-1",
  "court": {
    "name": "臺灣臺中地方法院",
    "code": "TCD"
  },
  "division": {
    "name": "民事",
    "code": "V"
  },
  "year": 100,
  "word": "聲",
  "number": "66",
  "jcheck": "1",
  "reason": "選任特別代理人",
  "content": "臺灣臺中地方法院民事裁定              100年度聲字第66號\n    聲  請  人  洪銘堅\n    相  對  人  洪滿美\n上列聲請人聲請為相對人選任特別代理人事件，本院裁定如下：\n    主    文\n選任聲請人洪銘堅於相對人對陳佩亦（民國○○年 ○月○○日生，國\n民身分證統一號碼：Ｚ000000000）聲請假扣押暨請求損害賠償訴\n訟時，為相對人之特別代理人。\n    理    由\n一、本件聲請意旨略以：本件之第三人陳佩亦於民國（下同）99\n    年 9月25日下午6時27分許，駕駛車牌號碼NX-2376號小客車\n    ，沿台中市清水區（即當時之台中縣清水鎮○○○路由西往\n    東方向行駛，行經高美路 387號前，適有相對人洪滿美騎乘\n    腳踏車沿高美路同向行駛在右前方，第三人陳佩亦疏未注意\n    車前狀況，於超越前車時，未注意兩車併行之間隔，其駕駛\n    前自小客車之右前車頭擦撞洪滿美所騎乘腳踏後方，致洪滿\n    美人車倒地，受有腦挫傷併左側硬腦膜下出血、腦內出血等\n    傷害，迄今仍呈語言溝通障礙之狀況，目前領有重度身心障\n    礙手冊，迄故顯屬無訴訟能力之人，且第三人陳佩亦迄今仍\n    否認犯行，拒絕賠償相對人洪滿美所受之損害，故確有聲請\n    假扣押暨起訴請求損害賠償之必要，而相對人未經法院宣告\n    禁治產，故無法定代理人，因其不能獨立以法律行為負義務\n    ，無訴訟能力，不能為有效之訴訟行為。聲請人為相對人之\n    弟，為其最近親屬之一，且聲請人住居在相對住所附近，本\n    件車禍事故發生迄今持續照顧相對人，為相對人處理相關事\n    務，且為相對人身心障礙手冊上登載之聯絡人，爰依民事訴\n    訟法第51條第 2項之規定，聲請法院選任聲請人為相對人之\n    特別代理人等語。\n二、按無訴訟能力人有為訴訟之必要，而無法定代理人，或法定\n    代理人不能行代理權者，其親屬或利害關係人，得聲請受訴\n    法院之審判長，選任特別代理人。民事訴訟法第51條第 2項\n    定有明文。\n三、經查：\n  (一)依童綜合醫療社團法人童綜合醫院100年1月20日出具之一般\n    證斷書載明相對人「腦挫傷併佐側硬腦膜下出血、腦內出血\n    。病人因上述診斷於100年1月 3日經由門診入院，目前右側\n    肢體乏力，語言溝通障礙，生活起居無法自理需長期依賴他\n    人照護，住院治療中。」，再依上開醫院於100年2月18日出\n    具之一般診斷書載明相對人「腦挫傷併佐側硬腦膜下出血、\n    腦內出血。病人因上述診斷於100年2月 7日經由門診入院，\n    目前右側肢體乏力，語言溝通障礙，生活起居無法自理需長\n    期依賴他人照護，於100年2月18日辦理出院。」，再相對人\n    目前領用之身心障礙手冊，載明「重度、多重障」等情，由\n    此足認依相對人之精神狀態，已不能處理自己之事務，足徵\n    相對人確無訴訟能力。\n  (二)又相對人係29年 2月24日出生，為成年人，惟迄今未受監護\n    宣告，故無法定代理人。聲請人為相對人之弟，有戶籍謄本\n    在卷可稽，是以聲請人因相對人有對第三人陳佩亦聲請假扣\n    押暨請求民事損害賠償訴訟之必要，而聲請法院為相對人選\n    任特別代理人，核與前揭規定並無不符，自應予以准許。\n四、依民事訴訟法第51條第2項，裁定如主文。\n中    華    民    國    100    年    3    月    17    日\n                  民事第一庭  法  官  顏世傑\n正本係照原本作成。\n不得抗告。\n中    華    民    國    100    年    3    月    17    日\n                              書記官  賴亮蓉",
  "structure": {
    "main": "選任聲請人洪銘堅於相對人對陳佩亦（民國○○年 ○月○○日生，國\n民身分證統一號碼：Ｚ000000000）聲請假扣押暨請求損害賠償訴\n訟時，為相對人之特別代理人。",
    "reason": "一、本件聲請意旨略以：本件之第三人陳佩亦於民國（下同）99\n    年 9月25日下午6時27分許，駕駛車牌號碼NX-2376號小客車\n    ，沿台中市清水區（即當時之台中縣清水鎮○○○路由西往\n    東方向行駛，行經高美路 387號前，適有相對人洪滿美騎乘\n    腳踏車沿高美路同向行駛在右前方，第三人陳佩亦疏未注意\n    車前狀況，於超越前車時，未注意兩車併行之間隔，其駕駛\n    前自小客車之右前車頭擦撞洪滿美所騎乘腳踏後方，致洪滿\n    美人車倒地，受有腦挫傷併左側硬腦膜下出血、腦內出血等\n    傷害，迄今仍呈語言溝通障礙之狀況，目前領有重度身心障\n    礙手冊，迄故顯屬無訴訟能力之人，且第三人陳佩亦迄今仍\n    否認犯行，拒絕賠償相對人洪滿美所受之損害，故確有聲請\n    假扣押暨起訴請求損害賠償之必要，而相對人未經法院宣告\n    禁治產，故無法定代理人，因其不能獨立以法律行為負義務\n    ，無訴訟能力，不能為有效之訴訟行為。聲請人為相對人之\n    弟，為其最近親屬之一，且聲請人住居在相對住所附近，本\n    件車禍事故發生迄今持續照顧相對人，為相對人處理相關事\n    務，且為相對人身心障礙手冊上登載之聯絡人，爰依民事訴\n    訟法第51條第 2項之規定，聲請法院選任聲請人為相對人之\n    特別代理人等語。\n二、按無訴訟能力人有為訴訟之必要，而無法定代理人，或法定\n    代理人不能行代理權者，其親屬或利害關係人，得聲請受訴\n    法院之審判長，選任特別代理人。民事訴訟法第51條第 2項\n    定有明文。\n三、經查：\n  (一)依童綜合醫療社團法人童綜合醫院100年1月20日出具之一般\n    證斷書載明相對人「腦挫傷併佐側硬腦膜下出血、腦內出血\n    。病人因上述診斷於100年1月 3日經由門診入院，目前右側\n    肢體乏力，語言溝通障礙，生活起居無法自理需長期依賴他\n    人照護，住院治療中。」，再依上開醫院於100年2月18日出\n    具之一般診斷書載明相對人「腦挫傷併佐側硬腦膜下出血、\n    腦內出血。病人因上述診斷於100年2月 7日經由門診入院，\n    目前右側肢體乏力，語言溝通障礙，生活起居無法自理需長\n    期依賴他人照護，於100年2月18日辦理出院。」，再相對人\n    目前領用之身心障礙手冊，載明「重度、多重障」等情，由\n    此足認依相對人之精神狀態，已不能處理自己之事務，足徵\n    相對人確無訴訟能力。\n  (二)又相對人係29年 2月24日出生，為成年人，惟迄今未受監護\n    宣告，故無法定代理人。聲請人為相對人之弟，有戶籍謄本\n    在卷可稽，是以聲請人因相對人有對第三人陳佩亦聲請假扣\n    押暨請求民事損害賠償訴訟之必要，而聲請法院為相對人選\n    任特別代理人，核與前揭規定並無不符，自應予以准許。\n四、依民事訴訟法第51條第2項，裁定如主文。"
  },
  "search": "臺灣臺中地方法院民事裁定100年度聲字第66號聲請人洪銘堅相對人洪滿美上列聲請人聲請為相對人選任特別代理人事件，本院裁定如下：主文選任聲請人洪銘堅於相對人對陳佩亦（民國○○年○月○○日生，國民身分證統一號碼：Ｚ000000000）聲請假扣押暨請求損害賠償訴訟時，為相對人之特別代理人。理由一、本件聲請意旨略以：本件之第三人陳佩亦於民國（下同）99年9月25日下午6時27分許，駕駛車牌號碼NX-2376號小客車，沿台中市清水區（即當時之台中縣清水鎮○○○路由西往東方向行駛，行經高美路387號前，適有相對人洪滿美騎乘腳踏車沿高美路同向行駛在右前方，第三人陳佩亦疏未注意車前狀況，於超越前車時，未注意兩車併行之間隔，其駕駛前自小客車之右前車頭擦撞洪滿美所騎乘腳踏後方，致洪滿美人車倒地，受有腦挫傷併左側硬腦膜下出血、腦內出血等傷害，迄今仍呈語言溝通障礙之狀況，目前領有重度身心障礙手冊，迄故顯屬無訴訟能力之人，且第三人陳佩亦迄今仍否認犯行，拒絕賠償相對人洪滿美所受之損害，故確有聲請假扣押暨起訴請求損害賠償之必要，而相對人未經法院宣告禁治產，故無法定代理人，因其不能獨立以法律行為負義務，無訴訟能力，不能為有效之訴訟行為。聲請人為相對人之弟，為其最近親屬之一，且聲請人住居在相對住所附近，本件車禍事故發生迄今持續照顧相對人，為相對人處理相關事務，且為相對人身心障礙手冊上登載之聯絡人，爰依民事訴訟法第51條第2項之規定，聲請法院選任聲請人為相對人之特別代理人等語。二、按無訴訟能力人有為訴訟之必要，而無法定代理人，或法定代理人不能行代理權者，其親屬或利害關係人，得聲請受訴法院之審判長，選任特別代理人。民事訴訟法第51條第2項定有明文。三、經查：(一)依童綜合醫療社團法人童綜合醫院100年1月20日出具之一般證斷書載明相對人「腦挫傷併佐側硬腦膜下出血、腦內出血。病人因上述診斷於100年1月3日經由門診入院，目前右側肢體乏力，語言溝通障礙，生活起居無法自理需長期依賴他人照護，住院治療中。」，再依上開醫院於100年2月18日出具之一般診斷書載明相對人「腦挫傷併佐側硬腦膜下出血、腦內出血。病人因上述診斷於100年2月7日經由門診入院，目前右側肢體乏力，語言溝通障礙，生活起居無法自理需長期依賴他人照護，於100年2月18日辦理出院。」，再相對人目前領用之身心障礙手冊，載明「重度、多重障」等情，由此足認依相對人之精神狀態，已不能處理自己之事務，足徵相對人確無訴訟能力。(二)又相對人係29年2月24日出生，為成年人，惟迄今未受監護宣告，故無法定代理人。聲請人為相對人之弟，有戶籍謄本在卷可稽，是以聲請人因相對人有對第三人陳佩亦聲請假扣押暨請求民事損害賠償訴訟之必要，而聲請法院為相對人選任特別代理人，核與前揭規定並無不符，自應予以准許。四、依民事訴訟法第51條第2項，裁定如主文。中華民國100年3月17日民事第一庭法官顏世傑正本係照原本作成。不得抗告。中華民國100年3月17日書記官賴亮蓉",
  "characters": {
    "judges": [
      "顏世傑"
    ],
    "prosecutors": [

    ],
    "lawyers": [

    ],
    "clerks": [

    ],
    "plaintiffs": [

    ],
    "defendants": [

    ],
    "prosecutor_office": [
      "洪銘堅"
    ],
    "creditors": [

    ],
    "debtors": [

    ],
    "judicial_associate_officer": [

    ]
  },
  "adjudged_at": "2011-03-17",
  "created_at": "2016-02-13 23:43:57",
  "updated_at": "2016-02-13 23:43:57"
}