{
  "identify": "TPD-100-司促-5540-20110317-1",
  "court": {
    "name": "臺灣臺北地方法院",
    "code": "TPD"
  },
  "division": {
    "name": "民事",
    "code": "V"
  },
  "year": 100,
  "word": "司促",
  "number": "5540",
  "jcheck": "1",
  "reason": "支付命令",
  "content": "臺灣臺北地方法院支付命令           100年度司促字第5540號\n聲  請  人\n即債權人    臺灣銀行股份有限公司\n法定代理人  張明道\n相  對  人\n即債務人    陳建甫\n            陳駱昌\n            李演麗\n一、債務人應向債權人連帶清償新臺幣貳拾玖萬玖仟伍佰伍拾元\n    ，及自民國九十九年十一月二十三日起至清償日止，按年息\n    百分之二．六一計算之利息，暨自民國九十九年十二月二日\n    起至清償日止，其逾期在六個月以內者，按上開利率百分之\n    十，逾期超過六個月者，按上開利率百分之二十計算之違約\n    金，並連帶賠償督促程序費用新臺幣伍佰元，否則應於本命\n    令送達後二十日之不變期間內，向本院提出異議。\n二、債權人請求之原因事實如附件所載。\n三、如債務人未於第一項期間內提出異議，本命令與確定判決有\n    同一效力。\n中    華    民    國   100    年    3     月    17    日\n                  民事庭司法事務官  林嘉怡\n    附件：\n    債權人請求之原因事實（100年度司促字第5540號）\n    （一）債權人原為「臺灣銀行」，92年7 月1 日起變更組織\n          為「股份有限公司」，全名為「臺灣銀行股份有限公\n          司」。按法人組織變更，其法人人格之存續不受影響\n          , 原屬「臺灣銀行」之權利義務，由變更後之「臺灣\n          銀行股份有限公司」繼續承受或負擔，合先敘明。\n    （二）債務人陳建甫於民國97年至99年間邀同債務人陳駱昌\n          、李演麗為連帶保證人向債權人訂借「高中以上學生\n          就學貸款」5 筆，共計新臺幣299550元整，借款期限\n          及償還辦法還款方式為於階段學業完成或退伍後滿一\n          年之日起開始分60期，每滿一個月為一期平均攤還本\n          金或本息。倘借款人不依期償還本金或本息時，除應\n          自遲延日起按約定利率計付遲延利息外，另按遲延還\n          本付息部份，本金自到期日起，遲延利息自付息日起\n          ，照應還款額，逾期六個月以內者，按借款利率百分\n          之十，逾期超過六個月以上者，按借款利率百分之二\n          十加計違約金。\n    （三）依借據約定，借款人有任何一宗債務不依約清償本金\n          、利息時，即喪失分期償還權利，債權人得終止契約\n          ，追償全部借款本息暨違約金，詎債務人陳建甫於就\n          讀學校畢業後自民國99年11月23日起未依約履行，計\n          尚欠本金新臺幣299550元及自民國99年11月23日起至\n          清償日止按年息2.61％計算之利息和自民國99年12月\n          2 日起至清償日止，逾期六個月以內者，按上開利率\n          百分之十，逾期超過六個月以上者，按上開利率百分\n          之二十計算之違約金等未清償，迭經催討，未蒙繳納\n          ，債務人陳駱昌、李演麗既為連帶保證人，自應負連\n          帶清償責任，為此狀請鈞院鑑核，賜准對債務人核發\n          支付命令，實為德便。",
  "structure": {
  },
  "search": "臺灣臺北地方法院支付命令100年度司促字第5540號聲請人即債權人臺灣銀行股份有限公司法定代理人張明道相對人即債務人陳建甫陳駱昌李演麗一、債務人應向債權人連帶清償新臺幣貳拾玖萬玖仟伍佰伍拾元，及自民國九十九年十一月二十三日起至清償日止，按年息百分之二．六一計算之利息，暨自民國九十九年十二月二日起至清償日止，其逾期在六個月以內者，按上開利率百分之十，逾期超過六個月者，按上開利率百分之二十計算之違約金，並連帶賠償督促程序費用新臺幣伍佰元，否則應於本命令送達後二十日之不變期間內，向本院提出異議。二、債權人請求之原因事實如附件所載。三、如債務人未於第一項期間內提出異議，本命令與確定判決有同一效力。中華民國100年3月17日民事庭司法事務官林嘉怡附件：債權人請求之原因事實（100年度司促字第5540號）（一）債權人原為「臺灣銀行」，92年7月1日起變更組織為「股份有限公司」，全名為「臺灣銀行股份有限公司」。按法人組織變更，其法人人格之存續不受影響,原屬「臺灣銀行」之權利義務，由變更後之「臺灣銀行股份有限公司」繼續承受或負擔，合先敘明。（二）債務人陳建甫於民國97年至99年間邀同債務人陳駱昌、李演麗為連帶保證人向債權人訂借「高中以上學生就學貸款」5筆，共計新臺幣299550元整，借款期限及償還辦法還款方式為於階段學業完成或退伍後滿一年之日起開始分60期，每滿一個月為一期平均攤還本金或本息。倘借款人不依期償還本金或本息時，除應自遲延日起按約定利率計付遲延利息外，另按遲延還本付息部份，本金自到期日起，遲延利息自付息日起，照應還款額，逾期六個月以內者，按借款利率百分之十，逾期超過六個月以上者，按借款利率百分之二十加計違約金。（三）依借據約定，借款人有任何一宗債務不依約清償本金、利息時，即喪失分期償還權利，債權人得終止契約，追償全部借款本息暨違約金，詎債務人陳建甫於就讀學校畢業後自民國99年11月23日起未依約履行，計尚欠本金新臺幣299550元及自民國99年11月23日起至清償日止按年息2.61％計算之利息和自民國99年12月2日起至清償日止，逾期六個月以內者，按上開利率百分之十，逾期超過六個月以上者，按上開利率百分之二十計算之違約金等未清償，迭經催討，未蒙繳納，債務人陳駱昌、李演麗既為連帶保證人，自應負連帶清償責任，為此狀請鈞院鑑核，賜准對債務人核發支付命令，實為德便。",
  "characters": {
    "judges": [

    ],
    "prosecutors": [

    ],
    "lawyers": [

    ],
    "clerks": [

    ],
    "plaintiffs": [

    ],
    "defendants": [

    ],
    "prosecutor_office": [

    ],
    "creditors": [
      "臺灣銀行股份有限公司"
    ],
    "debtors": [

    ],
    "judicial_associate_officer": [
      "林嘉怡"
    ]
  },
  "adjudged_at": "2011-03-17",
  "created_at": "2016-02-13 23:49:21",
  "updated_at": "2016-02-13 23:49:21"
}