{
  "identify": "KLD-100-基交簡-667-20111028-1",
  "court": {
    "name": "臺灣基隆地方法院",
    "code": "KLD"
  },
  "division": {
    "name": "刑事",
    "code": "M"
  },
  "year": 100,
  "word": "基交簡",
  "number": "667",
  "jcheck": "1",
  "reason": "過失傷害",
  "content": "臺灣基隆地方法院刑事簡易判決      100年度基交簡字第667號\n聲  請  人  臺灣基隆地方法院檢察署檢察官\n被      告  黃來福\n上列被告因過失傷害案件，經檢察官聲請以簡易判決處刑（100\n年度偵字第3412號），本院判決如下：\n    主  文\n黃來福因過失傷害人，處拘役伍拾伍日，如易科罰金，以新臺幣\n壹仟元折算壹日。\n    犯罪事實及理由\n一、本件犯罪事實、證據，均引用如附件檢察官聲請簡易判決處\n    刑書之記載。\n二、核被告所為，係犯刑法第284 條第1 項前段之過失傷害罪。\n    茲審酌被告之過失程度、肇事當時情形、告訴人傷勢、被告\n    犯後態度，且與告訴人成立和解後未依約定賠償損害等一切\n    情狀，量處如主文所示之刑，並諭知易科罰金之折算標準。\n三、依刑事訴訟法第449 條第1 項前段、第3 項、第454 條第2\n    項，刑法第284 條第1 項前段、第41條第1 項前段，刑法施\n    行法第1 條之1 ，逕以簡易判決處刑如主文。\n四、如不服本判決，應於判決送達後10日內，向本院提出上訴書\n    狀，上訴於本院合議庭。\n中    華    民    國   100    年    10    月    28    日\n                  基隆簡易庭法    官  吳佳齡\n以上正本證明與原本無異。\n如不服本判決，應於判決送達後10日內，向本院提出上訴書狀，\n敘述上訴理由，上訴於本院合議庭，並按他造當事人之人數附具\n繕本。\n中    華    民    國   100    年    10    月    28    日\n                            書 記 官  莊智凱\n附錄論罪法條：\n中華民國刑法第284條\n（過失傷害罪）\n因過失傷害人者，處 6 月以下有期徒刑、拘役或 5 百元以下罰\n金，致重傷者，處 1 年以下有期徒刑、拘役或 5 百元以下罰金\n。\n從事業務之人，因業務上之過失傷害人者，處 1 年以下有期徒\n刑、拘役或 1 千元以下罰金，致重傷者，處 3 年以下有期徒刑\n、拘役或 2 千元以下罰金。\n附件：\n臺灣基隆地方法院檢察署檢察官聲請簡易判決處刑書\n                                     100年度偵字第3412號\n    被      告  黃來福  男  48歲（民國○○年○○月○○日生）\n                        住基隆市○○區○○街71號之1\n                        身分證統一編號：Ｚ000000000號\n上列被告因過失傷害案件，業經偵查終結，認宜以簡易判決處刑\n，茲敘述犯罪事實及證據並所犯法條如下：\n        犯  罪  事  實\n一、黃來福於民國100年6月5日晚上7時許，駕駛車牌號碼7390－\n    YB號自用小客車，沿基隆市東岸高架橋往中正路方向行駛，\n    行經東岸高架橋出口時，本應注意汽車行駛時，駕駛人應注\n    意車前狀況，並隨時採取必要之安全措施，而依當時天候晴\n    、夜間有照明、路面係乾燥無缺陷之柏油路、路況無障礙物\n    、視距良好等情形，又無不能注意之情事，竟疏未注意車前\n    狀況，撞擊由吳泓敏所駕駛在前方停等紅燈之車牌號碼2030\n    －B3號自用小客車，致吳泓敏受右側頸扭傷及拉傷、第3、4\n    頸椎半脫位之傷害。\n二、案經吳泓敏訴由基隆市警察局第一分局報告偵辦。\n        證  據  並  所  犯  法  條\n一、訊據被告黃來福對於前揭犯罪事實坦承不諱，核與證人吳泓\n    敏及鄭元娟證述之情節相符，並有基隆市○○○道路交通事\n    故現場圖、道路交通事故調查報告表(一)、(二)、道路交通事故\n    談話紀錄表、車損及現場照片及診斷證明書等附卷可參。按\n    駕駛人應注意車前狀況，隨時採取必要之安全措施，道路交\n    通安全規則第94條第3項定有明文，而依本件肇事時天候晴\n    、夜間有照明、路面係乾燥無缺陷之柏油路、路況無障礙物\n    、視距良好等情，被告亦無不能注意之情事，其疏未注意車\n    前狀況，而與告訴人之自用小客車發生碰撞，其有過失堪以\n    認定。而證人吳泓敏因被告前揭過失行為，受有前揭傷害，\n    已如前述，足證被告過失行為與告訴人所受傷害間有相當因\n    果關係。綜上所述，被告犯嫌堪以認定。\n二、核被告所為係犯刑法第284條第1項前段之過失傷害罪嫌。\n三、依刑事訴訟法第451條第1項聲請逕以簡易判決處刑。\n    此  致\n臺灣基隆地方法院基隆簡易庭\n中    華    民    國   100    年    8     月    31    日\n                              檢  察  官  張志明\n上正本證明與原本無異\n中    華    民    國   100    年    9     月    24    日\n                              書  記  官  林子堯\n附錄：\n中華民國刑法第284條（過失傷害罪）\n因過失傷害人者，處6月以下有期徒刑、拘役或5百元以下罰金，\n致重傷者，處1年以下有期徒刑、拘役或5百元以下罰金。\n從事業務之人，因業務上之過失傷害人者，處1年以下有期徒刑\n、拘役或1千元以下罰金，致重傷者，處3年以下有期徒刑、拘役\n或2千元以下罰金。",
  "structure": {
    "main": "黃來福因過失傷害人，處拘役伍拾伍日，如易科罰金，以新臺幣\n壹仟元折算壹日。\n    犯罪事實及理由\n一、本件犯罪事實、證據，均引用如附件檢察官聲請簡易判決處\n    刑書之記載。\n二、核被告所為，係犯刑法第284 條第1 項前段之過失傷害罪。\n    茲審酌被告之過失程度、肇事當時情形、告訴人傷勢、被告\n    犯後態度，且與告訴人成立和解後未依約定賠償損害等一切\n    情狀，量處如主文所示之刑，並諭知易科罰金之折算標準。\n三、依刑事訴訟法第449 條第1 項前段、第3 項、第454 條第2\n    項，刑法第284 條第1 項前段、第41條第1 項前段，刑法施\n    行法第1 條之1 ，逕以簡易判決處刑如主文。\n四、如不服本判決，應於判決送達後10日內，向本院提出上訴書\n    狀，上訴於本院合議庭。\n中    華    民    國   100    年    10    月    28    日\n                  基隆簡易庭法    官  吳佳齡\n以上正本證明與原本無異。\n如不服本判決，應於判決送達後10日內，向本院提出上訴書狀，\n敘述上訴理由，上訴於本院合議庭，並按他造當事人之人數附具\n繕本。\n中    華    民    國   100    年    10    月    28    日\n                            書 記 官  莊智凱\n附錄論罪法條：\n中華民國刑法第284條\n（過失傷害罪）\n因過失傷害人者，處 6 月以下有期徒刑、拘役或 5 百元以下罰\n金，致重傷者，處 1 年以下有期徒刑、拘役或 5 百元以下罰金\n。\n從事業務之人，因業務上之過失傷害人者，處 1 年以下有期徒\n刑、拘役或 1 千元以下罰金，致重傷者，處 3 年以下有期徒刑\n、拘役或 2 千元以下罰金。\n附件：\n臺灣基隆地方法院檢察署檢察官聲請簡易判決處刑書\n                                     100年度偵字第3412號\n    被      告  黃來福  男  48歲（民國○○年○○月○○日生）\n                        住基隆市○○區○○街71號之1\n                        身分證統一編號：Ｚ000000000號\n上列被告因過失傷害案件，業經偵查終結，認宜以簡易判決處刑\n，茲敘述犯罪事實及證據並所犯法條如下：\n        犯  罪",
    "fact": "一、本件犯罪事實、證據，均引用如附件檢察官聲請簡易判決處\n    刑書之記載。\n二、核被告所為，係犯刑法第284 條第1 項前段之過失傷害罪。\n    茲審酌被告之過失程度、肇事當時情形、告訴人傷勢、被告\n    犯後態度，且與告訴人成立和解後未依約定賠償損害等一切\n    情狀，量處如主文所示之刑，並諭知易科罰金之折算標準。\n三、依刑事訴訟法第449 條第1 項前段、第3 項、第454 條第2\n    項，刑法第284 條第1 項前段、第41條第1 項前段，刑法施\n    行法第1 條之1 ，逕以簡易判決處刑如主文。\n四、如不服本判決，應於判決送達後10日內，向本院提出上訴書\n    狀，上訴於本院合議庭。",
    "reason": "一、本件犯罪事實、證據，均引用如附件檢察官聲請簡易判決處\n    刑書之記載。\n二、核被告所為，係犯刑法第284 條第1 項前段之過失傷害罪。\n    茲審酌被告之過失程度、肇事當時情形、告訴人傷勢、被告\n    犯後態度，且與告訴人成立和解後未依約定賠償損害等一切\n    情狀，量處如主文所示之刑，並諭知易科罰金之折算標準。\n三、依刑事訴訟法第449 條第1 項前段、第3 項、第454 條第2\n    項，刑法第284 條第1 項前段、第41條第1 項前段，刑法施\n    行法第1 條之1 ，逕以簡易判決處刑如主文。\n四、如不服本判決，應於判決送達後10日內，向本院提出上訴書\n    狀，上訴於本院合議庭。"
  },
  "search": "臺灣基隆地方法院刑事簡易判決100年度基交簡字第667號聲請人臺灣基隆地方法院檢察署檢察官被告黃來福上列被告因過失傷害案件，經檢察官聲請以簡易判決處刑（100年度偵字第3412號），本院判決如下：主文黃來福因過失傷害人，處拘役伍拾伍日，如易科罰金，以新臺幣壹仟元折算壹日。犯罪事實及理由一、本件犯罪事實、證據，均引用如附件檢察官聲請簡易判決處刑書之記載。二、核被告所為，係犯刑法第284條第1項前段之過失傷害罪。茲審酌被告之過失程度、肇事當時情形、告訴人傷勢、被告犯後態度，且與告訴人成立和解後未依約定賠償損害等一切情狀，量處如主文所示之刑，並諭知易科罰金之折算標準。三、依刑事訴訟法第449條第1項前段、第3項、第454條第2項，刑法第284條第1項前段、第41條第1項前段，刑法施行法第1條之1，逕以簡易判決處刑如主文。四、如不服本判決，應於判決送達後10日內，向本院提出上訴書狀，上訴於本院合議庭。中華民國100年10月28日基隆簡易庭法官吳佳齡以上正本證明與原本無異。如不服本判決，應於判決送達後10日內，向本院提出上訴書狀，敘述上訴理由，上訴於本院合議庭，並按他造當事人之人數附具繕本。中華民國100年10月28日書記官莊智凱附錄論罪法條：中華民國刑法第284條（過失傷害罪）因過失傷害人者，處6月以下有期徒刑、拘役或5百元以下罰金，致重傷者，處1年以下有期徒刑、拘役或5百元以下罰金。從事業務之人，因業務上之過失傷害人者，處1年以下有期徒刑、拘役或1千元以下罰金，致重傷者，處3年以下有期徒刑、拘役或2千元以下罰金。附件：臺灣基隆地方法院檢察署檢察官聲請簡易判決處刑書100年度偵字第3412號被告黃來福男48歲（民國○○年○○月○○日生）住基隆市○○區○○街71號之1身分證統一編號：Ｚ000000000號上列被告因過失傷害案件，業經偵查終結，認宜以簡易判決處刑，茲敘述犯罪事實及證據並所犯法條如下：犯罪事實一、黃來福於民國100年6月5日晚上7時許，駕駛車牌號碼7390－YB號自用小客車，沿基隆市東岸高架橋往中正路方向行駛，行經東岸高架橋出口時，本應注意汽車行駛時，駕駛人應注意車前狀況，並隨時採取必要之安全措施，而依當時天候晴、夜間有照明、路面係乾燥無缺陷之柏油路、路況無障礙物、視距良好等情形，又無不能注意之情事，竟疏未注意車前狀況，撞擊由吳泓敏所駕駛在前方停等紅燈之車牌號碼2030－B3號自用小客車，致吳泓敏受右側頸扭傷及拉傷、第3、4頸椎半脫位之傷害。二、案經吳泓敏訴由基隆市警察局第一分局報告偵辦。證據並所犯法條一、訊據被告黃來福對於前揭犯罪事實坦承不諱，核與證人吳泓敏及鄭元娟證述之情節相符，並有基隆市○○○道路交通事故現場圖、道路交通事故調查報告表(一)、(二)、道路交通事故談話紀錄表、車損及現場照片及診斷證明書等附卷可參。按駕駛人應注意車前狀況，隨時採取必要之安全措施，道路交通安全規則第94條第3項定有明文，而依本件肇事時天候晴、夜間有照明、路面係乾燥無缺陷之柏油路、路況無障礙物、視距良好等情，被告亦無不能注意之情事，其疏未注意車前狀況，而與告訴人之自用小客車發生碰撞，其有過失堪以認定。而證人吳泓敏因被告前揭過失行為，受有前揭傷害，已如前述，足證被告過失行為與告訴人所受傷害間有相當因果關係。綜上所述，被告犯嫌堪以認定。二、核被告所為係犯刑法第284條第1項前段之過失傷害罪嫌。三、依刑事訴訟法第451條第1項聲請逕以簡易判決處刑。此致臺灣基隆地方法院基隆簡易庭中華民國100年8月31日檢察官張志明上正本證明與原本無異中華民國100年9月24日書記官林子堯附錄：中華民國刑法第284條（過失傷害罪）因過失傷害人者，處6月以下有期徒刑、拘役或5百元以下罰金，致重傷者，處1年以下有期徒刑、拘役或5百元以下罰金。從事業務之人，因業務上之過失傷害人者，處1年以下有期徒刑、拘役或1千元以下罰金，致重傷者，處3年以下有期徒刑、拘役或2千元以下罰金。",
  "characters": {
    "judges": [
      "吳佳齡"
    ],
    "prosecutors": [

    ],
    "lawyers": [

    ],
    "clerks": [

    ],
    "plaintiffs": [

    ],
    "defendants": [
      "黃來福",
      "黃來福  男  48歲（民國○○年○○月○○日生）"
    ],
    "prosecutor_office": [
      "臺灣基隆地方法院檢察署檢察官"
    ],
    "creditors": [

    ],
    "debtors": [

    ],
    "judicial_associate_officer": [

    ]
  },
  "adjudged_at": "2011-10-28",
  "created_at": "2016-02-14 06:02:32",
  "updated_at": "2016-02-14 06:02:32"
}