{
  "identify": "TYD-100-審易-1966-20111028-1",
  "court": {
    "name": "臺灣桃園地方法院",
    "code": "TYD"
  },
  "division": {
    "name": "刑事",
    "code": "M"
  },
  "year": 100,
  "word": "審易",
  "number": "1966",
  "jcheck": "1",
  "reason": "毒品危害防制條例",
  "content": "臺灣桃園地方法院宣示判決筆錄       100年度審易字第1966號\n公  訴  人  臺灣桃園地方法院檢察署檢察官\n被      告  廖國豪\n上列被告因毒品危害防制條例案件（起訴案號：100 年度毒偵字\n第2993號），於中華民國100 年10月28日下午5 時，在本院第十\n四法庭宣示判決，出席職員如下：\n          法  官  羅國鴻\n          書記官  張筆隆\n法官起立朗讀判決主文、犯罪事實要旨、處罰條文，及告以上訴\n限制、期間並提出上訴狀之法院，且諭知記載其內容：\n一、主  文：\n    廖國豪施用第二級毒品，累犯，處有期徒刑月，如易科罰\n    金，以新臺幣壹仟元折算壹日，扣案之第二級毒品甲基安非\n    他命及用以包裝上開毒品之包裝袋貳個（驗餘合計毛重零點\n    陸伍壹柒公克）沒收銷燬之，扣案之玻璃球吸食器壹組、挖\n    杓壹支均沒收。\n二、犯罪事實要旨：\n    廖國豪前於民國89年間因施用毒品案件，經臺灣臺北地方法\n    院以89年度毒聲字第1263號裁定送觀察、勒戒後，認有繼續\n    施用毒品之傾向，再由臺灣臺東地方法院以89年度毒聲字第\n    493 號裁定令入戒治處所施以強制戒治，因其戒治成效經評\n    定為合格，復經臺灣臺東地方法院以90年度毒聲字第236 號\n    裁定停止戒治，於90年6 月8 日停止戒治出所，並付保護管\n    束，迄至90年9 月24日保護管束期滿未經撤銷，視為強制戒\n    治期滿執行完畢，該次施用毒品犯行，並經臺灣臺東地方法\n    院檢察署檢察官以90年度戒毒偵字第86號為不起訴處分確定\n    。於94年間（即前開強制戒治執行完畢釋放後5 年內）復因\n    施用毒品案件，經本院94年度壢簡字第1588號判處有期徒刑\n    5 月確定，入監執行後，已於97年1 月9 日期滿執行完畢。\n    詎其仍不知悔改，復基於施用第二級毒品甲基安非他命之犯\n    意，於100 年6 月6 至7 日某時，在桃園縣中壢市○○街10\n    號2 樓之18住處，以玻璃球吸食器燒烤之方式，施用第二級\n    毒品甲基安非他命1 次。嗣於100 年6 月8 日上午10時20分\n    許，為警在上址查獲，並扣得第二級毒品甲基安非他命2 包\n    （驗餘合計毛重0.6517公克），及其所有供其施用本件第二\n    級毒品所用之玻璃球吸食器1 組、刮杓1 支。\n三、處罰條文：\n    毒品危害防制條例第10條第2 項、第18條第1 項前段，刑法\n    第11條、第47條第1 項、第41條第1 項前段、第38條第1 項\n    第2 款。\n四、協商判決除有刑事訴訟法第455 條之4 第1 項第1 款於本訊\n    問程序終結前，被告撤銷協商合意或檢察官撤回協商聲請者\n    ；第2 款被告協商之意思非出於自由意志者；第4 款被告所\n    犯之罪非第455 條之2 第1 項所定得以協商判決者；第6 款\n    被告有其他較重之裁判上一罪之犯罪事實者；第7 款法院認\n    應諭知免刑或免訴、不受理者情形之一，及違反同條第2 項\n    「法院應於協商合意範圍內為判決；法院為協商判決所科之\n    刑，以宣告緩刑或2 年以下有期徒刑、拘役或罰金為限」之\n    規定者外，不得上訴。\n五、如有前項得上訴之情形者，得自收受判決送達後10日內，向\n    本院提出上訴書狀，上訴於第二審法院。\n中    華    民    國    100   年    10    月    28    日\n                        刑事庭      法  官  羅國鴻\n                                    書記官  張筆隆\n以上正本證明與原本無異。\n                                    書記官  張筆隆\n中    華    民    國    100   年    10    月    28    日\n【論罪科刑法條】\n毒品危害防制條例第10條\n施用第一級毒品者，處6 月以上5 年以下有期徒刑。\n施用第二級毒品者，處3 年以下有期徒刑",
  "structure": {
  },
  "search": "臺灣桃園地方法院宣示判決筆錄100年度審易字第1966號公訴人臺灣桃園地方法院檢察署檢察官被告廖國豪上列被告因毒品危害防制條例案件（起訴案號：100年度毒偵字第2993號），於中華民國100年10月28日下午5時，在本院第十四法庭宣示判決，出席職員如下：法官羅國鴻書記官張筆隆法官起立朗讀判決主文、犯罪事實要旨、處罰條文，及告以上訴限制、期間並提出上訴狀之法院，且諭知記載其內容：一、主文：廖國豪施用第二級毒品，累犯，處有期徒刑月，如易科罰金，以新臺幣壹仟元折算壹日，扣案之第二級毒品甲基安非他命及用以包裝上開毒品之包裝袋貳個（驗餘合計毛重零點陸伍壹柒公克）沒收銷燬之，扣案之玻璃球吸食器壹組、挖杓壹支均沒收。二、犯罪事實要旨：廖國豪前於民國89年間因施用毒品案件，經臺灣臺北地方法院以89年度毒聲字第1263號裁定送觀察、勒戒後，認有繼續施用毒品之傾向，再由臺灣臺東地方法院以89年度毒聲字第493號裁定令入戒治處所施以強制戒治，因其戒治成效經評定為合格，復經臺灣臺東地方法院以90年度毒聲字第236號裁定停止戒治，於90年6月8日停止戒治出所，並付保護管束，迄至90年9月24日保護管束期滿未經撤銷，視為強制戒治期滿執行完畢，該次施用毒品犯行，並經臺灣臺東地方法院檢察署檢察官以90年度戒毒偵字第86號為不起訴處分確定。於94年間（即前開強制戒治執行完畢釋放後5年內）復因施用毒品案件，經本院94年度壢簡字第1588號判處有期徒刑5月確定，入監執行後，已於97年1月9日期滿執行完畢。詎其仍不知悔改，復基於施用第二級毒品甲基安非他命之犯意，於100年6月6至7日某時，在桃園縣中壢市○○街10號2樓之18住處，以玻璃球吸食器燒烤之方式，施用第二級毒品甲基安非他命1次。嗣於100年6月8日上午10時20分許，為警在上址查獲，並扣得第二級毒品甲基安非他命2包（驗餘合計毛重0.6517公克），及其所有供其施用本件第二級毒品所用之玻璃球吸食器1組、刮杓1支。三、處罰條文：毒品危害防制條例第10條第2項、第18條第1項前段，刑法第11條、第47條第1項、第41條第1項前段、第38條第1項第2款。四、協商判決除有刑事訴訟法第455條之4第1項第1款於本訊問程序終結前，被告撤銷協商合意或檢察官撤回協商聲請者；第2款被告協商之意思非出於自由意志者；第4款被告所犯之罪非第455條之2第1項所定得以協商判決者；第6款被告有其他較重之裁判上一罪之犯罪事實者；第7款法院認應諭知免刑或免訴、不受理者情形之一，及違反同條第2項「法院應於協商合意範圍內為判決；法院為協商判決所科之刑，以宣告緩刑或2年以下有期徒刑、拘役或罰金為限」之規定者外，不得上訴。五、如有前項得上訴之情形者，得自收受判決送達後10日內，向本院提出上訴書狀，上訴於第二審法院。中華民國100年10月28日刑事庭法官羅國鴻書記官張筆隆以上正本證明與原本無異。書記官張筆隆中華民國100年10月28日【論罪科刑法條】毒品危害防制條例第10條施用第一級毒品者，處6月以上5年以下有期徒刑。施用第二級毒品者，處3年以下有期徒刑",
  "characters": {
    "judges": [
      "羅國鴻",
      "羅國鴻"
    ],
    "prosecutors": [

    ],
    "lawyers": [

    ],
    "clerks": [
      "張筆隆",
      "張筆隆",
      "張筆隆"
    ],
    "plaintiffs": [

    ],
    "defendants": [
      "廖國豪"
    ],
    "prosecutor_office": [
      "臺灣桃園地方法院檢察署檢察官"
    ],
    "creditors": [

    ],
    "debtors": [

    ],
    "judicial_associate_officer": [

    ]
  },
  "adjudged_at": "2011-10-28",
  "created_at": "2016-02-14 05:59:27",
  "updated_at": "2016-02-14 05:59:27"
}