{
  "identify": "PTD-100-聲-1356-20110922-1",
  "court": {
    "name": "臺灣屏東地方法院",
    "code": "PTD"
  },
  "division": {
    "name": "刑事",
    "code": "M"
  },
  "year": 100,
  "word": "聲",
  "number": "1356",
  "jcheck": "1",
  "reason": "聲明異議",
  "content": "臺灣屏東地方法院刑事裁定             100年度聲字第1356號\n聲明異議人  潘慶郎\n即受刑人\n上列聲明異議人即受刑人因違反毒品危害防制條例案件，聲明異\n議，本院裁定如下：\n    主  文\n聲明異議駁回。\n    理  由\n一、異議意旨如附件聲明異議狀（異議人誤載為抗告狀）所載。\n二、按送達於應受送達人之住居所、事務所或營業所，不獲會晤\n    應受送達人，亦無受領文書之同居人或受僱人時，得將文書\n    寄存送達地之自治機關或警察機關，並作送達通知書2 份，\n    1 份黏貼於應受送達人住居所、事務所或其就業處所門首，\n    另1 份置於該送達處所信箱或其他適當位置，以為送達。寄\n    存送達，自寄存之日起，經10日發生效力，為民事訴訟法第\n    138 條第1 項、第2 項所明定。該等規定，依刑事訴訟法第\n    62條規定，於刑事訴訟法準用之。故當送達人依此方式為送\n    達判決書正本起，經10日即已生送達效力，上訴期間，亦自\n    該送達之翌日起起算，至於應受送達人實際有無至警察機關\n    領取判決，及至警察機關領得判決之時日為何，並非所問（\n    最高法院87年度臺上字第3310號判決意旨參照）。次按受刑\n    人或其法定代理人或配偶以檢察官執行之指揮為不當者，得\n    向諭知該裁判之法院聲明異議，刑事訴訟法第484 條固定有\n    明文。惟該條文所稱「檢察官執行之指揮為不當」，係指檢\n    察官有積極執行指揮之違法及其執行方法有所不當等情形而\n    言（最高法院95年度臺抗字第486 號裁定意旨可資參照）。\n    是檢察官執行指揮如無違法或不當，聲明異議即無理由，應\n    由本院以裁定駁回。\n三、經查：\n  (一)聲明異議人即受刑人（下稱異議人）潘慶郎因違反毒品危害\n    防制條例案件，於民國100 年6 月16日經本院以100 年度訴\n    字第503 號判處有期徒刑1 年4 月及7 月，應執行有期徒刑\n    1 年9 月，嗣本院依異議人戶籍址屏東縣萬丹鄉○○○路50\n    巷11號交付郵政機關送達判決正本，因未獲會晤應受送達人\n    ，亦未見受領文書之同居人或受僱人，乃於100 年6 月29日\n    將上開判決書寄存於當地之警察機關即屏東縣政府警察局屏\n    東分局萬丹分駐所，並製作送達通知書兩份，一份黏貼於應\n    受送達人住居所、事務所、營業所或其就業處所門首，另一\n    份置於該送達處所信箱或其他適當位置，以為送達等情，有\n    本院送達證書可稽，並經本院職權調取本院100 年度訴字第\n    503 號全卷閱卷無誤。揆諸前揭說明，當送達人依此方式為\n    送達之日起經10日，即已生送達之效力，而上訴期間，亦自\n    該時日起算，至於異議人實際上何時至該警察機關領取判決\n    ，仍與該合法送達之效力不生影響。是以，本院前開判決已\n    於100 年7 月9 日發生送達效力。另再加計10日上訴期間及\n    4 日在途期間（因異議人住於本院所轄屏東縣，依法院訴訟\n    當事人在途期間標準第2 條之規定，上訴人向本院為訴訟行\n    為之在途期間為4 日），異議人如對本院前開判決不服欲提\n    起上訴，依前揭說明，其上訴期間乃於100 年7 月23日屆滿\n    ，惟因該日為休息日星期六，則依刑事訴訟法第62條準用民\n    事訴訟法第161 條規定，應依民法第122 條規定，以次日即\n    同年月25日（星期一）為上訴期間之屆滿日期，然異議人迄\n    該日止仍未提起上訴，故本院前開判決已於100 年7 月25日\n    確定等情，業經本院職權調取本院100 年度訴字第503 號全\n    卷閱卷無誤。異議人空言指摘本院前開判決未依刑事訴訟法\n    規定送達，致其未能提起上訴即逕送執行，然其並未提出具\n    體事證以實其說，且經遍查全案卷證亦無證據證明本件有捏\n    造送達通知之情形，是異議人所指顯屬無據。\n  (二)況且，本院前開判決迄今仍未經執行檢察官換發指揮書執行\n    乙情，有本院公務電話紀錄可憑。是揆諸前揭說明，所稱「\n    檢察官執行之指揮為不當」，須檢察官有積極執行指揮之違\n    法及其執行方法有所不當之情形，然就本案觀之，本院前開\n    判決確定後，檢察官迄未有何積極執行之指揮，遑論有何違\n    法或執行方法不當之可言，是受刑人於該案尚未經檢察官執\n    行指揮前即逕向本院聲明異議，尚無異議之標的，是其聲明\n    異議並不合法，應予駁回。\n四、依刑事訴訟法第486 條，裁定如主文。\n中    華    民    國   100    年    9     月    22    日\n                  刑事第二庭    法  官  陳秀慧\n以上正本證明與原本無異。\n如不服本裁定應於收受送達後五日內向本院提出抗告書狀敘述抗\n告之理由抗告於台灣高等法院高雄分院。\n中    華    民    國   100    年    9     月    22    日\n                                書記官  潘豐益",
  "structure": {
    "main": "聲明異議駁回。",
    "reason": "一、異議意旨如附件聲明異議狀（異議人誤載為抗告狀）所載。\n二、按送達於應受送達人之住居所、事務所或營業所，不獲會晤\n    應受送達人，亦無受領文書之同居人或受僱人時，得將文書\n    寄存送達地之自治機關或警察機關，並作送達通知書2 份，\n    1 份黏貼於應受送達人住居所、事務所或其就業處所門首，\n    另1 份置於該送達處所信箱或其他適當位置，以為送達。寄\n    存送達，自寄存之日起，經10日發生效力，為民事訴訟法第\n    138 條第1 項、第2 項所明定。該等規定，依刑事訴訟法第\n    62條規定，於刑事訴訟法準用之。故當送達人依此方式為送\n    達判決書正本起，經10日即已生送達效力，上訴期間，亦自\n    該送達之翌日起起算，至於應受送達人實際有無至警察機關\n    領取判決，及至警察機關領得判決之時日為何，並非所問（\n    最高法院87年度臺上字第3310號判決意旨參照）。次按受刑\n    人或其法定代理人或配偶以檢察官執行之指揮為不當者，得\n    向諭知該裁判之法院聲明異議，刑事訴訟法第484 條固定有\n    明文。惟該條文所稱「檢察官執行之指揮為不當」，係指檢\n    察官有積極執行指揮之違法及其執行方法有所不當等情形而\n    言（最高法院95年度臺抗字第486 號裁定意旨可資參照）。\n    是檢察官執行指揮如無違法或不當，聲明異議即無理由，應\n    由本院以裁定駁回。\n三、經查：\n  (一)聲明異議人即受刑人（下稱異議人）潘慶郎因違反毒品危害\n    防制條例案件，於民國100 年6 月16日經本院以100 年度訴\n    字第503 號判處有期徒刑1 年4 月及7 月，應執行有期徒刑\n    1 年9 月，嗣本院依異議人戶籍址屏東縣萬丹鄉○○○路50\n    巷11號交付郵政機關送達判決正本，因未獲會晤應受送達人\n    ，亦未見受領文書之同居人或受僱人，乃於100 年6 月29日\n    將上開判決書寄存於當地之警察機關即屏東縣政府警察局屏\n    東分局萬丹分駐所，並製作送達通知書兩份，一份黏貼於應\n    受送達人住居所、事務所、營業所或其就業處所門首，另一\n    份置於該送達處所信箱或其他適當位置，以為送達等情，有\n    本院送達證書可稽，並經本院職權調取本院100 年度訴字第\n    503 號全卷閱卷無誤。揆諸前揭說明，當送達人依此方式為\n    送達之日起經10日，即已生送達之效力，而上訴期間，亦自\n    該時日起算，至於異議人實際上何時至該警察機關領取判決\n    ，仍與該合法送達之效力不生影響。是以，本院前開判決已\n    於100 年7 月9 日發生送達效力。另再加計10日上訴期間及\n    4 日在途期間（因異議人住於本院所轄屏東縣，依法院訴訟\n    當事人在途期間標準第2 條之規定，上訴人向本院為訴訟行\n    為之在途期間為4 日），異議人如對本院前開判決不服欲提\n    起上訴，依前揭說明，其上訴期間乃於100 年7 月23日屆滿\n    ，惟因該日為休息日星期六，則依刑事訴訟法第62條準用民\n    事訴訟法第161 條規定，應依民法第122 條規定，以次日即\n    同年月25日（星期一）為上訴期間之屆滿日期，然異議人迄\n    該日止仍未提起上訴，故本院前開判決已於100 年7 月25日\n    確定等情，業經本院職權調取本院100 年度訴字第503 號全\n    卷閱卷無誤。異議人空言指摘本院前開判決未依刑事訴訟法\n    規定送達，致其未能提起上訴即逕送執行，然其並未提出具\n    體事證以實其說，且經遍查全案卷證亦無證據證明本件有捏\n    造送達通知之情形，是異議人所指顯屬無據。\n  (二)況且，本院前開判決迄今仍未經執行檢察官換發指揮書執行\n    乙情，有本院公務電話紀錄可憑。是揆諸前揭說明，所稱「\n    檢察官執行之指揮為不當」，須檢察官有積極執行指揮之違\n    法及其執行方法有所不當之情形，然就本案觀之，本院前開\n    判決確定後，檢察官迄未有何積極執行之指揮，遑論有何違\n    法或執行方法不當之可言，是受刑人於該案尚未經檢察官執\n    行指揮前即逕向本院聲明異議，尚無異議之標的，是其聲明\n    異議並不合法，應予駁回。\n四、依刑事訴訟法第486 條，裁定如主文。"
  },
  "search": "臺灣屏東地方法院刑事裁定100年度聲字第1356號聲明異議人潘慶郎即受刑人上列聲明異議人即受刑人因違反毒品危害防制條例案件，聲明異議，本院裁定如下：主文聲明異議駁回。理由一、異議意旨如附件聲明異議狀（異議人誤載為抗告狀）所載。二、按送達於應受送達人之住居所、事務所或營業所，不獲會晤應受送達人，亦無受領文書之同居人或受僱人時，得將文書寄存送達地之自治機關或警察機關，並作送達通知書2份，1份黏貼於應受送達人住居所、事務所或其就業處所門首，另1份置於該送達處所信箱或其他適當位置，以為送達。寄存送達，自寄存之日起，經10日發生效力，為民事訴訟法第138條第1項、第2項所明定。該等規定，依刑事訴訟法第62條規定，於刑事訴訟法準用之。故當送達人依此方式為送達判決書正本起，經10日即已生送達效力，上訴期間，亦自該送達之翌日起起算，至於應受送達人實際有無至警察機關領取判決，及至警察機關領得判決之時日為何，並非所問（最高法院87年度臺上字第3310號判決意旨參照）。次按受刑人或其法定代理人或配偶以檢察官執行之指揮為不當者，得向諭知該裁判之法院聲明異議，刑事訴訟法第484條固定有明文。惟該條文所稱「檢察官執行之指揮為不當」，係指檢察官有積極執行指揮之違法及其執行方法有所不當等情形而言（最高法院95年度臺抗字第486號裁定意旨可資參照）。是檢察官執行指揮如無違法或不當，聲明異議即無理由，應由本院以裁定駁回。三、經查：(一)聲明異議人即受刑人（下稱異議人）潘慶郎因違反毒品危害防制條例案件，於民國100年6月16日經本院以100年度訴字第503號判處有期徒刑1年4月及7月，應執行有期徒刑1年9月，嗣本院依異議人戶籍址屏東縣萬丹鄉○○○路50巷11號交付郵政機關送達判決正本，因未獲會晤應受送達人，亦未見受領文書之同居人或受僱人，乃於100年6月29日將上開判決書寄存於當地之警察機關即屏東縣政府警察局屏東分局萬丹分駐所，並製作送達通知書兩份，一份黏貼於應受送達人住居所、事務所、營業所或其就業處所門首，另一份置於該送達處所信箱或其他適當位置，以為送達等情，有本院送達證書可稽，並經本院職權調取本院100年度訴字第503號全卷閱卷無誤。揆諸前揭說明，當送達人依此方式為送達之日起經10日，即已生送達之效力，而上訴期間，亦自該時日起算，至於異議人實際上何時至該警察機關領取判決，仍與該合法送達之效力不生影響。是以，本院前開判決已於100年7月9日發生送達效力。另再加計10日上訴期間及4日在途期間（因異議人住於本院所轄屏東縣，依法院訴訟當事人在途期間標準第2條之規定，上訴人向本院為訴訟行為之在途期間為4日），異議人如對本院前開判決不服欲提起上訴，依前揭說明，其上訴期間乃於100年7月23日屆滿，惟因該日為休息日星期六，則依刑事訴訟法第62條準用民事訴訟法第161條規定，應依民法第122條規定，以次日即同年月25日（星期一）為上訴期間之屆滿日期，然異議人迄該日止仍未提起上訴，故本院前開判決已於100年7月25日確定等情，業經本院職權調取本院100年度訴字第503號全卷閱卷無誤。異議人空言指摘本院前開判決未依刑事訴訟法規定送達，致其未能提起上訴即逕送執行，然其並未提出具體事證以實其說，且經遍查全案卷證亦無證據證明本件有捏造送達通知之情形，是異議人所指顯屬無據。(二)況且，本院前開判決迄今仍未經執行檢察官換發指揮書執行乙情，有本院公務電話紀錄可憑。是揆諸前揭說明，所稱「檢察官執行之指揮為不當」，須檢察官有積極執行指揮之違法及其執行方法有所不當之情形，然就本案觀之，本院前開判決確定後，檢察官迄未有何積極執行之指揮，遑論有何違法或執行方法不當之可言，是受刑人於該案尚未經檢察官執行指揮前即逕向本院聲明異議，尚無異議之標的，是其聲明異議並不合法，應予駁回。四、依刑事訴訟法第486條，裁定如主文。中華民國100年9月22日刑事第二庭法官陳秀慧以上正本證明與原本無異。如不服本裁定應於收受送達後五日內向本院提出抗告書狀敘述抗告之理由抗告於台灣高等法院高雄分院。中華民國100年9月22日書記官潘豐益",
  "characters": {
    "judges": [
      "陳秀慧"
    ],
    "prosecutors": [

    ],
    "lawyers": [

    ],
    "clerks": [

    ],
    "plaintiffs": [

    ],
    "defendants": [

    ],
    "prosecutor_office": [

    ],
    "creditors": [

    ],
    "debtors": [

    ],
    "judicial_associate_officer": [

    ]
  },
  "adjudged_at": "2011-09-22",
  "created_at": "2016-02-12 15:15:13",
  "updated_at": "2016-02-12 15:15:13"
}