{
  "identify": "TYD-100-司聲繼-35-20110923-1",
  "court": {
    "name": "臺灣桃園地方法院",
    "code": "TYD"
  },
  "division": {
    "name": "民事",
    "code": "V"
  },
  "year": 100,
  "word": "司聲繼",
  "number": "35",
  "jcheck": "1",
  "reason": "聲請繼承",
  "content": "臺灣桃園地方法院民事裁定           100年度司聲繼字第35號\n聲  請  人  劉桂蘭\n相  對  人\n即被繼承人  吳如選 （亡）\n上列當事人聲請繼承事件，本院裁定如下：\n    主      文\n聲請駁回。\n聲請程序費用由聲請人負擔。\n    理      由\n一、本件聲請意旨略以：聲請人為被繼承人吳如選（男，民國15\n    年7 月29日出生，身分證字號：Ｚ000000000號）之配偶，被\n    繼承人於97年8 月16日死亡，遺有遺產，爰依法聲請繼承等\n    語，並提出被繼承人除戶戶籍謄本、親屬關係公證書、聲請\n    人護照及合照照片二張等為證。\n二、按大陸地區人民繼承臺灣地區人民之遺產者，應於繼承開始\n    起三年內以書面向繼承開始時被繼承人住所地之法院為繼承\n    之表示，逾期視為拋棄其繼承權，臺灣地區與大陸地區人民\n    關係條例第66條第1 項定有明文。\n三、經查，本件被繼承人於97年8 月16日死亡，聲請人於100 年\n    9 月15日方於本院100 年司聲繼字第35號聲請繼承事件具狀\n    聲請繼承，此有本院收狀戳章可證，業已超過首揭法條規定\n    之繼承開始後三年之期限，從而本件聲請於法未合，應予駁\n    回。\n四、依非訟事件法第21條第1項前段，裁定如主文。\n五、如對本裁定抗告須於送達後10日內向本院提出抗告狀，並應\n    繳納抗告費新台幣1,000 元。\n中    華    民    國  100     年    9     月    23    日\n                  家事法庭    司法事務官\n以上為正本係照原本作成",
  "structure": {
    "main": "聲請駁回。\n聲請程序費用由聲請人負擔。",
    "reason": "一、本件聲請意旨略以：聲請人為被繼承人吳如選（男，民國15\n    年7 月29日出生，身分證字號：Ｚ000000000號）之配偶，被\n    繼承人於97年8 月16日死亡，遺有遺產，爰依法聲請繼承等\n    語，並提出被繼承人除戶戶籍謄本、親屬關係公證書、聲請\n    人護照及合照照片二張等為證。\n二、按大陸地區人民繼承臺灣地區人民之遺產者，應於繼承開始\n    起三年內以書面向繼承開始時被繼承人住所地之法院為繼承\n    之表示，逾期視為拋棄其繼承權，臺灣地區與大陸地區人民\n    關係條例第66條第1 項定有明文。\n三、經查，本件被繼承人於97年8 月16日死亡，聲請人於100 年\n    9 月15日方於本院100 年司聲繼字第35號聲請繼承事件具狀\n    聲請繼承，此有本院收狀戳章可證，業已超過首揭法條規定\n    之繼承開始後三年之期限，從而本件聲請於法未合，應予駁\n    回。\n四、依非訟事件法第21條第1項前段，裁定如主文。\n五、如對本裁定抗告須於送達後10日內向本院提出抗告狀，並應\n    繳納抗告費新台幣1,000 元。"
  },
  "search": "臺灣桃園地方法院民事裁定100年度司聲繼字第35號聲請人劉桂蘭相對人即被繼承人吳如選（亡）上列當事人聲請繼承事件，本院裁定如下：主文聲請駁回。聲請程序費用由聲請人負擔。理由一、本件聲請意旨略以：聲請人為被繼承人吳如選（男，民國15年7月29日出生，身分證字號：Ｚ000000000號）之配偶，被繼承人於97年8月16日死亡，遺有遺產，爰依法聲請繼承等語，並提出被繼承人除戶戶籍謄本、親屬關係公證書、聲請人護照及合照照片二張等為證。二、按大陸地區人民繼承臺灣地區人民之遺產者，應於繼承開始起三年內以書面向繼承開始時被繼承人住所地之法院為繼承之表示，逾期視為拋棄其繼承權，臺灣地區與大陸地區人民關係條例第66條第1項定有明文。三、經查，本件被繼承人於97年8月16日死亡，聲請人於100年9月15日方於本院100年司聲繼字第35號聲請繼承事件具狀聲請繼承，此有本院收狀戳章可證，業已超過首揭法條規定之繼承開始後三年之期限，從而本件聲請於法未合，應予駁回。四、依非訟事件法第21條第1項前段，裁定如主文。五、如對本裁定抗告須於送達後10日內向本院提出抗告狀，並應繳納抗告費新台幣1,000元。中華民國100年9月23日家事法庭司法事務官以上為正本係照原本作成",
  "characters": {
    "judges": [

    ],
    "prosecutors": [

    ],
    "lawyers": [

    ],
    "clerks": [

    ],
    "plaintiffs": [

    ],
    "defendants": [

    ],
    "prosecutor_office": [
      "劉桂蘭"
    ],
    "creditors": [

    ],
    "debtors": [

    ],
    "judicial_associate_officer": [
      "以上為正本係照原本作成"
    ]
  },
  "adjudged_at": "2011-09-23",
  "created_at": "2016-02-12 15:06:55",
  "updated_at": "2016-02-12 15:06:55"
}