{
  "identify": "KSH-93-交附民-18-20040930-1",
  "court": {
    "name": "臺灣高等法院",
    "code": "KSH"
  },
  "division": {
    "name": "刑事",
    "code": "M"
  },
  "year": 93,
  "word": "交附民",
  "number": "18",
  "jcheck": "1",
  "reason": "業務過失傷害",
  "content": "臺灣高等法院高雄分院刑事附帶民事訴訟判決        九十三年度交附民字第一八號\n    原      告  甲○○\n    原  告兼右\n    法定代理人  丙○○\n    被      告  乙○○\n右列被告因業務過失傷害案件（九十三年度交上易字第四五號），原告提起附帶民事\n訴訟，請求損害賠償，本院判決如左：\n    主  文\n原告之訴及假執行之聲請均駁回。\n    事  實\n一、原告聲明求為判決，被告應賠償原告新台幣（下同）五百零五萬四千二百三十六\n    元及自起訴狀繕本送達翌日起至清償日止按年息百分之五計算之利息，並願供擔\n    保，聲請宣告假執行。其事實上陳述略稱，被告因過失撞傷原告甲○○，致原告\n    甲○○眼睛失明及機車損壞，為此請求被告應賠償原告機車修理費一萬九千元、\n    醫療費三萬九千二百三十六元、精神慰撫金五百萬元，爰求為判決如訴之聲明；\n    並援用刑事訴訟之證據。\n二、被告未提出書狀，亦未作何陳述，惟依其在刑事訴訟之陳述，不承認有何侵權行\n    為。\n    理  由\n一、按刑事訴訟諭知無罪、免訴或不受理之判決者，應以判決駁回原告之訴，刑事訴\n    訟法第五百零三條第一項前段定有明文。\n二、本件被告被訴業務過失傷害案件，業經臺灣高雄地方法院諭知無罪，檢察官不服\n    原判決提起上訴後，亦經本院判決上訴駁回在案。依照首開規定，自應駁回原告\n    附帶提起之民事訴訟，其假執行之聲請因亦無所附麗，應併予駁回。\n三、據上論斷，應依刑事訴訟法第五百零三條第一項前段，判決如主文。\n中    華    民    國      九十三      年      九      月      三十      日\n                              臺灣高等法院高雄分院刑事第六庭\n                                  審判長法官  王憲義\n                                        法官  張盛喜\n                                        法官  范惠瑩\n右正本證明與原本無異。\n如不服本判決應於收受本判決後十日內向本院提出上訴書狀，其未述上訴理由者，\n並得於提起上訴後十日內向本院補提理由書狀（均須按他造當事人之人數附繕本)「\n切勿逕送上級法院」。\n                                      書記官  呂明燕\n中    華    民    國      九十三      年      十      月       一       日\n",
  "structure": {
    "main": "原告之訴及假執行之聲請均駁回。",
    "fact": "一、原告聲明求為判決，被告應賠償原告新台幣（下同）五百零五萬四千二百三十六\n    元及自起訴狀繕本送達翌日起至清償日止按年息百分之五計算之利息，並願供擔\n    保，聲請宣告假執行。其事實上陳述略稱，被告因過失撞傷原告甲○○，致原告\n    甲○○眼睛失明及機車損壞，為此請求被告應賠償原告機車修理費一萬九千元、\n    醫療費三萬九千二百三十六元、精神慰撫金五百萬元，爰求為判決如訴之聲明；\n    並援用刑事訴訟之證據。\n二、被告未提出書狀，亦未作何陳述，惟依其在刑事訴訟之陳述，不承認有何侵權行\n    為。",
    "reason": "一、按刑事訴訟諭知無罪、免訴或不受理之判決者，應以判決駁回原告之訴，刑事訴\n    訟法第五百零三條第一項前段定有明文。\n二、本件被告被訴業務過失傷害案件，業經臺灣高雄地方法院諭知無罪，檢察官不服\n    原判決提起上訴後，亦經本院判決上訴駁回在案。依照首開規定，自應駁回原告\n    附帶提起之民事訴訟，其假執行之聲請因亦無所附麗，應併予駁回。\n三、據上論斷，應依刑事訴訟法第五百零三條第一項前段，判決如主文。\n中    華    民    國      九十三      年      九      月      三十      日\n                              臺灣高等法院高雄分院刑事第六庭\n                                  審判長法官  王憲義\n                                        法官  張盛喜\n                                        法官  范惠瑩\n右正本證明與原本無異。\n如不服本判決應於收受本判決後十日內向本院提出上訴書狀，其未述上訴理由者，\n並得於提起上訴後十日內向本院補提理由書狀（均須按他造當事人之人數附繕本)「\n切勿逕送上級法院」。\n                                      書記官  呂明燕"
  },
  "search": "臺灣高等法院高雄分院刑事附帶民事訴訟判決九十三年度交附民字第一八號原告甲○○原告兼右法定代理人丙○○被告乙○○右列被告因業務過失傷害案件（九十三年度交上易字第四五號），原告提起附帶民事訴訟，請求損害賠償，本院判決如左：主文原告之訴及假執行之聲請均駁回。事實一、原告聲明求為判決，被告應賠償原告新台幣（下同）五百零五萬四千二百三十六元及自起訴狀繕本送達翌日起至清償日止按年息百分之五計算之利息，並願供擔保，聲請宣告假執行。其事實上陳述略稱，被告因過失撞傷原告甲○○，致原告甲○○眼睛失明及機車損壞，為此請求被告應賠償原告機車修理費一萬九千元、醫療費三萬九千二百三十六元、精神慰撫金五百萬元，爰求為判決如訴之聲明；並援用刑事訴訟之證據。二、被告未提出書狀，亦未作何陳述，惟依其在刑事訴訟之陳述，不承認有何侵權行為。理由一、按刑事訴訟諭知無罪、免訴或不受理之判決者，應以判決駁回原告之訴，刑事訴訟法第五百零三條第一項前段定有明文。二、本件被告被訴業務過失傷害案件，業經臺灣高雄地方法院諭知無罪，檢察官不服原判決提起上訴後，亦經本院判決上訴駁回在案。依照首開規定，自應駁回原告附帶提起之民事訴訟，其假執行之聲請因亦無所附麗，應併予駁回。三、據上論斷，應依刑事訴訟法第五百零三條第一項前段，判決如主文。中華民國九十三年九月三十日臺灣高等法院高雄分院刑事第六庭審判長法官王憲義法官張盛喜法官范惠瑩右正本證明與原本無異。如不服本判決應於收受本判決後十日內向本院提出上訴書狀，其未述上訴理由者，並得於提起上訴後十日內向本院補提理由書狀（均須按他造當事人之人數附繕本)「切勿逕送上級法院」。書記官呂明燕中華民國九十三年十月一日",
  "characters": {
    "judges": [

    ],
    "prosecutors": [

    ],
    "lawyers": [

    ],
    "clerks": [
      "呂明燕"
    ],
    "plaintiffs": [
      "甲"
    ],
    "defendants": [
      "乙○○",
      "右列被告因業務過失傷害案件（九十三年度交上易字第四五號），原告提起附帶民事"
    ],
    "prosecutor_office": [

    ],
    "creditors": [

    ],
    "debtors": [

    ],
    "judicial_associate_officer": [

    ]
  },
  "adjudged_at": "2004-09-30",
  "created_at": "2016-02-06 01:07:26",
  "updated_at": "2016-02-06 01:07:26"
}