{
  "identify": "TPD-94-拍-1002-20051122-2",
  "court": {
    "name": "臺灣臺北地方法院",
    "code": "TPD"
  },
  "division": {
    "name": "民事",
    "code": "V"
  },
  "year": 94,
  "word": "拍",
  "number": "1002",
  "jcheck": "2",
  "reason": "拍賣抵押物",
  "content": "臺灣臺北地方法院民事裁定              94年度拍字第1002號\n聲  請  人  丙○○\n相  對  人  乙○○\n相  對  人  甲○○\n上列當事人間聲請拍賣抵押物事件，本院裁定如下：\n    主  文\n相對人乙○○所有如附表所示之不動產准予拍賣。\n聲請人其餘聲請駁回。\n聲請程序費用由相對人乙○○負擔。\n    理  由\n一、按抵押權人於債權已屆清償期而未受清償者，得聲請法院拍\n    賣抵押物，就其賣得價金而受清償，民法第873條第1項定有\n    明文。\n二、本件聲請意旨略以：相對人乙○○、甲○○於民國93年10月\n    8 日，以其所有如附表所示之不動產，為擔保其對聲請人所\n    欠借款之清償，設定新台幣（下同）5,000,000元之本金最\n    高限額抵押權，存續日期自93年10月8日起至123年10月7日\n    止，債務清償期依照各個債務契約所定清償日期，經登記在\n    案。茲相對人對聲請人負債5,000,000元，已屆清償期而未\n    為清償，為此聲請拍賣抵押物，以資受償，並提出抵押權設\n    定契約書影本、他項權利證明書影本、土地及建物登記簿謄\n    本、借據影本等件為證。\n三、除相對人甲○○非系爭不動產所有人，對該不動產無處分權\n    ，聲請人對之聲請拍賣扺押物，於法無據，該部分聲請應予\n    駁回外，其餘部分聲請經核尚無不合，應予准許。\n四、依非訟事件法第21條第2項、民事訴訟法第79條但書，裁定\n    如主文。\n中    華    民    國    94    年    11    月    22    日\n                  民事第六庭    法  官  郭美杏\n以上正本係照原本作成\n如不服本裁定應於送達後10日內向本院提出抗告狀，並繳納抗告費。\n中    華    民    國    94    年    11    月    22    日\n                                書記官  潘惠梅\n",
  "structure": {
    "main": "相對人乙○○所有如附表所示之不動產准予拍賣。\n聲請人其餘聲請駁回。\n聲請程序費用由相對人乙○○負擔。",
    "reason": "一、按抵押權人於債權已屆清償期而未受清償者，得聲請法院拍\n    賣抵押物，就其賣得價金而受清償，民法第873條第1項定有\n    明文。\n二、本件聲請意旨略以：相對人乙○○、甲○○於民國93年10月\n    8 日，以其所有如附表所示之不動產，為擔保其對聲請人所\n    欠借款之清償，設定新台幣（下同）5,000,000元之本金最\n    高限額抵押權，存續日期自93年10月8日起至123年10月7日\n    止，債務清償期依照各個債務契約所定清償日期，經登記在\n    案。茲相對人對聲請人負債5,000,000元，已屆清償期而未\n    為清償，為此聲請拍賣抵押物，以資受償，並提出抵押權設\n    定契約書影本、他項權利證明書影本、土地及建物登記簿謄\n    本、借據影本等件為證。\n三、除相對人甲○○非系爭不動產所有人，對該不動產無處分權\n    ，聲請人對之聲請拍賣扺押物，於法無據，該部分聲請應予\n    駁回外，其餘部分聲請經核尚無不合，應予准許。\n四、依非訟事件法第21條第2項、民事訴訟法第79條但書，裁定\n    如主文。"
  },
  "search": "臺灣臺北地方法院民事裁定94年度拍字第1002號聲請人丙○○相對人乙○○相對人甲○○上列當事人間聲請拍賣抵押物事件，本院裁定如下：主文相對人乙○○所有如附表所示之不動產准予拍賣。聲請人其餘聲請駁回。聲請程序費用由相對人乙○○負擔。理由一、按抵押權人於債權已屆清償期而未受清償者，得聲請法院拍賣抵押物，就其賣得價金而受清償，民法第873條第1項定有明文。二、本件聲請意旨略以：相對人乙○○、甲○○於民國93年10月8日，以其所有如附表所示之不動產，為擔保其對聲請人所欠借款之清償，設定新台幣（下同）5,000,000元之本金最高限額抵押權，存續日期自93年10月8日起至123年10月7日止，債務清償期依照各個債務契約所定清償日期，經登記在案。茲相對人對聲請人負債5,000,000元，已屆清償期而未為清償，為此聲請拍賣抵押物，以資受償，並提出抵押權設定契約書影本、他項權利證明書影本、土地及建物登記簿謄本、借據影本等件為證。三、除相對人甲○○非系爭不動產所有人，對該不動產無處分權，聲請人對之聲請拍賣扺押物，於法無據，該部分聲請應予駁回外，其餘部分聲請經核尚無不合，應予准許。四、依非訟事件法第21條第2項、民事訴訟法第79條但書，裁定如主文。中華民國94年11月22日民事第六庭法官郭美杏以上正本係照原本作成如不服本裁定應於送達後10日內向本院提出抗告狀，並繳納抗告費。中華民國94年11月22日書記官潘惠梅",
  "characters": {
    "judges": [
      "郭美杏"
    ],
    "prosecutors": [

    ],
    "lawyers": [

    ],
    "clerks": [
      "潘惠梅"
    ],
    "plaintiffs": [

    ],
    "defendants": [

    ],
    "prosecutor_office": [
      "丙"
    ],
    "creditors": [

    ],
    "debtors": [

    ],
    "judicial_associate_officer": [

    ]
  },
  "adjudged_at": "2005-11-22",
  "created_at": "2016-02-06 23:18:36",
  "updated_at": "2016-02-06 23:18:36"
}