{
  "identify": "TPD-100-事聲-16-20110304-1",
  "court": {
    "name": "臺灣臺北地方法院",
    "code": "TPD"
  },
  "division": {
    "name": "民事",
    "code": "V"
  },
  "year": 100,
  "word": "事聲",
  "number": "16",
  "jcheck": "1",
  "reason": "聲明異議",
  "content": "臺灣臺北地方法院民事裁定             100年度事聲字第16號\n異  議  人\n即  債權人  黃同立\n            蘇武佩英即被繼承.\n            蘇綏蘭即被繼承人.\n            蘇勵德即被繼承人.\n            蘇勵明即被繼承人.\n            蘇勵平即被繼承人.\n            謝余少萼\n            林苑即被繼承人林.\n            林芸即被繼承人林.\n            林衍即被繼承人林.\n            林衡即被繼承人林.\n            王鴻楨即被繼承人.\n            劉伯岱\n            吳綱華\n            陳季麟\n            鄭丹桂\n            蔡進益\n            高景辰\n            祝嘉敏即被繼承人.\n            祝嘉禧即被繼承人.\n            沈子乃即沈翠瑛，.\n            駱德榮即祝劍平之.\n            葉水生即田啟仁之.\n前列二十三人共同\n代  理  人  周燦雄律師\n上列異議人因與債務人劉陳碧珠、阮曉香、吳惠瑛、李孫英鑾、\n盛振華、陸元煦、武克疆、高碩文、陳聰、陳京、范士驤、劉仲\n華、祝德生、祝魯其璧、侯興長、林張玉葉、劉儒權、俞瓊珴等\n間拍賣抵押物強制執行事件，對於中華民國99年12月27日本院民\n事執行處司法事務官所為95年度執更一字第11號裁定提出異議，\n本院裁定如下：\n    主  文\n異議駁回。\n    理  由\n一、異議意旨略以：鈞院要求異議人提出拍賣抵押物裁定之確定\n    證明書或已送達債務人之證明，並非強制執行法第6條所規\n    定應提出之文件，台灣高等法院86年度抗字2923號裁定及學\n    者張登科均持相同見解，鈞院卻以異議人未提出為由而駁回\n    執行聲請，並無依據。又債權證明文件不以正本為必要，影\n    本亦可，最高法院99年度台抗字第416號裁定亦同此說。異\n    議人之債權係因代償債務人積欠合作金庫之債務而繼受取得\n    ，雖僅提出合作金庫出具之代償證明影本，然鈞院得依強制\n    執行法第19條之規定向合作金庫或地政事務所查詢以證明債\n    權確實存在，爰為此聲明異議等語。\n二、按抵押權人為拍賣抵押物之聲請，經法院為准予拍賣之裁定\n    ，固得以該裁定為執行名義，依強制執行法第4條第1項第5\n    款之規定，聲請強制執行，惟應提出債權及抵押權之證明\n    文件正本，同法第6條第1項第5款定有明文。如係設定最高\n    限額抵押權者，在抵押權人實行抵押權之前，其擔保之債權\n    尚未確定，尤需提出債權證明文件，俾能確定抵押權所擔保\n    債權之金額。又准予拍賣抵押物之裁定，雖不待確定，即得\n    為執行名義，然不宣示之裁定，應為送達，民事訴訟法第\n    236條第1項定有明文，是未經宣示之准予拍賣抵押物裁定，\n    應合法送達於債務人，對該債務人始生執行力，而具備開始\n    執行之要件，倘該拍賣抵押物裁定未經合法送達予債務人，\n    其執行力尚未成立，執行法院自不得據以強制執行。是以准\n    予拍賣抵押物之裁定聲請強制執行，固無庸提出確定證明書\n    正本，惟仍需提出已合法送達債務人之證明文件正本。而債\n    權人聲請強制執行時，倘未經提出上開證明文件者，應認聲\n    請強制執行之程式有欠缺，如定期命補正而逾期不為補正，\n    其強制執行之聲請即非合法，執行法院應依強制執行法第30\n    條之1準用民事訴訟法第249條第1項第6款之規定，以裁定駁\n    回之。\n三、經查：本件異議人執本院73年度拍字第1487號准予拍賣抵押\n    物之裁定為執行名義，聲請拍賣債務人劉陳碧珠等人所有之\n    不動產，主張渠等係代債務人劉陳碧珠等人向原抵押權人合\n    作金庫商業銀行（原名台灣省合作金庫）清償，而受有該等\n    債權及抵押權之讓與，固已檢附前揭民事裁定正本、他項權\n    利證明書正本及合作金庫商業銀行致異議人函文影本到院。\n    然未據提出前揭民事裁定已合法送達債務人劉陳碧珠等人之\n    文件正本(按系爭拍賣抵押物裁定卷宗業因逾保存年限已經\n    銷毀，無從調閱)及證明債權存在之代償文件正本，本院司\n    法事務官乃於民國99年12月1日及同年12月15日通知異議人\n    於文到10日內補正上開證明文件，異議人收受上開通知後，\n    逾期均未補正，揆諸前揭說明，其強制執行之聲請即難認為\n    合法，本院司法事務官據此駁回異議人強制執行之聲請，並\n    無違誤。異議人雖聲請執行法院向合作金庫商業銀行函詢有\n    無代償一事，惟查強制執行法第19條所規定之調查，係指執\n    行程序開始後債務人財產狀況之調查，與執行開始前債權人\n    應本於當事人進行主義提出債權證明文件正本，係屬兩事，\n    執行法院自無依強制執行法第19條規定向合作金庫商業銀行\n    函查確認之義務。綜上所述，異議意旨指摘原裁定不當，求\n    予廢棄，尚非有據，應予駁回。\n四、據上論結：本件異議為無理由，依強制執行法第30條之1、\n    民事訴訟法第240條之4第3項後段，裁定如主文。\n中    華    民    國   100    年    3     月    4     日\n                  民事第一庭    法  官  莊訓城\n以上正本係照原本作成\n如不服本裁定應於送達後10日內向本院提出抗告狀，並繳納抗告\n費新臺幣1,000元\n中    華    民    國   100    年    3     月    4     日\n                                書記官  陳俐妙",
  "structure": {
    "main": "異議駁回。",
    "reason": "一、異議意旨略以：鈞院要求異議人提出拍賣抵押物裁定之確定\n    證明書或已送達債務人之證明，並非強制執行法第6條所規\n    定應提出之文件，台灣高等法院86年度抗字2923號裁定及學\n    者張登科均持相同見解，鈞院卻以異議人未提出為由而駁回\n    執行聲請，並無依據。又債權證明文件不以正本為必要，影\n    本亦可，最高法院99年度台抗字第416號裁定亦同此說。異\n    議人之債權係因代償債務人積欠合作金庫之債務而繼受取得\n    ，雖僅提出合作金庫出具之代償證明影本，然鈞院得依強制\n    執行法第19條之規定向合作金庫或地政事務所查詢以證明債\n    權確實存在，爰為此聲明異議等語。\n二、按抵押權人為拍賣抵押物之聲請，經法院為准予拍賣之裁定\n    ，固得以該裁定為執行名義，依強制執行法第4條第1項第5\n    款之規定，聲請強制執行，惟應提出債權及抵押權之證明\n    文件正本，同法第6條第1項第5款定有明文。如係設定最高\n    限額抵押權者，在抵押權人實行抵押權之前，其擔保之債權\n    尚未確定，尤需提出債權證明文件，俾能確定抵押權所擔保\n    債權之金額。又准予拍賣抵押物之裁定，雖不待確定，即得\n    為執行名義，然不宣示之裁定，應為送達，民事訴訟法第\n    236條第1項定有明文，是未經宣示之准予拍賣抵押物裁定，\n    應合法送達於債務人，對該債務人始生執行力，而具備開始\n    執行之要件，倘該拍賣抵押物裁定未經合法送達予債務人，\n    其執行力尚未成立，執行法院自不得據以強制執行。是以准\n    予拍賣抵押物之裁定聲請強制執行，固無庸提出確定證明書\n    正本，惟仍需提出已合法送達債務人之證明文件正本。而債\n    權人聲請強制執行時，倘未經提出上開證明文件者，應認聲\n    請強制執行之程式有欠缺，如定期命補正而逾期不為補正，\n    其強制執行之聲請即非合法，執行法院應依強制執行法第30\n    條之1準用民事訴訟法第249條第1項第6款之規定，以裁定駁\n    回之。\n三、經查：本件異議人執本院73年度拍字第1487號准予拍賣抵押\n    物之裁定為執行名義，聲請拍賣債務人劉陳碧珠等人所有之\n    不動產，主張渠等係代債務人劉陳碧珠等人向原抵押權人合\n    作金庫商業銀行（原名台灣省合作金庫）清償，而受有該等\n    債權及抵押權之讓與，固已檢附前揭民事裁定正本、他項權\n    利證明書正本及合作金庫商業銀行致異議人函文影本到院。\n    然未據提出前揭民事裁定已合法送達債務人劉陳碧珠等人之\n    文件正本(按系爭拍賣抵押物裁定卷宗業因逾保存年限已經\n    銷毀，無從調閱)及證明債權存在之代償文件正本，本院司\n    法事務官乃於民國99年12月1日及同年12月15日通知異議人\n    於文到10日內補正上開證明文件，異議人收受上開通知後，\n    逾期均未補正，揆諸前揭說明，其強制執行之聲請即難認為\n    合法，本院司法事務官據此駁回異議人強制執行之聲請，並\n    無違誤。異議人雖聲請執行法院向合作金庫商業銀行函詢有\n    無代償一事，惟查強制執行法第19條所規定之調查，係指執\n    行程序開始後債務人財產狀況之調查，與執行開始前債權人\n    應本於當事人進行主義提出債權證明文件正本，係屬兩事，\n    執行法院自無依強制執行法第19條規定向合作金庫商業銀行\n    函查確認之義務。綜上所述，異議意旨指摘原裁定不當，求\n    予廢棄，尚非有據，應予駁回。\n四、據上論結：本件異議為無理由，依強制執行法第30條之1、\n    民事訴訟法第240條之4第3項後段，裁定如主文。"
  },
  "search": "臺灣臺北地方法院民事裁定100年度事聲字第16號異議人即債權人黃同立蘇武佩英即被繼承.蘇綏蘭即被繼承人.蘇勵德即被繼承人.蘇勵明即被繼承人.蘇勵平即被繼承人.謝余少萼林苑即被繼承人林.林芸即被繼承人林.林衍即被繼承人林.林衡即被繼承人林.王鴻楨即被繼承人.劉伯岱吳綱華陳季麟鄭丹桂蔡進益高景辰祝嘉敏即被繼承人.祝嘉禧即被繼承人.沈子乃即沈翠瑛，.駱德榮即祝劍平之.葉水生即田啟仁之.前列二十三人共同代理人周燦雄律師上列異議人因與債務人劉陳碧珠、阮曉香、吳惠瑛、李孫英鑾、盛振華、陸元煦、武克疆、高碩文、陳聰、陳京、范士驤、劉仲華、祝德生、祝魯其璧、侯興長、林張玉葉、劉儒權、俞瓊珴等間拍賣抵押物強制執行事件，對於中華民國99年12月27日本院民事執行處司法事務官所為95年度執更一字第11號裁定提出異議，本院裁定如下：主文異議駁回。理由一、異議意旨略以：鈞院要求異議人提出拍賣抵押物裁定之確定證明書或已送達債務人之證明，並非強制執行法第6條所規定應提出之文件，台灣高等法院86年度抗字2923號裁定及學者張登科均持相同見解，鈞院卻以異議人未提出為由而駁回執行聲請，並無依據。又債權證明文件不以正本為必要，影本亦可，最高法院99年度台抗字第416號裁定亦同此說。異議人之債權係因代償債務人積欠合作金庫之債務而繼受取得，雖僅提出合作金庫出具之代償證明影本，然鈞院得依強制執行法第19條之規定向合作金庫或地政事務所查詢以證明債權確實存在，爰為此聲明異議等語。二、按抵押權人為拍賣抵押物之聲請，經法院為准予拍賣之裁定，固得以該裁定為執行名義，依強制執行法第4條第1項第5款之規定，聲請強制執行，惟應提出債權及抵押權之證明文件正本，同法第6條第1項第5款定有明文。如係設定最高限額抵押權者，在抵押權人實行抵押權之前，其擔保之債權尚未確定，尤需提出債權證明文件，俾能確定抵押權所擔保債權之金額。又准予拍賣抵押物之裁定，雖不待確定，即得為執行名義，然不宣示之裁定，應為送達，民事訴訟法第236條第1項定有明文，是未經宣示之准予拍賣抵押物裁定，應合法送達於債務人，對該債務人始生執行力，而具備開始執行之要件，倘該拍賣抵押物裁定未經合法送達予債務人，其執行力尚未成立，執行法院自不得據以強制執行。是以准予拍賣抵押物之裁定聲請強制執行，固無庸提出確定證明書正本，惟仍需提出已合法送達債務人之證明文件正本。而債權人聲請強制執行時，倘未經提出上開證明文件者，應認聲請強制執行之程式有欠缺，如定期命補正而逾期不為補正，其強制執行之聲請即非合法，執行法院應依強制執行法第30條之1準用民事訴訟法第249條第1項第6款之規定，以裁定駁回之。三、經查：本件異議人執本院73年度拍字第1487號准予拍賣抵押物之裁定為執行名義，聲請拍賣債務人劉陳碧珠等人所有之不動產，主張渠等係代債務人劉陳碧珠等人向原抵押權人合作金庫商業銀行（原名台灣省合作金庫）清償，而受有該等債權及抵押權之讓與，固已檢附前揭民事裁定正本、他項權利證明書正本及合作金庫商業銀行致異議人函文影本到院。然未據提出前揭民事裁定已合法送達債務人劉陳碧珠等人之文件正本(按系爭拍賣抵押物裁定卷宗業因逾保存年限已經銷毀，無從調閱)及證明債權存在之代償文件正本，本院司法事務官乃於民國99年12月1日及同年12月15日通知異議人於文到10日內補正上開證明文件，異議人收受上開通知後，逾期均未補正，揆諸前揭說明，其強制執行之聲請即難認為合法，本院司法事務官據此駁回異議人強制執行之聲請，並無違誤。異議人雖聲請執行法院向合作金庫商業銀行函詢有無代償一事，惟查強制執行法第19條所規定之調查，係指執行程序開始後債務人財產狀況之調查，與執行開始前債權人應本於當事人進行主義提出債權證明文件正本，係屬兩事，執行法院自無依強制執行法第19條規定向合作金庫商業銀行函查確認之義務。綜上所述，異議意旨指摘原裁定不當，求予廢棄，尚非有據，應予駁回。四、據上論結：本件異議為無理由，依強制執行法第30條之1、民事訴訟法第240條之4第3項後段，裁定如主文。中華民國100年3月4日民事第一庭法官莊訓城以上正本係照原本作成如不服本裁定應於送達後10日內向本院提出抗告狀，並繳納抗告費新臺幣1,000元中華民國100年3月4日書記官陳俐妙",
  "characters": {
    "judges": [
      "莊訓城"
    ],
    "prosecutors": [

    ],
    "lawyers": [
      "周燦雄"
    ],
    "clerks": [

    ],
    "plaintiffs": [

    ],
    "defendants": [

    ],
    "prosecutor_office": [

    ],
    "creditors": [

    ],
    "debtors": [

    ],
    "judicial_associate_officer": [

    ]
  },
  "adjudged_at": "2011-03-04",
  "created_at": "2016-02-13 20:06:03",
  "updated_at": "2016-02-13 20:06:03"
}