{
  "identify": "TYD-99-監宣-365-20110304-1",
  "court": {
    "name": "臺灣桃園地方法院",
    "code": "TYD"
  },
  "division": {
    "name": "民事",
    "code": "V"
  },
  "year": 99,
  "word": "監宣",
  "number": "365",
  "jcheck": "1",
  "reason": "監護宣告",
  "content": "臺灣桃園地方法院民事裁定             99年度監宣字第365號\n聲  請  人  楊絲玲\n相  對  人  孫江平\n關  係  人（即選定監護人）\n            楊絲玲\n關  係  人（即指定會同開具財產清冊之人）\n            孫江翠\n上列聲請人對於相對人聲請監護宣告事件，本院裁定如下：\n    主  文\n宣告孫江平（男；民國○○年○○月○○日生；國民身分證統一編號：\nＺ000000000號）為受監護宣告人。\n選定楊絲玲（女；民國○○年○ 月○○日生；國民身分證統一編號：\nＺ000000000號）為受監護宣告人孫江平之監護人。\n指定孫江翠（女；民國○○年○○月○○日生；國民身分證統一編號：\nＺ000000000號）為會同開具財產清冊之人。\n聲請程序費用由受監護宣告人孫江平負擔。\n    理  由\n一、本件聲請意旨略以：聲請人為相對人孫江平之母，相對人於\n    民國○○年○○月○○日出生後即陸續出現多重障礙之現象，雖送\n    醫診治但未見起色，近日甚且已因精神障礙或其他心智缺陷\n    ，致不能為意思表示或受意思表示，或不能辨識其意思表示\n    之效果，爰依民法第14條第1 項、民事訴訟法第597 條第 1\n    項等規定，聲請鈞院准予對相對人為監護宣告。並依民法第\n    1111條規定指定聲請人為相對人之監護人暨指定相對人之胞\n    姊孫江翠為會同開具財產清冊之人，並提出戶籍謄本、診斷\n    證明書、中華民國身心障礙手冊影本等為證。\n二、按「對於因精神障礙或其他心智缺陷，致不能為意思表示或\n    受意思表示，或不能辨識其意思表示之效果者，法院得因本\n    人、配偶、四親等內之親屬、最近一年有同居事實之其他親\n    屬、檢察官、主管機關或社會福利機構之聲請，為監護之宣\n    告」，民法第14條第1 項定有明文。\n三、本件經本院於鑑定人行政院衛生署桃園療養院所屬精神鑑定\n    醫師周孫元先生前訊問相對人結果，相對人不會講話，只會\n    向發聲方向轉頭；另經訊問鑑定人所屬精神鑑定醫師周孫元\n    先生稱「相對人之前曾到院就診，診斷為重度智能不足，智\n    力只有一、二歲，有自閉症，此為長期情形，無法陳述，其\n    他詳鑑定報告」等語（參見本院民國100 年1 月24日訊問筆\n    錄）】。而依鑑定人行政院衛生署桃園療養院就相對人之精\n    神狀態所為之鑑定結果略稱：孫員為重度智能障礙及自閉症\n    之個案，領有多重障礙及重度智能障礙殘障手冊在案。孫員\n    八歲在本院診斷為重度智能障礙，目前在景仁教養院長期收\n    容，其社會、職業及生活功能完全退化，無法為言語意思表\n    示，日常生活需他人協助，一般經濟及社會性活動均有所缺\n    失，故謂因其心智缺陷，致其為意思表示、受意思表示或辨\n    識意思表示效果能力達不能之程度，未來更進一步回復之可\n    能性小等語，有該院民國100 年2 月22日桃療醫字第100000\n    1123號函暨所附精神鑑定報告書在卷可參。本院審酌於現場\n    訊問時相對人之精神、心智反應等狀況並參酌鑑定人之上揭\n    意見，認相對人目前之精神障礙與心智缺陷之程度，已無為\n    意思表示或受意思表示或辨識意思表示之效果的能力，而符\n    合受監護宣告之要件，爰依法宣告孫江平為應受監護宣告之\n    人。\n四、末按「受監護宣告之人應置監護人」、「法院為監護之宣告\n    時，應依職權就配偶、四親等內之親屬、最近一年有同居事\n    實之其他親屬、主管機關、社會福利機構或其他適當之人選\n    定一人或數人為監護人，並同時指定會同開具財產清冊之人\n    。法院為前項選定及指定前，得命主管機關或社會福利機構\n    進行訪視，提出調查報告及建議。監護之聲請人或利害關係\n    人亦得提出相關資料或證據，供法院斟酌」、「法院選定監\n    護人時，應依受監護宣告之人之最佳利益，優先考量受監護\n    宣告之人之意見，審酌一切情狀，並注意下列事項：一、受\n    監護宣告之人之身心狀態與生活及財產狀況。二、受監護宣\n    告之人與其配偶、子女或其他共同生活之人間之情感狀況。\n    三、監護人之職業、經歷、意見及其與受監護宣告之人之利\n    害關係。四、法人為監護人時，其事業之種類與內容，法人\n    及其代表人與受監護宣告之人之利害關係」，民法第1110條\n    、第1111條、第1111條之1 分別定有明文。\n五、本件經本院函桃園縣政府請派員進行訪視後，據其提出之評\n    估建議略稱：相對人生活無法自理，從小即有身心障礙現象\n    ，長期住教養院，受照顧情形尚屬妥善，聲請人為其生母，\n    而孫江翠則為其胞姊，二人雖較少探視相對人，但均有意願\n    擔任監護人及會同開具財產清冊之人，建請法官以相對人之\n    最佳利益考量，督促聲請人及相對人之胞姊多加關懷相對人\n    ，並參酌相關事證後綜合裁量之等語，有桃園縣政府社會工\n    作師公會民國100 年1 月27日桃姚字第100034號函暨所附監\n    護宣告訪視報告附卷可參。\n六、綜上所述，聲請人楊絲玲為受監護宣告人孫江平之母，受監\n    護宣告人自出生迄今，均由其照顧並處理相關事宜，且有意\n    願擔任監護人，又無不適或不宜擔任監護人的積、消極原因\n    ，如由楊絲玲為受監護宣告人孫江平之監護人，應能符合受\n    監護宣告人之最佳利益，爰依法選定楊絲玲為受監護宣告人\n    孫江平之監護人；又關係人孫江翠為受監護宣告人之胞姊，\n    為姊弟關係，應熟知受監護宣告人之財產狀況，其既有意願\n    且具扶養義務，由其來擔任會同開具財產清冊之人，應堪勝\n    任，併依前揭規定指定孫江翠為會同開具財產清冊之人。\n七、依民事訴訟法第604 條第1 項、第608 條第1 項，裁定如主\n    文。\n中    華    民    國   100    年    3     月    4     日\n                        家事法庭法  官  鄭新後\n上列正本證明與原本無異。\n本裁定就對相對人之監護宣告部分不得抗告；另就其餘有關選定\n監護人及指定會同開具財產清冊之人部分如有不服，應於本裁定\n送達後10日內向本院提出抗告狀。\n中    華    民    國   100    年    3     月    4     日\n                                書記官 許家齡",
  "structure": {
    "main": "宣告孫江平（男；民國○○年○○月○○日生；國民身分證統一編號：\nＺ000000000號）為受監護宣告人。\n選定楊絲玲（女；民國○○年○ 月○○日生；國民身分證統一編號：\nＺ000000000號）為受監護宣告人孫江平之監護人。\n指定孫江翠（女；民國○○年○○月○○日生；國民身分證統一編號：\nＺ000000000號）為會同開具財產清冊之人。\n聲請程序費用由受監護宣告人孫江平負擔。",
    "reason": "一、本件聲請意旨略以：聲請人為相對人孫江平之母，相對人於\n    民國○○年○○月○○日出生後即陸續出現多重障礙之現象，雖送\n    醫診治但未見起色，近日甚且已因精神障礙或其他心智缺陷\n    ，致不能為意思表示或受意思表示，或不能辨識其意思表示\n    之效果，爰依民法第14條第1 項、民事訴訟法第597 條第 1\n    項等規定，聲請鈞院准予對相對人為監護宣告。並依民法第\n    1111條規定指定聲請人為相對人之監護人暨指定相對人之胞\n    姊孫江翠為會同開具財產清冊之人，並提出戶籍謄本、診斷\n    證明書、中華民國身心障礙手冊影本等為證。\n二、按「對於因精神障礙或其他心智缺陷，致不能為意思表示或\n    受意思表示，或不能辨識其意思表示之效果者，法院得因本\n    人、配偶、四親等內之親屬、最近一年有同居事實之其他親\n    屬、檢察官、主管機關或社會福利機構之聲請，為監護之宣\n    告」，民法第14條第1 項定有明文。\n三、本件經本院於鑑定人行政院衛生署桃園療養院所屬精神鑑定\n    醫師周孫元先生前訊問相對人結果，相對人不會講話，只會\n    向發聲方向轉頭；另經訊問鑑定人所屬精神鑑定醫師周孫元\n    先生稱「相對人之前曾到院就診，診斷為重度智能不足，智\n    力只有一、二歲，有自閉症，此為長期情形，無法陳述，其\n    他詳鑑定報告」等語（參見本院民國100 年1 月24日訊問筆\n    錄）】。而依鑑定人行政院衛生署桃園療養院就相對人之精\n    神狀態所為之鑑定結果略稱：孫員為重度智能障礙及自閉症\n    之個案，領有多重障礙及重度智能障礙殘障手冊在案。孫員\n    八歲在本院診斷為重度智能障礙，目前在景仁教養院長期收\n    容，其社會、職業及生活功能完全退化，無法為言語意思表\n    示，日常生活需他人協助，一般經濟及社會性活動均有所缺\n    失，故謂因其心智缺陷，致其為意思表示、受意思表示或辨\n    識意思表示效果能力達不能之程度，未來更進一步回復之可\n    能性小等語，有該院民國100 年2 月22日桃療醫字第100000\n    1123號函暨所附精神鑑定報告書在卷可參。本院審酌於現場\n    訊問時相對人之精神、心智反應等狀況並參酌鑑定人之上揭\n    意見，認相對人目前之精神障礙與心智缺陷之程度，已無為\n    意思表示或受意思表示或辨識意思表示之效果的能力，而符\n    合受監護宣告之要件，爰依法宣告孫江平為應受監護宣告之\n    人。\n四、末按「受監護宣告之人應置監護人」、「法院為監護之宣告\n    時，應依職權就配偶、四親等內之親屬、最近一年有同居事\n    實之其他親屬、主管機關、社會福利機構或其他適當之人選\n    定一人或數人為監護人，並同時指定會同開具財產清冊之人\n    。法院為前項選定及指定前，得命主管機關或社會福利機構\n    進行訪視，提出調查報告及建議。監護之聲請人或利害關係\n    人亦得提出相關資料或證據，供法院斟酌」、「法院選定監\n    護人時，應依受監護宣告之人之最佳利益，優先考量受監護\n    宣告之人之意見，審酌一切情狀，並注意下列事項：一、受\n    監護宣告之人之身心狀態與生活及財產狀況。二、受監護宣\n    告之人與其配偶、子女或其他共同生活之人間之情感狀況。\n    三、監護人之職業、經歷、意見及其與受監護宣告之人之利\n    害關係。四、法人為監護人時，其事業之種類與內容，法人\n    及其代表人與受監護宣告之人之利害關係」，民法第1110條\n    、第1111條、第1111條之1 分別定有明文。\n五、本件經本院函桃園縣政府請派員進行訪視後，據其提出之評\n    估建議略稱：相對人生活無法自理，從小即有身心障礙現象\n    ，長期住教養院，受照顧情形尚屬妥善，聲請人為其生母，\n    而孫江翠則為其胞姊，二人雖較少探視相對人，但均有意願\n    擔任監護人及會同開具財產清冊之人，建請法官以相對人之\n    最佳利益考量，督促聲請人及相對人之胞姊多加關懷相對人\n    ，並參酌相關事證後綜合裁量之等語，有桃園縣政府社會工\n    作師公會民國100 年1 月27日桃姚字第100034號函暨所附監\n    護宣告訪視報告附卷可參。\n六、綜上所述，聲請人楊絲玲為受監護宣告人孫江平之母，受監\n    護宣告人自出生迄今，均由其照顧並處理相關事宜，且有意\n    願擔任監護人，又無不適或不宜擔任監護人的積、消極原因\n    ，如由楊絲玲為受監護宣告人孫江平之監護人，應能符合受\n    監護宣告人之最佳利益，爰依法選定楊絲玲為受監護宣告人\n    孫江平之監護人；又關係人孫江翠為受監護宣告人之胞姊，\n    為姊弟關係，應熟知受監護宣告人之財產狀況，其既有意願\n    且具扶養義務，由其來擔任會同開具財產清冊之人，應堪勝\n    任，併依前揭規定指定孫江翠為會同開具財產清冊之人。\n七、依民事訴訟法第604 條第1 項、第608 條第1 項，裁定如主\n    文。"
  },
  "search": "臺灣桃園地方法院民事裁定99年度監宣字第365號聲請人楊絲玲相對人孫江平關係人（即選定監護人）楊絲玲關係人（即指定會同開具財產清冊之人）孫江翠上列聲請人對於相對人聲請監護宣告事件，本院裁定如下：主文宣告孫江平（男；民國○○年○○月○○日生；國民身分證統一編號：Ｚ000000000號）為受監護宣告人。選定楊絲玲（女；民國○○年○月○○日生；國民身分證統一編號：Ｚ000000000號）為受監護宣告人孫江平之監護人。指定孫江翠（女；民國○○年○○月○○日生；國民身分證統一編號：Ｚ000000000號）為會同開具財產清冊之人。聲請程序費用由受監護宣告人孫江平負擔。理由一、本件聲請意旨略以：聲請人為相對人孫江平之母，相對人於民國○○年○○月○○日出生後即陸續出現多重障礙之現象，雖送醫診治但未見起色，近日甚且已因精神障礙或其他心智缺陷，致不能為意思表示或受意思表示，或不能辨識其意思表示之效果，爰依民法第14條第1項、民事訴訟法第597條第1項等規定，聲請鈞院准予對相對人為監護宣告。並依民法第1111條規定指定聲請人為相對人之監護人暨指定相對人之胞姊孫江翠為會同開具財產清冊之人，並提出戶籍謄本、診斷證明書、中華民國身心障礙手冊影本等為證。二、按「對於因精神障礙或其他心智缺陷，致不能為意思表示或受意思表示，或不能辨識其意思表示之效果者，法院得因本人、配偶、四親等內之親屬、最近一年有同居事實之其他親屬、檢察官、主管機關或社會福利機構之聲請，為監護之宣告」，民法第14條第1項定有明文。三、本件經本院於鑑定人行政院衛生署桃園療養院所屬精神鑑定醫師周孫元先生前訊問相對人結果，相對人不會講話，只會向發聲方向轉頭；另經訊問鑑定人所屬精神鑑定醫師周孫元先生稱「相對人之前曾到院就診，診斷為重度智能不足，智力只有一、二歲，有自閉症，此為長期情形，無法陳述，其他詳鑑定報告」等語（參見本院民國100年1月24日訊問筆錄）】。而依鑑定人行政院衛生署桃園療養院就相對人之精神狀態所為之鑑定結果略稱：孫員為重度智能障礙及自閉症之個案，領有多重障礙及重度智能障礙殘障手冊在案。孫員八歲在本院診斷為重度智能障礙，目前在景仁教養院長期收容，其社會、職業及生活功能完全退化，無法為言語意思表示，日常生活需他人協助，一般經濟及社會性活動均有所缺失，故謂因其心智缺陷，致其為意思表示、受意思表示或辨識意思表示效果能力達不能之程度，未來更進一步回復之可能性小等語，有該院民國100年2月22日桃療醫字第1000001123號函暨所附精神鑑定報告書在卷可參。本院審酌於現場訊問時相對人之精神、心智反應等狀況並參酌鑑定人之上揭意見，認相對人目前之精神障礙與心智缺陷之程度，已無為意思表示或受意思表示或辨識意思表示之效果的能力，而符合受監護宣告之要件，爰依法宣告孫江平為應受監護宣告之人。四、末按「受監護宣告之人應置監護人」、「法院為監護之宣告時，應依職權就配偶、四親等內之親屬、最近一年有同居事實之其他親屬、主管機關、社會福利機構或其他適當之人選定一人或數人為監護人，並同時指定會同開具財產清冊之人。法院為前項選定及指定前，得命主管機關或社會福利機構進行訪視，提出調查報告及建議。監護之聲請人或利害關係人亦得提出相關資料或證據，供法院斟酌」、「法院選定監護人時，應依受監護宣告之人之最佳利益，優先考量受監護宣告之人之意見，審酌一切情狀，並注意下列事項：一、受監護宣告之人之身心狀態與生活及財產狀況。二、受監護宣告之人與其配偶、子女或其他共同生活之人間之情感狀況。三、監護人之職業、經歷、意見及其與受監護宣告之人之利害關係。四、法人為監護人時，其事業之種類與內容，法人及其代表人與受監護宣告之人之利害關係」，民法第1110條、第1111條、第1111條之1分別定有明文。五、本件經本院函桃園縣政府請派員進行訪視後，據其提出之評估建議略稱：相對人生活無法自理，從小即有身心障礙現象，長期住教養院，受照顧情形尚屬妥善，聲請人為其生母，而孫江翠則為其胞姊，二人雖較少探視相對人，但均有意願擔任監護人及會同開具財產清冊之人，建請法官以相對人之最佳利益考量，督促聲請人及相對人之胞姊多加關懷相對人，並參酌相關事證後綜合裁量之等語，有桃園縣政府社會工作師公會民國100年1月27日桃姚字第100034號函暨所附監護宣告訪視報告附卷可參。六、綜上所述，聲請人楊絲玲為受監護宣告人孫江平之母，受監護宣告人自出生迄今，均由其照顧並處理相關事宜，且有意願擔任監護人，又無不適或不宜擔任監護人的積、消極原因，如由楊絲玲為受監護宣告人孫江平之監護人，應能符合受監護宣告人之最佳利益，爰依法選定楊絲玲為受監護宣告人孫江平之監護人；又關係人孫江翠為受監護宣告人之胞姊，為姊弟關係，應熟知受監護宣告人之財產狀況，其既有意願且具扶養義務，由其來擔任會同開具財產清冊之人，應堪勝任，併依前揭規定指定孫江翠為會同開具財產清冊之人。七、依民事訴訟法第604條第1項、第608條第1項，裁定如主文。中華民國100年3月4日家事法庭法官鄭新後上列正本證明與原本無異。本裁定就對相對人之監護宣告部分不得抗告；另就其餘有關選定監護人及指定會同開具財產清冊之人部分如有不服，應於本裁定送達後10日內向本院提出抗告狀。中華民國100年3月4日書記官許家齡",
  "characters": {
    "judges": [
      "鄭新後"
    ],
    "prosecutors": [

    ],
    "lawyers": [

    ],
    "clerks": [

    ],
    "plaintiffs": [

    ],
    "defendants": [

    ],
    "prosecutor_office": [
      "楊絲玲"
    ],
    "creditors": [

    ],
    "debtors": [

    ],
    "judicial_associate_officer": [

    ]
  },
  "adjudged_at": "2011-03-04",
  "created_at": "2016-02-13 20:04:36",
  "updated_at": "2016-02-13 20:04:36"
}