{
  "identify": "TPD-90-交簡上-115-20021125-1",
  "court": {
    "name": "臺灣臺北地方法院",
    "code": "TPD"
  },
  "division": {
    "name": "刑事",
    "code": "M"
  },
  "year": 90,
  "word": "交簡上",
  "number": "115",
  "jcheck": "1",
  "reason": "過失傷害",
  "content": "臺灣臺北地方法院刑事判決                        九十年度交簡上字第一一五號\n    上  訴  人  臺灣臺北地方法院檢察署檢察官\n    被      告  甲○○\n右列上訴人因甲○○過失傷害案件，不服臺灣臺北地方法院臺北簡易庭民國九十年六\n月十一日九十年度北交簡字第一一０九號簡易判決（臺灣臺北地方法院檢察署檢察官\n聲請簡易判決處刑書案號：九十年度偵字第五六五三號），提起上訴，本院管轄之第\n二審合議庭判決如左：\n    主    文\n原判決撤銷。\n甲○○因過失傷害人，處有期徒刑月，如易科罰金，以佰元折算壹日。\n    事    實\n一、甲○○於民國八十九年十一月二十日晚間，駕駛車牌號碼二Ｇ－四六０五號自用\n    小客車，沿臺北市○○○路由北向南方向行駛，於同日晚間九時二十分許，行經\n    同路段二段一五一巷口，擬左轉東向進入該巷之際，原應注意汽車行駛至交岔路\n    口，轉彎車應讓直行車先行，而當時天雨、夜間有照明、視距良好、市區○○道\n    路濕潤、無缺陷及障礙，依其智識、能力又無不能注意之情事，詎甲○○竟疏未\n    注意同路段由南向北方向通過路口之直行車輛，貿然進入路口並左轉，適有乙○\n    ○騎乘車牌號碼ＢＣＱ－二九０號重型機車沿臺北市○○○路二段中間車道由南\n    向北方向行駛，亦疏未注意車前狀況、隨時採取必要之安全措施，貿然快速通過\n    路口，見甲○○所駕車輛橫亙路中業已閃煞不及，乙○○所乘重型機車車頭遂撞\n    及甲○○所駕車輛右側車身，受有右側顳顎關節髁狀突骨折合併關節盤破損、左\n    側下顎骨髁狀突下及正中聯合掌骨折、下頜五公分撕裂傷、牙齒開咬、左側股骨\n    骨折之傷害。甲○○於肇事後，主動撥打電話報警，並於警員前往現場處理時，\n    不逃避接受裁判而當場向警員自首、承認為肇事人而願接受裁判。\n二、案經乙○○訴由臺北市政府警察局大安分局報請臺灣臺北地方法院檢察署檢察官\n    聲請簡易判決處刑。\n    理    由\n一、訊據被告甲○○固不否認於右揭時、地駕駛車牌號碼二Ｇ－四六０五號自用小客\n    車，沿臺北市○○○路由北向南方向行駛，於左轉東向進入同路段二段一五一巷\n    巷之際，右側車身與告訴人乙○○所騎乘、車牌號碼ＢＣＱ－二九０號重型機車\n    車頭發生碰撞，造成告訴人受有右側顳顎關節髁狀突骨折合併關節盤破損、左側\n    下顎骨髁狀突下及正中聯合掌骨折、下頜五公分撕裂傷、牙齒開咬、左側股骨骨\n    折之傷害等情，惟辯稱：當日其左轉至交岔路口中央，因前方車輛擁塞而停頓，\n    告訴人超速行駛且未注意車前狀況，始撞擊其所駕、靜止在路口中之車輛右側車\n    身，故告訴人亦有過失，且因告訴人要求金額過高故未能達成和解云云。\n二、經查：\n（一）被告於八十九年十一月二十日晚間，駕駛車牌號碼二Ｇ－四六０五號自用小客\n      車，沿臺北市○○○路由北向南方向行駛，於同日晚間九時二十分許，行經同\n      路段二段一五一巷口，擬左轉東向進入該巷之際，疏未注意同路段由南向北方\n      向通過路口之直行車輛，貿然進入路口並左轉，適有告訴人騎乘車牌號碼ＢＣ\n      Ｑ－二九０號重型機車沿臺北市○○○路二段中間車道由南向北方向行駛，亦\n      疏未注意車前狀況、隨時採取必要之安全措施，貿然快速通過路口，見被告所\n      駕車輛橫亙路中業已閃煞不及，告訴人所乘重型機車車頭遂撞及被告所駕車輛\n      右側車身，受有右側顳顎關節髁狀突骨折合併關節盤破損、左側下顎骨髁狀突\n      下及正中聯合掌骨折、下頜五公分撕裂傷、牙齒開咬、左側股骨骨折等傷害之\n      事實，業據被告於警、偵訊及本院調查、審理中坦承不諱，核與告訴人指述情\n      節及臺北市政府警察局大安分局交通分隊道路交通事故調查報告表、談話紀錄\n      表、分析研判表補充資料表、診斷證明書、現場照片所載相符；而當時天雨、\n      夜間有照明、視距良好、市區○○道路濕潤、無缺陷及障礙，依其智識、能力\n      又無不能注意之情事，並據臺北市政府警察局大安分局交通分隊據報處理之員\n      警觀察、記載明確，有道路交通事故調查報告表附卷可稽。\n（二）按道路交通安全規則所稱之汽車指在道路上不依軌道或電力架線而以原動機行\n      駛之車輛（包括機器腳踏車）；汽車行駛至交岔路口，轉彎車應讓直行車先行\n      ；汽車行駛時，駕駛人應注意車前狀況及兩車併行之間隔，並隨時採取必要之\n      安全措施，道路交通安全規則第二條第一項第一款、第一百零二條第一項第六\n      款、第九十四條第三項定有明文。本件被告駕駛自用小客車，沿臺北市○○○\n      路由北向南方向行駛，行經同路段二段一五一巷口，擬左轉進入該巷之際，當\n      時天雨、夜間有照明、視距良好、市區○○道路濕潤、無缺陷及障礙，依其智\n      識、能力又無不能注意之情事，前已述及，被告竟疏未注意同路段由南向北方\n      向通過路口之直行車輛，貿然進入路口並左轉，致騎乘重型機車沿路段由南向\n      北方向直行通過路口之告訴人見狀閃煞不及、撞及被告所駕車輛右側車身，受\n      有右側顳顎關節髁狀突骨折合併關節盤破損、左側下顎骨髁狀突下及正中聯合\n      掌骨折、下頜五公分撕裂傷、牙齒開咬、左側股骨骨折之傷害，被告有過失甚\n      明，且其過失行為與告訴人之傷害間，有相當因果關係，臺北市車輛行車事故\n      鑑定委員會亦同此見解，有該會本鑑審字第九０六００一五０００號覆函暨鑑\n      定意見書可憑。雖告訴人亦有疏未注意車前狀況、隨時採取必要安全措施之過\n      失，前業提及，但告訴人之過失並不能減免被告之過失，是被告所辯，委無可\n      採。\n（三）綜上所述，本件事證明確，被告犯行堪以認定，應依法論科。\n三、核被告所為，係犯刑法第二百八十四條第一項前段因過失傷害人罪。被告於肇事\n    後，主動撥打電話報警，並於警員前往現場處理時，不逃避接受裁判而當場向警\n    員自首、承認為肇事人而願接受裁判，此經本院職權查證屬實，有臺北市政府警\n    察局交通警察大隊自首調查報告表可參，被告對於有權偵查犯罪之機關尚不知犯\n    罪事實及犯罪人之前自首而願接受裁判，應依刑法第六十二條前段之規定減輕其\n    刑。原審認事證明確，依刑事訴訟法第四百四十九條第一項前段、第四百五十四\n    條第二項，刑法第二百八十四條第一項前段、第六十二條前段、第四十一條，罰\n    金罰鍰提高標準條例第一條前段、第二條判處被告有期徒刑三月，並諭知如易科\n    罰金之折算標準，固非無見，惟刑法第四十一條已於九十年一月十日經總統公布\n    施行，並於同年月十二日生效，該條規定：「犯最重本刑為五年以下有期徒刑之\n    刑之罪，而受六個月以下有期徒刑或拘役之宣告，因身體、教育、職業、家庭之\n    關係或其他正當事由，執行顯有困難者，得以一元以上三元以下折算一日，易科\n    罰金。但確因不執行所宣告之刑，難收矯正之效，或難以維持法秩序者，不在此\n    限」、「併合處罰之數罪，均有前項情形，其應執行之刑逾六月者，亦同」；按\n    行為後法律有變更者，適用裁判時之法律，刑法第二條第一項前段定有明文，而\n    易服勞役及期間、數罪併罰之定執行刑、緩刑及易以訓誡、易科罰金各事項，均\n    依新法，亦有最高法院二十四年七月總會決議（二）可資參照，是刑法第四十一\n    條既業於九十年一月十日修正，並於同年月十二日生效，揆諸上揭法條規定及決\n    議意旨，本件自應適用裁判時即修正後刑法第四十一條第一項前段之規定，諭知\n    易科罰金之折算標準，原審漏未比較新舊法，其適用法律即有違誤，爰撤銷原判\n    決，由本院另為適法之裁判。爰審酌被告並無前科、素行良好，有臺灣高等法院\n    被告全國前案紀錄表可按，因過失傷及告訴人，旋自首接受裁判，坦承犯行、非\n    無悔意，但告訴人傷勢非輕，迄今已二年猶未獲被告賠償，然就車禍之發生，告\n    訴人與有過失，告訴人未慮及己身之過失，請求賠償金額偏高，致雙方無法達成\n    和解等一切情狀，量處如主文所示之刑，並諭知如易科罰金之折算標準，以資懲\n    儆。\n據上論斷，應依刑事訴訟法第四百五十五條之一第三項、第三百六十九條第一項前段\n、第三百六十四條、第二百九十九條第一項前段，刑法第二條第一項前段、第二百八\n十四條第一項前段、第六十二條前段、第四十一條第一項前段，罰金罰鍰提高標準條\n例第一條前段、第二條，判決如主文。\n本案經檢察官丙○○到庭執行職務。\n中      華      民      國    九十一    年     十一     月    二十五    日\n                              臺灣臺北地方法院交通法庭\n                                      審判長法  官劉壽嵩\n                                            法  官林鴻達\n                                            法  官洪文慧\n右正本證明與原本無異。\n本判決不得上訴。\n                                            書記官謝韻華\n中      華      民      國    九十一    年     十一     月    二十五    日\n",
  "structure": {
    "main": "原判決撤銷。\n甲○○因過失傷害人，處有期徒刑月，如易科罰金，以佰元折算壹日。",
    "fact": "一、甲○○於民國八十九年十一月二十日晚間，駕駛車牌號碼二Ｇ－四六０五號自用\n    小客車，沿臺北市○○○路由北向南方向行駛，於同日晚間九時二十分許，行經\n    同路段二段一五一巷口，擬左轉東向進入該巷之際，原應注意汽車行駛至交岔路\n    口，轉彎車應讓直行車先行，而當時天雨、夜間有照明、視距良好、市區○○道\n    路濕潤、無缺陷及障礙，依其智識、能力又無不能注意之情事，詎甲○○竟疏未\n    注意同路段由南向北方向通過路口之直行車輛，貿然進入路口並左轉，適有乙○\n    ○騎乘車牌號碼ＢＣＱ－二九０號重型機車沿臺北市○○○路二段中間車道由南\n    向北方向行駛，亦疏未注意車前狀況、隨時採取必要之安全措施，貿然快速通過\n    路口，見甲○○所駕車輛橫亙路中業已閃煞不及，乙○○所乘重型機車車頭遂撞\n    及甲○○所駕車輛右側車身，受有右側顳顎關節髁狀突骨折合併關節盤破損、左\n    側下顎骨髁狀突下及正中聯合掌骨折、下頜五公分撕裂傷、牙齒開咬、左側股骨\n    骨折之傷害。甲○○於肇事後，主動撥打電話報警，並於警員前往現場處理時，\n    不逃避接受裁判而當場向警員自首、承認為肇事人而願接受裁判。\n二、案經乙○○訴由臺北市政府警察局大安分局報請臺灣臺北地方法院檢察署檢察官\n    聲請簡易判決處刑。",
    "reason": "一、訊據被告甲○○固不否認於右揭時、地駕駛車牌號碼二Ｇ－四六０五號自用小客\n    車，沿臺北市○○○路由北向南方向行駛，於左轉東向進入同路段二段一五一巷\n    巷之際，右側車身與告訴人乙○○所騎乘、車牌號碼ＢＣＱ－二九０號重型機車\n    車頭發生碰撞，造成告訴人受有右側顳顎關節髁狀突骨折合併關節盤破損、左側\n    下顎骨髁狀突下及正中聯合掌骨折、下頜五公分撕裂傷、牙齒開咬、左側股骨骨\n    折之傷害等情，惟辯稱：當日其左轉至交岔路口中央，因前方車輛擁塞而停頓，\n    告訴人超速行駛且未注意車前狀況，始撞擊其所駕、靜止在路口中之車輛右側車\n    身，故告訴人亦有過失，且因告訴人要求金額過高故未能達成和解云云。\n二、經查：\n（一）被告於八十九年十一月二十日晚間，駕駛車牌號碼二Ｇ－四六０五號自用小客\n      車，沿臺北市○○○路由北向南方向行駛，於同日晚間九時二十分許，行經同\n      路段二段一五一巷口，擬左轉東向進入該巷之際，疏未注意同路段由南向北方\n      向通過路口之直行車輛，貿然進入路口並左轉，適有告訴人騎乘車牌號碼ＢＣ\n      Ｑ－二九０號重型機車沿臺北市○○○路二段中間車道由南向北方向行駛，亦\n      疏未注意車前狀況、隨時採取必要之安全措施，貿然快速通過路口，見被告所\n      駕車輛橫亙路中業已閃煞不及，告訴人所乘重型機車車頭遂撞及被告所駕車輛\n      右側車身，受有右側顳顎關節髁狀突骨折合併關節盤破損、左側下顎骨髁狀突\n      下及正中聯合掌骨折、下頜五公分撕裂傷、牙齒開咬、左側股骨骨折等傷害之\n      事實，業據被告於警、偵訊及本院調查、審理中坦承不諱，核與告訴人指述情\n      節及臺北市政府警察局大安分局交通分隊道路交通事故調查報告表、談話紀錄\n      表、分析研判表補充資料表、診斷證明書、現場照片所載相符；而當時天雨、\n      夜間有照明、視距良好、市區○○道路濕潤、無缺陷及障礙，依其智識、能力\n      又無不能注意之情事，並據臺北市政府警察局大安分局交通分隊據報處理之員\n      警觀察、記載明確，有道路交通事故調查報告表附卷可稽。\n（二）按道路交通安全規則所稱之汽車指在道路上不依軌道或電力架線而以原動機行\n      駛之車輛（包括機器腳踏車）；汽車行駛至交岔路口，轉彎車應讓直行車先行\n      ；汽車行駛時，駕駛人應注意車前狀況及兩車併行之間隔，並隨時採取必要之\n      安全措施，道路交通安全規則第二條第一項第一款、第一百零二條第一項第六\n      款、第九十四條第三項定有明文。本件被告駕駛自用小客車，沿臺北市○○○\n      路由北向南方向行駛，行經同路段二段一五一巷口，擬左轉進入該巷之際，當\n      時天雨、夜間有照明、視距良好、市區○○道路濕潤、無缺陷及障礙，依其智\n      識、能力又無不能注意之情事，前已述及，被告竟疏未注意同路段由南向北方\n      向通過路口之直行車輛，貿然進入路口並左轉，致騎乘重型機車沿路段由南向\n      北方向直行通過路口之告訴人見狀閃煞不及、撞及被告所駕車輛右側車身，受\n      有右側顳顎關節髁狀突骨折合併關節盤破損、左側下顎骨髁狀突下及正中聯合\n      掌骨折、下頜五公分撕裂傷、牙齒開咬、左側股骨骨折之傷害，被告有過失甚\n      明，且其過失行為與告訴人之傷害間，有相當因果關係，臺北市車輛行車事故\n      鑑定委員會亦同此見解，有該會本鑑審字第九０六００一五０００號覆函暨鑑\n      定意見書可憑。雖告訴人亦有疏未注意車前狀況、隨時採取必要安全措施之過\n      失，前業提及，但告訴人之過失並不能減免被告之過失，是被告所辯，委無可\n      採。\n（三）綜上所述，本件事證明確，被告犯行堪以認定，應依法論科。\n三、核被告所為，係犯刑法第二百八十四條第一項前段因過失傷害人罪。被告於肇事\n    後，主動撥打電話報警，並於警員前往現場處理時，不逃避接受裁判而當場向警\n    員自首、承認為肇事人而願接受裁判，此經本院職權查證屬實，有臺北市政府警\n    察局交通警察大隊自首調查報告表可參，被告對於有權偵查犯罪之機關尚不知犯\n    罪事實及犯罪人之前自首而願接受裁判，應依刑法第六十二條前段之規定減輕其\n    刑。原審認事證明確，依刑事訴訟法第四百四十九條第一項前段、第四百五十四\n    條第二項，刑法第二百八十四條第一項前段、第六十二條前段、第四十一條，罰\n    金罰鍰提高標準條例第一條前段、第二條判處被告有期徒刑三月，並諭知如易科\n    罰金之折算標準，固非無見，惟刑法第四十一條已於九十年一月十日經總統公布\n    施行，並於同年月十二日生效，該條規定：「犯最重本刑為五年以下有期徒刑之\n    刑之罪，而受六個月以下有期徒刑或拘役之宣告，因身體、教育、職業、家庭之\n    關係或其他正當事由，執行顯有困難者，得以一元以上三元以下折算一日，易科\n    罰金。但確因不執行所宣告之刑，難收矯正之效，或難以維持法秩序者，不在此\n    限」、「併合處罰之數罪，均有前項情形，其應執行之刑逾六月者，亦同」；按\n    行為後法律有變更者，適用裁判時之法律，刑法第二條第一項前段定有明文，而\n    易服勞役及期間、數罪併罰之定執行刑、緩刑及易以訓誡、易科罰金各事項，均\n    依新法，亦有最高法院二十四年七月總會決議（二）可資參照，是刑法第四十一\n    條既業於九十年一月十日修正，並於同年月十二日生效，揆諸上揭法條規定及決\n    議意旨，本件自應適用裁判時即修正後刑法第四十一條第一項前段之規定，諭知\n    易科罰金之折算標準，原審漏未比較新舊法，其適用法律即有違誤，爰撤銷原判\n    決，由本院另為適法之裁判。爰審酌被告並無前科、素行良好，有臺灣高等法院\n    被告全國前案紀錄表可按，因過失傷及告訴人，旋自首接受裁判，坦承犯行、非\n    無悔意，但告訴人傷勢非輕，迄今已二年猶未獲被告賠償，然就車禍之發生，告\n    訴人與有過失，告訴人未慮及己身之過失，請求賠償金額偏高，致雙方無法達成\n    和解等一切情狀，量處如主文所示之刑，並諭知如易科罰金之折算標準，以資懲\n    儆。\n據上論斷，應依刑事訴訟法第四百五十五條之一第三項、第三百六十九條第一項前段\n、第三百六十四條、第二百九十九條第一項前段，刑法第二條第一項前段、第二百八\n十四條第一項前段、第六十二條前段、第四十一條第一項前段，罰金罰鍰提高標準條\n例第一條前段、第二條，判決如主文。\n本案經檢察官丙○○到庭執行職務。\n中      華      民      國    九十一    年     十一     月    二十五    日\n                              臺灣臺北地方法院交通法庭\n                                      審判長法  官劉壽嵩\n                                            法  官林鴻達\n                                            法  官洪文慧\n右正本證明與原本無異。\n本判決不得上訴。\n                                            書記官謝韻華"
  },
  "search": "臺灣臺北地方法院刑事判決九十年度交簡上字第一一五號上訴人臺灣臺北地方法院檢察署檢察官被告甲○○右列上訴人因甲○○過失傷害案件，不服臺灣臺北地方法院臺北簡易庭民國九十年六月十一日九十年度北交簡字第一一０九號簡易判決（臺灣臺北地方法院檢察署檢察官聲請簡易判決處刑書案號：九十年度偵字第五六五三號），提起上訴，本院管轄之第二審合議庭判決如左：主文原判決撤銷。甲○○因過失傷害人，處有期徒刑月，如易科罰金，以佰元折算壹日。事實一、甲○○於民國八十九年十一月二十日晚間，駕駛車牌號碼二Ｇ－四六０五號自用小客車，沿臺北市○○○路由北向南方向行駛，於同日晚間九時二十分許，行經同路段二段一五一巷口，擬左轉東向進入該巷之際，原應注意汽車行駛至交岔路口，轉彎車應讓直行車先行，而當時天雨、夜間有照明、視距良好、市區○○道路濕潤、無缺陷及障礙，依其智識、能力又無不能注意之情事，詎甲○○竟疏未注意同路段由南向北方向通過路口之直行車輛，貿然進入路口並左轉，適有乙○○騎乘車牌號碼ＢＣＱ－二九０號重型機車沿臺北市○○○路二段中間車道由南向北方向行駛，亦疏未注意車前狀況、隨時採取必要之安全措施，貿然快速通過路口，見甲○○所駕車輛橫亙路中業已閃煞不及，乙○○所乘重型機車車頭遂撞及甲○○所駕車輛右側車身，受有右側顳顎關節髁狀突骨折合併關節盤破損、左側下顎骨髁狀突下及正中聯合掌骨折、下頜五公分撕裂傷、牙齒開咬、左側股骨骨折之傷害。甲○○於肇事後，主動撥打電話報警，並於警員前往現場處理時，不逃避接受裁判而當場向警員自首、承認為肇事人而願接受裁判。二、案經乙○○訴由臺北市政府警察局大安分局報請臺灣臺北地方法院檢察署檢察官聲請簡易判決處刑。理由一、訊據被告甲○○固不否認於右揭時、地駕駛車牌號碼二Ｇ－四六０五號自用小客車，沿臺北市○○○路由北向南方向行駛，於左轉東向進入同路段二段一五一巷巷之際，右側車身與告訴人乙○○所騎乘、車牌號碼ＢＣＱ－二九０號重型機車車頭發生碰撞，造成告訴人受有右側顳顎關節髁狀突骨折合併關節盤破損、左側下顎骨髁狀突下及正中聯合掌骨折、下頜五公分撕裂傷、牙齒開咬、左側股骨骨折之傷害等情，惟辯稱：當日其左轉至交岔路口中央，因前方車輛擁塞而停頓，告訴人超速行駛且未注意車前狀況，始撞擊其所駕、靜止在路口中之車輛右側車身，故告訴人亦有過失，且因告訴人要求金額過高故未能達成和解云云。二、經查：（一）被告於八十九年十一月二十日晚間，駕駛車牌號碼二Ｇ－四六０五號自用小客車，沿臺北市○○○路由北向南方向行駛，於同日晚間九時二十分許，行經同路段二段一五一巷口，擬左轉東向進入該巷之際，疏未注意同路段由南向北方向通過路口之直行車輛，貿然進入路口並左轉，適有告訴人騎乘車牌號碼ＢＣＱ－二九０號重型機車沿臺北市○○○路二段中間車道由南向北方向行駛，亦疏未注意車前狀況、隨時採取必要之安全措施，貿然快速通過路口，見被告所駕車輛橫亙路中業已閃煞不及，告訴人所乘重型機車車頭遂撞及被告所駕車輛右側車身，受有右側顳顎關節髁狀突骨折合併關節盤破損、左側下顎骨髁狀突下及正中聯合掌骨折、下頜五公分撕裂傷、牙齒開咬、左側股骨骨折等傷害之事實，業據被告於警、偵訊及本院調查、審理中坦承不諱，核與告訴人指述情節及臺北市政府警察局大安分局交通分隊道路交通事故調查報告表、談話紀錄表、分析研判表補充資料表、診斷證明書、現場照片所載相符；而當時天雨、夜間有照明、視距良好、市區○○道路濕潤、無缺陷及障礙，依其智識、能力又無不能注意之情事，並據臺北市政府警察局大安分局交通分隊據報處理之員警觀察、記載明確，有道路交通事故調查報告表附卷可稽。（二）按道路交通安全規則所稱之汽車指在道路上不依軌道或電力架線而以原動機行駛之車輛（包括機器腳踏車）；汽車行駛至交岔路口，轉彎車應讓直行車先行；汽車行駛時，駕駛人應注意車前狀況及兩車併行之間隔，並隨時採取必要之安全措施，道路交通安全規則第二條第一項第一款、第一百零二條第一項第六款、第九十四條第三項定有明文。本件被告駕駛自用小客車，沿臺北市○○○路由北向南方向行駛，行經同路段二段一五一巷口，擬左轉進入該巷之際，當時天雨、夜間有照明、視距良好、市區○○道路濕潤、無缺陷及障礙，依其智識、能力又無不能注意之情事，前已述及，被告竟疏未注意同路段由南向北方向通過路口之直行車輛，貿然進入路口並左轉，致騎乘重型機車沿路段由南向北方向直行通過路口之告訴人見狀閃煞不及、撞及被告所駕車輛右側車身，受有右側顳顎關節髁狀突骨折合併關節盤破損、左側下顎骨髁狀突下及正中聯合掌骨折、下頜五公分撕裂傷、牙齒開咬、左側股骨骨折之傷害，被告有過失甚明，且其過失行為與告訴人之傷害間，有相當因果關係，臺北市車輛行車事故鑑定委員會亦同此見解，有該會本鑑審字第九０六００一五０００號覆函暨鑑定意見書可憑。雖告訴人亦有疏未注意車前狀況、隨時採取必要安全措施之過失，前業提及，但告訴人之過失並不能減免被告之過失，是被告所辯，委無可採。（三）綜上所述，本件事證明確，被告犯行堪以認定，應依法論科。三、核被告所為，係犯刑法第二百八十四條第一項前段因過失傷害人罪。被告於肇事後，主動撥打電話報警，並於警員前往現場處理時，不逃避接受裁判而當場向警員自首、承認為肇事人而願接受裁判，此經本院職權查證屬實，有臺北市政府警察局交通警察大隊自首調查報告表可參，被告對於有權偵查犯罪之機關尚不知犯罪事實及犯罪人之前自首而願接受裁判，應依刑法第六十二條前段之規定減輕其刑。原審認事證明確，依刑事訴訟法第四百四十九條第一項前段、第四百五十四條第二項，刑法第二百八十四條第一項前段、第六十二條前段、第四十一條，罰金罰鍰提高標準條例第一條前段、第二條判處被告有期徒刑三月，並諭知如易科罰金之折算標準，固非無見，惟刑法第四十一條已於九十年一月十日經總統公布施行，並於同年月十二日生效，該條規定：「犯最重本刑為五年以下有期徒刑之刑之罪，而受六個月以下有期徒刑或拘役之宣告，因身體、教育、職業、家庭之關係或其他正當事由，執行顯有困難者，得以一元以上三元以下折算一日，易科罰金。但確因不執行所宣告之刑，難收矯正之效，或難以維持法秩序者，不在此限」、「併合處罰之數罪，均有前項情形，其應執行之刑逾六月者，亦同」；按行為後法律有變更者，適用裁判時之法律，刑法第二條第一項前段定有明文，而易服勞役及期間、數罪併罰之定執行刑、緩刑及易以訓誡、易科罰金各事項，均依新法，亦有最高法院二十四年七月總會決議（二）可資參照，是刑法第四十一條既業於九十年一月十日修正，並於同年月十二日生效，揆諸上揭法條規定及決議意旨，本件自應適用裁判時即修正後刑法第四十一條第一項前段之規定，諭知易科罰金之折算標準，原審漏未比較新舊法，其適用法律即有違誤，爰撤銷原判決，由本院另為適法之裁判。爰審酌被告並無前科、素行良好，有臺灣高等法院被告全國前案紀錄表可按，因過失傷及告訴人，旋自首接受裁判，坦承犯行、非無悔意，但告訴人傷勢非輕，迄今已二年猶未獲被告賠償，然就車禍之發生，告訴人與有過失，告訴人未慮及己身之過失，請求賠償金額偏高，致雙方無法達成和解等一切情狀，量處如主文所示之刑，並諭知如易科罰金之折算標準，以資懲儆。據上論斷，應依刑事訴訟法第四百五十五條之一第三項、第三百六十九條第一項前段、第三百六十四條、第二百九十九條第一項前段，刑法第二條第一項前段、第二百八十四條第一項前段、第六十二條前段、第四十一條第一項前段，罰金罰鍰提高標準條例第一條前段、第二條，判決如主文。本案經檢察官丙○○到庭執行職務。中華民國九十一年十一月二十五日臺灣臺北地方法院交通法庭審判長法官劉壽嵩法官林鴻達法官洪文慧右正本證明與原本無異。本判決不得上訴。書記官謝韻華中華民國九十一年十一月二十五日",
  "characters": {
    "judges": [

    ],
    "prosecutors": [

    ],
    "lawyers": [

    ],
    "clerks": [

    ],
    "plaintiffs": [

    ],
    "defendants": [
      "甲○○",
      "右列上訴人因甲○○過失傷害案件，不服臺灣臺北地方法院臺北簡易庭民國九十年六",
      "月十一日九十年度北交簡字第一一０九號簡易判決（臺灣臺北地方法院檢察署檢察官",
      "聲請簡易判決處刑書案號：九十年度偵字第五六五三號），提起上訴，本院管轄之第",
      "二審合議庭判決如左："
    ],
    "prosecutor_office": [

    ],
    "creditors": [

    ],
    "debtors": [

    ],
    "judicial_associate_officer": [

    ]
  },
  "adjudged_at": "2002-11-25",
  "created_at": "2016-02-05 02:25:57",
  "updated_at": "2016-02-05 02:25:57"
}