{
  "identify": "TPD-100-司促-3438-20110222-1",
  "court": {
    "name": "臺灣臺北地方法院",
    "code": "TPD"
  },
  "division": {
    "name": "民事",
    "code": "V"
  },
  "year": 100,
  "word": "司促",
  "number": "3438",
  "jcheck": "1",
  "reason": "支付命令",
  "content": "臺灣臺北地方法院支付命令           100年度司促字第3438號\n聲  請  人\n即債權人    中國信託商業銀行股份有限公司\n法定代理人  辜松\n相  對  人\n即債務人    黃劉雪梅\n一、債務人應向債權人清償新臺幣肆萬玖仟佰伍拾肆元，及其\n    中新臺幣萬陸仟伍佰拾玖元，自民國一百年二月十八日\n    起至清償日止，按年息百分之二十計算之利息，並賠償督促\n    程序費用新臺幣伍佰元，否則應於本命令送達後二十日之不\n    變期間內，向本院提出異議。\n二、債權人請求之原因事實如附件所載。\n三、如債務人未於第一項期間內提出異議，本命令與確定判決有\n    同一效力。\n中    華    民    國   100    年    2     月    22    日\n                  民事庭司法事務官  林嘉怡\n    附件：\n    債權人請求之原因事實（100年度司促字第3438號）\n    （一）、債務人黃劉雪梅向債權人請領信用卡使用，依約債\n            務人即得於特約商店記帳消費。卡號：0000000000\n            000000卡別：Visa。債務人至100 年2 月17日止累\n            計49,354元正未給付，其中36,539元為消費款；12\n            ,815元為循環利息；0 元為依約定條款計算之其他\n            費用。債務人依約除應給付上開款項外，另應給付\n            如附表所示之利息。\n    （二）、本件係請求給付一定數量之金額債務，而所請求之\n            標的，茲為求清償之簡速，以免判決程序之繁雜起\n            見，特依民事訴訟法第五○八條之規定，狀請鈞院\n            依督促程序迅賜對相對人發支付命令，實為法便。",
  "structure": {
  },
  "search": "臺灣臺北地方法院支付命令100年度司促字第3438號聲請人即債權人中國信託商業銀行股份有限公司法定代理人辜松相對人即債務人黃劉雪梅一、債務人應向債權人清償新臺幣肆萬玖仟佰伍拾肆元，及其中新臺幣萬陸仟伍佰拾玖元，自民國一百年二月十八日起至清償日止，按年息百分之二十計算之利息，並賠償督促程序費用新臺幣伍佰元，否則應於本命令送達後二十日之不變期間內，向本院提出異議。二、債權人請求之原因事實如附件所載。三、如債務人未於第一項期間內提出異議，本命令與確定判決有同一效力。中華民國100年2月22日民事庭司法事務官林嘉怡附件：債權人請求之原因事實（100年度司促字第3438號）（一）、債務人黃劉雪梅向債權人請領信用卡使用，依約債務人即得於特約商店記帳消費。卡號：0000000000000000卡別：Visa。債務人至100年2月17日止累計49,354元正未給付，其中36,539元為消費款；12,815元為循環利息；0元為依約定條款計算之其他費用。債務人依約除應給付上開款項外，另應給付如附表所示之利息。（二）、本件係請求給付一定數量之金額債務，而所請求之標的，茲為求清償之簡速，以免判決程序之繁雜起見，特依民事訴訟法第五○八條之規定，狀請鈞院依督促程序迅賜對相對人發支付命令，實為法便。",
  "characters": {
    "judges": [

    ],
    "prosecutors": [

    ],
    "lawyers": [

    ],
    "clerks": [

    ],
    "plaintiffs": [

    ],
    "defendants": [

    ],
    "prosecutor_office": [

    ],
    "creditors": [
      "中國信託商業銀行股份有限公司"
    ],
    "debtors": [

    ],
    "judicial_associate_officer": [
      "林嘉怡"
    ]
  },
  "adjudged_at": "2011-02-22",
  "created_at": "2016-02-12 07:18:53",
  "updated_at": "2016-02-12 07:18:53"
}