{
  "identify": "KLD-100-基小-1291-20111124-1",
  "court": {
    "name": "臺灣基隆地方法院",
    "code": "KLD"
  },
  "division": {
    "name": "民事",
    "code": "V"
  },
  "year": 100,
  "word": "基小",
  "number": "1291",
  "jcheck": "1",
  "reason": "給付借款",
  "content": "臺灣基隆地方法院基隆簡易庭小額民事判決\n                                   100年度基小字第1291號\n原      告  國泰世華商業銀行股份有限公司\n法定代理人  汪國華\n訴訟代理人  游豐維\n            黃虹語\n被      告  黃憲敏\n上列當事人間請求給付借款事件，本院於中華民國100年11月10\n日言詞辯論終結，判決如下：\n    主  文\n被告應給付原告新臺幣壹萬零玖佰柒拾貳元，及自民國九十九年\n九月二十三日起至清償日止，按年息百分之十五計算之利息，暨\n自民國九十九年十月二十四日起至清償日止，逾期在六個月以內\n者，按上開利率百分之十、逾期超過六個月者，按上開利率百分\n之二十計算之違約金。\n訴訟費用新臺幣壹仟元由被告負擔。\n本判決得假執行。\n中    華    民    國    100   年    11    月    24    日\n                  基隆簡易庭法  官  姚貴美\n以上正本係照原本作成。\n對於本件判決如有不服，應於收受送達後20日內向本院提出上訴\n書狀，上訴於本院合議庭，並按他造當事人之人數附具繕本。\n當事人之上訴，非以判決違背法令為理由不得為之，上訴狀應記\n載上訴理由，表明下列各款事項：\n(一)原判決所違背之法令及其具體內容。\n(二)依訴訟資料可認為原判決有違背法令之具體事實。\n中    華    民    國    100    年    11   月    24    日\n                             書記官  莊惠雯",
  "structure": {
  },
  "search": "臺灣基隆地方法院基隆簡易庭小額民事判決100年度基小字第1291號原告國泰世華商業銀行股份有限公司法定代理人汪國華訴訟代理人游豐維黃虹語被告黃憲敏上列當事人間請求給付借款事件，本院於中華民國100年11月10日言詞辯論終結，判決如下：主文被告應給付原告新臺幣壹萬零玖佰柒拾貳元，及自民國九十九年九月二十三日起至清償日止，按年息百分之十五計算之利息，暨自民國九十九年十月二十四日起至清償日止，逾期在六個月以內者，按上開利率百分之十、逾期超過六個月者，按上開利率百分之二十計算之違約金。訴訟費用新臺幣壹仟元由被告負擔。本判決得假執行。中華民國100年11月24日基隆簡易庭法官姚貴美以上正本係照原本作成。對於本件判決如有不服，應於收受送達後20日內向本院提出上訴書狀，上訴於本院合議庭，並按他造當事人之人數附具繕本。當事人之上訴，非以判決違背法令為理由不得為之，上訴狀應記載上訴理由，表明下列各款事項：(一)原判決所違背之法令及其具體內容。(二)依訴訟資料可認為原判決有違背法令之具體事實。中華民國100年11月24日書記官莊惠雯",
  "characters": {
    "judges": [
      "姚貴美"
    ],
    "prosecutors": [

    ],
    "lawyers": [

    ],
    "clerks": [

    ],
    "plaintiffs": [
      "國泰世華商業銀行股份有限公司"
    ],
    "defendants": [
      "黃憲敏"
    ],
    "prosecutor_office": [

    ],
    "creditors": [

    ],
    "debtors": [

    ],
    "judicial_associate_officer": [

    ]
  },
  "adjudged_at": "2011-11-24",
  "created_at": "2016-02-13 01:57:17",
  "updated_at": "2016-02-13 01:57:17"
}