{
  "identify": "TYD-99-監宣-339-20110216-1",
  "court": {
    "name": "臺灣桃園地方法院",
    "code": "TYD"
  },
  "division": {
    "name": "民事",
    "code": "V"
  },
  "year": 99,
  "word": "監宣",
  "number": "339",
  "jcheck": "1",
  "reason": "監護宣告",
  "content": "臺灣桃園地方法院民事裁定             99年度監宣字第339號\n聲  請  人  陳敬德\n相  對  人  陳貞祠\n關  係  人  陳玉燕\n上列聲請人對於相對人聲請監護宣告事件，本院裁定如下：\n    主  文\n宣告陳貞祠（男；民國○○年○○月○○日生；身分證統一編號：\nＺ000000000號）為受輔助宣告之人。\n選定陳敬德（男；民國○○年○○月○○日生；身分證統一編號：\nＺ000000000號）為受輔助宣告人之輔助人。\n指定陳玉燕（女，民國○○年○○月○○日生，身分證統一編號：\nＺ000000000 號）為會同開具財產清冊之人。\n聲請程序費用由受輔助宣告人負擔。\n    理  由\n一、本件聲請意旨略以：聲請人為相對人之兄長，相對人約於民\n    國80年服兵役末期開始出現精神混亂之情況，雖送醫診治但\n    精神狀況仍不穩定，相對人陳貞祠於94年06月17日與越南籍\n    女子「丁氏中」結婚，婚後丁氏中入境臺灣一個月餘即離家\n    ，遭警方尋獲後被遣回越南，相對人陳貞祠即於同年08 月\n    11日離婚，嗣後相對人陳貞祠又於94年10月17日與同一名女\n    子結婚，但婚後丁氏中（已改名為丁氏終）在94~9 5年間僅\n    僅入境臺灣約一個月，就未曾再入境，陳貞祠與丁氏終二人\n    未共同生活，無任何夫妻情份，但陳貞祠卻陸續匯款約新台\n    幣135 萬元至越南給丁氏終，足見已欠缺財產管理能力。近\n    日於99年06月間，甚且詛咒父親陳慶豐（已於99年10月28日\n    歿）早日過世，以便早日繼承父親遺產，且對三妹陳玉婷出\n    言威脅其生命安全，行為舉止完全脫序，已達因精神障礙或\n    其他心智缺陷，致不能為意思表示或受意思表示，或不能辨\n    識其意思表示之效果，為此依民法第14條第1 項、民事訴訟\n    法第597 條第1 項之規定，聲請准對相對人為監護宣告。若\n    鈞院認相對人尚未達可宣告監護之程度，則請依民法第14條\n    第3 項、第15條之1 第1 項、民事訴訟法第624 之3 條之規\n    定為輔助宣告，並指定聲請人陳敬德為輔助人。為此，提出\n    財團法人天主教聖保祿修女會醫院診斷證明書、聲請人及相\n    對人之戶籍謄本各一份為證。\n二、關於宣告相對人為受輔助宣告人部分：\n(一)按對於因精神障礙或其他心智缺陷，致不能為意思表示或受\n    意思表示，或不能辨識其意思表示之效果者，法院得因本人\n    、配偶、四親等內之親屬、最近1 年有同居事實之其他親屬\n    、檢察官、主管機關或社會福利機構之聲請，為監護之宣告\n    ；對於因精神障礙或其他心智缺陷，致其為意思表示或受意\n    思表示，或辨識其意思表示效果之能力，顯有不足者，法院\n    得因本人、配偶、四親等內之親屬、最近1 年有同居事實之\n    其他親屬、檢察官、主管機關或社會福利機構之聲請，為輔\n    助之宣告，民法第14條第1 項、第15條之1 分別定有明文。\n    又法院對於監護之聲請，認為未達民法第14條第1 項之程度\n    ，而有輔助宣告之原因者，得依聲請或依職權以裁定為輔助\n    之宣告，民法第14條第3 項、民事訴訟法第624 條之3 第1\n    項分別定有明文。\n(二)本院囑託板橋地方法院鑑定相對人陳貞祠之精神狀態，經板\n    橋地方法院法官偕同鑑定人即精神鑑定醫師陳威廷醫師，至\n    仁濟療養院新莊分院相對人陳貞祠所在地，訊問勘驗相對人\n    ，經法官詢問相對人日常生活相關事宜，相對人大致可回答\n    ；另訊鑑定人陳威廷醫師稱：「相對人精神分裂症，意識清\n    楚，有明顯幻想症，及極度不安全感，對週遭事務亦有不理\n    性反應，及意念飛馳，有固著性，經濟能力及處理有顯著障\n    礙，詳見鑑定報告」等語，有板橋地方法院100 年01月18日\n    非訟事件筆錄1 份在卷可憑。參酌鑑定人陳威廷醫師提出之\n    鑑定報告，略以：相對人雖有病識感且可溝通，但經濟活動\n    ，無法量力而為，並有強烈固著性，對財產處理能力顯有障\n    礙，為符合輔助宣告之人。此有板橋地方法院中華民國100\n    年01月31日板院輔家純99家助40字第6500號函附精神鑑報告\n    書在卷可參。本院審酌相對人心智之缺陷程度並參諸上揭鑑\n    定結果之意見，認相對人於為意思表示或受意思表示或辨識\n    其意思表示效果的能力確顯有不足，而有賴他人從旁予以輔\n    助之需要，爰依法宣告相對人為受輔助宣告人。\n三、關於指定輔助人部分：\n(一)按受輔助宣告之人，應置輔助人，民法第1113條之1 第1 項\n    定有明文。又法院為輔助之宣告時，應依職權就配偶、四親\n    等內之親屬、最近一年有同居事實之其他親屬、主管機關、\n    社會福利機構或其他適當之人選定一人或數人為輔助人；法\n    院為選定輔助人前，得命主管機關或社會福利機構進行訪視\n    ，提出調查報告及建議；法院選定輔助人時，應依受輔助宣\n    告之人之最佳利益，優先考量受輔助宣告之人之意見，審酌\n    一切情狀，並注意下列事項：一、受輔助宣告之人之身心狀\n    態與生活及財產狀況。二、受輔助宣告之人與其配偶、子女\n    或其他共同生活之人間之情感狀況。三、輔助人之職業、經\n    歷、意見及其與受輔助宣告之人之利害關係。四、法人為輔\n    助人時，其事業之種類與內容，法人及其代表人與受監護宣\n    告之人之利害關係，此觀民法第1113條之1 第2 項準用同法\n    第1111條第1 項、第2 項、第1111條之1 規定甚明。\n(二)經本院囑請桃園縣政府委託桃園縣社會工作師公會派員對聲\n    請人等進行訪視，訪視報告略以：本件聲請人聲請監護宣告\n    之原因，相對人之父親辭世前，期望聲請人能成為相對人主\n    要事務處理者，且相對人越南籍配偶婚後不在台灣，未盡與\n    相對人同居之義務，卻又不斷要求相對人匯錢至越南，相對\n    人繼承父親的遺產生活無虞，但因精神及心智狀況無法辨識\n    自己之權利義務，為保障相對人的財產，而提出監宣宣告之\n    聲請。據聲請人所述，相對人距首次精神疾病發病至今已約\n    有20年，雖領有殘障手冊仍然每年需要接受精神鑑定，近年\n    來相對人一直在進住療養院及出院間循環，可見其精神狀況\n    不甚穩定。綜合評估建議聲請人陳敬德擔任輔助人，符合相\n    對人最佳利益等語，有桃園縣政府社會處社會工作及救助科\n    監護宣告訪視報告在卷可稽。本院審核上情，認聲請人係受\n    輔助宣告人之兄長，平日即為受輔助宣告人實際生活的主要\n    照顧者，對受輔助宣告人應會有最妥善之照顧，且查聲請人\n    又無其他不適或不宜擔任受輔助宣告人之輔助人的積極、消\n    極原因，如由聲請人擔任受輔助宣告人之輔助人，對於受輔\n    助宣告人，應具有最佳之利益。爰依法選定聲請人為受輔助\n    宣告人之輔助人。又陳玉燕為相對人之姐，當能善盡監督相\n    對人之財產狀況，併依前揭規定指定陳玉燕為會同開具財產\n    清冊之人。\n四、依民事訴訟法第624 條之1 第3 項、第608 條第1 項，裁定\n    如主文。\n中    華    民    國    100    年    2    月   16    日\n                  家事法庭法  官  陳添喜\n以上正本係照原本作成。\n宣告受監護宣告裁定不得抗告。\n如對指定監護人及會同開具財產清冊之人裁定抗告須於裁定送達\n後10日內向本院提出抗告狀，並繳納裁判費１０００元。\n中    華    民    國    100  年    2    月  17  日\n                          書記官  楊慧伶",
  "structure": {
    "main": "宣告陳貞祠（男；民國○○年○○月○○日生；身分證統一編號：\nＺ000000000號）為受輔助宣告之人。\n選定陳敬德（男；民國○○年○○月○○日生；身分證統一編號：\nＺ000000000號）為受輔助宣告人之輔助人。\n指定陳玉燕（女，民國○○年○○月○○日生，身分證統一編號：\nＺ000000000 號）為會同開具財產清冊之人。\n聲請程序費用由受輔助宣告人負擔。",
    "reason": "一、本件聲請意旨略以：聲請人為相對人之兄長，相對人約於民\n    國80年服兵役末期開始出現精神混亂之情況，雖送醫診治但\n    精神狀況仍不穩定，相對人陳貞祠於94年06月17日與越南籍\n    女子「丁氏中」結婚，婚後丁氏中入境臺灣一個月餘即離家\n    ，遭警方尋獲後被遣回越南，相對人陳貞祠即於同年08 月\n    11日離婚，嗣後相對人陳貞祠又於94年10月17日與同一名女\n    子結婚，但婚後丁氏中（已改名為丁氏終）在94~9 5年間僅\n    僅入境臺灣約一個月，就未曾再入境，陳貞祠與丁氏終二人\n    未共同生活，無任何夫妻情份，但陳貞祠卻陸續匯款約新台\n    幣135 萬元至越南給丁氏終，足見已欠缺財產管理能力。近\n    日於99年06月間，甚且詛咒父親陳慶豐（已於99年10月28日\n    歿）早日過世，以便早日繼承父親遺產，且對三妹陳玉婷出\n    言威脅其生命安全，行為舉止完全脫序，已達因精神障礙或\n    其他心智缺陷，致不能為意思表示或受意思表示，或不能辨\n    識其意思表示之效果，為此依民法第14條第1 項、民事訴訟\n    法第597 條第1 項之規定，聲請准對相對人為監護宣告。若\n    鈞院認相對人尚未達可宣告監護之程度，則請依民法第14條\n    第3 項、第15條之1 第1 項、民事訴訟法第624 之3 條之規\n    定為輔助宣告，並指定聲請人陳敬德為輔助人。為此，提出\n    財團法人天主教聖保祿修女會醫院診斷證明書、聲請人及相\n    對人之戶籍謄本各一份為證。\n二、關於宣告相對人為受輔助宣告人部分：\n(一)按對於因精神障礙或其他心智缺陷，致不能為意思表示或受\n    意思表示，或不能辨識其意思表示之效果者，法院得因本人\n    、配偶、四親等內之親屬、最近1 年有同居事實之其他親屬\n    、檢察官、主管機關或社會福利機構之聲請，為監護之宣告\n    ；對於因精神障礙或其他心智缺陷，致其為意思表示或受意\n    思表示，或辨識其意思表示效果之能力，顯有不足者，法院\n    得因本人、配偶、四親等內之親屬、最近1 年有同居事實之\n    其他親屬、檢察官、主管機關或社會福利機構之聲請，為輔\n    助之宣告，民法第14條第1 項、第15條之1 分別定有明文。\n    又法院對於監護之聲請，認為未達民法第14條第1 項之程度\n    ，而有輔助宣告之原因者，得依聲請或依職權以裁定為輔助\n    之宣告，民法第14條第3 項、民事訴訟法第624 條之3 第1\n    項分別定有明文。\n(二)本院囑託板橋地方法院鑑定相對人陳貞祠之精神狀態，經板\n    橋地方法院法官偕同鑑定人即精神鑑定醫師陳威廷醫師，至\n    仁濟療養院新莊分院相對人陳貞祠所在地，訊問勘驗相對人\n    ，經法官詢問相對人日常生活相關事宜，相對人大致可回答\n    ；另訊鑑定人陳威廷醫師稱：「相對人精神分裂症，意識清\n    楚，有明顯幻想症，及極度不安全感，對週遭事務亦有不理\n    性反應，及意念飛馳，有固著性，經濟能力及處理有顯著障\n    礙，詳見鑑定報告」等語，有板橋地方法院100 年01月18日\n    非訟事件筆錄1 份在卷可憑。參酌鑑定人陳威廷醫師提出之\n    鑑定報告，略以：相對人雖有病識感且可溝通，但經濟活動\n    ，無法量力而為，並有強烈固著性，對財產處理能力顯有障\n    礙，為符合輔助宣告之人。此有板橋地方法院中華民國100\n    年01月31日板院輔家純99家助40字第6500號函附精神鑑報告\n    書在卷可參。本院審酌相對人心智之缺陷程度並參諸上揭鑑\n    定結果之意見，認相對人於為意思表示或受意思表示或辨識\n    其意思表示效果的能力確顯有不足，而有賴他人從旁予以輔\n    助之需要，爰依法宣告相對人為受輔助宣告人。\n三、關於指定輔助人部分：\n(一)按受輔助宣告之人，應置輔助人，民法第1113條之1 第1 項\n    定有明文。又法院為輔助之宣告時，應依職權就配偶、四親\n    等內之親屬、最近一年有同居事實之其他親屬、主管機關、\n    社會福利機構或其他適當之人選定一人或數人為輔助人；法\n    院為選定輔助人前，得命主管機關或社會福利機構進行訪視\n    ，提出調查報告及建議；法院選定輔助人時，應依受輔助宣\n    告之人之最佳利益，優先考量受輔助宣告之人之意見，審酌\n    一切情狀，並注意下列事項：一、受輔助宣告之人之身心狀\n    態與生活及財產狀況。二、受輔助宣告之人與其配偶、子女\n    或其他共同生活之人間之情感狀況。三、輔助人之職業、經\n    歷、意見及其與受輔助宣告之人之利害關係。四、法人為輔\n    助人時，其事業之種類與內容，法人及其代表人與受監護宣\n    告之人之利害關係，此觀民法第1113條之1 第2 項準用同法\n    第1111條第1 項、第2 項、第1111條之1 規定甚明。\n(二)經本院囑請桃園縣政府委託桃園縣社會工作師公會派員對聲\n    請人等進行訪視，訪視報告略以：本件聲請人聲請監護宣告\n    之原因，相對人之父親辭世前，期望聲請人能成為相對人主\n    要事務處理者，且相對人越南籍配偶婚後不在台灣，未盡與\n    相對人同居之義務，卻又不斷要求相對人匯錢至越南，相對\n    人繼承父親的遺產生活無虞，但因精神及心智狀況無法辨識\n    自己之權利義務，為保障相對人的財產，而提出監宣宣告之\n    聲請。據聲請人所述，相對人距首次精神疾病發病至今已約\n    有20年，雖領有殘障手冊仍然每年需要接受精神鑑定，近年\n    來相對人一直在進住療養院及出院間循環，可見其精神狀況\n    不甚穩定。綜合評估建議聲請人陳敬德擔任輔助人，符合相\n    對人最佳利益等語，有桃園縣政府社會處社會工作及救助科\n    監護宣告訪視報告在卷可稽。本院審核上情，認聲請人係受\n    輔助宣告人之兄長，平日即為受輔助宣告人實際生活的主要\n    照顧者，對受輔助宣告人應會有最妥善之照顧，且查聲請人\n    又無其他不適或不宜擔任受輔助宣告人之輔助人的積極、消\n    極原因，如由聲請人擔任受輔助宣告人之輔助人，對於受輔\n    助宣告人，應具有最佳之利益。爰依法選定聲請人為受輔助\n    宣告人之輔助人。又陳玉燕為相對人之姐，當能善盡監督相\n    對人之財產狀況，併依前揭規定指定陳玉燕為會同開具財產\n    清冊之人。\n四、依民事訴訟法第624 條之1 第3 項、第608 條第1 項，裁定\n    如主文。"
  },
  "search": "臺灣桃園地方法院民事裁定99年度監宣字第339號聲請人陳敬德相對人陳貞祠關係人陳玉燕上列聲請人對於相對人聲請監護宣告事件，本院裁定如下：主文宣告陳貞祠（男；民國○○年○○月○○日生；身分證統一編號：Ｚ000000000號）為受輔助宣告之人。選定陳敬德（男；民國○○年○○月○○日生；身分證統一編號：Ｚ000000000號）為受輔助宣告人之輔助人。指定陳玉燕（女，民國○○年○○月○○日生，身分證統一編號：Ｚ000000000號）為會同開具財產清冊之人。聲請程序費用由受輔助宣告人負擔。理由一、本件聲請意旨略以：聲請人為相對人之兄長，相對人約於民國80年服兵役末期開始出現精神混亂之情況，雖送醫診治但精神狀況仍不穩定，相對人陳貞祠於94年06月17日與越南籍女子「丁氏中」結婚，婚後丁氏中入境臺灣一個月餘即離家，遭警方尋獲後被遣回越南，相對人陳貞祠即於同年08月11日離婚，嗣後相對人陳貞祠又於94年10月17日與同一名女子結婚，但婚後丁氏中（已改名為丁氏終）在94~95年間僅僅入境臺灣約一個月，就未曾再入境，陳貞祠與丁氏終二人未共同生活，無任何夫妻情份，但陳貞祠卻陸續匯款約新台幣135萬元至越南給丁氏終，足見已欠缺財產管理能力。近日於99年06月間，甚且詛咒父親陳慶豐（已於99年10月28日歿）早日過世，以便早日繼承父親遺產，且對三妹陳玉婷出言威脅其生命安全，行為舉止完全脫序，已達因精神障礙或其他心智缺陷，致不能為意思表示或受意思表示，或不能辨識其意思表示之效果，為此依民法第14條第1項、民事訴訟法第597條第1項之規定，聲請准對相對人為監護宣告。若鈞院認相對人尚未達可宣告監護之程度，則請依民法第14條第3項、第15條之1第1項、民事訴訟法第624之3條之規定為輔助宣告，並指定聲請人陳敬德為輔助人。為此，提出財團法人天主教聖保祿修女會醫院診斷證明書、聲請人及相對人之戶籍謄本各一份為證。二、關於宣告相對人為受輔助宣告人部分：(一)按對於因精神障礙或其他心智缺陷，致不能為意思表示或受意思表示，或不能辨識其意思表示之效果者，法院得因本人、配偶、四親等內之親屬、最近1年有同居事實之其他親屬、檢察官、主管機關或社會福利機構之聲請，為監護之宣告；對於因精神障礙或其他心智缺陷，致其為意思表示或受意思表示，或辨識其意思表示效果之能力，顯有不足者，法院得因本人、配偶、四親等內之親屬、最近1年有同居事實之其他親屬、檢察官、主管機關或社會福利機構之聲請，為輔助之宣告，民法第14條第1項、第15條之1分別定有明文。又法院對於監護之聲請，認為未達民法第14條第1項之程度，而有輔助宣告之原因者，得依聲請或依職權以裁定為輔助之宣告，民法第14條第3項、民事訴訟法第624條之3第1項分別定有明文。(二)本院囑託板橋地方法院鑑定相對人陳貞祠之精神狀態，經板橋地方法院法官偕同鑑定人即精神鑑定醫師陳威廷醫師，至仁濟療養院新莊分院相對人陳貞祠所在地，訊問勘驗相對人，經法官詢問相對人日常生活相關事宜，相對人大致可回答；另訊鑑定人陳威廷醫師稱：「相對人精神分裂症，意識清楚，有明顯幻想症，及極度不安全感，對週遭事務亦有不理性反應，及意念飛馳，有固著性，經濟能力及處理有顯著障礙，詳見鑑定報告」等語，有板橋地方法院100年01月18日非訟事件筆錄1份在卷可憑。參酌鑑定人陳威廷醫師提出之鑑定報告，略以：相對人雖有病識感且可溝通，但經濟活動，無法量力而為，並有強烈固著性，對財產處理能力顯有障礙，為符合輔助宣告之人。此有板橋地方法院中華民國100年01月31日板院輔家純99家助40字第6500號函附精神鑑報告書在卷可參。本院審酌相對人心智之缺陷程度並參諸上揭鑑定結果之意見，認相對人於為意思表示或受意思表示或辨識其意思表示效果的能力確顯有不足，而有賴他人從旁予以輔助之需要，爰依法宣告相對人為受輔助宣告人。三、關於指定輔助人部分：(一)按受輔助宣告之人，應置輔助人，民法第1113條之1第1項定有明文。又法院為輔助之宣告時，應依職權就配偶、四親等內之親屬、最近一年有同居事實之其他親屬、主管機關、社會福利機構或其他適當之人選定一人或數人為輔助人；法院為選定輔助人前，得命主管機關或社會福利機構進行訪視，提出調查報告及建議；法院選定輔助人時，應依受輔助宣告之人之最佳利益，優先考量受輔助宣告之人之意見，審酌一切情狀，並注意下列事項：一、受輔助宣告之人之身心狀態與生活及財產狀況。二、受輔助宣告之人與其配偶、子女或其他共同生活之人間之情感狀況。三、輔助人之職業、經歷、意見及其與受輔助宣告之人之利害關係。四、法人為輔助人時，其事業之種類與內容，法人及其代表人與受監護宣告之人之利害關係，此觀民法第1113條之1第2項準用同法第1111條第1項、第2項、第1111條之1規定甚明。(二)經本院囑請桃園縣政府委託桃園縣社會工作師公會派員對聲請人等進行訪視，訪視報告略以：本件聲請人聲請監護宣告之原因，相對人之父親辭世前，期望聲請人能成為相對人主要事務處理者，且相對人越南籍配偶婚後不在台灣，未盡與相對人同居之義務，卻又不斷要求相對人匯錢至越南，相對人繼承父親的遺產生活無虞，但因精神及心智狀況無法辨識自己之權利義務，為保障相對人的財產，而提出監宣宣告之聲請。據聲請人所述，相對人距首次精神疾病發病至今已約有20年，雖領有殘障手冊仍然每年需要接受精神鑑定，近年來相對人一直在進住療養院及出院間循環，可見其精神狀況不甚穩定。綜合評估建議聲請人陳敬德擔任輔助人，符合相對人最佳利益等語，有桃園縣政府社會處社會工作及救助科監護宣告訪視報告在卷可稽。本院審核上情，認聲請人係受輔助宣告人之兄長，平日即為受輔助宣告人實際生活的主要照顧者，對受輔助宣告人應會有最妥善之照顧，且查聲請人又無其他不適或不宜擔任受輔助宣告人之輔助人的積極、消極原因，如由聲請人擔任受輔助宣告人之輔助人，對於受輔助宣告人，應具有最佳之利益。爰依法選定聲請人為受輔助宣告人之輔助人。又陳玉燕為相對人之姐，當能善盡監督相對人之財產狀況，併依前揭規定指定陳玉燕為會同開具財產清冊之人。四、依民事訴訟法第624條之1第3項、第608條第1項，裁定如主文。中華民國100年2月16日家事法庭法官陳添喜以上正本係照原本作成。宣告受監護宣告裁定不得抗告。如對指定監護人及會同開具財產清冊之人裁定抗告須於裁定送達後10日內向本院提出抗告狀，並繳納裁判費１０００元。中華民國100年2月17日書記官楊慧伶",
  "characters": {
    "judges": [
      "陳添喜"
    ],
    "prosecutors": [

    ],
    "lawyers": [

    ],
    "clerks": [

    ],
    "plaintiffs": [

    ],
    "defendants": [

    ],
    "prosecutor_office": [
      "陳敬德"
    ],
    "creditors": [

    ],
    "debtors": [

    ],
    "judicial_associate_officer": [

    ]
  },
  "adjudged_at": "2011-02-16",
  "created_at": "2016-02-12 04:04:22",
  "updated_at": "2016-02-12 04:04:22"
}