{
  "identify": "TYD-100-訴-16-20110104-1",
  "court": {
    "name": "臺灣桃園地方法院",
    "code": "TYD"
  },
  "division": {
    "name": "民事",
    "code": "V"
  },
  "year": 100,
  "word": "訴",
  "number": "16",
  "jcheck": "1",
  "reason": "線管安設權",
  "content": "臺灣桃園地方法院民事裁定               100年度訴字第16號\n原      告  葉碧玲\n被      告  徐清三\n上列當事人間請求線管安設權事件，本院裁定如下：\n    主  文\n原告之訴及假執行之聲請均駁回。\n訴訟費用由原告負擔。\n    理  由\n一、按提起民事訴訟應依民事訴訟法第77條之13規定繳納裁判費\n    ，此為必須具備之程式。又原告之訴，起訴不合程式或不備\n    其他要件，依其情形可以補正，經審判長定期間命其補正而\n    不補正者，法院應以裁定駁回之，同法第249 條第1 項第6\n    款亦定有明文。\n二、本件原告起訴未據繳納裁判費，查本件訴訟標的經核定為新\n    臺幣（下同）1,650,000 元，應徵第一審裁判費17,335元，\n    經本院於民國99年10月6 日裁定命原告應於收受裁定後5 日\n    內補正，而該項裁定已於同年月13日送達原告，有送達證書\n    附卷可查。雖原告嗣於同年月19日對上開裁定提起抗告，惟\n    業經臺灣高等法院於99年11月23日以99年度抗字第1737號裁\n    定駁回抗告，該裁定並已於同年12月1 日送達原告，有送達\n    證書附於臺灣高等法院99年度抗字第1737號卷可稽，足見上\n    開裁定均已確定在案。惟原告迄今猶未補正上開裁判費，有\n    本院民事科查詢簡答表1 份在卷可憑，其訴顯難認為合法，\n    應予駁回。\n三、依民事訴訟法第249 條第1 項第6 款、第95條、第78條，裁\n    定如主文。\n中    華    民    國    100   年    1     月    4     日\n                  民事第一庭  法  官  陳振嘉\n正本係照原本作成。\n如不服本裁定應於送達後10日內向本院提出抗告狀，並繳納抗告\n費新臺幣1,000元。\n中    華    民    國   100    年    1     月    4     日\n                              書記官  谷貞豫",
  "structure": {
    "main": "原告之訴及假執行之聲請均駁回。\n訴訟費用由原告負擔。",
    "reason": "一、按提起民事訴訟應依民事訴訟法第77條之13規定繳納裁判費\n    ，此為必須具備之程式。又原告之訴，起訴不合程式或不備\n    其他要件，依其情形可以補正，經審判長定期間命其補正而\n    不補正者，法院應以裁定駁回之，同法第249 條第1 項第6\n    款亦定有明文。\n二、本件原告起訴未據繳納裁判費，查本件訴訟標的經核定為新\n    臺幣（下同）1,650,000 元，應徵第一審裁判費17,335元，\n    經本院於民國99年10月6 日裁定命原告應於收受裁定後5 日\n    內補正，而該項裁定已於同年月13日送達原告，有送達證書\n    附卷可查。雖原告嗣於同年月19日對上開裁定提起抗告，惟\n    業經臺灣高等法院於99年11月23日以99年度抗字第1737號裁\n    定駁回抗告，該裁定並已於同年12月1 日送達原告，有送達\n    證書附於臺灣高等法院99年度抗字第1737號卷可稽，足見上\n    開裁定均已確定在案。惟原告迄今猶未補正上開裁判費，有\n    本院民事科查詢簡答表1 份在卷可憑，其訴顯難認為合法，\n    應予駁回。\n三、依民事訴訟法第249 條第1 項第6 款、第95條、第78條，裁\n    定如主文。"
  },
  "search": "臺灣桃園地方法院民事裁定100年度訴字第16號原告葉碧玲被告徐清三上列當事人間請求線管安設權事件，本院裁定如下：主文原告之訴及假執行之聲請均駁回。訴訟費用由原告負擔。理由一、按提起民事訴訟應依民事訴訟法第77條之13規定繳納裁判費，此為必須具備之程式。又原告之訴，起訴不合程式或不備其他要件，依其情形可以補正，經審判長定期間命其補正而不補正者，法院應以裁定駁回之，同法第249條第1項第6款亦定有明文。二、本件原告起訴未據繳納裁判費，查本件訴訟標的經核定為新臺幣（下同）1,650,000元，應徵第一審裁判費17,335元，經本院於民國99年10月6日裁定命原告應於收受裁定後5日內補正，而該項裁定已於同年月13日送達原告，有送達證書附卷可查。雖原告嗣於同年月19日對上開裁定提起抗告，惟業經臺灣高等法院於99年11月23日以99年度抗字第1737號裁定駁回抗告，該裁定並已於同年12月1日送達原告，有送達證書附於臺灣高等法院99年度抗字第1737號卷可稽，足見上開裁定均已確定在案。惟原告迄今猶未補正上開裁判費，有本院民事科查詢簡答表1份在卷可憑，其訴顯難認為合法，應予駁回。三、依民事訴訟法第249條第1項第6款、第95條、第78條，裁定如主文。中華民國100年1月4日民事第一庭法官陳振嘉正本係照原本作成。如不服本裁定應於送達後10日內向本院提出抗告狀，並繳納抗告費新臺幣1,000元。中華民國100年1月4日書記官谷貞豫",
  "characters": {
    "judges": [
      "陳振嘉"
    ],
    "prosecutors": [

    ],
    "lawyers": [

    ],
    "clerks": [

    ],
    "plaintiffs": [
      "葉碧玲"
    ],
    "defendants": [
      "徐清三"
    ],
    "prosecutor_office": [

    ],
    "creditors": [

    ],
    "debtors": [

    ],
    "judicial_associate_officer": [

    ]
  },
  "adjudged_at": "2011-01-04",
  "created_at": "2016-02-13 04:37:38",
  "updated_at": "2016-02-13 04:37:38"
}