{
  "identify": "HLD-100-司促-1704-20110512-1",
  "court": {
    "name": "臺灣花蓮地方法院",
    "code": "HLD"
  },
  "division": {
    "name": "民事",
    "code": "V"
  },
  "year": 100,
  "word": "司促",
  "number": "1704",
  "jcheck": "1",
  "reason": "支付命令",
  "content": "臺灣花蓮地方法院民事裁定           100年度司促字第1704號\n債  權  人  正泰資產管理有限公司\n法定代理人  張龍根\n債  務  人  廖羿瑄即廖美容\n上列債權人聲請對債務人發支付命令事件，本院裁定如下：\n    主  文\n聲請駁回。\n程序費用新台幣伍佰元由債權人負擔。\n    理  由\n一、按聲請支付命令，應以訴狀表明當事人，如未為詳盡之記載\n    而可以補正者，經定期間命為補正，如逾期仍未補正，應認\n    其聲請不合程式，應以裁定駁回之。\n二、本件債權人聲請對債務人發給支付命令，經本院先後於一百\n    年三月三十一日及一百年四月二十日通知命債權人於通知書\n    送達翌日起五日內，補正業將債權讓與通知之存證信函送達\n    債務人之郵務回執，該通知已分別於一百年四月六日及一百\n    年四月二十六日合法送達於債權人，有送達證書附卷可稽，\n    惟債權人補正之相關資料，本院無以判斷新榮資產管理股份\n    有限公司與正泰資產管理有限公司間之債權讓與是否合法，\n    且資產管理公司間之債權讓與，並無金融機構合併法第18條\n    以公告為債權讓與通知之適用，故債權人縱提出債權讓與公\n    告，亦不得認業已合法通知債務人，揆諸前述，其聲請尚難\n    謂為合法，應駁回其聲請，爰依民事訴訟法第8條第1項裁定\n    如主文。\n三、如不服本裁定，應於裁定送達後十日內，以書狀向司法事務\n    官提出異議。\n中    華    民    國   100    年    5     月    12    日\n                        司法事務官  許涴琪",
  "structure": {
    "main": "聲請駁回。\n程序費用新台幣伍佰元由債權人負擔。",
    "reason": "一、按聲請支付命令，應以訴狀表明當事人，如未為詳盡之記載\n    而可以補正者，經定期間命為補正，如逾期仍未補正，應認\n    其聲請不合程式，應以裁定駁回之。\n二、本件債權人聲請對債務人發給支付命令，經本院先後於一百\n    年三月三十一日及一百年四月二十日通知命債權人於通知書\n    送達翌日起五日內，補正業將債權讓與通知之存證信函送達\n    債務人之郵務回執，該通知已分別於一百年四月六日及一百\n    年四月二十六日合法送達於債權人，有送達證書附卷可稽，\n    惟債權人補正之相關資料，本院無以判斷新榮資產管理股份\n    有限公司與正泰資產管理有限公司間之債權讓與是否合法，\n    且資產管理公司間之債權讓與，並無金融機構合併法第18條\n    以公告為債權讓與通知之適用，故債權人縱提出債權讓與公\n    告，亦不得認業已合法通知債務人，揆諸前述，其聲請尚難\n    謂為合法，應駁回其聲請，爰依民事訴訟法第8條第1項裁定\n    如主文。\n三、如不服本裁定，應於裁定送達後十日內，以書狀向司法事務\n    官提出異議。"
  },
  "search": "臺灣花蓮地方法院民事裁定100年度司促字第1704號債權人正泰資產管理有限公司法定代理人張龍根債務人廖羿瑄即廖美容上列債權人聲請對債務人發支付命令事件，本院裁定如下：主文聲請駁回。程序費用新台幣伍佰元由債權人負擔。理由一、按聲請支付命令，應以訴狀表明當事人，如未為詳盡之記載而可以補正者，經定期間命為補正，如逾期仍未補正，應認其聲請不合程式，應以裁定駁回之。二、本件債權人聲請對債務人發給支付命令，經本院先後於一百年三月三十一日及一百年四月二十日通知命債權人於通知書送達翌日起五日內，補正業將債權讓與通知之存證信函送達債務人之郵務回執，該通知已分別於一百年四月六日及一百年四月二十六日合法送達於債權人，有送達證書附卷可稽，惟債權人補正之相關資料，本院無以判斷新榮資產管理股份有限公司與正泰資產管理有限公司間之債權讓與是否合法，且資產管理公司間之債權讓與，並無金融機構合併法第18條以公告為債權讓與通知之適用，故債權人縱提出債權讓與公告，亦不得認業已合法通知債務人，揆諸前述，其聲請尚難謂為合法，應駁回其聲請，爰依民事訴訟法第8條第1項裁定如主文。三、如不服本裁定，應於裁定送達後十日內，以書狀向司法事務官提出異議。中華民國100年5月12日司法事務官許涴琪",
  "characters": {
    "judges": [

    ],
    "prosecutors": [

    ],
    "lawyers": [

    ],
    "clerks": [

    ],
    "plaintiffs": [

    ],
    "defendants": [

    ],
    "prosecutor_office": [

    ],
    "creditors": [
      "正泰資產管理有限公司"
    ],
    "debtors": [
      "廖羿瑄即廖美容"
    ],
    "judicial_associate_officer": [
      "許涴琪"
    ]
  },
  "adjudged_at": "2011-05-12",
  "created_at": "2016-02-12 00:59:33",
  "updated_at": "2016-02-12 00:59:33"
}