{
  "identify": "KSD-100-審訴-1130-20110512-1",
  "court": {
    "name": "臺灣高雄地方法院",
    "code": "KSD"
  },
  "division": {
    "name": "刑事",
    "code": "M"
  },
  "year": 100,
  "word": "審訴",
  "number": "1130",
  "jcheck": "1",
  "reason": "毒品危害防制條例",
  "content": "臺灣高雄地方法院宣示判決筆錄      100年度審訴字第1130號\n公  訴  人  臺灣高雄地方法院檢察署檢察官\n被      告  顏才富\n指定辯護人  本院公設辯護人蘇鴻吉\n上列被告因100 年度審訴字第1130號毒品危害防制條例案件，經\n檢察官提起公訴（起訴案號：臺灣高雄地方法院檢察署檢察官10\n0 年度毒偵字第1024號），經檢察官聲請法院改依協商程序而為\n判決，本院合議庭認為適當，裁定由受命法官進行協商判決程序\n，於中華民國100 年5 月12日下午4 時在本院刑事第十法庭宣示\n判決，以代判決書，出席職員如下：\n        法  官  呂明燕\n        書記官  張琇晴\n        通  譯  楊博淳\n法官起立朗讀判決主文、犯罪事實要旨、處罰條文、附記事項，\n及告以上訴限制、期間並提出上訴狀之法院，且諭知記載其內容\n：\n一、主文：\n    顏才富施用第一級毒品，累犯，處有期徒刑捌月；又施用第\n    二級毒品，累犯，處有期徒刑肆月。應執行有期徒刑拾月。\n二、犯罪事實要旨：\n    顏才富前於民國89年間，因施用毒品案件，經本院裁定送觀\n    察、勒戒後，因無繼續施用毒品傾向，於89年11月7 日執行\n    完畢釋放，並經臺灣高雄地方法院檢察署檢察官為不起訴處\n    分確定；復於前開觀察、勒戒執行完畢5 年內之90年間，再\n    犯施用毒品案件，經本院以90年度毒聲字第7223號裁定令入\n    戒治處所施以強制戒治，嗣經裁定停止戒治並付保護管束，\n    於92年1  月21日執行完畢，同案並經本院以91年度訴字第3\n    號判決判處有期徒刑7 月確定，於92年9 月24日縮刑期滿執\n    行完畢。復於94年間，因施用毒品案件，經本院以95年度訴\n    字第523 號判決判處有期徒刑8 月、3 月，應執行有期徒刑\n    9 月確定，於96年6 月26日縮刑期滿執行完畢。詎其猶不知\n    悛悔並戒絕毒癮，分別基於施用第一級毒品海洛因與第二級\n    毒品甲基安非他命之犯意，於99年11月24日上午11時許，在\n    其位於高雄市○○區○○路278 巷1 弄31號住處內，將甲基\n    安非他命置入玻璃球內燒烤之方式，施用第二級毒品甲基安\n    非他命1 次；又於同年月25日下午4 時許，同在上址，以針\n    筒注射之之方式，施用第一級毒品海洛因1 次。\n三、處罰條文：\n    毒品危害防制條例第10條第1 項、第2 項，刑法第11條前段\n    、第47條第1 項、第51條第5 款。\n四、附記事項：\n    無。\n五、協商判決除有刑事訴訟法第455 條之4 第1 項第1 款於本訊\n    問程序終結前，被告撤銷協商合意或檢察官撤回協商聲請者\n    ；第2 款被告協商之意思非出於自由意志者；第4 款被告所\n    犯之罪非第455 條之2 第1 項所定得以協商判決者；第6 款\n    被告有其他較重之裁判上一罪之犯罪事實者；第7 款法院認\n    應諭知免刑或免訴、不受理者情形之一，及違反同條第2 項\n    「法院應於協商合意範圍內為判決；法院為協商判決所科之\n    刑，以宣告緩刑或2 年以下有期徒刑、拘役或罰金為限」之\n    規定者外，不得上訴。\n六、如有前述得上訴情形而不服本判決，得自收受判決（即以本\n    宣示判決筆錄代之）送達之日起10日內，向本院提出上訴書\n    狀，並應敘述具體理由，如未敘述上訴理由者，應於上訴期\n    間屆滿後20日內補提理由書狀於本院（均須按他造當事人之\n    人數附繕本）「切勿逕送上級法院」。\n中    華    民    國   100    年    5     月    12    日\n                  臺灣高雄地方法院刑事第十庭\n                              書記官    張琇晴\n                              法  官    呂明燕\n以上正本證明與原本無異。\n如不服本判決應於收受本判決後10日內向本院提出上訴書狀，並\n應敘述具體理由，如未敘述上訴理由者，應於上訴期間屆滿後20\n日內補提理由書狀於本院（均須按他造當事人之人數附繕本）「\n切勿逕送上級法院」。\n中    華    民    國   100    年    5     月    12    日\n                              書記官    張琇晴\n附錄本案所犯法條：\n《毒品危害防制條例第10條》\n施用第一級毒品者，處6 月以上5 年以下有期徒刑。\n施用第二級毒品者，處3 年以下有期徒刑。",
  "structure": {
  },
  "search": "臺灣高雄地方法院宣示判決筆錄100年度審訴字第1130號公訴人臺灣高雄地方法院檢察署檢察官被告顏才富指定辯護人本院公設辯護人蘇鴻吉上列被告因100年度審訴字第1130號毒品危害防制條例案件，經檢察官提起公訴（起訴案號：臺灣高雄地方法院檢察署檢察官100年度毒偵字第1024號），經檢察官聲請法院改依協商程序而為判決，本院合議庭認為適當，裁定由受命法官進行協商判決程序，於中華民國100年5月12日下午4時在本院刑事第十法庭宣示判決，以代判決書，出席職員如下：法官呂明燕書記官張琇晴通譯楊博淳法官起立朗讀判決主文、犯罪事實要旨、處罰條文、附記事項，及告以上訴限制、期間並提出上訴狀之法院，且諭知記載其內容：一、主文：顏才富施用第一級毒品，累犯，處有期徒刑捌月；又施用第二級毒品，累犯，處有期徒刑肆月。應執行有期徒刑拾月。二、犯罪事實要旨：顏才富前於民國89年間，因施用毒品案件，經本院裁定送觀察、勒戒後，因無繼續施用毒品傾向，於89年11月7日執行完畢釋放，並經臺灣高雄地方法院檢察署檢察官為不起訴處分確定；復於前開觀察、勒戒執行完畢5年內之90年間，再犯施用毒品案件，經本院以90年度毒聲字第7223號裁定令入戒治處所施以強制戒治，嗣經裁定停止戒治並付保護管束，於92年1月21日執行完畢，同案並經本院以91年度訴字第3號判決判處有期徒刑7月確定，於92年9月24日縮刑期滿執行完畢。復於94年間，因施用毒品案件，經本院以95年度訴字第523號判決判處有期徒刑8月、3月，應執行有期徒刑9月確定，於96年6月26日縮刑期滿執行完畢。詎其猶不知悛悔並戒絕毒癮，分別基於施用第一級毒品海洛因與第二級毒品甲基安非他命之犯意，於99年11月24日上午11時許，在其位於高雄市○○區○○路278巷1弄31號住處內，將甲基安非他命置入玻璃球內燒烤之方式，施用第二級毒品甲基安非他命1次；又於同年月25日下午4時許，同在上址，以針筒注射之之方式，施用第一級毒品海洛因1次。三、處罰條文：毒品危害防制條例第10條第1項、第2項，刑法第11條前段、第47條第1項、第51條第5款。四、附記事項：無。五、協商判決除有刑事訴訟法第455條之4第1項第1款於本訊問程序終結前，被告撤銷協商合意或檢察官撤回協商聲請者；第2款被告協商之意思非出於自由意志者；第4款被告所犯之罪非第455條之2第1項所定得以協商判決者；第6款被告有其他較重之裁判上一罪之犯罪事實者；第7款法院認應諭知免刑或免訴、不受理者情形之一，及違反同條第2項「法院應於協商合意範圍內為判決；法院為協商判決所科之刑，以宣告緩刑或2年以下有期徒刑、拘役或罰金為限」之規定者外，不得上訴。六、如有前述得上訴情形而不服本判決，得自收受判決（即以本宣示判決筆錄代之）送達之日起10日內，向本院提出上訴書狀，並應敘述具體理由，如未敘述上訴理由者，應於上訴期間屆滿後20日內補提理由書狀於本院（均須按他造當事人之人數附繕本）「切勿逕送上級法院」。中華民國100年5月12日臺灣高雄地方法院刑事第十庭書記官張琇晴法官呂明燕以上正本證明與原本無異。如不服本判決應於收受本判決後10日內向本院提出上訴書狀，並應敘述具體理由，如未敘述上訴理由者，應於上訴期間屆滿後20日內補提理由書狀於本院（均須按他造當事人之人數附繕本）「切勿逕送上級法院」。中華民國100年5月12日書記官張琇晴附錄本案所犯法條：《毒品危害防制條例第10條》施用第一級毒品者，處6月以上5年以下有期徒刑。施用第二級毒品者，處3年以下有期徒刑。",
  "characters": {
    "judges": [
      "呂明燕",
      "呂明燕"
    ],
    "prosecutors": [

    ],
    "lawyers": [

    ],
    "clerks": [
      "張琇晴",
      "張琇晴",
      "張琇晴"
    ],
    "plaintiffs": [

    ],
    "defendants": [
      "顏才富"
    ],
    "prosecutor_office": [
      "臺灣高雄地方法院檢察署檢察官"
    ],
    "creditors": [

    ],
    "debtors": [

    ],
    "judicial_associate_officer": [

    ]
  },
  "adjudged_at": "2011-05-12",
  "created_at": "2016-02-12 00:54:21",
  "updated_at": "2016-02-12 00:54:21"
}