{
  "identify": "TNH-100-抗-65-20110303-1",
  "court": {
    "name": "臺灣高等法院",
    "code": "TNH"
  },
  "division": {
    "name": "刑事",
    "code": "M"
  },
  "year": 100,
  "word": "抗",
  "number": "65",
  "jcheck": "1",
  "reason": "定應執行刑",
  "content": "臺灣高等法院臺南分院刑事裁定           100年度抗字第65號\n抗  告  人\n即受刑人    葉智傑\n上列抗告人因定應執行刑案件，不服臺灣嘉義地方法院中華民國\n100年1月17日裁定（100年度聲字第86號）提起抗告，本院裁定\n如下：\n    主  文\n抗告駁回。\n    理  由\n一、本件抗告意旨略以：抗告人因違反毒品危害防制條例案件，\n    經判處有期徒刑7月，並已執行完畢，卻又因詐欺案經判處\n    有期徒刑4月，而經原審定應執行刑為有期徒刑10月，但聲\n    請人就不得易科罰金之有期徒刑7月，已執行完畢，且以更\n    生人身分，好不容易才找到工作，又因車禍，切掉脾臟，原\n    審裁定應執行刑卻不得易科罰金，對被告身體、家庭造成諸\n    多不便，爰提起抗告，請求能宣告易科罰金之折算標準。\n二、經查：抗告人即受刑人葉智傑因違反毒品危害防制條例、詐\n    欺案件，經臺灣嘉義地方法院分別判處有期徒刑7月、4月確\n    定，有臺灣高等法院被告前科紀錄表在卷可憑，原審因而依\n    檢察官之聲請，定應執行為有期徒刑10月，依法並無違誤，\n    另按數罪併罰中之1罪，依刑法規定得易科罰金，若因與不\n    得易科之他罪併合處罰結果而不得易科罰金時，原可易科部\n    分所處之刑，自亦無為易科折算標準之記載（大法官釋字第\n    144號解釋意旨參照），被告所犯違反毒品危害防制條例之\n    罪，既經判處有刑徒刑7月，即屬不得易科罰金，則原裁定\n    就該罪與詐欺罪定應執行刑後，依據前揭解釋意旨而未為易\n    科罰金之諭知，於法並無違誤，抗告意旨，以前詞指摘原裁\n    定不當，為無理由，應予駁回。\n三、據上論結，應依刑事訴訟法第412條，裁定如主文。\n中    華    民    國   100    年    3     月    3     日\n                  刑事第五庭    審判長法  官  楊明章\n                                      法  官  黃國永\n                                      法  官  趙文淵\n以上正本證明與原本無異。\n如不服本裁定，應於收受本裁定後五日內向本院提出抗告狀。\n                                      書記官  呂宬樂\n中    華    民    國   100    年    3     月    3     日",
  "structure": {
    "main": "抗告駁回。",
    "reason": "一、本件抗告意旨略以：抗告人因違反毒品危害防制條例案件，\n    經判處有期徒刑7月，並已執行完畢，卻又因詐欺案經判處\n    有期徒刑4月，而經原審定應執行刑為有期徒刑10月，但聲\n    請人就不得易科罰金之有期徒刑7月，已執行完畢，且以更\n    生人身分，好不容易才找到工作，又因車禍，切掉脾臟，原\n    審裁定應執行刑卻不得易科罰金，對被告身體、家庭造成諸\n    多不便，爰提起抗告，請求能宣告易科罰金之折算標準。\n二、經查：抗告人即受刑人葉智傑因違反毒品危害防制條例、詐\n    欺案件，經臺灣嘉義地方法院分別判處有期徒刑7月、4月確\n    定，有臺灣高等法院被告前科紀錄表在卷可憑，原審因而依\n    檢察官之聲請，定應執行為有期徒刑10月，依法並無違誤，\n    另按數罪併罰中之1罪，依刑法規定得易科罰金，若因與不\n    得易科之他罪併合處罰結果而不得易科罰金時，原可易科部\n    分所處之刑，自亦無為易科折算標準之記載（大法官釋字第\n    144號解釋意旨參照），被告所犯違反毒品危害防制條例之\n    罪，既經判處有刑徒刑7月，即屬不得易科罰金，則原裁定\n    就該罪與詐欺罪定應執行刑後，依據前揭解釋意旨而未為易\n    科罰金之諭知，於法並無違誤，抗告意旨，以前詞指摘原裁\n    定不當，為無理由，應予駁回。\n三、據上論結，應依刑事訴訟法第412條，裁定如主文。"
  },
  "search": "臺灣高等法院臺南分院刑事裁定100年度抗字第65號抗告人即受刑人葉智傑上列抗告人因定應執行刑案件，不服臺灣嘉義地方法院中華民國100年1月17日裁定（100年度聲字第86號）提起抗告，本院裁定如下：主文抗告駁回。理由一、本件抗告意旨略以：抗告人因違反毒品危害防制條例案件，經判處有期徒刑7月，並已執行完畢，卻又因詐欺案經判處有期徒刑4月，而經原審定應執行刑為有期徒刑10月，但聲請人就不得易科罰金之有期徒刑7月，已執行完畢，且以更生人身分，好不容易才找到工作，又因車禍，切掉脾臟，原審裁定應執行刑卻不得易科罰金，對被告身體、家庭造成諸多不便，爰提起抗告，請求能宣告易科罰金之折算標準。二、經查：抗告人即受刑人葉智傑因違反毒品危害防制條例、詐欺案件，經臺灣嘉義地方法院分別判處有期徒刑7月、4月確定，有臺灣高等法院被告前科紀錄表在卷可憑，原審因而依檢察官之聲請，定應執行為有期徒刑10月，依法並無違誤，另按數罪併罰中之1罪，依刑法規定得易科罰金，若因與不得易科之他罪併合處罰結果而不得易科罰金時，原可易科部分所處之刑，自亦無為易科折算標準之記載（大法官釋字第144號解釋意旨參照），被告所犯違反毒品危害防制條例之罪，既經判處有刑徒刑7月，即屬不得易科罰金，則原裁定就該罪與詐欺罪定應執行刑後，依據前揭解釋意旨而未為易科罰金之諭知，於法並無違誤，抗告意旨，以前詞指摘原裁定不當，為無理由，應予駁回。三、據上論結，應依刑事訴訟法第412條，裁定如主文。中華民國100年3月3日刑事第五庭審判長法官楊明章法官黃國永法官趙文淵以上正本證明與原本無異。如不服本裁定，應於收受本裁定後五日內向本院提出抗告狀。書記官呂宬樂中華民國100年3月3日",
  "characters": {
    "judges": [
      "楊明章",
      "黃國永",
      "趙文淵"
    ],
    "prosecutors": [

    ],
    "lawyers": [

    ],
    "clerks": [
      "呂宬樂"
    ],
    "plaintiffs": [

    ],
    "defendants": [

    ],
    "prosecutor_office": [

    ],
    "creditors": [

    ],
    "debtors": [

    ],
    "judicial_associate_officer": [

    ]
  },
  "adjudged_at": "2011-03-03",
  "created_at": "2016-02-13 19:52:02",
  "updated_at": "2016-02-13 19:52:02"
}