{
  "identify": "ULD-100-訴-75-20110302-1",
  "court": {
    "name": "臺灣雲林地方法院",
    "code": "ULD"
  },
  "division": {
    "name": "刑事",
    "code": "M"
  },
  "year": 100,
  "word": "訴",
  "number": "75",
  "jcheck": "1",
  "reason": "違反毒品危害防制條例",
  "content": "臺灣雲林地方法院協商程序宣示判決筆錄\n公  訴  人  臺灣雲林地方法院檢察署檢察官\n被      告  劉周芳\n指定辯護人  本院公設辯護人許俊雄\n上列被告因違反毒品危害防制條例案件，經檢察官提起公訴（99\n年度毒偵字第1759號），並聲請法院改依協商程序而為判決，本\n院認為適當，同意由受命法官獨任進行協商判決程序，於中華民\n國100 年3 月2 日下午3 時5 分在本院第九法庭宣示判決，以代\n判決書，出席職員如下：\n    法  官  謝宜雯\n    書記官  林美鳳\n    通  譯  沈民堯\n法官起立朗讀判決主文、犯罪事實要旨、處罰條文並告知上訴限\n制、期間及提出上訴狀之法院，且諭知記載其內容：\n一、主  文：\n    劉周芳施用第一級毒品，累犯，處有期徒刑拾壹月。\n二、犯罪事實要旨：\n    劉周芳前因施用毒品案件，經送強制戒治，因戒治成效良好\n    ，於民國90年7 月25日停止戒治釋放出所，所餘期間付保護\n    管束，嗣於91年1 月18日期滿，並由臺灣雲林地方法院檢察\n    署檢察官於同年2 月4 日，以91年度戒毒偵字第14號案件為\n    不起訴處分確定；又於5 年內，再犯施用第二級毒品案件，\n    經本院以93年度港簡字第85號刑事判決判處有期徒刑6 月確\n    定並執行完畢；復因施用第一、二級毒品案件，經本院以94\n    年度訴字第585 號刑事判決分別判處有期徒刑7 月、6 月，\n    並定應執行刑1 年確定，又於95年間，因竊盜、施用第一級\n    毒品等案件，經本院以95年度易字第71號、95年度訴字第26\n    7 號判決各判處有期徒刑9 月、8 月確定，上開3 案經本院\n    以96年度聲減字第540 號裁定各減為有期徒刑3 月15日、3\n    月、4 月15日、4 月，應執行有期徒刑1 年1 月確定後，與\n    劉周芳另於94年間因竊盜罪經本院以94年度易字第284 號判\n    決確定之有期徒刑7 月接續執行後，甫於96年9 月8 日縮刑\n    期滿執行完畢。猶不思警惕，復基於施用第1 、2 級毒品之\n    犯意，於99年11月5 日下午某時許，在雲林縣四湖鄉「參天\n    宮」之廁所內，以將第一、二級毒品海洛因及甲基安非他命\n    摻水混合後置入針筒內再加以注射之方式，同時施用第一、\n    二級毒品1 次。嗣於翌日上午11時55分許，為警採尿送驗後\n    ，結果呈可待因陽性、嗎啡陽性及安非他命陽性、甲基安非\n    他命陽性反應，始悉上情。\n三、處罰條文：\n    毒品危害防制條例第10條第1項、第2項，刑法第11條前段、\n    第47條第1項、第55條前段（兩罪為想像競合，應從重以施\n    用第一級毒品罪處斷）\n四、協商判決原則上不得上訴。但有刑事訴訟法第455 條之4 第\n    1 項第1 款「於本訊問程序終結前，被告撤銷協商合意或檢\n    察官撤回協商聲請者」；第2 款「被告協商之意思非出於自\n    由意志者」；第4 款「被告所犯之罪非第455 條之2 第1 項\n    所得以協商判決者」；第6 款「被告有其他較重之裁判上一\n    罪之犯罪事實者」；第7 款「法院認應諭知免刑或免訴、不\n    受理者」等情形之一，或協商判決違反同條第2 項「法院應\n    於協商合意範圍內為判決；法院為協商判決所科之刑，以宣\n    告緩刑、2 年以下有期徒刑、拘役或罰金為限」等規定者（\n    以上均簡稱但書情形），不在此限（即有但書情形，依法仍\n    得上訴）。\n五、本件如有上述但書情形，且不服本判決時，得自收受判決送\n    達之日起10日內，向本院提出上訴狀（須附繕本），上訴於\n    第二審法院。\n六、依據刑事訴訟法第455條之9之規定，作成本宣示判決筆錄，\n    以代判決書。\n中    華    民    國   100    年    3     月    2     日\n                  刑事第一庭  書記官  林 美 鳳\n                              法  官  謝 宜 雯\n以上正本證明與原本無異。\n                              書記官  林 美 鳳\n中    華    民    國   100    年    3     月    7     日",
  "structure": {
  },
  "search": "臺灣雲林地方法院協商程序宣示判決筆錄公訴人臺灣雲林地方法院檢察署檢察官被告劉周芳指定辯護人本院公設辯護人許俊雄上列被告因違反毒品危害防制條例案件，經檢察官提起公訴（99年度毒偵字第1759號），並聲請法院改依協商程序而為判決，本院認為適當，同意由受命法官獨任進行協商判決程序，於中華民國100年3月2日下午3時5分在本院第九法庭宣示判決，以代判決書，出席職員如下：法官謝宜雯書記官林美鳳通譯沈民堯法官起立朗讀判決主文、犯罪事實要旨、處罰條文並告知上訴限制、期間及提出上訴狀之法院，且諭知記載其內容：一、主文：劉周芳施用第一級毒品，累犯，處有期徒刑拾壹月。二、犯罪事實要旨：劉周芳前因施用毒品案件，經送強制戒治，因戒治成效良好，於民國90年7月25日停止戒治釋放出所，所餘期間付保護管束，嗣於91年1月18日期滿，並由臺灣雲林地方法院檢察署檢察官於同年2月4日，以91年度戒毒偵字第14號案件為不起訴處分確定；又於5年內，再犯施用第二級毒品案件，經本院以93年度港簡字第85號刑事判決判處有期徒刑6月確定並執行完畢；復因施用第一、二級毒品案件，經本院以94年度訴字第585號刑事判決分別判處有期徒刑7月、6月，並定應執行刑1年確定，又於95年間，因竊盜、施用第一級毒品等案件，經本院以95年度易字第71號、95年度訴字第267號判決各判處有期徒刑9月、8月確定，上開3案經本院以96年度聲減字第540號裁定各減為有期徒刑3月15日、3月、4月15日、4月，應執行有期徒刑1年1月確定後，與劉周芳另於94年間因竊盜罪經本院以94年度易字第284號判決確定之有期徒刑7月接續執行後，甫於96年9月8日縮刑期滿執行完畢。猶不思警惕，復基於施用第1、2級毒品之犯意，於99年11月5日下午某時許，在雲林縣四湖鄉「參天宮」之廁所內，以將第一、二級毒品海洛因及甲基安非他命摻水混合後置入針筒內再加以注射之方式，同時施用第一、二級毒品1次。嗣於翌日上午11時55分許，為警採尿送驗後，結果呈可待因陽性、嗎啡陽性及安非他命陽性、甲基安非他命陽性反應，始悉上情。三、處罰條文：毒品危害防制條例第10條第1項、第2項，刑法第11條前段、第47條第1項、第55條前段（兩罪為想像競合，應從重以施用第一級毒品罪處斷）四、協商判決原則上不得上訴。但有刑事訴訟法第455條之4第1項第1款「於本訊問程序終結前，被告撤銷協商合意或檢察官撤回協商聲請者」；第2款「被告協商之意思非出於自由意志者」；第4款「被告所犯之罪非第455條之2第1項所得以協商判決者」；第6款「被告有其他較重之裁判上一罪之犯罪事實者」；第7款「法院認應諭知免刑或免訴、不受理者」等情形之一，或協商判決違反同條第2項「法院應於協商合意範圍內為判決；法院為協商判決所科之刑，以宣告緩刑、2年以下有期徒刑、拘役或罰金為限」等規定者（以上均簡稱但書情形），不在此限（即有但書情形，依法仍得上訴）。五、本件如有上述但書情形，且不服本判決時，得自收受判決送達之日起10日內，向本院提出上訴狀（須附繕本），上訴於第二審法院。六、依據刑事訴訟法第455條之9之規定，作成本宣示判決筆錄，以代判決書。中華民國100年3月2日刑事第一庭書記官林美鳳法官謝宜雯以上正本證明與原本無異。書記官林美鳳中華民國100年3月7日",
  "characters": {
    "judges": [
      "謝宜雯",
      "謝宜雯"
    ],
    "prosecutors": [

    ],
    "lawyers": [

    ],
    "clerks": [
      "林美鳳",
      "林美鳳"
    ],
    "plaintiffs": [

    ],
    "defendants": [
      "劉周芳"
    ],
    "prosecutor_office": [
      "臺灣雲林地方法院檢察署檢察官"
    ],
    "creditors": [

    ],
    "debtors": [

    ],
    "judicial_associate_officer": [

    ]
  },
  "adjudged_at": "2011-03-02",
  "created_at": "2016-02-13 19:58:24",
  "updated_at": "2016-02-13 19:58:24"
}