{
  "identify": "SCD-100-竹北簡-269-20110608-1",
  "court": {
    "name": "臺灣新竹地方法院",
    "code": "SCD"
  },
  "division": {
    "name": "刑事",
    "code": "M"
  },
  "year": 100,
  "word": "竹北簡",
  "number": "269",
  "jcheck": "1",
  "reason": "違反毒品危害防制條例",
  "content": "臺灣新竹地方法院刑事簡易判決      100年度竹北簡字第269號\n聲  請  人  臺灣新竹地方法院檢察署檢察官\n被      告  曾佳莉\n上列被告因違反毒品危害防制條例案件，經檢察官聲請以簡易判\n決處刑（100年度毒偵字第649號），本院判決如下：\n    主  文\n曾佳莉施用第二級毒品，處有期徒刑月，如易科罰金，以新臺\n幣壹仟元折算壹日。\n    事實及證據\n一、本件犯罪事實：\n（一）曾佳莉前於民國90年4月間，因施用第二級毒品案件，經\n      本院於90年4月17日，以90年度毒聲字第717號裁定送觀察\n      、勒戒，於90年5月15日入所執行觀察、勒戒後，因認無\n      繼續施用毒品傾向，嗣於90年6月8日釋放出所執行完畢，\n      並經臺灣新竹地方法院檢察署檢察官以90年度毒偵字第\n      127號為不起訴處分確定。\n（二）曾佳莉不知悔改，又於99年2月間，因施用第二級毒品案\n      件，經本院於99年2月26日，以99年度毒聲字第42號裁定\n      送觀察、勒戒，於99年3月27日入所執行觀察、勒戒後，\n      因認無繼續施用毒品傾向，嗣於99年5月12日釋放出所執\n      行完畢，並經臺灣新竹地方法院檢察署檢察官於99年5月\n      12日以99年度毒偵字第172號為不起訴處分確定。\n（三）曾佳莉不知警惕，於前開觀察、勒戒處分執行完畢釋放後\n      5 年內，復基於施用第二級毒品甲基安非他命的犯罪意思\n      ，於100年2月21日晚間10時30分採尿往前回溯96小時內之\n      某時許，在其新竹市○○○路48巷1號2樓住所，施用第二\n      級毒品甲基安非他命1次。嗣經警於100年2月21日晚間10\n      時許在新竹縣竹北市○○路○段與高鐵七路高鐵橋下執行\n      臨檢勤務時，查獲其為毒品調驗人口，而於同日晚間10時\n      30 分許在警局採集其尿液送驗，結果呈安非他命、甲基\n      安非他命陽性反應，始悉上情。\n二、證據：\n（一）被告曾佳莉於檢察事務官偵查中之自白。\n（二）被告為警查獲時，經採尿送驗結果，呈安非他命、甲基安\n      非他命陽性反應，有新竹縣政府警察局採尿室毒品人口到\n      場採尿名冊、台灣檢驗科技股份有限公司於100年3月9日\n      所出具之原樣編號Ｚ000000000000號濫用藥物尿液檢驗報\n      告影本各1紙附卷可憑。\n（三）臺灣高等法院被告前案紀錄表、全國施用毒品案件紀錄表\n      、刑案資料查註紀錄表、矯正簡表、臺灣新竹地方法院檢\n      察署檢察官90年度毒偵字第127號、99年度毒偵字第172號\n      不起訴處分各1份在卷可查。\n三、論罪及科刑：\n（一）論罪：被告曾佳莉所為，係犯毒品危害防制條例第10條第\n      2項之施用第二級毒品罪。被告施用前持有第二級毒品之\n      低度行為，為施用第二級毒品之高度行為所吸收，不另論\n      罪。\n（二）科刑：審酌被告素行，經施以觀察、勒戒處分後，本次又\n      再度施用足以導致精神障礙及生命危險之成癮性毒品，其\n      前經施以觀察、勒戒仍無法使其戒斷毒癮，足見其缺乏拒\n      用毒品之決心及悔改之意，兼以施用毒品所生危害以自戕\n      健康為主，及其施用次數，犯罪後承認犯行等一切情狀，\n      量處如主文所示之刑，並諭知易科罰金之折算標準，以資\n      懲儆。\n四、依刑事訴訟法第449條第1項前段、第454條第1項，毒品危害\n    防制條例第10條第2項，刑法第11條、第41條第1項前段，逕\n    以簡易判決處刑如主文。\n五、如不服本件判決，得自收受送達之日起10日內，向本院提起\n    上訴。\n中    華    民    國    100    年    6    月    8    日\n                    竹北簡易庭法  官  謝永昌\n上列正本證明與原本無異。\n中    華    民    國    100    年    6    月    8    日\n                              書記官  張淑芬\n附錄本案論罪科刑實體法條全文：\n毒品危害防制條例第10條第2 項：\n施用第二級毒品者，處3 年以下有期徒刑",
  "structure": {
  },
  "search": "臺灣新竹地方法院刑事簡易判決100年度竹北簡字第269號聲請人臺灣新竹地方法院檢察署檢察官被告曾佳莉上列被告因違反毒品危害防制條例案件，經檢察官聲請以簡易判決處刑（100年度毒偵字第649號），本院判決如下：主文曾佳莉施用第二級毒品，處有期徒刑月，如易科罰金，以新臺幣壹仟元折算壹日。事實及證據一、本件犯罪事實：（一）曾佳莉前於民國90年4月間，因施用第二級毒品案件，經本院於90年4月17日，以90年度毒聲字第717號裁定送觀察、勒戒，於90年5月15日入所執行觀察、勒戒後，因認無繼續施用毒品傾向，嗣於90年6月8日釋放出所執行完畢，並經臺灣新竹地方法院檢察署檢察官以90年度毒偵字第127號為不起訴處分確定。（二）曾佳莉不知悔改，又於99年2月間，因施用第二級毒品案件，經本院於99年2月26日，以99年度毒聲字第42號裁定送觀察、勒戒，於99年3月27日入所執行觀察、勒戒後，因認無繼續施用毒品傾向，嗣於99年5月12日釋放出所執行完畢，並經臺灣新竹地方法院檢察署檢察官於99年5月12日以99年度毒偵字第172號為不起訴處分確定。（三）曾佳莉不知警惕，於前開觀察、勒戒處分執行完畢釋放後5年內，復基於施用第二級毒品甲基安非他命的犯罪意思，於100年2月21日晚間10時30分採尿往前回溯96小時內之某時許，在其新竹市○○○路48巷1號2樓住所，施用第二級毒品甲基安非他命1次。嗣經警於100年2月21日晚間10時許在新竹縣竹北市○○路○段與高鐵七路高鐵橋下執行臨檢勤務時，查獲其為毒品調驗人口，而於同日晚間10時30分許在警局採集其尿液送驗，結果呈安非他命、甲基安非他命陽性反應，始悉上情。二、證據：（一）被告曾佳莉於檢察事務官偵查中之自白。（二）被告為警查獲時，經採尿送驗結果，呈安非他命、甲基安非他命陽性反應，有新竹縣政府警察局採尿室毒品人口到場採尿名冊、台灣檢驗科技股份有限公司於100年3月9日所出具之原樣編號Ｚ000000000000號濫用藥物尿液檢驗報告影本各1紙附卷可憑。（三）臺灣高等法院被告前案紀錄表、全國施用毒品案件紀錄表、刑案資料查註紀錄表、矯正簡表、臺灣新竹地方法院檢察署檢察官90年度毒偵字第127號、99年度毒偵字第172號不起訴處分各1份在卷可查。三、論罪及科刑：（一）論罪：被告曾佳莉所為，係犯毒品危害防制條例第10條第2項之施用第二級毒品罪。被告施用前持有第二級毒品之低度行為，為施用第二級毒品之高度行為所吸收，不另論罪。（二）科刑：審酌被告素行，經施以觀察、勒戒處分後，本次又再度施用足以導致精神障礙及生命危險之成癮性毒品，其前經施以觀察、勒戒仍無法使其戒斷毒癮，足見其缺乏拒用毒品之決心及悔改之意，兼以施用毒品所生危害以自戕健康為主，及其施用次數，犯罪後承認犯行等一切情狀，量處如主文所示之刑，並諭知易科罰金之折算標準，以資懲儆。四、依刑事訴訟法第449條第1項前段、第454條第1項，毒品危害防制條例第10條第2項，刑法第11條、第41條第1項前段，逕以簡易判決處刑如主文。五、如不服本件判決，得自收受送達之日起10日內，向本院提起上訴。中華民國100年6月8日竹北簡易庭法官謝永昌上列正本證明與原本無異。中華民國100年6月8日書記官張淑芬附錄本案論罪科刑實體法條全文：毒品危害防制條例第10條第2項：施用第二級毒品者，處3年以下有期徒刑",
  "characters": {
    "judges": [
      "謝永昌"
    ],
    "prosecutors": [

    ],
    "lawyers": [

    ],
    "clerks": [
      "張淑芬"
    ],
    "plaintiffs": [

    ],
    "defendants": [
      "曾佳莉"
    ],
    "prosecutor_office": [
      "臺灣新竹地方法院檢察署檢察官"
    ],
    "creditors": [

    ],
    "debtors": [

    ],
    "judicial_associate_officer": [

    ]
  },
  "adjudged_at": "2011-06-08",
  "created_at": "2016-02-13 15:45:36",
  "updated_at": "2016-02-13 15:45:36"
}