{
  "identify": "SCD-100-竹簡-254-20110608-1",
  "court": {
    "name": "臺灣新竹地方法院",
    "code": "SCD"
  },
  "division": {
    "name": "民事",
    "code": "V"
  },
  "year": 100,
  "word": "竹簡",
  "number": "254",
  "jcheck": "1",
  "reason": "給付票款",
  "content": "臺灣新竹地方法院民事裁定            100年度竹簡字第254號\n原      告  傅文宏\n被      告  張碧純\n上列當事人間請求給付票款事件，本院裁定如下：\n    主  文\n原告之訴駁回。\n訴訟費用由原告負擔。\n    理  由\n一、按提起民事訴訟應依民事訴訟法第77條之13規定繳納裁判費\n    ，此為必須具備之程式。\n二、本件原告前對於被告聲請核發支付命令，經被告於法定期間\n    內聲明異議，依民事訴訟法第519 條規定，以原告支付命令\n    之聲請，視為起訴，而原告前聲請支付命令時，曾繳納裁判\n    費新台幣(下同)5百元，尚欠繳納裁判費12,380 元，經本院\n    於民國100年5月4日以裁定命原告於收受裁定後5日內補繳裁\n    判費，逾期未繳納，即駁回原告之訴，該項裁定已於100年5\n    月5日送達原告，有送達證書附卷可稽。\n三、原告逾期迄未補正，其訴顯難認為合法，應予駁回。\n四、依民事訴訟法第249條第1項第6 款，第95條，第78條，裁定\n    如主文。\n中    華    民    國   100    年    6     月    8     日\n                  民事第一庭    法      官  王佳惠\n以上正本係照原本作成。\n如不服本裁定應於送達後10日內向本院提出抗告狀，並繳納抗告\n費新臺幣1千元。\n中    華    民    國   100    年    6     月    8     日\n                                書  記  官  陳思璟",
  "structure": {
    "main": "原告之訴駁回。\n訴訟費用由原告負擔。",
    "reason": "一、按提起民事訴訟應依民事訴訟法第77條之13規定繳納裁判費\n    ，此為必須具備之程式。\n二、本件原告前對於被告聲請核發支付命令，經被告於法定期間\n    內聲明異議，依民事訴訟法第519 條規定，以原告支付命令\n    之聲請，視為起訴，而原告前聲請支付命令時，曾繳納裁判\n    費新台幣(下同)5百元，尚欠繳納裁判費12,380 元，經本院\n    於民國100年5月4日以裁定命原告於收受裁定後5日內補繳裁\n    判費，逾期未繳納，即駁回原告之訴，該項裁定已於100年5\n    月5日送達原告，有送達證書附卷可稽。\n三、原告逾期迄未補正，其訴顯難認為合法，應予駁回。\n四、依民事訴訟法第249條第1項第6 款，第95條，第78條，裁定\n    如主文。"
  },
  "search": "臺灣新竹地方法院民事裁定100年度竹簡字第254號原告傅文宏被告張碧純上列當事人間請求給付票款事件，本院裁定如下：主文原告之訴駁回。訴訟費用由原告負擔。理由一、按提起民事訴訟應依民事訴訟法第77條之13規定繳納裁判費，此為必須具備之程式。二、本件原告前對於被告聲請核發支付命令，經被告於法定期間內聲明異議，依民事訴訟法第519條規定，以原告支付命令之聲請，視為起訴，而原告前聲請支付命令時，曾繳納裁判費新台幣(下同)5百元，尚欠繳納裁判費12,380元，經本院於民國100年5月4日以裁定命原告於收受裁定後5日內補繳裁判費，逾期未繳納，即駁回原告之訴，該項裁定已於100年5月5日送達原告，有送達證書附卷可稽。三、原告逾期迄未補正，其訴顯難認為合法，應予駁回。四、依民事訴訟法第249條第1項第6款，第95條，第78條，裁定如主文。中華民國100年6月8日民事第一庭法官王佳惠以上正本係照原本作成。如不服本裁定應於送達後10日內向本院提出抗告狀，並繳納抗告費新臺幣1千元。中華民國100年6月8日書記官陳思璟",
  "characters": {
    "judges": [
      "王佳惠"
    ],
    "prosecutors": [

    ],
    "lawyers": [

    ],
    "clerks": [

    ],
    "plaintiffs": [
      "傅文宏"
    ],
    "defendants": [
      "張碧純"
    ],
    "prosecutor_office": [

    ],
    "creditors": [

    ],
    "debtors": [

    ],
    "judicial_associate_officer": [

    ]
  },
  "adjudged_at": "2011-06-08",
  "created_at": "2016-02-13 16:01:09",
  "updated_at": "2016-02-13 16:01:09"
}