{
  "identify": "KMH-100-聲再-1-20110628-1",
  "court": {
    "name": "福建高等法院金門分院",
    "code": "KMH"
  },
  "division": {
    "name": "刑事",
    "code": "M"
  },
  "year": 100,
  "word": "聲再",
  "number": "1",
  "jcheck": "1",
  "reason": "聲請再審",
  "content": "福建高等法院金門分院刑事裁定          100年度聲再字第1號\n再審聲請人\n即受判決人  陳河彬\n上列聲請人即受判決人因偽造文書等案件，對於本院97年度上訴\n字第16號，中華民國99年8 月24日第二審確定判決（原審案號：\n福建金門地方法院96年度訴字第18號，起訴案號：福建金門地方\n法院檢察署95年度偵字第313號及同署96年度偵字第169號移送併\n辦）聲請再審，本院裁定如下：\n    主  文\n再審暨停止刑罰執行之聲請均駁回。\n    理  由\n一、聲請意旨略以：\n（一）聲請人即受判決人陳河彬因偽造文書等案件，經本院97年\n      度上訴字第16號刑事判決（下稱原確定判決）判決有罪確\n      定，因發現有刑事訴訟法第420條第1項第6款規定之新證\n      據，而聲請再審。\n（二）另案宋旭杰（原名宋宜忠）被訴偽造文書案件，經台灣高\n      等法院98年度上訴字第451號判決及台灣台北地方法院97\n      年度訴字第1541號判決無罪確定，依該案件宋旭杰所述、\n      證人即本件共同被告楊美素在另案及本案之陳述，及本件\n      卷附經濟部投資審議委員會函，可知原確定判決附表一、\n      二所載聯益家電商行、林華雨具批發行、金鷹燈飾批發行\n      、美雲音像製品批發行、銀盛電腦辦公設備商行、優麗藝\n      品有限公司、晶華陶瓷有限公司、帝德電器有限公司、漳\n      州日茂塑膠有限公司、日辰鐘錶有限公司、鼎昌食品有限\n      公司等11家公司行號，係由楊美素或宋旭杰代理送件及申\n      請，與聲請人無關，原確定判決並未詳查。\n（三）再依卷內法務部調查局福建省調查處96年4月之卷宗第一\n      冊第150頁至第152頁所載：關於所謂「國華旅行社出具不\n      實之大陸台商在職證彙整表」所示，除羅讚佑及楊鵬霖等\n      2人未在該彙整表外，其餘如陳世育、林朝福、賴介禎、\n      孫慶茂、侯靖國、羅世忠、王俊福、幸延琮、林吳哲、何\n      明祖、楊順顯、倪世育、黃德倫等13人暨其他人，則均在\n      該彙整表內。而依該彙整表所示，每一申請人均記載有「\n      在台聯絡人」，簡言之，上開彙整表內所示之「在台聯絡\n      人」應即係替上開13人代辦小三通證之人，否則楊美素豈\n      有留設上開聯絡人之姓名及行動電話作為聯絡之理？而綜\n      合上開13人之在台聯絡人為謝幸儒、徐青枝、宋旭杰、楊\n      智婷。\n（四）原確定判決既發現有刑事訴訟法第420條第1項第6款規定\n      之新證據，即應傳訊證人楊美素、宋旭杰說明「台北郵局\n      第68-2036號信箱」之實際使用人為何？為何是由楊美素\n      代收投審會函？是否與聲請人有關？是否係由楊美素提供\n      所有聘僱證明書之相關文件？函查原確定判決附表一、二\n      所載之上開11家公司代理人聯絡地址是否均係「台北郵局\n      第68-2036號信箱」？是否與楊美素、宋旭杰有關？傳訊\n      上開「在台聯絡人」徐青枝、宋旭杰、楊智婷說明陳世育\n      等13人，究係透過何人辦理「小三通證」？是否透過證人\n      等在台聯絡人（聲請人或楊美素？）繳交相關費用及辦理\n      小三通時所必需之證明文件？該等證明文件究係由何人所\n      出具、交付予證人以辦理小三通證？對聲請人有無使公務\n      員登載不實之犯行等構成要件行為之釐清至為重要，自有\n      予以傳訊之必要。\n（五）爰依刑事訴訟法第420條第1項第6款、第421條規定聲請再\n      審，並裁定停止刑罰之執行。\n二、按法院認為無再審理由者，應以裁定駁回之。經前項裁定後\n    ，不得更以同一原因聲請再審，刑事訴訟法第434 條定有明\n    文。又法院認為聲請再審之程序違背規定者，應以裁定駁回\n    之，刑事訴訟法第433條亦有明文。\n三、經查：聲請意旨所述之再審事由，業經聲請人先前以此同一\n    原因聲請再審，並經本院認無再審理由裁定駁回確定等情，\n    有本院99年度聲再字第5號、第6號裁定在卷足憑，自無從更\n    以同一原因聲請再審，揆諸上開規定，其聲請再審之程序自\n    屬違背規定，應予駁回。其停止刑罰執行之聲請亦無理由，\n    應併予駁回。\n四、據上論斷，應依刑事訴訟法第433 條，裁定如主文。\n中    華    民    國   100    年    6     月    28    日\n                    刑事庭審判長法  官  吳昭瑩\n                                法  官  陳坤地\n                                法  官  陳容正\n以上為正本，係照原本作成，證明與原本無異。\n本裁定不得抗告。\n中    華    民    國   100    年    6     月    28    日\n                                書記官  周秀香",
  "structure": {
    "main": "再審暨停止刑罰執行之聲請均駁回。",
    "reason": "一、聲請意旨略以：\n（一）聲請人即受判決人陳河彬因偽造文書等案件，經本院97年\n      度上訴字第16號刑事判決（下稱原確定判決）判決有罪確\n      定，因發現有刑事訴訟法第420條第1項第6款規定之新證\n      據，而聲請再審。\n（二）另案宋旭杰（原名宋宜忠）被訴偽造文書案件，經台灣高\n      等法院98年度上訴字第451號判決及台灣台北地方法院97\n      年度訴字第1541號判決無罪確定，依該案件宋旭杰所述、\n      證人即本件共同被告楊美素在另案及本案之陳述，及本件\n      卷附經濟部投資審議委員會函，可知原確定判決附表一、\n      二所載聯益家電商行、林華雨具批發行、金鷹燈飾批發行\n      、美雲音像製品批發行、銀盛電腦辦公設備商行、優麗藝\n      品有限公司、晶華陶瓷有限公司、帝德電器有限公司、漳\n      州日茂塑膠有限公司、日辰鐘錶有限公司、鼎昌食品有限\n      公司等11家公司行號，係由楊美素或宋旭杰代理送件及申\n      請，與聲請人無關，原確定判決並未詳查。\n（三）再依卷內法務部調查局福建省調查處96年4月之卷宗第一\n      冊第150頁至第152頁所載：關於所謂「國華旅行社出具不\n      實之大陸台商在職證彙整表」所示，除羅讚佑及楊鵬霖等\n      2人未在該彙整表外，其餘如陳世育、林朝福、賴介禎、\n      孫慶茂、侯靖國、羅世忠、王俊福、幸延琮、林吳哲、何\n      明祖、楊順顯、倪世育、黃德倫等13人暨其他人，則均在\n      該彙整表內。而依該彙整表所示，每一申請人均記載有「\n      在台聯絡人」，簡言之，上開彙整表內所示之「在台聯絡\n      人」應即係替上開13人代辦小三通證之人，否則楊美素豈\n      有留設上開聯絡人之姓名及行動電話作為聯絡之理？而綜\n      合上開13人之在台聯絡人為謝幸儒、徐青枝、宋旭杰、楊\n      智婷。\n（四）原確定判決既發現有刑事訴訟法第420條第1項第6款規定\n      之新證據，即應傳訊證人楊美素、宋旭杰說明「台北郵局\n      第68-2036號信箱」之實際使用人為何？為何是由楊美素\n      代收投審會函？是否與聲請人有關？是否係由楊美素提供\n      所有聘僱證明書之相關文件？函查原確定判決附表一、二\n      所載之上開11家公司代理人聯絡地址是否均係「台北郵局\n      第68-2036號信箱」？是否與楊美素、宋旭杰有關？傳訊\n      上開「在台聯絡人」徐青枝、宋旭杰、楊智婷說明陳世育\n      等13人，究係透過何人辦理「小三通證」？是否透過證人\n      等在台聯絡人（聲請人或楊美素？）繳交相關費用及辦理\n      小三通時所必需之證明文件？該等證明文件究係由何人所\n      出具、交付予證人以辦理小三通證？對聲請人有無使公務\n      員登載不實之犯行等構成要件行為之釐清至為重要，自有\n      予以傳訊之必要。\n（五）爰依刑事訴訟法第420條第1項第6款、第421條規定聲請再\n      審，並裁定停止刑罰之執行。\n二、按法院認為無再審理由者，應以裁定駁回之。經前項裁定後\n    ，不得更以同一原因聲請再審，刑事訴訟法第434 條定有明\n    文。又法院認為聲請再審之程序違背規定者，應以裁定駁回\n    之，刑事訴訟法第433條亦有明文。\n三、經查：聲請意旨所述之再審事由，業經聲請人先前以此同一\n    原因聲請再審，並經本院認無再審理由裁定駁回確定等情，\n    有本院99年度聲再字第5號、第6號裁定在卷足憑，自無從更\n    以同一原因聲請再審，揆諸上開規定，其聲請再審之程序自\n    屬違背規定，應予駁回。其停止刑罰執行之聲請亦無理由，\n    應併予駁回。\n四、據上論斷，應依刑事訴訟法第433 條，裁定如主文。"
  },
  "search": "福建高等法院金門分院刑事裁定100年度聲再字第1號再審聲請人即受判決人陳河彬上列聲請人即受判決人因偽造文書等案件，對於本院97年度上訴字第16號，中華民國99年8月24日第二審確定判決（原審案號：福建金門地方法院96年度訴字第18號，起訴案號：福建金門地方法院檢察署95年度偵字第313號及同署96年度偵字第169號移送併辦）聲請再審，本院裁定如下：主文再審暨停止刑罰執行之聲請均駁回。理由一、聲請意旨略以：（一）聲請人即受判決人陳河彬因偽造文書等案件，經本院97年度上訴字第16號刑事判決（下稱原確定判決）判決有罪確定，因發現有刑事訴訟法第420條第1項第6款規定之新證據，而聲請再審。（二）另案宋旭杰（原名宋宜忠）被訴偽造文書案件，經台灣高等法院98年度上訴字第451號判決及台灣台北地方法院97年度訴字第1541號判決無罪確定，依該案件宋旭杰所述、證人即本件共同被告楊美素在另案及本案之陳述，及本件卷附經濟部投資審議委員會函，可知原確定判決附表一、二所載聯益家電商行、林華雨具批發行、金鷹燈飾批發行、美雲音像製品批發行、銀盛電腦辦公設備商行、優麗藝品有限公司、晶華陶瓷有限公司、帝德電器有限公司、漳州日茂塑膠有限公司、日辰鐘錶有限公司、鼎昌食品有限公司等11家公司行號，係由楊美素或宋旭杰代理送件及申請，與聲請人無關，原確定判決並未詳查。（三）再依卷內法務部調查局福建省調查處96年4月之卷宗第一冊第150頁至第152頁所載：關於所謂「國華旅行社出具不實之大陸台商在職證彙整表」所示，除羅讚佑及楊鵬霖等2人未在該彙整表外，其餘如陳世育、林朝福、賴介禎、孫慶茂、侯靖國、羅世忠、王俊福、幸延琮、林吳哲、何明祖、楊順顯、倪世育、黃德倫等13人暨其他人，則均在該彙整表內。而依該彙整表所示，每一申請人均記載有「在台聯絡人」，簡言之，上開彙整表內所示之「在台聯絡人」應即係替上開13人代辦小三通證之人，否則楊美素豈有留設上開聯絡人之姓名及行動電話作為聯絡之理？而綜合上開13人之在台聯絡人為謝幸儒、徐青枝、宋旭杰、楊智婷。（四）原確定判決既發現有刑事訴訟法第420條第1項第6款規定之新證據，即應傳訊證人楊美素、宋旭杰說明「台北郵局第68-2036號信箱」之實際使用人為何？為何是由楊美素代收投審會函？是否與聲請人有關？是否係由楊美素提供所有聘僱證明書之相關文件？函查原確定判決附表一、二所載之上開11家公司代理人聯絡地址是否均係「台北郵局第68-2036號信箱」？是否與楊美素、宋旭杰有關？傳訊上開「在台聯絡人」徐青枝、宋旭杰、楊智婷說明陳世育等13人，究係透過何人辦理「小三通證」？是否透過證人等在台聯絡人（聲請人或楊美素？）繳交相關費用及辦理小三通時所必需之證明文件？該等證明文件究係由何人所出具、交付予證人以辦理小三通證？對聲請人有無使公務員登載不實之犯行等構成要件行為之釐清至為重要，自有予以傳訊之必要。（五）爰依刑事訴訟法第420條第1項第6款、第421條規定聲請再審，並裁定停止刑罰之執行。二、按法院認為無再審理由者，應以裁定駁回之。經前項裁定後，不得更以同一原因聲請再審，刑事訴訟法第434條定有明文。又法院認為聲請再審之程序違背規定者，應以裁定駁回之，刑事訴訟法第433條亦有明文。三、經查：聲請意旨所述之再審事由，業經聲請人先前以此同一原因聲請再審，並經本院認無再審理由裁定駁回確定等情，有本院99年度聲再字第5號、第6號裁定在卷足憑，自無從更以同一原因聲請再審，揆諸上開規定，其聲請再審之程序自屬違背規定，應予駁回。其停止刑罰執行之聲請亦無理由，應併予駁回。四、據上論斷，應依刑事訴訟法第433條，裁定如主文。中華民國100年6月28日刑事庭審判長法官吳昭瑩法官陳坤地法官陳容正以上為正本，係照原本作成，證明與原本無異。本裁定不得抗告。中華民國100年6月28日書記官周秀香",
  "characters": {
    "judges": [
      "吳昭瑩",
      "陳坤地",
      "陳容正"
    ],
    "prosecutors": [

    ],
    "lawyers": [

    ],
    "clerks": [

    ],
    "plaintiffs": [

    ],
    "defendants": [

    ],
    "prosecutor_office": [

    ],
    "creditors": [

    ],
    "debtors": [

    ],
    "judicial_associate_officer": [

    ]
  },
  "adjudged_at": "2011-06-28",
  "created_at": "2016-02-13 16:02:55",
  "updated_at": "2016-02-13 16:02:55"
}