{
  "identify": "SCD-100-竹簡-488-20111125-1",
  "court": {
    "name": "臺灣新竹地方法院",
    "code": "SCD"
  },
  "division": {
    "name": "民事",
    "code": "V"
  },
  "year": 100,
  "word": "竹簡",
  "number": "488",
  "jcheck": "1",
  "reason": "給付票款",
  "content": "臺灣新竹地方法院民事裁定            100年度竹簡字第488號\n原      告  姜宏生\n被      告  鐵志精密工業股份有限公司\n法定代理人  伍俊鴻\n上列當事人間請求給付票款事件，本院裁定如下：\n    主      文\n原告之訴駁回。\n訴訟費用由原告負擔。\n    理      由\n一、按提起民事訴訟，應依民事訴訟法規定繳納裁判費，此為法\n    定必須具備之程式，又起訴不合程式者，法院應以裁定駁回\n    之，民事訴訟法第249 條第1 項第6 款定有明文，此一規定\n    於民事簡易訴訟程序亦有適用，此觀諸民事訴訟法第436 條\n    第2 項規定即明。\n二、本件支付命令異議視為起訴時原告僅繳納部分裁判費，經本\n    院於民國（下同）100 年10月14日以100 年度補字第858 號\n    裁定命其於收受送達後五日內補繳，此項裁定已於同年月18\n    日送達原告，有送達證書附卷可稽。\n三、原告逾期迄未補正，其訴不能認為合法，應予駁回。\n四、依民事訴訟法第436條第2項、第249條第1項第6款、第95條\n    、第78條，裁定如主文。\n中    華    民    國   100    年    11    月    25    日\n                  新竹簡易庭  法  官  張百見\n以上正本係照原本作成。\n如不服本裁定，應於送達後10日內，向本院提出抗告狀並表明抗\n告理由，如於本裁定宣示後送達前提起抗告者，應於裁定送達後\n10日內補提抗告理由書（須附繕本）。\n中    華    民    國   100    年    11    月    25    日\n                              書記官  黃詩傑",
  "structure": {
    "main": "原告之訴駁回。\n訴訟費用由原告負擔。",
    "reason": "一、按提起民事訴訟，應依民事訴訟法規定繳納裁判費，此為法\n    定必須具備之程式，又起訴不合程式者，法院應以裁定駁回\n    之，民事訴訟法第249 條第1 項第6 款定有明文，此一規定\n    於民事簡易訴訟程序亦有適用，此觀諸民事訴訟法第436 條\n    第2 項規定即明。\n二、本件支付命令異議視為起訴時原告僅繳納部分裁判費，經本\n    院於民國（下同）100 年10月14日以100 年度補字第858 號\n    裁定命其於收受送達後五日內補繳，此項裁定已於同年月18\n    日送達原告，有送達證書附卷可稽。\n三、原告逾期迄未補正，其訴不能認為合法，應予駁回。\n四、依民事訴訟法第436條第2項、第249條第1項第6款、第95條\n    、第78條，裁定如主文。"
  },
  "search": "臺灣新竹地方法院民事裁定100年度竹簡字第488號原告姜宏生被告鐵志精密工業股份有限公司法定代理人伍俊鴻上列當事人間請求給付票款事件，本院裁定如下：主文原告之訴駁回。訴訟費用由原告負擔。理由一、按提起民事訴訟，應依民事訴訟法規定繳納裁判費，此為法定必須具備之程式，又起訴不合程式者，法院應以裁定駁回之，民事訴訟法第249條第1項第6款定有明文，此一規定於民事簡易訴訟程序亦有適用，此觀諸民事訴訟法第436條第2項規定即明。二、本件支付命令異議視為起訴時原告僅繳納部分裁判費，經本院於民國（下同）100年10月14日以100年度補字第858號裁定命其於收受送達後五日內補繳，此項裁定已於同年月18日送達原告，有送達證書附卷可稽。三、原告逾期迄未補正，其訴不能認為合法，應予駁回。四、依民事訴訟法第436條第2項、第249條第1項第6款、第95條、第78條，裁定如主文。中華民國100年11月25日新竹簡易庭法官張百見以上正本係照原本作成。如不服本裁定，應於送達後10日內，向本院提出抗告狀並表明抗告理由，如於本裁定宣示後送達前提起抗告者，應於裁定送達後10日內補提抗告理由書（須附繕本）。中華民國100年11月25日書記官黃詩傑",
  "characters": {
    "judges": [
      "張百見"
    ],
    "prosecutors": [

    ],
    "lawyers": [

    ],
    "clerks": [

    ],
    "plaintiffs": [
      "姜宏生"
    ],
    "defendants": [
      "鐵志精密工業股份有限公司"
    ],
    "prosecutor_office": [

    ],
    "creditors": [

    ],
    "debtors": [

    ],
    "judicial_associate_officer": [

    ]
  },
  "adjudged_at": "2011-11-25",
  "created_at": "2016-02-13 00:04:12",
  "updated_at": "2016-02-13 00:04:12"
}