{
  "identify": "KLD-94-易-57-20050311-2",
  "court": {
    "name": "臺灣基隆地方法院",
    "code": "KLD"
  },
  "division": {
    "name": "刑事",
    "code": "M"
  },
  "year": 94,
  "word": "易",
  "number": "57",
  "jcheck": "2",
  "reason": "毒品危害防制條例",
  "content": "臺灣基隆地方法院刑事判決                94年度易字第57號\n公  訴  人  臺灣基隆地方法院檢察署檢察官\n被      告  甲○○  男  31歲.\n上列被告因違反毒品危害防制條例案件，經檢察官提起公訴（94\n年度毒偵字第404 號），本院合議庭裁定由受命法官獨任進行簡\n式審判程序，茲判決如下：\n    主  文\n甲○○施用第二級毒品，累犯，處有期徒刑伍月，如易科罰金以\n佰元折算壹日。\n    理  由\n一、犯罪事實：\n    甲○○前因施用第2 級毒品案件，先後2 次經觀察勒戒後，\n    均認無繼續施用毒品傾向，由臺灣基隆地方法院檢察署檢察\n    官分別於民國（下同）88年7 月31日、88年11月17日，以88\n    年度偵字第4615號、88年度毒偵字第375 號為不起訴處分確\n    定；又因施用第2 級毒品案件，先送強制戒治（於92年1 月\n    10日戒治期滿），並由臺灣基隆地方法院檢察署檢察官聲請\n    簡易判決處刑，經本院於90年12月14日判處有期徒刑4 月，\n    於91年1 月7 日確定，於92年1 月6 日執行完畢。猶不知悔\n    改，復基於施用第2 級毒品安非他命之犯意，於93年11月10\n    日，在基隆市○○路某卡拉ＯＫ店之包廂內，以將毒品安非\n    他命放入玻璃管內加熱產生煙霧後再予施用之方式，施用第\n    2 級毒品安非他命1 次。嗣於93年11月11日，為警依毒品危\n    害防制條例第25條之規定通知到場，並採驗尿液呈安非他命\n    陽性反應，始查知上情。\n二、程序事項：\n    本件被告甲○○所犯者非為死刑、無期徒刑、最輕本刑為3\n    年以上有期徒刑之罪或高等法院管轄第一審案件，其於準備\n    程序進行中，先就被訴事實為有罪之陳述，經告知其簡式審\n    判程序之旨，並聽取公訴人之意見後，本院依刑事訴訟法第\n    273 條之1 第1 項之規定，裁定由受命法官獨任進行簡式審\n    判程序，合先敘明。\n三、認定事實所依據之證據及理由：\n（一）被告自白：被告於本院審理中自白其於前述時、地施用第\n      2 級毒品之犯行事實，其任意自白核與下列事證相符，應\n      堪採為證據。\n（二）尿液檢驗結果：\n      台灣檢驗科技份有限公司濫用藥物尿液檢驗報告（附於94\n      年度毒偵字第404 號偵查卷第8 頁）：被告經警通知於93\n      年11月11日19時55分許採集之尿液經檢驗結果，呈安非他\n      命陽性反應。\n（三）被告前因施用第2 級毒品案件，先後2 次經觀察勒戒後，\n      均認無繼續施用毒品傾向，由臺灣基隆地方法院檢察署檢\n      察官分別於88年7 月31日、88年11月17日，以88年度偵字\n      第4615號、88年度毒偵字第375 號為不起訴處分確定；又\n      因施用第2 級毒品案件，先送強制戒治（於92 年1月10日\n      戒治期滿），並由臺灣基隆地方法院檢察署檢察官聲請簡\n      易判決處刑，經本院於90年12月3 日判處有期徒刑4 月，\n      於91年1 月7 日確定，於92年1 月6 日執行完畢，有不起\n      訴處分書、聲請簡易判決處刑書、判決書及被告全國前案\n      紀錄表在卷可按。\n四、論罪及科刑之理由：\n（一）查安非他命係毒品危害防制條例第2 條第2 項第2 款所定\n      之第2 級毒品。核被告甲○○所為，係犯毒品危害防制條\n      例第10條第2 項之施用第2 級毒品罪。\n（二）查被告曾受前揭犯罪事實欄所載有期徒刑之執行完畢，有\n      臺灣高等法院被告全國前案紀錄表在卷可稽，其受有期徒\n      刑之執行完畢後，5 年以內再犯本件有期徒刑以上之罪，\n      為累犯，應加重其刑。\n（三）本院審酌毒品對於人體會產生成癮性，係足以危害個人健\n      康及社會安全之管制藥物，被告經過執行觀察、勒戒，及\n      強制戒治，猶不知戒除濫行施用毒品惡習，再犯本件施用\n      毒品罪，深陷毒坑無法自拔，及其犯罪之自我麻醉動機、\n      犯罪之手段、所生自我戕害結果及犯罪後坦承犯行之態度\n      等一切情狀，量處如主文所示之刑，並諭知易科罰金之折\n      算標準，以示懲儆。\n五、適用之法律依據：\n    刑事訴訟法第273 條之1 第1 項、第299 條第1 項前段，毒\n    品危害防制條例第10條第2 項，刑法第11條前段、第47條、\n    第41條第1 項前段，罰金罰鍰提高標準條例第2 條。\n中    華    民    國    94    年    3     月    11    日\n                  刑事第二庭法  官  齊  潔\n以上正本證明與原本無異。\n對於本件判決如有不服，應於收受送達後10日內，向本院提出上\n訴書狀，上訴於臺灣高等法院，並按他造當事人之人數附具繕本\n。\n中    華    民    國    94    年    3     月    14    日\n                            書記官  莊國南\n附錄論罪法條：\n毒品危害防制條例第10條第 2 項：\n施用第 2 級毒品者，處3 年以下有期徒刑。\n",
  "structure": {
    "main": "甲○○施用第二級毒品，累犯，處有期徒刑伍月，如易科罰金以\n佰元折算壹日。",
    "reason": "一、犯罪事實：\n    甲○○前因施用第2 級毒品案件，先後2 次經觀察勒戒後，\n    均認無繼續施用毒品傾向，由臺灣基隆地方法院檢察署檢察\n    官分別於民國（下同）88年7 月31日、88年11月17日，以88\n    年度偵字第4615號、88年度毒偵字第375 號為不起訴處分確\n    定；又因施用第2 級毒品案件，先送強制戒治（於92年1 月\n    10日戒治期滿），並由臺灣基隆地方法院檢察署檢察官聲請\n    簡易判決處刑，經本院於90年12月14日判處有期徒刑4 月，\n    於91年1 月7 日確定，於92年1 月6 日執行完畢。猶不知悔\n    改，復基於施用第2 級毒品安非他命之犯意，於93年11月10\n    日，在基隆市○○路某卡拉ＯＫ店之包廂內，以將毒品安非\n    他命放入玻璃管內加熱產生煙霧後再予施用之方式，施用第\n    2 級毒品安非他命1 次。嗣於93年11月11日，為警依毒品危\n    害防制條例第25條之規定通知到場，並採驗尿液呈安非他命\n    陽性反應，始查知上情。\n二、程序事項：\n    本件被告甲○○所犯者非為死刑、無期徒刑、最輕本刑為3\n    年以上有期徒刑之罪或高等法院管轄第一審案件，其於準備\n    程序進行中，先就被訴事實為有罪之陳述，經告知其簡式審\n    判程序之旨，並聽取公訴人之意見後，本院依刑事訴訟法第\n    273 條之1 第1 項之規定，裁定由受命法官獨任進行簡式審\n    判程序，合先敘明。\n三、認定事實所依據之證據及理由：\n（一）被告自白：被告於本院審理中自白其於前述時、地施用第\n      2 級毒品之犯行事實，其任意自白核與下列事證相符，應\n      堪採為證據。\n（二）尿液檢驗結果：\n      台灣檢驗科技份有限公司濫用藥物尿液檢驗報告（附於94\n      年度毒偵字第404 號偵查卷第8 頁）：被告經警通知於93\n      年11月11日19時55分許採集之尿液經檢驗結果，呈安非他\n      命陽性反應。\n（三）被告前因施用第2 級毒品案件，先後2 次經觀察勒戒後，\n      均認無繼續施用毒品傾向，由臺灣基隆地方法院檢察署檢\n      察官分別於88年7 月31日、88年11月17日，以88年度偵字\n      第4615號、88年度毒偵字第375 號為不起訴處分確定；又\n      因施用第2 級毒品案件，先送強制戒治（於92 年1月10日\n      戒治期滿），並由臺灣基隆地方法院檢察署檢察官聲請簡\n      易判決處刑，經本院於90年12月3 日判處有期徒刑4 月，\n      於91年1 月7 日確定，於92年1 月6 日執行完畢，有不起\n      訴處分書、聲請簡易判決處刑書、判決書及被告全國前案\n      紀錄表在卷可按。\n四、論罪及科刑之理由：\n（一）查安非他命係毒品危害防制條例第2 條第2 項第2 款所定\n      之第2 級毒品。核被告甲○○所為，係犯毒品危害防制條\n      例第10條第2 項之施用第2 級毒品罪。\n（二）查被告曾受前揭犯罪事實欄所載有期徒刑之執行完畢，有\n      臺灣高等法院被告全國前案紀錄表在卷可稽，其受有期徒\n      刑之執行完畢後，5 年以內再犯本件有期徒刑以上之罪，\n      為累犯，應加重其刑。\n（三）本院審酌毒品對於人體會產生成癮性，係足以危害個人健\n      康及社會安全之管制藥物，被告經過執行觀察、勒戒，及\n      強制戒治，猶不知戒除濫行施用毒品惡習，再犯本件施用\n      毒品罪，深陷毒坑無法自拔，及其犯罪之自我麻醉動機、\n      犯罪之手段、所生自我戕害結果及犯罪後坦承犯行之態度\n      等一切情狀，量處如主文所示之刑，並諭知易科罰金之折\n      算標準，以示懲儆。\n五、適用之法律依據：\n    刑事訴訟法第273 條之1 第1 項、第299 條第1 項前段，毒\n    品危害防制條例第10條第2 項，刑法第11條前段、第47條、\n    第41條第1 項前段，罰金罰鍰提高標準條例第2 條。"
  },
  "search": "臺灣基隆地方法院刑事判決94年度易字第57號公訴人臺灣基隆地方法院檢察署檢察官被告甲○○男31歲.上列被告因違反毒品危害防制條例案件，經檢察官提起公訴（94年度毒偵字第404號），本院合議庭裁定由受命法官獨任進行簡式審判程序，茲判決如下：主文甲○○施用第二級毒品，累犯，處有期徒刑伍月，如易科罰金以佰元折算壹日。理由一、犯罪事實：甲○○前因施用第2級毒品案件，先後2次經觀察勒戒後，均認無繼續施用毒品傾向，由臺灣基隆地方法院檢察署檢察官分別於民國（下同）88年7月31日、88年11月17日，以88年度偵字第4615號、88年度毒偵字第375號為不起訴處分確定；又因施用第2級毒品案件，先送強制戒治（於92年1月10日戒治期滿），並由臺灣基隆地方法院檢察署檢察官聲請簡易判決處刑，經本院於90年12月14日判處有期徒刑4月，於91年1月7日確定，於92年1月6日執行完畢。猶不知悔改，復基於施用第2級毒品安非他命之犯意，於93年11月10日，在基隆市○○路某卡拉ＯＫ店之包廂內，以將毒品安非他命放入玻璃管內加熱產生煙霧後再予施用之方式，施用第2級毒品安非他命1次。嗣於93年11月11日，為警依毒品危害防制條例第25條之規定通知到場，並採驗尿液呈安非他命陽性反應，始查知上情。二、程序事項：本件被告甲○○所犯者非為死刑、無期徒刑、最輕本刑為3年以上有期徒刑之罪或高等法院管轄第一審案件，其於準備程序進行中，先就被訴事實為有罪之陳述，經告知其簡式審判程序之旨，並聽取公訴人之意見後，本院依刑事訴訟法第273條之1第1項之規定，裁定由受命法官獨任進行簡式審判程序，合先敘明。三、認定事實所依據之證據及理由：（一）被告自白：被告於本院審理中自白其於前述時、地施用第2級毒品之犯行事實，其任意自白核與下列事證相符，應堪採為證據。（二）尿液檢驗結果：台灣檢驗科技份有限公司濫用藥物尿液檢驗報告（附於94年度毒偵字第404號偵查卷第8頁）：被告經警通知於93年11月11日19時55分許採集之尿液經檢驗結果，呈安非他命陽性反應。（三）被告前因施用第2級毒品案件，先後2次經觀察勒戒後，均認無繼續施用毒品傾向，由臺灣基隆地方法院檢察署檢察官分別於88年7月31日、88年11月17日，以88年度偵字第4615號、88年度毒偵字第375號為不起訴處分確定；又因施用第2級毒品案件，先送強制戒治（於92年1月10日戒治期滿），並由臺灣基隆地方法院檢察署檢察官聲請簡易判決處刑，經本院於90年12月3日判處有期徒刑4月，於91年1月7日確定，於92年1月6日執行完畢，有不起訴處分書、聲請簡易判決處刑書、判決書及被告全國前案紀錄表在卷可按。四、論罪及科刑之理由：（一）查安非他命係毒品危害防制條例第2條第2項第2款所定之第2級毒品。核被告甲○○所為，係犯毒品危害防制條例第10條第2項之施用第2級毒品罪。（二）查被告曾受前揭犯罪事實欄所載有期徒刑之執行完畢，有臺灣高等法院被告全國前案紀錄表在卷可稽，其受有期徒刑之執行完畢後，5年以內再犯本件有期徒刑以上之罪，為累犯，應加重其刑。（三）本院審酌毒品對於人體會產生成癮性，係足以危害個人健康及社會安全之管制藥物，被告經過執行觀察、勒戒，及強制戒治，猶不知戒除濫行施用毒品惡習，再犯本件施用毒品罪，深陷毒坑無法自拔，及其犯罪之自我麻醉動機、犯罪之手段、所生自我戕害結果及犯罪後坦承犯行之態度等一切情狀，量處如主文所示之刑，並諭知易科罰金之折算標準，以示懲儆。五、適用之法律依據：刑事訴訟法第273條之1第1項、第299條第1項前段，毒品危害防制條例第10條第2項，刑法第11條前段、第47條、第41條第1項前段，罰金罰鍰提高標準條例第2條。中華民國94年3月11日刑事第二庭法官齊潔以上正本證明與原本無異。對於本件判決如有不服，應於收受送達後10日內，向本院提出上訴書狀，上訴於臺灣高等法院，並按他造當事人之人數附具繕本。中華民國94年3月14日書記官莊國南附錄論罪法條：毒品危害防制條例第10條第2項：施用第2級毒品者，處3年以下有期徒刑。",
  "characters": {
    "judges": [
      "齊潔"
    ],
    "prosecutors": [

    ],
    "lawyers": [

    ],
    "clerks": [
      "莊國南"
    ],
    "plaintiffs": [

    ],
    "defendants": [
      "甲○○  男  31歲."
    ],
    "prosecutor_office": [
      "臺灣基隆地方法院檢察署檢察官"
    ],
    "creditors": [

    ],
    "debtors": [

    ],
    "judicial_associate_officer": [

    ]
  },
  "adjudged_at": "2005-03-11",
  "created_at": "2016-02-07 07:37:32",
  "updated_at": "2016-02-07 07:37:32"
}