{
  "identify": "TCD-100-交聲-1225-20110421-1",
  "court": {
    "name": "臺灣臺中地方法院",
    "code": "TCD"
  },
  "division": {
    "name": "刑事",
    "code": "M"
  },
  "year": 100,
  "word": "交聲",
  "number": "1225",
  "jcheck": "1",
  "reason": "聲明異議",
  "content": "臺灣臺中地方法院交通事件裁定       100年度交聲字第1225號\n原處分機關  交通部公路總局臺中區監理所臺中市監理站\n異  議  人  蕭荷原名：蕭淑雯.\n即受處分人\n上列異議人即受處分人因違反道路交通管理處罰條例案件，對於\n交通部公路總局臺中區監理所臺中市監理站民國95年4月24日所\n為之處分（裁監稽違字第裁61-F00000000號裁決書）聲明異議，\n本院裁定如下：\n    主    文\n異議駁回。\n    理    由\n一、按處理違反道路交通管理事件，有關文書送達之程序，依行\n    政程序法之規定；送達，於應受送達人之住居所、事務所或\n    營業所為之；於應送達處所不獲會晤應受送達人時，得將文\n    書付與有辨別事理能力之同居人、受僱人或應送達處所之接\n    收郵件人員。應受送達人或其同居人、受僱人、接收郵件人\n    員無正當理由拒絕收領文書時，得將文書留置於應送達處所\n    ，以為送達；又送達不能依前2條規定為之者，得將文書寄\n    存送達地之地方自治或警察機關，並作送達通知書2份，1\n    份黏貼於應受送達人住居所、事務所、營業所或其就業處所\n    門首，另1份交由鄰居轉交或置於該送達處所信箱或其他適\n    當位置，以為送達。前項情形，由郵政機關為送達者，得將\n    文書寄存於送達地之郵政機關。寄存機關自收受寄存文書之\n    日起，應保存3個月，違反道路交通管理事件統一裁罰基準\n    及處理細則第5條，行政程序法第72條第1項前段、第73條第\n    1項、第3項、第74條分別定有明文。準此，送達舉發違反道\n    路交通管理事件通知單，若依行政程序法第74條規定為寄存\n    送達者，於合法寄存送達時即發生送達效力。次按受處分人\n    不服道路交通管理處罰條例第8條主管機關所為之處罰，得\n    於接到裁決書之翌日起20日內，向管轄地方法院聲明異議，\n    同條例第87條第1項定有明文。又按依前開規定向管轄法院\n    聲明異議之期間，自裁決送達之翌日起算，並得依法扣除在\n    途期間及聲請回復原狀；法院認聲明異議不合法律上之程式\n    或其異議權已經喪失者，應以裁定駁回之，但其不合法律上\n    之程式可補正者，應先定期命為補正，逾期不補正者，即予\n    駁回，道路交通事件處理辦法第11、17條分別定有明文。\n二、經查，本件異議人即受處分人蕭荷（原名：蕭淑雯）（下稱\n    異議人）係對原處分機關於95年4月24日所為裁監稽違字第\n    裁61-F00000000號裁決書之處分聲明異議。惟查，受處分人\n    之戶籍地址，原在「臺中市北屯區○○○○街42號」，於95\n    年7月25日起設籍「臺中市○○區○○路三段10號（北屯區\n    戶政事務所）」，於95年9月12日起遷入「臺中市○區○○\n    街161號」，嗣於98年2月24日遷入「臺中市○○區○○路\n    409 之32號2樓」，再於99年8月13日遷入「臺中市○區○○\n    街161號」等情，有全戶戶籍基料（完整姓名）查詢結果及\n    遷徙紀錄資料查詢結果各1份在卷足憑。而本件裁決書經原\n    處分機關按異議人之送達當時戶籍地（即臺中市北屯區○○\n    ○○街42號）寄送，因未獲會晤異議人本人，亦無可代為收\n    受文書之同居人、受僱人及接收郵件人員，郵務人員乃於95\n    年4 月27日將上開裁決書寄存於臺中27支郵局，並作送達通\n    知書2份，1份黏貼於應受送達人住居所門首，另1份置於該\n    送達處所信箱或其他適當位置以為送達，而完成寄存送達程\n    序，此亦有送達證書影本1紙在卷可稽。至異議人雖主張未\n    實際居住於原設籍地，惟依道路交通安全規則第23條規定，\n    汽車所有人地址如有變更，應向公路監理機關辦理登記，本\n    件異議人遷離設籍地，並未主動向公路監理機關辦理住所變\n    更登記，亦無向戶籍機關辦理遷入新址，其事實上遷移至何\n    處居住，為原處分機關依一般通常方法所無從查悉，則原處\n    分機關仍向異議人當時設籍地之「臺中市北屯區○○○○街\n    42 號」為送達，核無違誤，異議人實際上是否居住於設籍\n    地，尚不影響本件裁決書合法送達之效力。揆諸首揭說明，\n    前開裁決書自寄存之日即生合法送達之效力。再者，本件異\n    議人之前開送達地址與處罰機關所在地乃在同一鄉、鎮、市\n    ，依法不扣除在途期間。準此，異議人倘對上開裁決書之處\n    分不服，依前揭規定，自應於裁決書合法送達之翌日起算20\n    日內，向原處分機關提出聲明異議狀，始為適法。茲異議人\n    遲至100年4月13日始向原處分機關遞狀聲明異議，有該聲明\n    異議狀上原處分機關收文章日期戳記可考，顯已逾20日之異\n    議期間，其聲明異議自屬違背法律上之程式，且無從補正，\n    為不合法，應予駁回。\n三、惟按行政機關為行政處分時，雖可於行政處分上同時預告不\n    履行之法律效果，然此僅係行政處分之「預告行為」，行為\n    人不履行時，行政機關仍須另為行政處分，始可發生該預告\n    之法律效果，不可以該預告行為，作為行政處分而發生預告\n    內容之法律效果。查本件裁決書除裁處異議人應於95年5月\n    24日前繳納罰鍰4,500元外，另於裁決主文第2項記載「逾期\n    不繳納者，自95年5月25日起加倍罰鍰為9,000元」等語，此\n    部分記載自屬行政處分之「預告行為」，依上開說明，尚不\n    可僅以該預告行為即認已發生預告內容之法律效果。且原處\n    分機關將異議人上開違反道路交通管理處罰條例違規應裁處\n    之罰鍰，與逾期未繳納而加倍罰鍰之法律效果一併告知，並\n    僅為1次合法送達，卻對異議人產生數個行政處分，無異讓\n    異議人喪失法律所規定救濟之權利，不但違反行政程序法第\n    96 條第1項第6款、第110條規定，行政處分應以書面為之，\n    載明應記載事項，並送達已知相對人及利害關係人，及違反\n    道路交通管理事件統一裁罰基準及處理細則第45條但書之規\n    定，處罰機關逕行裁決時，原處分機關應於裁決書載明應記\n    載事項，並送達異議人，而且與母法（道路交通管理處罰條\n    例）授權之目的未盡相符，亦與法律保留原則有違。因之，\n    原處分機關所為一次性裁決書之合法送達，應僅對異議人產\n    生罰鍰4,500元之行政處分效力，其餘均屬自始、當然、確\n    定無效之行政處分（臺灣高等法院臺中分院97年度交抗字第\n    157號、100年度交抗字第182號、99年度交抗字第1101號裁\n    定意旨參照），併此敘明。\n四、據上論斷，應依道路交通管理處罰條例第87條第2項、道路\n    交通事件處理辦法第17條，裁定如主文。\n中    華    民    國   100    年    4     月    21    日\n                   交通法庭  法  官  簡璽容\n上正本證明與原本無異。\n如不服本裁定，應於送達後5日內，向本院提出抗告狀。\n                             書記官  張雅如\n中    華    民    國   100    年    4     月    21    日",
  "structure": {
    "main": "異議駁回。",
    "reason": "一、按處理違反道路交通管理事件，有關文書送達之程序，依行\n    政程序法之規定；送達，於應受送達人之住居所、事務所或\n    營業所為之；於應送達處所不獲會晤應受送達人時，得將文\n    書付與有辨別事理能力之同居人、受僱人或應送達處所之接\n    收郵件人員。應受送達人或其同居人、受僱人、接收郵件人\n    員無正當理由拒絕收領文書時，得將文書留置於應送達處所\n    ，以為送達；又送達不能依前2條規定為之者，得將文書寄\n    存送達地之地方自治或警察機關，並作送達通知書2份，1\n    份黏貼於應受送達人住居所、事務所、營業所或其就業處所\n    門首，另1份交由鄰居轉交或置於該送達處所信箱或其他適\n    當位置，以為送達。前項情形，由郵政機關為送達者，得將\n    文書寄存於送達地之郵政機關。寄存機關自收受寄存文書之\n    日起，應保存3個月，違反道路交通管理事件統一裁罰基準\n    及處理細則第5條，行政程序法第72條第1項前段、第73條第\n    1項、第3項、第74條分別定有明文。準此，送達舉發違反道\n    路交通管理事件通知單，若依行政程序法第74條規定為寄存\n    送達者，於合法寄存送達時即發生送達效力。次按受處分人\n    不服道路交通管理處罰條例第8條主管機關所為之處罰，得\n    於接到裁決書之翌日起20日內，向管轄地方法院聲明異議，\n    同條例第87條第1項定有明文。又按依前開規定向管轄法院\n    聲明異議之期間，自裁決送達之翌日起算，並得依法扣除在\n    途期間及聲請回復原狀；法院認聲明異議不合法律上之程式\n    或其異議權已經喪失者，應以裁定駁回之，但其不合法律上\n    之程式可補正者，應先定期命為補正，逾期不補正者，即予\n    駁回，道路交通事件處理辦法第11、17條分別定有明文。\n二、經查，本件異議人即受處分人蕭荷（原名：蕭淑雯）（下稱\n    異議人）係對原處分機關於95年4月24日所為裁監稽違字第\n    裁61-F00000000號裁決書之處分聲明異議。惟查，受處分人\n    之戶籍地址，原在「臺中市北屯區○○○○街42號」，於95\n    年7月25日起設籍「臺中市○○區○○路三段10號（北屯區\n    戶政事務所）」，於95年9月12日起遷入「臺中市○區○○\n    街161號」，嗣於98年2月24日遷入「臺中市○○區○○路\n    409 之32號2樓」，再於99年8月13日遷入「臺中市○區○○\n    街161號」等情，有全戶戶籍基料（完整姓名）查詢結果及\n    遷徙紀錄資料查詢結果各1份在卷足憑。而本件裁決書經原\n    處分機關按異議人之送達當時戶籍地（即臺中市北屯區○○\n    ○○街42號）寄送，因未獲會晤異議人本人，亦無可代為收\n    受文書之同居人、受僱人及接收郵件人員，郵務人員乃於95\n    年4 月27日將上開裁決書寄存於臺中27支郵局，並作送達通\n    知書2份，1份黏貼於應受送達人住居所門首，另1份置於該\n    送達處所信箱或其他適當位置以為送達，而完成寄存送達程\n    序，此亦有送達證書影本1紙在卷可稽。至異議人雖主張未\n    實際居住於原設籍地，惟依道路交通安全規則第23條規定，\n    汽車所有人地址如有變更，應向公路監理機關辦理登記，本\n    件異議人遷離設籍地，並未主動向公路監理機關辦理住所變\n    更登記，亦無向戶籍機關辦理遷入新址，其事實上遷移至何\n    處居住，為原處分機關依一般通常方法所無從查悉，則原處\n    分機關仍向異議人當時設籍地之「臺中市北屯區○○○○街\n    42 號」為送達，核無違誤，異議人實際上是否居住於設籍\n    地，尚不影響本件裁決書合法送達之效力。揆諸首揭說明，\n    前開裁決書自寄存之日即生合法送達之效力。再者，本件異\n    議人之前開送達地址與處罰機關所在地乃在同一鄉、鎮、市\n    ，依法不扣除在途期間。準此，異議人倘對上開裁決書之處\n    分不服，依前揭規定，自應於裁決書合法送達之翌日起算20\n    日內，向原處分機關提出聲明異議狀，始為適法。茲異議人\n    遲至100年4月13日始向原處分機關遞狀聲明異議，有該聲明\n    異議狀上原處分機關收文章日期戳記可考，顯已逾20日之異\n    議期間，其聲明異議自屬違背法律上之程式，且無從補正，\n    為不合法，應予駁回。\n三、惟按行政機關為行政處分時，雖可於行政處分上同時預告不\n    履行之法律效果，然此僅係行政處分之「預告行為」，行為\n    人不履行時，行政機關仍須另為行政處分，始可發生該預告\n    之法律效果，不可以該預告行為，作為行政處分而發生預告\n    內容之法律效果。查本件裁決書除裁處異議人應於95年5月\n    24日前繳納罰鍰4,500元外，另於裁決主文第2項記載「逾期\n    不繳納者，自95年5月25日起加倍罰鍰為9,000元」等語，此\n    部分記載自屬行政處分之「預告行為」，依上開說明，尚不\n    可僅以該預告行為即認已發生預告內容之法律效果。且原處\n    分機關將異議人上開違反道路交通管理處罰條例違規應裁處\n    之罰鍰，與逾期未繳納而加倍罰鍰之法律效果一併告知，並\n    僅為1次合法送達，卻對異議人產生數個行政處分，無異讓\n    異議人喪失法律所規定救濟之權利，不但違反行政程序法第\n    96 條第1項第6款、第110條規定，行政處分應以書面為之，\n    載明應記載事項，並送達已知相對人及利害關係人，及違反\n    道路交通管理事件統一裁罰基準及處理細則第45條但書之規\n    定，處罰機關逕行裁決時，原處分機關應於裁決書載明應記\n    載事項，並送達異議人，而且與母法（道路交通管理處罰條\n    例）授權之目的未盡相符，亦與法律保留原則有違。因之，\n    原處分機關所為一次性裁決書之合法送達，應僅對異議人產\n    生罰鍰4,500元之行政處分效力，其餘均屬自始、當然、確\n    定無效之行政處分（臺灣高等法院臺中分院97年度交抗字第\n    157號、100年度交抗字第182號、99年度交抗字第1101號裁\n    定意旨參照），併此敘明。\n四、據上論斷，應依道路交通管理處罰條例第87條第2項、道路\n    交通事件處理辦法第17條，裁定如主文。"
  },
  "search": "臺灣臺中地方法院交通事件裁定100年度交聲字第1225號原處分機關交通部公路總局臺中區監理所臺中市監理站異議人蕭荷原名：蕭淑雯.即受處分人上列異議人即受處分人因違反道路交通管理處罰條例案件，對於交通部公路總局臺中區監理所臺中市監理站民國95年4月24日所為之處分（裁監稽違字第裁61-F00000000號裁決書）聲明異議，本院裁定如下：主文異議駁回。理由一、按處理違反道路交通管理事件，有關文書送達之程序，依行政程序法之規定；送達，於應受送達人之住居所、事務所或營業所為之；於應送達處所不獲會晤應受送達人時，得將文書付與有辨別事理能力之同居人、受僱人或應送達處所之接收郵件人員。應受送達人或其同居人、受僱人、接收郵件人員無正當理由拒絕收領文書時，得將文書留置於應送達處所，以為送達；又送達不能依前2條規定為之者，得將文書寄存送達地之地方自治或警察機關，並作送達通知書2份，1份黏貼於應受送達人住居所、事務所、營業所或其就業處所門首，另1份交由鄰居轉交或置於該送達處所信箱或其他適當位置，以為送達。前項情形，由郵政機關為送達者，得將文書寄存於送達地之郵政機關。寄存機關自收受寄存文書之日起，應保存3個月，違反道路交通管理事件統一裁罰基準及處理細則第5條，行政程序法第72條第1項前段、第73條第1項、第3項、第74條分別定有明文。準此，送達舉發違反道路交通管理事件通知單，若依行政程序法第74條規定為寄存送達者，於合法寄存送達時即發生送達效力。次按受處分人不服道路交通管理處罰條例第8條主管機關所為之處罰，得於接到裁決書之翌日起20日內，向管轄地方法院聲明異議，同條例第87條第1項定有明文。又按依前開規定向管轄法院聲明異議之期間，自裁決送達之翌日起算，並得依法扣除在途期間及聲請回復原狀；法院認聲明異議不合法律上之程式或其異議權已經喪失者，應以裁定駁回之，但其不合法律上之程式可補正者，應先定期命為補正，逾期不補正者，即予駁回，道路交通事件處理辦法第11、17條分別定有明文。二、經查，本件異議人即受處分人蕭荷（原名：蕭淑雯）（下稱異議人）係對原處分機關於95年4月24日所為裁監稽違字第裁61-F00000000號裁決書之處分聲明異議。惟查，受處分人之戶籍地址，原在「臺中市北屯區○○○○街42號」，於95年7月25日起設籍「臺中市○○區○○路三段10號（北屯區戶政事務所）」，於95年9月12日起遷入「臺中市○區○○街161號」，嗣於98年2月24日遷入「臺中市○○區○○路409之32號2樓」，再於99年8月13日遷入「臺中市○區○○街161號」等情，有全戶戶籍基料（完整姓名）查詢結果及遷徙紀錄資料查詢結果各1份在卷足憑。而本件裁決書經原處分機關按異議人之送達當時戶籍地（即臺中市北屯區○○○○街42號）寄送，因未獲會晤異議人本人，亦無可代為收受文書之同居人、受僱人及接收郵件人員，郵務人員乃於95年4月27日將上開裁決書寄存於臺中27支郵局，並作送達通知書2份，1份黏貼於應受送達人住居所門首，另1份置於該送達處所信箱或其他適當位置以為送達，而完成寄存送達程序，此亦有送達證書影本1紙在卷可稽。至異議人雖主張未實際居住於原設籍地，惟依道路交通安全規則第23條規定，汽車所有人地址如有變更，應向公路監理機關辦理登記，本件異議人遷離設籍地，並未主動向公路監理機關辦理住所變更登記，亦無向戶籍機關辦理遷入新址，其事實上遷移至何處居住，為原處分機關依一般通常方法所無從查悉，則原處分機關仍向異議人當時設籍地之「臺中市北屯區○○○○街42號」為送達，核無違誤，異議人實際上是否居住於設籍地，尚不影響本件裁決書合法送達之效力。揆諸首揭說明，前開裁決書自寄存之日即生合法送達之效力。再者，本件異議人之前開送達地址與處罰機關所在地乃在同一鄉、鎮、市，依法不扣除在途期間。準此，異議人倘對上開裁決書之處分不服，依前揭規定，自應於裁決書合法送達之翌日起算20日內，向原處分機關提出聲明異議狀，始為適法。茲異議人遲至100年4月13日始向原處分機關遞狀聲明異議，有該聲明異議狀上原處分機關收文章日期戳記可考，顯已逾20日之異議期間，其聲明異議自屬違背法律上之程式，且無從補正，為不合法，應予駁回。三、惟按行政機關為行政處分時，雖可於行政處分上同時預告不履行之法律效果，然此僅係行政處分之「預告行為」，行為人不履行時，行政機關仍須另為行政處分，始可發生該預告之法律效果，不可以該預告行為，作為行政處分而發生預告內容之法律效果。查本件裁決書除裁處異議人應於95年5月24日前繳納罰鍰4,500元外，另於裁決主文第2項記載「逾期不繳納者，自95年5月25日起加倍罰鍰為9,000元」等語，此部分記載自屬行政處分之「預告行為」，依上開說明，尚不可僅以該預告行為即認已發生預告內容之法律效果。且原處分機關將異議人上開違反道路交通管理處罰條例違規應裁處之罰鍰，與逾期未繳納而加倍罰鍰之法律效果一併告知，並僅為1次合法送達，卻對異議人產生數個行政處分，無異讓異議人喪失法律所規定救濟之權利，不但違反行政程序法第96條第1項第6款、第110條規定，行政處分應以書面為之，載明應記載事項，並送達已知相對人及利害關係人，及違反道路交通管理事件統一裁罰基準及處理細則第45條但書之規定，處罰機關逕行裁決時，原處分機關應於裁決書載明應記載事項，並送達異議人，而且與母法（道路交通管理處罰條例）授權之目的未盡相符，亦與法律保留原則有違。因之，原處分機關所為一次性裁決書之合法送達，應僅對異議人產生罰鍰4,500元之行政處分效力，其餘均屬自始、當然、確定無效之行政處分（臺灣高等法院臺中分院97年度交抗字第157號、100年度交抗字第182號、99年度交抗字第1101號裁定意旨參照），併此敘明。四、據上論斷，應依道路交通管理處罰條例第87條第2項、道路交通事件處理辦法第17條，裁定如主文。中華民國100年4月21日交通法庭法官簡璽容上正本證明與原本無異。如不服本裁定，應於送達後5日內，向本院提出抗告狀。書記官張雅如中華民國100年4月21日",
  "characters": {
    "judges": [
      "簡璽容"
    ],
    "prosecutors": [

    ],
    "lawyers": [

    ],
    "clerks": [
      "張雅如"
    ],
    "plaintiffs": [

    ],
    "defendants": [

    ],
    "prosecutor_office": [

    ],
    "creditors": [

    ],
    "debtors": [

    ],
    "judicial_associate_officer": [

    ]
  },
  "adjudged_at": "2011-04-21",
  "created_at": "2016-02-12 08:37:20",
  "updated_at": "2016-02-12 08:37:20"
}