{
  "identify": "KLD-100-監-37-20110602-1",
  "court": {
    "name": "臺灣基隆地方法院",
    "code": "KLD"
  },
  "division": {
    "name": "民事",
    "code": "V"
  },
  "year": 100,
  "word": "監",
  "number": "37",
  "jcheck": "1",
  "reason": "選定監護人",
  "content": "臺灣基隆地方法院民事裁定               100年度監字第37號\n聲  請  人  王鈺儒\n上列聲請人聲請為相對人王榮一選定監護人事件，本院裁定如下\n：\n    主  文\n聲請駁回。\n聲請程序費用新臺幣壹仟元由聲請人負擔。\n    理  由\n一、本件聲請意旨略以：聲請人王鈺儒為相對人王榮一（男，民\n    國○○年○月○○日生，身分證統一編號：Ｚ000000000 號）之子\n    ，惟相對人已於84年11月因發生重大車禍，造成重度及多障\n    不便，現已無法表達能力，致不能處理自己事務，且無民法\n    第1111條第1 項規定之人，無人能行使負擔對於相對人之權\n    利義務。相對人王榮一現在新北市○○區○○街298之1號托\n    育中心，為行使負擔對於相對人之權利義務，應置監護人，\n    爰依非訟事件法第139條之規定，請鈞院選定聲請人為相對\n    人王榮一之監護人等語。\n二、按「受監護宣告之人應置監護人。」「法院為監護之宣告時\n    ，應依職權就配偶、四親等內之親屬、最近一年有同居事實\n    之其他親屬、主管機關、社會福利機構或其他適當之人選定\n    一人或數人為監護人，並同時指定會同開具財產清冊之人。\n    」民法第1110條、第1111條第1項分別定有明文。是成年人\n    設置監護人，係以經法院為監護宣告為前提要件，成年人在\n    未經法院為監護之宣告前，即屬有行為能力之人，自無從予\n    以選任監護人。\n三、經查：聲請人之父即相對人王榮一未曾經法院為監護宣告（\n    或舊法所稱禁治產），有王榮一之戶籍謄本在卷可稽，而王\n    榮一係29年2月27日生，為滿20歲之成年人，其既未經法院\n    為監護之宣告，依前揭說明，無論其目前精神狀態為何，在\n    法律上仍屬有行為能力之人，本院自無從予以選任監護人，\n    是聲請人向本院聲請選定監護人，於法無據，應不准許。至\n    相對人王榮一若確有精神障礙或其他心智缺陷，致不能為意\n    思表示或受意思表示之情形，聲請人應依民法第14條第1項\n    之規定，向本院聲請對相對人王榮一為監護之宣告，法院若\n    認相對人確有應為監護宣告之情形，於裁定時即會依職權為\n    相對人選定監護人，併此敘明。\n四、依非訟事件法第21條第1項前段、第24條第1項，裁定如主文\n    。\n中    華    民    國   100    年    6     月    2     日\n                  家事法庭法  官  王美婷\n以上正本係照原本作成。\n如對本裁定抗告，須於裁定送達後10日之不變期間內，向本院提\n出抗告狀，並繳納抗告費新臺幣1,000元\n中    華    民    國   100    年    6     月    2     日\n                          書記官  明祖斌",
  "structure": {
    "main": "聲請駁回。\n聲請程序費用新臺幣壹仟元由聲請人負擔。",
    "reason": "一、本件聲請意旨略以：聲請人王鈺儒為相對人王榮一（男，民\n    國○○年○月○○日生，身分證統一編號：Ｚ000000000 號）之子\n    ，惟相對人已於84年11月因發生重大車禍，造成重度及多障\n    不便，現已無法表達能力，致不能處理自己事務，且無民法\n    第1111條第1 項規定之人，無人能行使負擔對於相對人之權\n    利義務。相對人王榮一現在新北市○○區○○街298之1號托\n    育中心，為行使負擔對於相對人之權利義務，應置監護人，\n    爰依非訟事件法第139條之規定，請鈞院選定聲請人為相對\n    人王榮一之監護人等語。\n二、按「受監護宣告之人應置監護人。」「法院為監護之宣告時\n    ，應依職權就配偶、四親等內之親屬、最近一年有同居事實\n    之其他親屬、主管機關、社會福利機構或其他適當之人選定\n    一人或數人為監護人，並同時指定會同開具財產清冊之人。\n    」民法第1110條、第1111條第1項分別定有明文。是成年人\n    設置監護人，係以經法院為監護宣告為前提要件，成年人在\n    未經法院為監護之宣告前，即屬有行為能力之人，自無從予\n    以選任監護人。\n三、經查：聲請人之父即相對人王榮一未曾經法院為監護宣告（\n    或舊法所稱禁治產），有王榮一之戶籍謄本在卷可稽，而王\n    榮一係29年2月27日生，為滿20歲之成年人，其既未經法院\n    為監護之宣告，依前揭說明，無論其目前精神狀態為何，在\n    法律上仍屬有行為能力之人，本院自無從予以選任監護人，\n    是聲請人向本院聲請選定監護人，於法無據，應不准許。至\n    相對人王榮一若確有精神障礙或其他心智缺陷，致不能為意\n    思表示或受意思表示之情形，聲請人應依民法第14條第1項\n    之規定，向本院聲請對相對人王榮一為監護之宣告，法院若\n    認相對人確有應為監護宣告之情形，於裁定時即會依職權為\n    相對人選定監護人，併此敘明。\n四、依非訟事件法第21條第1項前段、第24條第1項，裁定如主文\n    。"
  },
  "search": "臺灣基隆地方法院民事裁定100年度監字第37號聲請人王鈺儒上列聲請人聲請為相對人王榮一選定監護人事件，本院裁定如下：主文聲請駁回。聲請程序費用新臺幣壹仟元由聲請人負擔。理由一、本件聲請意旨略以：聲請人王鈺儒為相對人王榮一（男，民國○○年○月○○日生，身分證統一編號：Ｚ000000000號）之子，惟相對人已於84年11月因發生重大車禍，造成重度及多障不便，現已無法表達能力，致不能處理自己事務，且無民法第1111條第1項規定之人，無人能行使負擔對於相對人之權利義務。相對人王榮一現在新北市○○區○○街298之1號托育中心，為行使負擔對於相對人之權利義務，應置監護人，爰依非訟事件法第139條之規定，請鈞院選定聲請人為相對人王榮一之監護人等語。二、按「受監護宣告之人應置監護人。」「法院為監護之宣告時，應依職權就配偶、四親等內之親屬、最近一年有同居事實之其他親屬、主管機關、社會福利機構或其他適當之人選定一人或數人為監護人，並同時指定會同開具財產清冊之人。」民法第1110條、第1111條第1項分別定有明文。是成年人設置監護人，係以經法院為監護宣告為前提要件，成年人在未經法院為監護之宣告前，即屬有行為能力之人，自無從予以選任監護人。三、經查：聲請人之父即相對人王榮一未曾經法院為監護宣告（或舊法所稱禁治產），有王榮一之戶籍謄本在卷可稽，而王榮一係29年2月27日生，為滿20歲之成年人，其既未經法院為監護之宣告，依前揭說明，無論其目前精神狀態為何，在法律上仍屬有行為能力之人，本院自無從予以選任監護人，是聲請人向本院聲請選定監護人，於法無據，應不准許。至相對人王榮一若確有精神障礙或其他心智缺陷，致不能為意思表示或受意思表示之情形，聲請人應依民法第14條第1項之規定，向本院聲請對相對人王榮一為監護之宣告，法院若認相對人確有應為監護宣告之情形，於裁定時即會依職權為相對人選定監護人，併此敘明。四、依非訟事件法第21條第1項前段、第24條第1項，裁定如主文。中華民國100年6月2日家事法庭法官王美婷以上正本係照原本作成。如對本裁定抗告，須於裁定送達後10日之不變期間內，向本院提出抗告狀，並繳納抗告費新臺幣1,000元中華民國100年6月2日書記官明祖斌",
  "characters": {
    "judges": [
      "王美婷"
    ],
    "prosecutors": [

    ],
    "lawyers": [

    ],
    "clerks": [

    ],
    "plaintiffs": [

    ],
    "defendants": [

    ],
    "prosecutor_office": [
      "王鈺儒"
    ],
    "creditors": [

    ],
    "debtors": [

    ],
    "judicial_associate_officer": [

    ]
  },
  "adjudged_at": "2011-06-02",
  "created_at": "2016-02-13 15:35:45",
  "updated_at": "2016-02-13 15:35:45"
}