{
  "identify": "KSD-93-易-1132-20050608-1",
  "court": {
    "name": "臺灣高雄地方法院",
    "code": "KSD"
  },
  "division": {
    "name": "刑事",
    "code": "M"
  },
  "year": 93,
  "word": "易",
  "number": "1132",
  "jcheck": "1",
  "reason": "詐欺等",
  "content": "臺灣高雄地方法院刑事判決              93年度易字第1132號\n公  訴  人  臺灣高雄地方法院檢察署檢察官\n被      告  丙○○  男  51歲.\n上列被告因詐欺等案件，經檢察官提起公訴（93年度偵緝字第\n1175號、93年度偵字第12129 號、93年度偵字第13068 號、93年\n度偵字第13072 號），嗣因被告就被訴事實為有罪之陳述，經本\n院告知簡式審判程序意旨，並聽取公訴人及被告之意見後，本院\n合議庭裁定由受命法官獨任依簡式審判程序審理，判決如下：\n    主  文\n丙○○意圖為自己不法之所有，而侵占對於業務上所持有之物，\n處有期徒刑柒月；又意圖為自己不法之所有，而侵占遺失物，處\n罰金貳仟元，如易服勞役，以參佰元折算壹日；又意圖為自己不\n法之所有，以詐術使人將本人之物交付，處有期徒刑柒月。應執\n行有期徒刑壹年，罰金貳仟元，罰金部分，如易服勞役，以參佰\n元折算壹日。\n    事  實\n一、丙○○於民國92年4 月21日起受僱於高雄市○○區○○路\n    144 號「泰安房屋仲介公司」（下稱「泰安公司」），擔任\n    業務員一職，負責招攬客戶仲介房屋買賣及代向客戶收取斡\n    旋金之工作，為從事業務之人。其於同年8 月5 日，在「泰\n    安公司」，向客戶孫明富收取購買房屋之斡旋金新臺幣（下\n    同）100,000 元後，竟意圖為自己不法之所有，基於侵占業\n    務上所持有之物之犯意，將其業務上所持有之上開款項，變\n    易持有為所有之意，未將前揭款項繳回「泰安公司」而予以\n    侵占入己。嗣因「泰安公司」發現上開款項遲未入帳，始查\n    悉上情。\n二、再於92年9 月3 日在高雄市○○路某處，拾獲李雪芬所遺失\n    以李胡銀為發票人，以高新銀行建國分行為付款人，帳號\n    797 號、票號KS0000000 號、發票日92年9 月13日、面額\n    700,000 元之支票1 紙後，竟意圖為自己不法之所有，另行\n    萌生侵占遺失物之犯意，變易持有為所有之意，將上開支票\n    侵占入己，並於同年9 月初某日，在臺南市○○區○○路，\n    將上開支票交付不知情之其子黃博禹，央請代為提示付款，\n    嗣因黃博禹將前揭支票存入不知情之王靜琦於臺新銀行高雄\n    分行所開立帳號00000000000000號帳戶內，為警循線查獲。\n三、又意圖為自己不法之所有，於93年1 月間，在高雄縣梓官鄉\n    ○○路127 巷10號丁○○住處，向丁○○誆稱可代為參與坐\n    落高雄縣梓官鄉○○村○○路22號房屋拍賣之投標，丁○○\n    不疑有他，乃委託其代為參與投標，嗣於同年2 月17日，丙\n    ○○復在前揭丁○○住處，向丁○○誆稱是日將至法院參與\n    上開房屋拍賣之投標，惟需先向法院繳納保證金新臺幣（下\n    同）652,000 元，丁○○因而陷於錯誤，於同日11時許，偕\n    同其子溫國輝與丙○○一同前往高雄縣梓官鄉○○村○○路\n    306 號第一商業銀行梓本分行，由丁○○自其在該行所開立\n    帳號00000000000 號帳戶提領65,2000 元，並申請第一商業\n    銀行梓本分行以交付該行所簽發同面額支票之方式給付，第\n    一商業銀行梓本分行乃簽發以該行為發票人，票號EH000000\n    0 號之同面額支票1 紙，交予丙○○，丙○○取得丁○○交\n    付之上揭由第一商業銀行梓本分行簽發之支票後，旋將之存\n    入其在該分行所開立帳號00000000000 號帳戶內提示付款，\n    得手後，則於同日下午撥打電話向丁○○謊稱業已標得該房\n    屋。嗣因丁○○之子溫國輝於同年月23日前來本院辦理相關\n    手續，發現丁○○並未標得上開房屋，嗣央請本院人員查詢\n    後，始知丙○○並未代為參與投標，始知受騙。\n四、案經丁○○訴請及高雄縣政府警察局鳳山分局、高雄縣政府\n    警察局岡山分局報請臺灣高雄地方法院檢察署檢察官偵查起\n    訴。\n    理  由\n一、按除被告所犯為死刑、無期徒刑、最輕本刑為3 年以上有期\n    徒刑之罪或高等法院管轄第一審案件者外，於法院行準備程\n    序進行中，被告先就被訴事實為有罪之陳述時，審判長得告\n    知被告簡式審判程序之旨，並聽取當事人、代理人、辯護人\n    及輔佐人之意見後，裁定進行簡式審判程序；且受命法官行\n    準備程序，與法院或審判長有同一之權限；又簡式審判程序\n    之證據調查，不受刑事訴訟法第159 條第1 項、第161 條之\n    2 、第161 條之3 、第163 條之1 及第164 條至第170 條規\n    定之限制，刑事訴訟法第273 條之1 第1 項、第279 條第2\n    項前段、第273 條之2 分別定有明文。查被告丙○○上開所\n    為，均係犯死刑、無期徒刑、最輕本刑為3 年以上有期徒刑\n    以外之罪，其於準備程序中就前開被訴事實為有罪之陳述，\n    經受命法官告知簡式審判程序之旨，並聽取公訴人、被告之\n    意見後，本院認為適宜由受命法官獨任進行簡式審判程序，\n    依刑事訴訟法第273 條之1 第1 項規定，裁定由受命法官獨\n    任進行審判程序，合先敘明。\n二、訊據被告對於上揭事實欄一、二、三所載之事實供認不諱，\n    且被告關於前揭事實欄一所載事實之自白，核與證人即「泰\n    安公司」負責人乙○○於警詢及偵查中證述之情節相符（參\n    見警卷卷(二)第2 頁、偵查卷卷(五)之1 第10頁）；關於上開事\n    實欄二所載事實之自白，核與證人即被害人李雪芬於警詢及\n    本院審判中指訴之情節吻合（參見警卷卷(三)第1 頁、本院94\n    年5 月25日審判筆錄），並經證人王靜琦、黃博禹於警詢中\n    證述明確（參見警卷卷(三)第3 頁至第6 頁），復有臺新國際\n    商業銀行代收票據記錄憑條、支票正、反面、臺灣票據交換\n    所高雄市分所退票理由單等影本各1 份、遺失票據申報書2\n    份、掛失止付票據提示人資料查報表在卷可稽（參見警卷卷\n    (三)第8 頁至第13頁）；關於上揭事實欄三所載事實之自白，\n    核與證人溫國輝於警詢中證述之情節相符（參見警卷卷(一)第\n    1 頁、第2 頁），而上開房屋經本院查封後，於93年1 月12\n    日、2 月23日分別進行第1 次、第2 次拍賣，均無人應買，\n    於93年3 月22日進行第3 次拍賣，始有蔡相伯、戴鳳美、徐\n    惠萍3 人參與投標，並由蔡相伯出賣3,472,000 元得標，被\n    告始終未代理丁○○參與投標等情，亦經本院調取本院92年\n    度執字第42069 號案卷核閱無訛，復有第一商業銀行活期存\n    款存摺封面及內頁、存摺類存款取款憑條、本行支票申請書\n    代收入傳票、第一商業銀行梓本分行簽發之上開支票正、反\n    面影本各1 份在卷可按（參見偵查卷卷(一)第18頁至第22頁）\n    。足認被告上開自白，核與事實相符，堪予採信。本件事證\n    明確，被告犯行洵堪認定。\n三、核被告所為，係犯刑法第336 條第2 項之業務侵占罪、同法\n    第337 條之侵占遺失物罪（起訴書雖記載被告此部分行為，\n    涉犯同法第335 第1 項之普通侵占罪，惟公訴檢察官於本院\n    審判中業已更正為同法第337 條之侵占遺失物罪，本院自毋\n    庸變更起訴法條，併此敘明）及同法第339 條第1 項之詐欺\n    取財罪。被告所犯上開3 罪，犯意各別，行為互殊，應予分\n    論併罰。再起訴書雖記載被告乃於92年7 、8 月間，在高雄\n    市○○區○○路，受李雪芬委託代為購買房屋，李雪芬同時\n    並交付上開以李胡銀為發票人之支票1 紙，被告在取得該支\n    票後，意圖為自己不法之所有，以變易持有為所有之意思侵\n    占入己花用，惟公訴檢察官於本院審判中業將此部分起訴之\n    犯罪事實更正為如事實欄所載，本院自應依更正後起訴之犯\n    罪事實進行審理，另被告係於92年8 月5 日向客戶孫明富收\n    取上開斡旋金，起訴書誤載為92年8 月7 日，亦有未洽，併\n    此敘明。爰審酌不知循正當途徑謀生，竟冀圖不勞而獲，以\n    前述侵占及詐騙之方式牟利，又因貪念而於拾獲上述李雪芬\n    所遺失之支票後，將之侵占入己，惡性非輕，且侵占、詐欺\n    款項之金額及所侵占之上開支票面額不低，迄今仍未賠償被\n    害人所受之損害，惟念於犯罪後於本院審判中業已坦承犯行\n    ，態度良好等一切情狀，分別量處如主文所示之刑，並就有\n    期徒刑部分，定其應執行之刑，及就罰金部分，諭知易服勞\n    役之折算標準。\n據上論斷，應依刑事訴訟法第273 條之1 第1 項、第284 條之1\n、第299 條第1 項前段、刑法第336 條第2 項、第337 條、第\n339 條第1 項、第42條第2 項、第51條第5 款，罰金罰鍰提高標\n準條例第1 項前段、第2 項，判決如主文。\n本案經檢察官甲○○到庭執行職務。\n中    華    民    國    94    年    6     月    8     日\n                  刑事第十二庭  法  官  伍逸康\n右正本證明與原本無異。\n如不服本判決，應於判決送達後10日內，向本院提出上訴狀。\n（須附繕本）\n中    華    民    國    94    年    6     月    15    日\n                                書記官  蘇  豫\n附錄本案論罪科刑法條全文：\n中華民國刑法第336條\n對於公務上或因公益所持有之物，犯前條第1 項之罪者，處1 年\n以上7 年以下有期徒刑，得併科5,000 元以下罰金。\n對於業務上所持有之物，犯前條第1 項之罪者，處6 月以上5 年\n以下有期徒刑，得併科3,000元以下罰金。\n前二項之未遂犯罰之。\n中華民國刑法第337條\n意圖為自己或第三人不法之所有，而侵占遺失物、漂流物或其他\n離本人所持有之物者，處500 元以下罰金。\n中華民國刑法第339條\n意圖為自己或第三人不法之所有，以詐術使人將本人或第三人之\n物交付者，處5 年以下有期徒刑、拘役或科或併科1 千元以下罰\n金。\n以前項方法得財產上不法之利益或使第三人得之者，亦同。\n前二項之未遂犯罰之。\n",
  "structure": {
    "main": "丙○○意圖為自己不法之所有，而侵占對於業務上所持有之物，\n處有期徒刑柒月；又意圖為自己不法之所有，而侵占遺失物，處\n罰金貳仟元，如易服勞役，以參佰元折算壹日；又意圖為自己不\n法之所有，以詐術使人將本人之物交付，處有期徒刑柒月。應執\n行有期徒刑壹年，罰金貳仟元，罰金部分，如易服勞役，以參佰\n元折算壹日。",
    "fact": "一、丙○○於民國92年4 月21日起受僱於高雄市○○區○○路\n    144 號「泰安房屋仲介公司」（下稱「泰安公司」），擔任\n    業務員一職，負責招攬客戶仲介房屋買賣及代向客戶收取斡\n    旋金之工作，為從事業務之人。其於同年8 月5 日，在「泰\n    安公司」，向客戶孫明富收取購買房屋之斡旋金新臺幣（下\n    同）100,000 元後，竟意圖為自己不法之所有，基於侵占業\n    務上所持有之物之犯意，將其業務上所持有之上開款項，變\n    易持有為所有之意，未將前揭款項繳回「泰安公司」而予以\n    侵占入己。嗣因「泰安公司」發現上開款項遲未入帳，始查\n    悉上情。\n二、再於92年9 月3 日在高雄市○○路某處，拾獲李雪芬所遺失\n    以李胡銀為發票人，以高新銀行建國分行為付款人，帳號\n    797 號、票號KS0000000 號、發票日92年9 月13日、面額\n    700,000 元之支票1 紙後，竟意圖為自己不法之所有，另行\n    萌生侵占遺失物之犯意，變易持有為所有之意，將上開支票\n    侵占入己，並於同年9 月初某日，在臺南市○○區○○路，\n    將上開支票交付不知情之其子黃博禹，央請代為提示付款，\n    嗣因黃博禹將前揭支票存入不知情之王靜琦於臺新銀行高雄\n    分行所開立帳號00000000000000號帳戶內，為警循線查獲。\n三、又意圖為自己不法之所有，於93年1 月間，在高雄縣梓官鄉\n    ○○路127 巷10號丁○○住處，向丁○○誆稱可代為參與坐\n    落高雄縣梓官鄉○○村○○路22號房屋拍賣之投標，丁○○\n    不疑有他，乃委託其代為參與投標，嗣於同年2 月17日，丙\n    ○○復在前揭丁○○住處，向丁○○誆稱是日將至法院參與\n    上開房屋拍賣之投標，惟需先向法院繳納保證金新臺幣（下\n    同）652,000 元，丁○○因而陷於錯誤，於同日11時許，偕\n    同其子溫國輝與丙○○一同前往高雄縣梓官鄉○○村○○路\n    306 號第一商業銀行梓本分行，由丁○○自其在該行所開立\n    帳號00000000000 號帳戶提領65,2000 元，並申請第一商業\n    銀行梓本分行以交付該行所簽發同面額支票之方式給付，第\n    一商業銀行梓本分行乃簽發以該行為發票人，票號EH000000\n    0 號之同面額支票1 紙，交予丙○○，丙○○取得丁○○交\n    付之上揭由第一商業銀行梓本分行簽發之支票後，旋將之存\n    入其在該分行所開立帳號00000000000 號帳戶內提示付款，\n    得手後，則於同日下午撥打電話向丁○○謊稱業已標得該房\n    屋。嗣因丁○○之子溫國輝於同年月23日前來本院辦理相關\n    手續，發現丁○○並未標得上開房屋，嗣央請本院人員查詢\n    後，始知丙○○並未代為參與投標，始知受騙。\n四、案經丁○○訴請及高雄縣政府警察局鳳山分局、高雄縣政府\n    警察局岡山分局報請臺灣高雄地方法院檢察署檢察官偵查起\n    訴。",
    "reason": "一、按除被告所犯為死刑、無期徒刑、最輕本刑為3 年以上有期\n    徒刑之罪或高等法院管轄第一審案件者外，於法院行準備程\n    序進行中，被告先就被訴事實為有罪之陳述時，審判長得告\n    知被告簡式審判程序之旨，並聽取當事人、代理人、辯護人\n    及輔佐人之意見後，裁定進行簡式審判程序；且受命法官行\n    準備程序，與法院或審判長有同一之權限；又簡式審判程序\n    之證據調查，不受刑事訴訟法第159 條第1 項、第161 條之\n    2 、第161 條之3 、第163 條之1 及第164 條至第170 條規\n    定之限制，刑事訴訟法第273 條之1 第1 項、第279 條第2\n    項前段、第273 條之2 分別定有明文。查被告丙○○上開所\n    為，均係犯死刑、無期徒刑、最輕本刑為3 年以上有期徒刑\n    以外之罪，其於準備程序中就前開被訴事實為有罪之陳述，\n    經受命法官告知簡式審判程序之旨，並聽取公訴人、被告之\n    意見後，本院認為適宜由受命法官獨任進行簡式審判程序，\n    依刑事訴訟法第273 條之1 第1 項規定，裁定由受命法官獨\n    任進行審判程序，合先敘明。\n二、訊據被告對於上揭事實欄一、二、三所載之事實供認不諱，\n    且被告關於前揭事實欄一所載事實之自白，核與證人即「泰\n    安公司」負責人乙○○於警詢及偵查中證述之情節相符（參\n    見警卷卷(二)第2 頁、偵查卷卷(五)之1 第10頁）；關於上開事\n    實欄二所載事實之自白，核與證人即被害人李雪芬於警詢及\n    本院審判中指訴之情節吻合（參見警卷卷(三)第1 頁、本院94\n    年5 月25日審判筆錄），並經證人王靜琦、黃博禹於警詢中\n    證述明確（參見警卷卷(三)第3 頁至第6 頁），復有臺新國際\n    商業銀行代收票據記錄憑條、支票正、反面、臺灣票據交換\n    所高雄市分所退票理由單等影本各1 份、遺失票據申報書2\n    份、掛失止付票據提示人資料查報表在卷可稽（參見警卷卷\n    (三)第8 頁至第13頁）；關於上揭事實欄三所載事實之自白，\n    核與證人溫國輝於警詢中證述之情節相符（參見警卷卷(一)第\n    1 頁、第2 頁），而上開房屋經本院查封後，於93年1 月12\n    日、2 月23日分別進行第1 次、第2 次拍賣，均無人應買，\n    於93年3 月22日進行第3 次拍賣，始有蔡相伯、戴鳳美、徐\n    惠萍3 人參與投標，並由蔡相伯出賣3,472,000 元得標，被\n    告始終未代理丁○○參與投標等情，亦經本院調取本院92年\n    度執字第42069 號案卷核閱無訛，復有第一商業銀行活期存\n    款存摺封面及內頁、存摺類存款取款憑條、本行支票申請書\n    代收入傳票、第一商業銀行梓本分行簽發之上開支票正、反\n    面影本各1 份在卷可按（參見偵查卷卷(一)第18頁至第22頁）\n    。足認被告上開自白，核與事實相符，堪予採信。本件事證\n    明確，被告犯行洵堪認定。\n三、核被告所為，係犯刑法第336 條第2 項之業務侵占罪、同法\n    第337 條之侵占遺失物罪（起訴書雖記載被告此部分行為，\n    涉犯同法第335 第1 項之普通侵占罪，惟公訴檢察官於本院\n    審判中業已更正為同法第337 條之侵占遺失物罪，本院自毋\n    庸變更起訴法條，併此敘明）及同法第339 條第1 項之詐欺\n    取財罪。被告所犯上開3 罪，犯意各別，行為互殊，應予分\n    論併罰。再起訴書雖記載被告乃於92年7 、8 月間，在高雄\n    市○○區○○路，受李雪芬委託代為購買房屋，李雪芬同時\n    並交付上開以李胡銀為發票人之支票1 紙，被告在取得該支\n    票後，意圖為自己不法之所有，以變易持有為所有之意思侵\n    占入己花用，惟公訴檢察官於本院審判中業將此部分起訴之\n    犯罪事實更正為如事實欄所載，本院自應依更正後起訴之犯\n    罪事實進行審理，另被告係於92年8 月5 日向客戶孫明富收\n    取上開斡旋金，起訴書誤載為92年8 月7 日，亦有未洽，併\n    此敘明。爰審酌不知循正當途徑謀生，竟冀圖不勞而獲，以\n    前述侵占及詐騙之方式牟利，又因貪念而於拾獲上述李雪芬\n    所遺失之支票後，將之侵占入己，惡性非輕，且侵占、詐欺\n    款項之金額及所侵占之上開支票面額不低，迄今仍未賠償被\n    害人所受之損害，惟念於犯罪後於本院審判中業已坦承犯行\n    ，態度良好等一切情狀，分別量處如主文所示之刑，並就有\n    期徒刑部分，定其應執行之刑，及就罰金部分，諭知易服勞\n    役之折算標準。\n據上論斷，應依刑事訴訟法第273 條之1 第1 項、第284 條之1\n、第299 條第1 項前段、刑法第336 條第2 項、第337 條、第\n339 條第1 項、第42條第2 項、第51條第5 款，罰金罰鍰提高標\n準條例第1 項前段、第2 項，判決如主文。\n本案經檢察官甲○○到庭執行職務。\n中    華    民    國    94    年    6     月    8     日\n                  刑事第十二庭  法  官  伍逸康\n右正本證明與原本無異。\n如不服本判決，應於判決送達後10日內，向本院提出上訴狀。\n（須附繕本）"
  },
  "search": "臺灣高雄地方法院刑事判決93年度易字第1132號公訴人臺灣高雄地方法院檢察署檢察官被告丙○○男51歲.上列被告因詐欺等案件，經檢察官提起公訴（93年度偵緝字第1175號、93年度偵字第12129號、93年度偵字第13068號、93年度偵字第13072號），嗣因被告就被訴事實為有罪之陳述，經本院告知簡式審判程序意旨，並聽取公訴人及被告之意見後，本院合議庭裁定由受命法官獨任依簡式審判程序審理，判決如下：主文丙○○意圖為自己不法之所有，而侵占對於業務上所持有之物，處有期徒刑柒月；又意圖為自己不法之所有，而侵占遺失物，處罰金貳仟元，如易服勞役，以參佰元折算壹日；又意圖為自己不法之所有，以詐術使人將本人之物交付，處有期徒刑柒月。應執行有期徒刑壹年，罰金貳仟元，罰金部分，如易服勞役，以參佰元折算壹日。事實一、丙○○於民國92年4月21日起受僱於高雄市○○區○○路144號「泰安房屋仲介公司」（下稱「泰安公司」），擔任業務員一職，負責招攬客戶仲介房屋買賣及代向客戶收取斡旋金之工作，為從事業務之人。其於同年8月5日，在「泰安公司」，向客戶孫明富收取購買房屋之斡旋金新臺幣（下同）100,000元後，竟意圖為自己不法之所有，基於侵占業務上所持有之物之犯意，將其業務上所持有之上開款項，變易持有為所有之意，未將前揭款項繳回「泰安公司」而予以侵占入己。嗣因「泰安公司」發現上開款項遲未入帳，始查悉上情。二、再於92年9月3日在高雄市○○路某處，拾獲李雪芬所遺失以李胡銀為發票人，以高新銀行建國分行為付款人，帳號797號、票號KS0000000號、發票日92年9月13日、面額700,000元之支票1紙後，竟意圖為自己不法之所有，另行萌生侵占遺失物之犯意，變易持有為所有之意，將上開支票侵占入己，並於同年9月初某日，在臺南市○○區○○路，將上開支票交付不知情之其子黃博禹，央請代為提示付款，嗣因黃博禹將前揭支票存入不知情之王靜琦於臺新銀行高雄分行所開立帳號00000000000000號帳戶內，為警循線查獲。三、又意圖為自己不法之所有，於93年1月間，在高雄縣梓官鄉○○路127巷10號丁○○住處，向丁○○誆稱可代為參與坐落高雄縣梓官鄉○○村○○路22號房屋拍賣之投標，丁○○不疑有他，乃委託其代為參與投標，嗣於同年2月17日，丙○○復在前揭丁○○住處，向丁○○誆稱是日將至法院參與上開房屋拍賣之投標，惟需先向法院繳納保證金新臺幣（下同）652,000元，丁○○因而陷於錯誤，於同日11時許，偕同其子溫國輝與丙○○一同前往高雄縣梓官鄉○○村○○路306號第一商業銀行梓本分行，由丁○○自其在該行所開立帳號00000000000號帳戶提領65,2000元，並申請第一商業銀行梓本分行以交付該行所簽發同面額支票之方式給付，第一商業銀行梓本分行乃簽發以該行為發票人，票號EH0000000號之同面額支票1紙，交予丙○○，丙○○取得丁○○交付之上揭由第一商業銀行梓本分行簽發之支票後，旋將之存入其在該分行所開立帳號00000000000號帳戶內提示付款，得手後，則於同日下午撥打電話向丁○○謊稱業已標得該房屋。嗣因丁○○之子溫國輝於同年月23日前來本院辦理相關手續，發現丁○○並未標得上開房屋，嗣央請本院人員查詢後，始知丙○○並未代為參與投標，始知受騙。四、案經丁○○訴請及高雄縣政府警察局鳳山分局、高雄縣政府警察局岡山分局報請臺灣高雄地方法院檢察署檢察官偵查起訴。理由一、按除被告所犯為死刑、無期徒刑、最輕本刑為3年以上有期徒刑之罪或高等法院管轄第一審案件者外，於法院行準備程序進行中，被告先就被訴事實為有罪之陳述時，審判長得告知被告簡式審判程序之旨，並聽取當事人、代理人、辯護人及輔佐人之意見後，裁定進行簡式審判程序；且受命法官行準備程序，與法院或審判長有同一之權限；又簡式審判程序之證據調查，不受刑事訴訟法第159條第1項、第161條之2、第161條之3、第163條之1及第164條至第170條規定之限制，刑事訴訟法第273條之1第1項、第279條第2項前段、第273條之2分別定有明文。查被告丙○○上開所為，均係犯死刑、無期徒刑、最輕本刑為3年以上有期徒刑以外之罪，其於準備程序中就前開被訴事實為有罪之陳述，經受命法官告知簡式審判程序之旨，並聽取公訴人、被告之意見後，本院認為適宜由受命法官獨任進行簡式審判程序，依刑事訴訟法第273條之1第1項規定，裁定由受命法官獨任進行審判程序，合先敘明。二、訊據被告對於上揭事實欄一、二、三所載之事實供認不諱，且被告關於前揭事實欄一所載事實之自白，核與證人即「泰安公司」負責人乙○○於警詢及偵查中證述之情節相符（參見警卷卷(二)第2頁、偵查卷卷(五)之1第10頁）；關於上開事實欄二所載事實之自白，核與證人即被害人李雪芬於警詢及本院審判中指訴之情節吻合（參見警卷卷(三)第1頁、本院94年5月25日審判筆錄），並經證人王靜琦、黃博禹於警詢中證述明確（參見警卷卷(三)第3頁至第6頁），復有臺新國際商業銀行代收票據記錄憑條、支票正、反面、臺灣票據交換所高雄市分所退票理由單等影本各1份、遺失票據申報書2份、掛失止付票據提示人資料查報表在卷可稽（參見警卷卷(三)第8頁至第13頁）；關於上揭事實欄三所載事實之自白，核與證人溫國輝於警詢中證述之情節相符（參見警卷卷(一)第1頁、第2頁），而上開房屋經本院查封後，於93年1月12日、2月23日分別進行第1次、第2次拍賣，均無人應買，於93年3月22日進行第3次拍賣，始有蔡相伯、戴鳳美、徐惠萍3人參與投標，並由蔡相伯出賣3,472,000元得標，被告始終未代理丁○○參與投標等情，亦經本院調取本院92年度執字第42069號案卷核閱無訛，復有第一商業銀行活期存款存摺封面及內頁、存摺類存款取款憑條、本行支票申請書代收入傳票、第一商業銀行梓本分行簽發之上開支票正、反面影本各1份在卷可按（參見偵查卷卷(一)第18頁至第22頁）。足認被告上開自白，核與事實相符，堪予採信。本件事證明確，被告犯行洵堪認定。三、核被告所為，係犯刑法第336條第2項之業務侵占罪、同法第337條之侵占遺失物罪（起訴書雖記載被告此部分行為，涉犯同法第335第1項之普通侵占罪，惟公訴檢察官於本院審判中業已更正為同法第337條之侵占遺失物罪，本院自毋庸變更起訴法條，併此敘明）及同法第339條第1項之詐欺取財罪。被告所犯上開3罪，犯意各別，行為互殊，應予分論併罰。再起訴書雖記載被告乃於92年7、8月間，在高雄市○○區○○路，受李雪芬委託代為購買房屋，李雪芬同時並交付上開以李胡銀為發票人之支票1紙，被告在取得該支票後，意圖為自己不法之所有，以變易持有為所有之意思侵占入己花用，惟公訴檢察官於本院審判中業將此部分起訴之犯罪事實更正為如事實欄所載，本院自應依更正後起訴之犯罪事實進行審理，另被告係於92年8月5日向客戶孫明富收取上開斡旋金，起訴書誤載為92年8月7日，亦有未洽，併此敘明。爰審酌不知循正當途徑謀生，竟冀圖不勞而獲，以前述侵占及詐騙之方式牟利，又因貪念而於拾獲上述李雪芬所遺失之支票後，將之侵占入己，惡性非輕，且侵占、詐欺款項之金額及所侵占之上開支票面額不低，迄今仍未賠償被害人所受之損害，惟念於犯罪後於本院審判中業已坦承犯行，態度良好等一切情狀，分別量處如主文所示之刑，並就有期徒刑部分，定其應執行之刑，及就罰金部分，諭知易服勞役之折算標準。據上論斷，應依刑事訴訟法第273條之1第1項、第284條之1、第299條第1項前段、刑法第336條第2項、第337條、第339條第1項、第42條第2項、第51條第5款，罰金罰鍰提高標準條例第1項前段、第2項，判決如主文。本案經檢察官甲○○到庭執行職務。中華民國94年6月8日刑事第十二庭法官伍逸康右正本證明與原本無異。如不服本判決，應於判決送達後10日內，向本院提出上訴狀。（須附繕本）中華民國94年6月15日書記官蘇豫附錄本案論罪科刑法條全文：中華民國刑法第336條對於公務上或因公益所持有之物，犯前條第1項之罪者，處1年以上7年以下有期徒刑，得併科5,000元以下罰金。對於業務上所持有之物，犯前條第1項之罪者，處6月以上5年以下有期徒刑，得併科3,000元以下罰金。前二項之未遂犯罰之。中華民國刑法第337條意圖為自己或第三人不法之所有，而侵占遺失物、漂流物或其他離本人所持有之物者，處500元以下罰金。中華民國刑法第339條意圖為自己或第三人不法之所有，以詐術使人將本人或第三人之物交付者，處5年以下有期徒刑、拘役或科或併科1千元以下罰金。以前項方法得財產上不法之利益或使第三人得之者，亦同。前二項之未遂犯罰之。",
  "characters": {
    "judges": [
      "伍逸康"
    ],
    "prosecutors": [

    ],
    "lawyers": [

    ],
    "clerks": [
      "蘇豫"
    ],
    "plaintiffs": [

    ],
    "defendants": [
      "丙○○  男  51歲."
    ],
    "prosecutor_office": [
      "臺灣高雄地方法院檢察署檢察官"
    ],
    "creditors": [

    ],
    "debtors": [

    ],
    "judicial_associate_officer": [

    ]
  },
  "adjudged_at": "2005-06-08",
  "created_at": "2016-02-07 05:15:38",
  "updated_at": "2016-02-07 05:15:38"
}