{
  "identify": "SLD-100-聲-1872-20111021-1",
  "court": {
    "name": "臺灣士林地方法院",
    "code": "SLD"
  },
  "division": {
    "name": "刑事",
    "code": "M"
  },
  "year": 100,
  "word": "聲",
  "number": "1872",
  "jcheck": "1",
  "reason": "定應執行刑",
  "content": "臺灣士林地方法院刑事裁定             100年度聲字第1872號\n聲  請  人  臺灣士林地方法院檢察署檢察官\n受  刑  人  蘇勇名\n上列聲請人因受刑人數罪併罰有二裁判以上，聲請定其應執行之\n刑（100 年度執聲字第1117號），本院裁定如下：\n    主  文\n蘇勇名所犯如附表所示之罪，應執行有期徒刑壹年壹月，如易科\n罰金以銀元參佰元即新臺幣玖佰元折算壹日。\n    理  由\n一、聲請意旨略以：受刑人蘇勇名因犯商業會計法等案件，先後\n    經判決確定如附表，應依刑法第53條及第51條第5 款之規定\n    ，定其應執行刑，爰依刑事訴訟法第477 條第1 項聲請裁定\n    等語。\n二、按裁判確定前犯數罪者，併合處罰之；數罪併罰，分別宣告\n    其罪之刑，若宣告多數有期徒刑者，於各刑中之最長期以上\n    ，各刑合併之刑期以下，定其刑期；但不得逾30年；刑法第\n    50條、第51條第5 款分別定有明文。又數罪併罰，有2 裁判\n    以上者，依第51條之規定，定其應執行之刑，同法第53條亦\n    規定甚明。\n三、經查：受刑人蘇勇名因犯稅捐稽徵法、偽造文書、商業會計\n    法等案件，分別經臺灣臺北地方法院及本院先後判處如附表\n    所示之刑，並均經確定在案（附表編號1 至3 所示之罪，前\n    經臺灣臺北地方法院定應執行刑為有期徒刑10月），有各該\n    判決書及臺灣高等法院被告前案紀錄表各1 份附卷可參。茲\n    聲請人以本院為前開案件犯罪事實最後判決之法院，聲請定\n    其應執行之刑，經本院審核前開案卷無訛，認本件聲請為有\n    理由。\n四、另按被告犯應併合處罰之數罪，經法院以判決或裁定定其數\n    罪之應執行刑確定者，該數罪是否執行完畢，均係以所定之\n    應執行刑全部執行完畢為斷。其在定應執行刑之前已先執行\n    之有期徒刑之罪，因嗣後與他罪合併定應執行刑，而由檢察\n    官換發執行指揮書執行應執行刑，是其前已執行之有期徒刑\n    部分，僅應予扣除，該罪宣告之刑不能認為已執行完畢，最\n    高法院93年度台非字第298 號判決意旨可資參照。再按刑法\n    第2 條第1 項規定：「行為後法律有變更者，適用行為時之\n    法律。但行為後之法律有利於行為人者，適用最有利於行為\n    人之法律」。受刑人所犯如附表編號1 至3 之罪係於民國95\n    年7 月1 日刑法修正施行前所犯，而受刑人行為後，刑法第\n    51條第5 款之規定有所修正，經比較新舊法，以修正前之規\n    定定應執行刑之最高刑期限制為20年，對於受刑人較為有利\n    。其次，受刑人行為後，刑法第41條關於易科罰金折算標準\n    及數罪併罰逾6 個月得否易科罰金部分迭有修正，經比較新\n    舊法，仍以95年7 月1 日刑法修正施行前之易科罰金以銀元\n    300 元即新台幣900 元為折算標準、數罪併罰逾6 月仍得易\n    科罰金等規定，對受刑人較為有利，據此均依刑法第2 條第\n    1 項前段適用修正前之規定。\n五、又法律上屬於自由裁量之事項，有其外部性界限及內部性界\n    限，並非概無拘束。依據法律之具體規定，法院應在其範圍\n    選擇為適當之裁判者，為外部性界限；而法院為裁判時，應\n    考量法律之目的，及法律秩序之理念所在者，為內部性界限\n    。法院為裁判時，二者均不得有所踰越（參考最高法院80年\n    度臺非字第473 號判例意旨) 。在數罪併罰，有二裁判以上\n    ，定其應執行之刑時，固屬於法院自由裁量之事項，然仍應\n    受前揭外部性界限及內部性界限之拘束（最高法院93年度臺\n    非字第192 號裁判要旨參照）。查受刑人所犯如附表編號1\n    至3 所示之犯罪，曾經臺灣臺北地方法院以100 年度聲字第\n    1856號裁定定其應執行有期徒刑10月，如易科罰金以銀元30\n    0 元即新臺幣900 元折算1 日確定；另如附表所示編號4 、\n    5 所犯之罪，則經本院以100 年度審簡字第552 號判決應執\n    行有期徒刑4 月，如易科罰金以新臺幣1,000 元折算1 日確\n    定；有前揭裁定書、判決書及臺灣高等法院被告前案紀錄表\n    各1 份在卷可按；依上開說明，本院為最後事實審法院，就\n    附表所示案件再為定應執行刑之裁判時，自應受前開裁判所\n    為定應執行刑內部界限之拘束。又受刑人所犯如附表編號1\n    、2 所示之罪，雖於100 年9 月14日易科罰金執行完畢，惟\n    尚未與附表編號3 至5 所示之罪所處之刑，合併定其應執行\n    刑，茲檢察官聲請定其應執行之刑，本院審核後認為應定其\n    應執行之刑，並依95年7 月1 日修正施行前之刑法第41條第\n    1 項前段、第2 項規定諭知易科罰金之折算標準。\n六、依刑事訴訟法第477 條第1 項、刑法第2 條第1 項前段、第\n    53條、95年7 月1 日修正施行前刑法第51條第5 款、第41條\n    第1 項前段、第2 項、廢止前罰金罰鍰提高標準條例第2 條\n    ，現行法規所定貨幣單位折算新台幣條例第2 條，裁定如主\n    文。\n中    華    民    國   100    年    10    月    21    日\n                  刑事第六庭法  官  邱光吾\n以上正本證明與原本無異。\n如不服本裁定應於送達後5日內向本院提出抗告狀。\n                            書記官  劉致芬\n中    華    民    國   100    年    10    月    25    日",
  "structure": {
    "main": "蘇勇名所犯如附表所示之罪，應執行有期徒刑壹年壹月，如易科\n罰金以銀元參佰元即新臺幣玖佰元折算壹日。",
    "reason": "一、聲請意旨略以：受刑人蘇勇名因犯商業會計法等案件，先後\n    經判決確定如附表，應依刑法第53條及第51條第5 款之規定\n    ，定其應執行刑，爰依刑事訴訟法第477 條第1 項聲請裁定\n    等語。\n二、按裁判確定前犯數罪者，併合處罰之；數罪併罰，分別宣告\n    其罪之刑，若宣告多數有期徒刑者，於各刑中之最長期以上\n    ，各刑合併之刑期以下，定其刑期；但不得逾30年；刑法第\n    50條、第51條第5 款分別定有明文。又數罪併罰，有2 裁判\n    以上者，依第51條之規定，定其應執行之刑，同法第53條亦\n    規定甚明。\n三、經查：受刑人蘇勇名因犯稅捐稽徵法、偽造文書、商業會計\n    法等案件，分別經臺灣臺北地方法院及本院先後判處如附表\n    所示之刑，並均經確定在案（附表編號1 至3 所示之罪，前\n    經臺灣臺北地方法院定應執行刑為有期徒刑10月），有各該\n    判決書及臺灣高等法院被告前案紀錄表各1 份附卷可參。茲\n    聲請人以本院為前開案件犯罪事實最後判決之法院，聲請定\n    其應執行之刑，經本院審核前開案卷無訛，認本件聲請為有\n    理由。\n四、另按被告犯應併合處罰之數罪，經法院以判決或裁定定其數\n    罪之應執行刑確定者，該數罪是否執行完畢，均係以所定之\n    應執行刑全部執行完畢為斷。其在定應執行刑之前已先執行\n    之有期徒刑之罪，因嗣後與他罪合併定應執行刑，而由檢察\n    官換發執行指揮書執行應執行刑，是其前已執行之有期徒刑\n    部分，僅應予扣除，該罪宣告之刑不能認為已執行完畢，最\n    高法院93年度台非字第298 號判決意旨可資參照。再按刑法\n    第2 條第1 項規定：「行為後法律有變更者，適用行為時之\n    法律。但行為後之法律有利於行為人者，適用最有利於行為\n    人之法律」。受刑人所犯如附表編號1 至3 之罪係於民國95\n    年7 月1 日刑法修正施行前所犯，而受刑人行為後，刑法第\n    51條第5 款之規定有所修正，經比較新舊法，以修正前之規\n    定定應執行刑之最高刑期限制為20年，對於受刑人較為有利\n    。其次，受刑人行為後，刑法第41條關於易科罰金折算標準\n    及數罪併罰逾6 個月得否易科罰金部分迭有修正，經比較新\n    舊法，仍以95年7 月1 日刑法修正施行前之易科罰金以銀元\n    300 元即新台幣900 元為折算標準、數罪併罰逾6 月仍得易\n    科罰金等規定，對受刑人較為有利，據此均依刑法第2 條第\n    1 項前段適用修正前之規定。\n五、又法律上屬於自由裁量之事項，有其外部性界限及內部性界\n    限，並非概無拘束。依據法律之具體規定，法院應在其範圍\n    選擇為適當之裁判者，為外部性界限；而法院為裁判時，應\n    考量法律之目的，及法律秩序之理念所在者，為內部性界限\n    。法院為裁判時，二者均不得有所踰越（參考最高法院80年\n    度臺非字第473 號判例意旨) 。在數罪併罰，有二裁判以上\n    ，定其應執行之刑時，固屬於法院自由裁量之事項，然仍應\n    受前揭外部性界限及內部性界限之拘束（最高法院93年度臺\n    非字第192 號裁判要旨參照）。查受刑人所犯如附表編號1\n    至3 所示之犯罪，曾經臺灣臺北地方法院以100 年度聲字第\n    1856號裁定定其應執行有期徒刑10月，如易科罰金以銀元30\n    0 元即新臺幣900 元折算1 日確定；另如附表所示編號4 、\n    5 所犯之罪，則經本院以100 年度審簡字第552 號判決應執\n    行有期徒刑4 月，如易科罰金以新臺幣1,000 元折算1 日確\n    定；有前揭裁定書、判決書及臺灣高等法院被告前案紀錄表\n    各1 份在卷可按；依上開說明，本院為最後事實審法院，就\n    附表所示案件再為定應執行刑之裁判時，自應受前開裁判所\n    為定應執行刑內部界限之拘束。又受刑人所犯如附表編號1\n    、2 所示之罪，雖於100 年9 月14日易科罰金執行完畢，惟\n    尚未與附表編號3 至5 所示之罪所處之刑，合併定其應執行\n    刑，茲檢察官聲請定其應執行之刑，本院審核後認為應定其\n    應執行之刑，並依95年7 月1 日修正施行前之刑法第41條第\n    1 項前段、第2 項規定諭知易科罰金之折算標準。\n六、依刑事訴訟法第477 條第1 項、刑法第2 條第1 項前段、第\n    53條、95年7 月1 日修正施行前刑法第51條第5 款、第41條\n    第1 項前段、第2 項、廢止前罰金罰鍰提高標準條例第2 條\n    ，現行法規所定貨幣單位折算新台幣條例第2 條，裁定如主\n    文。"
  },
  "search": "臺灣士林地方法院刑事裁定100年度聲字第1872號聲請人臺灣士林地方法院檢察署檢察官受刑人蘇勇名上列聲請人因受刑人數罪併罰有二裁判以上，聲請定其應執行之刑（100年度執聲字第1117號），本院裁定如下：主文蘇勇名所犯如附表所示之罪，應執行有期徒刑壹年壹月，如易科罰金以銀元參佰元即新臺幣玖佰元折算壹日。理由一、聲請意旨略以：受刑人蘇勇名因犯商業會計法等案件，先後經判決確定如附表，應依刑法第53條及第51條第5款之規定，定其應執行刑，爰依刑事訴訟法第477條第1項聲請裁定等語。二、按裁判確定前犯數罪者，併合處罰之；數罪併罰，分別宣告其罪之刑，若宣告多數有期徒刑者，於各刑中之最長期以上，各刑合併之刑期以下，定其刑期；但不得逾30年；刑法第50條、第51條第5款分別定有明文。又數罪併罰，有2裁判以上者，依第51條之規定，定其應執行之刑，同法第53條亦規定甚明。三、經查：受刑人蘇勇名因犯稅捐稽徵法、偽造文書、商業會計法等案件，分別經臺灣臺北地方法院及本院先後判處如附表所示之刑，並均經確定在案（附表編號1至3所示之罪，前經臺灣臺北地方法院定應執行刑為有期徒刑10月），有各該判決書及臺灣高等法院被告前案紀錄表各1份附卷可參。茲聲請人以本院為前開案件犯罪事實最後判決之法院，聲請定其應執行之刑，經本院審核前開案卷無訛，認本件聲請為有理由。四、另按被告犯應併合處罰之數罪，經法院以判決或裁定定其數罪之應執行刑確定者，該數罪是否執行完畢，均係以所定之應執行刑全部執行完畢為斷。其在定應執行刑之前已先執行之有期徒刑之罪，因嗣後與他罪合併定應執行刑，而由檢察官換發執行指揮書執行應執行刑，是其前已執行之有期徒刑部分，僅應予扣除，該罪宣告之刑不能認為已執行完畢，最高法院93年度台非字第298號判決意旨可資參照。再按刑法第2條第1項規定：「行為後法律有變更者，適用行為時之法律。但行為後之法律有利於行為人者，適用最有利於行為人之法律」。受刑人所犯如附表編號1至3之罪係於民國95年7月1日刑法修正施行前所犯，而受刑人行為後，刑法第51條第5款之規定有所修正，經比較新舊法，以修正前之規定定應執行刑之最高刑期限制為20年，對於受刑人較為有利。其次，受刑人行為後，刑法第41條關於易科罰金折算標準及數罪併罰逾6個月得否易科罰金部分迭有修正，經比較新舊法，仍以95年7月1日刑法修正施行前之易科罰金以銀元300元即新台幣900元為折算標準、數罪併罰逾6月仍得易科罰金等規定，對受刑人較為有利，據此均依刑法第2條第1項前段適用修正前之規定。五、又法律上屬於自由裁量之事項，有其外部性界限及內部性界限，並非概無拘束。依據法律之具體規定，法院應在其範圍選擇為適當之裁判者，為外部性界限；而法院為裁判時，應考量法律之目的，及法律秩序之理念所在者，為內部性界限。法院為裁判時，二者均不得有所踰越（參考最高法院80年度臺非字第473號判例意旨)。在數罪併罰，有二裁判以上，定其應執行之刑時，固屬於法院自由裁量之事項，然仍應受前揭外部性界限及內部性界限之拘束（最高法院93年度臺非字第192號裁判要旨參照）。查受刑人所犯如附表編號1至3所示之犯罪，曾經臺灣臺北地方法院以100年度聲字第1856號裁定定其應執行有期徒刑10月，如易科罰金以銀元300元即新臺幣900元折算1日確定；另如附表所示編號4、5所犯之罪，則經本院以100年度審簡字第552號判決應執行有期徒刑4月，如易科罰金以新臺幣1,000元折算1日確定；有前揭裁定書、判決書及臺灣高等法院被告前案紀錄表各1份在卷可按；依上開說明，本院為最後事實審法院，就附表所示案件再為定應執行刑之裁判時，自應受前開裁判所為定應執行刑內部界限之拘束。又受刑人所犯如附表編號1、2所示之罪，雖於100年9月14日易科罰金執行完畢，惟尚未與附表編號3至5所示之罪所處之刑，合併定其應執行刑，茲檢察官聲請定其應執行之刑，本院審核後認為應定其應執行之刑，並依95年7月1日修正施行前之刑法第41條第1項前段、第2項規定諭知易科罰金之折算標準。六、依刑事訴訟法第477條第1項、刑法第2條第1項前段、第53條、95年7月1日修正施行前刑法第51條第5款、第41條第1項前段、第2項、廢止前罰金罰鍰提高標準條例第2條，現行法規所定貨幣單位折算新台幣條例第2條，裁定如主文。中華民國100年10月21日刑事第六庭法官邱光吾以上正本證明與原本無異。如不服本裁定應於送達後5日內向本院提出抗告狀。書記官劉致芬中華民國100年10月25日",
  "characters": {
    "judges": [
      "邱光吾"
    ],
    "prosecutors": [

    ],
    "lawyers": [

    ],
    "clerks": [
      "劉致芬"
    ],
    "plaintiffs": [

    ],
    "defendants": [

    ],
    "prosecutor_office": [
      "臺灣士林地方法院檢察署檢察官"
    ],
    "creditors": [

    ],
    "debtors": [

    ],
    "judicial_associate_officer": [

    ]
  },
  "adjudged_at": "2011-10-21",
  "created_at": "2016-02-14 07:55:02",
  "updated_at": "2016-02-14 07:55:02"
}