{
  "identify": "TPD-100-消債全-3-20111021-1",
  "court": {
    "name": "臺灣臺北地方法院",
    "code": "TPD"
  },
  "division": {
    "name": "民事",
    "code": "V"
  },
  "year": 100,
  "word": "消債全",
  "number": "3",
  "jcheck": "1",
  "reason": "聲請保全處分",
  "content": "臺灣臺北地方法院民事裁定            100年度消債全字第3號\n聲  請  人\n即  債務人  潘郁樺\n代  理  人  張金盛律師\n上列聲請人即債務人因聲請清算事件（100年度消債清字第31號\n），聲請保全處分，本院裁定如下：\n    主  文\n聲請駁回。\n    理  由\n一、按法院就清算之聲請為裁定前，得因利害關係人之聲請或依\n    職權，以裁定為停止債務人財產強制執行程序之保全處分，\n    消費者債務清理條例第19條第1項第3款固定有明文。惟上開\n    消費者債務清理條例第19條第3款規定，係基於維持債權人\n    間之公平受償，使債務人有重建更生之機會，以債權人為對\n    象，限制其聲請強制執行所為之保全（消費者債務清理條例\n    第19條立法說明參照）。是法院就更生之聲請為裁定前，自\n    應依債務人之財產狀況，就保全處分對債務人清算目的達成\n    之促進，及保全處分實施就相關利害關係所生影響，兼顧債\n    權人權益，避免債務人惡意利用保全處分，阻礙債權人行使\n    權利，或作為延期償付手段之可能性，綜合比較斟酌，決定\n    有無以裁定為保全處分之必要。\n二、聲請意旨略以：債務人因財務困難，陷於不能清償債務之情\n    形，業已提出清算聲請於本院審理中。因債務人之薪資有遭\n    強制執行之虞，為避免債權人透過強制執行程序，先獲清償\n    ，影響債權人間公平受償及債務人更生之機會，使清算程序\n    室礙難行，為此聲請裁定對於債務人之財產不得強制執行，\n    已執行者應停止強制執行。\n三、經查，依聲請人所列財產狀況，除薪資所得外，並無其他財\n    產，債權人應無從於強制執行程序外因行使債權而受償；且\n    縱債權人於清算聲請裁定前，循訴訟、非訟程序取得執行名\n    義，於付諸強制執行前，亦僅為債權存否及數額之確認，於\n    債權人之公平受償、債務人之重建更生，均不生影響。且查\n    聲請人目前並無已開始之強制執行程序，有本院民事執行處\n    索引卡查詢證明在卷可按，其執行內容、方法均屬未定，是\n    否已達影響日後清算程序進行之程度，即有未明，本無預為\n    保全之必要；況如前所述，本件聲請人財產僅有薪資所得，\n    以保全處分期間原則上不逾60日，至多120日之規定觀之（\n    消費者債務清理條例第19條第2項規定參照），強制執行程\n    序停止與否，於聲請人所陳報總額新臺幣1,327,776元債權\n    之公平受償，影響非高。綜酌以上各情，暨兼顧債權人權益\n    考量，本院認聲請人所為停止強制執行程序保全處分之聲請\n    ，尚無必要。\n四、從而，債務人聲請保全處分，於法即有未合，應予駁回，爰\n    裁定如主文。\n中    華    民    國  100    年    10    月    21    日\n              民事第二庭    法      官  陳慧萍\n上為正本係照原本作成。\n如不服本裁定，應於裁定送達後10日內，以書狀向本院提出抗告\n，並繳納抗告費新臺幣1,000元。\n中    華    民    國  100    年    10    月    21    日\n                            書  記  官  黃靖雅",
  "structure": {
    "main": "聲請駁回。",
    "reason": "一、按法院就清算之聲請為裁定前，得因利害關係人之聲請或依\n    職權，以裁定為停止債務人財產強制執行程序之保全處分，\n    消費者債務清理條例第19條第1項第3款固定有明文。惟上開\n    消費者債務清理條例第19條第3款規定，係基於維持債權人\n    間之公平受償，使債務人有重建更生之機會，以債權人為對\n    象，限制其聲請強制執行所為之保全（消費者債務清理條例\n    第19條立法說明參照）。是法院就更生之聲請為裁定前，自\n    應依債務人之財產狀況，就保全處分對債務人清算目的達成\n    之促進，及保全處分實施就相關利害關係所生影響，兼顧債\n    權人權益，避免債務人惡意利用保全處分，阻礙債權人行使\n    權利，或作為延期償付手段之可能性，綜合比較斟酌，決定\n    有無以裁定為保全處分之必要。\n二、聲請意旨略以：債務人因財務困難，陷於不能清償債務之情\n    形，業已提出清算聲請於本院審理中。因債務人之薪資有遭\n    強制執行之虞，為避免債權人透過強制執行程序，先獲清償\n    ，影響債權人間公平受償及債務人更生之機會，使清算程序\n    室礙難行，為此聲請裁定對於債務人之財產不得強制執行，\n    已執行者應停止強制執行。\n三、經查，依聲請人所列財產狀況，除薪資所得外，並無其他財\n    產，債權人應無從於強制執行程序外因行使債權而受償；且\n    縱債權人於清算聲請裁定前，循訴訟、非訟程序取得執行名\n    義，於付諸強制執行前，亦僅為債權存否及數額之確認，於\n    債權人之公平受償、債務人之重建更生，均不生影響。且查\n    聲請人目前並無已開始之強制執行程序，有本院民事執行處\n    索引卡查詢證明在卷可按，其執行內容、方法均屬未定，是\n    否已達影響日後清算程序進行之程度，即有未明，本無預為\n    保全之必要；況如前所述，本件聲請人財產僅有薪資所得，\n    以保全處分期間原則上不逾60日，至多120日之規定觀之（\n    消費者債務清理條例第19條第2項規定參照），強制執行程\n    序停止與否，於聲請人所陳報總額新臺幣1,327,776元債權\n    之公平受償，影響非高。綜酌以上各情，暨兼顧債權人權益\n    考量，本院認聲請人所為停止強制執行程序保全處分之聲請\n    ，尚無必要。\n四、從而，債務人聲請保全處分，於法即有未合，應予駁回，爰\n    裁定如主文。"
  },
  "search": "臺灣臺北地方法院民事裁定100年度消債全字第3號聲請人即債務人潘郁樺代理人張金盛律師上列聲請人即債務人因聲請清算事件（100年度消債清字第31號），聲請保全處分，本院裁定如下：主文聲請駁回。理由一、按法院就清算之聲請為裁定前，得因利害關係人之聲請或依職權，以裁定為停止債務人財產強制執行程序之保全處分，消費者債務清理條例第19條第1項第3款固定有明文。惟上開消費者債務清理條例第19條第3款規定，係基於維持債權人間之公平受償，使債務人有重建更生之機會，以債權人為對象，限制其聲請強制執行所為之保全（消費者債務清理條例第19條立法說明參照）。是法院就更生之聲請為裁定前，自應依債務人之財產狀況，就保全處分對債務人清算目的達成之促進，及保全處分實施就相關利害關係所生影響，兼顧債權人權益，避免債務人惡意利用保全處分，阻礙債權人行使權利，或作為延期償付手段之可能性，綜合比較斟酌，決定有無以裁定為保全處分之必要。二、聲請意旨略以：債務人因財務困難，陷於不能清償債務之情形，業已提出清算聲請於本院審理中。因債務人之薪資有遭強制執行之虞，為避免債權人透過強制執行程序，先獲清償，影響債權人間公平受償及債務人更生之機會，使清算程序室礙難行，為此聲請裁定對於債務人之財產不得強制執行，已執行者應停止強制執行。三、經查，依聲請人所列財產狀況，除薪資所得外，並無其他財產，債權人應無從於強制執行程序外因行使債權而受償；且縱債權人於清算聲請裁定前，循訴訟、非訟程序取得執行名義，於付諸強制執行前，亦僅為債權存否及數額之確認，於債權人之公平受償、債務人之重建更生，均不生影響。且查聲請人目前並無已開始之強制執行程序，有本院民事執行處索引卡查詢證明在卷可按，其執行內容、方法均屬未定，是否已達影響日後清算程序進行之程度，即有未明，本無預為保全之必要；況如前所述，本件聲請人財產僅有薪資所得，以保全處分期間原則上不逾60日，至多120日之規定觀之（消費者債務清理條例第19條第2項規定參照），強制執行程序停止與否，於聲請人所陳報總額新臺幣1,327,776元債權之公平受償，影響非高。綜酌以上各情，暨兼顧債權人權益考量，本院認聲請人所為停止強制執行程序保全處分之聲請，尚無必要。四、從而，債務人聲請保全處分，於法即有未合，應予駁回，爰裁定如主文。中華民國100年10月21日民事第二庭法官陳慧萍上為正本係照原本作成。如不服本裁定，應於裁定送達後10日內，以書狀向本院提出抗告，並繳納抗告費新臺幣1,000元。中華民國100年10月21日書記官黃靖雅",
  "characters": {
    "judges": [
      "陳慧萍"
    ],
    "prosecutors": [

    ],
    "lawyers": [
      "張金盛"
    ],
    "clerks": [

    ],
    "plaintiffs": [

    ],
    "defendants": [

    ],
    "prosecutor_office": [

    ],
    "creditors": [

    ],
    "debtors": [

    ],
    "judicial_associate_officer": [

    ]
  },
  "adjudged_at": "2011-10-21",
  "created_at": "2016-02-14 08:01:16",
  "updated_at": "2016-02-14 08:01:16"
}