{
  "identify": "ILD-100-易-787-20111229-1",
  "court": {
    "name": "臺灣宜蘭地方法院",
    "code": "ILD"
  },
  "division": {
    "name": "刑事",
    "code": "M"
  },
  "year": 100,
  "word": "易",
  "number": "787",
  "jcheck": "1",
  "reason": "賭博",
  "content": "臺灣宜蘭地方法院宣示判決筆錄          100年度易字第787號\n公  訴  人  臺灣宜蘭地方法院檢察署檢察官\n被      告  游浩蔡\n上列被告因犯賭博案件（臺灣宜蘭地方法院檢察署：100年度偵\n字第792號），於中華民國100年12月29日下午4時許，在本院第1\n法庭宣示判決，出席職員如下：\n法      官  鄭貽馨\n書  記  官  高雪琴\n通      譯  謝孟庭\n法官起立朗讀判決主文、犯罪事實要旨、處罰條文，及告以上訴\n限制、期間並提出上訴狀之法院，且諭知記載其內容：\n一、主  文：\n    游浩蔡犯圖利聚眾賭博罪，處有期徒刑參月，如易科罰金，\n    以新臺幣壹仟元折算壹日。扣案之帳冊壹本、抽頭金新臺幣\n    貳佰元、麻將壹副、搬風壹個及骰子參粒均沒收。\n二、犯罪事實要旨：\n    游浩蔡意圖營利，自民國100年1月初某日起至100年2月8日\n    晚間10時45分止，提供其向不知情之林坤德承租之宜蘭縣宜\n    蘭市○○路145號房屋（即美琪計程車行），為賭博場所，\n    每日聚集賭客，到該房屋後段之房間內，以麻將為賭具，以\n    新臺幣（下同）300元為底，每台50元，輪流作莊，每打1將\n    4圈，向每位賭客收取抽頭金100元之方式賭博財物。嗣警方\n    持搜索票於100年2月8日晚上10時45分許，在上開房間內查\n    獲，並扣得游浩蔡所有之帳冊1本、抽頭金200元、麻將1副\n    、搬風1個及骰子3粒。案經宜蘭縣政府警察局宜蘭分局報請\n    臺灣宜蘭地方法院檢察署檢察官偵查起訴。\n三、處罰條文：\n    刑法第268條、第55條、第41條第1項前段、第38條第1項第2\n    款，刑法施行法第1條之1第1項、第2項前段。\n四、協商判決除有刑事訴訟法第455條之4第1項第1款於本訊問程\n    序終結前，被告撤銷協商合意或檢察官撤回協商聲請者；第\n    2款被告協商之意思非出於自由意志者；第4款被告所犯之罪\n    非第455條之2第1項所定得以協商判決者；第6款被告有其他\n    較重之裁判上一罪之犯罪事實者；第7款法院認應諭知免刑\n    或免訴、不受理者情形之一，及違反同條第2項「法院應於\n    協商合意範圍內為判決；法院為協商判決所科之刑，以宣告\n    緩刑或2年以下有期徒刑、拘役或罰金為限」之規定者外，\n    不得上訴。\n五、如有前述得上訴情形而不服本件判決，得自收受判決送達之\n    日起10日內，向本院提出上訴書狀，上訴於第二審法院。\n中    華    民    國   100    年    12    月    29    日\n                  臺灣宜蘭地方法院刑事第四庭\n                      書記官  高雪琴\n                      法  官  鄭貽馨\n以上正本證明與原本無異。\n                      書記官  高雪琴\n中    華    民    國   100    年    12    月    29    日\n附錄本案論罪科刑法條全文：\n中華民國刑法第268條\n意圖營利，供給賭博場所或聚眾賭博者，處3年以下有期徒刑，\n得併科3千元以下罰金。",
  "structure": {
  },
  "search": "臺灣宜蘭地方法院宣示判決筆錄100年度易字第787號公訴人臺灣宜蘭地方法院檢察署檢察官被告游浩蔡上列被告因犯賭博案件（臺灣宜蘭地方法院檢察署：100年度偵字第792號），於中華民國100年12月29日下午4時許，在本院第1法庭宣示判決，出席職員如下：法官鄭貽馨書記官高雪琴通譯謝孟庭法官起立朗讀判決主文、犯罪事實要旨、處罰條文，及告以上訴限制、期間並提出上訴狀之法院，且諭知記載其內容：一、主文：游浩蔡犯圖利聚眾賭博罪，處有期徒刑參月，如易科罰金，以新臺幣壹仟元折算壹日。扣案之帳冊壹本、抽頭金新臺幣貳佰元、麻將壹副、搬風壹個及骰子參粒均沒收。二、犯罪事實要旨：游浩蔡意圖營利，自民國100年1月初某日起至100年2月8日晚間10時45分止，提供其向不知情之林坤德承租之宜蘭縣宜蘭市○○路145號房屋（即美琪計程車行），為賭博場所，每日聚集賭客，到該房屋後段之房間內，以麻將為賭具，以新臺幣（下同）300元為底，每台50元，輪流作莊，每打1將4圈，向每位賭客收取抽頭金100元之方式賭博財物。嗣警方持搜索票於100年2月8日晚上10時45分許，在上開房間內查獲，並扣得游浩蔡所有之帳冊1本、抽頭金200元、麻將1副、搬風1個及骰子3粒。案經宜蘭縣政府警察局宜蘭分局報請臺灣宜蘭地方法院檢察署檢察官偵查起訴。三、處罰條文：刑法第268條、第55條、第41條第1項前段、第38條第1項第2款，刑法施行法第1條之1第1項、第2項前段。四、協商判決除有刑事訴訟法第455條之4第1項第1款於本訊問程序終結前，被告撤銷協商合意或檢察官撤回協商聲請者；第2款被告協商之意思非出於自由意志者；第4款被告所犯之罪非第455條之2第1項所定得以協商判決者；第6款被告有其他較重之裁判上一罪之犯罪事實者；第7款法院認應諭知免刑或免訴、不受理者情形之一，及違反同條第2項「法院應於協商合意範圍內為判決；法院為協商判決所科之刑，以宣告緩刑或2年以下有期徒刑、拘役或罰金為限」之規定者外，不得上訴。五、如有前述得上訴情形而不服本件判決，得自收受判決送達之日起10日內，向本院提出上訴書狀，上訴於第二審法院。中華民國100年12月29日臺灣宜蘭地方法院刑事第四庭書記官高雪琴法官鄭貽馨以上正本證明與原本無異。書記官高雪琴中華民國100年12月29日附錄本案論罪科刑法條全文：中華民國刑法第268條意圖營利，供給賭博場所或聚眾賭博者，處3年以下有期徒刑，得併科3千元以下罰金。",
  "characters": {
    "judges": [
      "鄭貽馨",
      "鄭貽馨"
    ],
    "prosecutors": [

    ],
    "lawyers": [

    ],
    "clerks": [
      "高雪琴",
      "高雪琴"
    ],
    "plaintiffs": [

    ],
    "defendants": [
      "游浩蔡"
    ],
    "prosecutor_office": [
      "臺灣宜蘭地方法院檢察署檢察官"
    ],
    "creditors": [

    ],
    "debtors": [

    ],
    "judicial_associate_officer": [

    ]
  },
  "adjudged_at": "2011-12-29",
  "created_at": "2016-02-13 13:52:30",
  "updated_at": "2016-02-13 13:52:30"
}