{
  "identify": "ULD-100-訴-152-20110519-2",
  "court": {
    "name": "臺灣雲林地方法院",
    "code": "ULD"
  },
  "division": {
    "name": "民事",
    "code": "V"
  },
  "year": 100,
  "word": "訴",
  "number": "152",
  "jcheck": "2",
  "reason": "清償債務",
  "content": "臺灣雲林地方法院民事裁定              100年度訴字第152號\n原      告  永豐商業銀行股份有限公司\n法定代理人  邱正雄\n被      告  林清旺即林振義\n上列當事人間請求清償債務事件，本院裁定如下：\n    主  文\n原告之訴駁回。\n訴訟費用由原告負擔。\n    理  由\n一、按提起民事訴訟應依民事訴訟法第1編第3章第1節、第2節之\n    規定繳納裁判費，此為必須具備之程式。\n二、本件原告起訴僅據繳納部分裁判費，經本院於民國100 年05\n    月04日裁定命原告於03日內補正。該項裁定已於100 年05月\n    05 日送達原告，有送達證書附卷可憑。\n三、原告逾期迄未補正，其訴顯難認為合法，應予以駁回。\n四、依民事訴訟法第249 條第1 項第6 款、第95條、第78條，裁\n    定如主文。\n中    華    民    國   100    年    5     月    19    日\n                  民事第二庭    法  官  陳秋如\n以上正本係照原本作成\n如不服本裁定應於送達後10日內向本院提出抗告狀（需附繕本）\n，並應繳納抗告裁判費新臺幣1,000 元。\n中    華    民    國   100    年    5     月    19    日\n                                書記官  官佳慧",
  "structure": {
    "main": "原告之訴駁回。\n訴訟費用由原告負擔。",
    "reason": "一、按提起民事訴訟應依民事訴訟法第1編第3章第1節、第2節之\n    規定繳納裁判費，此為必須具備之程式。\n二、本件原告起訴僅據繳納部分裁判費，經本院於民國100 年05\n    月04日裁定命原告於03日內補正。該項裁定已於100 年05月\n    05 日送達原告，有送達證書附卷可憑。\n三、原告逾期迄未補正，其訴顯難認為合法，應予以駁回。\n四、依民事訴訟法第249 條第1 項第6 款、第95條、第78條，裁\n    定如主文。"
  },
  "search": "臺灣雲林地方法院民事裁定100年度訴字第152號原告永豐商業銀行股份有限公司法定代理人邱正雄被告林清旺即林振義上列當事人間請求清償債務事件，本院裁定如下：主文原告之訴駁回。訴訟費用由原告負擔。理由一、按提起民事訴訟應依民事訴訟法第1編第3章第1節、第2節之規定繳納裁判費，此為必須具備之程式。二、本件原告起訴僅據繳納部分裁判費，經本院於民國100年05月04日裁定命原告於03日內補正。該項裁定已於100年05月05日送達原告，有送達證書附卷可憑。三、原告逾期迄未補正，其訴顯難認為合法，應予以駁回。四、依民事訴訟法第249條第1項第6款、第95條、第78條，裁定如主文。中華民國100年5月19日民事第二庭法官陳秋如以上正本係照原本作成如不服本裁定應於送達後10日內向本院提出抗告狀（需附繕本），並應繳納抗告裁判費新臺幣1,000元。中華民國100年5月19日書記官官佳慧",
  "characters": {
    "judges": [
      "陳秋如"
    ],
    "prosecutors": [

    ],
    "lawyers": [

    ],
    "clerks": [

    ],
    "plaintiffs": [
      "永豐商業銀行股份有限公司"
    ],
    "defendants": [
      "林清旺即林振義"
    ],
    "prosecutor_office": [

    ],
    "creditors": [

    ],
    "debtors": [

    ],
    "judicial_associate_officer": [

    ]
  },
  "adjudged_at": "2011-05-19",
  "created_at": "2016-02-12 02:56:33",
  "updated_at": "2016-02-12 02:56:33"
}