{
  "identify": "TPH-100-抗-567-20110729-1",
  "court": {
    "name": "臺灣高等法院",
    "code": "TPH"
  },
  "division": {
    "name": "民事",
    "code": "V"
  },
  "year": 100,
  "word": "抗",
  "number": "567",
  "jcheck": "1",
  "reason": "聲明異議",
  "content": "臺灣高等法院民事裁定                  100年度抗字第567號\n抗  告  人  江澤木\n            林月雲\n前列二人共同\n代  理  人  黃福雄律師\n            周兆龍律師\n相  對  人  江花即江添彩之承.\n即  債權人\n            江澤堂即江添彩之.\n            江唐昭美即江添彩.\n            江文玲即江添彩之.\n            江文瑄即江添彩之.\n            江靜玉即江添彩之.\n            江柏志即江添彩之.\n            王派克即江添彩之.\n            王安妮即江添彩之.\n上列當事人間聲明異議事件，對於中華民國100年2月15日臺灣士\n林地方法院87年度執全字第1308號所為裁定提起抗告，本院裁定\n如下：\n    主  文\n抗告駁回。\n抗告訴訟費用由抗告人負擔。\n    理  由\n一、本件抗告人於原法院聲明異議及抗告意旨略以：債權人江添\n    彩（下稱江添彩，已死亡，由相對人繼承債權）於民國（下\n    同）87年間陸續以「債權人江添彩於80年9月間多次匯款至\n    江添彩在美國之帳戶約計美金120萬元以上，詎債務人江澤\n    木、林月雲侵占入已」之同一原因事實，分別向原法院、臺\n    灣臺北地方法院（下稱臺北地院）、臺灣宜蘭地方法院（下\n    稱宜蘭地院）聲請如原裁定附表各編號所示之假扣押裁定為\n    執行名義，並均為如原裁定附表所示之假扣押執行，執行如\n    原裁定附表各編號所示之執行標的，價值合計達新臺幣（以\n    下未標明幣別者皆同）4,330萬7,765元，實已違反超額查封\n    禁止之規定。又相對人就假扣押之原因事實，經本院88年度\n    重上字第265號判決伊等應給付之金額為美金22萬8,101元，\n    以聲請日之匯率1美元兌換30.824元計算，相當於703萬0,98\n    5元，是假扣押所擔保之債權範圍僅703萬0,985元及伊等應\n    負擔之費用（如執行程序費用5萬6,248元），與相對人查封\n    伊等前揭財產4,330萬7,765元顯差距過大，自不得就超出前\n    開假扣押所擔保之債權範圍外之財產為查封，爰請求就如原\n    裁定附表編號1所示之執行命令予以撤銷等語。\n二、按當事人或利害關係人對於執行法院強制執行之命令，或對\n    於執行法官、書記官、執達員實施強制執行之方法，強制執\n    行時應遵守之程序，或其他侵害利益之情事，得於強制執行\n    程序終結前，為聲請或聲明異議。強制執行法第12條定有明\n    文。次按查封不動產，以其價格足以清償強制執行之債權額\n    及債務人應負擔之費用為限，此觀強制執行法第 113條、第\n    50條規定自明。惟所謂「價格足以清償強制執行之債權額及\n    債務人應負擔之費用」，尚應以執行名義上所載債權額以為\n    認定，是本件相對人係以原法院87年度裁全字第1725號假扣\n    押裁定為執行名義聲請強制執行，其上所載得為假扣押之金\n    額為15萬元，即應就相對人本件聲請執行之標的是否有逾本\n    件執行名義之金額以定之。經查：\n  (一)相對人本件聲請執行之標的為宜蘭縣冬山鄉○○段205號地\n    號土地，僅單一標的，則就本件執行名義及執行標的以觀，\n    尚難認有超額執行可言。\n  (二)抗告人雖以相對人就同一原因事實，分別向原法院、臺北地\n    院、宜蘭地院聲請多筆假扣押裁定為執行名義，並假扣押執\n    行多筆執行標的，價值合計4,330萬7,765元，已違反超額查\n    封禁止之規定云云。惟是否超額執行，應於個別執行事件，\n    依個別執行名義以為論斷。同一債權重複取得不同執行名義\n    者，固非不得合併而為觀察，惟以一部請求形式取得不同多\n    數執行名義者（例如債權人就同一債權同時取得本票裁定及\n    確定判決），如係就單一債權不相重複之部分各自取得執行\n    名義，則查封不動產是否足以清償強制執行債權額，仍須就\n    各執行事件、本諸個別執行名義而為判斷。抗告人以原裁定\n    附表編號1至13所示各次一部請求執行名義均係同一債權，\n    合併觀察而認本件假扣押強制執行有超額查封之情，尚非可\n    採。從而，原裁定駁回抗告人之聲明異議，經核並無違誤。\n    抗告意旨指摘原裁定不當，聲明廢棄，為無理由，應予駁回\n    。\n據上論結，本件抗告為無理由，依強制執行法第30條之1，民事\n訴訟法第495條之1第1項、第449條第1項、第95條、第78條，裁\n定如主文。\n中    華    民    國    100    年    7    月    29    日\n                    民事第二十庭\n                        審判長法  官  張  蘭\n                              法  官  王漢章\n                              法  官  黃莉雲\n正本係照原本作成。\n不得抗告。\n中    華    民    國   100    年    7     月    29    日\n                              書記官  魏汝萍",
  "structure": {
    "main": "抗告駁回。\n抗告訴訟費用由抗告人負擔。",
    "reason": "一、本件抗告人於原法院聲明異議及抗告意旨略以：債權人江添\n    彩（下稱江添彩，已死亡，由相對人繼承債權）於民國（下\n    同）87年間陸續以「債權人江添彩於80年9月間多次匯款至\n    江添彩在美國之帳戶約計美金120萬元以上，詎債務人江澤\n    木、林月雲侵占入已」之同一原因事實，分別向原法院、臺\n    灣臺北地方法院（下稱臺北地院）、臺灣宜蘭地方法院（下\n    稱宜蘭地院）聲請如原裁定附表各編號所示之假扣押裁定為\n    執行名義，並均為如原裁定附表所示之假扣押執行，執行如\n    原裁定附表各編號所示之執行標的，價值合計達新臺幣（以\n    下未標明幣別者皆同）4,330萬7,765元，實已違反超額查封\n    禁止之規定。又相對人就假扣押之原因事實，經本院88年度\n    重上字第265號判決伊等應給付之金額為美金22萬8,101元，\n    以聲請日之匯率1美元兌換30.824元計算，相當於703萬0,98\n    5元，是假扣押所擔保之債權範圍僅703萬0,985元及伊等應\n    負擔之費用（如執行程序費用5萬6,248元），與相對人查封\n    伊等前揭財產4,330萬7,765元顯差距過大，自不得就超出前\n    開假扣押所擔保之債權範圍外之財產為查封，爰請求就如原\n    裁定附表編號1所示之執行命令予以撤銷等語。\n二、按當事人或利害關係人對於執行法院強制執行之命令，或對\n    於執行法官、書記官、執達員實施強制執行之方法，強制執\n    行時應遵守之程序，或其他侵害利益之情事，得於強制執行\n    程序終結前，為聲請或聲明異議。強制執行法第12條定有明\n    文。次按查封不動產，以其價格足以清償強制執行之債權額\n    及債務人應負擔之費用為限，此觀強制執行法第 113條、第\n    50條規定自明。惟所謂「價格足以清償強制執行之債權額及\n    債務人應負擔之費用」，尚應以執行名義上所載債權額以為\n    認定，是本件相對人係以原法院87年度裁全字第1725號假扣\n    押裁定為執行名義聲請強制執行，其上所載得為假扣押之金\n    額為15萬元，即應就相對人本件聲請執行之標的是否有逾本\n    件執行名義之金額以定之。經查：\n  (一)相對人本件聲請執行之標的為宜蘭縣冬山鄉○○段205號地\n    號土地，僅單一標的，則就本件執行名義及執行標的以觀，\n    尚難認有超額執行可言。\n  (二)抗告人雖以相對人就同一原因事實，分別向原法院、臺北地\n    院、宜蘭地院聲請多筆假扣押裁定為執行名義，並假扣押執\n    行多筆執行標的，價值合計4,330萬7,765元，已違反超額查\n    封禁止之規定云云。惟是否超額執行，應於個別執行事件，\n    依個別執行名義以為論斷。同一債權重複取得不同執行名義\n    者，固非不得合併而為觀察，惟以一部請求形式取得不同多\n    數執行名義者（例如債權人就同一債權同時取得本票裁定及\n    確定判決），如係就單一債權不相重複之部分各自取得執行\n    名義，則查封不動產是否足以清償強制執行債權額，仍須就\n    各執行事件、本諸個別執行名義而為判斷。抗告人以原裁定\n    附表編號1至13所示各次一部請求執行名義均係同一債權，\n    合併觀察而認本件假扣押強制執行有超額查封之情，尚非可\n    採。從而，原裁定駁回抗告人之聲明異議，經核並無違誤。\n    抗告意旨指摘原裁定不當，聲明廢棄，為無理由，應予駁回\n    。\n據上論結，本件抗告為無理由，依強制執行法第30條之1，民事\n訴訟法第495條之1第1項、第449條第1項、第95條、第78條，裁\n定如主文。"
  },
  "search": "臺灣高等法院民事裁定100年度抗字第567號抗告人江澤木林月雲前列二人共同代理人黃福雄律師周兆龍律師相對人江花即江添彩之承.即債權人江澤堂即江添彩之.江唐昭美即江添彩.江文玲即江添彩之.江文瑄即江添彩之.江靜玉即江添彩之.江柏志即江添彩之.王派克即江添彩之.王安妮即江添彩之.上列當事人間聲明異議事件，對於中華民國100年2月15日臺灣士林地方法院87年度執全字第1308號所為裁定提起抗告，本院裁定如下：主文抗告駁回。抗告訴訟費用由抗告人負擔。理由一、本件抗告人於原法院聲明異議及抗告意旨略以：債權人江添彩（下稱江添彩，已死亡，由相對人繼承債權）於民國（下同）87年間陸續以「債權人江添彩於80年9月間多次匯款至江添彩在美國之帳戶約計美金120萬元以上，詎債務人江澤木、林月雲侵占入已」之同一原因事實，分別向原法院、臺灣臺北地方法院（下稱臺北地院）、臺灣宜蘭地方法院（下稱宜蘭地院）聲請如原裁定附表各編號所示之假扣押裁定為執行名義，並均為如原裁定附表所示之假扣押執行，執行如原裁定附表各編號所示之執行標的，價值合計達新臺幣（以下未標明幣別者皆同）4,330萬7,765元，實已違反超額查封禁止之規定。又相對人就假扣押之原因事實，經本院88年度重上字第265號判決伊等應給付之金額為美金22萬8,101元，以聲請日之匯率1美元兌換30.824元計算，相當於703萬0,985元，是假扣押所擔保之債權範圍僅703萬0,985元及伊等應負擔之費用（如執行程序費用5萬6,248元），與相對人查封伊等前揭財產4,330萬7,765元顯差距過大，自不得就超出前開假扣押所擔保之債權範圍外之財產為查封，爰請求就如原裁定附表編號1所示之執行命令予以撤銷等語。二、按當事人或利害關係人對於執行法院強制執行之命令，或對於執行法官、書記官、執達員實施強制執行之方法，強制執行時應遵守之程序，或其他侵害利益之情事，得於強制執行程序終結前，為聲請或聲明異議。強制執行法第12條定有明文。次按查封不動產，以其價格足以清償強制執行之債權額及債務人應負擔之費用為限，此觀強制執行法第113條、第50條規定自明。惟所謂「價格足以清償強制執行之債權額及債務人應負擔之費用」，尚應以執行名義上所載債權額以為認定，是本件相對人係以原法院87年度裁全字第1725號假扣押裁定為執行名義聲請強制執行，其上所載得為假扣押之金額為15萬元，即應就相對人本件聲請執行之標的是否有逾本件執行名義之金額以定之。經查：(一)相對人本件聲請執行之標的為宜蘭縣冬山鄉○○段205號地號土地，僅單一標的，則就本件執行名義及執行標的以觀，尚難認有超額執行可言。(二)抗告人雖以相對人就同一原因事實，分別向原法院、臺北地院、宜蘭地院聲請多筆假扣押裁定為執行名義，並假扣押執行多筆執行標的，價值合計4,330萬7,765元，已違反超額查封禁止之規定云云。惟是否超額執行，應於個別執行事件，依個別執行名義以為論斷。同一債權重複取得不同執行名義者，固非不得合併而為觀察，惟以一部請求形式取得不同多數執行名義者（例如債權人就同一債權同時取得本票裁定及確定判決），如係就單一債權不相重複之部分各自取得執行名義，則查封不動產是否足以清償強制執行債權額，仍須就各執行事件、本諸個別執行名義而為判斷。抗告人以原裁定附表編號1至13所示各次一部請求執行名義均係同一債權，合併觀察而認本件假扣押強制執行有超額查封之情，尚非可採。從而，原裁定駁回抗告人之聲明異議，經核並無違誤。抗告意旨指摘原裁定不當，聲明廢棄，為無理由，應予駁回。據上論結，本件抗告為無理由，依強制執行法第30條之1，民事訴訟法第495條之1第1項、第449條第1項、第95條、第78條，裁定如主文。中華民國100年7月29日民事第二十庭審判長法官張蘭法官王漢章法官黃莉雲正本係照原本作成。不得抗告。中華民國100年7月29日書記官魏汝萍",
  "characters": {
    "judges": [
      "張蘭",
      "王漢章",
      "黃莉雲"
    ],
    "prosecutors": [

    ],
    "lawyers": [
      "黃福雄",
      "周兆龍"
    ],
    "clerks": [

    ],
    "plaintiffs": [

    ],
    "defendants": [

    ],
    "prosecutor_office": [

    ],
    "creditors": [

    ],
    "debtors": [

    ],
    "judicial_associate_officer": [

    ]
  },
  "adjudged_at": "2011-07-29",
  "created_at": "2016-02-14 02:04:04",
  "updated_at": "2016-02-14 02:04:04"
}