{
  "identify": "TPD-93-小上-176-20050113-1",
  "court": {
    "name": "臺灣臺北地方法院",
    "code": "TPD"
  },
  "division": {
    "name": "民事",
    "code": "V"
  },
  "year": 93,
  "word": "小上",
  "number": "176",
  "jcheck": "1",
  "reason": "給付管理費",
  "content": "臺灣臺北地方法院民事判決             93年度小上字第176號\n上  訴  人  甲○○\n被上訴人    大華儷園管理委會\n                      之二\n法定代理人  張婉貞\n上列當事人間請求給付管理費事件，上訴人對於中華民國93年9\n月13日臺灣臺北地方法院臺北簡易庭93年度北小字第21 75 號第\n一審判決提起上訴，本院裁定如下：\n    主  文\n上訴駁回。\n第二審訴訟費用新台幣壹仟伍佰元由上訴人負擔。\n    理  由\n一、按對於小額程序第一審裁判之上訴或抗告，非以其違背法令\n    為理由，不得為之，民事訴訟法第四百三十六條之二十四第\n    二項定有明文。依同法第四百三十六條之三十二第二項、四\n    百六十八條規定，判決不適用法規或適用不當者，為違背法\n    令；而判決有同法第四百六十九第一款至第五款情形之一者\n    ，為當然違背法令。是當事人提起上訴，如依民事訴訟法第\n    四百三十六條之二十五規定，以小額訴訟程序之第一審判決\n    有不適用法規或適用法規不當為理由時，其上訴狀或理由書\n    應有具體之指摘，並揭示該法規之條項或其內容；若係成文\n    法以外之法則，應揭示該法則之旨趣；倘為司法院解釋、或\n    本院之判例，則應揭示該判解之字號或其內容；如以民事訴\n    訟法第四百三十六條之三十二第二項、第四百六十九條第一\n    款至第五款所列情形為理由時，其上訴狀或理由書，應揭示\n    合於該條款之事實。上訴狀或理由書如未依此項方法表明，\n    或其所表明者，顯與上開法條規定之情形不相合時，即難認\n    為已對小額程序之第一審判決之違背法令有具體之指摘，其\n    上訴自難認為合法，即屬不應准許，應予駁回，參見最高法\n    院二十六年度鄂上字第二三六號判例意旨即明。\n二、本件上訴人上訴意旨略以：被上訴人儷園管委會新任主任委\n    員張婉貞，及其訴訟代理人蔡陵坡，未經法定程序通知利害\n    關係人召開區分所有權人會議，黑箱作業被判偽造文書在案\n    ，其資格不合法，應予撤銷。其二人侵權不法規約計有違反\n    公寓大廈管理條例第四條、第九條、第十五條、第二十六條\n    ，被上訴人乃以侵占他人財產之方式（按土地登記規則第七\n    十二條，共同使用部分之所有權附屬權利隨主建物移轉於同\n    一人），劃地收租強收買路費，而一樓之店家應自行成立商\n    場管理委員會，而認原審判決為幫助犯罪之延續，枉法裁判\n    云云，提起本件上訴。\n三、經查，原審審酌各項證據資料後，認被上訴人即大華儷園管\n    理委會業已合法成立，而上訴人以規約未合法通過即無庸繳\n    納本件管理費云云並無理由，而判令上訴人應給付被上訴人\n    管理費。而上訴人上訴狀所指摘事項，並未表明原判決所違\n    背之法令及具體內容，亦未表明依何訴訟資料可認為原判決\n    有違背法令之具體事實。其遽以提起本件上訴，諸前揭說明\n    ，難認合法，應予駁回。\n四、上訴人應負擔之訴訟費用額新台幣1,500 元。\n五、爰依依民事訴訟法第436 條之32第2 項、第436 條之19第1\n    項、第444 條第1 項、第95條、第78條裁定如主文。\n中    華    民    國    94    年    1     月    13    日\n                 刑事第四庭    審判長法  官   盧彥如\n                                     法  官   唐于智\n                                     法  官   洪遠亮\n以上正本係照原本作成\n不得上訴\n中    華    民    國    94    年    1     月    13    日\n                                     書記官  柯金珠\n",
  "structure": {
    "main": "上訴駁回。\n第二審訴訟費用新台幣壹仟伍佰元由上訴人負擔。",
    "reason": "一、按對於小額程序第一審裁判之上訴或抗告，非以其違背法令\n    為理由，不得為之，民事訴訟法第四百三十六條之二十四第\n    二項定有明文。依同法第四百三十六條之三十二第二項、四\n    百六十八條規定，判決不適用法規或適用不當者，為違背法\n    令；而判決有同法第四百六十九第一款至第五款情形之一者\n    ，為當然違背法令。是當事人提起上訴，如依民事訴訟法第\n    四百三十六條之二十五規定，以小額訴訟程序之第一審判決\n    有不適用法規或適用法規不當為理由時，其上訴狀或理由書\n    應有具體之指摘，並揭示該法規之條項或其內容；若係成文\n    法以外之法則，應揭示該法則之旨趣；倘為司法院解釋、或\n    本院之判例，則應揭示該判解之字號或其內容；如以民事訴\n    訟法第四百三十六條之三十二第二項、第四百六十九條第一\n    款至第五款所列情形為理由時，其上訴狀或理由書，應揭示\n    合於該條款之事實。上訴狀或理由書如未依此項方法表明，\n    或其所表明者，顯與上開法條規定之情形不相合時，即難認\n    為已對小額程序之第一審判決之違背法令有具體之指摘，其\n    上訴自難認為合法，即屬不應准許，應予駁回，參見最高法\n    院二十六年度鄂上字第二三六號判例意旨即明。\n二、本件上訴人上訴意旨略以：被上訴人儷園管委會新任主任委\n    員張婉貞，及其訴訟代理人蔡陵坡，未經法定程序通知利害\n    關係人召開區分所有權人會議，黑箱作業被判偽造文書在案\n    ，其資格不合法，應予撤銷。其二人侵權不法規約計有違反\n    公寓大廈管理條例第四條、第九條、第十五條、第二十六條\n    ，被上訴人乃以侵占他人財產之方式（按土地登記規則第七\n    十二條，共同使用部分之所有權附屬權利隨主建物移轉於同\n    一人），劃地收租強收買路費，而一樓之店家應自行成立商\n    場管理委員會，而認原審判決為幫助犯罪之延續，枉法裁判\n    云云，提起本件上訴。\n三、經查，原審審酌各項證據資料後，認被上訴人即大華儷園管\n    理委會業已合法成立，而上訴人以規約未合法通過即無庸繳\n    納本件管理費云云並無理由，而判令上訴人應給付被上訴人\n    管理費。而上訴人上訴狀所指摘事項，並未表明原判決所違\n    背之法令及具體內容，亦未表明依何訴訟資料可認為原判決\n    有違背法令之具體事實。其遽以提起本件上訴，諸前揭說明\n    ，難認合法，應予駁回。\n四、上訴人應負擔之訴訟費用額新台幣1,500 元。\n五、爰依依民事訴訟法第436 條之32第2 項、第436 條之19第1\n    項、第444 條第1 項、第95條、第78條裁定如主文。"
  },
  "search": "臺灣臺北地方法院民事判決93年度小上字第176號上訴人甲○○被上訴人大華儷園管理委會之二法定代理人張婉貞上列當事人間請求給付管理費事件，上訴人對於中華民國93年9月13日臺灣臺北地方法院臺北簡易庭93年度北小字第2175號第一審判決提起上訴，本院裁定如下：主文上訴駁回。第二審訴訟費用新台幣壹仟伍佰元由上訴人負擔。理由一、按對於小額程序第一審裁判之上訴或抗告，非以其違背法令為理由，不得為之，民事訴訟法第四百三十六條之二十四第二項定有明文。依同法第四百三十六條之三十二第二項、四百六十八條規定，判決不適用法規或適用不當者，為違背法令；而判決有同法第四百六十九第一款至第五款情形之一者，為當然違背法令。是當事人提起上訴，如依民事訴訟法第四百三十六條之二十五規定，以小額訴訟程序之第一審判決有不適用法規或適用法規不當為理由時，其上訴狀或理由書應有具體之指摘，並揭示該法規之條項或其內容；若係成文法以外之法則，應揭示該法則之旨趣；倘為司法院解釋、或本院之判例，則應揭示該判解之字號或其內容；如以民事訴訟法第四百三十六條之三十二第二項、第四百六十九條第一款至第五款所列情形為理由時，其上訴狀或理由書，應揭示合於該條款之事實。上訴狀或理由書如未依此項方法表明，或其所表明者，顯與上開法條規定之情形不相合時，即難認為已對小額程序之第一審判決之違背法令有具體之指摘，其上訴自難認為合法，即屬不應准許，應予駁回，參見最高法院二十六年度鄂上字第二三六號判例意旨即明。二、本件上訴人上訴意旨略以：被上訴人儷園管委會新任主任委員張婉貞，及其訴訟代理人蔡陵坡，未經法定程序通知利害關係人召開區分所有權人會議，黑箱作業被判偽造文書在案，其資格不合法，應予撤銷。其二人侵權不法規約計有違反公寓大廈管理條例第四條、第九條、第十五條、第二十六條，被上訴人乃以侵占他人財產之方式（按土地登記規則第七十二條，共同使用部分之所有權附屬權利隨主建物移轉於同一人），劃地收租強收買路費，而一樓之店家應自行成立商場管理委員會，而認原審判決為幫助犯罪之延續，枉法裁判云云，提起本件上訴。三、經查，原審審酌各項證據資料後，認被上訴人即大華儷園管理委會業已合法成立，而上訴人以規約未合法通過即無庸繳納本件管理費云云並無理由，而判令上訴人應給付被上訴人管理費。而上訴人上訴狀所指摘事項，並未表明原判決所違背之法令及具體內容，亦未表明依何訴訟資料可認為原判決有違背法令之具體事實。其遽以提起本件上訴，諸前揭說明，難認合法，應予駁回。四、上訴人應負擔之訴訟費用額新台幣1,500元。五、爰依依民事訴訟法第436條之32第2項、第436條之19第1項、第444條第1項、第95條、第78條裁定如主文。中華民國94年1月13日刑事第四庭審判長法官盧彥如法官唐于智法官洪遠亮以上正本係照原本作成不得上訴中華民國94年1月13日書記官柯金珠",
  "characters": {
    "judges": [
      "盧彥如",
      "唐于智",
      "洪遠亮"
    ],
    "prosecutors": [

    ],
    "lawyers": [

    ],
    "clerks": [
      "柯金珠"
    ],
    "plaintiffs": [

    ],
    "defendants": [

    ],
    "prosecutor_office": [

    ],
    "creditors": [

    ],
    "debtors": [

    ],
    "judicial_associate_officer": [

    ]
  },
  "adjudged_at": "2005-01-13",
  "created_at": "2016-02-07 01:15:06",
  "updated_at": "2016-02-07 01:15:06"
}