{
  "identify": "CYD-100-嘉簡-1506-20110926-1",
  "court": {
    "name": "臺灣嘉義地方法院",
    "code": "CYD"
  },
  "division": {
    "name": "刑事",
    "code": "M"
  },
  "year": 100,
  "word": "嘉簡",
  "number": "1506",
  "jcheck": "1",
  "reason": "竊盜等",
  "content": "臺灣嘉義地方法院刑事簡易判決       100年度嘉簡字第1506號\n公  訴  人  臺灣嘉義地方法院檢察署檢察官\n被      告  周盈志\n上列被告因竊盜等案件，經檢察官提起公訴（100年度偵字第540\n3號），本院裁定改依簡易程序審理，而為判決如下：\n    主  文\n周盈志犯侵入住宅竊盜罪，處有期徒刑陸月，如易科罰金，以新\n臺幣壹仟元折算壹日；又犯侵入住宅竊盜未遂罪，處有期徒刑參\n月，如易科罰金，以新臺幣壹仟元折算壹日；又犯侵入住宅罪，\n處有期徒刑貳月，如易科罰金，以新臺幣壹仟元折算壹日。應執\n行有期徒刑捌月，如易科罰金，以新臺幣壹仟元折算壹日。\n    犯 罪 事 實 及 理 由\n一、本件犯罪事實、證據及應適用之法條除下列補充外，均引用\n    起訴書之記載：\n（一）犯罪事實欄第5行所記載之「及同年月21日」、第6行所記\n      載之「2次」均刪除。\n（二）核被告周盈志所為，於民國100年7月7日係犯刑法第321條\n      第1項第1款之侵入住宅竊盜罪，於100年7月21日係犯同法\n      第321條第2項、第1項第1款之侵入住宅竊盜未遂罪，於10\n      0年7月17日係犯同法第306條第1項之侵入住宅罪。其上開\n      所犯侵入住宅竊盜既遂及未遂罪，均不再論以侵入住宅罪\n      ，是據起訴書之記載，認於100年7月21日應另論以侵入住\n      宅罪部分，尚有誤會，而此部分業據公訴檢察官當庭聲明\n      更正（見本院100年9月23日準備程序筆錄）。被告所犯上\n      開數罪犯意各別，行為互殊，應予分別論處，併合處罰。\n二、依刑事訴訟法第449條第2項、第454條第2項，刑法第321條\n    第2項、第1項第1款、第306條第1項、第41條第1項前段、第\n    8項、第51條第5款，刑法施行法第1條之1第1項、第2項前段\n    ，逕以簡易判決處刑如主文。\n三、如不服本件判決，得自收受送達之日起10日內，向本院提起\n    上訴。\n中    華    民    國   100    年    9     月    26    日\n                  嘉義簡易庭法  官  吳育霖\n上列正本證明與原本無異。\n如不服本判決，應於判決送達後10日內向本院提出上訴狀（應附\n繕本）。告訴人或被害人如對於本判決不服者，應具備理由請求\n檢察官上訴，其上訴期間之計算係以檢察官收受判決正本之日期\n為準。\n中    華    民    國   100    年    9     月    26    日\n                            書記官  陳俊男\n附錄本案論罪科刑法條：\n中華民國刑法第306條（侵入住居罪）\n無故侵入他人住宅、建築物或附連圍繞之土地或船艦者，處1年\n以下有期徒刑、拘役或3百元以下罰金。\n無故隱匿其內，或受退去之要求而仍留滯者，亦同。\n第321條（加重竊盜罪）\n犯竊盜罪而有下列情形之一者，處6月以上、5年以下有期徒刑，\n得併科新臺幣10萬元以下罰金：\n一、侵入住宅或有人居住之建築物、船艦或隱匿其內而犯之者。\n二、毀越門扇、牆垣或其他安全設備而犯之者。\n三、攜帶兇器而犯之者。\n四、結夥三人以上而犯之者。\n五、乘火災、水災或其他災害之際而犯之者。\n六、在車站、埠頭、航空站或其他供水、陸、空公眾運輸之舟、\n    車、航空機內而犯之者。\n前項之未遂犯罰之。",
  "structure": {
  },
  "search": "臺灣嘉義地方法院刑事簡易判決100年度嘉簡字第1506號公訴人臺灣嘉義地方法院檢察署檢察官被告周盈志上列被告因竊盜等案件，經檢察官提起公訴（100年度偵字第5403號），本院裁定改依簡易程序審理，而為判決如下：主文周盈志犯侵入住宅竊盜罪，處有期徒刑陸月，如易科罰金，以新臺幣壹仟元折算壹日；又犯侵入住宅竊盜未遂罪，處有期徒刑參月，如易科罰金，以新臺幣壹仟元折算壹日；又犯侵入住宅罪，處有期徒刑貳月，如易科罰金，以新臺幣壹仟元折算壹日。應執行有期徒刑捌月，如易科罰金，以新臺幣壹仟元折算壹日。犯罪事實及理由一、本件犯罪事實、證據及應適用之法條除下列補充外，均引用起訴書之記載：（一）犯罪事實欄第5行所記載之「及同年月21日」、第6行所記載之「2次」均刪除。（二）核被告周盈志所為，於民國100年7月7日係犯刑法第321條第1項第1款之侵入住宅竊盜罪，於100年7月21日係犯同法第321條第2項、第1項第1款之侵入住宅竊盜未遂罪，於100年7月17日係犯同法第306條第1項之侵入住宅罪。其上開所犯侵入住宅竊盜既遂及未遂罪，均不再論以侵入住宅罪，是據起訴書之記載，認於100年7月21日應另論以侵入住宅罪部分，尚有誤會，而此部分業據公訴檢察官當庭聲明更正（見本院100年9月23日準備程序筆錄）。被告所犯上開數罪犯意各別，行為互殊，應予分別論處，併合處罰。二、依刑事訴訟法第449條第2項、第454條第2項，刑法第321條第2項、第1項第1款、第306條第1項、第41條第1項前段、第8項、第51條第5款，刑法施行法第1條之1第1項、第2項前段，逕以簡易判決處刑如主文。三、如不服本件判決，得自收受送達之日起10日內，向本院提起上訴。中華民國100年9月26日嘉義簡易庭法官吳育霖上列正本證明與原本無異。如不服本判決，應於判決送達後10日內向本院提出上訴狀（應附繕本）。告訴人或被害人如對於本判決不服者，應具備理由請求檢察官上訴，其上訴期間之計算係以檢察官收受判決正本之日期為準。中華民國100年9月26日書記官陳俊男附錄本案論罪科刑法條：中華民國刑法第306條（侵入住居罪）無故侵入他人住宅、建築物或附連圍繞之土地或船艦者，處1年以下有期徒刑、拘役或3百元以下罰金。無故隱匿其內，或受退去之要求而仍留滯者，亦同。第321條（加重竊盜罪）犯竊盜罪而有下列情形之一者，處6月以上、5年以下有期徒刑，得併科新臺幣10萬元以下罰金：一、侵入住宅或有人居住之建築物、船艦或隱匿其內而犯之者。二、毀越門扇、牆垣或其他安全設備而犯之者。三、攜帶兇器而犯之者。四、結夥三人以上而犯之者。五、乘火災、水災或其他災害之際而犯之者。六、在車站、埠頭、航空站或其他供水、陸、空公眾運輸之舟、車、航空機內而犯之者。前項之未遂犯罰之。",
  "characters": {
    "judges": [
      "吳育霖"
    ],
    "prosecutors": [

    ],
    "lawyers": [

    ],
    "clerks": [
      "陳俊男"
    ],
    "plaintiffs": [

    ],
    "defendants": [
      "周盈志"
    ],
    "prosecutor_office": [
      "臺灣嘉義地方法院檢察署檢察官"
    ],
    "creditors": [

    ],
    "debtors": [

    ],
    "judicial_associate_officer": [

    ]
  },
  "adjudged_at": "2011-09-26",
  "created_at": "2016-02-12 12:39:27",
  "updated_at": "2016-02-12 12:39:27"
}