{
  "identify": "TPH-94-聲再-433-20051230-1",
  "court": {
    "name": "臺灣高等法院",
    "code": "TPH"
  },
  "division": {
    "name": "刑事",
    "code": "M"
  },
  "year": 94,
  "word": "聲再",
  "number": "433",
  "jcheck": "1",
  "reason": "強盜等",
  "content": "臺灣高等法院刑事裁定                 94年度聲再字第433號\n再審聲請人\n即受判決人  甲○○\n                    現於台灣台北監獄\n上列聲請人因強盜等案件，對於本院94年度上訴字第572號，中\n華民國94年10月19日第二審確定判決（92年度訴字第922號，起\n訴案號：檢察署91年度偵字第22107號），聲請再審，本院裁定\n如下：\n    主  文\n再審之聲請駁回。\n    理  由\n一、按刑事訴訟法第420條第6項規定：「因發見確實之新證據，\n    足認受有罪判決之人，應受無罪、免訴、免刑或輕於原判決\n    所認罪名之判決者」得聲請再審。\n二、聲請人聲請意旨略以：臺灣桃園地方法院92年度訴字第937\n    號及本院94年度上訴字第572號認定：「（聲請人）甲○○\n    自其住處取出其所有具有殺傷力仿BERETTA廠半自動玩具手\n    槍換裝土造金屬槍管改造而成之改造手槍一支（含金屬滑套\n    一個、彈夾一個，槍枝管制編號0000000000號，甲○○涉犯\n    違反槍砲彈藥刀械管制條例案件部分，另案由台灣桃園地方\n    法院於93年3月31日以92年度訴字第937號判處有期徒刑1年\n    10月，併科罰金6萬元，現上訴由本院審理中，尚未確定）\n    」（嗣經本院於94年3月23日以93年度上訴字第1460號判處\n    聲請人甲○○未經許可，持有可發射子彈具有殺傷力之改造\n    玩具手槍，處有期徒刑1年10月，併科罰金新台幣6萬元。罰\n    金如易服勞役，以銀元3百元即新台幣9百元折算1日。扣案\n    之仿BERETTA廠半自動手槍製造之改造玩具手槍一枝 ( 含金\n    屬滑套一個、彈夾一個，槍枝管制編號：0000000000號)沒\n    收）；又本院於94年10月19日以94年度上訴字第572號判處\n    聲請人「甲○○未經許可，持有可發射子彈具有殺傷力之改\n    造玩具手槍，處有期徒刑2年。併科罰金新台幣6萬元。罰金\n    如易服勞役，以銀元3佰元即新台幣9（百）元折算1日。扣\n    案之仿BERETTA廠半自動手槍製造之改造玩具手槍壹枝 (含\n    金屬滑套壹個、彈夾壹個，槍枝管制編號：0000000000號)\n    沒收。」依刑事訴訟法第302條第1項規定，案件經判決確定\n    者，應諭知免訴之判決，依前開法條之適用，因聲請再審云\n    云。\n三、惟查依前開本院94年10月19日94年度上訴字第572號判決理\n    由欄之四載明，已載記：按「未經許可持有槍、彈，一經持\n    有即成立犯罪；至其持有之繼續乃行為之繼續，俟持有行為\n    終了為止，僅屬一個持有行為，不得割裂論罪。若以之犯他\n    罪，兩罪間之關係如何，應視開始持有之原因為斷。如早已\n    非法持有槍彈，後另起意犯罪；或意圖犯甲罪而持有槍、彈\n    ，卻持以犯乙罪，均應以數罪併罰論處，必因意圖犯某罪而\n    持有槍、彈，後果以之犯該罪，兩罪間始有牽連犯之適用」\n    （最高法院89年度臺上字第1239號、第5376號、90年度臺上\n    字第1035號、第7498號判決意旨參照）。查被告甲○○持有\n    仿BERETTA廠半自動改造手槍一支，係於本案發生前1、2個\n    月買的，當初買來的用途只是好玩而已，業據被告甲○○於\n    本院審理時供承在卷（詳本院94年10月5日審判筆錄)，與本\n    案係發生於91年11月8日凌晨零時許，起始原因係於購毒糾\n    紛，是以被告甲○○購買前開仿BERETTA廠半自動改造手槍\n    一支顯不可能係預供日後91年11月8日凌晨犯罪之用，揆諸\n    前開說明，被告甲○○就未經許可，持有可發射子彈具殺傷\n    力改造玩具手槍之行為，應另成立未經許可，持有可發射子\n    彈具殺傷力之改造手槍罪名」等語。則本件即係「未經許可\n    持有槍、彈，一經持有即成立犯罪；至其持有之繼續乃行為\n    之繼續，俟持有行為終了為止，僅屬一個持有行為，不得割\n    裂論罪」，及「早已非法持有槍彈，後另起意犯罪，而持有\n    槍、彈，卻持以犯乙罪，均應以數罪併罰論處」，應成立二\n    個「未經許可，持有可發射子彈具有殺傷力之改造玩具手槍\n    罪」，並非別就扣案BERETTA廠半自動手槍製造之改造玩具\n    手槍一枝 (含金屬滑套一個、彈夾一個，槍枝管制編號：00\n    00000000號)諭知沒收，並無刑事訴訟法第302條第1項規定\n    ，案件經判決確定者，應諭知免訴之判決之情行形，聲請人\n    聲請再審為無理由，應予駁回。\n四、據上論斷，應依刑事訴訟法第434條第1項，裁定如主文。\n中    華    民    國    94    年    12    月    30    日\n                  刑事第十一庭審判長法  官  楊炳禎\n                                    法  官  陳國文\n                                    法  官  江國華\n以上正本證明與原本無異。\n如不服本裁定，應於收受送達後5 日內向本院提出抗告狀。\n                                    書記官  陳秋萍\n中    華    民    國    95    年    1     月    3     日\n",
  "structure": {
    "main": "再審之聲請駁回。",
    "reason": "一、按刑事訴訟法第420條第6項規定：「因發見確實之新證據，\n    足認受有罪判決之人，應受無罪、免訴、免刑或輕於原判決\n    所認罪名之判決者」得聲請再審。\n二、聲請人聲請意旨略以：臺灣桃園地方法院92年度訴字第937\n    號及本院94年度上訴字第572號認定：「（聲請人）甲○○\n    自其住處取出其所有具有殺傷力仿BERETTA廠半自動玩具手\n    槍換裝土造金屬槍管改造而成之改造手槍一支（含金屬滑套\n    一個、彈夾一個，槍枝管制編號0000000000號，甲○○涉犯\n    違反槍砲彈藥刀械管制條例案件部分，另案由台灣桃園地方\n    法院於93年3月31日以92年度訴字第937號判處有期徒刑1年\n    10月，併科罰金6萬元，現上訴由本院審理中，尚未確定）\n    」（嗣經本院於94年3月23日以93年度上訴字第1460號判處\n    聲請人甲○○未經許可，持有可發射子彈具有殺傷力之改造\n    玩具手槍，處有期徒刑1年10月，併科罰金新台幣6萬元。罰\n    金如易服勞役，以銀元3百元即新台幣9百元折算1日。扣案\n    之仿BERETTA廠半自動手槍製造之改造玩具手槍一枝 ( 含金\n    屬滑套一個、彈夾一個，槍枝管制編號：0000000000號)沒\n    收）；又本院於94年10月19日以94年度上訴字第572號判處\n    聲請人「甲○○未經許可，持有可發射子彈具有殺傷力之改\n    造玩具手槍，處有期徒刑2年。併科罰金新台幣6萬元。罰金\n    如易服勞役，以銀元3佰元即新台幣9（百）元折算1日。扣\n    案之仿BERETTA廠半自動手槍製造之改造玩具手槍壹枝 (含\n    金屬滑套壹個、彈夾壹個，槍枝管制編號：0000000000號)\n    沒收。」依刑事訴訟法第302條第1項規定，案件經判決確定\n    者，應諭知免訴之判決，依前開法條之適用，因聲請再審云\n    云。\n三、惟查依前開本院94年10月19日94年度上訴字第572號判決理\n    由欄之四載明，已載記：按「未經許可持有槍、彈，一經持\n    有即成立犯罪；至其持有之繼續乃行為之繼續，俟持有行為\n    終了為止，僅屬一個持有行為，不得割裂論罪。若以之犯他\n    罪，兩罪間之關係如何，應視開始持有之原因為斷。如早已\n    非法持有槍彈，後另起意犯罪；或意圖犯甲罪而持有槍、彈\n    ，卻持以犯乙罪，均應以數罪併罰論處，必因意圖犯某罪而\n    持有槍、彈，後果以之犯該罪，兩罪間始有牽連犯之適用」\n    （最高法院89年度臺上字第1239號、第5376號、90年度臺上\n    字第1035號、第7498號判決意旨參照）。查被告甲○○持有\n    仿BERETTA廠半自動改造手槍一支，係於本案發生前1、2個\n    月買的，當初買來的用途只是好玩而已，業據被告甲○○於\n    本院審理時供承在卷（詳本院94年10月5日審判筆錄)，與本\n    案係發生於91年11月8日凌晨零時許，起始原因係於購毒糾\n    紛，是以被告甲○○購買前開仿BERETTA廠半自動改造手槍\n    一支顯不可能係預供日後91年11月8日凌晨犯罪之用，揆諸\n    前開說明，被告甲○○就未經許可，持有可發射子彈具殺傷\n    力改造玩具手槍之行為，應另成立未經許可，持有可發射子\n    彈具殺傷力之改造手槍罪名」等語。則本件即係「未經許可\n    持有槍、彈，一經持有即成立犯罪；至其持有之繼續乃行為\n    之繼續，俟持有行為終了為止，僅屬一個持有行為，不得割\n    裂論罪」，及「早已非法持有槍彈，後另起意犯罪，而持有\n    槍、彈，卻持以犯乙罪，均應以數罪併罰論處」，應成立二\n    個「未經許可，持有可發射子彈具有殺傷力之改造玩具手槍\n    罪」，並非別就扣案BERETTA廠半自動手槍製造之改造玩具\n    手槍一枝 (含金屬滑套一個、彈夾一個，槍枝管制編號：00\n    00000000號)諭知沒收，並無刑事訴訟法第302條第1項規定\n    ，案件經判決確定者，應諭知免訴之判決之情行形，聲請人\n    聲請再審為無理由，應予駁回。\n四、據上論斷，應依刑事訴訟法第434條第1項，裁定如主文。"
  },
  "search": "臺灣高等法院刑事裁定94年度聲再字第433號再審聲請人即受判決人甲○○現於台灣台北監獄上列聲請人因強盜等案件，對於本院94年度上訴字第572號，中華民國94年10月19日第二審確定判決（92年度訴字第922號，起訴案號：檢察署91年度偵字第22107號），聲請再審，本院裁定如下：主文再審之聲請駁回。理由一、按刑事訴訟法第420條第6項規定：「因發見確實之新證據，足認受有罪判決之人，應受無罪、免訴、免刑或輕於原判決所認罪名之判決者」得聲請再審。二、聲請人聲請意旨略以：臺灣桃園地方法院92年度訴字第937號及本院94年度上訴字第572號認定：「（聲請人）甲○○自其住處取出其所有具有殺傷力仿BERETTA廠半自動玩具手槍換裝土造金屬槍管改造而成之改造手槍一支（含金屬滑套一個、彈夾一個，槍枝管制編號0000000000號，甲○○涉犯違反槍砲彈藥刀械管制條例案件部分，另案由台灣桃園地方法院於93年3月31日以92年度訴字第937號判處有期徒刑1年10月，併科罰金6萬元，現上訴由本院審理中，尚未確定）」（嗣經本院於94年3月23日以93年度上訴字第1460號判處聲請人甲○○未經許可，持有可發射子彈具有殺傷力之改造玩具手槍，處有期徒刑1年10月，併科罰金新台幣6萬元。罰金如易服勞役，以銀元3百元即新台幣9百元折算1日。扣案之仿BERETTA廠半自動手槍製造之改造玩具手槍一枝(含金屬滑套一個、彈夾一個，槍枝管制編號：0000000000號)沒收）；又本院於94年10月19日以94年度上訴字第572號判處聲請人「甲○○未經許可，持有可發射子彈具有殺傷力之改造玩具手槍，處有期徒刑2年。併科罰金新台幣6萬元。罰金如易服勞役，以銀元3佰元即新台幣9（百）元折算1日。扣案之仿BERETTA廠半自動手槍製造之改造玩具手槍壹枝(含金屬滑套壹個、彈夾壹個，槍枝管制編號：0000000000號)沒收。」依刑事訴訟法第302條第1項規定，案件經判決確定者，應諭知免訴之判決，依前開法條之適用，因聲請再審云云。三、惟查依前開本院94年10月19日94年度上訴字第572號判決理由欄之四載明，已載記：按「未經許可持有槍、彈，一經持有即成立犯罪；至其持有之繼續乃行為之繼續，俟持有行為終了為止，僅屬一個持有行為，不得割裂論罪。若以之犯他罪，兩罪間之關係如何，應視開始持有之原因為斷。如早已非法持有槍彈，後另起意犯罪；或意圖犯甲罪而持有槍、彈，卻持以犯乙罪，均應以數罪併罰論處，必因意圖犯某罪而持有槍、彈，後果以之犯該罪，兩罪間始有牽連犯之適用」（最高法院89年度臺上字第1239號、第5376號、90年度臺上字第1035號、第7498號判決意旨參照）。查被告甲○○持有仿BERETTA廠半自動改造手槍一支，係於本案發生前1、2個月買的，當初買來的用途只是好玩而已，業據被告甲○○於本院審理時供承在卷（詳本院94年10月5日審判筆錄)，與本案係發生於91年11月8日凌晨零時許，起始原因係於購毒糾紛，是以被告甲○○購買前開仿BERETTA廠半自動改造手槍一支顯不可能係預供日後91年11月8日凌晨犯罪之用，揆諸前開說明，被告甲○○就未經許可，持有可發射子彈具殺傷力改造玩具手槍之行為，應另成立未經許可，持有可發射子彈具殺傷力之改造手槍罪名」等語。則本件即係「未經許可持有槍、彈，一經持有即成立犯罪；至其持有之繼續乃行為之繼續，俟持有行為終了為止，僅屬一個持有行為，不得割裂論罪」，及「早已非法持有槍彈，後另起意犯罪，而持有槍、彈，卻持以犯乙罪，均應以數罪併罰論處」，應成立二個「未經許可，持有可發射子彈具有殺傷力之改造玩具手槍罪」，並非別就扣案BERETTA廠半自動手槍製造之改造玩具手槍一枝(含金屬滑套一個、彈夾一個，槍枝管制編號：0000000000號)諭知沒收，並無刑事訴訟法第302條第1項規定，案件經判決確定者，應諭知免訴之判決之情行形，聲請人聲請再審為無理由，應予駁回。四、據上論斷，應依刑事訴訟法第434條第1項，裁定如主文。中華民國94年12月30日刑事第十一庭審判長法官楊炳禎法官陳國文法官江國華以上正本證明與原本無異。如不服本裁定，應於收受送達後5日內向本院提出抗告狀。書記官陳秋萍中華民國95年1月3日",
  "characters": {
    "judges": [
      "楊炳禎",
      "陳國文",
      "江國華"
    ],
    "prosecutors": [

    ],
    "lawyers": [

    ],
    "clerks": [
      "陳秋萍"
    ],
    "plaintiffs": [

    ],
    "defendants": [

    ],
    "prosecutor_office": [

    ],
    "creditors": [

    ],
    "debtors": [

    ],
    "judicial_associate_officer": [

    ]
  },
  "adjudged_at": "2005-12-30",
  "created_at": "2016-02-07 04:17:00",
  "updated_at": "2016-02-07 04:17:00"
}