{
  "identify": "TCD-99-交易-883-20110131-2",
  "court": {
    "name": "臺灣臺中地方法院",
    "code": "TCD"
  },
  "division": {
    "name": "刑事",
    "code": "M"
  },
  "year": 99,
  "word": "交易",
  "number": "883",
  "jcheck": "2",
  "reason": "妨害公務等",
  "content": "臺灣臺中地方法院宣示判決筆錄         99年度交易字第883號\n公  訴  人  臺灣臺中地方法院檢察署檢察官\n被      告  張宗元\n上列被告等因妨害公務等案件，經檢察官提起公訴（九十九年度\n偵字第一八三七一號），並聲請認罪協商，本院裁定進行認罪協\n商程序後，於中華民國一百年一月三十一日下午四時，在本院刑\n事第十一法庭宣示判決，出席職員如下：\n          法  官  林學晴\n          書記官  簡雅文\n法官起立朗讀判決主文、犯罪事實要旨、處罰條文、附記事項，\n及告以上訴限制、期間並提出上訴狀之法院，且諭知記載其內容\n：\n一、主  文：\n    張宗元服用酒類，不能安全駕駛動力交通工具而駕駛，處拘\n    役拾日，如易科罰金，以新臺幣壹仟元折算壹日；又對於\n    公務員依法執行職務時，施強暴，處拘役肆拾日，如易科罰\n    金，以新臺幣壹仟元折算壹日。應執行拘役陸拾日，如易科\n    罰金，以新臺幣壹仟元折算壹日。緩刑年。\n二、犯罪事實要旨：\n    張宗元自民國九十九年七月二十七日二十二時起至翌日（二\n    十八日）零時許，在臺中市○○區○○路前妻家中飲用啤酒\n    及烏梅酒。明知其已因飲酒無法安全駕駛動力交通工具，竟\n    仍於酒後駕駛其所有之車牌號碼二Ｊ－００五六號自小客貨\n    車離開，欲返回位在臺中市○區○○里○○街五巷十八號住\n    處。嗣於凌晨三時四十分許，張宗元在太平區○○路六一九\n    號前，因右前輪爆胎，仍不停踩油門，發出噪音，為警前往\n    處理，當場發現張宗元酒味甚濃，欲對張宗元施以酒測。惟\n    張宗元拒不配合，員警乃將張宗元帶回臺中市警察局太平分\n    局坪林派出所，以完成調查程序。詎張宗元明知員警張季平\n    、劉漢昌等人係依法執行公務之公務員，竟在警車上對警員\n    張季平辱罵以「混蛋」、「你娘累」、「他媽的」等語（所\n    涉妨害名譽部分，未據員警張季平提出告訴），且出手拍打\n    張季平的大腿（未成傷），而對於依法執行職務之警員施強\n    暴。迨張宗元到達派出所後，猶不知收歛，又以「啥小」辱\n    罵警員，拒不配合調查及製作筆錄。\n三、處罰條文：刑法第一百八十五條之三條、第一百三十五條。\n四、附記事項：\n    爰審酌被告犯罪之目的、手段及其年事已高，並患有重聽領\n    有殘障手冊等情，兼之被告已於本院審理時坦承犯行，深具\n    悔意，且員警張季平於本院審理時亦當庭表示願意原諒被告\n    ，有本院一百年一月二十七日審判筆錄（本院卷第五十一頁\n    背面）一份在卷可稽，本院認被告經此教訓，當知警惕，信\n    無再犯之虞，所宣告之刑以暫不執行為適當，爰依刑法第七\n    十四條第一項第二款之規定及協商內容，諭知緩刑三年，以\n    勵自新。\n五、協商判決除有刑事訴訟法第四百五十五條之四第一項第一款\n    於本訊問程序終結前，被告撤銷協商合意或檢察官撤回協商\n    聲請者；第二款被告協商之意思非出於自由意志者；第四款\n    被告所犯之罪非第四百五十五條之二第一項所定得以聲請協\n    商判決者；第六款被告有其他較重之裁判上一罪之犯罪事實\n    者；第七款法院認應諭知免刑或免訴、不受理者情形之一，\n    及違反同條第二項「法院應於協商合意範圍內為判決；法院\n    為協商判決所科之刑，以宣告緩刑或二年以下有期徒刑、拘\n    役或罰金為限」之規定者外，不得上訴。\n六、如有上開可得上訴情形，得自收受宣示判決筆錄送達之日起\n    十日內，向本院提出上訴書狀，上訴於第二審法院。\n中    華    民    國    100    年     1    月    31   日\n                  臺灣臺中地方法院刑事第十一庭\n                                  書記官  簡雅文\n                                  法  官  林學晴\n以上正本證明與原本無異。\n上訴書狀如未敘述理由，應於上訴期間屆滿後20日內補提理由書\n狀於本院。（應敘述具體理由並附繕本）。\n                                  書記官  簡雅文\n中    華    民    國    100    年     1    月    31   日\n【附錄本案論罪科刑法條全文】\n刑法第一百八十五條之三\n服用毒品、麻醉藥品、酒類或其他相類之物，不能安全駕駛動力\n交通工具而駕駛者，處一年以下有期徒刑、拘役或科或併科十五\n萬元以下罰金。\n刑法第一百三十五條第一項\n對於公務員依法執行職務時，施強暴脅迫者，處三年以下有期徒\n刑、拘役或三百元以下罰金。",
  "structure": {
  },
  "search": "臺灣臺中地方法院宣示判決筆錄99年度交易字第883號公訴人臺灣臺中地方法院檢察署檢察官被告張宗元上列被告等因妨害公務等案件，經檢察官提起公訴（九十九年度偵字第一八三七一號），並聲請認罪協商，本院裁定進行認罪協商程序後，於中華民國一百年一月三十一日下午四時，在本院刑事第十一法庭宣示判決，出席職員如下：法官林學晴書記官簡雅文法官起立朗讀判決主文、犯罪事實要旨、處罰條文、附記事項，及告以上訴限制、期間並提出上訴狀之法院，且諭知記載其內容：一、主文：張宗元服用酒類，不能安全駕駛動力交通工具而駕駛，處拘役拾日，如易科罰金，以新臺幣壹仟元折算壹日；又對於公務員依法執行職務時，施強暴，處拘役肆拾日，如易科罰金，以新臺幣壹仟元折算壹日。應執行拘役陸拾日，如易科罰金，以新臺幣壹仟元折算壹日。緩刑年。二、犯罪事實要旨：張宗元自民國九十九年七月二十七日二十二時起至翌日（二十八日）零時許，在臺中市○○區○○路前妻家中飲用啤酒及烏梅酒。明知其已因飲酒無法安全駕駛動力交通工具，竟仍於酒後駕駛其所有之車牌號碼二Ｊ－００五六號自小客貨車離開，欲返回位在臺中市○區○○里○○街五巷十八號住處。嗣於凌晨三時四十分許，張宗元在太平區○○路六一九號前，因右前輪爆胎，仍不停踩油門，發出噪音，為警前往處理，當場發現張宗元酒味甚濃，欲對張宗元施以酒測。惟張宗元拒不配合，員警乃將張宗元帶回臺中市警察局太平分局坪林派出所，以完成調查程序。詎張宗元明知員警張季平、劉漢昌等人係依法執行公務之公務員，竟在警車上對警員張季平辱罵以「混蛋」、「你娘累」、「他媽的」等語（所涉妨害名譽部分，未據員警張季平提出告訴），且出手拍打張季平的大腿（未成傷），而對於依法執行職務之警員施強暴。迨張宗元到達派出所後，猶不知收歛，又以「啥小」辱罵警員，拒不配合調查及製作筆錄。三、處罰條文：刑法第一百八十五條之三條、第一百三十五條。四、附記事項：爰審酌被告犯罪之目的、手段及其年事已高，並患有重聽領有殘障手冊等情，兼之被告已於本院審理時坦承犯行，深具悔意，且員警張季平於本院審理時亦當庭表示願意原諒被告，有本院一百年一月二十七日審判筆錄（本院卷第五十一頁背面）一份在卷可稽，本院認被告經此教訓，當知警惕，信無再犯之虞，所宣告之刑以暫不執行為適當，爰依刑法第七十四條第一項第二款之規定及協商內容，諭知緩刑三年，以勵自新。五、協商判決除有刑事訴訟法第四百五十五條之四第一項第一款於本訊問程序終結前，被告撤銷協商合意或檢察官撤回協商聲請者；第二款被告協商之意思非出於自由意志者；第四款被告所犯之罪非第四百五十五條之二第一項所定得以聲請協商判決者；第六款被告有其他較重之裁判上一罪之犯罪事實者；第七款法院認應諭知免刑或免訴、不受理者情形之一，及違反同條第二項「法院應於協商合意範圍內為判決；法院為協商判決所科之刑，以宣告緩刑或二年以下有期徒刑、拘役或罰金為限」之規定者外，不得上訴。六、如有上開可得上訴情形，得自收受宣示判決筆錄送達之日起十日內，向本院提出上訴書狀，上訴於第二審法院。中華民國100年1月31日臺灣臺中地方法院刑事第十一庭書記官簡雅文法官林學晴以上正本證明與原本無異。上訴書狀如未敘述理由，應於上訴期間屆滿後20日內補提理由書狀於本院。（應敘述具體理由並附繕本）。書記官簡雅文中華民國100年1月31日【附錄本案論罪科刑法條全文】刑法第一百八十五條之三服用毒品、麻醉藥品、酒類或其他相類之物，不能安全駕駛動力交通工具而駕駛者，處一年以下有期徒刑、拘役或科或併科十五萬元以下罰金。刑法第一百三十五條第一項對於公務員依法執行職務時，施強暴脅迫者，處三年以下有期徒刑、拘役或三百元以下罰金。",
  "characters": {
    "judges": [
      "林學晴",
      "林學晴"
    ],
    "prosecutors": [

    ],
    "lawyers": [

    ],
    "clerks": [
      "簡雅文",
      "簡雅文",
      "簡雅文"
    ],
    "plaintiffs": [

    ],
    "defendants": [
      "張宗元"
    ],
    "prosecutor_office": [
      "臺灣臺中地方法院檢察署檢察官"
    ],
    "creditors": [

    ],
    "debtors": [

    ],
    "judicial_associate_officer": [

    ]
  },
  "adjudged_at": "2011-01-31",
  "created_at": "2016-02-13 09:18:27",
  "updated_at": "2016-02-13 09:18:27"
}