{
  "identify": "TYD-99-審訴-2225-20110429-1",
  "court": {
    "name": "臺灣桃園地方法院",
    "code": "TYD"
  },
  "division": {
    "name": "刑事",
    "code": "M"
  },
  "year": 99,
  "word": "審訴",
  "number": "2225",
  "jcheck": "1",
  "reason": "毒品危害防制條例",
  "content": "臺灣桃園地方法院宣示判決筆錄        99年度審訴字第2225號\n公  訴  人  臺灣桃園地方法院檢察署檢察官\n被      告  陳璁澓原名陳欽城.\n指定辯護人  本院公設辯護人陳瑞明\n上列被告因毒品危害防制條例案件，於中華民國100 年4 月29日\n下午5 時許，在本院第十法庭宣示判決，出席職員如下：\n          法  官   許曉微\n          書記官   林宜亭\n          通  譯\n法官起立朗讀判決主文、犯罪事實要旨、處罰條文、附記事項，\n及告以上訴限制、期間並提出上訴狀之法院，且諭知記載其內容\n：\n一、主  文：\n    陳璁澓施用第一級毒品，累犯，處有期徒刑拾月，扣案之海\n    洛因貳包含袋（驗餘淨重共零點肆柒陸公克）均沒收銷燬之\n    ；又施用第二級毒品，累犯，處有期徒刑陸月，扣案之內含\n    甲基安非他命殘渣之吸食器壹組沒收銷燬。應執行有期徒刑\n    壹年貳月，扣案之海洛因貳包含袋（驗餘淨重共零點肆柒陸\n    公克）及內含甲基安非他命殘渣之吸食器壹組，均沒收銷燬\n    之。\n二、犯罪事實要旨：\n    陳璁澓前於民國96年間，因施用毒品案件，經臺灣士林地方\n    法院以96年度毒聲字第217 號裁定送觀察、勒戒後，因認有\n    繼續施用毒品之傾向，再經同法院以96年度毒聲字第315 號\n    裁定令入戒治處所施以強制戒治，嗣因強制戒治成效評定合\n    格，認無繼續強制戒治之必要，於97年4 月7 日執行完畢釋\n    放出所，該次犯行並經臺灣士林地方法院檢察署檢察官以97\n    年度戒毒偵字第45號為不起訴處分確定。另曾於96年間因持\n    有毒品案件，經臺灣士林地方法院以96年度簡字第912 號判\n    決判處有期徒刑3 月，又曾於94年間因犯妨害自由案件，經\n    臺灣臺北地方法院以95年度易字第1594號等判決判處有期徒\n    刑6 月，減為有期徒刑3 月確定，上開二罪接續執行，於97\n    年10月6 日縮刑期滿執行完畢。詎仍不知悔改，復基於施用\n    第一、二級毒品之犯意，於前開強制戒治執行完畢釋放後五\n    年內之99年8 月9 日下午3 時許，在桃園縣八德市○○路○\n    段428 巷17弄3 衖5 號之1 之居所內，分別以抽香菸之方式\n    施用海洛因及以玻璃球吸食器燒烤吸食之方式施用甲基安非\n    他命各1 次。嗣於同日晚間9 時10分許，在上開居所內為警\n    查獲，並扣得其施用剩餘之海洛因2 包含袋（驗餘淨重共0.\n    476公克）及內含甲基安非他命殘渣之吸食器1 組。\n三、處罰條文：\n    毒品危害防制條例第10條第1 項、第2 項、第18條第1 項前\n    段，刑法第11條、第47條第1 項、第51條第5 款。\n四、附記事項：\n    扣案之內含甲基安非他命殘渣之吸食器1 組，係被告施用毒\n    品甲基安非他命後所剩餘，業據其供承在卷，並有法務部調\n    查局鑑定書1 份在卷可佐，因內含之甲基安非他命因量微無\n    法與吸食器析離，應一體視為第二級毒品甲基安非他命，爰\n    依毒品危害防制條例第18條第1 項前段規定宣告沒收銷燬之\n    。至扣案之注射針筒1 支，被告於本院審理時否認為其所有\n    ，稱係友人託其丟棄，並供稱其非以注射方式施用毒品，是\n    尚乏證據可認係被告所有且供犯本件施用毒品罪所用之物，\n    又非違禁物，爰不予宣告沒收。\n五、協商判決除有刑事訴訟法第455 條之4 第1 項第1 款於本訊\n    問程序終結前，被告撤銷協商合意或檢察官撤回協商聲請者\n    ；第2 款被告協商之意思非出於自由意志者；第4 款被告所\n    犯之罪非第455 條之2 第1 項所定得以協商判決者；第6 款\n    被告有其他較重之裁判上一罪之犯罪事實者；第7 款法院認\n    應諭知免刑或免訴、不受理者情形之一，及違反同條第2 項\n    「法院應於協商合意範圍內為判決；法院為協商判決所科之\n    刑，以宣告緩刑或2 年以下有期徒刑、拘役或罰金為限」之\n    規定者外，不得上訴。\n六、如有前項得上訴之情形者，得自判決送達之日起10日內，向\n    本院提出上訴書狀，上訴於第二審法院。\n中    華    民    國   100    年    4    月     29    日\n                            刑事庭法  官  許曉微\n                                  書記官  林宜亭\n以上正本證明與原本無異。\n                                  書記官  林宜亭\n中    華    民    國   100    年    4    月     29    日\n附錄本案論罪科刑法條：\n毒品危害防制條例第10條規定：\n施用第一級毒品者，處6 月以上5 年以下有期徒刑。\n施用第二級毒品者，處3 年以下有期徒刑。",
  "structure": {
  },
  "search": "臺灣桃園地方法院宣示判決筆錄99年度審訴字第2225號公訴人臺灣桃園地方法院檢察署檢察官被告陳璁澓原名陳欽城.指定辯護人本院公設辯護人陳瑞明上列被告因毒品危害防制條例案件，於中華民國100年4月29日下午5時許，在本院第十法庭宣示判決，出席職員如下：法官許曉微書記官林宜亭通譯法官起立朗讀判決主文、犯罪事實要旨、處罰條文、附記事項，及告以上訴限制、期間並提出上訴狀之法院，且諭知記載其內容：一、主文：陳璁澓施用第一級毒品，累犯，處有期徒刑拾月，扣案之海洛因貳包含袋（驗餘淨重共零點肆柒陸公克）均沒收銷燬之；又施用第二級毒品，累犯，處有期徒刑陸月，扣案之內含甲基安非他命殘渣之吸食器壹組沒收銷燬。應執行有期徒刑壹年貳月，扣案之海洛因貳包含袋（驗餘淨重共零點肆柒陸公克）及內含甲基安非他命殘渣之吸食器壹組，均沒收銷燬之。二、犯罪事實要旨：陳璁澓前於民國96年間，因施用毒品案件，經臺灣士林地方法院以96年度毒聲字第217號裁定送觀察、勒戒後，因認有繼續施用毒品之傾向，再經同法院以96年度毒聲字第315號裁定令入戒治處所施以強制戒治，嗣因強制戒治成效評定合格，認無繼續強制戒治之必要，於97年4月7日執行完畢釋放出所，該次犯行並經臺灣士林地方法院檢察署檢察官以97年度戒毒偵字第45號為不起訴處分確定。另曾於96年間因持有毒品案件，經臺灣士林地方法院以96年度簡字第912號判決判處有期徒刑3月，又曾於94年間因犯妨害自由案件，經臺灣臺北地方法院以95年度易字第1594號等判決判處有期徒刑6月，減為有期徒刑3月確定，上開二罪接續執行，於97年10月6日縮刑期滿執行完畢。詎仍不知悔改，復基於施用第一、二級毒品之犯意，於前開強制戒治執行完畢釋放後五年內之99年8月9日下午3時許，在桃園縣八德市○○路○段428巷17弄3衖5號之1之居所內，分別以抽香菸之方式施用海洛因及以玻璃球吸食器燒烤吸食之方式施用甲基安非他命各1次。嗣於同日晚間9時10分許，在上開居所內為警查獲，並扣得其施用剩餘之海洛因2包含袋（驗餘淨重共0.476公克）及內含甲基安非他命殘渣之吸食器1組。三、處罰條文：毒品危害防制條例第10條第1項、第2項、第18條第1項前段，刑法第11條、第47條第1項、第51條第5款。四、附記事項：扣案之內含甲基安非他命殘渣之吸食器1組，係被告施用毒品甲基安非他命後所剩餘，業據其供承在卷，並有法務部調查局鑑定書1份在卷可佐，因內含之甲基安非他命因量微無法與吸食器析離，應一體視為第二級毒品甲基安非他命，爰依毒品危害防制條例第18條第1項前段規定宣告沒收銷燬之。至扣案之注射針筒1支，被告於本院審理時否認為其所有，稱係友人託其丟棄，並供稱其非以注射方式施用毒品，是尚乏證據可認係被告所有且供犯本件施用毒品罪所用之物，又非違禁物，爰不予宣告沒收。五、協商判決除有刑事訴訟法第455條之4第1項第1款於本訊問程序終結前，被告撤銷協商合意或檢察官撤回協商聲請者；第2款被告協商之意思非出於自由意志者；第4款被告所犯之罪非第455條之2第1項所定得以協商判決者；第6款被告有其他較重之裁判上一罪之犯罪事實者；第7款法院認應諭知免刑或免訴、不受理者情形之一，及違反同條第2項「法院應於協商合意範圍內為判決；法院為協商判決所科之刑，以宣告緩刑或2年以下有期徒刑、拘役或罰金為限」之規定者外，不得上訴。六、如有前項得上訴之情形者，得自判決送達之日起10日內，向本院提出上訴書狀，上訴於第二審法院。中華民國100年4月29日刑事庭法官許曉微書記官林宜亭以上正本證明與原本無異。書記官林宜亭中華民國100年4月29日附錄本案論罪科刑法條：毒品危害防制條例第10條規定：施用第一級毒品者，處6月以上5年以下有期徒刑。施用第二級毒品者，處3年以下有期徒刑。",
  "characters": {
    "judges": [
      "許曉微",
      "許曉微"
    ],
    "prosecutors": [

    ],
    "lawyers": [

    ],
    "clerks": [
      "林宜亭",
      "林宜亭",
      "林宜亭"
    ],
    "plaintiffs": [

    ],
    "defendants": [
      "陳璁澓原名陳欽城."
    ],
    "prosecutor_office": [
      "臺灣桃園地方法院檢察署檢察官"
    ],
    "creditors": [

    ],
    "debtors": [

    ],
    "judicial_associate_officer": [

    ]
  },
  "adjudged_at": "2011-04-29",
  "created_at": "2016-02-12 11:08:54",
  "updated_at": "2016-02-12 11:08:54"
}