{
  "identify": "PTD-100-補-172-20110526-1",
  "court": {
    "name": "臺灣屏東地方法院",
    "code": "PTD"
  },
  "division": {
    "name": "民事",
    "code": "V"
  },
  "year": 100,
  "word": "補",
  "number": "172",
  "jcheck": "1",
  "reason": "債務人異議之訴",
  "content": "臺灣屏東地方法院民事裁定              100年度補字第172號\n原      告  格林恒業股份有限公司\n法定代理人  楊國廷\n訴訟代理人  葉瑞金\n被      告  臺灣土地銀行股份有限公司\n法定代理人  王耀興\n被      告  中租迪和股份有限公司\n法定代理人  陳龍鳳\n上列當事人間債務人異議之訴等事件，原告起訴未據繳納裁判費\n。按「以一訴主張數項標的者，其價額合併計算之。．．以一訴\n附帶請求其孳息、損害賠償、違約金或費用者，不併算其價額。\n」此民事訴訟法第77條之2 第1 項本文、第2 項定有明文。本件\n原告起訴第一項聲明為「鈞院屏院惠民執辛字第99司執16417 號\n兩造間連帶保證財產強制執行事件，原告願供擔保，強制執行程\n序應予撤銷。」，此部分被告主張強制執行債權額為新臺幣（下\n同）823, 315元，而原告認為尚存債權額為173,000 元，則有爭\n執部分為650, 315元，故此部分之訴訟標的價額應為650,315 元\n；又原告起訴第二項聲明「被告中租應返還不當得利951,700 元\n，及自98年6 月30日起至返還日止，按年息百分之五計算之利息\n。」，則此部分訴訟標的價額為951,700 元；至原告第三項聲明\n「被告土銀或中租應出具清償證明書予原告」，原告因交付此清\n償證明書所受利益之客觀價額，應係被告強制執行所主張債權額\n823,315 元，是此部分之價額為823,315 元。準此本件核定訴訟\n標的價額應為2,425,330 元（650,315 元+951,700元+823,315元\n），應徵第一審裁判費新臺幣25,057元，因原告起訴時已繳交1,\n880 元，故尚須補繳23,177元，茲依民事訴訟法第249 條第1項\n但書之規定，限原告於收受本裁定送達七日內補繳，逾期不繳，\n即駁回其訴，特此裁定。\n中    華    民    國   100    年    5     月    26    日\n                  民事第一庭    法  官  曾吉雄\n正本與原本無異。\n如不服本裁定關於核定訴訟標的價額部分，應於送達後10日內向\n本院提出抗告狀，並繳納抗告費新台幣1,000元；其餘關於命補\n繳裁判費部分，不得抗告。\n中    華    民    國   100    年    5     月    26    日\n                                書記官  許倬維",
  "structure": {
  },
  "search": "臺灣屏東地方法院民事裁定100年度補字第172號原告格林恒業股份有限公司法定代理人楊國廷訴訟代理人葉瑞金被告臺灣土地銀行股份有限公司法定代理人王耀興被告中租迪和股份有限公司法定代理人陳龍鳳上列當事人間債務人異議之訴等事件，原告起訴未據繳納裁判費。按「以一訴主張數項標的者，其價額合併計算之。．．以一訴附帶請求其孳息、損害賠償、違約金或費用者，不併算其價額。」此民事訴訟法第77條之2第1項本文、第2項定有明文。本件原告起訴第一項聲明為「鈞院屏院惠民執辛字第99司執16417號兩造間連帶保證財產強制執行事件，原告願供擔保，強制執行程序應予撤銷。」，此部分被告主張強制執行債權額為新臺幣（下同）823,315元，而原告認為尚存債權額為173,000元，則有爭執部分為650,315元，故此部分之訴訟標的價額應為650,315元；又原告起訴第二項聲明「被告中租應返還不當得利951,700元，及自98年6月30日起至返還日止，按年息百分之五計算之利息。」，則此部分訴訟標的價額為951,700元；至原告第三項聲明「被告土銀或中租應出具清償證明書予原告」，原告因交付此清償證明書所受利益之客觀價額，應係被告強制執行所主張債權額823,315元，是此部分之價額為823,315元。準此本件核定訴訟標的價額應為2,425,330元（650,315元+951,700元+823,315元），應徵第一審裁判費新臺幣25,057元，因原告起訴時已繳交1,880元，故尚須補繳23,177元，茲依民事訴訟法第249條第1項但書之規定，限原告於收受本裁定送達七日內補繳，逾期不繳，即駁回其訴，特此裁定。中華民國100年5月26日民事第一庭法官曾吉雄正本與原本無異。如不服本裁定關於核定訴訟標的價額部分，應於送達後10日內向本院提出抗告狀，並繳納抗告費新台幣1,000元；其餘關於命補繳裁判費部分，不得抗告。中華民國100年5月26日書記官許倬維",
  "characters": {
    "judges": [
      "曾吉雄"
    ],
    "prosecutors": [

    ],
    "lawyers": [

    ],
    "clerks": [

    ],
    "plaintiffs": [
      "格林恒業股份有限公司"
    ],
    "defendants": [
      "臺灣土地銀行股份有限公司",
      "中租迪和股份有限公司"
    ],
    "prosecutor_office": [

    ],
    "creditors": [

    ],
    "debtors": [

    ],
    "judicial_associate_officer": [

    ]
  },
  "adjudged_at": "2011-05-26",
  "created_at": "2016-02-12 02:15:07",
  "updated_at": "2016-02-12 02:15:07"
}