{
  "identify": "SLD-100-訴-173-20110525-1",
  "court": {
    "name": "臺灣士林地方法院",
    "code": "SLD"
  },
  "division": {
    "name": "民事",
    "code": "V"
  },
  "year": 100,
  "word": "訴",
  "number": "173",
  "jcheck": "1",
  "reason": "確認委任關係不存在",
  "content": "臺灣士林地方法院民事判決              100年度訴字第173號\n原      告  周鐘麒\n訴訟代理人  賴呈瑞律師\n被      告  天弓科技股份有限公司\n法定代理人  趙郁文\n上列當事人間確認委任關係不存在事件，本院於民國100 年5 月\n11日言詞辯論終結，判決如下：\n    主  文\n確認原告與被告間之董事委任關係不存在。\n訴訟費用由被告負擔。\n    事  實  及  理  由\n一、被告經合法通知，未於言詞辯論期日到場，核無民事訴訟法\n    第386 條各款所列情形，爰依原告聲請，由其一造辯論而為\n    判決。\n二、原告起訴主張：原告原任被告公司之董事，惟已於民國94年\n    1 月5 日以請辭書向被告為終止董事委任關係之意思表示，\n    兩造間之董事委任關係已因原告終止而不存在。惟被告收受\n    終止委任關係之意思表示後，雖曾申請變更董事登記，惟迄\n    今原告仍登記為被告公司董事，客觀上有使他人誤認兩造間\n    董事委任關係為存在，致原告法律上地位不安定之虞。爰提\n    起本件訴訟，聲明請求判決如主文所示等語。\n三、被告經合法通知，未於言詞辯論期日到場，亦未提出書狀為\n    何聲請或陳述。\n四、按確認之訴，非原告有即受確認判決之法律上利益者，不得\n    提起，民事訴訟法第247 條前段定有明文，而所謂「即受確\n    認判決之法律上利益者」，須因法律關係之存否不明確，致\n    原告在私法上之地位有受侵害之危險，而此項危險得以對於\n    被告之確認判決除去之者，始為存在（最高法院27年上字第\n    316 號判例參照）。原告主張伊於94年1 月5 日向被告辭任\n    董事職務，惟迄今原告仍登記為被告公司董事，則兩造間董\n    事之委任關係是否存在，即有不明確之處，且該法律地位之\n    不明確狀態得以確認判決除去。準此，原告提起本件訴訟自\n    有確認利益。\n五、按公司與董事間之關係，除公司法另有規定外，依民法關於\n    委任之規定；又按當事人之任何一方，得隨時終止委任契約\n    。公司法第192 條第4 項、民法第549 條第1 項分別定有明\n    文。本件原告主張伊已於94年1 月間向被告辭任董事職務等\n    情，業據其提出與所述相符之請辭書、公司變更登記表（本\n    院卷第8 頁至第9 頁）為證，被告經合法通知，未於言詞辯\n    論期日到場爭執，亦未提出任何書狀答辯以供本院斟酌，堪\n    認原告之主張為真實。原告既已向被告為終止委任關係之意\n    思表示，則依上開法條規定，兩造間董事之委任關係已不存\n    在。從而，原告起訴請求確認兩造間董事委任關係不存在，\n    為有理由，應予准許，爰判決如主文第1 項所示。\n六、據上論結，原告之訴為有理由，依民事訴訟法第78條，判決\n    如主文。\n中    華    民    國   100    年    5     月    25    日\n                  民事第二庭  法  官  王怡雯\n以上正本係照原本作成。\n如對本判決上訴須於判決送達後 20 日內向本院提出上訴狀。如\n委任律師提起上訴者，應一併繳納上訴審裁判費。\n中    華    民    國   100    年    5     月    27    日\n                              書記官  林冠伶",
  "structure": {
    "fact": "一、被告經合法通知，未於言詞辯論期日到場，核無民事訴訟法\n    第386 條各款所列情形，爰依原告聲請，由其一造辯論而為\n    判決。\n二、原告起訴主張：原告原任被告公司之董事，惟已於民國94年\n    1 月5 日以請辭書向被告為終止董事委任關係之意思表示，\n    兩造間之董事委任關係已因原告終止而不存在。惟被告收受\n    終止委任關係之意思表示後，雖曾申請變更董事登記，惟迄\n    今原告仍登記為被告公司董事，客觀上有使他人誤認兩造間\n    董事委任關係為存在，致原告法律上地位不安定之虞。爰提\n    起本件訴訟，聲明請求判決如主文所示等語。\n三、被告經合法通知，未於言詞辯論期日到場，亦未提出書狀為\n    何聲請或陳述。\n四、按確認之訴，非原告有即受確認判決之法律上利益者，不得\n    提起，民事訴訟法第247 條前段定有明文，而所謂「即受確\n    認判決之法律上利益者」，須因法律關係之存否不明確，致\n    原告在私法上之地位有受侵害之危險，而此項危險得以對於\n    被告之確認判決除去之者，始為存在（最高法院27年上字第\n    316 號判例參照）。原告主張伊於94年1 月5 日向被告辭任\n    董事職務，惟迄今原告仍登記為被告公司董事，則兩造間董\n    事之委任關係是否存在，即有不明確之處，且該法律地位之\n    不明確狀態得以確認判決除去。準此，原告提起本件訴訟自\n    有確認利益。\n五、按公司與董事間之關係，除公司法另有規定外，依民法關於\n    委任之規定；又按當事人之任何一方，得隨時終止委任契約\n    。公司法第192 條第4 項、民法第549 條第1 項分別定有明\n    文。本件原告主張伊已於94年1 月間向被告辭任董事職務等\n    情，業據其提出與所述相符之請辭書、公司變更登記表（本\n    院卷第8 頁至第9 頁）為證，被告經合法通知，未於言詞辯\n    論期日到場爭執，亦未提出任何書狀答辯以供本院斟酌，堪\n    認原告之主張為真實。原告既已向被告為終止委任關係之意\n    思表示，則依上開法條規定，兩造間董事之委任關係已不存\n    在。從而，原告起訴請求確認兩造間董事委任關係不存在，\n    為有理由，應予准許，爰判決如主文第1 項所示。\n六、據上論結，原告之訴為有理由，依民事訴訟法第78條，判決\n    如主文。"
  },
  "search": "臺灣士林地方法院民事判決100年度訴字第173號原告周鐘麒訴訟代理人賴呈瑞律師被告天弓科技股份有限公司法定代理人趙郁文上列當事人間確認委任關係不存在事件，本院於民國100年5月11日言詞辯論終結，判決如下：主文確認原告與被告間之董事委任關係不存在。訴訟費用由被告負擔。事實及理由一、被告經合法通知，未於言詞辯論期日到場，核無民事訴訟法第386條各款所列情形，爰依原告聲請，由其一造辯論而為判決。二、原告起訴主張：原告原任被告公司之董事，惟已於民國94年1月5日以請辭書向被告為終止董事委任關係之意思表示，兩造間之董事委任關係已因原告終止而不存在。惟被告收受終止委任關係之意思表示後，雖曾申請變更董事登記，惟迄今原告仍登記為被告公司董事，客觀上有使他人誤認兩造間董事委任關係為存在，致原告法律上地位不安定之虞。爰提起本件訴訟，聲明請求判決如主文所示等語。三、被告經合法通知，未於言詞辯論期日到場，亦未提出書狀為何聲請或陳述。四、按確認之訴，非原告有即受確認判決之法律上利益者，不得提起，民事訴訟法第247條前段定有明文，而所謂「即受確認判決之法律上利益者」，須因法律關係之存否不明確，致原告在私法上之地位有受侵害之危險，而此項危險得以對於被告之確認判決除去之者，始為存在（最高法院27年上字第316號判例參照）。原告主張伊於94年1月5日向被告辭任董事職務，惟迄今原告仍登記為被告公司董事，則兩造間董事之委任關係是否存在，即有不明確之處，且該法律地位之不明確狀態得以確認判決除去。準此，原告提起本件訴訟自有確認利益。五、按公司與董事間之關係，除公司法另有規定外，依民法關於委任之規定；又按當事人之任何一方，得隨時終止委任契約。公司法第192條第4項、民法第549條第1項分別定有明文。本件原告主張伊已於94年1月間向被告辭任董事職務等情，業據其提出與所述相符之請辭書、公司變更登記表（本院卷第8頁至第9頁）為證，被告經合法通知，未於言詞辯論期日到場爭執，亦未提出任何書狀答辯以供本院斟酌，堪認原告之主張為真實。原告既已向被告為終止委任關係之意思表示，則依上開法條規定，兩造間董事之委任關係已不存在。從而，原告起訴請求確認兩造間董事委任關係不存在，為有理由，應予准許，爰判決如主文第1項所示。六、據上論結，原告之訴為有理由，依民事訴訟法第78條，判決如主文。中華民國100年5月25日民事第二庭法官王怡雯以上正本係照原本作成。如對本判決上訴須於判決送達後20日內向本院提出上訴狀。如委任律師提起上訴者，應一併繳納上訴審裁判費。中華民國100年5月27日書記官林冠伶",
  "characters": {
    "judges": [
      "王怡雯"
    ],
    "prosecutors": [

    ],
    "lawyers": [
      "賴呈瑞",
      "委任"
    ],
    "clerks": [

    ],
    "plaintiffs": [
      "周鐘麒"
    ],
    "defendants": [
      "天弓科技股份有限公司"
    ],
    "prosecutor_office": [

    ],
    "creditors": [

    ],
    "debtors": [

    ],
    "judicial_associate_officer": [

    ]
  },
  "adjudged_at": "2011-05-25",
  "created_at": "2016-02-12 02:14:19",
  "updated_at": "2016-02-12 02:14:19"
}