{
  "identify": "CHD-100-聲更-1-20110802-1",
  "court": {
    "name": "臺灣彰化地方法院",
    "code": "CHD"
  },
  "division": {
    "name": "民事",
    "code": "V"
  },
  "year": 100,
  "word": "聲更",
  "number": "1",
  "jcheck": "1",
  "reason": "停止執行",
  "content": "臺灣彰化地方法院民事裁定  100年度聲更字第1號\n聲  請  人  胡靜蓉\n相  對  人  李彥樺\n上列當事人間因停止執行事件，聲請人對於民國100年7月20日本\n院100年度聲字第69號裁定提起抗告，經台灣高等法院台中分院\n廢棄原裁定發回（100年度抗字第334號），本院裁定如下：\n    主  文\n聲請人供擔保新臺幣貳拾陸萬肆仟參佰參拾參元後，本院99年度\n司執字第17761號執行事件之強制執行程序，於本院100年度訴字\n603號債務人異議之訴等事件判決確定、和解或撤回起訴前應暫\n予停止。\n    理  由\n一、按有回復原狀之聲請或提起再審或異議之訴，或對於和解為\n    繼續審判之請求，或提起宣告調解無效之訴，撤銷調解之訴\n    ，或對於法院因強制執行法第 4條第1項第5款之裁定提起抗\n    告時，法院因必要情形，或依聲請定相當並確實之擔保，得\n    為停止強制執行之裁定，強制執行法第18 條第2項定有明文\n    。\n二、本件聲請人以其於100年7月14日向本院提起債務人異議之訴\n    為理由，聲請裁定停止99年度司執字第17761號清償債務強\n    制執行事件之強制執行程序。\n三、經本院審酌強制執行聲請狀及前開100年度訴字第603號債務\n    人異議之訴事件卷宗審究後，認為聲請人之聲請為有理由，\n    應予准許。茲審酌上開執行事件聲請執行債權額為新臺幣（\n    下同）1,220,000元，相對人因本件停止執行所受損害，相\n    當於1,220,000元延後受償之法定遲延利息，至於相對人延\n    後受償期間，應視該債務人異議之訴何時確定為斷，由於何\n    時確定尚無定論，本院認以該訴訟至第3審確定之時間，即\n    依各級法院辦案期限實施要點所規定各審級辦案期限（即第\n    1 審1年4個月，第2審2年，第3審1年）估計為4年4個月，並\n    以法定遲延利息利率即年息百分之5計算，故認聲請人應供\n    擔保金264,333元（計算式：1,220,000×0.05×52 /12＝26\n    4,333）為適當，裁定如主文所示。\n四、依強制執行法第18條第2項裁定如主文。\n中    華    民    國   100    年    8     月    2     日\n                  民事第一庭    法  官  黃倩玲\n以上正本係照原本作成。\n如對本裁定抗告，須於裁定送達後10日內向本院提出抗告狀。\n中    華    民    國   100    年    8     月    2     日\n                                書記官  黃幼華",
  "structure": {
    "main": "聲請人供擔保新臺幣貳拾陸萬肆仟參佰參拾參元後，本院99年度\n司執字第17761號執行事件之強制執行程序，於本院100年度訴字\n603號債務人異議之訴等事件判決確定、和解或撤回起訴前應暫\n予停止。",
    "reason": "一、按有回復原狀之聲請或提起再審或異議之訴，或對於和解為\n    繼續審判之請求，或提起宣告調解無效之訴，撤銷調解之訴\n    ，或對於法院因強制執行法第 4條第1項第5款之裁定提起抗\n    告時，法院因必要情形，或依聲請定相當並確實之擔保，得\n    為停止強制執行之裁定，強制執行法第18 條第2項定有明文\n    。\n二、本件聲請人以其於100年7月14日向本院提起債務人異議之訴\n    為理由，聲請裁定停止99年度司執字第17761號清償債務強\n    制執行事件之強制執行程序。\n三、經本院審酌強制執行聲請狀及前開100年度訴字第603號債務\n    人異議之訴事件卷宗審究後，認為聲請人之聲請為有理由，\n    應予准許。茲審酌上開執行事件聲請執行債權額為新臺幣（\n    下同）1,220,000元，相對人因本件停止執行所受損害，相\n    當於1,220,000元延後受償之法定遲延利息，至於相對人延\n    後受償期間，應視該債務人異議之訴何時確定為斷，由於何\n    時確定尚無定論，本院認以該訴訟至第3審確定之時間，即\n    依各級法院辦案期限實施要點所規定各審級辦案期限（即第\n    1 審1年4個月，第2審2年，第3審1年）估計為4年4個月，並\n    以法定遲延利息利率即年息百分之5計算，故認聲請人應供\n    擔保金264,333元（計算式：1,220,000×0.05×52 /12＝26\n    4,333）為適當，裁定如主文所示。\n四、依強制執行法第18條第2項裁定如主文。"
  },
  "search": "臺灣彰化地方法院民事裁定100年度聲更字第1號聲請人胡靜蓉相對人李彥樺上列當事人間因停止執行事件，聲請人對於民國100年7月20日本院100年度聲字第69號裁定提起抗告，經台灣高等法院台中分院廢棄原裁定發回（100年度抗字第334號），本院裁定如下：主文聲請人供擔保新臺幣貳拾陸萬肆仟參佰參拾參元後，本院99年度司執字第17761號執行事件之強制執行程序，於本院100年度訴字603號債務人異議之訴等事件判決確定、和解或撤回起訴前應暫予停止。理由一、按有回復原狀之聲請或提起再審或異議之訴，或對於和解為繼續審判之請求，或提起宣告調解無效之訴，撤銷調解之訴，或對於法院因強制執行法第4條第1項第5款之裁定提起抗告時，法院因必要情形，或依聲請定相當並確實之擔保，得為停止強制執行之裁定，強制執行法第18條第2項定有明文。二、本件聲請人以其於100年7月14日向本院提起債務人異議之訴為理由，聲請裁定停止99年度司執字第17761號清償債務強制執行事件之強制執行程序。三、經本院審酌強制執行聲請狀及前開100年度訴字第603號債務人異議之訴事件卷宗審究後，認為聲請人之聲請為有理由，應予准許。茲審酌上開執行事件聲請執行債權額為新臺幣（下同）1,220,000元，相對人因本件停止執行所受損害，相當於1,220,000元延後受償之法定遲延利息，至於相對人延後受償期間，應視該債務人異議之訴何時確定為斷，由於何時確定尚無定論，本院認以該訴訟至第3審確定之時間，即依各級法院辦案期限實施要點所規定各審級辦案期限（即第1審1年4個月，第2審2年，第3審1年）估計為4年4個月，並以法定遲延利息利率即年息百分之5計算，故認聲請人應供擔保金264,333元（計算式：1,220,000×0.05×52/12＝264,333）為適當，裁定如主文所示。四、依強制執行法第18條第2項裁定如主文。中華民國100年8月2日民事第一庭法官黃倩玲以上正本係照原本作成。如對本裁定抗告，須於裁定送達後10日內向本院提出抗告狀。中華民國100年8月2日書記官黃幼華",
  "characters": {
    "judges": [
      "黃倩玲"
    ],
    "prosecutors": [

    ],
    "lawyers": [

    ],
    "clerks": [

    ],
    "plaintiffs": [

    ],
    "defendants": [

    ],
    "prosecutor_office": [
      "胡靜蓉"
    ],
    "creditors": [

    ],
    "debtors": [

    ],
    "judicial_associate_officer": [

    ]
  },
  "adjudged_at": "2011-08-02",
  "created_at": "2016-02-12 19:01:10",
  "updated_at": "2016-02-12 19:01:10"
}