{
  "identify": "ILD-100-聲-503-20110802-1",
  "court": {
    "name": "臺灣宜蘭地方法院",
    "code": "ILD"
  },
  "division": {
    "name": "刑事",
    "code": "M"
  },
  "year": 100,
  "word": "聲",
  "number": "503",
  "jcheck": "1",
  "reason": "保護管束",
  "content": "臺灣宜蘭地方法院刑事裁定              100年度聲字第503號\n聲  請  人  臺灣宜蘭地方法院檢察署檢察官\n受  刑  人  邱韶瑋\n上列受刑人因強盜案件，聲請人聲請付保護管束（100年度執聲\n字第346號），本院裁定如下：\n    主  文\n邱韶瑋假釋中付保護管束。\n    理  由\n一、聲請意旨略以：受刑人邱韶瑋因強盜案件，現在法務部矯正\n    署宜蘭監獄執行中，經呈奉核准假釋在案，爰依刑法第93條\n    第2項及刑事訴訟法第481條聲請假釋中應付保護管束之裁定\n    等語。\n二、經查：受刑人邱韶瑋因強盜案件，為本院95年度訴字第517\n    號判決處有期徒刑6年確定，現在法務部矯正署宜蘭監獄執\n    行中，其刑滿日期原為民國102年6月19日，經依行刑累進處\n    遇條例縮刑80日後，其刑期終了日為102年3月31日，業經法\n    務部以100年7月29日法授矯字第1000116876號函核准假釋出\n    獄，有臺灣高等法院被告前案紀錄表及法務部矯正署宜蘭監\n    獄假釋出獄人交付保護管束名冊在卷可稽，本院審核相關文\n    件，認聲請人之聲請為正當，爰依刑事訴訟法第481條第1項\n    、刑法第93條第2項、第96條但書，裁定如主文。\n中    華    民    國   100    年    8     月    2     日\n                  刑事第三庭  法  官  陳映佐\n以上正本證明與原本無異。\n如不服本裁定，應於裁定送達後5日內，向本院提出抗告狀。（\n應附繕本）\n                              書記官  翁靜儀\n中    華    民    國   100    年    8     月    2     日",
  "structure": {
    "main": "邱韶瑋假釋中付保護管束。",
    "reason": "一、聲請意旨略以：受刑人邱韶瑋因強盜案件，現在法務部矯正\n    署宜蘭監獄執行中，經呈奉核准假釋在案，爰依刑法第93條\n    第2項及刑事訴訟法第481條聲請假釋中應付保護管束之裁定\n    等語。\n二、經查：受刑人邱韶瑋因強盜案件，為本院95年度訴字第517\n    號判決處有期徒刑6年確定，現在法務部矯正署宜蘭監獄執\n    行中，其刑滿日期原為民國102年6月19日，經依行刑累進處\n    遇條例縮刑80日後，其刑期終了日為102年3月31日，業經法\n    務部以100年7月29日法授矯字第1000116876號函核准假釋出\n    獄，有臺灣高等法院被告前案紀錄表及法務部矯正署宜蘭監\n    獄假釋出獄人交付保護管束名冊在卷可稽，本院審核相關文\n    件，認聲請人之聲請為正當，爰依刑事訴訟法第481條第1項\n    、刑法第93條第2項、第96條但書，裁定如主文。"
  },
  "search": "臺灣宜蘭地方法院刑事裁定100年度聲字第503號聲請人臺灣宜蘭地方法院檢察署檢察官受刑人邱韶瑋上列受刑人因強盜案件，聲請人聲請付保護管束（100年度執聲字第346號），本院裁定如下：主文邱韶瑋假釋中付保護管束。理由一、聲請意旨略以：受刑人邱韶瑋因強盜案件，現在法務部矯正署宜蘭監獄執行中，經呈奉核准假釋在案，爰依刑法第93條第2項及刑事訴訟法第481條聲請假釋中應付保護管束之裁定等語。二、經查：受刑人邱韶瑋因強盜案件，為本院95年度訴字第517號判決處有期徒刑6年確定，現在法務部矯正署宜蘭監獄執行中，其刑滿日期原為民國102年6月19日，經依行刑累進處遇條例縮刑80日後，其刑期終了日為102年3月31日，業經法務部以100年7月29日法授矯字第1000116876號函核准假釋出獄，有臺灣高等法院被告前案紀錄表及法務部矯正署宜蘭監獄假釋出獄人交付保護管束名冊在卷可稽，本院審核相關文件，認聲請人之聲請為正當，爰依刑事訴訟法第481條第1項、刑法第93條第2項、第96條但書，裁定如主文。中華民國100年8月2日刑事第三庭法官陳映佐以上正本證明與原本無異。如不服本裁定，應於裁定送達後5日內，向本院提出抗告狀。（應附繕本）書記官翁靜儀中華民國100年8月2日",
  "characters": {
    "judges": [
      "陳映佐"
    ],
    "prosecutors": [

    ],
    "lawyers": [

    ],
    "clerks": [
      "翁靜儀"
    ],
    "plaintiffs": [

    ],
    "defendants": [

    ],
    "prosecutor_office": [
      "臺灣宜蘭地方法院檢察署檢察官"
    ],
    "creditors": [

    ],
    "debtors": [

    ],
    "judicial_associate_officer": [

    ]
  },
  "adjudged_at": "2011-08-02",
  "created_at": "2016-02-12 19:03:26",
  "updated_at": "2016-02-12 19:03:26"
}