{
  "identify": "TPD-99-司聲-1904-20110208-1",
  "court": {
    "name": "臺灣臺北地方法院",
    "code": "TPD"
  },
  "division": {
    "name": "民事",
    "code": "V"
  },
  "year": 99,
  "word": "司聲",
  "number": "1904",
  "jcheck": "1",
  "reason": "返還提存物",
  "content": "臺灣臺北地方法院民事裁定            99年度司聲字第1904號\n聲  請  人  上海商業儲蓄銀行股份有限公司\n法定代理人  邱怡仁\n代  理  人  陳韻如\n相  對  人  張美香\n            林伯芳即林進態之遺產管理人\n上列聲請人聲請返還提存物事件，本院裁定如下：\n    主  文\n本院九十四年度存字第二九八○號提存事件聲請人所提存之新臺\n幣貳佰萬元整，准予返還。\n    理  由\n一、按訴訟終結後，供擔保人證明已定20日以上之期間，催告受\n    擔保利益人行使權利而不行使者，法院應依供擔保人之聲請\n    ，以裁定命返還其提存物，民事訴訟法第104條第1項第3款\n    前段定有明文。上開規定，於其他依法令供訴訟上之擔保者\n    準用之，並為同法第106條所規定。所謂訴訟終結，包括執\n    行程序終結；於假扣押執行事件，如供擔保之債權人已撤回\n    假扣押之執行，其撤回執行距其收受為執行名義之假扣押裁\n    定已逾30日，依強制執行法第132條第3項規定已不得再聲請\n    強制執行者，亦可認為訴訟終結。\n二、本件聲請意旨略以：聲請人與相對人間假扣押事件，聲請人\n    前遵鈞院92年度裁全字第7423號民事裁定，為擔保假扣押，\n    曾提存新臺幣（下同）200萬元，並以鈞院92年度存字第421\n    0號提存事件提存，嗣經變換提存物，現以鈞院94年度存字\n    第2980號提存事件提存200萬元在案；茲因聲請人已聲請撤\n    銷假扣押裁定及撤回假扣押執行之聲請，該假扣押程序業已\n    終結，並經聲請人聲請鈞院定25日期間通知受擔保利益人即\n    相對人行使權利而其迄未行使，爰聲請返還本件提存物，並\n    提出假扣押裁定、提存書、撤銷假扣押裁定、確定證明書、\n    民事撤回假扣押強制執行聲請狀及本院民事庭通知相對人行\n    使權利函等件影本為證。\n三、經本院依職權調閱本院92年度存字第4210號、94年度存字第\n    2980號、92年度執全字第2696號、92年度執全字第2572號、\n    94年度執字第28485號、99年度司聲字第1302號及臺灣板橋\n    地方法院98年度財管字第113號事件卷宗，聲請人業已撤回\n    對相對人之假扣押執行，且詎聲請人收受假扣押裁定已逾30\n    日，按諸上開說明，聲請人已不得再聲請執行，應認訴訟已\n    終結。相對人迄未對聲請人行使權利，亦有本院民事紀錄科\n    查詢表附卷可稽。從而，聲請人聲請返還本件提存物，經核\n    於法尚無不合，應予准許。\n四、如不服本裁定，應於裁定送達後10日內，以書狀向本院司法\n    事務官提出異議。\n【本件聯絡人：康股書記官（02）00000000分機6049】\n中    華    民    國    100    年    2    月    8    日\n                  民事第一庭    司法事務官  劉瑞宗",
  "structure": {
    "main": "本院九十四年度存字第二九八○號提存事件聲請人所提存之新臺\n幣貳佰萬元整，准予返還。",
    "reason": "一、按訴訟終結後，供擔保人證明已定20日以上之期間，催告受\n    擔保利益人行使權利而不行使者，法院應依供擔保人之聲請\n    ，以裁定命返還其提存物，民事訴訟法第104條第1項第3款\n    前段定有明文。上開規定，於其他依法令供訴訟上之擔保者\n    準用之，並為同法第106條所規定。所謂訴訟終結，包括執\n    行程序終結；於假扣押執行事件，如供擔保之債權人已撤回\n    假扣押之執行，其撤回執行距其收受為執行名義之假扣押裁\n    定已逾30日，依強制執行法第132條第3項規定已不得再聲請\n    強制執行者，亦可認為訴訟終結。\n二、本件聲請意旨略以：聲請人與相對人間假扣押事件，聲請人\n    前遵鈞院92年度裁全字第7423號民事裁定，為擔保假扣押，\n    曾提存新臺幣（下同）200萬元，並以鈞院92年度存字第421\n    0號提存事件提存，嗣經變換提存物，現以鈞院94年度存字\n    第2980號提存事件提存200萬元在案；茲因聲請人已聲請撤\n    銷假扣押裁定及撤回假扣押執行之聲請，該假扣押程序業已\n    終結，並經聲請人聲請鈞院定25日期間通知受擔保利益人即\n    相對人行使權利而其迄未行使，爰聲請返還本件提存物，並\n    提出假扣押裁定、提存書、撤銷假扣押裁定、確定證明書、\n    民事撤回假扣押強制執行聲請狀及本院民事庭通知相對人行\n    使權利函等件影本為證。\n三、經本院依職權調閱本院92年度存字第4210號、94年度存字第\n    2980號、92年度執全字第2696號、92年度執全字第2572號、\n    94年度執字第28485號、99年度司聲字第1302號及臺灣板橋\n    地方法院98年度財管字第113號事件卷宗，聲請人業已撤回\n    對相對人之假扣押執行，且詎聲請人收受假扣押裁定已逾30\n    日，按諸上開說明，聲請人已不得再聲請執行，應認訴訟已\n    終結。相對人迄未對聲請人行使權利，亦有本院民事紀錄科\n    查詢表附卷可稽。從而，聲請人聲請返還本件提存物，經核\n    於法尚無不合，應予准許。\n四、如不服本裁定，應於裁定送達後10日內，以書狀向本院司法\n    事務官提出異議。\n【本件聯絡人：康股書記官（02）00000000分機6049】"
  },
  "search": "臺灣臺北地方法院民事裁定99年度司聲字第1904號聲請人上海商業儲蓄銀行股份有限公司法定代理人邱怡仁代理人陳韻如相對人張美香林伯芳即林進態之遺產管理人上列聲請人聲請返還提存物事件，本院裁定如下：主文本院九十四年度存字第二九八○號提存事件聲請人所提存之新臺幣貳佰萬元整，准予返還。理由一、按訴訟終結後，供擔保人證明已定20日以上之期間，催告受擔保利益人行使權利而不行使者，法院應依供擔保人之聲請，以裁定命返還其提存物，民事訴訟法第104條第1項第3款前段定有明文。上開規定，於其他依法令供訴訟上之擔保者準用之，並為同法第106條所規定。所謂訴訟終結，包括執行程序終結；於假扣押執行事件，如供擔保之債權人已撤回假扣押之執行，其撤回執行距其收受為執行名義之假扣押裁定已逾30日，依強制執行法第132條第3項規定已不得再聲請強制執行者，亦可認為訴訟終結。二、本件聲請意旨略以：聲請人與相對人間假扣押事件，聲請人前遵鈞院92年度裁全字第7423號民事裁定，為擔保假扣押，曾提存新臺幣（下同）200萬元，並以鈞院92年度存字第4210號提存事件提存，嗣經變換提存物，現以鈞院94年度存字第2980號提存事件提存200萬元在案；茲因聲請人已聲請撤銷假扣押裁定及撤回假扣押執行之聲請，該假扣押程序業已終結，並經聲請人聲請鈞院定25日期間通知受擔保利益人即相對人行使權利而其迄未行使，爰聲請返還本件提存物，並提出假扣押裁定、提存書、撤銷假扣押裁定、確定證明書、民事撤回假扣押強制執行聲請狀及本院民事庭通知相對人行使權利函等件影本為證。三、經本院依職權調閱本院92年度存字第4210號、94年度存字第2980號、92年度執全字第2696號、92年度執全字第2572號、94年度執字第28485號、99年度司聲字第1302號及臺灣板橋地方法院98年度財管字第113號事件卷宗，聲請人業已撤回對相對人之假扣押執行，且詎聲請人收受假扣押裁定已逾30日，按諸上開說明，聲請人已不得再聲請執行，應認訴訟已終結。相對人迄未對聲請人行使權利，亦有本院民事紀錄科查詢表附卷可稽。從而，聲請人聲請返還本件提存物，經核於法尚無不合，應予准許。四、如不服本裁定，應於裁定送達後10日內，以書狀向本院司法事務官提出異議。【本件聯絡人：康股書記官（02）00000000分機6049】中華民國100年2月8日民事第一庭司法事務官劉瑞宗",
  "characters": {
    "judges": [

    ],
    "prosecutors": [

    ],
    "lawyers": [

    ],
    "clerks": [

    ],
    "plaintiffs": [

    ],
    "defendants": [

    ],
    "prosecutor_office": [
      "上海商業儲蓄銀行股份有限公司"
    ],
    "creditors": [

    ],
    "debtors": [

    ],
    "judicial_associate_officer": [
      "劉瑞宗"
    ]
  },
  "adjudged_at": "2011-02-08",
  "created_at": "2016-02-12 05:14:23",
  "updated_at": "2016-02-12 05:14:23"
}