{
  "identify": "TPD-100-司促-2199-20110131-1",
  "court": {
    "name": "臺灣臺北地方法院",
    "code": "TPD"
  },
  "division": {
    "name": "民事",
    "code": "V"
  },
  "year": 100,
  "word": "司促",
  "number": "2199",
  "jcheck": "1",
  "reason": "支付命令",
  "content": "臺灣臺北地方法院支付命令           100年度司促字第2199號\n聲  請  人\n即債權人    中國信託商業銀行股份有限公司\n法定代理人  辜松\n相  對  人\n即債務人    陳忠生\n一、債務人應向債權人清償新臺幣拾肆萬陸仟捌佰陸拾肆元，\n    及其中新臺幣壹拾柒萬柒仟貳佰玖拾壹元，自民國一百年一\n    月二十七日起至清償日止，按年息百分之二十計算之利息，\n    並賠償督促程序費用新臺幣伍佰元，否則應於本命令送達後\n    二十日之不變期間內，向本院提出異議。\n二、債權人請求之原因事實如附件所載。\n三、如債務人未於第一項期間內提出異議，本命令與確定判決有\n    同一效力。\n中    華    民    國   100    年    1     月    31    日\n                  民事庭司法事務官  鄧仁誠\n    附件：\n    債權人請求之原因事實（100年度司促字第2199號）\n    （一）、債務人陳忠生向債權人請領信用卡使用，依約債務\n            人即得於特約商店記帳消費。卡號：000000000000\n            0000卡別：MasterCard。債務人至100 年1 月26日\n            止累計346,864 元正未給付，其中177,291 元為消\n            費款；165,973 元為循環利息；3, 600元為依約定\n            條款計算之其他費用。債務人依約除應給付上開款\n            項外，另應給付如附表所示之利息。\n    （二）、本件係請求給付一定數量之金額債務，而所請求之\n            標的，茲為求清償之簡速，以免判決程序之繁雜起\n            見，特依民事訴訟法第五○八條之規定，狀請鈞院\n            依督促程序迅賜對相對人發支付命令，實為法便。",
  "structure": {
  },
  "search": "臺灣臺北地方法院支付命令100年度司促字第2199號聲請人即債權人中國信託商業銀行股份有限公司法定代理人辜松相對人即債務人陳忠生一、債務人應向債權人清償新臺幣拾肆萬陸仟捌佰陸拾肆元，及其中新臺幣壹拾柒萬柒仟貳佰玖拾壹元，自民國一百年一月二十七日起至清償日止，按年息百分之二十計算之利息，並賠償督促程序費用新臺幣伍佰元，否則應於本命令送達後二十日之不變期間內，向本院提出異議。二、債權人請求之原因事實如附件所載。三、如債務人未於第一項期間內提出異議，本命令與確定判決有同一效力。中華民國100年1月31日民事庭司法事務官鄧仁誠附件：債權人請求之原因事實（100年度司促字第2199號）（一）、債務人陳忠生向債權人請領信用卡使用，依約債務人即得於特約商店記帳消費。卡號：0000000000000000卡別：MasterCard。債務人至100年1月26日止累計346,864元正未給付，其中177,291元為消費款；165,973元為循環利息；3,600元為依約定條款計算之其他費用。債務人依約除應給付上開款項外，另應給付如附表所示之利息。（二）、本件係請求給付一定數量之金額債務，而所請求之標的，茲為求清償之簡速，以免判決程序之繁雜起見，特依民事訴訟法第五○八條之規定，狀請鈞院依督促程序迅賜對相對人發支付命令，實為法便。",
  "characters": {
    "judges": [

    ],
    "prosecutors": [

    ],
    "lawyers": [

    ],
    "clerks": [

    ],
    "plaintiffs": [

    ],
    "defendants": [

    ],
    "prosecutor_office": [

    ],
    "creditors": [
      "中國信託商業銀行股份有限公司"
    ],
    "debtors": [

    ],
    "judicial_associate_officer": [
      "鄧仁誠"
    ]
  },
  "adjudged_at": "2011-01-31",
  "created_at": "2016-02-13 05:58:22",
  "updated_at": "2016-02-13 05:58:22"
}