{
  "identify": "KSD-100-司促-10370-20110315-3",
  "court": {
    "name": "臺灣高雄地方法院",
    "code": "KSD"
  },
  "division": {
    "name": "民事",
    "code": "V"
  },
  "year": 100,
  "word": "司促",
  "number": "10370",
  "jcheck": "3",
  "reason": "支付命令",
  "content": "臺灣高雄地方法院支付命令          100年度司促字第10370號\n債  權  人  台北富邦商業銀行股份有限公司\n法定代理人  韓蔚廷\n債  務  人  張堯山\n一、債務人應向債權人清償新臺幣陸萬貳仟柒佰貳拾元，及自民\n    國一百年二月十四日起至清償日止，按年息百分之十一點三\n    三計算之利息，暨自民國一百年三月十五日起至清償日止，\n    其逾期在六個月以內者，按上開利率百分之十，逾期超過六\n    個月者，按上開利率百分之二十計算之違約金，並賠償督促\n    程序費用新臺幣伍佰元，否則應於本命令送達後二十日之不\n    變期間內，向本院提出異議。\n二、債權人請求之原因事實：\n    （一）緣債務人張堯山於民國（以下同）94年6月20日，向\n    聲請人借款新臺幣（以下同）15萬元整，借款期限自94年6\n    月20日起至97年6月19日止，利息按年利率11.33%計算，並\n    應按月攤還本息。如有任何一期本金或利息未如期攤還，其\n    債務即視為全部到期，借款人喪失期限之利益，遲延履行給\n    付本金或利息時，除仍按上開利率計息外，其逾期在六個月\n    以內償還者，按上開利率10%；逾期六個月以上者，其超過\n    六個月部份按上開利率20%加付違約金。\n    （二）詎料債務人等就上開借款之本息僅繳息至自100年2月\n    14日起即未依約清償債務本息，經聲請人迭次催討，相對人\n    等均置之不理，依約相對人等已喪失期限利益，全部債務視\n    為到期，聲請人得向相對人等請求全數清償。\n三、如債務人未於第一項期間內提出異議，本命令與確定判決有\n    同一效力。\n中    華    民    國   100    年    3     月    15    日\n                        民事庭司法事務官  周士翔\n附註：\n一、案件一經確定本院即依職權核發確定證明書，債權人毋庸具\n    狀申請。\n二、嗣後遞狀應註明案號及股別。",
  "structure": {
  },
  "search": "臺灣高雄地方法院支付命令100年度司促字第10370號債權人台北富邦商業銀行股份有限公司法定代理人韓蔚廷債務人張堯山一、債務人應向債權人清償新臺幣陸萬貳仟柒佰貳拾元，及自民國一百年二月十四日起至清償日止，按年息百分之十一點三三計算之利息，暨自民國一百年三月十五日起至清償日止，其逾期在六個月以內者，按上開利率百分之十，逾期超過六個月者，按上開利率百分之二十計算之違約金，並賠償督促程序費用新臺幣伍佰元，否則應於本命令送達後二十日之不變期間內，向本院提出異議。二、債權人請求之原因事實：（一）緣債務人張堯山於民國（以下同）94年6月20日，向聲請人借款新臺幣（以下同）15萬元整，借款期限自94年6月20日起至97年6月19日止，利息按年利率11.33%計算，並應按月攤還本息。如有任何一期本金或利息未如期攤還，其債務即視為全部到期，借款人喪失期限之利益，遲延履行給付本金或利息時，除仍按上開利率計息外，其逾期在六個月以內償還者，按上開利率10%；逾期六個月以上者，其超過六個月部份按上開利率20%加付違約金。（二）詎料債務人等就上開借款之本息僅繳息至自100年2月14日起即未依約清償債務本息，經聲請人迭次催討，相對人等均置之不理，依約相對人等已喪失期限利益，全部債務視為到期，聲請人得向相對人等請求全數清償。三、如債務人未於第一項期間內提出異議，本命令與確定判決有同一效力。中華民國100年3月15日民事庭司法事務官周士翔附註：一、案件一經確定本院即依職權核發確定證明書，債權人毋庸具狀申請。二、嗣後遞狀應註明案號及股別。",
  "characters": {
    "judges": [

    ],
    "prosecutors": [

    ],
    "lawyers": [

    ],
    "clerks": [

    ],
    "plaintiffs": [

    ],
    "defendants": [

    ],
    "prosecutor_office": [

    ],
    "creditors": [
      "台北富邦商業銀行股份有限公司"
    ],
    "debtors": [
      "張堯山"
    ],
    "judicial_associate_officer": [
      "周士翔"
    ]
  },
  "adjudged_at": "2011-03-15",
  "created_at": "2016-02-13 19:27:59",
  "updated_at": "2016-02-13 19:27:59"
}