{
  "identify": "TNH-100-上易-178-20110622-1",
  "court": {
    "name": "臺灣高等法院",
    "code": "TNH"
  },
  "division": {
    "name": "刑事",
    "code": "M"
  },
  "year": 100,
  "word": "上易",
  "number": "178",
  "jcheck": "1",
  "reason": "妨害名譽",
  "content": "臺灣高等法院臺南分院刑事判決        100年度上易字第178號\n上  訴  人\n即  被  告  楊肇\n輔  佐  人  楊治民\n上列上訴人因妨害名譽案件，不服臺灣嘉義地方法院99年度易字\n第924號中華民國100年2 月11日第一審判決（起訴案號：臺灣嘉\n義地方法院檢察署99年度偵字第8720號），提起上訴，本院判決\n如下：\n    主  文\n上訴駁回。\n    事  實\n一、緣「諾那華藏精舍嘉義道場」於民國99年10月10日舉辦至南\n    投縣埔里鎮一日遊（放生、蹺塔、誦經）活動，楊肇、鄭芙\n    蓉夫婦與張耀華均有參加並同坐一部遊覽車上，於99年10月\n    10日上午8 時許，楊肇、張耀華在同部遊覽車上因拿取早餐\n    之事發生口角，楊肇竟基於侮辱他人名譽之犯意，公然在滿\n    座的遊覽車上，於特定多數人得以共見共聞之情況下，向張\n    耀華（42年4 月23日生）丟擲三明治，並大聲辱罵：「張耀\n    華妳不要臉」等語數次，足生損害於張耀華之名譽。\n二、案經被害人張耀華訴由臺灣嘉義地方法院檢察署檢察官偵查\n    起訴。\n    理  由\n壹、證據能力方面\n    按被告以外之人於審判外之言詞或書面陳述，除法律有規定\n    者外，不得作為證據；又被告以外之人於審判外之陳述，雖\n    不符合同法第159條之1至第159條之4之規定，但經當事人於\n    審判程序同意作為證據，法院審酌該言詞陳述或書面陳述作\n    成時之情況，認為適當者，亦得為證據。當事人、代理人或\n    辯護人於法院調查證據時，知有第159條第1項不得為證據之\n    情形，而未於言詞辯論終結前聲明異議者，視為有前項之同\n    意，刑事訴訟法第159條第1項及第159條之5分別定有明文。\n    經查，本判決下列所引用之被告以外之人於審判外之陳述（\n    包含書面陳述），雖屬傳聞證據部分，業經檢察官、被告、\n    輔佐人於本院準備程序及審判期日中均明示同意此部分之證\n    據有證據能力（見本院卷第27頁、28頁、141 頁），且迄至\n    言詞辯論終結前亦未撤回前開同意，本院審酌上開證據資料\n    製作時之情況，製作當時之過程、內容、功能等情況，其取\n    得並無違法情形，具備合法可信之適當性保障，經綜合判斷\n    ，與本件犯罪待證事實，具有關連性，核無可信度明顯過低\n    之情事，且認為以之作為證據應屬適當，爰依刑事訴訟法第\n    159條之5規定，認前揭證據資料均有證據能力。\n貳、認定犯罪事實所憑之證據及理由\n一、訊據被告楊肇否認有何公然悔辱之犯行，辯稱：事發當日係\n    因告訴人張耀華先霸佔遊覽車前6 排的位置，不讓伊夫妻坐\n    ，事後又無故阻止主辦人發早餐給伊妻子楊鄭芙蓉，伊沒有\n    對告訴人丟三明治。伊係因自衛，保護合法權益而與告訴人\n    發生口角，伊記不清楚有沒有罵告訴人，而告訴人有罵伊「\n    老不修」等語。\n二、經查：\n(一)、被告楊肇於原審準備程序訊問時業已供承伊有講「張耀華妳\n    不要臉」那句話乙節不諱，而上開犯罪事實，亦經證人即告\n    訴人張耀華於原審審理中結證稱：「上車時師姊有說，吃過\n    早餐與拿過早餐的人不要再拿了，然後被告太太已經拿過了\n    ，還要拿，我就小聲的跟她講，還拍她一下說『有拿過就好\n    ，不要再拿』，他太太說沒有拿過，之後被告楊肇就站起來\n    ，被告就拿著三明治往我身上丟。接著就一直罵我『張耀華\n    妳不要臉』、『張耀華妳不要臉』、『張耀華妳不要臉』，\n    大小聲的一直罵。他不僅罵我，還用手一直指我。」、「（\n    問：你們車上約有多少人？）滿座，約有40人左右。」等語\n    明確（見原審卷第38頁、39頁），核與證人張素梅、李麗花\n    於偵查中及原審審理中之證述情節互核相符（見他字偵查卷\n    第13頁、偵字偵查卷第7頁、8頁、原審卷第41頁、第44頁）\n    ，按證人張素梅、李麗花與被告並無仇恨，並經具結在卷，\n    實無甘冒偽證罪責追訴之風險，而為虛偽陳述，證人張素梅\n    、李麗花之證述應堪採信，足認被告確有於上開時、地，因\n    拿取早餐之事與告訴人發生口角，而在滿座的遊覽車上，向\n    告訴人丟擲三明治，並對告訴人辱罵：「張耀華妳不要臉」\n    等語數次之事實，應堪認定。\n(二)、另證人江春儀於本院審理時證述：「（99年10月10日你有去\n    埔里？）有。」、「兩輛，我搭第二輛，就是與被告、李麗\n    花、李麗花的女兒同一輛車。」、「（99年10月10日是何人\n    邀你去的？）諾那華藏精舍嘉義助念團舉辦，我是常住幹部\n    ，這次是團長召集的，團長叫做『蔡爾高』，蔡爾高也與我\n    們同車。」、「（當天張素梅有無去？）有，張素梅也與我\n    同車。」、「我提出的證明，李麗花就在剛剛照片裡面。」\n    、「我有與楊肇同車，車號是923-FF，司機王志欽。」、「\n    （出遊的名單？）楊肇、鄭芙蓉有報名參加，在第二份資料\n    來電取消，第三份沒有楊肇與鄭芙蓉的名字，但他們也上車\n    ，所以我辦的不是很好。」等語（見本院卷第67頁、68頁、\n    70頁、71頁），並提出當時活動報名表等件為證（見本院卷\n    第85頁至122 頁），足見「諾那華藏精舍嘉義道場」於99年\n    10月10日舉辦至南投縣埔里鎮一日遊（放生、蹺塔、誦經）\n    活動，證人江春儀、李麗花、張素梅確有與被告楊肇、證人\n    鄭芙蓉同車，證人胡金枝於本院審理時亦證述：「（當天一\n    共幾輛遊覽車？）兩輛。」、「（你有與被告同車？）有。\n    」、「（你坐在第幾排？）忘記了，但我坐在被告的前面一\n    排。」、「（你有看到被告和告訴人發生爭執？）有。大聲\n    講，小聲叫。」、「我記得為了一些吃的東西，本來沒有提\n    供食物，結果有人提供每人一個包子，不知道是否為了包子\n    的事情，大聲講，小聲叫，在那邊罵，我知道的就是這樣。\n    」、「（被告有無罵告訴人？）當然有。」、「【提示告訴\n    人今日提出之照片】（這些照片是否你們99年10月10日去玩\n    ，所拍攝的照片？）是去這邊玩沒錯。」、「（這些照片，\n    裡面是否有拍攝到你？）有。其中穿黃色上衣的人是我。」\n    、「【提示大張的列印照片】（這些照片是否你們99年10月\n    10日所拍攝的照片？）是。」、「（其中一張相片，是在作\n    什麼儀式？）這就是放生的活動。就是將泥鰍放在一個孔，\n    該孔通河川，就是放生在清水的排水溝。」、「就是他們兩\n    個發生衝突，被告就是在罵告訴人，車上只有他們兩人發生\n    衝突，只有你父親在那邊罵，罵什麼我不曉得。」等語（見\n    本院卷第60頁、61頁、64頁、65頁），足認證人胡金枝確有\n    參加99年10月10日之活動，並與被告及張耀華坐同部遊覽車\n    ，當日被告在車上確有因早餐之事，與告訴人張耀華發生爭\n    執及出言辱罵告訴人張耀華乙情，亦可認定。證人吳陳素梅\n    於本院審理時亦證述：「【請鈞院提示告訴人上次提出之相\n    片】（穿紅色上衣的張素梅、戴帽子的李麗花、黃色上衣的\n    胡金枝是否有去？）張素梅我有印象，戴帽子的李麗花看不\n    清楚，黃色上衣的胡金枝有印象。」、「（張素梅、胡金枝\n    你剛剛有認出，他們兩人有無跟你同一部車？）有。」、「\n    （有無聽到楊肇向張耀華說『不要臉』？）好像有這樣的事\n    情，很大聲一直喊。」、「（你剛提到，你與張耀華之前就\n    認識，當天的印象都是很模糊，楊肇罵張耀華，你印象有這\n    件事情，但張耀華罵我父親，你肯定沒有，你是否確定你說\n    的是事實？）是。我是照我所見所聞說的。」等語（見本院\n    卷第143頁、144頁、146 頁），足見證人張素梅、胡金枝確\n    有參加99年10月10日之活動，益證被告於上開時、地確有向\n    張耀華大聲辱罵：「張耀華妳不要臉」乙節，且被告楊肇確\n    實亦有參加當日活動，此有告訴人張耀華提出之照片在卷可\n    證（見本院卷第77頁至79頁），而證人江春儀、胡金枝、吳\n    陳素梅分別結稱證人張素梅、李麗花亦確實有參加99年10月\n    10日之活動，證人吳陳素梅更結證被告確有以上開言詞公然\n    侮辱告訴人張耀華，則被告辯稱：張素梅、李麗花之證述係\n    偽證；照片係偽造云云，應不足採。\n(三)、被告雖辯稱事發當日係因告訴人先霸佔遊覽車前6 排的位置\n    ，不讓伊夫妻坐，事後又無故阻止主辦人發早餐給伊妻子楊\n    鄭芙蓉，伊係因自衛，保護合法權益而與告訴人發生口角，\n    告訴人亦有罵伊「老不修」等語，惟查：\n(1)、證人即告訴人張耀華否認有霸佔遊覽車前6 排的位置或罵被\n    告「老不修」之行為，亦解釋其不讓被告妻子拿早餐係因被\n    告妻子拿過了。證人李麗花於原審審理時證稱：伊坐在車頭\n    第1 排，旁邊坐伊外孫，伊上車時，被告夫妻及告訴人均已\n    就座，沒有人為伊保留第1 排的位置，該車的位置是誰先到\n    就誰先坐，伊上車時，前面幾排的位置只剩第1 排的位置，\n    後方都坐滿了等語（見原審卷第45頁），證人張素梅於原審\n    審理時亦證述：伊坐在被告後方2 排，告訴人被被告辱罵時\n    ，並未反罵告訴人「老不修」等語（見原審卷第41頁、42頁\n    ），足見尚無法證明告訴人張耀華確有霸佔座位或反罵告訴\n    人「老不修」等情。另證人即被告妻子楊鄭芙蓉雖於原審審\n    理時證稱：「張耀華一上車，把東西放在前六排的椅子上，\n    早餐我是先拿一份，後來我再拿一份給我先生時，她不給我\n    們，之後張耀華、楊肇就吵起來，張耀華罵我先生『老不修\n    』，我先生罵什麼我沒有注意聽到。我沒有看到我先生拿三\n    明治丟張耀華。我坐在我先生旁邊。」等語（見原審卷第46\n    頁），惟證人楊鄭芙蓉所為證述，除核與證人張素梅、李麗\n    花、江春儀、胡金枝、吳陳素梅所證述情節不相符合，且係\n    被告之配偶，基於配偶間之親誼關係，證詞難免偏頗，況以\n    其座位就在被告旁邊，何以僅聽到告訴人罵被告，卻未注意\n    被告罵告訴人何話，足見證人鄭芙蓉所為上開證述顯係迴護\n    被告之詞，證人楊鄭芙蓉之證詞，實不足採信、實難認定告\n    訴人確有霸佔座位或辱罵被告「老不修」之行為。\n(2)、按正當防衛必須對於現在不法之侵害始得為之，侵害業已過\n    去，即無正當防衛可言，最高法院30年上字第1040號判例要\n    旨參照。查本件縱認告訴人曾有霸佔座位、阻止主辦人發早\n    餐予被告或辱罵被告「老不修」之行為，姑不論上開霸佔座\n    位，阻止發早餐之行為是否可評價為不法之侵害，倘認係屬\n    不法侵害，該等侵害亦已過去，被告再以「不要臉」等語辱\n    罵告訴人，已不符正當防衛之要件，且衡諸一般人之經驗法\n    則或論理法則，辱罵他人「不要臉」亦無法實質排除任何侵\n    害進而防衛自己或他人的權利，是被告此部分辯解，尚無足\n    採。\n三、綜上所述，被告所辯，不足採信，被告所為公然侮辱之犯行\n    ，足堪認定，本件事證明確，應依法論科。\n參、論罪科刑之理由\n一、按刑法第309 條規定之公然侮辱罪，係因公然表示有貶損他\n    人社會地位即人格價值之虞之個人抽象判斷而成立，則所謂\n    公然，即指使不特定人或多數人得以共見共聞之狀態；而所\n    謂侮辱係指不指摘具體事實，而為可能貶損他人社會評價一\n    切輕蔑之行為，即以使人難堪為目的之一切輕蔑之行為，皆\n    為侮辱。\n二、被告在滿座的遊覽車上，向張耀華丟擲三明治，並大聲辱罵\n    ：「張耀華妳不要臉」等語數次之行為，應屬在多數人得以\n    共見共聞之狀態，而以「張耀華妳不要臉」之言語，足使張\n    耀華難堪，並有貶損其人格價值之虞，核被告所為，係犯刑\n    法第309條第1項之公然侮辱罪。\n肆、本院維持原判決之理由\n一、原判決以被告犯行罪證明確，因予適用刑法第309條第1項、\n    第41條第1項前段，刑法施行法第1條之1 之規定，並審酌被\n    告年逾七十歲，具高中畢業之智識，竟因細故，於滿座的遊\n    覽車上，對告訴人丟擲三明治，並辱罵告訴人「不要臉」，\n    ，並兼衡其犯罪手段、所造成告訴人損害、犯罪後態度及尚\n    未與告訴人和解等一切情狀，量處拘役40日，並諭知易科罰\n    金之折算標準。\n二、本院經核原判決認事用法俱無不合，量刑亦稱妥適，被告上\n    訴意旨猶執前詞否認犯行，因而指摘原判決不當，為無理由\n    ，應予駁回。\n據上論結，應依刑事訴訟法第368條，判決如主文。\n本案經檢察官郭珍妮到庭執行職務。\n中    華    民    國  100    年     6     月    22    日\n                  刑事第四庭    審判長法  官  吳志誠\n                                      法  官  羅心芳\n                                      法  官  吳森豐\n以上正本證明與原本無異。\n不得上訴。\n                                      書記官  岑  玢\n中    華    民    國  100    年     6     月    22    日\n中華民國刑法第309條\n（公然侮辱罪）\n公然侮辱人者，處拘役或 3 百元以下罰金。\n以強暴犯前項之罪者，處 1 年以下有期徒刑、拘役或 5 百元以\n下罰金。",
  "structure": {
    "main": "上訴駁回。",
    "fact": "一、緣「諾那華藏精舍嘉義道場」於民國99年10月10日舉辦至南\n    投縣埔里鎮一日遊（放生、蹺塔、誦經）活動，楊肇、鄭芙\n    蓉夫婦與張耀華均有參加並同坐一部遊覽車上，於99年10月\n    10日上午8 時許，楊肇、張耀華在同部遊覽車上因拿取早餐\n    之事發生口角，楊肇竟基於侮辱他人名譽之犯意，公然在滿\n    座的遊覽車上，於特定多數人得以共見共聞之情況下，向張\n    耀華（42年4 月23日生）丟擲三明治，並大聲辱罵：「張耀\n    華妳不要臉」等語數次，足生損害於張耀華之名譽。\n二、案經被害人張耀華訴由臺灣嘉義地方法院檢察署檢察官偵查\n    起訴。",
    "reason": "壹、證據能力方面\n    按被告以外之人於審判外之言詞或書面陳述，除法律有規定\n    者外，不得作為證據；又被告以外之人於審判外之陳述，雖\n    不符合同法第159條之1至第159條之4之規定，但經當事人於\n    審判程序同意作為證據，法院審酌該言詞陳述或書面陳述作\n    成時之情況，認為適當者，亦得為證據。當事人、代理人或\n    辯護人於法院調查證據時，知有第159條第1項不得為證據之\n    情形，而未於言詞辯論終結前聲明異議者，視為有前項之同\n    意，刑事訴訟法第159條第1項及第159條之5分別定有明文。\n    經查，本判決下列所引用之被告以外之人於審判外之陳述（\n    包含書面陳述），雖屬傳聞證據部分，業經檢察官、被告、\n    輔佐人於本院準備程序及審判期日中均明示同意此部分之證\n    據有證據能力（見本院卷第27頁、28頁、141 頁），且迄至\n    言詞辯論終結前亦未撤回前開同意，本院審酌上開證據資料\n    製作時之情況，製作當時之過程、內容、功能等情況，其取\n    得並無違法情形，具備合法可信之適當性保障，經綜合判斷\n    ，與本件犯罪待證事實，具有關連性，核無可信度明顯過低\n    之情事，且認為以之作為證據應屬適當，爰依刑事訴訟法第\n    159條之5規定，認前揭證據資料均有證據能力。\n貳、認定犯罪事實所憑之證據及理由\n一、訊據被告楊肇否認有何公然悔辱之犯行，辯稱：事發當日係\n    因告訴人張耀華先霸佔遊覽車前6 排的位置，不讓伊夫妻坐\n    ，事後又無故阻止主辦人發早餐給伊妻子楊鄭芙蓉，伊沒有\n    對告訴人丟三明治。伊係因自衛，保護合法權益而與告訴人\n    發生口角，伊記不清楚有沒有罵告訴人，而告訴人有罵伊「\n    老不修」等語。\n二、經查：\n(一)、被告楊肇於原審準備程序訊問時業已供承伊有講「張耀華妳\n    不要臉」那句話乙節不諱，而上開犯罪事實，亦經證人即告\n    訴人張耀華於原審審理中結證稱：「上車時師姊有說，吃過\n    早餐與拿過早餐的人不要再拿了，然後被告太太已經拿過了\n    ，還要拿，我就小聲的跟她講，還拍她一下說『有拿過就好\n    ，不要再拿』，他太太說沒有拿過，之後被告楊肇就站起來\n    ，被告就拿著三明治往我身上丟。接著就一直罵我『張耀華\n    妳不要臉』、『張耀華妳不要臉』、『張耀華妳不要臉』，\n    大小聲的一直罵。他不僅罵我，還用手一直指我。」、「（\n    問：你們車上約有多少人？）滿座，約有40人左右。」等語\n    明確（見原審卷第38頁、39頁），核與證人張素梅、李麗花\n    於偵查中及原審審理中之證述情節互核相符（見他字偵查卷\n    第13頁、偵字偵查卷第7頁、8頁、原審卷第41頁、第44頁）\n    ，按證人張素梅、李麗花與被告並無仇恨，並經具結在卷，\n    實無甘冒偽證罪責追訴之風險，而為虛偽陳述，證人張素梅\n    、李麗花之證述應堪採信，足認被告確有於上開時、地，因\n    拿取早餐之事與告訴人發生口角，而在滿座的遊覽車上，向\n    告訴人丟擲三明治，並對告訴人辱罵：「張耀華妳不要臉」\n    等語數次之事實，應堪認定。\n(二)、另證人江春儀於本院審理時證述：「（99年10月10日你有去\n    埔里？）有。」、「兩輛，我搭第二輛，就是與被告、李麗\n    花、李麗花的女兒同一輛車。」、「（99年10月10日是何人\n    邀你去的？）諾那華藏精舍嘉義助念團舉辦，我是常住幹部\n    ，這次是團長召集的，團長叫做『蔡爾高』，蔡爾高也與我\n    們同車。」、「（當天張素梅有無去？）有，張素梅也與我\n    同車。」、「我提出的證明，李麗花就在剛剛照片裡面。」\n    、「我有與楊肇同車，車號是923-FF，司機王志欽。」、「\n    （出遊的名單？）楊肇、鄭芙蓉有報名參加，在第二份資料\n    來電取消，第三份沒有楊肇與鄭芙蓉的名字，但他們也上車\n    ，所以我辦的不是很好。」等語（見本院卷第67頁、68頁、\n    70頁、71頁），並提出當時活動報名表等件為證（見本院卷\n    第85頁至122 頁），足見「諾那華藏精舍嘉義道場」於99年\n    10月10日舉辦至南投縣埔里鎮一日遊（放生、蹺塔、誦經）\n    活動，證人江春儀、李麗花、張素梅確有與被告楊肇、證人\n    鄭芙蓉同車，證人胡金枝於本院審理時亦證述：「（當天一\n    共幾輛遊覽車？）兩輛。」、「（你有與被告同車？）有。\n    」、「（你坐在第幾排？）忘記了，但我坐在被告的前面一\n    排。」、「（你有看到被告和告訴人發生爭執？）有。大聲\n    講，小聲叫。」、「我記得為了一些吃的東西，本來沒有提\n    供食物，結果有人提供每人一個包子，不知道是否為了包子\n    的事情，大聲講，小聲叫，在那邊罵，我知道的就是這樣。\n    」、「（被告有無罵告訴人？）當然有。」、「【提示告訴\n    人今日提出之照片】（這些照片是否你們99年10月10日去玩\n    ，所拍攝的照片？）是去這邊玩沒錯。」、「（這些照片，\n    裡面是否有拍攝到你？）有。其中穿黃色上衣的人是我。」\n    、「【提示大張的列印照片】（這些照片是否你們99年10月\n    10日所拍攝的照片？）是。」、「（其中一張相片，是在作\n    什麼儀式？）這就是放生的活動。就是將泥鰍放在一個孔，\n    該孔通河川，就是放生在清水的排水溝。」、「就是他們兩\n    個發生衝突，被告就是在罵告訴人，車上只有他們兩人發生\n    衝突，只有你父親在那邊罵，罵什麼我不曉得。」等語（見\n    本院卷第60頁、61頁、64頁、65頁），足認證人胡金枝確有\n    參加99年10月10日之活動，並與被告及張耀華坐同部遊覽車\n    ，當日被告在車上確有因早餐之事，與告訴人張耀華發生爭\n    執及出言辱罵告訴人張耀華乙情，亦可認定。證人吳陳素梅\n    於本院審理時亦證述：「【請鈞院提示告訴人上次提出之相\n    片】（穿紅色上衣的張素梅、戴帽子的李麗花、黃色上衣的\n    胡金枝是否有去？）張素梅我有印象，戴帽子的李麗花看不\n    清楚，黃色上衣的胡金枝有印象。」、「（張素梅、胡金枝\n    你剛剛有認出，他們兩人有無跟你同一部車？）有。」、「\n    （有無聽到楊肇向張耀華說『不要臉』？）好像有這樣的事\n    情，很大聲一直喊。」、「（你剛提到，你與張耀華之前就\n    認識，當天的印象都是很模糊，楊肇罵張耀華，你印象有這\n    件事情，但張耀華罵我父親，你肯定沒有，你是否確定你說\n    的是事實？）是。我是照我所見所聞說的。」等語（見本院\n    卷第143頁、144頁、146 頁），足見證人張素梅、胡金枝確\n    有參加99年10月10日之活動，益證被告於上開時、地確有向\n    張耀華大聲辱罵：「張耀華妳不要臉」乙節，且被告楊肇確\n    實亦有參加當日活動，此有告訴人張耀華提出之照片在卷可\n    證（見本院卷第77頁至79頁），而證人江春儀、胡金枝、吳\n    陳素梅分別結稱證人張素梅、李麗花亦確實有參加99年10月\n    10日之活動，證人吳陳素梅更結證被告確有以上開言詞公然\n    侮辱告訴人張耀華，則被告辯稱：張素梅、李麗花之證述係\n    偽證；照片係偽造云云，應不足採。\n(三)、被告雖辯稱事發當日係因告訴人先霸佔遊覽車前6 排的位置\n    ，不讓伊夫妻坐，事後又無故阻止主辦人發早餐給伊妻子楊\n    鄭芙蓉，伊係因自衛，保護合法權益而與告訴人發生口角，\n    告訴人亦有罵伊「老不修」等語，惟查：\n(1)、證人即告訴人張耀華否認有霸佔遊覽車前6 排的位置或罵被\n    告「老不修」之行為，亦解釋其不讓被告妻子拿早餐係因被\n    告妻子拿過了。證人李麗花於原審審理時證稱：伊坐在車頭\n    第1 排，旁邊坐伊外孫，伊上車時，被告夫妻及告訴人均已\n    就座，沒有人為伊保留第1 排的位置，該車的位置是誰先到\n    就誰先坐，伊上車時，前面幾排的位置只剩第1 排的位置，\n    後方都坐滿了等語（見原審卷第45頁），證人張素梅於原審\n    審理時亦證述：伊坐在被告後方2 排，告訴人被被告辱罵時\n    ，並未反罵告訴人「老不修」等語（見原審卷第41頁、42頁\n    ），足見尚無法證明告訴人張耀華確有霸佔座位或反罵告訴\n    人「老不修」等情。另證人即被告妻子楊鄭芙蓉雖於原審審\n    理時證稱：「張耀華一上車，把東西放在前六排的椅子上，\n    早餐我是先拿一份，後來我再拿一份給我先生時，她不給我\n    們，之後張耀華、楊肇就吵起來，張耀華罵我先生『老不修\n    』，我先生罵什麼我沒有注意聽到。我沒有看到我先生拿三\n    明治丟張耀華。我坐在我先生旁邊。」等語（見原審卷第46\n    頁），惟證人楊鄭芙蓉所為證述，除核與證人張素梅、李麗\n    花、江春儀、胡金枝、吳陳素梅所證述情節不相符合，且係\n    被告之配偶，基於配偶間之親誼關係，證詞難免偏頗，況以\n    其座位就在被告旁邊，何以僅聽到告訴人罵被告，卻未注意\n    被告罵告訴人何話，足見證人鄭芙蓉所為上開證述顯係迴護\n    被告之詞，證人楊鄭芙蓉之證詞，實不足採信、實難認定告\n    訴人確有霸佔座位或辱罵被告「老不修」之行為。\n(2)、按正當防衛必須對於現在不法之侵害始得為之，侵害業已過\n    去，即無正當防衛可言，最高法院30年上字第1040號判例要\n    旨參照。查本件縱認告訴人曾有霸佔座位、阻止主辦人發早\n    餐予被告或辱罵被告「老不修」之行為，姑不論上開霸佔座\n    位，阻止發早餐之行為是否可評價為不法之侵害，倘認係屬\n    不法侵害，該等侵害亦已過去，被告再以「不要臉」等語辱\n    罵告訴人，已不符正當防衛之要件，且衡諸一般人之經驗法\n    則或論理法則，辱罵他人「不要臉」亦無法實質排除任何侵\n    害進而防衛自己或他人的權利，是被告此部分辯解，尚無足\n    採。\n三、綜上所述，被告所辯，不足採信，被告所為公然侮辱之犯行\n    ，足堪認定，本件事證明確，應依法論科。\n參、論罪科刑之理由\n一、按刑法第309 條規定之公然侮辱罪，係因公然表示有貶損他\n    人社會地位即人格價值之虞之個人抽象判斷而成立，則所謂\n    公然，即指使不特定人或多數人得以共見共聞之狀態；而所\n    謂侮辱係指不指摘具體事實，而為可能貶損他人社會評價一\n    切輕蔑之行為，即以使人難堪為目的之一切輕蔑之行為，皆\n    為侮辱。\n二、被告在滿座的遊覽車上，向張耀華丟擲三明治，並大聲辱罵\n    ：「張耀華妳不要臉」等語數次之行為，應屬在多數人得以\n    共見共聞之狀態，而以「張耀華妳不要臉」之言語，足使張\n    耀華難堪，並有貶損其人格價值之虞，核被告所為，係犯刑\n    法第309條第1項之公然侮辱罪。\n肆、本院維持原判決之理由\n一、原判決以被告犯行罪證明確，因予適用刑法第309條第1項、\n    第41條第1項前段，刑法施行法第1條之1 之規定，並審酌被\n    告年逾七十歲，具高中畢業之智識，竟因細故，於滿座的遊\n    覽車上，對告訴人丟擲三明治，並辱罵告訴人「不要臉」，\n    ，並兼衡其犯罪手段、所造成告訴人損害、犯罪後態度及尚\n    未與告訴人和解等一切情狀，量處拘役40日，並諭知易科罰\n    金之折算標準。\n二、本院經核原判決認事用法俱無不合，量刑亦稱妥適，被告上\n    訴意旨猶執前詞否認犯行，因而指摘原判決不當，為無理由\n    ，應予駁回。\n據上論結，應依刑事訴訟法第368條，判決如主文。\n本案經檢察官郭珍妮到庭執行職務。\n中    華    民    國  100    年     6     月    22    日\n                  刑事第四庭    審判長法  官  吳志誠\n                                      法  官  羅心芳\n                                      法  官  吳森豐\n以上正本證明與原本無異。\n不得上訴。\n                                      書記官  岑  玢"
  },
  "search": "臺灣高等法院臺南分院刑事判決100年度上易字第178號上訴人即被告楊肇輔佐人楊治民上列上訴人因妨害名譽案件，不服臺灣嘉義地方法院99年度易字第924號中華民國100年2月11日第一審判決（起訴案號：臺灣嘉義地方法院檢察署99年度偵字第8720號），提起上訴，本院判決如下：主文上訴駁回。事實一、緣「諾那華藏精舍嘉義道場」於民國99年10月10日舉辦至南投縣埔里鎮一日遊（放生、蹺塔、誦經）活動，楊肇、鄭芙蓉夫婦與張耀華均有參加並同坐一部遊覽車上，於99年10月10日上午8時許，楊肇、張耀華在同部遊覽車上因拿取早餐之事發生口角，楊肇竟基於侮辱他人名譽之犯意，公然在滿座的遊覽車上，於特定多數人得以共見共聞之情況下，向張耀華（42年4月23日生）丟擲三明治，並大聲辱罵：「張耀華妳不要臉」等語數次，足生損害於張耀華之名譽。二、案經被害人張耀華訴由臺灣嘉義地方法院檢察署檢察官偵查起訴。理由壹、證據能力方面按被告以外之人於審判外之言詞或書面陳述，除法律有規定者外，不得作為證據；又被告以外之人於審判外之陳述，雖不符合同法第159條之1至第159條之4之規定，但經當事人於審判程序同意作為證據，法院審酌該言詞陳述或書面陳述作成時之情況，認為適當者，亦得為證據。當事人、代理人或辯護人於法院調查證據時，知有第159條第1項不得為證據之情形，而未於言詞辯論終結前聲明異議者，視為有前項之同意，刑事訴訟法第159條第1項及第159條之5分別定有明文。經查，本判決下列所引用之被告以外之人於審判外之陳述（包含書面陳述），雖屬傳聞證據部分，業經檢察官、被告、輔佐人於本院準備程序及審判期日中均明示同意此部分之證據有證據能力（見本院卷第27頁、28頁、141頁），且迄至言詞辯論終結前亦未撤回前開同意，本院審酌上開證據資料製作時之情況，製作當時之過程、內容、功能等情況，其取得並無違法情形，具備合法可信之適當性保障，經綜合判斷，與本件犯罪待證事實，具有關連性，核無可信度明顯過低之情事，且認為以之作為證據應屬適當，爰依刑事訴訟法第159條之5規定，認前揭證據資料均有證據能力。貳、認定犯罪事實所憑之證據及理由一、訊據被告楊肇否認有何公然悔辱之犯行，辯稱：事發當日係因告訴人張耀華先霸佔遊覽車前6排的位置，不讓伊夫妻坐，事後又無故阻止主辦人發早餐給伊妻子楊鄭芙蓉，伊沒有對告訴人丟三明治。伊係因自衛，保護合法權益而與告訴人發生口角，伊記不清楚有沒有罵告訴人，而告訴人有罵伊「老不修」等語。二、經查：(一)、被告楊肇於原審準備程序訊問時業已供承伊有講「張耀華妳不要臉」那句話乙節不諱，而上開犯罪事實，亦經證人即告訴人張耀華於原審審理中結證稱：「上車時師姊有說，吃過早餐與拿過早餐的人不要再拿了，然後被告太太已經拿過了，還要拿，我就小聲的跟她講，還拍她一下說『有拿過就好，不要再拿』，他太太說沒有拿過，之後被告楊肇就站起來，被告就拿著三明治往我身上丟。接著就一直罵我『張耀華妳不要臉』、『張耀華妳不要臉』、『張耀華妳不要臉』，大小聲的一直罵。他不僅罵我，還用手一直指我。」、「（問：你們車上約有多少人？）滿座，約有40人左右。」等語明確（見原審卷第38頁、39頁），核與證人張素梅、李麗花於偵查中及原審審理中之證述情節互核相符（見他字偵查卷第13頁、偵字偵查卷第7頁、8頁、原審卷第41頁、第44頁），按證人張素梅、李麗花與被告並無仇恨，並經具結在卷，實無甘冒偽證罪責追訴之風險，而為虛偽陳述，證人張素梅、李麗花之證述應堪採信，足認被告確有於上開時、地，因拿取早餐之事與告訴人發生口角，而在滿座的遊覽車上，向告訴人丟擲三明治，並對告訴人辱罵：「張耀華妳不要臉」等語數次之事實，應堪認定。(二)、另證人江春儀於本院審理時證述：「（99年10月10日你有去埔里？）有。」、「兩輛，我搭第二輛，就是與被告、李麗花、李麗花的女兒同一輛車。」、「（99年10月10日是何人邀你去的？）諾那華藏精舍嘉義助念團舉辦，我是常住幹部，這次是團長召集的，團長叫做『蔡爾高』，蔡爾高也與我們同車。」、「（當天張素梅有無去？）有，張素梅也與我同車。」、「我提出的證明，李麗花就在剛剛照片裡面。」、「我有與楊肇同車，車號是923-FF，司機王志欽。」、「（出遊的名單？）楊肇、鄭芙蓉有報名參加，在第二份資料來電取消，第三份沒有楊肇與鄭芙蓉的名字，但他們也上車，所以我辦的不是很好。」等語（見本院卷第67頁、68頁、70頁、71頁），並提出當時活動報名表等件為證（見本院卷第85頁至122頁），足見「諾那華藏精舍嘉義道場」於99年10月10日舉辦至南投縣埔里鎮一日遊（放生、蹺塔、誦經）活動，證人江春儀、李麗花、張素梅確有與被告楊肇、證人鄭芙蓉同車，證人胡金枝於本院審理時亦證述：「（當天一共幾輛遊覽車？）兩輛。」、「（你有與被告同車？）有。」、「（你坐在第幾排？）忘記了，但我坐在被告的前面一排。」、「（你有看到被告和告訴人發生爭執？）有。大聲講，小聲叫。」、「我記得為了一些吃的東西，本來沒有提供食物，結果有人提供每人一個包子，不知道是否為了包子的事情，大聲講，小聲叫，在那邊罵，我知道的就是這樣。」、「（被告有無罵告訴人？）當然有。」、「【提示告訴人今日提出之照片】（這些照片是否你們99年10月10日去玩，所拍攝的照片？）是去這邊玩沒錯。」、「（這些照片，裡面是否有拍攝到你？）有。其中穿黃色上衣的人是我。」、「【提示大張的列印照片】（這些照片是否你們99年10月10日所拍攝的照片？）是。」、「（其中一張相片，是在作什麼儀式？）這就是放生的活動。就是將泥鰍放在一個孔，該孔通河川，就是放生在清水的排水溝。」、「就是他們兩個發生衝突，被告就是在罵告訴人，車上只有他們兩人發生衝突，只有你父親在那邊罵，罵什麼我不曉得。」等語（見本院卷第60頁、61頁、64頁、65頁），足認證人胡金枝確有參加99年10月10日之活動，並與被告及張耀華坐同部遊覽車，當日被告在車上確有因早餐之事，與告訴人張耀華發生爭執及出言辱罵告訴人張耀華乙情，亦可認定。證人吳陳素梅於本院審理時亦證述：「【請鈞院提示告訴人上次提出之相片】（穿紅色上衣的張素梅、戴帽子的李麗花、黃色上衣的胡金枝是否有去？）張素梅我有印象，戴帽子的李麗花看不清楚，黃色上衣的胡金枝有印象。」、「（張素梅、胡金枝你剛剛有認出，他們兩人有無跟你同一部車？）有。」、「（有無聽到楊肇向張耀華說『不要臉』？）好像有這樣的事情，很大聲一直喊。」、「（你剛提到，你與張耀華之前就認識，當天的印象都是很模糊，楊肇罵張耀華，你印象有這件事情，但張耀華罵我父親，你肯定沒有，你是否確定你說的是事實？）是。我是照我所見所聞說的。」等語（見本院卷第143頁、144頁、146頁），足見證人張素梅、胡金枝確有參加99年10月10日之活動，益證被告於上開時、地確有向張耀華大聲辱罵：「張耀華妳不要臉」乙節，且被告楊肇確實亦有參加當日活動，此有告訴人張耀華提出之照片在卷可證（見本院卷第77頁至79頁），而證人江春儀、胡金枝、吳陳素梅分別結稱證人張素梅、李麗花亦確實有參加99年10月10日之活動，證人吳陳素梅更結證被告確有以上開言詞公然侮辱告訴人張耀華，則被告辯稱：張素梅、李麗花之證述係偽證；照片係偽造云云，應不足採。(三)、被告雖辯稱事發當日係因告訴人先霸佔遊覽車前6排的位置，不讓伊夫妻坐，事後又無故阻止主辦人發早餐給伊妻子楊鄭芙蓉，伊係因自衛，保護合法權益而與告訴人發生口角，告訴人亦有罵伊「老不修」等語，惟查：(1)、證人即告訴人張耀華否認有霸佔遊覽車前6排的位置或罵被告「老不修」之行為，亦解釋其不讓被告妻子拿早餐係因被告妻子拿過了。證人李麗花於原審審理時證稱：伊坐在車頭第1排，旁邊坐伊外孫，伊上車時，被告夫妻及告訴人均已就座，沒有人為伊保留第1排的位置，該車的位置是誰先到就誰先坐，伊上車時，前面幾排的位置只剩第1排的位置，後方都坐滿了等語（見原審卷第45頁），證人張素梅於原審審理時亦證述：伊坐在被告後方2排，告訴人被被告辱罵時，並未反罵告訴人「老不修」等語（見原審卷第41頁、42頁），足見尚無法證明告訴人張耀華確有霸佔座位或反罵告訴人「老不修」等情。另證人即被告妻子楊鄭芙蓉雖於原審審理時證稱：「張耀華一上車，把東西放在前六排的椅子上，早餐我是先拿一份，後來我再拿一份給我先生時，她不給我們，之後張耀華、楊肇就吵起來，張耀華罵我先生『老不修』，我先生罵什麼我沒有注意聽到。我沒有看到我先生拿三明治丟張耀華。我坐在我先生旁邊。」等語（見原審卷第46頁），惟證人楊鄭芙蓉所為證述，除核與證人張素梅、李麗花、江春儀、胡金枝、吳陳素梅所證述情節不相符合，且係被告之配偶，基於配偶間之親誼關係，證詞難免偏頗，況以其座位就在被告旁邊，何以僅聽到告訴人罵被告，卻未注意被告罵告訴人何話，足見證人鄭芙蓉所為上開證述顯係迴護被告之詞，證人楊鄭芙蓉之證詞，實不足採信、實難認定告訴人確有霸佔座位或辱罵被告「老不修」之行為。(2)、按正當防衛必須對於現在不法之侵害始得為之，侵害業已過去，即無正當防衛可言，最高法院30年上字第1040號判例要旨參照。查本件縱認告訴人曾有霸佔座位、阻止主辦人發早餐予被告或辱罵被告「老不修」之行為，姑不論上開霸佔座位，阻止發早餐之行為是否可評價為不法之侵害，倘認係屬不法侵害，該等侵害亦已過去，被告再以「不要臉」等語辱罵告訴人，已不符正當防衛之要件，且衡諸一般人之經驗法則或論理法則，辱罵他人「不要臉」亦無法實質排除任何侵害進而防衛自己或他人的權利，是被告此部分辯解，尚無足採。三、綜上所述，被告所辯，不足採信，被告所為公然侮辱之犯行，足堪認定，本件事證明確，應依法論科。參、論罪科刑之理由一、按刑法第309條規定之公然侮辱罪，係因公然表示有貶損他人社會地位即人格價值之虞之個人抽象判斷而成立，則所謂公然，即指使不特定人或多數人得以共見共聞之狀態；而所謂侮辱係指不指摘具體事實，而為可能貶損他人社會評價一切輕蔑之行為，即以使人難堪為目的之一切輕蔑之行為，皆為侮辱。二、被告在滿座的遊覽車上，向張耀華丟擲三明治，並大聲辱罵：「張耀華妳不要臉」等語數次之行為，應屬在多數人得以共見共聞之狀態，而以「張耀華妳不要臉」之言語，足使張耀華難堪，並有貶損其人格價值之虞，核被告所為，係犯刑法第309條第1項之公然侮辱罪。肆、本院維持原判決之理由一、原判決以被告犯行罪證明確，因予適用刑法第309條第1項、第41條第1項前段，刑法施行法第1條之1之規定，並審酌被告年逾七十歲，具高中畢業之智識，竟因細故，於滿座的遊覽車上，對告訴人丟擲三明治，並辱罵告訴人「不要臉」，，並兼衡其犯罪手段、所造成告訴人損害、犯罪後態度及尚未與告訴人和解等一切情狀，量處拘役40日，並諭知易科罰金之折算標準。二、本院經核原判決認事用法俱無不合，量刑亦稱妥適，被告上訴意旨猶執前詞否認犯行，因而指摘原判決不當，為無理由，應予駁回。據上論結，應依刑事訴訟法第368條，判決如主文。本案經檢察官郭珍妮到庭執行職務。中華民國100年6月22日刑事第四庭審判長法官吳志誠法官羅心芳法官吳森豐以上正本證明與原本無異。不得上訴。書記官岑玢中華民國100年6月22日中華民國刑法第309條（公然侮辱罪）公然侮辱人者，處拘役或3百元以下罰金。以強暴犯前項之罪者，處1年以下有期徒刑、拘役或5百元以下罰金。",
  "characters": {
    "judges": [
      "吳志誠",
      "羅心芳",
      "吳森豐"
    ],
    "prosecutors": [
      "郭珍妮"
    ],
    "lawyers": [

    ],
    "clerks": [
      "岑玢"
    ],
    "plaintiffs": [

    ],
    "defendants": [
      "楊肇"
    ],
    "prosecutor_office": [

    ],
    "creditors": [

    ],
    "debtors": [

    ],
    "judicial_associate_officer": [

    ]
  },
  "adjudged_at": "2011-06-22",
  "created_at": "2016-02-13 18:05:21",
  "updated_at": "2016-02-13 18:05:21"
}