{
  "identify": "CYD-100-聲-59-20110321-1",
  "court": {
    "name": "臺灣嘉義地方法院",
    "code": "CYD"
  },
  "division": {
    "name": "民事",
    "code": "V"
  },
  "year": 100,
  "word": "聲",
  "number": "59",
  "jcheck": "1",
  "reason": "返還擔保金",
  "content": "臺灣嘉義地方法院民事裁定  100年度聲字第59號\n聲  請  人  吳明興\n相  對  人  張中田\n上列聲請人聲請返還擔保金事件，本院裁定如下：\n    主  文\n臺灣臺南地方法院九十九年度存字第九二○號提存事件聲請人所\n提存之擔保金新臺幣參拾肆萬元，准予返還。\n聲請程序費用由相對人負擔。\n    理  由\n一、按訴訟終結後，供擔保人證明已定20日以上之期間，催告受\n    擔保利益人行使權利而未行使者，或法院依供擔保人之聲請\n    ，通知受擔保利益人於一定期間內行使權利並向法院為行使\n    權利之證明而未證明者，法院應依供擔保人之聲請，以裁定\n    命返還其提存物或保證書，民事訴訟法第104條第1項第3款\n    定有明文，依同法第106條之規定，於其他依法令供訴訟上\n    之擔保者，亦準用之。其中所謂訴訟終結，在因假扣押或假\n    處分所供擔保之場合，因該擔保係為保障受擔保利益人因該\n    假扣押或假處分所受損害而設，倘執行法院已依假扣押或假\n    處分裁定為假扣押或假處分之執行，則在供擔保人撤回假扣\n    押或假處分之執行前，受擔保利益人所受損害仍可能繼續發\n    生，損害額既尚未確定，自難強令其行使權利，必待供擔保\n    人已撤回假扣押或假處分之執行，始得謂為訴訟終結（最高\n    法院87年臺抗字第234號裁定意旨可資參照）。\n二、本件聲請意旨略以：聲請人與相對人間假扣押事件，聲請人\n    前依本院99年度全字第467號假扣押裁定，提供新臺幣34萬\n    元為擔保金，並以臺灣臺南地方法院99年度存字第920號擔\n    保提存事件提存後，就相對人所有財產依本院99年度全字第\n    467號假扣押在案。茲因無繼續假扣押之必要，業經本院99\n    年度裁全聲字第18號裁定撤銷假扣押確定，且為取回擔保金\n    ，亦已定20日以上期間催告相對人即擔保利益人行使權利，\n    迄今逾期仍未行使，爰依法聲請裁定返還擔保金等語，並提\n    出存證信函及回執（均影本）為證。\n三、聲請人主張之上開事實，業據提出臺灣臺南地方法院99年度\n    存字第920號提存書影本、本院99年度全字第467號假扣押裁\n    定影本、本院99年度裁全聲字第18號裁定影本、臺灣臺南地\n    方法院99年度營簡字第358號和解筆錄影本、存證信函及回\n    執影本等為證，復經本院依職權調閱上開假扣押保全程序執\n    行卷宗、提存卷宗審核無訛，且查明相對人迄未對聲請人行\n    使權利。從而，聲請人依首揭規定，聲請返還上開擔保金，\n    自無不合，應予准許。\n四、依民事訴訟法第95條、第78條，裁定如主文。\n中    華    民    國   100    年    3     月    21    日\n                  民二庭法  官  黃仁勇\n以上正本係照原本作成。\n如對本裁定抗告須於裁定送達後10日內向本院提出抗告狀。\n中    華    民    國    99    年    3     月    21    日\n                        書記官  黃意雯",
  "structure": {
    "main": "臺灣臺南地方法院九十九年度存字第九二○號提存事件聲請人所\n提存之擔保金新臺幣參拾肆萬元，准予返還。\n聲請程序費用由相對人負擔。",
    "reason": "一、按訴訟終結後，供擔保人證明已定20日以上之期間，催告受\n    擔保利益人行使權利而未行使者，或法院依供擔保人之聲請\n    ，通知受擔保利益人於一定期間內行使權利並向法院為行使\n    權利之證明而未證明者，法院應依供擔保人之聲請，以裁定\n    命返還其提存物或保證書，民事訴訟法第104條第1項第3款\n    定有明文，依同法第106條之規定，於其他依法令供訴訟上\n    之擔保者，亦準用之。其中所謂訴訟終結，在因假扣押或假\n    處分所供擔保之場合，因該擔保係為保障受擔保利益人因該\n    假扣押或假處分所受損害而設，倘執行法院已依假扣押或假\n    處分裁定為假扣押或假處分之執行，則在供擔保人撤回假扣\n    押或假處分之執行前，受擔保利益人所受損害仍可能繼續發\n    生，損害額既尚未確定，自難強令其行使權利，必待供擔保\n    人已撤回假扣押或假處分之執行，始得謂為訴訟終結（最高\n    法院87年臺抗字第234號裁定意旨可資參照）。\n二、本件聲請意旨略以：聲請人與相對人間假扣押事件，聲請人\n    前依本院99年度全字第467號假扣押裁定，提供新臺幣34萬\n    元為擔保金，並以臺灣臺南地方法院99年度存字第920號擔\n    保提存事件提存後，就相對人所有財產依本院99年度全字第\n    467號假扣押在案。茲因無繼續假扣押之必要，業經本院99\n    年度裁全聲字第18號裁定撤銷假扣押確定，且為取回擔保金\n    ，亦已定20日以上期間催告相對人即擔保利益人行使權利，\n    迄今逾期仍未行使，爰依法聲請裁定返還擔保金等語，並提\n    出存證信函及回執（均影本）為證。\n三、聲請人主張之上開事實，業據提出臺灣臺南地方法院99年度\n    存字第920號提存書影本、本院99年度全字第467號假扣押裁\n    定影本、本院99年度裁全聲字第18號裁定影本、臺灣臺南地\n    方法院99年度營簡字第358號和解筆錄影本、存證信函及回\n    執影本等為證，復經本院依職權調閱上開假扣押保全程序執\n    行卷宗、提存卷宗審核無訛，且查明相對人迄未對聲請人行\n    使權利。從而，聲請人依首揭規定，聲請返還上開擔保金，\n    自無不合，應予准許。\n四、依民事訴訟法第95條、第78條，裁定如主文。"
  },
  "search": "臺灣嘉義地方法院民事裁定100年度聲字第59號聲請人吳明興相對人張中田上列聲請人聲請返還擔保金事件，本院裁定如下：主文臺灣臺南地方法院九十九年度存字第九二○號提存事件聲請人所提存之擔保金新臺幣參拾肆萬元，准予返還。聲請程序費用由相對人負擔。理由一、按訴訟終結後，供擔保人證明已定20日以上之期間，催告受擔保利益人行使權利而未行使者，或法院依供擔保人之聲請，通知受擔保利益人於一定期間內行使權利並向法院為行使權利之證明而未證明者，法院應依供擔保人之聲請，以裁定命返還其提存物或保證書，民事訴訟法第104條第1項第3款定有明文，依同法第106條之規定，於其他依法令供訴訟上之擔保者，亦準用之。其中所謂訴訟終結，在因假扣押或假處分所供擔保之場合，因該擔保係為保障受擔保利益人因該假扣押或假處分所受損害而設，倘執行法院已依假扣押或假處分裁定為假扣押或假處分之執行，則在供擔保人撤回假扣押或假處分之執行前，受擔保利益人所受損害仍可能繼續發生，損害額既尚未確定，自難強令其行使權利，必待供擔保人已撤回假扣押或假處分之執行，始得謂為訴訟終結（最高法院87年臺抗字第234號裁定意旨可資參照）。二、本件聲請意旨略以：聲請人與相對人間假扣押事件，聲請人前依本院99年度全字第467號假扣押裁定，提供新臺幣34萬元為擔保金，並以臺灣臺南地方法院99年度存字第920號擔保提存事件提存後，就相對人所有財產依本院99年度全字第467號假扣押在案。茲因無繼續假扣押之必要，業經本院99年度裁全聲字第18號裁定撤銷假扣押確定，且為取回擔保金，亦已定20日以上期間催告相對人即擔保利益人行使權利，迄今逾期仍未行使，爰依法聲請裁定返還擔保金等語，並提出存證信函及回執（均影本）為證。三、聲請人主張之上開事實，業據提出臺灣臺南地方法院99年度存字第920號提存書影本、本院99年度全字第467號假扣押裁定影本、本院99年度裁全聲字第18號裁定影本、臺灣臺南地方法院99年度營簡字第358號和解筆錄影本、存證信函及回執影本等為證，復經本院依職權調閱上開假扣押保全程序執行卷宗、提存卷宗審核無訛，且查明相對人迄未對聲請人行使權利。從而，聲請人依首揭規定，聲請返還上開擔保金，自無不合，應予准許。四、依民事訴訟法第95條、第78條，裁定如主文。中華民國100年3月21日民二庭法官黃仁勇以上正本係照原本作成。如對本裁定抗告須於裁定送達後10日內向本院提出抗告狀。中華民國99年3月21日書記官黃意雯",
  "characters": {
    "judges": [
      "黃仁勇"
    ],
    "prosecutors": [

    ],
    "lawyers": [

    ],
    "clerks": [

    ],
    "plaintiffs": [

    ],
    "defendants": [

    ],
    "prosecutor_office": [
      "吳明興"
    ],
    "creditors": [

    ],
    "debtors": [

    ],
    "judicial_associate_officer": [

    ]
  },
  "adjudged_at": "2011-03-21",
  "created_at": "2016-02-13 21:38:28",
  "updated_at": "2016-02-13 21:38:28"
}