{
  "identify": "TCD-100-聲-1080-20110321-1",
  "court": {
    "name": "臺灣臺中地方法院",
    "code": "TCD"
  },
  "division": {
    "name": "刑事",
    "code": "M"
  },
  "year": 100,
  "word": "聲",
  "number": "1080",
  "jcheck": "1",
  "reason": "聲請沒入保證金",
  "content": "臺灣臺中地方法院刑事裁定             100年度聲字第1080號\n聲  請  人  臺灣臺中地方法院檢察署檢察官\n具  保  人  鄭碧吟\n受  刑  人  楊東翰\n上列被告因強盜案件，經聲請人聲請沒入保證金（100年執聲沒\n字第38號），本院裁定如下：\n    主  文\n鄭碧吟繳納之保證金新臺幣伍萬元，沒入之。\n    理  由\n一、本件受刑人即被告楊東翰（下稱被告）因強盜案件，前經本\n    院准予具保，並指定保證金額新臺幣（下同）5萬元，復經\n    具保人鄭碧吟繳納保證金後，將被告釋放在案，而被告於判\n    決確定後，接獲檢察官通知到案執行時，業已逃匿；檢察官\n    以被告已逃匿為由，聲請沒入保證金。\n二、按具保之被告逃匿者，應命具保人繳納指定之保證金額，並\n    沒入之。不繳納者，強制執行。保證金已繳納者，沒入之。\n    刑事訴訟法第118條第1項定有明文。經查，被告因強盜案件\n    ，經法院判決確定後，復經檢察官通知具保人偕同被告到案\n    接受執行，惟被告屆時並未到案接受執行，且被告經臺灣臺\n    中地方法院檢察署檢察官傳拘無著，此有送達證書、戶籍資\n    料、報告書附卷可考，是被告已有逃匿之事實，至為明顯。\n    從而，檢察官據以被告逃匿為由，依上開刑事訴訟法第118\n    條第1項之規定而為沒入具保人5萬元保證金之聲請，依法核\n    無不合，應予准許。\n三、依刑事訴訟法第118條第1項、第121條第1項，裁定如主文。\n中    華    民    國   100    年    3     月    21    日\n                  刑事第十六庭  法  官  王世華\n上正本證明與原本無異。\n如不服本裁定，應於送達後五日內，向本院提出抗告狀。\n                                書記官  張禎庭\n中    華    民    國   100    年    3     月    21    日",
  "structure": {
    "main": "鄭碧吟繳納之保證金新臺幣伍萬元，沒入之。",
    "reason": "一、本件受刑人即被告楊東翰（下稱被告）因強盜案件，前經本\n    院准予具保，並指定保證金額新臺幣（下同）5萬元，復經\n    具保人鄭碧吟繳納保證金後，將被告釋放在案，而被告於判\n    決確定後，接獲檢察官通知到案執行時，業已逃匿；檢察官\n    以被告已逃匿為由，聲請沒入保證金。\n二、按具保之被告逃匿者，應命具保人繳納指定之保證金額，並\n    沒入之。不繳納者，強制執行。保證金已繳納者，沒入之。\n    刑事訴訟法第118條第1項定有明文。經查，被告因強盜案件\n    ，經法院判決確定後，復經檢察官通知具保人偕同被告到案\n    接受執行，惟被告屆時並未到案接受執行，且被告經臺灣臺\n    中地方法院檢察署檢察官傳拘無著，此有送達證書、戶籍資\n    料、報告書附卷可考，是被告已有逃匿之事實，至為明顯。\n    從而，檢察官據以被告逃匿為由，依上開刑事訴訟法第118\n    條第1項之規定而為沒入具保人5萬元保證金之聲請，依法核\n    無不合，應予准許。\n三、依刑事訴訟法第118條第1項、第121條第1項，裁定如主文。"
  },
  "search": "臺灣臺中地方法院刑事裁定100年度聲字第1080號聲請人臺灣臺中地方法院檢察署檢察官具保人鄭碧吟受刑人楊東翰上列被告因強盜案件，經聲請人聲請沒入保證金（100年執聲沒字第38號），本院裁定如下：主文鄭碧吟繳納之保證金新臺幣伍萬元，沒入之。理由一、本件受刑人即被告楊東翰（下稱被告）因強盜案件，前經本院准予具保，並指定保證金額新臺幣（下同）5萬元，復經具保人鄭碧吟繳納保證金後，將被告釋放在案，而被告於判決確定後，接獲檢察官通知到案執行時，業已逃匿；檢察官以被告已逃匿為由，聲請沒入保證金。二、按具保之被告逃匿者，應命具保人繳納指定之保證金額，並沒入之。不繳納者，強制執行。保證金已繳納者，沒入之。刑事訴訟法第118條第1項定有明文。經查，被告因強盜案件，經法院判決確定後，復經檢察官通知具保人偕同被告到案接受執行，惟被告屆時並未到案接受執行，且被告經臺灣臺中地方法院檢察署檢察官傳拘無著，此有送達證書、戶籍資料、報告書附卷可考，是被告已有逃匿之事實，至為明顯。從而，檢察官據以被告逃匿為由，依上開刑事訴訟法第118條第1項之規定而為沒入具保人5萬元保證金之聲請，依法核無不合，應予准許。三、依刑事訴訟法第118條第1項、第121條第1項，裁定如主文。中華民國100年3月21日刑事第十六庭法官王世華上正本證明與原本無異。如不服本裁定，應於送達後五日內，向本院提出抗告狀。書記官張禎庭中華民國100年3月21日",
  "characters": {
    "judges": [
      "王世華"
    ],
    "prosecutors": [

    ],
    "lawyers": [

    ],
    "clerks": [
      "張禎庭"
    ],
    "plaintiffs": [

    ],
    "defendants": [

    ],
    "prosecutor_office": [
      "臺灣臺中地方法院檢察署檢察官"
    ],
    "creditors": [

    ],
    "debtors": [

    ],
    "judicial_associate_officer": [

    ]
  },
  "adjudged_at": "2011-03-21",
  "created_at": "2016-02-13 21:47:36",
  "updated_at": "2016-02-13 21:47:36"
}