{
  "identify": "TPH-94-上訴-2571-20051108-2",
  "court": {
    "name": "臺灣高等法院",
    "code": "TPH"
  },
  "division": {
    "name": "刑事",
    "code": "M"
  },
  "year": 94,
  "word": "上訴",
  "number": "2571",
  "jcheck": "2",
  "reason": "違反槍砲彈藥刀械管制條例等",
  "content": "臺灣高等法院刑事裁定                94年度上訴字第2571號\n上  訴  人\n即  被  告  甲○○\n上列上訴人因違反槍砲彈藥刀械管制條例等案件，對於本院中華\n民國94年9月27日所為第二審判決（94年度上訴字第2571號），\n提起上訴，本院裁定如下：\n    主  文\n甲○○關於恐嚇罪部分之上訴駁回。\n    理  由\n一、按最重本刑為3年以下有期徒刑、拘役或專科罰金之罪，或\n    刑法第320條、第321條之竊盜罪，第335條、第336條第2項\n    之侵占罪，第339條、第341條之詐欺罪，第342條之背信罪\n    ，第346條之恐嚇罪，第349條第2項之贓物罪之案件，經第\n    二審判決後，不得上訴於第三審法院，刑事訴訟法第376條\n    定有明文。\n二、經查：本件被告所犯刑法第305條恐嚇危害安全罪部分，核\n    屬最重本刑為2年以下有期徒刑之罪。揆諸上開說明，上訴\n    人對本院關於恐嚇危害安全罪部分所為之第二審判決，提起\n    第三審上訴，顯屬違背上開規定，為法律上不應准許，應予\n    駁回。\n三、據上論斷，依刑事訴訟法第384條前段，裁定如主文。\n中    華    民    國    94    年    11    月    8     日\n                  刑事第三庭審判長法  官  洪光燦\n                                  法  官  王詠寰\n                                  法  官  江振義\n以上正本證明與原本無異。\n不得抗告。\n                                  書記官  劉文美\n中    華    民    國    94    年    11    月    8     日\n",
  "structure": {
    "main": "甲○○關於恐嚇罪部分之上訴駁回。",
    "reason": "一、按最重本刑為3年以下有期徒刑、拘役或專科罰金之罪，或\n    刑法第320條、第321條之竊盜罪，第335條、第336條第2項\n    之侵占罪，第339條、第341條之詐欺罪，第342條之背信罪\n    ，第346條之恐嚇罪，第349條第2項之贓物罪之案件，經第\n    二審判決後，不得上訴於第三審法院，刑事訴訟法第376條\n    定有明文。\n二、經查：本件被告所犯刑法第305條恐嚇危害安全罪部分，核\n    屬最重本刑為2年以下有期徒刑之罪。揆諸上開說明，上訴\n    人對本院關於恐嚇危害安全罪部分所為之第二審判決，提起\n    第三審上訴，顯屬違背上開規定，為法律上不應准許，應予\n    駁回。\n三、據上論斷，依刑事訴訟法第384條前段，裁定如主文。"
  },
  "search": "臺灣高等法院刑事裁定94年度上訴字第2571號上訴人即被告甲○○上列上訴人因違反槍砲彈藥刀械管制條例等案件，對於本院中華民國94年9月27日所為第二審判決（94年度上訴字第2571號），提起上訴，本院裁定如下：主文甲○○關於恐嚇罪部分之上訴駁回。理由一、按最重本刑為3年以下有期徒刑、拘役或專科罰金之罪，或刑法第320條、第321條之竊盜罪，第335條、第336條第2項之侵占罪，第339條、第341條之詐欺罪，第342條之背信罪，第346條之恐嚇罪，第349條第2項之贓物罪之案件，經第二審判決後，不得上訴於第三審法院，刑事訴訟法第376條定有明文。二、經查：本件被告所犯刑法第305條恐嚇危害安全罪部分，核屬最重本刑為2年以下有期徒刑之罪。揆諸上開說明，上訴人對本院關於恐嚇危害安全罪部分所為之第二審判決，提起第三審上訴，顯屬違背上開規定，為法律上不應准許，應予駁回。三、據上論斷，依刑事訴訟法第384條前段，裁定如主文。中華民國94年11月8日刑事第三庭審判長法官洪光燦法官王詠寰法官江振義以上正本證明與原本無異。不得抗告。書記官劉文美中華民國94年11月8日",
  "characters": {
    "judges": [
      "洪光燦",
      "王詠寰",
      "江振義"
    ],
    "prosecutors": [

    ],
    "lawyers": [

    ],
    "clerks": [
      "劉文美"
    ],
    "plaintiffs": [

    ],
    "defendants": [
      "甲"
    ],
    "prosecutor_office": [

    ],
    "creditors": [

    ],
    "debtors": [

    ],
    "judicial_associate_officer": [

    ]
  },
  "adjudged_at": "2005-11-08",
  "created_at": "2016-02-07 00:23:23",
  "updated_at": "2016-02-07 00:23:23"
}