{
  "identify": "SCD-100-審訴-15-20110211-1",
  "court": {
    "name": "臺灣新竹地方法院",
    "code": "SCD"
  },
  "division": {
    "name": "刑事",
    "code": "M"
  },
  "year": 100,
  "word": "審訴",
  "number": "15",
  "jcheck": "1",
  "reason": "違反毒品危害防制條例",
  "content": "臺灣新竹地方法院刑事宣示判決筆錄     100年度審訴字第15號\n公  訴  人  臺灣新竹地方法院檢察署檢察官\n被      告  廖永歆\n指定辯護人  本院公設辯護人周凱珍\n上列被告因違反毒品危害防制條例案件，經檢察官提起公訴（99\n年度撤緩毒偵字第36號）後，聲請本院改依協商程序而為判決，\n於中華民國100 年2 月11日下午4 時在本院刑事第十一法庭宣示\n判決，出席職員如下：\n                                      審判長法官  邱忠義\n                                          書記官  劉依緹\n                                          通  譯  邱立杰\n法官起立朗讀判決主文、犯罪事實要旨、處罰條文，及告以上訴\n限制、期間並提出上訴狀之法院，且諭知記載其內容：\n一、主  文：\n    廖永歆施用第一級毒品，累犯，處有期徒刑柒月。扣案之海\n    洛因殘渣袋壹個（毛重零點零壹捌公克），沒收銷燬之；另\n    扣案之注射針筒貳組，均沒收之。又施用第二級毒品，累犯\n    ，處有期徒刑肆月。主刑部分應執行有期徒刑玖月。扣案之\n    海洛因殘渣袋壹個（毛重零點零壹捌公克），沒收銷燬之；\n    另扣案之注射針筒貳組，均沒收之。\n二、犯罪事實要旨：\n（一）廖永歆前曾於民國94年間，因違反毒品危害防制條例案件\n      ，經本院以95年度訴字第1 號判決分別判處有期徒刑7 月\n      、4 月，應執行刑有期徒刑10月確定，於95年7 月11日入\n      監執行，並於96年4 月28日縮刑期滿執行完畢。\n（二）廖永歆前(1)於91年間，因連續施用第二級毒品案件，經本\n      院以91年度毒聲字第17號裁定送觀察、勒戒，於91年1 月\n      5 日入所，因認無繼續施用毒品傾向，於91年1 月28日釋\n      放出所執行完畢，並經臺灣新竹地方法院檢察署檢察官以\n      91年度毒偵字第51號為不起訴處分確定；(2)又於92年間，\n      因施用第一級、第二級毒品案件，經本院以92年度毒聲字\n      第581 號裁定送觀察、勒戒，於92年11月12日入所，因認\n      無繼續施用毒品傾向，於92年12月8 日釋放出所執行完畢\n      ，並經臺灣新竹地方法院檢察署檢察官以92年度毒偵字第\n      583 號為不起訴處分確定；(3)另於94年間，因連續施用第\n      一級、第二級毒品案件，經本院以95年度訴字第1 號判決\n      分別判處有期徒刑7 月、4 月，應執行有期徒刑10月確定\n      ，其執行情形詳如上開（一）部分。\n（三）詎廖永歆仍不知悔改，於前開觀察勒戒處分執行完畢釋放\n      後，「5 年內再犯」施用毒品案件，並經法院判處罪刑確\n      定後，(1)復基於施用第一級毒品海洛因的犯罪意思，於98\n      年11月13日下午5 時許，在新竹市○○路380 號「種福宮\n      」內，以針筒注射之方式，施用第一級毒品海洛因1 次；\n      (2)另基於施用第二級毒品甲基安非他命的犯罪意思，於98\n      年11月13日晚上9 時20分許為警採集尿液往前回溯96小時\n      內某時，在不詳地點，以不詳方式，施用第二級毒品甲基\n      安非他命1 次。嗣於98年11月13日下午5 時許，在上址「\n      種福宮」內為警查獲，並扣得其所有之海洛因殘渣袋1 個\n      （毛重0.018 公克）、注射針筒2 組，復經警採集其尿液\n      送驗，結果呈甲基安非他命、嗎啡、可待因陽性反應，始\n      悉上情。\n（四）案經新竹市警察局第二分局報告臺灣新竹地方法院檢察署\n      檢察官偵查起訴。\n三、處罰條文：\n    毒品危害防制條例第10條第1 項、第2 項、第18條第1 項前\n    段，刑法第11條、第47條第1 項、第51條第5 款、第38條第\n    1 項第2 款。\n四、協商判決除有刑事訴訟法第455 條之4 第1 項第1 款於本訊\n    問程序終結前，被告撤銷協商合意或檢察官撤回協商聲請者\n    ；第2 款被告協商之意思非出於自由意志者；第4 款被告所\n    犯之罪非第455 條之2 第1 項所定得以協商判決者；第6 款\n    被告有其他較重之裁判上一罪之犯罪事實者；第7 款法院認\n    應諭知免刑或免訴、不受理者情形之一，及違反同條第2 項\n    「法院應於協商合意範圍內為判決；法院為協商判決所科之\n    刑，以宣告緩刑或2 年以下有期徒刑、拘役或罰金為限」之\n    規定者外，檢察官與被告均不得上訴。\n五、如有前項得上訴之情形，得自收受宣示判決筆錄送達之日起\n    10日內，向本院提出上訴書狀，上訴於第二審法院。\n中    華    民    國   100    年     2    月    11    日\n                  刑事第九庭書  記  官        劉依緹\n                            審判長法官        邱忠義\n以上筆錄正本係照原本作成。\n中    華    民    國   100    年    2     月    11    日\n                            書  記  官        王思穎\n附錄本案處罰實體法條全文：\n毒品危害防制條例第10條：\n施用第一級毒品者，處6 月以上5 年以下有期徒刑。\n施用第二級毒品者，處3 年以下有期徒刑。",
  "structure": {
  },
  "search": "臺灣新竹地方法院刑事宣示判決筆錄100年度審訴字第15號公訴人臺灣新竹地方法院檢察署檢察官被告廖永歆指定辯護人本院公設辯護人周凱珍上列被告因違反毒品危害防制條例案件，經檢察官提起公訴（99年度撤緩毒偵字第36號）後，聲請本院改依協商程序而為判決，於中華民國100年2月11日下午4時在本院刑事第十一法庭宣示判決，出席職員如下：審判長法官邱忠義書記官劉依緹通譯邱立杰法官起立朗讀判決主文、犯罪事實要旨、處罰條文，及告以上訴限制、期間並提出上訴狀之法院，且諭知記載其內容：一、主文：廖永歆施用第一級毒品，累犯，處有期徒刑柒月。扣案之海洛因殘渣袋壹個（毛重零點零壹捌公克），沒收銷燬之；另扣案之注射針筒貳組，均沒收之。又施用第二級毒品，累犯，處有期徒刑肆月。主刑部分應執行有期徒刑玖月。扣案之海洛因殘渣袋壹個（毛重零點零壹捌公克），沒收銷燬之；另扣案之注射針筒貳組，均沒收之。二、犯罪事實要旨：（一）廖永歆前曾於民國94年間，因違反毒品危害防制條例案件，經本院以95年度訴字第1號判決分別判處有期徒刑7月、4月，應執行刑有期徒刑10月確定，於95年7月11日入監執行，並於96年4月28日縮刑期滿執行完畢。（二）廖永歆前(1)於91年間，因連續施用第二級毒品案件，經本院以91年度毒聲字第17號裁定送觀察、勒戒，於91年1月5日入所，因認無繼續施用毒品傾向，於91年1月28日釋放出所執行完畢，並經臺灣新竹地方法院檢察署檢察官以91年度毒偵字第51號為不起訴處分確定；(2)又於92年間，因施用第一級、第二級毒品案件，經本院以92年度毒聲字第581號裁定送觀察、勒戒，於92年11月12日入所，因認無繼續施用毒品傾向，於92年12月8日釋放出所執行完畢，並經臺灣新竹地方法院檢察署檢察官以92年度毒偵字第583號為不起訴處分確定；(3)另於94年間，因連續施用第一級、第二級毒品案件，經本院以95年度訴字第1號判決分別判處有期徒刑7月、4月，應執行有期徒刑10月確定，其執行情形詳如上開（一）部分。（三）詎廖永歆仍不知悔改，於前開觀察勒戒處分執行完畢釋放後，「5年內再犯」施用毒品案件，並經法院判處罪刑確定後，(1)復基於施用第一級毒品海洛因的犯罪意思，於98年11月13日下午5時許，在新竹市○○路380號「種福宮」內，以針筒注射之方式，施用第一級毒品海洛因1次；(2)另基於施用第二級毒品甲基安非他命的犯罪意思，於98年11月13日晚上9時20分許為警採集尿液往前回溯96小時內某時，在不詳地點，以不詳方式，施用第二級毒品甲基安非他命1次。嗣於98年11月13日下午5時許，在上址「種福宮」內為警查獲，並扣得其所有之海洛因殘渣袋1個（毛重0.018公克）、注射針筒2組，復經警採集其尿液送驗，結果呈甲基安非他命、嗎啡、可待因陽性反應，始悉上情。（四）案經新竹市警察局第二分局報告臺灣新竹地方法院檢察署檢察官偵查起訴。三、處罰條文：毒品危害防制條例第10條第1項、第2項、第18條第1項前段，刑法第11條、第47條第1項、第51條第5款、第38條第1項第2款。四、協商判決除有刑事訴訟法第455條之4第1項第1款於本訊問程序終結前，被告撤銷協商合意或檢察官撤回協商聲請者；第2款被告協商之意思非出於自由意志者；第4款被告所犯之罪非第455條之2第1項所定得以協商判決者；第6款被告有其他較重之裁判上一罪之犯罪事實者；第7款法院認應諭知免刑或免訴、不受理者情形之一，及違反同條第2項「法院應於協商合意範圍內為判決；法院為協商判決所科之刑，以宣告緩刑或2年以下有期徒刑、拘役或罰金為限」之規定者外，檢察官與被告均不得上訴。五、如有前項得上訴之情形，得自收受宣示判決筆錄送達之日起10日內，向本院提出上訴書狀，上訴於第二審法院。中華民國100年2月11日刑事第九庭書記官劉依緹審判長法官邱忠義以上筆錄正本係照原本作成。中華民國100年2月11日書記官王思穎附錄本案處罰實體法條全文：毒品危害防制條例第10條：施用第一級毒品者，處6月以上5年以下有期徒刑。施用第二級毒品者，處3年以下有期徒刑。",
  "characters": {
    "judges": [

    ],
    "prosecutors": [

    ],
    "lawyers": [

    ],
    "clerks": [
      "劉依緹"
    ],
    "plaintiffs": [

    ],
    "defendants": [
      "廖永歆"
    ],
    "prosecutor_office": [
      "臺灣新竹地方法院檢察署檢察官"
    ],
    "creditors": [

    ],
    "debtors": [

    ],
    "judicial_associate_officer": [

    ]
  },
  "adjudged_at": "2011-02-11",
  "created_at": "2016-02-12 05:25:17",
  "updated_at": "2016-02-12 05:25:17"
}