{
  "identify": "KSD-94-聲-1272-20050909-2",
  "court": {
    "name": "臺灣高雄地方法院",
    "code": "KSD"
  },
  "division": {
    "name": "民事",
    "code": "V"
  },
  "year": 94,
  "word": "聲",
  "number": "1272",
  "jcheck": "2",
  "reason": "返還提存物",
  "content": "臺灣高雄地方法院民事裁定              94年度聲字第1272號\n聲  請  人  中國信託商業銀行股份有限公司\n法定代理人  乙○○\n相  對  人  陳秋菊\n            （原名甲○○）\n當事人間請求返還提存物事件，本院於民國94年8月23日所為之\n裁定，其正本應更正如下：\n  主  文\n原裁定正本主文欄關於「擔保金新臺幣壹佰壹拾萬元」之記載，\n應更正為「臺北市政府建設公債八十九年度第二期債票面額新臺\n幣壹佰萬元券壹張、壹拾萬元券壹張（票號：KJ000067、\nKH000082號，均附息票三至七期）」；理由欄第二點中關於「提\n供新臺幣1,100,000 元為擔保金」之記載，應更正為「提供臺北\n市政府建設公債八十九年度第二期債票面額新臺幣100 萬元券1\n張、10萬元券1 張（票號：KJ000067、KH000082號，均附息票三\n至七期）為擔保」。\n  理  由\n一、按判決如有誤寫、誤算或其他類此之顯然錯誤者，法院得依\n    聲請或依職權以裁定更正之，民事訴訟法第232條第1項定有\n    明文。此於裁定亦準用之，同法第239條亦定有明文。\n二、查本院前開之裁定有如主文所示之顯然錯誤，應予更正。\n三、依首開規定，裁定如主文。\n中    華    民    國    94    年    9     月    9     日\n                  民事第五庭法  官  王雅苑\n正本係照原本作成。\n如不服本裁定應於送達後10日內向本院提出抗告狀，並繳納裁判\n費新台幣1,000元。\n中    華    民    國    94    年    9     月    9     日\n                            書記官  洪育祺\n",
  "structure": {
    "main": "原裁定正本主文欄關於「擔保金新臺幣壹佰壹拾萬元」之記載，\n應更正為「臺北市政府建設公債八十九年度第二期債票面額新臺\n幣壹佰萬元券壹張、壹拾萬元券壹張（票號：KJ000067、\nKH000082號，均附息票三至七期）」；理由欄第二點中關於「提\n供新臺幣1,100,000 元為擔保金」之記載，應更正為「提供臺北\n市政府建設公債八十九年度第二期債票面額新臺幣100 萬元券1\n張、10萬元券1 張（票號：KJ000067、KH000082號，均附息票三\n至七期）為擔保」。",
    "reason": "一、按判決如有誤寫、誤算或其他類此之顯然錯誤者，法院得依\n    聲請或依職權以裁定更正之，民事訴訟法第232條第1項定有\n    明文。此於裁定亦準用之，同法第239條亦定有明文。\n二、查本院前開之裁定有如主文所示之顯然錯誤，應予更正。\n三、依首開規定，裁定如主文。"
  },
  "search": "臺灣高雄地方法院民事裁定94年度聲字第1272號聲請人中國信託商業銀行股份有限公司法定代理人乙○○相對人陳秋菊（原名甲○○）當事人間請求返還提存物事件，本院於民國94年8月23日所為之裁定，其正本應更正如下：主文原裁定正本主文欄關於「擔保金新臺幣壹佰壹拾萬元」之記載，應更正為「臺北市政府建設公債八十九年度第二期債票面額新臺幣壹佰萬元券壹張、壹拾萬元券壹張（票號：KJ000067、KH000082號，均附息票三至七期）」；理由欄第二點中關於「提供新臺幣1,100,000元為擔保金」之記載，應更正為「提供臺北市政府建設公債八十九年度第二期債票面額新臺幣100萬元券1張、10萬元券1張（票號：KJ000067、KH000082號，均附息票三至七期）為擔保」。理由一、按判決如有誤寫、誤算或其他類此之顯然錯誤者，法院得依聲請或依職權以裁定更正之，民事訴訟法第232條第1項定有明文。此於裁定亦準用之，同法第239條亦定有明文。二、查本院前開之裁定有如主文所示之顯然錯誤，應予更正。三、依首開規定，裁定如主文。中華民國94年9月9日民事第五庭法官王雅苑正本係照原本作成。如不服本裁定應於送達後10日內向本院提出抗告狀，並繳納裁判費新台幣1,000元。中華民國94年9月9日書記官洪育祺",
  "characters": {
    "judges": [
      "王雅苑"
    ],
    "prosecutors": [

    ],
    "lawyers": [

    ],
    "clerks": [
      "洪育祺"
    ],
    "plaintiffs": [

    ],
    "defendants": [

    ],
    "prosecutor_office": [
      "中國信託商業銀行股份有限公司"
    ],
    "creditors": [

    ],
    "debtors": [

    ],
    "judicial_associate_officer": [

    ]
  },
  "adjudged_at": "2005-09-09",
  "created_at": "2016-02-06 20:00:20",
  "updated_at": "2016-02-06 20:00:20"
}