{
  "identify": "TYD-94-家救-7-20050408-1",
  "court": {
    "name": "臺灣桃園地方法院",
    "code": "TYD"
  },
  "division": {
    "name": "民事",
    "code": "V"
  },
  "year": 94,
  "word": "家救",
  "number": "7",
  "jcheck": "1",
  "reason": "訴訟救助",
  "content": "臺灣桃園地方法院民事裁定               94年度家救字第7號\n聲  請  人  乙○○\n代  理  人  盧建宏律師\n相  對  人  甲○○\n上列當事人間請求離婚等事件（94年度婚字第316 號），聲請人\n聲請訴訟救助，本院裁定如下：\n    主    文\n准予訴訟救助。\n    理    由\n一、按「經分會（法律扶助基金會分會）准予法律扶助之無資力\n    者，其於訴訟程序中，向法院聲請訴訟救助時，應准予訴訟\n    救助。但另有不符法律扶助事實之證明者，不在此限。」，\n    法律扶助法第62條定有明文。又「當事人無資力支出訴訟費\n    用者，法院應依聲請，以裁定准予訴訟救助。但顯無勝訴之\n    望者，不在此限。」，民事訴訟法第107 條規定甚明。\n二、查本件聲請人提起本件離婚等訴訟，因無資力，經向財團法\n    人法律扶助基金會桃園分會申請法律扶助，經該分會審查後\n    准予法律扶助，扶助種類係訴訟代理或辯護、民事訴訟第一\n    審訴訟代理人，有該分會扶助律師接案通知書影本及律師委\n    任狀附卷可稽。本件既已獲訴訟代理之救助，且訴訟非顯無\n    勝訴之望，本件聲請於法即無不合，應予准許。\n三、爰依法律扶助法第62條，民事訴訟法第107條，裁定如主文。\n中    華    民    國    94    年    4     月    8     日\n                  家事法庭法  官  熊祥雲\n上列正本證明與原本無異\n如不服本裁定應於送達後10日內向本院提出抗告狀，並應繳納抗\n告費新台幣1,000 元。\n中    華    民    國    94    年    4     月    8     日\n                          書記官  吳宏明\n",
  "structure": {
    "main": "准予訴訟救助。",
    "reason": "一、按「經分會（法律扶助基金會分會）准予法律扶助之無資力\n    者，其於訴訟程序中，向法院聲請訴訟救助時，應准予訴訟\n    救助。但另有不符法律扶助事實之證明者，不在此限。」，\n    法律扶助法第62條定有明文。又「當事人無資力支出訴訟費\n    用者，法院應依聲請，以裁定准予訴訟救助。但顯無勝訴之\n    望者，不在此限。」，民事訴訟法第107 條規定甚明。\n二、查本件聲請人提起本件離婚等訴訟，因無資力，經向財團法\n    人法律扶助基金會桃園分會申請法律扶助，經該分會審查後\n    准予法律扶助，扶助種類係訴訟代理或辯護、民事訴訟第一\n    審訴訟代理人，有該分會扶助律師接案通知書影本及律師委\n    任狀附卷可稽。本件既已獲訴訟代理之救助，且訴訟非顯無\n    勝訴之望，本件聲請於法即無不合，應予准許。\n三、爰依法律扶助法第62條，民事訴訟法第107條，裁定如主文。"
  },
  "search": "臺灣桃園地方法院民事裁定94年度家救字第7號聲請人乙○○代理人盧建宏律師相對人甲○○上列當事人間請求離婚等事件（94年度婚字第316號），聲請人聲請訴訟救助，本院裁定如下：主文准予訴訟救助。理由一、按「經分會（法律扶助基金會分會）准予法律扶助之無資力者，其於訴訟程序中，向法院聲請訴訟救助時，應准予訴訟救助。但另有不符法律扶助事實之證明者，不在此限。」，法律扶助法第62條定有明文。又「當事人無資力支出訴訟費用者，法院應依聲請，以裁定准予訴訟救助。但顯無勝訴之望者，不在此限。」，民事訴訟法第107條規定甚明。二、查本件聲請人提起本件離婚等訴訟，因無資力，經向財團法人法律扶助基金會桃園分會申請法律扶助，經該分會審查後准予法律扶助，扶助種類係訴訟代理或辯護、民事訴訟第一審訴訟代理人，有該分會扶助律師接案通知書影本及律師委任狀附卷可稽。本件既已獲訴訟代理之救助，且訴訟非顯無勝訴之望，本件聲請於法即無不合，應予准許。三、爰依法律扶助法第62條，民事訴訟法第107條，裁定如主文。中華民國94年4月8日家事法庭法官熊祥雲上列正本證明與原本無異如不服本裁定應於送達後10日內向本院提出抗告狀，並應繳納抗告費新台幣1,000元。中華民國94年4月8日書記官吳宏明",
  "characters": {
    "judges": [
      "熊祥雲"
    ],
    "prosecutors": [

    ],
    "lawyers": [
      "盧建宏"
    ],
    "clerks": [
      "吳宏明"
    ],
    "plaintiffs": [

    ],
    "defendants": [

    ],
    "prosecutor_office": [
      "乙"
    ],
    "creditors": [

    ],
    "debtors": [

    ],
    "judicial_associate_officer": [

    ]
  },
  "adjudged_at": "2005-04-08",
  "created_at": "2016-02-06 18:57:36",
  "updated_at": "2016-02-06 18:57:36"
}