{
  "identify": "KSD-100-司促-13405-20110401-2",
  "court": {
    "name": "臺灣高雄地方法院",
    "code": "KSD"
  },
  "division": {
    "name": "民事",
    "code": "V"
  },
  "year": 100,
  "word": "司促",
  "number": "13405",
  "jcheck": "2",
  "reason": "支付命令",
  "content": "臺灣高雄地方法院支付命令          100年度司促字第13405號\n債  權  人  中國信託商業銀行股份有限公司\n法定代理人  辜松\n債  務  人  李正順\n一、債務人應向債權人清償新臺幣壹拾萬零壹佰陸拾肆元，及如\n    附表所示之利息，並賠償督促程序費用新臺幣伍佰元，否則\n    應於本命令送達後二十日之不變期間內，向本院提出異議。\n二、債權人請求之原因事實：債務人李正順於94年7 月28日向債\n    權人借款72,000元，約定自94年7 月28日起至98年7 月28日\n    日止按月清償本息，利息按年利率百分之20.00 採固定利率\n    計算，依約定如有停止付款或經票據交換所通知拒絕往來者\n    ，或任何一宗債務不依約清償本金或付息者等「喪失期限利\n    益之加速條款」情形之一時，借款債務視為全部到期，此有\n    借據為證。又依據貸款申請書規定: 『立約人( 即債務人)\n    同意授權貴行( 即聲請人) 依立約人借款當時之信用狀況核\n    定及填載之。立約人同意貴行得依立約人信用狀況隨時調整\n    借款額度』，故債權人於債務人繳款狀況正常下可調整其借\n    款額度。詎債務人未依約履行債務依雙方所立借據約定當即\n    喪失期限之利益，上述借款視為全部到期，債務人至100 年\n    3 月26日止累計100,16 4元正未給付，其中69,270元為本金\n    ；26,380元為利息；4,5 14元為依約定條款計算之其他費用\n    ，債務人依約除應給付上開款項外，另應給付如附表所示之\n    利息。\n三、如債務人未於第一項期間內提出異議，本命令與確定判決有\n    同一效力。\n中    華    民    國   100    年    4     月    1     日\n                        民事庭司法事務官  黃思瑜\n附表100 年度司促字第13405 號利息：\n┌──┬───┬─────┬──────┬──────┬───────┐\n│序號│ 本金 │相關債務人│ 利息起算日 │ 利息截止日 │ 利息計算方式 │\n├──┼───┼─────┼──────┼──────┼───────┤\n│  1 │新臺幣│李正順    │100年3月27日│至清償日止  │按年利率20.00%│\n│    │69270 │          │            │            │計算之利息。  │\n│    │元    │          │            │            │              │\n└──┴───┴─────┴──────┴──────┴───────┘\n附註：\n一、案件一經確定本院即依職權核發確定證明書，債權人毋庸具\n    狀申請。\n二、嗣後遞狀應註明案號及股別。",
  "structure": {
  },
  "search": "臺灣高雄地方法院支付命令100年度司促字第13405號債權人中國信託商業銀行股份有限公司法定代理人辜松債務人李正順一、債務人應向債權人清償新臺幣壹拾萬零壹佰陸拾肆元，及如附表所示之利息，並賠償督促程序費用新臺幣伍佰元，否則應於本命令送達後二十日之不變期間內，向本院提出異議。二、債權人請求之原因事實：債務人李正順於94年7月28日向債權人借款72,000元，約定自94年7月28日起至98年7月28日日止按月清償本息，利息按年利率百分之20.00採固定利率計算，依約定如有停止付款或經票據交換所通知拒絕往來者，或任何一宗債務不依約清償本金或付息者等「喪失期限利益之加速條款」情形之一時，借款債務視為全部到期，此有借據為證。又依據貸款申請書規定:『立約人(即債務人)同意授權貴行(即聲請人)依立約人借款當時之信用狀況核定及填載之。立約人同意貴行得依立約人信用狀況隨時調整借款額度』，故債權人於債務人繳款狀況正常下可調整其借款額度。詎債務人未依約履行債務依雙方所立借據約定當即喪失期限之利益，上述借款視為全部到期，債務人至100年3月26日止累計100,164元正未給付，其中69,270元為本金；26,380元為利息；4,514元為依約定條款計算之其他費用，債務人依約除應給付上開款項外，另應給付如附表所示之利息。三、如債務人未於第一項期間內提出異議，本命令與確定判決有同一效力。中華民國100年4月1日民事庭司法事務官黃思瑜附表100年度司促字第13405號利息：┌──┬───┬─────┬──────┬──────┬───────┐│序號│本金│相關債務人│利息起算日│利息截止日│利息計算方式│├──┼───┼─────┼──────┼──────┼───────┤│1│新臺幣│李正順│100年3月27日│至清償日止│按年利率20.00%│││69270││││計算之利息。│││元│││││└──┴───┴─────┴──────┴──────┴───────┘附註：一、案件一經確定本院即依職權核發確定證明書，債權人毋庸具狀申請。二、嗣後遞狀應註明案號及股別。",
  "characters": {
    "judges": [

    ],
    "prosecutors": [

    ],
    "lawyers": [

    ],
    "clerks": [

    ],
    "plaintiffs": [

    ],
    "defendants": [

    ],
    "prosecutor_office": [

    ],
    "creditors": [
      "中國信託商業銀行股份有限公司"
    ],
    "debtors": [
      "李正順"
    ],
    "judicial_associate_officer": [
      "黃思瑜"
    ]
  },
  "adjudged_at": "2011-04-01",
  "created_at": "2016-02-12 09:52:42",
  "updated_at": "2016-02-12 09:52:42"
}