{
  "identify": "TPD-94-聲判-52-20050525-1",
  "court": {
    "name": "臺灣臺北地方法院",
    "code": "TPD"
  },
  "division": {
    "name": "刑事",
    "code": "M"
  },
  "year": 94,
  "word": "聲判",
  "number": "52",
  "jcheck": "1",
  "reason": "聲請交付審判",
  "content": "臺灣臺北地方法院刑事裁定              94年度聲判字第52號\n聲  請  人  乙○○\n即  告訴人\n右聲請人因被告甲○○傷害案件，不服台灣高等法院檢察署民國\n94年4 月29日94年度上聲議字第1268號駁回再議之處分（原不起\n訴處分：台灣台北地方法院檢察署93年度偵字第21420 號），聲\n請交付審判，本院裁定如下：\n    主  文\n聲請駁回。\n    理  由\n一、本件聲請交付審判意旨如附件聲請書。\n二、按告訴人不服上級法院檢察署檢察長或檢察總長認為再議無\n    理由而駁回之處分者，得於接受處分書後10日內委任律師提\n    出理由狀，向該管第一審法院聲請交付審判；法院認為交付\n    審判之聲請不合法或無理由者，應駁回之，刑事訴訟法第\n    258 條之1 、第258 條之3 第2 項前段分別定有明文。本件\n    聲請人即告訴人乙○○固於民國94年5 月11日收受上開台灣\n    高等法院檢察署94年度上聲議字第1268號駁回再議處分書，\n    有同署送達證書在卷可稽，惟其於同年月二十日提出聲請交\n    付審判書狀時起，迄未委任律師提出理由狀，其聲請不合法\n    ，依上揭說明，自應駁回其聲請。\n三、應依刑事訴訟法第258條之3第2項前段裁定如主文。\n中    華    民    國    94    年    5     月    25    日\n                刑事第十二庭  審判長法  官  李英豪\n                                    法  官  張永宏\n                                    法  官  胡宏文\n以上正本證明與原本無異\n本裁定不得抗告\n                                    書記官  謝韻華\n中    華    民    國    94    年    5     月    25    日\n",
  "structure": {
    "main": "聲請駁回。",
    "reason": "一、本件聲請交付審判意旨如附件聲請書。\n二、按告訴人不服上級法院檢察署檢察長或檢察總長認為再議無\n    理由而駁回之處分者，得於接受處分書後10日內委任律師提\n    出理由狀，向該管第一審法院聲請交付審判；法院認為交付\n    審判之聲請不合法或無理由者，應駁回之，刑事訴訟法第\n    258 條之1 、第258 條之3 第2 項前段分別定有明文。本件\n    聲請人即告訴人乙○○固於民國94年5 月11日收受上開台灣\n    高等法院檢察署94年度上聲議字第1268號駁回再議處分書，\n    有同署送達證書在卷可稽，惟其於同年月二十日提出聲請交\n    付審判書狀時起，迄未委任律師提出理由狀，其聲請不合法\n    ，依上揭說明，自應駁回其聲請。\n三、應依刑事訴訟法第258條之3第2項前段裁定如主文。"
  },
  "search": "臺灣臺北地方法院刑事裁定94年度聲判字第52號聲請人乙○○即告訴人右聲請人因被告甲○○傷害案件，不服台灣高等法院檢察署民國94年4月29日94年度上聲議字第1268號駁回再議之處分（原不起訴處分：台灣台北地方法院檢察署93年度偵字第21420號），聲請交付審判，本院裁定如下：主文聲請駁回。理由一、本件聲請交付審判意旨如附件聲請書。二、按告訴人不服上級法院檢察署檢察長或檢察總長認為再議無理由而駁回之處分者，得於接受處分書後10日內委任律師提出理由狀，向該管第一審法院聲請交付審判；法院認為交付審判之聲請不合法或無理由者，應駁回之，刑事訴訟法第258條之1、第258條之3第2項前段分別定有明文。本件聲請人即告訴人乙○○固於民國94年5月11日收受上開台灣高等法院檢察署94年度上聲議字第1268號駁回再議處分書，有同署送達證書在卷可稽，惟其於同年月二十日提出聲請交付審判書狀時起，迄未委任律師提出理由狀，其聲請不合法，依上揭說明，自應駁回其聲請。三、應依刑事訴訟法第258條之3第2項前段裁定如主文。中華民國94年5月25日刑事第十二庭審判長法官李英豪法官張永宏法官胡宏文以上正本證明與原本無異本裁定不得抗告書記官謝韻華中華民國94年5月25日",
  "characters": {
    "judges": [
      "李英豪",
      "張永宏",
      "胡宏文"
    ],
    "prosecutors": [

    ],
    "lawyers": [

    ],
    "clerks": [
      "謝韻華"
    ],
    "plaintiffs": [

    ],
    "defendants": [

    ],
    "prosecutor_office": [
      "乙"
    ],
    "creditors": [

    ],
    "debtors": [

    ],
    "judicial_associate_officer": [

    ]
  },
  "adjudged_at": "2005-05-25",
  "created_at": "2016-02-06 15:56:48",
  "updated_at": "2016-02-06 15:56:48"
}