{
  "identify": "ILD-100-司促-416-20110121-2",
  "court": {
    "name": "臺灣宜蘭地方法院",
    "code": "ILD"
  },
  "division": {
    "name": "民事",
    "code": "V"
  },
  "year": 100,
  "word": "司促",
  "number": "416",
  "jcheck": "2",
  "reason": "支付命令",
  "content": "臺灣宜蘭地方法院支付命令            100年度司促字第416號\n債  權  人  中國信託商業銀行股份有限公司\n法定代理人  辜松\n債  務  人  林才民\n一、債務人應向債權人清償新臺幣壹拾壹萬伍仟捌佰肆拾玖元，\n    及如附表所示之利息，並賠償督促程序費用新臺幣伍佰元，\n    否則應於本命令送達後二十日之不變期間內，向本院提出異\n    議。\n二、債權人請求之原因事實：\n  (一)債務人林才民向債權人請領信用卡使用，依約債務人即得\n      於特約商店記帳消費。卡號：0000000000000000卡別：U\n      。債務人至100年1月5日止累計82,143元正未給付，其中\n      73,922元為消費款；1,718元為循環利息；6,503元為依約\n      定條款計算之其他費用。債務人依約除應給付上開款項外\n      ，另應給付如附表所示之利息。\n  (二)債務人林才民於93年12月24日向債權人借款170,000元，\n      約定自93年12月24日起至100年12月24日止按月清償本息\n      ，利息按年利率百分之9.99採固定利率計算，依約定如有\n      停止付款或經票據交換所通知拒絕往來者，或任何一宗債\n      務不依約清償本金或付息者等「喪失期限利益之加速條款\n      」情形之一時，借款債務視為全部到期，此有借據為證。\n      詎債務人未依約履行債務依雙方所立借據約定當即喪失期\n      限之利益，上述借款視為全部到期，債務人至100年1月19\n      日止累計33,706元正未給付，其中33,414元為本金；265\n      元為利息；27元為依約定條款計算之其他費用，債務人依\n      約除應給付上開款項外，另應給付如附表所示之利息。\n  (三)本件係請求給付一定數量之金額債務，而所請求之標的，\n      茲為求清償之簡速，以免判決程序之繁雜起見，特依民事\n      訴訟法第五○八條之規定，狀請鈞院依督促程序迅賜對相\n      對人發支付命令，實為法便。\n三、如債務人未於第一項期間內提出異議，本命令與確定判決有\n    同一效力。\n中    華    民    國   100    年    1     月    21    日\n                    臺灣宜蘭地方法院民事庭\n                        司法事務官  張筱妮\n以上正本係照原本作成\n中    華    民    國   100    年    1     月    21    日\n                        書  記  官  康清煌\n附表\n100年度司促字第416號利息：\n┌──┬───┬─────┬──────┬──────┬───────┐\n│序號│ 本金 │相關債務人│ 利息起算日 │ 利息截止日 │ 利息計算方式 │\n├──┼───┼─────┼──────┼──────┼───────┤\n│  1 │新臺幣│林才民    │100年1月6日 │至清償日止  │按年利率20%計 │\n│    │73922 │          │            │            │算之利息。    │\n│    │元    │          │            │            │              │\n├──┼───┼─────┼──────┼──────┼───────┤\n│  2 │新臺幣│林才民    │100年1月20日│至清償日止  │按年利率9.99% │\n│    │33414 │          │            │            │計算之利息。  │\n│    │元    │          │            │            │              │\n└──┴───┴─────┴──────┴──────┴───────┘\n◎附註：\n一、債權人、債務人如於事後遞狀均請註明案號、股別。\n二、若債務人為法人或商號者，債權人應於收受支付命令後５日\n    內，提出法人或商號最新證記資料（例如公司設立變更登記\n    事項表）及法人或商號法定代理人最新戶籍謄本（記事欄勿\n    省略），以核對是否合法送達。（否則無法核發確定證明書\n    ）。\n三、案件一經確定，本院依職權逕行核發確定證明書，債權人毋\n    庸另行聲請。",
  "structure": {
  },
  "search": "臺灣宜蘭地方法院支付命令100年度司促字第416號債權人中國信託商業銀行股份有限公司法定代理人辜松債務人林才民一、債務人應向債權人清償新臺幣壹拾壹萬伍仟捌佰肆拾玖元，及如附表所示之利息，並賠償督促程序費用新臺幣伍佰元，否則應於本命令送達後二十日之不變期間內，向本院提出異議。二、債權人請求之原因事實：(一)債務人林才民向債權人請領信用卡使用，依約債務人即得於特約商店記帳消費。卡號：0000000000000000卡別：U。債務人至100年1月5日止累計82,143元正未給付，其中73,922元為消費款；1,718元為循環利息；6,503元為依約定條款計算之其他費用。債務人依約除應給付上開款項外，另應給付如附表所示之利息。(二)債務人林才民於93年12月24日向債權人借款170,000元，約定自93年12月24日起至100年12月24日止按月清償本息，利息按年利率百分之9.99採固定利率計算，依約定如有停止付款或經票據交換所通知拒絕往來者，或任何一宗債務不依約清償本金或付息者等「喪失期限利益之加速條款」情形之一時，借款債務視為全部到期，此有借據為證。詎債務人未依約履行債務依雙方所立借據約定當即喪失期限之利益，上述借款視為全部到期，債務人至100年1月19日止累計33,706元正未給付，其中33,414元為本金；265元為利息；27元為依約定條款計算之其他費用，債務人依約除應給付上開款項外，另應給付如附表所示之利息。(三)本件係請求給付一定數量之金額債務，而所請求之標的，茲為求清償之簡速，以免判決程序之繁雜起見，特依民事訴訟法第五○八條之規定，狀請鈞院依督促程序迅賜對相對人發支付命令，實為法便。三、如債務人未於第一項期間內提出異議，本命令與確定判決有同一效力。中華民國100年1月21日臺灣宜蘭地方法院民事庭司法事務官張筱妮以上正本係照原本作成中華民國100年1月21日書記官康清煌附表100年度司促字第416號利息：┌──┬───┬─────┬──────┬──────┬───────┐│序號│本金│相關債務人│利息起算日│利息截止日│利息計算方式│├──┼───┼─────┼──────┼──────┼───────┤│1│新臺幣│林才民│100年1月6日│至清償日止│按年利率20%計│││73922││││算之利息。│││元│││││├──┼───┼─────┼──────┼──────┼───────┤│2│新臺幣│林才民│100年1月20日│至清償日止│按年利率9.99%│││33414││││計算之利息。│││元│││││└──┴───┴─────┴──────┴──────┴───────┘◎附註：一、債權人、債務人如於事後遞狀均請註明案號、股別。二、若債務人為法人或商號者，債權人應於收受支付命令後５日內，提出法人或商號最新證記資料（例如公司設立變更登記事項表）及法人或商號法定代理人最新戶籍謄本（記事欄勿省略），以核對是否合法送達。（否則無法核發確定證明書）。三、案件一經確定，本院依職權逕行核發確定證明書，債權人毋庸另行聲請。",
  "characters": {
    "judges": [

    ],
    "prosecutors": [

    ],
    "lawyers": [

    ],
    "clerks": [

    ],
    "plaintiffs": [

    ],
    "defendants": [

    ],
    "prosecutor_office": [

    ],
    "creditors": [
      "中國信託商業銀行股份有限公司"
    ],
    "debtors": [
      "林才民"
    ],
    "judicial_associate_officer": [
      "張筱妮"
    ]
  },
  "adjudged_at": "2011-01-21",
  "created_at": "2016-02-13 08:30:10",
  "updated_at": "2016-02-13 08:30:10"
}