{
  "identify": "TCD-100-監-269-20111031-1",
  "court": {
    "name": "臺灣臺中地方法院",
    "code": "TCD"
  },
  "division": {
    "name": "民事",
    "code": "V"
  },
  "year": 100,
  "word": "監",
  "number": "269",
  "jcheck": "1",
  "reason": "許可監護人行為",
  "content": "臺灣臺中地方法院民事裁定              100年度監字第269號\n聲  請  人  黃明河\n相  對  人  黃楊\n上列當事人間聲請許可監護人行為事件，本院裁定如下：\n  主  文\n准聲請人處分相對人黃楊所有坐落臺中市○○區○○段五三三\n之一六地號土地（面積八三平方公尺、權利範圍全部）土地及其\n上門牌號碼：臺中市○○區○○路五九號之建物（權利範圍全部\n）。\n前項變賣所得價金應存入相對人設於中華郵政股份有限公司臺中\n北屯郵局局號0000000號，帳號0000000號帳戶內\n。\n聲請程序費用由相對人負擔。\n  理  由\n一、聲請意旨略以：相對人前經本院以99年度監宣字第477 號民\n    事裁定宣告為受監護宣告之人，並選定聲請人為其監護人，\n    及指定黃菊香為會同開具財產清冊之人。因相對人呈重度智\n    能不足狀態，目前仍須持續照護，每月支出生活費用須新臺\n    幣（下同）5 萬餘元，而相對人並無存款、現金或投資，為\n    支應相對人之照顧費用，爰聲請准聲請人處分相對人所有坐\n    落臺中市○○區○○段 533之16地號之土地（面積：83平方\n    公尺、權利範圍全部）及其上門牌號碼：臺中市○○區○○\n    路59號之建物（權利範圍全部）等語。\n二、按監護人對於受監護人之財產，非為受監護人之利益，不得\n    使用、代為或同意處分。監護人為下列行為，非經法院許可\n    ，不生效力：一代理受監護人購置或處分不動產。二代理受\n    監護人，就供其居住之建築物或其基地出租、供他人使用或\n    終止租賃。監護人不得以受監護人之財產為投資。但購買公\n    債、國庫券、中央銀行儲蓄券、金融債券、可轉讓定期存單\n    、金融機構承兌匯票或保證商業本票，不在此限，民法第11\n    01條定有明文。該條規定，依民法第1113條規定，準用於成\n    年人之監護。\n三、經查，聲請人主張相對人為其配偶，經本院以99年度監宣字\n    第477 號民事裁定宣告為受監護宣告之人，並選定聲請人為\n    其監護人，及指定黃菊香為會同開具財產清冊之人等情，業\n    據其提出戶籍謄本1 份為證，並經本院依職權調取99年度監\n    字第477 號監護宣告民事聲請卷宗核閱無訛，此部分自堪信\n    為真實。相對人名下有坐落臺中市○○區○○段 533之16地\n    號之土地（面積：83平方公尺、權利範圍全部）及其上門牌\n    號碼：臺中市○○區○○路59號之建物（權利範圍全部）等\n    情，業據聲請人提出土地登記第二類謄本（地號全部）、臺\n    中市政府地方稅務局房屋稅籍證明書各1 份為證，且相對人\n    名下除上開房地外，尚有土地6 筆、田賦15筆，此有本院依\n    職權調取相對人稅務電子閘門財產調件明細表在卷可參。又\n    相對人目前在家安養，且仍須持續照護，每月支出約5 萬餘\n    元等情，業據聲請人提出看護勞動契約、薪資表、繳款通知\n    書、匯款收據、購買日常用品收據等附卷可稽。又聲請人擬\n    將相對人所有坐落臺中市○○區○○段 533之16地號之土地\n    （面積：83平方公尺、權利範圍全部）及其上門牌號碼：臺\n    中市○○區○○路59號之建物（權利範圍全部），以200 萬\n    元出賣予第三人，並得相對人之子女黃菊香、黃長安、黃長\n    發、黃紋振、黃翠竹之同意等情，亦有親屬團體會議處分受\n    監護宣告人財產、親屬系統表、同意書在卷可憑。本院審酌\n    上情，認相對人既已無自理能力，生活均賴聲請人協助處理\n    ，尚有醫療、照顧養護費用亟須支付，故將相對人所有上開\n    土地予以處分，支付相對人每月之醫療、照顧養護費用，應\n    屬為相對人之利益，故有處分相對人所有坐落臺中市○○區\n    ○○段533之16地號之土地（面積：83平方公尺、權利範圍\n    全部）及其上門牌號碼：臺中市○○區○○路59號之建物（\n    權利範圍全部），以所得價款支付相對人醫療及照護費用之\n    必要。綜上，本件聲請核與法無不合，應予准許。另為確保\n    變賣不動產所得之價金為相對人療養身體之用，併諭知相對\n    人上開不動產變賣所得價金均存入相對人設於中華郵政股份\n    有限公司臺中北屯郵局局號0000000，帳號0000000號帳戶內\n    。\n四、依非訟事件法第21條第2 項，民事訴訟法第78條、95條裁定\n    如主文。\n中    華    民    國   100    年    10    月    31    日\n                  家事法庭      法  官  郭妙俐\n正本係照原本作成。\n如對本裁定抗告，須於裁定送達後10日之不變期間內，向本院提\n出抗告狀。\n中    華    民    國   100    年    10    月    31    日\n                                書記官",
  "structure": {
    "main": "准聲請人處分相對人黃楊所有坐落臺中市○○區○○段五三三\n之一六地號土地（面積八三平方公尺、權利範圍全部）土地及其\n上門牌號碼：臺中市○○區○○路五九號之建物（權利範圍全部\n）。\n前項變賣所得價金應存入相對人設於中華郵政股份有限公司臺中\n北屯郵局局號0000000號，帳號0000000號帳戶內\n。\n聲請程序費用由相對人負擔。",
    "reason": "一、聲請意旨略以：相對人前經本院以99年度監宣字第477 號民\n    事裁定宣告為受監護宣告之人，並選定聲請人為其監護人，\n    及指定黃菊香為會同開具財產清冊之人。因相對人呈重度智\n    能不足狀態，目前仍須持續照護，每月支出生活費用須新臺\n    幣（下同）5 萬餘元，而相對人並無存款、現金或投資，為\n    支應相對人之照顧費用，爰聲請准聲請人處分相對人所有坐\n    落臺中市○○區○○段 533之16地號之土地（面積：83平方\n    公尺、權利範圍全部）及其上門牌號碼：臺中市○○區○○\n    路59號之建物（權利範圍全部）等語。\n二、按監護人對於受監護人之財產，非為受監護人之利益，不得\n    使用、代為或同意處分。監護人為下列行為，非經法院許可\n    ，不生效力：一代理受監護人購置或處分不動產。二代理受\n    監護人，就供其居住之建築物或其基地出租、供他人使用或\n    終止租賃。監護人不得以受監護人之財產為投資。但購買公\n    債、國庫券、中央銀行儲蓄券、金融債券、可轉讓定期存單\n    、金融機構承兌匯票或保證商業本票，不在此限，民法第11\n    01條定有明文。該條規定，依民法第1113條規定，準用於成\n    年人之監護。\n三、經查，聲請人主張相對人為其配偶，經本院以99年度監宣字\n    第477 號民事裁定宣告為受監護宣告之人，並選定聲請人為\n    其監護人，及指定黃菊香為會同開具財產清冊之人等情，業\n    據其提出戶籍謄本1 份為證，並經本院依職權調取99年度監\n    字第477 號監護宣告民事聲請卷宗核閱無訛，此部分自堪信\n    為真實。相對人名下有坐落臺中市○○區○○段 533之16地\n    號之土地（面積：83平方公尺、權利範圍全部）及其上門牌\n    號碼：臺中市○○區○○路59號之建物（權利範圍全部）等\n    情，業據聲請人提出土地登記第二類謄本（地號全部）、臺\n    中市政府地方稅務局房屋稅籍證明書各1 份為證，且相對人\n    名下除上開房地外，尚有土地6 筆、田賦15筆，此有本院依\n    職權調取相對人稅務電子閘門財產調件明細表在卷可參。又\n    相對人目前在家安養，且仍須持續照護，每月支出約5 萬餘\n    元等情，業據聲請人提出看護勞動契約、薪資表、繳款通知\n    書、匯款收據、購買日常用品收據等附卷可稽。又聲請人擬\n    將相對人所有坐落臺中市○○區○○段 533之16地號之土地\n    （面積：83平方公尺、權利範圍全部）及其上門牌號碼：臺\n    中市○○區○○路59號之建物（權利範圍全部），以200 萬\n    元出賣予第三人，並得相對人之子女黃菊香、黃長安、黃長\n    發、黃紋振、黃翠竹之同意等情，亦有親屬團體會議處分受\n    監護宣告人財產、親屬系統表、同意書在卷可憑。本院審酌\n    上情，認相對人既已無自理能力，生活均賴聲請人協助處理\n    ，尚有醫療、照顧養護費用亟須支付，故將相對人所有上開\n    土地予以處分，支付相對人每月之醫療、照顧養護費用，應\n    屬為相對人之利益，故有處分相對人所有坐落臺中市○○區\n    ○○段533之16地號之土地（面積：83平方公尺、權利範圍\n    全部）及其上門牌號碼：臺中市○○區○○路59號之建物（\n    權利範圍全部），以所得價款支付相對人醫療及照護費用之\n    必要。綜上，本件聲請核與法無不合，應予准許。另為確保\n    變賣不動產所得之價金為相對人療養身體之用，併諭知相對\n    人上開不動產變賣所得價金均存入相對人設於中華郵政股份\n    有限公司臺中北屯郵局局號0000000，帳號0000000號帳戶內\n    。\n四、依非訟事件法第21條第2 項，民事訴訟法第78條、95條裁定\n    如主文。"
  },
  "search": "臺灣臺中地方法院民事裁定100年度監字第269號聲請人黃明河相對人黃楊上列當事人間聲請許可監護人行為事件，本院裁定如下：主文准聲請人處分相對人黃楊所有坐落臺中市○○區○○段五三三之一六地號土地（面積八三平方公尺、權利範圍全部）土地及其上門牌號碼：臺中市○○區○○路五九號之建物（權利範圍全部）。前項變賣所得價金應存入相對人設於中華郵政股份有限公司臺中北屯郵局局號0000000號，帳號0000000號帳戶內。聲請程序費用由相對人負擔。理由一、聲請意旨略以：相對人前經本院以99年度監宣字第477號民事裁定宣告為受監護宣告之人，並選定聲請人為其監護人，及指定黃菊香為會同開具財產清冊之人。因相對人呈重度智能不足狀態，目前仍須持續照護，每月支出生活費用須新臺幣（下同）5萬餘元，而相對人並無存款、現金或投資，為支應相對人之照顧費用，爰聲請准聲請人處分相對人所有坐落臺中市○○區○○段533之16地號之土地（面積：83平方公尺、權利範圍全部）及其上門牌號碼：臺中市○○區○○路59號之建物（權利範圍全部）等語。二、按監護人對於受監護人之財產，非為受監護人之利益，不得使用、代為或同意處分。監護人為下列行為，非經法院許可，不生效力：一代理受監護人購置或處分不動產。二代理受監護人，就供其居住之建築物或其基地出租、供他人使用或終止租賃。監護人不得以受監護人之財產為投資。但購買公債、國庫券、中央銀行儲蓄券、金融債券、可轉讓定期存單、金融機構承兌匯票或保證商業本票，不在此限，民法第1101條定有明文。該條規定，依民法第1113條規定，準用於成年人之監護。三、經查，聲請人主張相對人為其配偶，經本院以99年度監宣字第477號民事裁定宣告為受監護宣告之人，並選定聲請人為其監護人，及指定黃菊香為會同開具財產清冊之人等情，業據其提出戶籍謄本1份為證，並經本院依職權調取99年度監字第477號監護宣告民事聲請卷宗核閱無訛，此部分自堪信為真實。相對人名下有坐落臺中市○○區○○段533之16地號之土地（面積：83平方公尺、權利範圍全部）及其上門牌號碼：臺中市○○區○○路59號之建物（權利範圍全部）等情，業據聲請人提出土地登記第二類謄本（地號全部）、臺中市政府地方稅務局房屋稅籍證明書各1份為證，且相對人名下除上開房地外，尚有土地6筆、田賦15筆，此有本院依職權調取相對人稅務電子閘門財產調件明細表在卷可參。又相對人目前在家安養，且仍須持續照護，每月支出約5萬餘元等情，業據聲請人提出看護勞動契約、薪資表、繳款通知書、匯款收據、購買日常用品收據等附卷可稽。又聲請人擬將相對人所有坐落臺中市○○區○○段533之16地號之土地（面積：83平方公尺、權利範圍全部）及其上門牌號碼：臺中市○○區○○路59號之建物（權利範圍全部），以200萬元出賣予第三人，並得相對人之子女黃菊香、黃長安、黃長發、黃紋振、黃翠竹之同意等情，亦有親屬團體會議處分受監護宣告人財產、親屬系統表、同意書在卷可憑。本院審酌上情，認相對人既已無自理能力，生活均賴聲請人協助處理，尚有醫療、照顧養護費用亟須支付，故將相對人所有上開土地予以處分，支付相對人每月之醫療、照顧養護費用，應屬為相對人之利益，故有處分相對人所有坐落臺中市○○區○○段533之16地號之土地（面積：83平方公尺、權利範圍全部）及其上門牌號碼：臺中市○○區○○路59號之建物（權利範圍全部），以所得價款支付相對人醫療及照護費用之必要。綜上，本件聲請核與法無不合，應予准許。另為確保變賣不動產所得之價金為相對人療養身體之用，併諭知相對人上開不動產變賣所得價金均存入相對人設於中華郵政股份有限公司臺中北屯郵局局號0000000，帳號0000000號帳戶內。四、依非訟事件法第21條第2項，民事訴訟法第78條、95條裁定如主文。中華民國100年10月31日家事法庭法官郭妙俐正本係照原本作成。如對本裁定抗告，須於裁定送達後10日之不變期間內，向本院提出抗告狀。中華民國100年10月31日書記官",
  "characters": {
    "judges": [
      "郭妙俐"
    ],
    "prosecutors": [

    ],
    "lawyers": [

    ],
    "clerks": [

    ],
    "plaintiffs": [

    ],
    "defendants": [

    ],
    "prosecutor_office": [
      "黃明河"
    ],
    "creditors": [

    ],
    "debtors": [

    ],
    "judicial_associate_officer": [

    ]
  },
  "adjudged_at": "2011-10-31",
  "created_at": "2016-02-14 08:36:01",
  "updated_at": "2016-02-14 08:36:01"
}