{
  "identify": "TCD-100-交易-161-20110224-1",
  "court": {
    "name": "臺灣臺中地方法院",
    "code": "TCD"
  },
  "division": {
    "name": "刑事",
    "code": "M"
  },
  "year": 100,
  "word": "交易",
  "number": "161",
  "jcheck": "1",
  "reason": "公共危險",
  "content": "臺灣臺中地方法院宣示判決筆錄        100年度交易字第161號\n公  訴  人  臺灣臺中地方法院檢察署檢察官\n被      告  力明坤\n指定辯護人  本院公設辯護人賴忠杰\n上列被告因公共危險案件，經檢察官提起公訴（100年度偵字第\n990號），並聲請改依協商程序而為判決，本院裁定進行認罪協\n商程序後，於中華民國100年2月24日下午16時30分，在本院刑事\n第十五法庭宣示判決，出席職員如下：\n          法  官  柯雅惠\n          書記官  廖健雄\n法官起立朗讀判決主文、犯罪事實要旨、處罰條文及告以上訴限\n制、期間並提出上訴狀之法院，且諭知記載其內容：\n一、判決主文：\n    力明坤服用酒類，不能安全駕駛動力交通工具而駕駛，累犯\n    ，處有期徒刑柒月。\n二、犯罪事實要旨：\n    力明坤因公共危險案件，經本院以96年度中交簡字第536號\n    判處有期徒刑5月確定，又因公共危險案件，經本院以96年\n    度中交簡字第769號判處有期徒刑4月確定，上開2案因符合\n    中華民國九十六年罪犯減刑條例要件，經本院以96年度聲減\n    字第2589號減刑後定應執行有期徒刑4月確定，於96年7月31\n    日徒刑執行完畢。再因公共危險案件，經本院以98年度中交\n    簡字第380號判處有期徒刑6月確定，於98年4月7日易科罰金\n    執行完畢。詎其猶不知悔改，自99年12月24日下午1時30分\n    許起，至同日下午5時許止，在臺中市○○路及福雅路交岔\n    路口某工地內，飲用含酒精飲料「保力達」2瓶及燒酒雞約5\n    、6碗後，已達不能安全駕駛動力交通工具之程度，竟仍於\n    同日18時30分許，駕駛車牌號碼為5077-MD號自用小客車上\n    路，嗣於同日18時55分許，行經臺中市○區○○路47之1號\n    前時，因不勝酒力，注意力及控制力降低，不慎追撞由王善\n    所騎乘之車牌號碼TAO-248號輕型機車，及周冀明所駕駛之\n    車牌號碼RI-1571號自用小客車而肇事。經警據報前往處理\n    ，測得力明坤呼氣酒精濃度達1.06mg/l而查獲上情。\n三、處罰條文：\n    刑法第185條之3、第47條第1項，刑法施行法第1條之1，判\n    決如主文。\n四、協商判決除有刑事訴訟法第455 條之4 第1 項第1 款於本訊\n    問程序終結前，被告撤銷協商合意或檢察官撤回協商聲請者\n    ；第2 款被告協商之意思非出於自由意志者；第4 款被告所\n    犯之罪非第455 條之2 第1 項所定得以協商判決者；第6 款\n    被告有其他較重之裁判上一罪之犯罪事實者；第7 款法院認\n    應諭知免刑或免訴、不受理者情形之一，及違反同條第2 項\n    「法院應於協商合意範圍內為判決；法院為協商判決所科之\n    刑，以宣告緩刑或2 年以下有期徒刑、拘役或罰金為限」之\n    規定者外，不得上訴。\n五、如不服本判決，應於收受判決後10日內向本院提出上訴書狀\n    ，並應敘述具體理由；其未敘述上訴理由者，應於上訴期間\n    屆滿後20日內向本院補提理由書（均須按他造當事人之人數\n    附繕本）「切勿逕送上級法院」。\n中    華    民    國   100    年    2     月    24    日\n                  刑事第十五法庭    法  官  柯雅惠\n以上正本證明與原本無異。\n                                    書記官  廖健雄\n中    華    民    國   100    年    2     月    24    日",
  "structure": {
  },
  "search": "臺灣臺中地方法院宣示判決筆錄100年度交易字第161號公訴人臺灣臺中地方法院檢察署檢察官被告力明坤指定辯護人本院公設辯護人賴忠杰上列被告因公共危險案件，經檢察官提起公訴（100年度偵字第990號），並聲請改依協商程序而為判決，本院裁定進行認罪協商程序後，於中華民國100年2月24日下午16時30分，在本院刑事第十五法庭宣示判決，出席職員如下：法官柯雅惠書記官廖健雄法官起立朗讀判決主文、犯罪事實要旨、處罰條文及告以上訴限制、期間並提出上訴狀之法院，且諭知記載其內容：一、判決主文：力明坤服用酒類，不能安全駕駛動力交通工具而駕駛，累犯，處有期徒刑柒月。二、犯罪事實要旨：力明坤因公共危險案件，經本院以96年度中交簡字第536號判處有期徒刑5月確定，又因公共危險案件，經本院以96年度中交簡字第769號判處有期徒刑4月確定，上開2案因符合中華民國九十六年罪犯減刑條例要件，經本院以96年度聲減字第2589號減刑後定應執行有期徒刑4月確定，於96年7月31日徒刑執行完畢。再因公共危險案件，經本院以98年度中交簡字第380號判處有期徒刑6月確定，於98年4月7日易科罰金執行完畢。詎其猶不知悔改，自99年12月24日下午1時30分許起，至同日下午5時許止，在臺中市○○路及福雅路交岔路口某工地內，飲用含酒精飲料「保力達」2瓶及燒酒雞約5、6碗後，已達不能安全駕駛動力交通工具之程度，竟仍於同日18時30分許，駕駛車牌號碼為5077-MD號自用小客車上路，嗣於同日18時55分許，行經臺中市○區○○路47之1號前時，因不勝酒力，注意力及控制力降低，不慎追撞由王善所騎乘之車牌號碼TAO-248號輕型機車，及周冀明所駕駛之車牌號碼RI-1571號自用小客車而肇事。經警據報前往處理，測得力明坤呼氣酒精濃度達1.06mg/l而查獲上情。三、處罰條文：刑法第185條之3、第47條第1項，刑法施行法第1條之1，判決如主文。四、協商判決除有刑事訴訟法第455條之4第1項第1款於本訊問程序終結前，被告撤銷協商合意或檢察官撤回協商聲請者；第2款被告協商之意思非出於自由意志者；第4款被告所犯之罪非第455條之2第1項所定得以協商判決者；第6款被告有其他較重之裁判上一罪之犯罪事實者；第7款法院認應諭知免刑或免訴、不受理者情形之一，及違反同條第2項「法院應於協商合意範圍內為判決；法院為協商判決所科之刑，以宣告緩刑或2年以下有期徒刑、拘役或罰金為限」之規定者外，不得上訴。五、如不服本判決，應於收受判決後10日內向本院提出上訴書狀，並應敘述具體理由；其未敘述上訴理由者，應於上訴期間屆滿後20日內向本院補提理由書（均須按他造當事人之人數附繕本）「切勿逕送上級法院」。中華民國100年2月24日刑事第十五法庭法官柯雅惠以上正本證明與原本無異。書記官廖健雄中華民國100年2月24日",
  "characters": {
    "judges": [
      "柯雅惠",
      "柯雅惠"
    ],
    "prosecutors": [

    ],
    "lawyers": [

    ],
    "clerks": [
      "廖健雄",
      "廖健雄"
    ],
    "plaintiffs": [

    ],
    "defendants": [
      "力明坤"
    ],
    "prosecutor_office": [
      "臺灣臺中地方法院檢察署檢察官"
    ],
    "creditors": [

    ],
    "debtors": [

    ],
    "judicial_associate_officer": [

    ]
  },
  "adjudged_at": "2011-02-24",
  "created_at": "2016-02-12 05:51:42",
  "updated_at": "2016-02-12 05:51:42"
}