{
  "identify": "CHD-100-司票-577-20111102-1",
  "court": {
    "name": "臺灣彰化地方法院",
    "code": "CHD"
  },
  "division": {
    "name": "民事",
    "code": "V"
  },
  "year": 100,
  "word": "司票",
  "number": "577",
  "jcheck": "1",
  "reason": "本票裁定",
  "content": "臺灣彰化地方法院簡易庭民事裁定      100年度司票字第577號\n聲  請  人  馬志成\n相  對  人  蕭能昌\n上列當事人間聲請本票裁定事件，本院裁定如下：\n    主  文\n相對人於民國一百年五月二十四日簽發之本票內載憑票支付聲請\n人新臺幣貳萬元，及自民國一百年八月二十八日起至清償日止，\n按年息百分之六計算之利息，准予強制執行。\n聲請程序費用新臺幣伍佰元由相對人負擔。\n    理  由\n一、本件聲請意旨略以：聲請人執有相對人於民國100年5月24日\n    簽發免除作成拒絕證書之本票1紙，內載金額新臺幣20,000\n    元，到期日為民國100年5月24日，詎於民國100年8月28日提\n    示，未獲清償，爰提出本票1紙，聲請裁定准許強制執行。\n二、本件聲請核與票據法第123條規定相符，應予准許。\n三、依非訟事件法第21條第2項，民事訴訟法第78條，裁定如主\n    文。\n四、如不服本裁定，應於裁定送達後10日內向本院提出抗告狀(\n    需附繕本)，並繳納抗告費新台幣1000元。發票人如主張本\n    票係偽造、變造者，得於本裁定送達後20日內，對執票人向\n    本院另行提起確認之訴。發票人已提起確認之訴者，得依非\n    訟事件法第195條規定聲請法院停止執行。\n中    華    民    國   100    年    11    月    2     日\n                  簡易庭司法事務官  楊淑婷",
  "structure": {
    "main": "相對人於民國一百年五月二十四日簽發之本票內載憑票支付聲請\n人新臺幣貳萬元，及自民國一百年八月二十八日起至清償日止，\n按年息百分之六計算之利息，准予強制執行。\n聲請程序費用新臺幣伍佰元由相對人負擔。",
    "reason": "一、本件聲請意旨略以：聲請人執有相對人於民國100年5月24日\n    簽發免除作成拒絕證書之本票1紙，內載金額新臺幣20,000\n    元，到期日為民國100年5月24日，詎於民國100年8月28日提\n    示，未獲清償，爰提出本票1紙，聲請裁定准許強制執行。\n二、本件聲請核與票據法第123條規定相符，應予准許。\n三、依非訟事件法第21條第2項，民事訴訟法第78條，裁定如主\n    文。\n四、如不服本裁定，應於裁定送達後10日內向本院提出抗告狀(\n    需附繕本)，並繳納抗告費新台幣1000元。發票人如主張本\n    票係偽造、變造者，得於本裁定送達後20日內，對執票人向\n    本院另行提起確認之訴。發票人已提起確認之訴者，得依非\n    訟事件法第195條規定聲請法院停止執行。"
  },
  "search": "臺灣彰化地方法院簡易庭民事裁定100年度司票字第577號聲請人馬志成相對人蕭能昌上列當事人間聲請本票裁定事件，本院裁定如下：主文相對人於民國一百年五月二十四日簽發之本票內載憑票支付聲請人新臺幣貳萬元，及自民國一百年八月二十八日起至清償日止，按年息百分之六計算之利息，准予強制執行。聲請程序費用新臺幣伍佰元由相對人負擔。理由一、本件聲請意旨略以：聲請人執有相對人於民國100年5月24日簽發免除作成拒絕證書之本票1紙，內載金額新臺幣20,000元，到期日為民國100年5月24日，詎於民國100年8月28日提示，未獲清償，爰提出本票1紙，聲請裁定准許強制執行。二、本件聲請核與票據法第123條規定相符，應予准許。三、依非訟事件法第21條第2項，民事訴訟法第78條，裁定如主文。四、如不服本裁定，應於裁定送達後10日內向本院提出抗告狀(需附繕本)，並繳納抗告費新台幣1000元。發票人如主張本票係偽造、變造者，得於本裁定送達後20日內，對執票人向本院另行提起確認之訴。發票人已提起確認之訴者，得依非訟事件法第195條規定聲請法院停止執行。中華民國100年11月2日簡易庭司法事務官楊淑婷",
  "characters": {
    "judges": [

    ],
    "prosecutors": [

    ],
    "lawyers": [

    ],
    "clerks": [

    ],
    "plaintiffs": [

    ],
    "defendants": [

    ],
    "prosecutor_office": [
      "馬志成"
    ],
    "creditors": [

    ],
    "debtors": [

    ],
    "judicial_associate_officer": [
      "楊淑婷"
    ]
  },
  "adjudged_at": "2011-11-02",
  "created_at": "2016-02-12 23:39:11",
  "updated_at": "2016-02-12 23:39:11"
}