{
  "identify": "CYD-100-撤緩-109-20111102-1",
  "court": {
    "name": "臺灣嘉義地方法院",
    "code": "CYD"
  },
  "division": {
    "name": "刑事",
    "code": "M"
  },
  "year": 100,
  "word": "撤緩",
  "number": "109",
  "jcheck": "1",
  "reason": "聲請撤銷緩刑",
  "content": "臺灣嘉義地方法院刑事裁定            100年度撤緩字第109號\n聲  請  人  臺灣嘉義地方法院檢察署檢察官\n受  刑  人  黃琮軒\n上列聲請人因受刑人妨害自由案件（本院96年度嘉簡字第1518號\n），聲請撤銷緩刑之宣告（96年度執保字第152號），本院裁定\n如下：\n    主  文\n黃琮軒之緩刑宣告（本院96年度嘉簡字第1518號）撤銷。\n    理  由\n一、聲請意旨略以：受刑人黃琮軒因妨害自由案件，前經本院於\n    民國96年9月29日以96年度嘉簡字第1518號判決判處有期徒\n    刑11月15日，緩刑4年，於96年11月5日確定。惟該受刑人於\n    緩刑期內，更犯槍砲彈藥刀械管制條例案件，經最高法院於\n    100年9月29日以100年度臺上字第5305號判決判處有期徒刑3\n    年8月、併科罰金新臺幣8萬元，於100年9月29日確定，依刑\n    法第75條第1項第1款之規定，應撤銷其緩刑之宣告，爰依刑\n    事訴訟法第476條規定聲請裁定之。\n二、按受緩刑之宣告，而有下列情形之一者，撤銷其宣告：一、\n    緩刑期內因故意犯他罪，而在緩刑期內受逾6月有期徒刑之\n    宣告確定者。二、緩刑前因故意犯他罪，而在緩刑期內受逾\n    6月有期徒刑之宣告確定者。前項撤銷之聲請，於判決確定\n    後6月以內為之。次按於中華民國98年5月19日刑法修正施行\n    前，受緩刑之宣告，98年5月19日修正刑法施行後，仍在緩\n    刑期內者，適用98年5月19日修正施行之刑法第75條及第75\n    條之1規定，刑法第75條、中華民國刑法施行法第6條之1第2\n    項定有明文。又槍砲彈藥刀械管制條例第7條第1項未經許可\n    無故持有爆裂物罪，其持有之繼續，為行為之繼續，而非狀\n    態之繼續，亦即一經非法持有爆裂物，該罪雖告成立，但其\n    完結，須繼續至持有行為終了時為止。是受刑人前案受有緩\n    刑宣告，就後案係在前案緩刑期內故意犯罪或緩刑宣告前所\n    犯，自亦應以其持有行為終了時決之。\n三、查受刑人前因犯妨害自由案件，前經本院於民國96年9月29\n    日以96年度嘉簡字第1518號判決判處有期徒刑11月15日，緩\n    刑4年，於96年11月5日確定；復因其於92年2月某日在不詳\n    地點製造爆裂物並持有之，迄至99年2月13日13時30分許，\n    經警查獲上揭爆裂物，其持有犯行始終了。則其於前揭妨害\n    自由案件緩刑期內之99年2月13日故意犯製造並持有爆裂物\n    罪，經本院99年度訴字第930號判處有期徒刑3年8月，併科\n    罰金新臺幣8萬元，上訴後，分別經臺灣高等法院臺南分院\n    以100年度上訴字第315號、最高法院以100年度臺上字第\n    5305號判決駁回上訴，而於100年9月29日確定等情，有各開\n    判決正本及臺灣高等法院被告前案紀錄表1份在卷可考，足\n    認受刑人於緩刑期內因故意犯他罪，而在緩刑期內受逾6月\n    有期徒刑之宣告確定，且受刑人係於98年5月19日刑法修正\n    施行前之98年1月9日前受緩刑之宣告，而於緩刑期內之99年\n    2月13日再犯他罪，並受逾6月有期徒刑之宣告確定，依前揭\n    施行法之規定，自應適用新修正刑法第75條判斷是否撤銷緩\n    刑。是聲請人聲請撤銷受刑人前揭緩刑之宣告，核與刑法第\n    75條第1項第1款規定相符，應予准許。\n四、依刑事訴訟法第476條、第220條規定，裁定如主文。\n中    華    民    國   100    年    11    月    2     日\n                  刑事第四庭    法  官  王慧娟\n以上正本證明與原本無異。\n如不服本裁定，應於送達後5日內，向本院提出抗告狀。\n中    華    民    國   100    年    11    月    2     日\n                                書記官  高文靜",
  "structure": {
    "main": "黃琮軒之緩刑宣告（本院96年度嘉簡字第1518號）撤銷。",
    "reason": "一、聲請意旨略以：受刑人黃琮軒因妨害自由案件，前經本院於\n    民國96年9月29日以96年度嘉簡字第1518號判決判處有期徒\n    刑11月15日，緩刑4年，於96年11月5日確定。惟該受刑人於\n    緩刑期內，更犯槍砲彈藥刀械管制條例案件，經最高法院於\n    100年9月29日以100年度臺上字第5305號判決判處有期徒刑3\n    年8月、併科罰金新臺幣8萬元，於100年9月29日確定，依刑\n    法第75條第1項第1款之規定，應撤銷其緩刑之宣告，爰依刑\n    事訴訟法第476條規定聲請裁定之。\n二、按受緩刑之宣告，而有下列情形之一者，撤銷其宣告：一、\n    緩刑期內因故意犯他罪，而在緩刑期內受逾6月有期徒刑之\n    宣告確定者。二、緩刑前因故意犯他罪，而在緩刑期內受逾\n    6月有期徒刑之宣告確定者。前項撤銷之聲請，於判決確定\n    後6月以內為之。次按於中華民國98年5月19日刑法修正施行\n    前，受緩刑之宣告，98年5月19日修正刑法施行後，仍在緩\n    刑期內者，適用98年5月19日修正施行之刑法第75條及第75\n    條之1規定，刑法第75條、中華民國刑法施行法第6條之1第2\n    項定有明文。又槍砲彈藥刀械管制條例第7條第1項未經許可\n    無故持有爆裂物罪，其持有之繼續，為行為之繼續，而非狀\n    態之繼續，亦即一經非法持有爆裂物，該罪雖告成立，但其\n    完結，須繼續至持有行為終了時為止。是受刑人前案受有緩\n    刑宣告，就後案係在前案緩刑期內故意犯罪或緩刑宣告前所\n    犯，自亦應以其持有行為終了時決之。\n三、查受刑人前因犯妨害自由案件，前經本院於民國96年9月29\n    日以96年度嘉簡字第1518號判決判處有期徒刑11月15日，緩\n    刑4年，於96年11月5日確定；復因其於92年2月某日在不詳\n    地點製造爆裂物並持有之，迄至99年2月13日13時30分許，\n    經警查獲上揭爆裂物，其持有犯行始終了。則其於前揭妨害\n    自由案件緩刑期內之99年2月13日故意犯製造並持有爆裂物\n    罪，經本院99年度訴字第930號判處有期徒刑3年8月，併科\n    罰金新臺幣8萬元，上訴後，分別經臺灣高等法院臺南分院\n    以100年度上訴字第315號、最高法院以100年度臺上字第\n    5305號判決駁回上訴，而於100年9月29日確定等情，有各開\n    判決正本及臺灣高等法院被告前案紀錄表1份在卷可考，足\n    認受刑人於緩刑期內因故意犯他罪，而在緩刑期內受逾6月\n    有期徒刑之宣告確定，且受刑人係於98年5月19日刑法修正\n    施行前之98年1月9日前受緩刑之宣告，而於緩刑期內之99年\n    2月13日再犯他罪，並受逾6月有期徒刑之宣告確定，依前揭\n    施行法之規定，自應適用新修正刑法第75條判斷是否撤銷緩\n    刑。是聲請人聲請撤銷受刑人前揭緩刑之宣告，核與刑法第\n    75條第1項第1款規定相符，應予准許。\n四、依刑事訴訟法第476條、第220條規定，裁定如主文。"
  },
  "search": "臺灣嘉義地方法院刑事裁定100年度撤緩字第109號聲請人臺灣嘉義地方法院檢察署檢察官受刑人黃琮軒上列聲請人因受刑人妨害自由案件（本院96年度嘉簡字第1518號），聲請撤銷緩刑之宣告（96年度執保字第152號），本院裁定如下：主文黃琮軒之緩刑宣告（本院96年度嘉簡字第1518號）撤銷。理由一、聲請意旨略以：受刑人黃琮軒因妨害自由案件，前經本院於民國96年9月29日以96年度嘉簡字第1518號判決判處有期徒刑11月15日，緩刑4年，於96年11月5日確定。惟該受刑人於緩刑期內，更犯槍砲彈藥刀械管制條例案件，經最高法院於100年9月29日以100年度臺上字第5305號判決判處有期徒刑3年8月、併科罰金新臺幣8萬元，於100年9月29日確定，依刑法第75條第1項第1款之規定，應撤銷其緩刑之宣告，爰依刑事訴訟法第476條規定聲請裁定之。二、按受緩刑之宣告，而有下列情形之一者，撤銷其宣告：一、緩刑期內因故意犯他罪，而在緩刑期內受逾6月有期徒刑之宣告確定者。二、緩刑前因故意犯他罪，而在緩刑期內受逾6月有期徒刑之宣告確定者。前項撤銷之聲請，於判決確定後6月以內為之。次按於中華民國98年5月19日刑法修正施行前，受緩刑之宣告，98年5月19日修正刑法施行後，仍在緩刑期內者，適用98年5月19日修正施行之刑法第75條及第75條之1規定，刑法第75條、中華民國刑法施行法第6條之1第2項定有明文。又槍砲彈藥刀械管制條例第7條第1項未經許可無故持有爆裂物罪，其持有之繼續，為行為之繼續，而非狀態之繼續，亦即一經非法持有爆裂物，該罪雖告成立，但其完結，須繼續至持有行為終了時為止。是受刑人前案受有緩刑宣告，就後案係在前案緩刑期內故意犯罪或緩刑宣告前所犯，自亦應以其持有行為終了時決之。三、查受刑人前因犯妨害自由案件，前經本院於民國96年9月29日以96年度嘉簡字第1518號判決判處有期徒刑11月15日，緩刑4年，於96年11月5日確定；復因其於92年2月某日在不詳地點製造爆裂物並持有之，迄至99年2月13日13時30分許，經警查獲上揭爆裂物，其持有犯行始終了。則其於前揭妨害自由案件緩刑期內之99年2月13日故意犯製造並持有爆裂物罪，經本院99年度訴字第930號判處有期徒刑3年8月，併科罰金新臺幣8萬元，上訴後，分別經臺灣高等法院臺南分院以100年度上訴字第315號、最高法院以100年度臺上字第5305號判決駁回上訴，而於100年9月29日確定等情，有各開判決正本及臺灣高等法院被告前案紀錄表1份在卷可考，足認受刑人於緩刑期內因故意犯他罪，而在緩刑期內受逾6月有期徒刑之宣告確定，且受刑人係於98年5月19日刑法修正施行前之98年1月9日前受緩刑之宣告，而於緩刑期內之99年2月13日再犯他罪，並受逾6月有期徒刑之宣告確定，依前揭施行法之規定，自應適用新修正刑法第75條判斷是否撤銷緩刑。是聲請人聲請撤銷受刑人前揭緩刑之宣告，核與刑法第75條第1項第1款規定相符，應予准許。四、依刑事訴訟法第476條、第220條規定，裁定如主文。中華民國100年11月2日刑事第四庭法官王慧娟以上正本證明與原本無異。如不服本裁定，應於送達後5日內，向本院提出抗告狀。中華民國100年11月2日書記官高文靜",
  "characters": {
    "judges": [
      "王慧娟"
    ],
    "prosecutors": [

    ],
    "lawyers": [

    ],
    "clerks": [

    ],
    "plaintiffs": [

    ],
    "defendants": [

    ],
    "prosecutor_office": [
      "臺灣嘉義地方法院檢察署檢察官"
    ],
    "creditors": [

    ],
    "debtors": [

    ],
    "judicial_associate_officer": [

    ]
  },
  "adjudged_at": "2011-11-02",
  "created_at": "2016-02-12 23:51:31",
  "updated_at": "2016-02-12 23:51:31"
}