{
  "identify": "CYD-100-訴-444-20110906-1",
  "court": {
    "name": "臺灣嘉義地方法院",
    "code": "CYD"
  },
  "division": {
    "name": "民事",
    "code": "V"
  },
  "year": 100,
  "word": "訴",
  "number": "444",
  "jcheck": "1",
  "reason": "清償債務",
  "content": "臺灣嘉義地方法院民事裁定  100年度訴字第444號\n原      告  千瑜耐火材料科技有限公司\n法定代理人  黃建勳\n被      告  嘉展塑膠工業有限公司\n法定代理人  吳文凱\n上列當事人間清償債務事件，本院裁定如下：\n    主  文\n原告之訴駁回。\n訴訟費用由原告負擔。\n    理  由\n一、按提起民事訴訟，應依民事訴訟法第77條之13規定繳納裁判\n    費，此為必須具備之程式。次按依民事訴訟法第519條第1項\n    規定以支付命令之聲請視為起訴或聲請調解者，仍應依第77\n    條之13或第77條之20規定全額徵收裁判費或聲請費，此觀同\n    法第77條之21第 1項規定甚明。\n二、查原告因清償債務事件聲請對被告發支付命令，惟被告已於\n    法定期間內聲明異議，應以支付命令之聲請視為起訴。原告\n    僅繳納部分裁判費，經本院於民國100年8月16日裁定命原告\n    於收受裁定後5日內補正，此項裁定已於100年 8月18日送達\n    原告，有送達證書在卷可稽。而原告逾期迄今仍未補正，有\n    本院裁判費查詢簡答表及多元化案件繳費狀況查詢清單各乙\n    份附卷可憑，是原告起訴自非合法，應予駁回。\n三、依民事訴訟法第249條第 1項第6款、第95條、第78條，裁定\n    如主文。\n中    華    民    國   100    年    9     月    6     日\n                  民事第三庭  法  官  曾宏揚\n以上正本係照原本作成。\n如對本裁定抗告應於送達後10日內向本院提出抗告狀。\n中    華    民    國   100    年    9     月    6     日\n                              書記官  陳見明",
  "structure": {
    "main": "原告之訴駁回。\n訴訟費用由原告負擔。",
    "reason": "一、按提起民事訴訟，應依民事訴訟法第77條之13規定繳納裁判\n    費，此為必須具備之程式。次按依民事訴訟法第519條第1項\n    規定以支付命令之聲請視為起訴或聲請調解者，仍應依第77\n    條之13或第77條之20規定全額徵收裁判費或聲請費，此觀同\n    法第77條之21第 1項規定甚明。\n二、查原告因清償債務事件聲請對被告發支付命令，惟被告已於\n    法定期間內聲明異議，應以支付命令之聲請視為起訴。原告\n    僅繳納部分裁判費，經本院於民國100年8月16日裁定命原告\n    於收受裁定後5日內補正，此項裁定已於100年 8月18日送達\n    原告，有送達證書在卷可稽。而原告逾期迄今仍未補正，有\n    本院裁判費查詢簡答表及多元化案件繳費狀況查詢清單各乙\n    份附卷可憑，是原告起訴自非合法，應予駁回。\n三、依民事訴訟法第249條第 1項第6款、第95條、第78條，裁定\n    如主文。"
  },
  "search": "臺灣嘉義地方法院民事裁定100年度訴字第444號原告千瑜耐火材料科技有限公司法定代理人黃建勳被告嘉展塑膠工業有限公司法定代理人吳文凱上列當事人間清償債務事件，本院裁定如下：主文原告之訴駁回。訴訟費用由原告負擔。理由一、按提起民事訴訟，應依民事訴訟法第77條之13規定繳納裁判費，此為必須具備之程式。次按依民事訴訟法第519條第1項規定以支付命令之聲請視為起訴或聲請調解者，仍應依第77條之13或第77條之20規定全額徵收裁判費或聲請費，此觀同法第77條之21第1項規定甚明。二、查原告因清償債務事件聲請對被告發支付命令，惟被告已於法定期間內聲明異議，應以支付命令之聲請視為起訴。原告僅繳納部分裁判費，經本院於民國100年8月16日裁定命原告於收受裁定後5日內補正，此項裁定已於100年8月18日送達原告，有送達證書在卷可稽。而原告逾期迄今仍未補正，有本院裁判費查詢簡答表及多元化案件繳費狀況查詢清單各乙份附卷可憑，是原告起訴自非合法，應予駁回。三、依民事訴訟法第249條第1項第6款、第95條、第78條，裁定如主文。中華民國100年9月6日民事第三庭法官曾宏揚以上正本係照原本作成。如對本裁定抗告應於送達後10日內向本院提出抗告狀。中華民國100年9月6日書記官陳見明",
  "characters": {
    "judges": [
      "曾宏揚"
    ],
    "prosecutors": [

    ],
    "lawyers": [

    ],
    "clerks": [

    ],
    "plaintiffs": [
      "千瑜耐火材料科技有限公司"
    ],
    "defendants": [
      "嘉展塑膠工業有限公司"
    ],
    "prosecutor_office": [

    ],
    "creditors": [

    ],
    "debtors": [

    ],
    "judicial_associate_officer": [

    ]
  },
  "adjudged_at": "2011-09-06",
  "created_at": "2016-02-12 14:24:35",
  "updated_at": "2016-02-12 14:24:35"
}