{
  "identify": "HLD-93-訴-29-20040205-1",
  "court": {
    "name": "臺灣花蓮地方法院",
    "code": "HLD"
  },
  "division": {
    "name": "民事",
    "code": "V"
  },
  "year": 93,
  "word": "訴",
  "number": "29",
  "jcheck": "1",
  "reason": "給付承攬報酬",
  "content": "臺灣花蓮地方法院民事裁定              九十三年度訴字第二九號\n    原      告  中山園藝有限公司\n    法定代理人  甲○○\n    被      告  花蓮海洋公園股份有限公司\n    法定代理人  趙藤雄\n右當事人間給付承攬報酬事件，本院裁定如左：\n    主      文\n原告之訴駁回。\n訴訟費用由原告負擔。\n    理      由\n一、按提起民事訴訟應繳納裁判費，此為起訴必須具備之程式。\n二、本件原告因給付承攬報酬事件，聲請對被告發支付命令，惟被告已於法定期間內\n    對支付命令提出異議，應以支付命令之聲請視為起訴。惟原告除繳納支付命令裁\n    判費新台幣（下同）一千元外，尚有裁判費九千九百元未繳，經本院於民國九十\n    三年一月七日裁定命原告於十四日內補正。該項裁定已於九十三年一月十九日送\n    達原告，有送達證書附卷可稽。\n三、原告逾期迄未補正，其訴顯難認為合法，自應予駁回。\n四、依民事訴訟法第二百四十九條第一項第六款、第九十五條、第七十八條，裁定如\n    主文。\n中      華      民      國    九十三    年      二    月        五      日\n                                  臺灣花蓮地方法院民事庭\n~B法      官  蘇嫊娟\n右正本證明與原本無異。\n如對本裁定不服，應於送達後十日內，向本院提出抗告狀（應抄附繕本）。\n~B法院書記官  徐宗賢\n中      華      民      國    九十三    年      二      月      六      日\n",
  "structure": {
    "main": "原告之訴駁回。\n訴訟費用由原告負擔。",
    "reason": "一、按提起民事訴訟應繳納裁判費，此為起訴必須具備之程式。\n二、本件原告因給付承攬報酬事件，聲請對被告發支付命令，惟被告已於法定期間內\n    對支付命令提出異議，應以支付命令之聲請視為起訴。惟原告除繳納支付命令裁\n    判費新台幣（下同）一千元外，尚有裁判費九千九百元未繳，經本院於民國九十\n    三年一月七日裁定命原告於十四日內補正。該項裁定已於九十三年一月十九日送\n    達原告，有送達證書附卷可稽。\n三、原告逾期迄未補正，其訴顯難認為合法，自應予駁回。\n四、依民事訴訟法第二百四十九條第一項第六款、第九十五條、第七十八條，裁定如\n    主文。"
  },
  "search": "臺灣花蓮地方法院民事裁定九十三年度訴字第二九號原告中山園藝有限公司法定代理人甲○○被告花蓮海洋公園股份有限公司法定代理人趙藤雄右當事人間給付承攬報酬事件，本院裁定如左：主文原告之訴駁回。訴訟費用由原告負擔。理由一、按提起民事訴訟應繳納裁判費，此為起訴必須具備之程式。二、本件原告因給付承攬報酬事件，聲請對被告發支付命令，惟被告已於法定期間內對支付命令提出異議，應以支付命令之聲請視為起訴。惟原告除繳納支付命令裁判費新台幣（下同）一千元外，尚有裁判費九千九百元未繳，經本院於民國九十三年一月七日裁定命原告於十四日內補正。該項裁定已於九十三年一月十九日送達原告，有送達證書附卷可稽。三、原告逾期迄未補正，其訴顯難認為合法，自應予駁回。四、依民事訴訟法第二百四十九條第一項第六款、第九十五條、第七十八條，裁定如主文。中華民國九十三年二月五日臺灣花蓮地方法院民事庭~B法官蘇嫊娟右正本證明與原本無異。如對本裁定不服，應於送達後十日內，向本院提出抗告狀（應抄附繕本）。~B法院書記官徐宗賢中華民國九十三年二月六日",
  "characters": {
    "judges": [
      "蘇嫊娟"
    ],
    "prosecutors": [

    ],
    "lawyers": [

    ],
    "clerks": [

    ],
    "plaintiffs": [
      "中山園藝有限公司"
    ],
    "defendants": [
      "花蓮海洋公園股份有限公司"
    ],
    "prosecutor_office": [

    ],
    "creditors": [

    ],
    "debtors": [

    ],
    "judicial_associate_officer": [

    ]
  },
  "adjudged_at": "2004-02-05",
  "created_at": "2016-02-05 21:40:45",
  "updated_at": "2016-02-05 21:40:45"
}