{
  "identify": "TYD-100-補-202-20110530-1",
  "court": {
    "name": "臺灣桃園地方法院",
    "code": "TYD"
  },
  "division": {
    "name": "民事",
    "code": "V"
  },
  "year": 100,
  "word": "補",
  "number": "202",
  "jcheck": "1",
  "reason": "確認信託關係不存在等",
  "content": "臺灣桃園地方法院民事裁定              100年度補字第202號\n原      告  臺灣土地銀行股份有限公司\n法定代理人  蘇樂明\n訴訟代理人  賴森林\n被      告  台北常安國際有限公司\n法定代理人  王玉珍\n上列當事人間請求確認信託關係不存在等事件，原告起訴未據繳\n納裁判費，查本件訴訟標的價額核定為新臺幣（下同）21,749,2\n24元（本件原告就訴訟標的所有之利益係以土地公告現值核定之\n，即以原告請求塗銷4 筆土地所有權之土地面積乘以每平方公尺\n之公告現值總和計算，因該4 筆土地公告現值之總和為21,749,2\n 24 元，低於原告之債權本金178,640,617 元，故本件訴訟標的\n價額以較低之土地公告現值核定之：(1)195 地號土地：1662.47\n平方公尺x5600 元=9,309,832元；(2)195 之1 地號土地：0.62平\n方公尺x5600 元=3,472元；(3)223 地號土地：2068.62 平方公尺\nx5600 元=11,584,272 元；(4)223 之1 地號土地：152.08平方公\n尺x5600 元=851,648元；9,309,832+3,472+11,584,272+851,648\n＝21,749,224），應徵第一審裁判費為203,400 元。茲依民事訴\n訟法第249 條第1 項但書之規定，請原告於收受本裁定送達後5\n日內補繳，如逾期未繳即駁回其訴，特此裁定。\n中    華    民    國   100    年    5     月    30    日\n                  民事第一庭    法  官  郭琇玲\n正本係照原本作成。\n本裁定關於訴訟標的價額核定之部分如有不服，得於裁定送達後\n10日內向本院提出抗告狀，並應繳納抗告費新台幣1000元；命補\n裁判費之部分，不得抗告。\n中    華    民    國   100    年    5     月    30    日\n                                書記官  游  誼",
  "structure": {
  },
  "search": "臺灣桃園地方法院民事裁定100年度補字第202號原告臺灣土地銀行股份有限公司法定代理人蘇樂明訴訟代理人賴森林被告台北常安國際有限公司法定代理人王玉珍上列當事人間請求確認信託關係不存在等事件，原告起訴未據繳納裁判費，查本件訴訟標的價額核定為新臺幣（下同）21,749,224元（本件原告就訴訟標的所有之利益係以土地公告現值核定之，即以原告請求塗銷4筆土地所有權之土地面積乘以每平方公尺之公告現值總和計算，因該4筆土地公告現值之總和為21,749,224元，低於原告之債權本金178,640,617元，故本件訴訟標的價額以較低之土地公告現值核定之：(1)195地號土地：1662.47平方公尺x5600元=9,309,832元；(2)195之1地號土地：0.62平方公尺x5600元=3,472元；(3)223地號土地：2068.62平方公尺x5600元=11,584,272元；(4)223之1地號土地：152.08平方公尺x5600元=851,648元；9,309,832+3,472+11,584,272+851,648＝21,749,224），應徵第一審裁判費為203,400元。茲依民事訴訟法第249條第1項但書之規定，請原告於收受本裁定送達後5日內補繳，如逾期未繳即駁回其訴，特此裁定。中華民國100年5月30日民事第一庭法官郭琇玲正本係照原本作成。本裁定關於訴訟標的價額核定之部分如有不服，得於裁定送達後10日內向本院提出抗告狀，並應繳納抗告費新台幣1000元；命補裁判費之部分，不得抗告。中華民國100年5月30日書記官游誼",
  "characters": {
    "judges": [
      "郭琇玲"
    ],
    "prosecutors": [

    ],
    "lawyers": [

    ],
    "clerks": [

    ],
    "plaintiffs": [
      "臺灣土地銀行股份有限公司"
    ],
    "defendants": [
      "台北常安國際有限公司"
    ],
    "prosecutor_office": [

    ],
    "creditors": [

    ],
    "debtors": [

    ],
    "judicial_associate_officer": [

    ]
  },
  "adjudged_at": "2011-05-30",
  "created_at": "2016-02-12 02:51:06",
  "updated_at": "2016-02-12 02:51:06"
}