{
  "identify": "TTD-100-司促-3533-20110823-1",
  "court": {
    "name": "臺灣臺東地方法院",
    "code": "TTD"
  },
  "division": {
    "name": "民事",
    "code": "V"
  },
  "year": 100,
  "word": "司促",
  "number": "3533",
  "jcheck": "1",
  "reason": "支付命令",
  "content": "臺灣臺東地方法院支付命令           100年度司促字第3533號\n債  權  人  國泰世華商業銀行股份有限公司\n法定代理人  汪國華\n債  務  人  盧克凡\n一、債務人應向債權人給付新臺幣壹拾萬壹仟陸佰玖拾捌元，\n    及其中之新臺幣壹拾壹萬陸仟壹佰柒拾伍元自民國九十四年\n    十二月二十二日起至清償日止，按週年利率百分之十九點七\n    計算之利息。\n二、債務人應向債權人給付新臺幣玖萬零陸佰捌拾壹元，及其中\n    之新臺幣捌萬仟零拾柒元自民國九十四年十二月二十二\n    日起至民國九十五年六月十三日止，按週年利率百分之五點\n    八八計算之利息，與自民國九十五年六月十四日起至清償日\n    止，按週年利率百分之十四點八八計算之利息，及自民國九\n    十四年十二月二十二日起至清償日止，按月以新臺幣貳佰捌\n    拾捌元計算之帳務管理費，並負擔督促程序費用新臺幣伍佰\n    元。\n三、債權人請求之原因事實略以：債務人與債權人於民國（下同\n    ）92年11月7日成立信用卡契約（卡別MASTER，卡號0000000\n    000000000）及於93年12月13日以代償卡（卡號00000000000\n    00000）償付債務人於慶豐商業銀行之信用卡欠款，尚分別\n    積欠如主文所示金額，爰狀請發支付命令。\n四、債務人對於本命令，得於送達後二十日之不變期間內向本院\n    提出異議，如債務人不於期間內提出異議，本命令與確定判\n    決有同一之效力。\n中    華    民    國   100    年    8     月    23    日\n                  簡易庭  司法事務官  洪子嵐\n以上為正本，係照原本作成。",
  "structure": {
  },
  "search": "臺灣臺東地方法院支付命令100年度司促字第3533號債權人國泰世華商業銀行股份有限公司法定代理人汪國華債務人盧克凡一、債務人應向債權人給付新臺幣壹拾萬壹仟陸佰玖拾捌元，及其中之新臺幣壹拾壹萬陸仟壹佰柒拾伍元自民國九十四年十二月二十二日起至清償日止，按週年利率百分之十九點七計算之利息。二、債務人應向債權人給付新臺幣玖萬零陸佰捌拾壹元，及其中之新臺幣捌萬仟零拾柒元自民國九十四年十二月二十二日起至民國九十五年六月十三日止，按週年利率百分之五點八八計算之利息，與自民國九十五年六月十四日起至清償日止，按週年利率百分之十四點八八計算之利息，及自民國九十四年十二月二十二日起至清償日止，按月以新臺幣貳佰捌拾捌元計算之帳務管理費，並負擔督促程序費用新臺幣伍佰元。三、債權人請求之原因事實略以：債務人與債權人於民國（下同）92年11月7日成立信用卡契約（卡別MASTER，卡號0000000000000000）及於93年12月13日以代償卡（卡號0000000000000000）償付債務人於慶豐商業銀行之信用卡欠款，尚分別積欠如主文所示金額，爰狀請發支付命令。四、債務人對於本命令，得於送達後二十日之不變期間內向本院提出異議，如債務人不於期間內提出異議，本命令與確定判決有同一之效力。中華民國100年8月23日簡易庭司法事務官洪子嵐以上為正本，係照原本作成。",
  "characters": {
    "judges": [

    ],
    "prosecutors": [

    ],
    "lawyers": [

    ],
    "clerks": [

    ],
    "plaintiffs": [

    ],
    "defendants": [

    ],
    "prosecutor_office": [

    ],
    "creditors": [
      "國泰世華商業銀行股份有限公司"
    ],
    "debtors": [
      "盧克凡"
    ],
    "judicial_associate_officer": [
      "洪子嵐"
    ]
  },
  "adjudged_at": "2011-08-23",
  "created_at": "2016-02-12 20:55:14",
  "updated_at": "2016-02-12 20:55:14"
}