{
  "identify": "KSD-100-司拍-833-20111227-2",
  "court": {
    "name": "臺灣高雄地方法院",
    "code": "KSD"
  },
  "division": {
    "name": "民事",
    "code": "V"
  },
  "year": 100,
  "word": "司拍",
  "number": "833",
  "jcheck": "2",
  "reason": "拍賣抵押物",
  "content": "臺灣高雄地方法院民事裁定            100年度司拍字第833號\n聲  請  人  歐元隆\n相  對  人  朱德源\n當事人間聲請拍賣抵押物事件，本院裁定如下：\n    主      文\n相對人所有如附表所示之不動產准予拍賣。\n程序費用新台幣貳仟元由相對人負擔。\n    理      由\n一、按抵押權人於債權已屆清償期而未受清償者，得聲請法院拍\n    賣抵押物，就其賣得價金而受清償，上開規定於最高限額抵\n    押權亦準用之，民法第873條、第881條之17分別定有明文。\n二、聲請意旨略以：相對人朱德源於民國84年7月31日以其所有\n    如附表所示之不動產，為向聲請人借款之擔保，設定新台幣\n    （下同）1,800,000元之本金最高限額抵押權，存續期間自\n    民國84年7月29日起至民國84年8月28日止，約定依照各個債\n    務契約所定清償日期為清償期，經登記在案。\n三、嗣相對人於民國84年7月29日向聲請人借用1,500,000元，約\n    定清償期為民國84年8月28日，約定利息、違約金均如契約\n    所載。詎清償期屆至後，相對人未依約清償，為此聲請拍賣\n    抵押物，以資受償，並提出抵押權設定契約書影本、他項權\n    利證明書影本、土地及建物登記簿謄本各1件、借據影本1件\n    為證。\n四、本院於民國100年11月14日通知相對人就抵押權所擔保之債\n    權額陳述意見，相對人具狀表示，系爭債權已消滅；本院就\n    此復於民國100年12月12日通知聲請人就相對人之陳述意見\n    狀表示意見，聲請人於收受後具狀表示，最高限額抵押權尚\n    在有效期限內，並無債權消滅之事實等語。惟查，相對人主\n    張之事實，係屬實體事項之爭執事實，而聲請拍賣抵押物之\n    性質係屬非訟事件，非訟事件之性質係對於實體事項之爭執\n    並不審酌，相對人對於此類實體事項之爭執應另行起訴以資\n    釐清。故法院於聲請人提出聲請拍賣抵押物聲請狀、債權證\n    明以及扺押權設定契約書、他項權利證明書、不動產登記謄\n    本等公文書，並且該公文書俱經依法登記而有公示表徵時，\n    法院即對上開書面進行形式審理，當聲請合於法定要件時，\n    自應依法而為准許之裁定。\n五、依非訟事件法第21條第2項、第24條第1項、民事訴訟法第78\n    條，裁定如主文。\n六、如不服本裁定，應於裁定送達後10日之不變期間內，向本院\n    提出抗告狀，並需繳抗告費新台幣1000元。\n中    華    民    國   100    年    12    月    27    日\n                         鳳山簡易庭\n                                 司法事務官 邱麗娟\n┌─────────────────────────────────────┐\n│附表：                                                100年度司拍字第833號│\n├─┬──────────────────┬─┬────┬────┬────┤\n│編│土        地          坐          落│地│面    積│        │        │\n│  ├───┬────┬────┬────┤  ├────┤權利範圍│所有權人│\n│號│縣  市│鄉鎮市區○   段   │地    號│目│平方公尺│        │        │\n├─┼───┼────┼────┼────┼─┼────┼────┼────┤\n│00│高雄市│前鎮區  ○○○段  │1101    │建│  406   │2分之1  │朱德源  │\n│1 │      │        │        │        │  │        │        │        │\n└─┴───┴────┴────┴────┴─┴────┴────┴────┘\n附註：\n一、案件一經確定本院即依職權核發確定證明書，債權人毋庸具\n    狀申請。\n二、嗣後遞狀應註明案號及股別。",
  "structure": {
    "main": "相對人所有如附表所示之不動產准予拍賣。\n程序費用新台幣貳仟元由相對人負擔。",
    "reason": "一、按抵押權人於債權已屆清償期而未受清償者，得聲請法院拍\n    賣抵押物，就其賣得價金而受清償，上開規定於最高限額抵\n    押權亦準用之，民法第873條、第881條之17分別定有明文。\n二、聲請意旨略以：相對人朱德源於民國84年7月31日以其所有\n    如附表所示之不動產，為向聲請人借款之擔保，設定新台幣\n    （下同）1,800,000元之本金最高限額抵押權，存續期間自\n    民國84年7月29日起至民國84年8月28日止，約定依照各個債\n    務契約所定清償日期為清償期，經登記在案。\n三、嗣相對人於民國84年7月29日向聲請人借用1,500,000元，約\n    定清償期為民國84年8月28日，約定利息、違約金均如契約\n    所載。詎清償期屆至後，相對人未依約清償，為此聲請拍賣\n    抵押物，以資受償，並提出抵押權設定契約書影本、他項權\n    利證明書影本、土地及建物登記簿謄本各1件、借據影本1件\n    為證。\n四、本院於民國100年11月14日通知相對人就抵押權所擔保之債\n    權額陳述意見，相對人具狀表示，系爭債權已消滅；本院就\n    此復於民國100年12月12日通知聲請人就相對人之陳述意見\n    狀表示意見，聲請人於收受後具狀表示，最高限額抵押權尚\n    在有效期限內，並無債權消滅之事實等語。惟查，相對人主\n    張之事實，係屬實體事項之爭執事實，而聲請拍賣抵押物之\n    性質係屬非訟事件，非訟事件之性質係對於實體事項之爭執\n    並不審酌，相對人對於此類實體事項之爭執應另行起訴以資\n    釐清。故法院於聲請人提出聲請拍賣抵押物聲請狀、債權證\n    明以及扺押權設定契約書、他項權利證明書、不動產登記謄\n    本等公文書，並且該公文書俱經依法登記而有公示表徵時，\n    法院即對上開書面進行形式審理，當聲請合於法定要件時，\n    自應依法而為准許之裁定。\n五、依非訟事件法第21條第2項、第24條第1項、民事訴訟法第78\n    條，裁定如主文。\n六、如不服本裁定，應於裁定送達後10日之不變期間內，向本院\n    提出抗告狀，並需繳抗告費新台幣1000元。"
  },
  "search": "臺灣高雄地方法院民事裁定100年度司拍字第833號聲請人歐元隆相對人朱德源當事人間聲請拍賣抵押物事件，本院裁定如下：主文相對人所有如附表所示之不動產准予拍賣。程序費用新台幣貳仟元由相對人負擔。理由一、按抵押權人於債權已屆清償期而未受清償者，得聲請法院拍賣抵押物，就其賣得價金而受清償，上開規定於最高限額抵押權亦準用之，民法第873條、第881條之17分別定有明文。二、聲請意旨略以：相對人朱德源於民國84年7月31日以其所有如附表所示之不動產，為向聲請人借款之擔保，設定新台幣（下同）1,800,000元之本金最高限額抵押權，存續期間自民國84年7月29日起至民國84年8月28日止，約定依照各個債務契約所定清償日期為清償期，經登記在案。三、嗣相對人於民國84年7月29日向聲請人借用1,500,000元，約定清償期為民國84年8月28日，約定利息、違約金均如契約所載。詎清償期屆至後，相對人未依約清償，為此聲請拍賣抵押物，以資受償，並提出抵押權設定契約書影本、他項權利證明書影本、土地及建物登記簿謄本各1件、借據影本1件為證。四、本院於民國100年11月14日通知相對人就抵押權所擔保之債權額陳述意見，相對人具狀表示，系爭債權已消滅；本院就此復於民國100年12月12日通知聲請人就相對人之陳述意見狀表示意見，聲請人於收受後具狀表示，最高限額抵押權尚在有效期限內，並無債權消滅之事實等語。惟查，相對人主張之事實，係屬實體事項之爭執事實，而聲請拍賣抵押物之性質係屬非訟事件，非訟事件之性質係對於實體事項之爭執並不審酌，相對人對於此類實體事項之爭執應另行起訴以資釐清。故法院於聲請人提出聲請拍賣抵押物聲請狀、債權證明以及扺押權設定契約書、他項權利證明書、不動產登記謄本等公文書，並且該公文書俱經依法登記而有公示表徵時，法院即對上開書面進行形式審理，當聲請合於法定要件時，自應依法而為准許之裁定。五、依非訟事件法第21條第2項、第24條第1項、民事訴訟法第78條，裁定如主文。六、如不服本裁定，應於裁定送達後10日之不變期間內，向本院提出抗告狀，並需繳抗告費新台幣1000元。中華民國100年12月27日鳳山簡易庭司法事務官邱麗娟┌─────────────────────────────────────┐│附表：100年度司拍字第833號│├─┬──────────────────┬─┬────┬────┬────┤│編│土地坐落│地│面積││││├───┬────┬────┬────┤├────┤權利範圍│所有權人││號│縣市│鄉鎮市區○段│地號│目│平方公尺│││├─┼───┼────┼────┼────┼─┼────┼────┼────┤│00│高雄市│前鎮區○○○段│1101│建│406│2分之1│朱德源││1│││││││││└─┴───┴────┴────┴────┴─┴────┴────┴────┘附註：一、案件一經確定本院即依職權核發確定證明書，債權人毋庸具狀申請。二、嗣後遞狀應註明案號及股別。",
  "characters": {
    "judges": [

    ],
    "prosecutors": [

    ],
    "lawyers": [

    ],
    "clerks": [

    ],
    "plaintiffs": [

    ],
    "defendants": [

    ],
    "prosecutor_office": [
      "歐元隆"
    ],
    "creditors": [

    ],
    "debtors": [

    ],
    "judicial_associate_officer": [
      "邱麗娟"
    ]
  },
  "adjudged_at": "2011-12-27",
  "created_at": "2016-02-13 11:46:17",
  "updated_at": "2016-02-13 11:46:17"
}