{
  "identify": "KLD-100-基小-14-20110323-1",
  "court": {
    "name": "臺灣基隆地方法院",
    "code": "KLD"
  },
  "division": {
    "name": "民事",
    "code": "V"
  },
  "year": 100,
  "word": "基小",
  "number": "14",
  "jcheck": "1",
  "reason": "給付公寓大廈管理費",
  "content": "臺灣基隆地方法院基隆簡易庭小額民事判決\n原      告  許阿慶\n            許阿田\n            郭秀卿\n            羅心伶\n            章玉勳\n            周秀英\n            張錫津\n            王李貴雲\n            吳玉惠\n            陳鳳明\n            蔡明琦\n            辛秋惠\n            黃鍾秀\n            李明珠\n            謝勇俊\n            蔡孟勳\n            許厚進\n            許厚益\n共      同\n訴訟代理人  黃鳳梨\n被      告  駿衛保全股份有限公司\n法定代理人  蔡璧合\n訴訟代理人  鄭國良\n上列當事人間請求給付公寓大廈管理費事件，本院於民國100年3\n月16日言詞辯論終結，判決如下：\n    主  文\n被告應給付原告新臺幣貳萬肆仟元，及自民國一○○年一月一日\n起至清償日止，按年息百分之五計算之利息。\n訴訟費用新臺幣壹仟元由被告負擔。\n本判決得假執行。\n中    華    民    國   100    年    3     月    23    日\n                  基隆簡易庭法  官  林淑鳳\n以上正本係照原本作成。\n對於本件判決如有不服，應於收受送達後20日內向本院提出上訴\n書狀，上訴於本院合議庭，並按他造當事人之人數附具繕本。\n如委任律師提起上訴者，應一併繳納上訴審裁判費。\n當事人之上訴，非以判決違背法令為理由不得為之，上訴狀應記\n載上訴理由，表明下列各款事項：\n(一)原判決所違背之法令及其具體內容。\n(二)依訴訟資料可認為原判決有違背法令之具體事實。\n中    華    民    國   100    年    3     月    23    日\n                            書記官  王鵬勝",
  "structure": {
  },
  "search": "臺灣基隆地方法院基隆簡易庭小額民事判決原告許阿慶許阿田郭秀卿羅心伶章玉勳周秀英張錫津王李貴雲吳玉惠陳鳳明蔡明琦辛秋惠黃鍾秀李明珠謝勇俊蔡孟勳許厚進許厚益共同訴訟代理人黃鳳梨被告駿衛保全股份有限公司法定代理人蔡璧合訴訟代理人鄭國良上列當事人間請求給付公寓大廈管理費事件，本院於民國100年3月16日言詞辯論終結，判決如下：主文被告應給付原告新臺幣貳萬肆仟元，及自民國一○○年一月一日起至清償日止，按年息百分之五計算之利息。訴訟費用新臺幣壹仟元由被告負擔。本判決得假執行。中華民國100年3月23日基隆簡易庭法官林淑鳳以上正本係照原本作成。對於本件判決如有不服，應於收受送達後20日內向本院提出上訴書狀，上訴於本院合議庭，並按他造當事人之人數附具繕本。如委任律師提起上訴者，應一併繳納上訴審裁判費。當事人之上訴，非以判決違背法令為理由不得為之，上訴狀應記載上訴理由，表明下列各款事項：(一)原判決所違背之法令及其具體內容。(二)依訴訟資料可認為原判決有違背法令之具體事實。中華民國100年3月23日書記官王鵬勝",
  "characters": {
    "judges": [
      "林淑鳳"
    ],
    "prosecutors": [

    ],
    "lawyers": [
      "如委任"
    ],
    "clerks": [

    ],
    "plaintiffs": [
      "許阿慶"
    ],
    "defendants": [
      "駿衛保全股份有限公司"
    ],
    "prosecutor_office": [

    ],
    "creditors": [

    ],
    "debtors": [

    ],
    "judicial_associate_officer": [

    ]
  },
  "adjudged_at": "2011-03-23",
  "created_at": "2016-02-13 22:26:50",
  "updated_at": "2016-02-13 22:26:50"
}