{
  "identify": "MLD-100-易-8-20110322-1",
  "court": {
    "name": "臺灣苗栗地方法院",
    "code": "MLD"
  },
  "division": {
    "name": "刑事",
    "code": "M"
  },
  "year": 100,
  "word": "易",
  "number": "8",
  "jcheck": "1",
  "reason": "傷害等",
  "content": "臺灣苗栗地方法院刑事判決                100年度易字第8號\n公  訴  人  臺灣苗栗地方法院檢察署檢察官\n被      告  湯元水\n上列被告因傷害等案件，經檢察官提起公訴（99年度偵字第6083\n號），本院判決如下：\n    主  文\n本件公訴不受理。\n    理  由\n一、公訴意旨如起訴書所載 （如附件） 。\n二、按告訴乃論之罪，告訴人於第一審辯論終結前得撤回其告訴\n    ，又告訴經撤回者，應諭知不受理之判決，刑事訴訟法第23\n    8 條第1 項、第303 條第3 款分別定有明文。\n三、查本件告訴人彭月梅告訴被告湯元水傷害等案件，起訴書認\n    係觸犯刑法第條第306 條第1 項侵入住宅罪、第354 條毀損\n    罪、第277 條第1 項傷害罪，依同法第308 條第1 項、第35\n    7 條、第287 條前段之規定，須告訴乃論。茲據告訴人彭月\n    梅撤回告訴，此有刑事撤回告訴狀1 紙、本院公務電話紀錄\n    1 份在卷可稽，依照首開說明，本件爰不經言詞辯論，逕為\n    諭知不受理之判決。\n據上論斷，應依刑事訴訟法第303 條第3 款、第307 條判決如主\n文。\n中    華    民    國  100     年    3     月    22    日\n                  刑事第一庭  法  官  呂曾達\n以上正本證明與原本無異。\n如不服本判決應於收受判決後10日內向本院提出上訴書狀，並應\n應敘述具體理由。其未敘述上訴理由者，應於上訴期間屆滿後20\n日內向本院補提理由書(均須按他造當事人之人數附繕本)「切勿\n逕送上級法院」。\n                              書記官  劉容辰\n中    華    民    國   100    年    3     月    22    日\n附件：\n臺灣苗栗地方法院檢察署檢察官起訴書\n                                      99年度偵字第6083號\n    被告  湯元水  男  56歲（民國○○年○○月○日生）\n                  住苗栗縣泰安鄉錦水村13鄰圓墩116號\n                  國民身分證統一編號：Ｚ000000000號\n上列被告因傷害等案件，業經偵查終結，認應提起公訴，茲將犯\n罪事實及證據並所犯法條分敘如下：\n            犯罪事實\n一、湯元水於民國98年8 月間，因涉嫌違反森林法案件，經貴院\n    （98年度訴字第663 號）判處有期徒刑10月，併科罰新台幣\n    金60萬元，緩刑3年確定，現仍在緩刑期內。又於99年9月上\n    旬，因酒醉駕車公共危險罪，經本檢察官為緩起訴處分（99\n    年度偵字第4756號），惟仍不知悔改，於99年9月30日清晨6\n    時50分許，明知彭月梅不願其進入屋內，仍乘酒興踢壞位於\n    苗栗縣泰安鄉錦水村11鄰圓墩78號彭月梅家中房門，而侵入\n    彭宅，再邀彭月梅之乾弟弟宋啟瑞共飲。宋啟瑞小酌1 杯後\n    不想再喝，且彭月梅擔心二人飲酒後會吵架，便要宋啟瑞不\n    要陪湯元水飲酒，使湯元水不悅，竟持棍毆打彭月梅，致彭\n    月梅之雙肘、右膝、右手4 指破皮瘀血，同時撕破彭月梅之\n    上衣與胸罩。\n二、案經彭月梅訴由苗栗縣警察局大湖分局報請偵辦。\n            證據並所犯法條\n一、訊之被告湯元水坦承於上述時地進入彭宅，惟否認毆打彭月\n    梅與毀損之情，惟查上情業據宋啟瑞證述明確，核與告訴人\n    彭月梅所陳相符，並有苗栗醫院99年9 月30日診斷證明書、\n    現場相片3張在卷可參，被告之犯嫌應可認定。\n二、核被告所為，係犯刑法第306條第1項之侵入住宅罪、第277\n    條第1項之傷害罪、第354條之毀損罪嫌，其之後撕毀被害人\n    衣服之行為與傷害行為，為一行為犯2 罪名，為想像競合犯\n    ，請從一重處斷，而侵入住宅、踢壞大門之毀損罪與傷害罪\n    ，犯意各別，請分論併罰。告訴人雖認被告涉嫌妨害自由罪\n    ，惟被告係在傷害被告之時短暫使被告喪失行動自由，目的\n    在傷害而非妨害自由，故應為傷害行為吸收，不另論罪，併\n    予敘明。請審酌被告於緩刑及緩起訴期間內，仍故意犯本案\n    ，且毫無悔意，請從重量刑，以維護人民安全。\n三、依刑事訴訟法第251條第1項提起公訴。\n    此  致\n臺灣苗栗地方法院\n中    華    民    國    99    年    12    月    7     日\n                        檢察官  唐先恆\n本件正本證明與原本無異\n中    華    民    國    99    年    12    月    15    日\n                        書記官  李民貴",
  "structure": {
    "main": "本件公訴不受理。\n    理  由\n一、公訴意旨如起訴書所載 （如附件） 。\n二、按告訴乃論之罪，告訴人於第一審辯論終結前得撤回其告訴\n    ，又告訴經撤回者，應諭知不受理之判決，刑事訴訟法第23\n    8 條第1 項、第303 條第3 款分別定有明文。\n三、查本件告訴人彭月梅告訴被告湯元水傷害等案件，起訴書認\n    係觸犯刑法第條第306 條第1 項侵入住宅罪、第354 條毀損\n    罪、第277 條第1 項傷害罪，依同法第308 條第1 項、第35\n    7 條、第287 條前段之規定，須告訴乃論。茲據告訴人彭月\n    梅撤回告訴，此有刑事撤回告訴狀1 紙、本院公務電話紀錄\n    1 份在卷可稽，依照首開說明，本件爰不經言詞辯論，逕為\n    諭知不受理之判決。\n據上論斷，應依刑事訴訟法第303 條第3 款、第307 條判決如主\n文。\n中    華    民    國  100     年    3     月    22    日\n                  刑事第一庭  法  官  呂曾達\n以上正本證明與原本無異。\n如不服本判決應於收受判決後10日內向本院提出上訴書狀，並應\n應敘述具體理由。其未敘述上訴理由者，應於上訴期間屆滿後20\n日內向本院補提理由書(均須按他造當事人之人數附繕本)「切勿\n逕送上級法院」。\n                              書記官  劉容辰\n中    華    民    國   100    年    3     月    22    日\n附件：\n臺灣苗栗地方法院檢察署檢察官起訴書\n                                      99年度偵字第6083號\n    被告  湯元水  男  56歲（民國○○年○○月○日生）\n                  住苗栗縣泰安鄉錦水村13鄰圓墩116號\n                  國民身分證統一編號：Ｚ000000000號\n上列被告因傷害等案件，業經偵查終結，認應提起公訴，茲將犯\n罪事實及證據並所犯法條分敘如下：",
    "fact": "一、湯元水於民國98年8 月間，因涉嫌違反森林法案件，經貴院\n    （98年度訴字第663 號）判處有期徒刑10月，併科罰新台幣\n    金60萬元，緩刑3年確定，現仍在緩刑期內。又於99年9月上\n    旬，因酒醉駕車公共危險罪，經本檢察官為緩起訴處分（99\n    年度偵字第4756號），惟仍不知悔改，於99年9月30日清晨6\n    時50分許，明知彭月梅不願其進入屋內，仍乘酒興踢壞位於\n    苗栗縣泰安鄉錦水村11鄰圓墩78號彭月梅家中房門，而侵入\n    彭宅，再邀彭月梅之乾弟弟宋啟瑞共飲。宋啟瑞小酌1 杯後\n    不想再喝，且彭月梅擔心二人飲酒後會吵架，便要宋啟瑞不\n    要陪湯元水飲酒，使湯元水不悅，竟持棍毆打彭月梅，致彭\n    月梅之雙肘、右膝、右手4 指破皮瘀血，同時撕破彭月梅之\n    上衣與胸罩。\n二、案經彭月梅訴由苗栗縣警察局大湖分局報請偵辦。\n            證據並所犯法條\n一、訊之被告湯元水坦承於上述時地進入彭宅，惟否認毆打彭月\n    梅與毀損之情，惟查上情業據宋啟瑞證述明確，核與告訴人\n    彭月梅所陳相符，並有苗栗醫院99年9 月30日診斷證明書、\n    現場相片3張在卷可參，被告之犯嫌應可認定。\n二、核被告所為，係犯刑法第306條第1項之侵入住宅罪、第277\n    條第1項之傷害罪、第354條之毀損罪嫌，其之後撕毀被害人\n    衣服之行為與傷害行為，為一行為犯2 罪名，為想像競合犯\n    ，請從一重處斷，而侵入住宅、踢壞大門之毀損罪與傷害罪\n    ，犯意各別，請分論併罰。告訴人雖認被告涉嫌妨害自由罪\n    ，惟被告係在傷害被告之時短暫使被告喪失行動自由，目的\n    在傷害而非妨害自由，故應為傷害行為吸收，不另論罪，併\n    予敘明。請審酌被告於緩刑及緩起訴期間內，仍故意犯本案\n    ，且毫無悔意，請從重量刑，以維護人民安全。\n三、依刑事訴訟法第251條第1項提起公訴。\n    此  致\n臺灣苗栗地方法院"
  },
  "search": "臺灣苗栗地方法院刑事判決100年度易字第8號公訴人臺灣苗栗地方法院檢察署檢察官被告湯元水上列被告因傷害等案件，經檢察官提起公訴（99年度偵字第6083號），本院判決如下：主文本件公訴不受理。理由一、公訴意旨如起訴書所載（如附件）。二、按告訴乃論之罪，告訴人於第一審辯論終結前得撤回其告訴，又告訴經撤回者，應諭知不受理之判決，刑事訴訟法第238條第1項、第303條第3款分別定有明文。三、查本件告訴人彭月梅告訴被告湯元水傷害等案件，起訴書認係觸犯刑法第條第306條第1項侵入住宅罪、第354條毀損罪、第277條第1項傷害罪，依同法第308條第1項、第357條、第287條前段之規定，須告訴乃論。茲據告訴人彭月梅撤回告訴，此有刑事撤回告訴狀1紙、本院公務電話紀錄1份在卷可稽，依照首開說明，本件爰不經言詞辯論，逕為諭知不受理之判決。據上論斷，應依刑事訴訟法第303條第3款、第307條判決如主文。中華民國100年3月22日刑事第一庭法官呂曾達以上正本證明與原本無異。如不服本判決應於收受判決後10日內向本院提出上訴書狀，並應應敘述具體理由。其未敘述上訴理由者，應於上訴期間屆滿後20日內向本院補提理由書(均須按他造當事人之人數附繕本)「切勿逕送上級法院」。書記官劉容辰中華民國100年3月22日附件：臺灣苗栗地方法院檢察署檢察官起訴書99年度偵字第6083號被告湯元水男56歲（民國○○年○○月○日生）住苗栗縣泰安鄉錦水村13鄰圓墩116號國民身分證統一編號：Ｚ000000000號上列被告因傷害等案件，業經偵查終結，認應提起公訴，茲將犯罪事實及證據並所犯法條分敘如下：犯罪事實一、湯元水於民國98年8月間，因涉嫌違反森林法案件，經貴院（98年度訴字第663號）判處有期徒刑10月，併科罰新台幣金60萬元，緩刑3年確定，現仍在緩刑期內。又於99年9月上旬，因酒醉駕車公共危險罪，經本檢察官為緩起訴處分（99年度偵字第4756號），惟仍不知悔改，於99年9月30日清晨6時50分許，明知彭月梅不願其進入屋內，仍乘酒興踢壞位於苗栗縣泰安鄉錦水村11鄰圓墩78號彭月梅家中房門，而侵入彭宅，再邀彭月梅之乾弟弟宋啟瑞共飲。宋啟瑞小酌1杯後不想再喝，且彭月梅擔心二人飲酒後會吵架，便要宋啟瑞不要陪湯元水飲酒，使湯元水不悅，竟持棍毆打彭月梅，致彭月梅之雙肘、右膝、右手4指破皮瘀血，同時撕破彭月梅之上衣與胸罩。二、案經彭月梅訴由苗栗縣警察局大湖分局報請偵辦。證據並所犯法條一、訊之被告湯元水坦承於上述時地進入彭宅，惟否認毆打彭月梅與毀損之情，惟查上情業據宋啟瑞證述明確，核與告訴人彭月梅所陳相符，並有苗栗醫院99年9月30日診斷證明書、現場相片3張在卷可參，被告之犯嫌應可認定。二、核被告所為，係犯刑法第306條第1項之侵入住宅罪、第277條第1項之傷害罪、第354條之毀損罪嫌，其之後撕毀被害人衣服之行為與傷害行為，為一行為犯2罪名，為想像競合犯，請從一重處斷，而侵入住宅、踢壞大門之毀損罪與傷害罪，犯意各別，請分論併罰。告訴人雖認被告涉嫌妨害自由罪，惟被告係在傷害被告之時短暫使被告喪失行動自由，目的在傷害而非妨害自由，故應為傷害行為吸收，不另論罪，併予敘明。請審酌被告於緩刑及緩起訴期間內，仍故意犯本案，且毫無悔意，請從重量刑，以維護人民安全。三、依刑事訴訟法第251條第1項提起公訴。此致臺灣苗栗地方法院中華民國99年12月7日檢察官唐先恆本件正本證明與原本無異中華民國99年12月15日書記官李民貴",
  "characters": {
    "judges": [
      "呂曾達"
    ],
    "prosecutors": [

    ],
    "lawyers": [

    ],
    "clerks": [
      "劉容辰"
    ],
    "plaintiffs": [

    ],
    "defendants": [
      "湯元水"
    ],
    "prosecutor_office": [
      "臺灣苗栗地方法院檢察署檢察官"
    ],
    "creditors": [

    ],
    "debtors": [

    ],
    "judicial_associate_officer": [

    ]
  },
  "adjudged_at": "2011-03-22",
  "created_at": "2016-02-13 22:26:49",
  "updated_at": "2016-02-13 22:26:49"
}