{
  "identify": "CYD-100-訴-432-20110831-1",
  "court": {
    "name": "臺灣嘉義地方法院",
    "code": "CYD"
  },
  "division": {
    "name": "刑事",
    "code": "M"
  },
  "year": 100,
  "word": "訴",
  "number": "432",
  "jcheck": "1",
  "reason": "違反毒品危害防制條例",
  "content": "臺灣嘉義地方法院刑事認罪協商判決      100年度訴字第432號\n公  訴  人  臺灣嘉義地方法院檢察署檢察官\n被      告  黃証約\n指定辯護人  本院公設辯護人顏玲玲\n上列被告因違反毒品危害防制條例案件，經檢察官提起公訴（10\n0年度毒偵字第663號），聲請改依協商程序而為判決，本院合議\n庭裁定由受命法官獨任進行認罪協商程序，判決如下：\n    主  文\n黃証約施用第一級毒品，累犯，處有期徒刑玖月。\n    犯 罪 事 實 及 理 由\n一、本件犯罪事實及證據引用附件檢察官起訴書之記載，另犯罪\n    事實一第12至16行「，及於96年間…執行完畢」更正為「後\n    經減刑裁定為有期徒刑3月又15日，如易科罰金，以新台幣1\n    ,000元折算1日確定，於96年8月6日縮刑期滿執行完畢」，\n    證據部分補充：「被告於本院行準備程序時為認罪之陳述」\n    。\n二、本件被告已認罪，經檢察官與被告、指定辯護人於審判外達\n    成協商合意，其合意內容為：被告施用第1級毒品願受有期\n    徒刑9月之宣告。本院查上開協商合意並無刑事訴訟法第455\n    條之4第1項所列情形之一，檢察官聲請改依協商程序而為判\n    決，本院爰不經言詞辯論，於協商合意範圍內為協商判決。\n三、應適用之法條：刑事訴訟法第455條之4第2項、第455條之8\n    、第454條第2項，毒品危害防制條例第10條第1項，刑法第1\n    1條、第47條第1項。\n四、本判決除有刑事訴訟法第455條之4第1項第1款、第2款、第4\n    款、第6款、第7款所定情形之一，或違反同條第2項之規定\n    外，不得上訴。\n五、如有前揭各款情形而不服本判決，應於收受送達後10日內向\n    本院提出上訴書狀（應敘述具體理由並附繕本）。上訴書狀\n    如未敘述理由，應於上訴期間屆滿後20日內補提理由書於本\n    院。\n中    華    民    國    100    年    8    月    31    日\n                  刑事第二庭   法  官  林青怡\n上列正本證明與原本無異。\n中    華    民    國   100    年    8     月    31    日\n                               書記官  江芳耀\n附錄本案論罪科刑法條全文\n毒品危害防制條例第10條\n施用第一級毒品者，處六月以上五年以下有期徒刑。\n施用第二級毒品者，處三年以下有期徒刑。\n【附件】臺灣嘉義地方法院檢察署檢察官100年度毒偵字第663號\n        起訴書1份",
  "structure": {
  },
  "search": "臺灣嘉義地方法院刑事認罪協商判決100年度訴字第432號公訴人臺灣嘉義地方法院檢察署檢察官被告黃証約指定辯護人本院公設辯護人顏玲玲上列被告因違反毒品危害防制條例案件，經檢察官提起公訴（100年度毒偵字第663號），聲請改依協商程序而為判決，本院合議庭裁定由受命法官獨任進行認罪協商程序，判決如下：主文黃証約施用第一級毒品，累犯，處有期徒刑玖月。犯罪事實及理由一、本件犯罪事實及證據引用附件檢察官起訴書之記載，另犯罪事實一第12至16行「，及於96年間…執行完畢」更正為「後經減刑裁定為有期徒刑3月又15日，如易科罰金，以新台幣1,000元折算1日確定，於96年8月6日縮刑期滿執行完畢」，證據部分補充：「被告於本院行準備程序時為認罪之陳述」。二、本件被告已認罪，經檢察官與被告、指定辯護人於審判外達成協商合意，其合意內容為：被告施用第1級毒品願受有期徒刑9月之宣告。本院查上開協商合意並無刑事訴訟法第455條之4第1項所列情形之一，檢察官聲請改依協商程序而為判決，本院爰不經言詞辯論，於協商合意範圍內為協商判決。三、應適用之法條：刑事訴訟法第455條之4第2項、第455條之8、第454條第2項，毒品危害防制條例第10條第1項，刑法第11條、第47條第1項。四、本判決除有刑事訴訟法第455條之4第1項第1款、第2款、第4款、第6款、第7款所定情形之一，或違反同條第2項之規定外，不得上訴。五、如有前揭各款情形而不服本判決，應於收受送達後10日內向本院提出上訴書狀（應敘述具體理由並附繕本）。上訴書狀如未敘述理由，應於上訴期間屆滿後20日內補提理由書於本院。中華民國100年8月31日刑事第二庭法官林青怡上列正本證明與原本無異。中華民國100年8月31日書記官江芳耀附錄本案論罪科刑法條全文毒品危害防制條例第10條施用第一級毒品者，處六月以上五年以下有期徒刑。施用第二級毒品者，處三年以下有期徒刑。【附件】臺灣嘉義地方法院檢察署檢察官100年度毒偵字第663號起訴書1份",
  "characters": {
    "judges": [
      "林青怡"
    ],
    "prosecutors": [

    ],
    "lawyers": [

    ],
    "clerks": [
      "江芳耀"
    ],
    "plaintiffs": [

    ],
    "defendants": [
      "黃証約"
    ],
    "prosecutor_office": [
      "臺灣嘉義地方法院檢察署檢察官"
    ],
    "creditors": [

    ],
    "debtors": [

    ],
    "judicial_associate_officer": [

    ]
  },
  "adjudged_at": "2011-08-31",
  "created_at": "2016-02-12 18:14:25",
  "updated_at": "2016-02-12 18:14:25"
}