{
  "identify": "CYD-99-司執消債更-24-20110427-1",
  "court": {
    "name": "臺灣嘉義地方法院",
    "code": "CYD"
  },
  "division": {
    "name": "民事",
    "code": "V"
  },
  "year": 99,
  "word": "司執消債更",
  "number": "24",
  "jcheck": "1",
  "reason": "更生之執行",
  "content": "臺灣嘉義地方法院民事裁定        99年度司執消債更字第24號\n聲  請  人\n即  債務人  李慶城\n債  權  人  誠第一資產管理股份有限公司\n法定代理人  王裕南\n債  權  人  臺灣銀行股份有限公司\n法定代理人  張明道\n代  理  人  黃文明\n債  權  人  花旗(台灣)商業銀行股份有限公司\n法定代理人  管國霖\n債  權  人  渣打國際商業銀行股份有限公司\n法定代理人  曾璟璇\n債  權  人  遠東國際商業銀行股份有限公司\n法定代理人  洪信德\n債  權  人  台新國際商業銀行股份有限公司\n法定代理人  蔡榮棟\n債  權  人  大眾商業銀行股份有限公司\n法定代理人  陳建平\n代  理  人  蔡怡玫\n債  權  人  日盛國際商業銀行股份有限公司\n法定代理人  楊智光\n債  權  人  安泰商業銀行股份有限公司\n法定代理人  齊百邁\n債  權  人  中國信託商業銀行股份有限公司\n法定代理人  辜松\n債  權  人  萬榮行銷股份有限公司\n法定代理人  劉五湖\n代  理  人  王靖雯\n上列當事人間聲請消費者債務清理事件，本院裁定如下：\n    主  文\n債務人所提如附件所示之更生方案應予認可。\n債務人未依更生條件全部履行完畢前，應受如附表之生活限制。\n    理  由\n一、按法院得將更生方案之內容及債務人財產及收入狀況報告書\n    通知債權人，命債權人於法院所定期間內以書面確答是否同\n    意該方案，逾期不為確答，視為同意。同意及視為同意更生\n    方案之已申報無擔保及無優先權債權人過半數，且其所代表\n    之債權額，逾已申報無擔保及無優先權總債權額之二分之一\n    時，視為債權人會議可決更生方案。更生方案未依前二條規\n    定可決時，除有第六十四條規定之情形外，法院應以裁定開\n    始清算程序。消費者債務清理條例（下稱本條例）第60條第\n    1、2項及第61條分別定有明文。查本件債務人之個人財產及\n    收入狀況說明書與更生方案，業經本院公告揭示於本院牌示\n    處，並合法送達於各債權人，此有本院公告及送達證明在卷\n    可稽。且本件已有超過半數之已申報無擔保及無優先權債權\n    人，且其所代表之債權額，逾已申報無擔保及無優先權總債\n    權額之二分之一，回函表示不同意債務人之更生方案，此亦\n    有各債權人之陳報狀在卷可稽。是則本件債務人所提之更生\n    方案並未經債權人以書面決議方式可決，故應由本院依前揭\n    規定審查是否有符合本條例第64條依職權逕予認可之適用，\n    合先予敘明。\n二、債務人更生方案意旨略以：債務人現無擔保及無優先權債務\n    總額為新臺幣（下同）6,398,391元，第1期至96期每期願清\n    償25,000元，並自認可方案裁定確定之翌日起，依債權比例\n    於每月28日分別電匯予各債權人，共計清償8年，並以1個月\n    為1期，共計清償96期，清償總金額為2,400,000元，無擔保\n    及無優先權債權人受清償成數為37.51％（詳參附件債務人\n    更生方案）。\n三、次按債務人有薪資、執行業務所得或其他固定收入，法院認\n    更生方案之條件公允者，得不經債權人會議可決，逕依債務\n    人之聲請或依職權以裁定認可更生方案；法院為認可之裁定\n    時，因更生方案履行之必要，對於債務人在未依更生條件全\n    部履行完畢前之生活程度，得為相當之限制，本條例第64條\n    第1項、第62條第2項分別定有明文。申言之，消費者債務清\n    理條例之目的，除保障債權人集團性滿足之最大化及公平化\n    外，並為賦與債務人重建復甦其經濟生活之機會，故消費者\n    債務清理程序制度之構築首需強調生活再建及破綻預防，提\n    高債務人工作意願並改善其生活習慣，使能重新出發，從而\n    保障其生存權，並促進其義務遂行能力，儘可能永續性回復\n    信用。是若還款額度逾越所能負擔之極限過大，債務人勢必\n    無以清償，終至喪失其還債之意願，則債權人因實際受償的\n    金額降低，反蒙受實際不利益。因而更生方案是否合理可行\n    ，應視債務人財產狀況（含現有資力與將來收入來源）、清\n    償能力及經濟信用等評估，及考量債權人之受償額度（如「\n    清算保障原則」─本條例64條第2項第4款參照），予以客觀\n    判斷，始不違背前述說明。再者本條例為使法院正確判斷有\n    無逕行裁定認可更生方案之必要，雖賦予債權人獲得一定資\n    訊及陳述意見之機會。惟債權人所為之陳述，僅供法院判斷\n    是否逕行裁定認可更生方案之參考，並無拘束法院之效力，\n    附此敘明。\n四、債務人提出之更生方案是否公允，經查：\n（一）更生方案履行期間之收入狀況：\n      債務人陳稱目前任職光泉食品股份有限公司（下稱光泉公\n      司），每月含本薪、外勤津貼、安全津貼、伙食津貼、加\n      班費、業績獎金、年節金、年終獎金等項之平均收入為\n      42,646元（元以下四捨五入），已據本院函詢光泉公司據\n      其函覆相符，堪信屬實。\n（二）更生方案履行期間之必要支出狀況：\n      債務人主張更生方案履行期間每月必要生活費用為伙食費\n      4,500元、民生用品700元、通勤費498元、行動電話費400\n      元、水電費1,090元、瓦斯費300元、機車強制險128元、\n      房租3,000元、勞健保費1,255元、誠保費30元、二名女兒\n      扶養費4,500元、長女李采昀註冊費672元及二名女兒健保\n      費573元。按消費者債務清理條例之立法目的，乃在使陷\n      於經濟上困境之消費者，得藉由更生程序，清理債務，以\n      妥適調整其與債權人之權利義務關係，並非幫助債務人保\n      持其舊有之生活水平，故其生活程度自應受相當之限制，\n      以維持一般人最低生活水平所需為準，否則對債權人即屬\n      不公，合先敘明。查：\n      1.債務人主張每月支出伙食費4,500元、個人民生用品700\n        元、行動電話費400元，經核債務人之工作及日常生活\n        所需，尚屬合理。又債務人主張其每月支出通勤費498\n        元係騎乘機車，自嘉義市湖內里湖子內859號住處至工\n        作地嘉義縣民雄鄉○○村○○○街96號上班之費用，另\n        每月支出其所騎乘機車之強制汽車責任保險費128元，\n        亦據其提出收據為憑，且經核金額亦屬合理，均准予認\n        列。\n      2.債務人與其配偶郭純如育有2女李采昀係94年1月生、李\n        采蓁係98年9月生，有戶籍謄本在卷可稽，又債務人主\n        張其全家每月水電費2,180元、瓦斯費600元、房租6,00\n        0元，亦據債務人提出房屋租賃契約書為證，經核尚屬\n        合理，並由其與郭純如平均分攤，債務人負擔4,390元\n        ，應屬可採。\n      3.勞健保及誠保費部分，債務人主張每月支出1,285元，\n        ，亦據光泉公司函覆本院在卷足憑，應為可採。\n      4.另債務人主張扶養其長女李采昀、次女李采蓁，每月支\n        出二名女兒扶養費4,500元、長女李采昀註冊費672元及\n        二名女兒健保費573元，合計5,745元部分，債務人二名\n        女兒現為未成年人有受扶養之必要，有戶籍謄本在卷可\n        按。本院參酌上開金額未逾國稅局99年度扶養親屬免稅\n        扣除額每人每月6,833元（計算式：82,000元÷12月，\n        元以下四捨五入），再與其配偶共同分擔2分之1之金額\n        ，尚屬合理，應為可採。\n      5.綜上，債務人主張更生方案履行期間每月必要生活費用\n        伙食費4,500元、民生用品700元、通勤費498元、行動\n        電話費400元、水電費1,090元、瓦斯費300元、機車強\n        制險128元、房租3,000元、勞健保費1,255元、誠保費\n        30元、二名女兒扶養費4,500元、長女李采昀註冊費672\n        元及二名女兒健保費573元，總計17,646元為有理由，\n        此為債務人每月必要生活之支出。\n（三）經上計算，債務人每月收入42,646元，扣除更生方案履行\n      期間每月必要支出為17,646元後，餘25,000元（計算式：\n      42,646元－17,646元＝25,000元），所提之更生方案係將\n      剩餘金額全部提列作為每月更生還款金額，是債務人已勉\n      力提出還款方案及金額，確有履行更生方案之誠意。又系\n      爭方案清償總金額2,400,000元，債務總清償成數為37.51\n      ％，堪認清償總額已達債權總額相當成數，債權人受償金\n      額不致過低。\n（四）況且本條例立法目的，除保障債權人集團性滿足之最大化\n      及公平性外，並為賦與債務人重建復甦經濟生活之機會。\n      本件債務人更生方案已盡其償還能力，同前所述，如更生\n      方案不予認可，依本條例規定惟有開始進行清算，債務人\n      名下無其他財產，未具清算實益，反易致使債權人一無所\n      得，對債權人同為不利尤甚。且若還款額度逾越債務人所\n      能負擔之極限過大，債務人勢必無法清償，終至喪失其還\n      債之意願，則債權人實際受償之金額勢必大幅降低，因而\n      反受實質之不利益，適有害於債權人債權之保障與本條例\n      為重建債務人經濟生活之立法目的。\n（五）本院衡酌前情，認債務人已提出其最大限度之還款金額，\n      確有履行之誠意，且該更生方案公允、適當且可行。\n五、綜上所述，本件債務人確有薪資固定收入，所提更生方案條\n    件公允，且亦無本條例第63條、第64條第2項所定不應認可\n    之消極事由存在，揆諸消費者債務清理條例之立法目的，為\n    保障債權人公平受償，並謀求消費者經濟生活之更生，則本\n    件更生方案自應予認可，另依本條例第62條第2項之規定，\n    在債務人未依更生條件全部履行完畢前之生活程度，得為相\n    當之限制，爰裁定如主文。\n六、如不服本裁定，應於裁定送達後10日內，以書狀向司法事務\n    官提出異議。\n中    華    民    國   100    年    4     月    27    日\n              民事執行處司法事務官  陳拓禎",
  "structure": {
    "main": "債務人所提如附件所示之更生方案應予認可。\n債務人未依更生條件全部履行完畢前，應受如附表之生活限制。",
    "reason": "一、按法院得將更生方案之內容及債務人財產及收入狀況報告書\n    通知債權人，命債權人於法院所定期間內以書面確答是否同\n    意該方案，逾期不為確答，視為同意。同意及視為同意更生\n    方案之已申報無擔保及無優先權債權人過半數，且其所代表\n    之債權額，逾已申報無擔保及無優先權總債權額之二分之一\n    時，視為債權人會議可決更生方案。更生方案未依前二條規\n    定可決時，除有第六十四條規定之情形外，法院應以裁定開\n    始清算程序。消費者債務清理條例（下稱本條例）第60條第\n    1、2項及第61條分別定有明文。查本件債務人之個人財產及\n    收入狀況說明書與更生方案，業經本院公告揭示於本院牌示\n    處，並合法送達於各債權人，此有本院公告及送達證明在卷\n    可稽。且本件已有超過半數之已申報無擔保及無優先權債權\n    人，且其所代表之債權額，逾已申報無擔保及無優先權總債\n    權額之二分之一，回函表示不同意債務人之更生方案，此亦\n    有各債權人之陳報狀在卷可稽。是則本件債務人所提之更生\n    方案並未經債權人以書面決議方式可決，故應由本院依前揭\n    規定審查是否有符合本條例第64條依職權逕予認可之適用，\n    合先予敘明。\n二、債務人更生方案意旨略以：債務人現無擔保及無優先權債務\n    總額為新臺幣（下同）6,398,391元，第1期至96期每期願清\n    償25,000元，並自認可方案裁定確定之翌日起，依債權比例\n    於每月28日分別電匯予各債權人，共計清償8年，並以1個月\n    為1期，共計清償96期，清償總金額為2,400,000元，無擔保\n    及無優先權債權人受清償成數為37.51％（詳參附件債務人\n    更生方案）。\n三、次按債務人有薪資、執行業務所得或其他固定收入，法院認\n    更生方案之條件公允者，得不經債權人會議可決，逕依債務\n    人之聲請或依職權以裁定認可更生方案；法院為認可之裁定\n    時，因更生方案履行之必要，對於債務人在未依更生條件全\n    部履行完畢前之生活程度，得為相當之限制，本條例第64條\n    第1項、第62條第2項分別定有明文。申言之，消費者債務清\n    理條例之目的，除保障債權人集團性滿足之最大化及公平化\n    外，並為賦與債務人重建復甦其經濟生活之機會，故消費者\n    債務清理程序制度之構築首需強調生活再建及破綻預防，提\n    高債務人工作意願並改善其生活習慣，使能重新出發，從而\n    保障其生存權，並促進其義務遂行能力，儘可能永續性回復\n    信用。是若還款額度逾越所能負擔之極限過大，債務人勢必\n    無以清償，終至喪失其還債之意願，則債權人因實際受償的\n    金額降低，反蒙受實際不利益。因而更生方案是否合理可行\n    ，應視債務人財產狀況（含現有資力與將來收入來源）、清\n    償能力及經濟信用等評估，及考量債權人之受償額度（如「\n    清算保障原則」─本條例64條第2項第4款參照），予以客觀\n    判斷，始不違背前述說明。再者本條例為使法院正確判斷有\n    無逕行裁定認可更生方案之必要，雖賦予債權人獲得一定資\n    訊及陳述意見之機會。惟債權人所為之陳述，僅供法院判斷\n    是否逕行裁定認可更生方案之參考，並無拘束法院之效力，\n    附此敘明。\n四、債務人提出之更生方案是否公允，經查：\n（一）更生方案履行期間之收入狀況：\n      債務人陳稱目前任職光泉食品股份有限公司（下稱光泉公\n      司），每月含本薪、外勤津貼、安全津貼、伙食津貼、加\n      班費、業績獎金、年節金、年終獎金等項之平均收入為\n      42,646元（元以下四捨五入），已據本院函詢光泉公司據\n      其函覆相符，堪信屬實。\n（二）更生方案履行期間之必要支出狀況：\n      債務人主張更生方案履行期間每月必要生活費用為伙食費\n      4,500元、民生用品700元、通勤費498元、行動電話費400\n      元、水電費1,090元、瓦斯費300元、機車強制險128元、\n      房租3,000元、勞健保費1,255元、誠保費30元、二名女兒\n      扶養費4,500元、長女李采昀註冊費672元及二名女兒健保\n      費573元。按消費者債務清理條例之立法目的，乃在使陷\n      於經濟上困境之消費者，得藉由更生程序，清理債務，以\n      妥適調整其與債權人之權利義務關係，並非幫助債務人保\n      持其舊有之生活水平，故其生活程度自應受相當之限制，\n      以維持一般人最低生活水平所需為準，否則對債權人即屬\n      不公，合先敘明。查：\n      1.債務人主張每月支出伙食費4,500元、個人民生用品700\n        元、行動電話費400元，經核債務人之工作及日常生活\n        所需，尚屬合理。又債務人主張其每月支出通勤費498\n        元係騎乘機車，自嘉義市湖內里湖子內859號住處至工\n        作地嘉義縣民雄鄉○○村○○○街96號上班之費用，另\n        每月支出其所騎乘機車之強制汽車責任保險費128元，\n        亦據其提出收據為憑，且經核金額亦屬合理，均准予認\n        列。\n      2.債務人與其配偶郭純如育有2女李采昀係94年1月生、李\n        采蓁係98年9月生，有戶籍謄本在卷可稽，又債務人主\n        張其全家每月水電費2,180元、瓦斯費600元、房租6,00\n        0元，亦據債務人提出房屋租賃契約書為證，經核尚屬\n        合理，並由其與郭純如平均分攤，債務人負擔4,390元\n        ，應屬可採。\n      3.勞健保及誠保費部分，債務人主張每月支出1,285元，\n        ，亦據光泉公司函覆本院在卷足憑，應為可採。\n      4.另債務人主張扶養其長女李采昀、次女李采蓁，每月支\n        出二名女兒扶養費4,500元、長女李采昀註冊費672元及\n        二名女兒健保費573元，合計5,745元部分，債務人二名\n        女兒現為未成年人有受扶養之必要，有戶籍謄本在卷可\n        按。本院參酌上開金額未逾國稅局99年度扶養親屬免稅\n        扣除額每人每月6,833元（計算式：82,000元÷12月，\n        元以下四捨五入），再與其配偶共同分擔2分之1之金額\n        ，尚屬合理，應為可採。\n      5.綜上，債務人主張更生方案履行期間每月必要生活費用\n        伙食費4,500元、民生用品700元、通勤費498元、行動\n        電話費400元、水電費1,090元、瓦斯費300元、機車強\n        制險128元、房租3,000元、勞健保費1,255元、誠保費\n        30元、二名女兒扶養費4,500元、長女李采昀註冊費672\n        元及二名女兒健保費573元，總計17,646元為有理由，\n        此為債務人每月必要生活之支出。\n（三）經上計算，債務人每月收入42,646元，扣除更生方案履行\n      期間每月必要支出為17,646元後，餘25,000元（計算式：\n      42,646元－17,646元＝25,000元），所提之更生方案係將\n      剩餘金額全部提列作為每月更生還款金額，是債務人已勉\n      力提出還款方案及金額，確有履行更生方案之誠意。又系\n      爭方案清償總金額2,400,000元，債務總清償成數為37.51\n      ％，堪認清償總額已達債權總額相當成數，債權人受償金\n      額不致過低。\n（四）況且本條例立法目的，除保障債權人集團性滿足之最大化\n      及公平性外，並為賦與債務人重建復甦經濟生活之機會。\n      本件債務人更生方案已盡其償還能力，同前所述，如更生\n      方案不予認可，依本條例規定惟有開始進行清算，債務人\n      名下無其他財產，未具清算實益，反易致使債權人一無所\n      得，對債權人同為不利尤甚。且若還款額度逾越債務人所\n      能負擔之極限過大，債務人勢必無法清償，終至喪失其還\n      債之意願，則債權人實際受償之金額勢必大幅降低，因而\n      反受實質之不利益，適有害於債權人債權之保障與本條例\n      為重建債務人經濟生活之立法目的。\n（五）本院衡酌前情，認債務人已提出其最大限度之還款金額，\n      確有履行之誠意，且該更生方案公允、適當且可行。\n五、綜上所述，本件債務人確有薪資固定收入，所提更生方案條\n    件公允，且亦無本條例第63條、第64條第2項所定不應認可\n    之消極事由存在，揆諸消費者債務清理條例之立法目的，為\n    保障債權人公平受償，並謀求消費者經濟生活之更生，則本\n    件更生方案自應予認可，另依本條例第62條第2項之規定，\n    在債務人未依更生條件全部履行完畢前之生活程度，得為相\n    當之限制，爰裁定如主文。\n六、如不服本裁定，應於裁定送達後10日內，以書狀向司法事務\n    官提出異議。"
  },
  "search": "臺灣嘉義地方法院民事裁定99年度司執消債更字第24號聲請人即債務人李慶城債權人誠第一資產管理股份有限公司法定代理人王裕南債權人臺灣銀行股份有限公司法定代理人張明道代理人黃文明債權人花旗(台灣)商業銀行股份有限公司法定代理人管國霖債權人渣打國際商業銀行股份有限公司法定代理人曾璟璇債權人遠東國際商業銀行股份有限公司法定代理人洪信德債權人台新國際商業銀行股份有限公司法定代理人蔡榮棟債權人大眾商業銀行股份有限公司法定代理人陳建平代理人蔡怡玫債權人日盛國際商業銀行股份有限公司法定代理人楊智光債權人安泰商業銀行股份有限公司法定代理人齊百邁債權人中國信託商業銀行股份有限公司法定代理人辜松債權人萬榮行銷股份有限公司法定代理人劉五湖代理人王靖雯上列當事人間聲請消費者債務清理事件，本院裁定如下：主文債務人所提如附件所示之更生方案應予認可。債務人未依更生條件全部履行完畢前，應受如附表之生活限制。理由一、按法院得將更生方案之內容及債務人財產及收入狀況報告書通知債權人，命債權人於法院所定期間內以書面確答是否同意該方案，逾期不為確答，視為同意。同意及視為同意更生方案之已申報無擔保及無優先權債權人過半數，且其所代表之債權額，逾已申報無擔保及無優先權總債權額之二分之一時，視為債權人會議可決更生方案。更生方案未依前二條規定可決時，除有第六十四條規定之情形外，法院應以裁定開始清算程序。消費者債務清理條例（下稱本條例）第60條第1、2項及第61條分別定有明文。查本件債務人之個人財產及收入狀況說明書與更生方案，業經本院公告揭示於本院牌示處，並合法送達於各債權人，此有本院公告及送達證明在卷可稽。且本件已有超過半數之已申報無擔保及無優先權債權人，且其所代表之債權額，逾已申報無擔保及無優先權總債權額之二分之一，回函表示不同意債務人之更生方案，此亦有各債權人之陳報狀在卷可稽。是則本件債務人所提之更生方案並未經債權人以書面決議方式可決，故應由本院依前揭規定審查是否有符合本條例第64條依職權逕予認可之適用，合先予敘明。二、債務人更生方案意旨略以：債務人現無擔保及無優先權債務總額為新臺幣（下同）6,398,391元，第1期至96期每期願清償25,000元，並自認可方案裁定確定之翌日起，依債權比例於每月28日分別電匯予各債權人，共計清償8年，並以1個月為1期，共計清償96期，清償總金額為2,400,000元，無擔保及無優先權債權人受清償成數為37.51％（詳參附件債務人更生方案）。三、次按債務人有薪資、執行業務所得或其他固定收入，法院認更生方案之條件公允者，得不經債權人會議可決，逕依債務人之聲請或依職權以裁定認可更生方案；法院為認可之裁定時，因更生方案履行之必要，對於債務人在未依更生條件全部履行完畢前之生活程度，得為相當之限制，本條例第64條第1項、第62條第2項分別定有明文。申言之，消費者債務清理條例之目的，除保障債權人集團性滿足之最大化及公平化外，並為賦與債務人重建復甦其經濟生活之機會，故消費者債務清理程序制度之構築首需強調生活再建及破綻預防，提高債務人工作意願並改善其生活習慣，使能重新出發，從而保障其生存權，並促進其義務遂行能力，儘可能永續性回復信用。是若還款額度逾越所能負擔之極限過大，債務人勢必無以清償，終至喪失其還債之意願，則債權人因實際受償的金額降低，反蒙受實際不利益。因而更生方案是否合理可行，應視債務人財產狀況（含現有資力與將來收入來源）、清償能力及經濟信用等評估，及考量債權人之受償額度（如「清算保障原則」─本條例64條第2項第4款參照），予以客觀判斷，始不違背前述說明。再者本條例為使法院正確判斷有無逕行裁定認可更生方案之必要，雖賦予債權人獲得一定資訊及陳述意見之機會。惟債權人所為之陳述，僅供法院判斷是否逕行裁定認可更生方案之參考，並無拘束法院之效力，附此敘明。四、債務人提出之更生方案是否公允，經查：（一）更生方案履行期間之收入狀況：債務人陳稱目前任職光泉食品股份有限公司（下稱光泉公司），每月含本薪、外勤津貼、安全津貼、伙食津貼、加班費、業績獎金、年節金、年終獎金等項之平均收入為42,646元（元以下四捨五入），已據本院函詢光泉公司據其函覆相符，堪信屬實。（二）更生方案履行期間之必要支出狀況：債務人主張更生方案履行期間每月必要生活費用為伙食費4,500元、民生用品700元、通勤費498元、行動電話費400元、水電費1,090元、瓦斯費300元、機車強制險128元、房租3,000元、勞健保費1,255元、誠保費30元、二名女兒扶養費4,500元、長女李采昀註冊費672元及二名女兒健保費573元。按消費者債務清理條例之立法目的，乃在使陷於經濟上困境之消費者，得藉由更生程序，清理債務，以妥適調整其與債權人之權利義務關係，並非幫助債務人保持其舊有之生活水平，故其生活程度自應受相當之限制，以維持一般人最低生活水平所需為準，否則對債權人即屬不公，合先敘明。查：1.債務人主張每月支出伙食費4,500元、個人民生用品700元、行動電話費400元，經核債務人之工作及日常生活所需，尚屬合理。又債務人主張其每月支出通勤費498元係騎乘機車，自嘉義市湖內里湖子內859號住處至工作地嘉義縣民雄鄉○○村○○○街96號上班之費用，另每月支出其所騎乘機車之強制汽車責任保險費128元，亦據其提出收據為憑，且經核金額亦屬合理，均准予認列。2.債務人與其配偶郭純如育有2女李采昀係94年1月生、李采蓁係98年9月生，有戶籍謄本在卷可稽，又債務人主張其全家每月水電費2,180元、瓦斯費600元、房租6,000元，亦據債務人提出房屋租賃契約書為證，經核尚屬合理，並由其與郭純如平均分攤，債務人負擔4,390元，應屬可採。3.勞健保及誠保費部分，債務人主張每月支出1,285元，，亦據光泉公司函覆本院在卷足憑，應為可採。4.另債務人主張扶養其長女李采昀、次女李采蓁，每月支出二名女兒扶養費4,500元、長女李采昀註冊費672元及二名女兒健保費573元，合計5,745元部分，債務人二名女兒現為未成年人有受扶養之必要，有戶籍謄本在卷可按。本院參酌上開金額未逾國稅局99年度扶養親屬免稅扣除額每人每月6,833元（計算式：82,000元÷12月，元以下四捨五入），再與其配偶共同分擔2分之1之金額，尚屬合理，應為可採。5.綜上，債務人主張更生方案履行期間每月必要生活費用伙食費4,500元、民生用品700元、通勤費498元、行動電話費400元、水電費1,090元、瓦斯費300元、機車強制險128元、房租3,000元、勞健保費1,255元、誠保費30元、二名女兒扶養費4,500元、長女李采昀註冊費672元及二名女兒健保費573元，總計17,646元為有理由，此為債務人每月必要生活之支出。（三）經上計算，債務人每月收入42,646元，扣除更生方案履行期間每月必要支出為17,646元後，餘25,000元（計算式：42,646元－17,646元＝25,000元），所提之更生方案係將剩餘金額全部提列作為每月更生還款金額，是債務人已勉力提出還款方案及金額，確有履行更生方案之誠意。又系爭方案清償總金額2,400,000元，債務總清償成數為37.51％，堪認清償總額已達債權總額相當成數，債權人受償金額不致過低。（四）況且本條例立法目的，除保障債權人集團性滿足之最大化及公平性外，並為賦與債務人重建復甦經濟生活之機會。本件債務人更生方案已盡其償還能力，同前所述，如更生方案不予認可，依本條例規定惟有開始進行清算，債務人名下無其他財產，未具清算實益，反易致使債權人一無所得，對債權人同為不利尤甚。且若還款額度逾越債務人所能負擔之極限過大，債務人勢必無法清償，終至喪失其還債之意願，則債權人實際受償之金額勢必大幅降低，因而反受實質之不利益，適有害於債權人債權之保障與本條例為重建債務人經濟生活之立法目的。（五）本院衡酌前情，認債務人已提出其最大限度之還款金額，確有履行之誠意，且該更生方案公允、適當且可行。五、綜上所述，本件債務人確有薪資固定收入，所提更生方案條件公允，且亦無本條例第63條、第64條第2項所定不應認可之消極事由存在，揆諸消費者債務清理條例之立法目的，為保障債權人公平受償，並謀求消費者經濟生活之更生，則本件更生方案自應予認可，另依本條例第62條第2項之規定，在債務人未依更生條件全部履行完畢前之生活程度，得為相當之限制，爰裁定如主文。六、如不服本裁定，應於裁定送達後10日內，以書狀向司法事務官提出異議。中華民國100年4月27日民事執行處司法事務官陳拓禎",
  "characters": {
    "judges": [

    ],
    "prosecutors": [

    ],
    "lawyers": [

    ],
    "clerks": [

    ],
    "plaintiffs": [

    ],
    "defendants": [

    ],
    "prosecutor_office": [

    ],
    "creditors": [
      "臺灣銀行股份有限公司",
      "花旗",
      "渣打國際商業銀行股份有限公司",
      "遠東國際商業銀行股份有限公司",
      "台新國際商業銀行股份有限公司",
      "大眾商業銀行股份有限公司",
      "日盛國際商業銀行股份有限公司",
      "安泰商業銀行股份有限公司",
      "中國信託商業銀行股份有限公司",
      "萬榮行銷股份有限公司"
    ],
    "debtors": [

    ],
    "judicial_associate_officer": [
      "陳拓禎"
    ]
  },
  "adjudged_at": "2011-04-27",
  "created_at": "2016-02-12 09:22:58",
  "updated_at": "2016-02-12 09:22:58"
}