{
  "identify": "ILD-100-司拍-39-20110428-1",
  "court": {
    "name": "臺灣宜蘭地方法院",
    "code": "ILD"
  },
  "division": {
    "name": "民事",
    "code": "V"
  },
  "year": 100,
  "word": "司拍",
  "number": "39",
  "jcheck": "1",
  "reason": "拍賣抵押物",
  "content": "臺灣宜蘭地方法院民事裁定             100年度司拍字第39號\n聲  請  人  中國信託商業銀行股份有限公司\n法定代理人  辜松\n相  對  人  黃建銘\n上列當事人間聲請拍賣抵押物事件，本院裁定如下：\n    主  文\n相對人所有如附表所示之不動產，准予拍賣。\n聲請程序費用新臺幣貳仟元由相對人負擔。\n    理  由\n一、按抵押權人於債權已屆清償期而未受清償者，得聲請法院拍\n    賣抵押物，就其賣得價金而受清償，民法第873條定有明文\n    。又上開關於普通抵押權之規定，於民法物權編修正施行前\n    設定之最高限額抵押權亦準用之，同法第881條之17及民法\n    物權編施行法第17條分別定有明文。\n二、本件聲請意旨略以：相對人於民國（下同）94年7月7日以如\n    附表所示之不動產，為向聲請人現在及將來一切債務之擔保\n    ，設定新臺幣（下同）490萬元之最高限額抵押權，存續日\n    期自94年7月5日起至134年7月5日止，債務清償期、利息、\n    違約金等依照各個債務契約約定，經登記在案。嗣相對人於\n    94年7月11日向聲請人借款408萬元，約定按月攤還本息，利\n    息、違約金等均依照各借貸契約約定，並約定如有任何一宗\n    債務不依約清償或攤還本金、利息時，借款人即喪失期限之\n    利益，應立即全部償還。詎相對人自100年1月11日後即未依\n    約履行債務，依上開約定，本件借款應視為全部到期，尚積\n    欠本金3,451,558元及利息、違約金。為此聲請拍賣抵押物\n    以資受償，並提出他項權利證明書影本、抵押權設定契約書\n    影本、不動產登記簿謄本影本、借據影本、繳款歷史交易查\n    詢影本、放款主檔畫面影本、放款帳戶利率查詢影本等為證\n    。\n三、經核尚無不合，應予准許。\n四、依非訟事件法第21條第2 項、第24條第1 項、民事訴訟法第\n    78條，裁定如主文。\n中    華    民    國   100    年    4     月    28    日\n                  臺灣宜蘭地方法院民事庭\n                      司法事務官  呂明龍\n正本係照原本作成。\n如不服本裁定，應於裁定送達後10日內向本院提出抗告狀，並繳\n納抗告費新臺幣1仟元。\n中    華    民    國   100    年    4     月    28    日\n                      書  記  官  黃月雲",
  "structure": {
    "main": "相對人所有如附表所示之不動產，准予拍賣。\n聲請程序費用新臺幣貳仟元由相對人負擔。",
    "reason": "一、按抵押權人於債權已屆清償期而未受清償者，得聲請法院拍\n    賣抵押物，就其賣得價金而受清償，民法第873條定有明文\n    。又上開關於普通抵押權之規定，於民法物權編修正施行前\n    設定之最高限額抵押權亦準用之，同法第881條之17及民法\n    物權編施行法第17條分別定有明文。\n二、本件聲請意旨略以：相對人於民國（下同）94年7月7日以如\n    附表所示之不動產，為向聲請人現在及將來一切債務之擔保\n    ，設定新臺幣（下同）490萬元之最高限額抵押權，存續日\n    期自94年7月5日起至134年7月5日止，債務清償期、利息、\n    違約金等依照各個債務契約約定，經登記在案。嗣相對人於\n    94年7月11日向聲請人借款408萬元，約定按月攤還本息，利\n    息、違約金等均依照各借貸契約約定，並約定如有任何一宗\n    債務不依約清償或攤還本金、利息時，借款人即喪失期限之\n    利益，應立即全部償還。詎相對人自100年1月11日後即未依\n    約履行債務，依上開約定，本件借款應視為全部到期，尚積\n    欠本金3,451,558元及利息、違約金。為此聲請拍賣抵押物\n    以資受償，並提出他項權利證明書影本、抵押權設定契約書\n    影本、不動產登記簿謄本影本、借據影本、繳款歷史交易查\n    詢影本、放款主檔畫面影本、放款帳戶利率查詢影本等為證\n    。\n三、經核尚無不合，應予准許。\n四、依非訟事件法第21條第2 項、第24條第1 項、民事訴訟法第\n    78條，裁定如主文。"
  },
  "search": "臺灣宜蘭地方法院民事裁定100年度司拍字第39號聲請人中國信託商業銀行股份有限公司法定代理人辜松相對人黃建銘上列當事人間聲請拍賣抵押物事件，本院裁定如下：主文相對人所有如附表所示之不動產，准予拍賣。聲請程序費用新臺幣貳仟元由相對人負擔。理由一、按抵押權人於債權已屆清償期而未受清償者，得聲請法院拍賣抵押物，就其賣得價金而受清償，民法第873條定有明文。又上開關於普通抵押權之規定，於民法物權編修正施行前設定之最高限額抵押權亦準用之，同法第881條之17及民法物權編施行法第17條分別定有明文。二、本件聲請意旨略以：相對人於民國（下同）94年7月7日以如附表所示之不動產，為向聲請人現在及將來一切債務之擔保，設定新臺幣（下同）490萬元之最高限額抵押權，存續日期自94年7月5日起至134年7月5日止，債務清償期、利息、違約金等依照各個債務契約約定，經登記在案。嗣相對人於94年7月11日向聲請人借款408萬元，約定按月攤還本息，利息、違約金等均依照各借貸契約約定，並約定如有任何一宗債務不依約清償或攤還本金、利息時，借款人即喪失期限之利益，應立即全部償還。詎相對人自100年1月11日後即未依約履行債務，依上開約定，本件借款應視為全部到期，尚積欠本金3,451,558元及利息、違約金。為此聲請拍賣抵押物以資受償，並提出他項權利證明書影本、抵押權設定契約書影本、不動產登記簿謄本影本、借據影本、繳款歷史交易查詢影本、放款主檔畫面影本、放款帳戶利率查詢影本等為證。三、經核尚無不合，應予准許。四、依非訟事件法第21條第2項、第24條第1項、民事訴訟法第78條，裁定如主文。中華民國100年4月28日臺灣宜蘭地方法院民事庭司法事務官呂明龍正本係照原本作成。如不服本裁定，應於裁定送達後10日內向本院提出抗告狀，並繳納抗告費新臺幣1仟元。中華民國100年4月28日書記官黃月雲",
  "characters": {
    "judges": [

    ],
    "prosecutors": [

    ],
    "lawyers": [

    ],
    "clerks": [

    ],
    "plaintiffs": [

    ],
    "defendants": [

    ],
    "prosecutor_office": [
      "中國信託商業銀行股份有限公司"
    ],
    "creditors": [

    ],
    "debtors": [

    ],
    "judicial_associate_officer": [
      "呂明龍"
    ]
  },
  "adjudged_at": "2011-04-28",
  "created_at": "2016-02-12 09:12:29",
  "updated_at": "2016-02-12 09:12:29"
}