{
  "identify": "MLD-94-婚-85-20051228-1",
  "court": {
    "name": "臺灣苗栗地方法院",
    "code": "MLD"
  },
  "division": {
    "name": "民事",
    "code": "V"
  },
  "year": 94,
  "word": "婚",
  "number": "85",
  "jcheck": "1",
  "reason": "請求離婚",
  "content": "臺灣苗栗地方法院民事裁定                94年度婚字第85號\n原      告  乙○○\n                        之2號.\n被      告  甲○○○  原住臺北.\n上列當事人間請求離婚事件，本院裁定如下：\n    主    文\n本件移送臺灣板橋地方法院。\n    理    由\n一、按離婚之訴，專屬夫妻之住所地或夫、妻死亡時住所地之法\n    院管轄；但訴之原因事實發生於夫或妻之居所地者，得由各\n    該居所地之法院管轄，民事訴訟法第568 條第1 項定有明文\n    。次按訴訟之全部或一部，法院認為無管轄權者，依原告聲\n    請或依職權以裁定移送其管轄法院，同法第28條第1 項亦有\n    明白規定。\n二、按「夫妻之住所，由雙方共同協議之；未為協議或協議不成\n    時，得聲請法院定之」，民法第1002條第1 項定有明文。又\n    按「依一定之事實，足認以久住之意思，住於一定之區域者\n    ，即為設定其住所於該地，為民法第20條所明定，是我國民\n    法關於住所之設定，兼採主觀主義及客觀主義之精神，必須\n    主觀上有久住一定區域之意思，客觀上有住於一定區域之事\n    實，該一定之區域始為住所，故住所並不以登記為要件。又\n    戶籍法為戶籍登記之行政管理規定，戶籍地址乃係依戶籍法\n    所為登記之事項，戶籍地址並非為認定住所之唯一標準」（\n    最高法院93年度臺抗字第393 號裁定意旨參照）。經查：被\n    告係越南國人民，現行方不明之事實，有苗栗縣警察局竹南\n    分局函文1 件附卷可稽（見卷第23頁），是被告在我國並無\n    戶籍。而兩造於民國90年2 月22日結婚後，最後共同居所為\n    臺北縣五股鄉○○路93號4 樓，被告離家後，原告迄今仍居\n    住於該址之事實，為原告陳述明確（見卷第102 頁），並經\n    證人即原告之兄陳連福到庭證述明確（見卷第119 頁），是\n    兩造最後係協議選定住所於該址，且該址係原告陳稱受被告\n    惡意遺棄之原因事實發生地，本院對原告而言亦屬不便利法\n    院，揆諸上開法律，該址之管轄法院臺灣板橋地方法院方有\n    本件之專屬管轄權，本院並無管轄權。\n三、綜上論述，原告請求移轉管轄至臺灣板橋地方法院，核無不\n    合。\n四、依民事訴訟法第28條第1項，裁定如主文。\n中    華    民    國    94    年    12    月    28    日\n                  家事法庭    法  官  伍偉華\n以上正本係照原本作成。\n如對本裁定上訴，須於裁定送達後10日內向本院提出抗告狀附繕\n本，並繳納抗告費用。\n                              書記官  許瑞萍\n中    華    民    國    94    年    12    月    30    日\n",
  "structure": {
    "main": "本件移送臺灣板橋地方法院。",
    "reason": "一、按離婚之訴，專屬夫妻之住所地或夫、妻死亡時住所地之法\n    院管轄；但訴之原因事實發生於夫或妻之居所地者，得由各\n    該居所地之法院管轄，民事訴訟法第568 條第1 項定有明文\n    。次按訴訟之全部或一部，法院認為無管轄權者，依原告聲\n    請或依職權以裁定移送其管轄法院，同法第28條第1 項亦有\n    明白規定。\n二、按「夫妻之住所，由雙方共同協議之；未為協議或協議不成\n    時，得聲請法院定之」，民法第1002條第1 項定有明文。又\n    按「依一定之事實，足認以久住之意思，住於一定之區域者\n    ，即為設定其住所於該地，為民法第20條所明定，是我國民\n    法關於住所之設定，兼採主觀主義及客觀主義之精神，必須\n    主觀上有久住一定區域之意思，客觀上有住於一定區域之事\n    實，該一定之區域始為住所，故住所並不以登記為要件。又\n    戶籍法為戶籍登記之行政管理規定，戶籍地址乃係依戶籍法\n    所為登記之事項，戶籍地址並非為認定住所之唯一標準」（\n    最高法院93年度臺抗字第393 號裁定意旨參照）。經查：被\n    告係越南國人民，現行方不明之事實，有苗栗縣警察局竹南\n    分局函文1 件附卷可稽（見卷第23頁），是被告在我國並無\n    戶籍。而兩造於民國90年2 月22日結婚後，最後共同居所為\n    臺北縣五股鄉○○路93號4 樓，被告離家後，原告迄今仍居\n    住於該址之事實，為原告陳述明確（見卷第102 頁），並經\n    證人即原告之兄陳連福到庭證述明確（見卷第119 頁），是\n    兩造最後係協議選定住所於該址，且該址係原告陳稱受被告\n    惡意遺棄之原因事實發生地，本院對原告而言亦屬不便利法\n    院，揆諸上開法律，該址之管轄法院臺灣板橋地方法院方有\n    本件之專屬管轄權，本院並無管轄權。\n三、綜上論述，原告請求移轉管轄至臺灣板橋地方法院，核無不\n    合。\n四、依民事訴訟法第28條第1項，裁定如主文。"
  },
  "search": "臺灣苗栗地方法院民事裁定94年度婚字第85號原告乙○○之2號.被告甲○○○原住臺北.上列當事人間請求離婚事件，本院裁定如下：主文本件移送臺灣板橋地方法院。理由一、按離婚之訴，專屬夫妻之住所地或夫、妻死亡時住所地之法院管轄；但訴之原因事實發生於夫或妻之居所地者，得由各該居所地之法院管轄，民事訴訟法第568條第1項定有明文。次按訴訟之全部或一部，法院認為無管轄權者，依原告聲請或依職權以裁定移送其管轄法院，同法第28條第1項亦有明白規定。二、按「夫妻之住所，由雙方共同協議之；未為協議或協議不成時，得聲請法院定之」，民法第1002條第1項定有明文。又按「依一定之事實，足認以久住之意思，住於一定之區域者，即為設定其住所於該地，為民法第20條所明定，是我國民法關於住所之設定，兼採主觀主義及客觀主義之精神，必須主觀上有久住一定區域之意思，客觀上有住於一定區域之事實，該一定之區域始為住所，故住所並不以登記為要件。又戶籍法為戶籍登記之行政管理規定，戶籍地址乃係依戶籍法所為登記之事項，戶籍地址並非為認定住所之唯一標準」（最高法院93年度臺抗字第393號裁定意旨參照）。經查：被告係越南國人民，現行方不明之事實，有苗栗縣警察局竹南分局函文1件附卷可稽（見卷第23頁），是被告在我國並無戶籍。而兩造於民國90年2月22日結婚後，最後共同居所為臺北縣五股鄉○○路93號4樓，被告離家後，原告迄今仍居住於該址之事實，為原告陳述明確（見卷第102頁），並經證人即原告之兄陳連福到庭證述明確（見卷第119頁），是兩造最後係協議選定住所於該址，且該址係原告陳稱受被告惡意遺棄之原因事實發生地，本院對原告而言亦屬不便利法院，揆諸上開法律，該址之管轄法院臺灣板橋地方法院方有本件之專屬管轄權，本院並無管轄權。三、綜上論述，原告請求移轉管轄至臺灣板橋地方法院，核無不合。四、依民事訴訟法第28條第1項，裁定如主文。中華民國94年12月28日家事法庭法官伍偉華以上正本係照原本作成。如對本裁定上訴，須於裁定送達後10日內向本院提出抗告狀附繕本，並繳納抗告費用。書記官許瑞萍中華民國94年12月30日",
  "characters": {
    "judges": [
      "伍偉華"
    ],
    "prosecutors": [

    ],
    "lawyers": [

    ],
    "clerks": [
      "許瑞萍"
    ],
    "plaintiffs": [
      "乙"
    ],
    "defendants": [
      "甲○○○  原住臺北."
    ],
    "prosecutor_office": [

    ],
    "creditors": [

    ],
    "debtors": [

    ],
    "judicial_associate_officer": [

    ]
  },
  "adjudged_at": "2005-12-28",
  "created_at": "2016-02-07 03:28:45",
  "updated_at": "2016-02-07 03:28:45"
}