{
  "identify": "KSH-99-交抗-622-20110106-1",
  "court": {
    "name": "臺灣高等法院",
    "code": "KSH"
  },
  "division": {
    "name": "刑事",
    "code": "M"
  },
  "year": 99,
  "word": "交抗",
  "number": "622",
  "jcheck": "1",
  "reason": "聲明異議",
  "content": "臺灣高等法院高雄分院刑事裁定         99年度交抗字第622號\n抗告人  即\n原處分機關  交通部公路總局高雄區監理所\n代  表  人  劉育麟\n抗  告  人\n即  異議人\n即受處分人  李心琪\n上列抗告人因受處分人違反道路交通管理處罰條例，聲明異議案\n件，不服臺灣高雄地方法院中華民國99年11月25日裁定（99年度\n交聲字第3090號），提起抗告，本院裁定如下：\n    主  文\n抗告駁回。\n    理  由\n一、原處分意旨略以：異議人即受處分人李心琪於民國98年5 月\n    29日04時40分許，明知已因服用酒類，控制力及注意力已達\n    不能安全駕駛動力交通工具之程度，詎仍駕駛車牌號碼719-\n    BDM 號重型機車，行駛於林園鄉○○○路，為警攔查，並施\n    以檢測，得知呼氣酒精濃度含量為每公升0.61毫克，而有「\n    汽車駕駛人酒精濃度超過規定標準（每公升0.25至0.4 毫克\n    ）」之違規，依道路交通管理處罰條例第35條第1 項第1 款\n    規定，裁處罰鍰新臺幣（下同）4 萬5,000 元，吊扣駕照12\n    個月，並應參加道路交通安全講習等語。\n二、異議意旨略以：異議人於前揭時、地酒駕違規，業經檢察官\n    以緩起訴判處40小時之義務勞動服務，如今又處以罰鍰，違\n    反一事不二罰之法理，懇請撤銷4 萬5,000元的罰款等語。\n三、經查：\n  (一)關於罰鍰部分：\n  1.按汽車駕駛人，駕駛汽車經測試檢定有酒精濃度超過規定標\n    準者，處1 萬5,000 元以上60,000元以下罰鍰，並當場移置\n    保管該汽車及吊扣其駕駛執照1 年。汽車駕駛人有飲用酒類\n    或其他類似物後其吐氣所含酒精濃度超過每公升0.25毫克或\n    血液中酒精濃度超過百分之0.05以上者，不得駕車。道路交\n    通管理處罰條例第35條第1 項第1 款、道路交通安全規則第\n    114 條第2 款分別定有明文。惟依95年2 月5 日施行之行政\n    罰法第26條第1 項規定：「一行為同時觸犯刑事法律及違反\n    行政法上義務規定者，依刑事法律處罰之。但其行為應處以\n    其他種類行政罰或得沒入之物而未經法院宣告沒收者，亦得\n    裁處之。」，此乃一行為同時造成刑罰法律與行政秩序罰規\n    定發生競合適用之關係時，基於「一事不二罰」之法理，經\n    由立法程序確立應以刑罰優先為原則，避免行為人承受過度\n    且重複之處罰。此觀該條立法理由明確揭示：「一行為同時\n    觸犯刑事法律及違反行政法上義務規定時，由於刑罰與行政\n    罰同屬對不法行為之制裁，而刑罰之懲罰作用較強，故依刑\n    事法律處罰，即足資警惕時，實無一事二罰再處行政罰之必\n    要。且刑事法律處罰，由法院依法定程序為之，較符合正當\n    法律程序，應予優先適用。但罰鍰以外之沒入或其他種類行\n    政罰，因兼具維護公共秩序之作用，為達行政目的，行政機\n    關仍得併予裁處，故為第一項但書規定。」，其理益明。是\n    以前揭行政罰法中刑事法律處罰優先且不再處以行政秩序罰\n    之目的，既係因為行為人已接受刑罰而足資警惕，且已發生\n    懲罰之作用，即無使行為人陷於雙重處罰之不利益，則關於\n    刑事法律處罰之範圍自應採取實質認定，凡刑事實體法或程\n    序法中所規定客觀上剝奪行為人生命、自由、財產權利，主\n    觀上亦因制裁之嚴厲性、痛苦性，其強度足以造成心理強制\n    而間接達成矯正教化目的之處遇手段，皆應納入其中，而不\n    以形式上符合刑法第32條至第34條所定主刑及從刑種類者為\n    限，始與前揭法律規範之意旨相符。\n  2.查異議人於98年5 月29日04時40分許，明知已因服用酒類，\n    控制力及注意力已達不能安全駕駛動力交通工具之程度，詎\n    仍駕駛車牌號碼719-BDM 號重型機車，行駛於林園鄉○○○\n    路，為警攔查，並施以檢測，得知呼氣酒精濃度含量為每公\n    升0.61毫克，而經臺灣高雄地方法院檢察署檢察官以98年度\n    偵字第20617號為緩起訴處分，緩起訴期間為1年，並命異議\n    人向指定之公益團體、地方自治團體或社區提供40小時之義\n    務勞務，上開緩起訴處分期間已於99年8月11 日期滿而未經\n    撤銷等情，亦有臺灣高等法院被告前案紀錄表在卷可稽，則\n    異議人上開違反刑事法律禁止規範之犯罪事實既已明確，僅\n    因檢察官採取緩起訴處分之替代性刑事處遇手段，未將該案\n    逕行起訴或聲請簡易判決處刑，致其後適用之刑事訴訟程序\n    有所區別，然就異議人負有向檢察官指定機構提供一定時數\n    之勞務義務觀察，其如未在上開指定期間內確實履行義務，\n    依刑事訴訟法第253 條之3 第1 項第3 款之規定，異議人將\n    遭受撤銷緩起訴處分之不利益；反之，倘其確實遵守並履行\n    各項緩起訴條件，除非合於刑事訴訟法第260 條所定情形之\n    一，否則異議人即無再就同一案件遭受刑事訴追之虞。從而\n    ，異議人已因上開緩起訴處分而剝奪其人身自由，主觀上前\n    揭義務勞務亦具有強制性、懲罰性，雖不若易科罰金係以支\n    付金錢作為自由刑之替代，惟經由緩起訴處分條件之履行使\n    其免於遭檢察官發動起訴程序，仍具有替代刑罰之效果，廣\n    義而言，應屬前揭所稱之「實質刑事法律處罰」，而有行政\n    罰法第26條第1 項「一事不二罰」規定之適用。是異議人因\n    駕駛人酒精濃度超過規定標準之違規行為，依行政罰法第26\n    條第1 項前段規定，即應依刑事法律處罰之，已無再依上開\n    道路交通處罰條例第35條第1 項第1 款裁處行政罰鍰之餘地\n    。\n  (二)關於吊扣重型機車駕駛執照\n    道路交通管理處罰條例第35條第1 項第1 款所稱「駕駛汽車\n    經測試檢定有酒精濃度超過規定標準之情形，因而肇事致人\n    受傷者，吊扣其駕駛執照2 年」係以行為人飲酒後駕車之行\n    為，造成他人受傷為必要。本件異議人飲酒駕車後，並因此\n    使他人受傷。本件異議人上開交通違規行為，既有「因而肇\n    事致人受傷」之情形，原處分機關僅依舉發通知單之記載而\n    裁處吊扣異議人駕駛執照12個月，於法未合，應依道路交通\n    管理處罰條例第35條第1項第1款及違反道路交通管理事件統\n    一裁罰基準表之規定，裁處異議人吊扣駕駛執照24個月。\n  (三)關於施以道路安全講習部分：\n    原處分機關裁處異議人施以道路安全講習部分，均係為達成\n    遏止酒後駕車之不法行為，維護道路交通用路權人之安全法\n    益等行政目的所必要之罰鍰以外之其他種類行政罰，依行政\n    罰法第26條第1 項但書之規定，原處分機關仍得裁處，並未\n    違反「一事不二罰」之規定，故此部分之裁處並無違誤。\n四、綜上所述，本件異議人於飲酒後駕駛重型機車之行為，違反\n    道路交通管理處罰條例第35條第1 項第1 款規定，依同條例\n    第24條第1 項第2 款及違反道路交通管理事件統一裁罰基準\n    表之規定，應吊扣重型機車駕駛執照24個月及應參加道路交\n    通安全講習。是異議人就罰鍰45,000元部分聲明異議，非無\n    理由。又道路交通管理處罰條例第87條第1 項規定：「受處\n    分人不服第8 條主管機關所為之處罰，得於接到裁決書之翌\n    日起20日內，向管轄地方法院聲明異議。」此條文中所謂之\n    「處罰」，應指包括對受處分人裁處之違規事實是否正當，\n    及裁罰所引用之法條是否適當而言，蓋此二者有不可分離之\n    關係，即聲明異議應以交通違規行為為標的，非以處罰項目\n    為範圍。是本件異議人酒後駕車只有一個交通違規行為，雖\n    異議人僅就處罰項目中之罰鍰部分提起異議，其餘部分（吊\n    扣駕照及應參加道路交通安全講習部分）並未提及，然其餘\n    處罰項目與其交通違規行為是否存在既無從分離，法院自應\n    併予審理，附此敘明。從而，原處分機關裁罰異議人罰鍰45\n    ,000元之處分即有不當，自應將原處分全部撤銷，另為裁定\n    李心琪汽車駕駛人，駕駛汽車經測試酒精濃度超過規定標準\n    ，處吊扣重型機器腳踏車普通駕駛執照貳拾肆個月，且接受\n    道路交通安全講習。\n五、經核原裁定於法並無不合，交通部公路總局高雄區監理所抗\n    告意旨仍執：異議人李心琪於98年5 月29日酒後駕車違規之\n    事實，同時觸犯刑事法律及違反行政法上義務，刑事部分經\n    檢察官緩起訴處分確定，異議人並已依緩起訴處分命令履行\n    義務勞務，然其提供義務勞務之性質與本件處分所為罰鍰、\n    吊扣普通重型機器腳踏車駕駛執照及施以道路交通安全講習\n    之種類不同。抗告人交通部公路總局高雄區監理所於上開緩\n    起訴期滿後，於99年10月12日以高監營裁字第裁80－NO0000\n    000 號裁決書裁處罰鍰新台幣（下同）4 萬5,000 元，自吊\n    扣普通重型機器腳踏車駕駛執照12月，並施以道路安全講習\n    ，應無不合。原裁定將本件處分撤銷，於法尚有未洽等詞；\n    李心琪抗告意旨仍執：異議人即抗告人李心琪於案發當天係\n    因為了救割腕自殺之友人，才會酒後駕車載受傷友人至建佑\n    醫院救治，不料途中又因閃躲一隻流浪狗，才會造成車禍，\n    原審99年度交聲字第3090號裁定吊扣普通重型機器腳踏車駕\n    駛執照24個月，期間過長，請求改定為12個月等詞，指摘原\n    裁定不當，難認有理由，均應駁回。\n據上論斷，應依道路交通案件處理辦法第26條，刑事訴訟法第41\n2 條，裁定如主文。\n中    華    民    國  100   年    1     月      6     日\n                  刑事第七庭    審判長法  官 莊飛宗\n                                      法  官 蔡廣昇\n                                      法  官 謝宏宗\n以上正本證明與原本無異。\n本裁定不得再抗告。\n中    華    民    國  100   年    1     月      7     日\n                                      書記官 蘇恒仁",
  "structure": {
    "main": "抗告駁回。",
    "reason": "一、原處分意旨略以：異議人即受處分人李心琪於民國98年5 月\n    29日04時40分許，明知已因服用酒類，控制力及注意力已達\n    不能安全駕駛動力交通工具之程度，詎仍駕駛車牌號碼719-\n    BDM 號重型機車，行駛於林園鄉○○○路，為警攔查，並施\n    以檢測，得知呼氣酒精濃度含量為每公升0.61毫克，而有「\n    汽車駕駛人酒精濃度超過規定標準（每公升0.25至0.4 毫克\n    ）」之違規，依道路交通管理處罰條例第35條第1 項第1 款\n    規定，裁處罰鍰新臺幣（下同）4 萬5,000 元，吊扣駕照12\n    個月，並應參加道路交通安全講習等語。\n二、異議意旨略以：異議人於前揭時、地酒駕違規，業經檢察官\n    以緩起訴判處40小時之義務勞動服務，如今又處以罰鍰，違\n    反一事不二罰之法理，懇請撤銷4 萬5,000元的罰款等語。\n三、經查：\n  (一)關於罰鍰部分：\n  1.按汽車駕駛人，駕駛汽車經測試檢定有酒精濃度超過規定標\n    準者，處1 萬5,000 元以上60,000元以下罰鍰，並當場移置\n    保管該汽車及吊扣其駕駛執照1 年。汽車駕駛人有飲用酒類\n    或其他類似物後其吐氣所含酒精濃度超過每公升0.25毫克或\n    血液中酒精濃度超過百分之0.05以上者，不得駕車。道路交\n    通管理處罰條例第35條第1 項第1 款、道路交通安全規則第\n    114 條第2 款分別定有明文。惟依95年2 月5 日施行之行政\n    罰法第26條第1 項規定：「一行為同時觸犯刑事法律及違反\n    行政法上義務規定者，依刑事法律處罰之。但其行為應處以\n    其他種類行政罰或得沒入之物而未經法院宣告沒收者，亦得\n    裁處之。」，此乃一行為同時造成刑罰法律與行政秩序罰規\n    定發生競合適用之關係時，基於「一事不二罰」之法理，經\n    由立法程序確立應以刑罰優先為原則，避免行為人承受過度\n    且重複之處罰。此觀該條立法理由明確揭示：「一行為同時\n    觸犯刑事法律及違反行政法上義務規定時，由於刑罰與行政\n    罰同屬對不法行為之制裁，而刑罰之懲罰作用較強，故依刑\n    事法律處罰，即足資警惕時，實無一事二罰再處行政罰之必\n    要。且刑事法律處罰，由法院依法定程序為之，較符合正當\n    法律程序，應予優先適用。但罰鍰以外之沒入或其他種類行\n    政罰，因兼具維護公共秩序之作用，為達行政目的，行政機\n    關仍得併予裁處，故為第一項但書規定。」，其理益明。是\n    以前揭行政罰法中刑事法律處罰優先且不再處以行政秩序罰\n    之目的，既係因為行為人已接受刑罰而足資警惕，且已發生\n    懲罰之作用，即無使行為人陷於雙重處罰之不利益，則關於\n    刑事法律處罰之範圍自應採取實質認定，凡刑事實體法或程\n    序法中所規定客觀上剝奪行為人生命、自由、財產權利，主\n    觀上亦因制裁之嚴厲性、痛苦性，其強度足以造成心理強制\n    而間接達成矯正教化目的之處遇手段，皆應納入其中，而不\n    以形式上符合刑法第32條至第34條所定主刑及從刑種類者為\n    限，始與前揭法律規範之意旨相符。\n  2.查異議人於98年5 月29日04時40分許，明知已因服用酒類，\n    控制力及注意力已達不能安全駕駛動力交通工具之程度，詎\n    仍駕駛車牌號碼719-BDM 號重型機車，行駛於林園鄉○○○\n    路，為警攔查，並施以檢測，得知呼氣酒精濃度含量為每公\n    升0.61毫克，而經臺灣高雄地方法院檢察署檢察官以98年度\n    偵字第20617號為緩起訴處分，緩起訴期間為1年，並命異議\n    人向指定之公益團體、地方自治團體或社區提供40小時之義\n    務勞務，上開緩起訴處分期間已於99年8月11 日期滿而未經\n    撤銷等情，亦有臺灣高等法院被告前案紀錄表在卷可稽，則\n    異議人上開違反刑事法律禁止規範之犯罪事實既已明確，僅\n    因檢察官採取緩起訴處分之替代性刑事處遇手段，未將該案\n    逕行起訴或聲請簡易判決處刑，致其後適用之刑事訴訟程序\n    有所區別，然就異議人負有向檢察官指定機構提供一定時數\n    之勞務義務觀察，其如未在上開指定期間內確實履行義務，\n    依刑事訴訟法第253 條之3 第1 項第3 款之規定，異議人將\n    遭受撤銷緩起訴處分之不利益；反之，倘其確實遵守並履行\n    各項緩起訴條件，除非合於刑事訴訟法第260 條所定情形之\n    一，否則異議人即無再就同一案件遭受刑事訴追之虞。從而\n    ，異議人已因上開緩起訴處分而剝奪其人身自由，主觀上前\n    揭義務勞務亦具有強制性、懲罰性，雖不若易科罰金係以支\n    付金錢作為自由刑之替代，惟經由緩起訴處分條件之履行使\n    其免於遭檢察官發動起訴程序，仍具有替代刑罰之效果，廣\n    義而言，應屬前揭所稱之「實質刑事法律處罰」，而有行政\n    罰法第26條第1 項「一事不二罰」規定之適用。是異議人因\n    駕駛人酒精濃度超過規定標準之違規行為，依行政罰法第26\n    條第1 項前段規定，即應依刑事法律處罰之，已無再依上開\n    道路交通處罰條例第35條第1 項第1 款裁處行政罰鍰之餘地\n    。\n  (二)關於吊扣重型機車駕駛執照\n    道路交通管理處罰條例第35條第1 項第1 款所稱「駕駛汽車\n    經測試檢定有酒精濃度超過規定標準之情形，因而肇事致人\n    受傷者，吊扣其駕駛執照2 年」係以行為人飲酒後駕車之行\n    為，造成他人受傷為必要。本件異議人飲酒駕車後，並因此\n    使他人受傷。本件異議人上開交通違規行為，既有「因而肇\n    事致人受傷」之情形，原處分機關僅依舉發通知單之記載而\n    裁處吊扣異議人駕駛執照12個月，於法未合，應依道路交通\n    管理處罰條例第35條第1項第1款及違反道路交通管理事件統\n    一裁罰基準表之規定，裁處異議人吊扣駕駛執照24個月。\n  (三)關於施以道路安全講習部分：\n    原處分機關裁處異議人施以道路安全講習部分，均係為達成\n    遏止酒後駕車之不法行為，維護道路交通用路權人之安全法\n    益等行政目的所必要之罰鍰以外之其他種類行政罰，依行政\n    罰法第26條第1 項但書之規定，原處分機關仍得裁處，並未\n    違反「一事不二罰」之規定，故此部分之裁處並無違誤。\n四、綜上所述，本件異議人於飲酒後駕駛重型機車之行為，違反\n    道路交通管理處罰條例第35條第1 項第1 款規定，依同條例\n    第24條第1 項第2 款及違反道路交通管理事件統一裁罰基準\n    表之規定，應吊扣重型機車駕駛執照24個月及應參加道路交\n    通安全講習。是異議人就罰鍰45,000元部分聲明異議，非無\n    理由。又道路交通管理處罰條例第87條第1 項規定：「受處\n    分人不服第8 條主管機關所為之處罰，得於接到裁決書之翌\n    日起20日內，向管轄地方法院聲明異議。」此條文中所謂之\n    「處罰」，應指包括對受處分人裁處之違規事實是否正當，\n    及裁罰所引用之法條是否適當而言，蓋此二者有不可分離之\n    關係，即聲明異議應以交通違規行為為標的，非以處罰項目\n    為範圍。是本件異議人酒後駕車只有一個交通違規行為，雖\n    異議人僅就處罰項目中之罰鍰部分提起異議，其餘部分（吊\n    扣駕照及應參加道路交通安全講習部分）並未提及，然其餘\n    處罰項目與其交通違規行為是否存在既無從分離，法院自應\n    併予審理，附此敘明。從而，原處分機關裁罰異議人罰鍰45\n    ,000元之處分即有不當，自應將原處分全部撤銷，另為裁定\n    李心琪汽車駕駛人，駕駛汽車經測試酒精濃度超過規定標準\n    ，處吊扣重型機器腳踏車普通駕駛執照貳拾肆個月，且接受\n    道路交通安全講習。\n五、經核原裁定於法並無不合，交通部公路總局高雄區監理所抗\n    告意旨仍執：異議人李心琪於98年5 月29日酒後駕車違規之\n    事實，同時觸犯刑事法律及違反行政法上義務，刑事部分經\n    檢察官緩起訴處分確定，異議人並已依緩起訴處分命令履行\n    義務勞務，然其提供義務勞務之性質與本件處分所為罰鍰、\n    吊扣普通重型機器腳踏車駕駛執照及施以道路交通安全講習\n    之種類不同。抗告人交通部公路總局高雄區監理所於上開緩\n    起訴期滿後，於99年10月12日以高監營裁字第裁80－NO0000\n    000 號裁決書裁處罰鍰新台幣（下同）4 萬5,000 元，自吊\n    扣普通重型機器腳踏車駕駛執照12月，並施以道路安全講習\n    ，應無不合。原裁定將本件處分撤銷，於法尚有未洽等詞；\n    李心琪抗告意旨仍執：異議人即抗告人李心琪於案發當天係\n    因為了救割腕自殺之友人，才會酒後駕車載受傷友人至建佑\n    醫院救治，不料途中又因閃躲一隻流浪狗，才會造成車禍，\n    原審99年度交聲字第3090號裁定吊扣普通重型機器腳踏車駕\n    駛執照24個月，期間過長，請求改定為12個月等詞，指摘原\n    裁定不當，難認有理由，均應駁回。\n據上論斷，應依道路交通案件處理辦法第26條，刑事訴訟法第41\n2 條，裁定如主文。"
  },
  "search": "臺灣高等法院高雄分院刑事裁定99年度交抗字第622號抗告人即原處分機關交通部公路總局高雄區監理所代表人劉育麟抗告人即異議人即受處分人李心琪上列抗告人因受處分人違反道路交通管理處罰條例，聲明異議案件，不服臺灣高雄地方法院中華民國99年11月25日裁定（99年度交聲字第3090號），提起抗告，本院裁定如下：主文抗告駁回。理由一、原處分意旨略以：異議人即受處分人李心琪於民國98年5月29日04時40分許，明知已因服用酒類，控制力及注意力已達不能安全駕駛動力交通工具之程度，詎仍駕駛車牌號碼719-BDM號重型機車，行駛於林園鄉○○○路，為警攔查，並施以檢測，得知呼氣酒精濃度含量為每公升0.61毫克，而有「汽車駕駛人酒精濃度超過規定標準（每公升0.25至0.4毫克）」之違規，依道路交通管理處罰條例第35條第1項第1款規定，裁處罰鍰新臺幣（下同）4萬5,000元，吊扣駕照12個月，並應參加道路交通安全講習等語。二、異議意旨略以：異議人於前揭時、地酒駕違規，業經檢察官以緩起訴判處40小時之義務勞動服務，如今又處以罰鍰，違反一事不二罰之法理，懇請撤銷4萬5,000元的罰款等語。三、經查：(一)關於罰鍰部分：1.按汽車駕駛人，駕駛汽車經測試檢定有酒精濃度超過規定標準者，處1萬5,000元以上60,000元以下罰鍰，並當場移置保管該汽車及吊扣其駕駛執照1年。汽車駕駛人有飲用酒類或其他類似物後其吐氣所含酒精濃度超過每公升0.25毫克或血液中酒精濃度超過百分之0.05以上者，不得駕車。道路交通管理處罰條例第35條第1項第1款、道路交通安全規則第114條第2款分別定有明文。惟依95年2月5日施行之行政罰法第26條第1項規定：「一行為同時觸犯刑事法律及違反行政法上義務規定者，依刑事法律處罰之。但其行為應處以其他種類行政罰或得沒入之物而未經法院宣告沒收者，亦得裁處之。」，此乃一行為同時造成刑罰法律與行政秩序罰規定發生競合適用之關係時，基於「一事不二罰」之法理，經由立法程序確立應以刑罰優先為原則，避免行為人承受過度且重複之處罰。此觀該條立法理由明確揭示：「一行為同時觸犯刑事法律及違反行政法上義務規定時，由於刑罰與行政罰同屬對不法行為之制裁，而刑罰之懲罰作用較強，故依刑事法律處罰，即足資警惕時，實無一事二罰再處行政罰之必要。且刑事法律處罰，由法院依法定程序為之，較符合正當法律程序，應予優先適用。但罰鍰以外之沒入或其他種類行政罰，因兼具維護公共秩序之作用，為達行政目的，行政機關仍得併予裁處，故為第一項但書規定。」，其理益明。是以前揭行政罰法中刑事法律處罰優先且不再處以行政秩序罰之目的，既係因為行為人已接受刑罰而足資警惕，且已發生懲罰之作用，即無使行為人陷於雙重處罰之不利益，則關於刑事法律處罰之範圍自應採取實質認定，凡刑事實體法或程序法中所規定客觀上剝奪行為人生命、自由、財產權利，主觀上亦因制裁之嚴厲性、痛苦性，其強度足以造成心理強制而間接達成矯正教化目的之處遇手段，皆應納入其中，而不以形式上符合刑法第32條至第34條所定主刑及從刑種類者為限，始與前揭法律規範之意旨相符。2.查異議人於98年5月29日04時40分許，明知已因服用酒類，控制力及注意力已達不能安全駕駛動力交通工具之程度，詎仍駕駛車牌號碼719-BDM號重型機車，行駛於林園鄉○○○路，為警攔查，並施以檢測，得知呼氣酒精濃度含量為每公升0.61毫克，而經臺灣高雄地方法院檢察署檢察官以98年度偵字第20617號為緩起訴處分，緩起訴期間為1年，並命異議人向指定之公益團體、地方自治團體或社區提供40小時之義務勞務，上開緩起訴處分期間已於99年8月11日期滿而未經撤銷等情，亦有臺灣高等法院被告前案紀錄表在卷可稽，則異議人上開違反刑事法律禁止規範之犯罪事實既已明確，僅因檢察官採取緩起訴處分之替代性刑事處遇手段，未將該案逕行起訴或聲請簡易判決處刑，致其後適用之刑事訴訟程序有所區別，然就異議人負有向檢察官指定機構提供一定時數之勞務義務觀察，其如未在上開指定期間內確實履行義務，依刑事訴訟法第253條之3第1項第3款之規定，異議人將遭受撤銷緩起訴處分之不利益；反之，倘其確實遵守並履行各項緩起訴條件，除非合於刑事訴訟法第260條所定情形之一，否則異議人即無再就同一案件遭受刑事訴追之虞。從而，異議人已因上開緩起訴處分而剝奪其人身自由，主觀上前揭義務勞務亦具有強制性、懲罰性，雖不若易科罰金係以支付金錢作為自由刑之替代，惟經由緩起訴處分條件之履行使其免於遭檢察官發動起訴程序，仍具有替代刑罰之效果，廣義而言，應屬前揭所稱之「實質刑事法律處罰」，而有行政罰法第26條第1項「一事不二罰」規定之適用。是異議人因駕駛人酒精濃度超過規定標準之違規行為，依行政罰法第26條第1項前段規定，即應依刑事法律處罰之，已無再依上開道路交通處罰條例第35條第1項第1款裁處行政罰鍰之餘地。(二)關於吊扣重型機車駕駛執照道路交通管理處罰條例第35條第1項第1款所稱「駕駛汽車經測試檢定有酒精濃度超過規定標準之情形，因而肇事致人受傷者，吊扣其駕駛執照2年」係以行為人飲酒後駕車之行為，造成他人受傷為必要。本件異議人飲酒駕車後，並因此使他人受傷。本件異議人上開交通違規行為，既有「因而肇事致人受傷」之情形，原處分機關僅依舉發通知單之記載而裁處吊扣異議人駕駛執照12個月，於法未合，應依道路交通管理處罰條例第35條第1項第1款及違反道路交通管理事件統一裁罰基準表之規定，裁處異議人吊扣駕駛執照24個月。(三)關於施以道路安全講習部分：原處分機關裁處異議人施以道路安全講習部分，均係為達成遏止酒後駕車之不法行為，維護道路交通用路權人之安全法益等行政目的所必要之罰鍰以外之其他種類行政罰，依行政罰法第26條第1項但書之規定，原處分機關仍得裁處，並未違反「一事不二罰」之規定，故此部分之裁處並無違誤。四、綜上所述，本件異議人於飲酒後駕駛重型機車之行為，違反道路交通管理處罰條例第35條第1項第1款規定，依同條例第24條第1項第2款及違反道路交通管理事件統一裁罰基準表之規定，應吊扣重型機車駕駛執照24個月及應參加道路交通安全講習。是異議人就罰鍰45,000元部分聲明異議，非無理由。又道路交通管理處罰條例第87條第1項規定：「受處分人不服第8條主管機關所為之處罰，得於接到裁決書之翌日起20日內，向管轄地方法院聲明異議。」此條文中所謂之「處罰」，應指包括對受處分人裁處之違規事實是否正當，及裁罰所引用之法條是否適當而言，蓋此二者有不可分離之關係，即聲明異議應以交通違規行為為標的，非以處罰項目為範圍。是本件異議人酒後駕車只有一個交通違規行為，雖異議人僅就處罰項目中之罰鍰部分提起異議，其餘部分（吊扣駕照及應參加道路交通安全講習部分）並未提及，然其餘處罰項目與其交通違規行為是否存在既無從分離，法院自應併予審理，附此敘明。從而，原處分機關裁罰異議人罰鍰45,000元之處分即有不當，自應將原處分全部撤銷，另為裁定李心琪汽車駕駛人，駕駛汽車經測試酒精濃度超過規定標準，處吊扣重型機器腳踏車普通駕駛執照貳拾肆個月，且接受道路交通安全講習。五、經核原裁定於法並無不合，交通部公路總局高雄區監理所抗告意旨仍執：異議人李心琪於98年5月29日酒後駕車違規之事實，同時觸犯刑事法律及違反行政法上義務，刑事部分經檢察官緩起訴處分確定，異議人並已依緩起訴處分命令履行義務勞務，然其提供義務勞務之性質與本件處分所為罰鍰、吊扣普通重型機器腳踏車駕駛執照及施以道路交通安全講習之種類不同。抗告人交通部公路總局高雄區監理所於上開緩起訴期滿後，於99年10月12日以高監營裁字第裁80－NO0000000號裁決書裁處罰鍰新台幣（下同）4萬5,000元，自吊扣普通重型機器腳踏車駕駛執照12月，並施以道路安全講習，應無不合。原裁定將本件處分撤銷，於法尚有未洽等詞；李心琪抗告意旨仍執：異議人即抗告人李心琪於案發當天係因為了救割腕自殺之友人，才會酒後駕車載受傷友人至建佑醫院救治，不料途中又因閃躲一隻流浪狗，才會造成車禍，原審99年度交聲字第3090號裁定吊扣普通重型機器腳踏車駕駛執照24個月，期間過長，請求改定為12個月等詞，指摘原裁定不當，難認有理由，均應駁回。據上論斷，應依道路交通案件處理辦法第26條，刑事訴訟法第412條，裁定如主文。中華民國100年1月6日刑事第七庭審判長法官莊飛宗法官蔡廣昇法官謝宏宗以上正本證明與原本無異。本裁定不得再抗告。中華民國100年1月7日書記官蘇恒仁",
  "characters": {
    "judges": [
      "莊飛宗",
      "蔡廣昇",
      "謝宏宗"
    ],
    "prosecutors": [

    ],
    "lawyers": [

    ],
    "clerks": [

    ],
    "plaintiffs": [

    ],
    "defendants": [

    ],
    "prosecutor_office": [

    ],
    "creditors": [

    ],
    "debtors": [

    ],
    "judicial_associate_officer": [

    ]
  },
  "adjudged_at": "2011-01-06",
  "created_at": "2016-02-13 04:25:04",
  "updated_at": "2016-02-13 04:25:04"
}