{
  "identify": "KSD-100-司聲-542-20110624-1",
  "court": {
    "name": "臺灣高雄地方法院",
    "code": "KSD"
  },
  "division": {
    "name": "民事",
    "code": "V"
  },
  "year": 100,
  "word": "司聲",
  "number": "542",
  "jcheck": "1",
  "reason": "變換提存物",
  "content": "臺灣高雄地方法院民事裁定            100年度司聲字第542號\n聲  請  人  高雄縣美濃鎮農會\n法定代理人  林華玉\n相  對  人  宋爍清\n上列當事人間聲請變換提存物事件，本院裁定如下：\n    主  文\n本院民國九十九年度存字第一○二○號提存事件，聲請人所提存\n之合作金庫銀行可轉讓定期存單面額新台幣壹佰萬元壹張（編號\n：Ｊ0000000) 、壹拾萬元參張（編號：Ｇ000000\n0、Ｇ0000000、Ｇ0000000），及現金肆萬元，\n共計壹佰參拾肆萬元，准予變換提存為同額之壹年期合作金庫銀\n行無記名可轉讓定期存單。\n    理  由\n一、按供擔保之提存物或保證書，除得由當事人約定變換外，法\n    院得依供擔保人之聲請，以裁定許其變換，民事訴訟法第10\n    5 條第1 項定有明文。\n二、本件聲請人主張：聲請人前遵本院91年度全字第6931號民事\n    裁定，為擔保相對人因假扣押所受損害，並依據本院99年度\n    司聲字第189號民事裁定准予變換提存物，曾提供如主文所\n    示之定期存單及現金為擔保，以本院99年度存字第1020號提\n    存事件提存在案。茲因上開定期存單已經到期，爰聲請變換\n    提存物等語。\n三、經查聲請人主張之前揭事實，業據其提出本院99年度存字第\n    1020號提存書影本為證，並經本院依職權調取上開提存卷宗\n    核閱無誤。是以，聲請人聲請變換提存物，核無不合，應予\n    准許。\n四、依民事訴訟法第105 條第1 項，裁定如主文。\n五、如不服本裁定，應於送達後10日內，以書狀向本院司法事務\n    官提出異議。\n中    華    民    國   100    年    6     月    24    日\n                    民事庭司法事務官  黃思瑜",
  "structure": {
    "main": "本院民國九十九年度存字第一○二○號提存事件，聲請人所提存\n之合作金庫銀行可轉讓定期存單面額新台幣壹佰萬元壹張（編號\n：Ｊ0000000) 、壹拾萬元參張（編號：Ｇ000000\n0、Ｇ0000000、Ｇ0000000），及現金肆萬元，\n共計壹佰參拾肆萬元，准予變換提存為同額之壹年期合作金庫銀\n行無記名可轉讓定期存單。",
    "reason": "一、按供擔保之提存物或保證書，除得由當事人約定變換外，法\n    院得依供擔保人之聲請，以裁定許其變換，民事訴訟法第10\n    5 條第1 項定有明文。\n二、本件聲請人主張：聲請人前遵本院91年度全字第6931號民事\n    裁定，為擔保相對人因假扣押所受損害，並依據本院99年度\n    司聲字第189號民事裁定准予變換提存物，曾提供如主文所\n    示之定期存單及現金為擔保，以本院99年度存字第1020號提\n    存事件提存在案。茲因上開定期存單已經到期，爰聲請變換\n    提存物等語。\n三、經查聲請人主張之前揭事實，業據其提出本院99年度存字第\n    1020號提存書影本為證，並經本院依職權調取上開提存卷宗\n    核閱無誤。是以，聲請人聲請變換提存物，核無不合，應予\n    准許。\n四、依民事訴訟法第105 條第1 項，裁定如主文。\n五、如不服本裁定，應於送達後10日內，以書狀向本院司法事務\n    官提出異議。"
  },
  "search": "臺灣高雄地方法院民事裁定100年度司聲字第542號聲請人高雄縣美濃鎮農會法定代理人林華玉相對人宋爍清上列當事人間聲請變換提存物事件，本院裁定如下：主文本院民國九十九年度存字第一○二○號提存事件，聲請人所提存之合作金庫銀行可轉讓定期存單面額新台幣壹佰萬元壹張（編號：Ｊ0000000)、壹拾萬元參張（編號：Ｇ0000000、Ｇ0000000、Ｇ0000000），及現金肆萬元，共計壹佰參拾肆萬元，准予變換提存為同額之壹年期合作金庫銀行無記名可轉讓定期存單。理由一、按供擔保之提存物或保證書，除得由當事人約定變換外，法院得依供擔保人之聲請，以裁定許其變換，民事訴訟法第105條第1項定有明文。二、本件聲請人主張：聲請人前遵本院91年度全字第6931號民事裁定，為擔保相對人因假扣押所受損害，並依據本院99年度司聲字第189號民事裁定准予變換提存物，曾提供如主文所示之定期存單及現金為擔保，以本院99年度存字第1020號提存事件提存在案。茲因上開定期存單已經到期，爰聲請變換提存物等語。三、經查聲請人主張之前揭事實，業據其提出本院99年度存字第1020號提存書影本為證，並經本院依職權調取上開提存卷宗核閱無誤。是以，聲請人聲請變換提存物，核無不合，應予准許。四、依民事訴訟法第105條第1項，裁定如主文。五、如不服本裁定，應於送達後10日內，以書狀向本院司法事務官提出異議。中華民國100年6月24日民事庭司法事務官黃思瑜",
  "characters": {
    "judges": [

    ],
    "prosecutors": [

    ],
    "lawyers": [

    ],
    "clerks": [

    ],
    "plaintiffs": [

    ],
    "defendants": [

    ],
    "prosecutor_office": [
      "高雄縣美濃鎮農會"
    ],
    "creditors": [

    ],
    "debtors": [

    ],
    "judicial_associate_officer": [
      "黃思瑜"
    ]
  },
  "adjudged_at": "2011-06-24",
  "created_at": "2016-02-13 16:36:26",
  "updated_at": "2016-02-13 16:36:26"
}