{
  "identify": "KLD-100-消債清-4-20110221-1",
  "court": {
    "name": "臺灣基隆地方法院",
    "code": "KLD"
  },
  "division": {
    "name": "民事",
    "code": "V"
  },
  "year": 100,
  "word": "消債清",
  "number": "4",
  "jcheck": "1",
  "reason": "聲請清算",
  "content": "臺灣基隆地方法院民事裁定            100年度消債清字第4號\n債  務  人  李秋君\n代  理  人  游蕙菁律師\n上列債務人因消費者債務清理事件聲請清算，本院裁定如下：\n    主  文\n債務人李秋君自中華民國一○○年二月二十一日中午十二時起開\n始清算程序，並同時終止清算程序。\n    理  由\n一、按法院開始清算程序之裁定，應載明其年、月、日、時，並\n    即時發生效力；債務人之財產不敷清償清算程序之費用時，\n    法院應裁定開始清算程序，並同時終止清算程序，消費者債\n    務清理條例（以下簡稱本條例）第83條第1項、第85條第1項\n    分別定有明文。\n二、經查：\n  (一)本件債務人聲請更生，前雖經本院以97年度消債更字第79號\n    裁定開始更生程序，惟債務人於民國99年11月25日所提出每\n    月為1期，第1期至第24期每期清償新臺幣（下同） 4,500元\n    ，第25期至第96期每期清償 6,000元之更生方案，未能依本\n    條例第60條規定獲得債權人會議之可決。\n  (二)債務人自陳其現於建築工地擔任臨時工，薪資為每日 800元\n    ，每月工作天數為20日，每月收入為16,000元，以債務人每\n    月收入扣除其個人之必要生活費用 9,829元（依行政院所公\n    告98年度臺灣省低收入戶最低生活費用每人每月 9,829元計\n    算）、勞工保險費每月800元、健保費每月550元等支出後，\n    僅有餘額 4,821元，顯已無法負擔債務人所提上開更生方案\n    第 2階段之還款金額，顯見債務人所提之更生方案有本條例\n    第63條第1項第8款所定更生方案無履行可能性之情形，法院\n    自不應認可。\n  (三)又債務人名下並無任何可供換價之動產及不動產，有稅務電\n    子閘門財產所得調件明細表可稽（見本院98年度執消債更字\n    第56號卷一第125、126頁），堪認債務人之財產應不敷清償\n    清算程序之費用。\n三、綜上所述，本件債務人所提之更生方案既未能依本條例第59\n    條、第60條規定經債權人會議可決，復有本條例第63條第 1\n    項第8款情形，依本條例第64條第2項第 2款規定，本院即不\n    得依職權以裁定認可更生方案，應依本條例第61條規定，以\n    裁定開始清算程序，且因債務人之財產不敷清償清算程序之\n    費用，並裁定同時終止清算程序。\n四、又本件裁定終止清算程序後，債務人所負之債務並非當然免\n    除，應由本院審酌消費者債務清理條例第132條至第135條等\n    規定，依職權認定是否裁定免責，故本院如未為債務人免責\n    之裁定，債務人就其所負債務仍應負清償之責，併予敘明。\n五、依消費者債務清理條例第61條、第85條第 1項，裁定如主文\n    。\n中    華    民    國   100    年    2     月    21    日\n                  民事庭法  官  陳湘琳\n以上正本係照原本作成。\n開始清算程序之裁定不得抗告，如不服同時終止清算程序之裁定\n，應於裁定送達後10日內，以書狀向本院提出抗告，並繳納抗告\n費新臺幣1,000元。\n中    華    民    國   100    年    2     月    21    日\n                        書記官  洪佳如",
  "structure": {
    "main": "債務人李秋君自中華民國一○○年二月二十一日中午十二時起開\n始清算程序，並同時終止清算程序。",
    "reason": "一、按法院開始清算程序之裁定，應載明其年、月、日、時，並\n    即時發生效力；債務人之財產不敷清償清算程序之費用時，\n    法院應裁定開始清算程序，並同時終止清算程序，消費者債\n    務清理條例（以下簡稱本條例）第83條第1項、第85條第1項\n    分別定有明文。\n二、經查：\n  (一)本件債務人聲請更生，前雖經本院以97年度消債更字第79號\n    裁定開始更生程序，惟債務人於民國99年11月25日所提出每\n    月為1期，第1期至第24期每期清償新臺幣（下同） 4,500元\n    ，第25期至第96期每期清償 6,000元之更生方案，未能依本\n    條例第60條規定獲得債權人會議之可決。\n  (二)債務人自陳其現於建築工地擔任臨時工，薪資為每日 800元\n    ，每月工作天數為20日，每月收入為16,000元，以債務人每\n    月收入扣除其個人之必要生活費用 9,829元（依行政院所公\n    告98年度臺灣省低收入戶最低生活費用每人每月 9,829元計\n    算）、勞工保險費每月800元、健保費每月550元等支出後，\n    僅有餘額 4,821元，顯已無法負擔債務人所提上開更生方案\n    第 2階段之還款金額，顯見債務人所提之更生方案有本條例\n    第63條第1項第8款所定更生方案無履行可能性之情形，法院\n    自不應認可。\n  (三)又債務人名下並無任何可供換價之動產及不動產，有稅務電\n    子閘門財產所得調件明細表可稽（見本院98年度執消債更字\n    第56號卷一第125、126頁），堪認債務人之財產應不敷清償\n    清算程序之費用。\n三、綜上所述，本件債務人所提之更生方案既未能依本條例第59\n    條、第60條規定經債權人會議可決，復有本條例第63條第 1\n    項第8款情形，依本條例第64條第2項第 2款規定，本院即不\n    得依職權以裁定認可更生方案，應依本條例第61條規定，以\n    裁定開始清算程序，且因債務人之財產不敷清償清算程序之\n    費用，並裁定同時終止清算程序。\n四、又本件裁定終止清算程序後，債務人所負之債務並非當然免\n    除，應由本院審酌消費者債務清理條例第132條至第135條等\n    規定，依職權認定是否裁定免責，故本院如未為債務人免責\n    之裁定，債務人就其所負債務仍應負清償之責，併予敘明。\n五、依消費者債務清理條例第61條、第85條第 1項，裁定如主文\n    。"
  },
  "search": "臺灣基隆地方法院民事裁定100年度消債清字第4號債務人李秋君代理人游蕙菁律師上列債務人因消費者債務清理事件聲請清算，本院裁定如下：主文債務人李秋君自中華民國一○○年二月二十一日中午十二時起開始清算程序，並同時終止清算程序。理由一、按法院開始清算程序之裁定，應載明其年、月、日、時，並即時發生效力；債務人之財產不敷清償清算程序之費用時，法院應裁定開始清算程序，並同時終止清算程序，消費者債務清理條例（以下簡稱本條例）第83條第1項、第85條第1項分別定有明文。二、經查：(一)本件債務人聲請更生，前雖經本院以97年度消債更字第79號裁定開始更生程序，惟債務人於民國99年11月25日所提出每月為1期，第1期至第24期每期清償新臺幣（下同）4,500元，第25期至第96期每期清償6,000元之更生方案，未能依本條例第60條規定獲得債權人會議之可決。(二)債務人自陳其現於建築工地擔任臨時工，薪資為每日800元，每月工作天數為20日，每月收入為16,000元，以債務人每月收入扣除其個人之必要生活費用9,829元（依行政院所公告98年度臺灣省低收入戶最低生活費用每人每月9,829元計算）、勞工保險費每月800元、健保費每月550元等支出後，僅有餘額4,821元，顯已無法負擔債務人所提上開更生方案第2階段之還款金額，顯見債務人所提之更生方案有本條例第63條第1項第8款所定更生方案無履行可能性之情形，法院自不應認可。(三)又債務人名下並無任何可供換價之動產及不動產，有稅務電子閘門財產所得調件明細表可稽（見本院98年度執消債更字第56號卷一第125、126頁），堪認債務人之財產應不敷清償清算程序之費用。三、綜上所述，本件債務人所提之更生方案既未能依本條例第59條、第60條規定經債權人會議可決，復有本條例第63條第1項第8款情形，依本條例第64條第2項第2款規定，本院即不得依職權以裁定認可更生方案，應依本條例第61條規定，以裁定開始清算程序，且因債務人之財產不敷清償清算程序之費用，並裁定同時終止清算程序。四、又本件裁定終止清算程序後，債務人所負之債務並非當然免除，應由本院審酌消費者債務清理條例第132條至第135條等規定，依職權認定是否裁定免責，故本院如未為債務人免責之裁定，債務人就其所負債務仍應負清償之責，併予敘明。五、依消費者債務清理條例第61條、第85條第1項，裁定如主文。中華民國100年2月21日民事庭法官陳湘琳以上正本係照原本作成。開始清算程序之裁定不得抗告，如不服同時終止清算程序之裁定，應於裁定送達後10日內，以書狀向本院提出抗告，並繳納抗告費新臺幣1,000元。中華民國100年2月21日書記官洪佳如",
  "characters": {
    "judges": [
      "陳湘琳"
    ],
    "prosecutors": [

    ],
    "lawyers": [
      "游蕙菁"
    ],
    "clerks": [

    ],
    "plaintiffs": [

    ],
    "defendants": [

    ],
    "prosecutor_office": [

    ],
    "creditors": [

    ],
    "debtors": [
      "李秋君"
    ],
    "judicial_associate_officer": [

    ]
  },
  "adjudged_at": "2011-02-21",
  "created_at": "2016-02-12 06:34:06",
  "updated_at": "2016-02-12 06:34:06"
}