{
  "identify": "TPD-91-聲再-14-20020606-1",
  "court": {
    "name": "臺灣臺北地方法院",
    "code": "TPD"
  },
  "division": {
    "name": "刑事",
    "code": "M"
  },
  "year": 91,
  "word": "聲再",
  "number": "14",
  "jcheck": "1",
  "reason": "聲請再審",
  "content": "臺灣臺北地方法院刑事裁定                          九十一年度聲再字第一四號\n    再審聲請人\n    即受判決人  甲○○\n右列再審聲請人因妨害自由案件，對於本院中華民國九十一年三月十二日第二審確定\n判決（九十年度簡上字第二七六號），聲請再審，本院裁定如左：\n    主  文\n再審之聲請駁回。\n    理  由\n一、聲請再審意旨詳如附件刑事聲請再審狀、刑事聲請抗告狀所載。\n二、按有罪之判決確定後，因發現確實之新證據，足認受有罪判決之人應受無罪、免\n    訴、免刑或輕於原判決所認罪名之判決者，為受判決人之利益，得聲請再審，刑\n    事訴訟法第四百二十條第一項第六款固有明文，惟該款所稱「確實之新證據」，\n    係指就新證據之本身形式上觀察，毋須經調查程序，顯然可認為足以動搖原確定\n    判決者而言；且發現之新證據，須該證據當時已經存在，為法院及當事人所不知\n    ，不及調查斟酌，至其後始行發見者而言，此有最高法院四十年臺抗字第二號判\n    例、八十五年臺抗字第三○八號裁定可資參照。\n三、經查，本件再審聲請人前因妨害自由案件，經本院以九十年度簡上字第二七六號\n    判決確定，有上開刑事卷宗可稽。再審聲請人雖以其未接到臺灣臺北地方法院檢\n    察署檢察官的起訴書、未聽過錄音帶內容、通聯紀錄內容提及和被害人徐義鑫談\n    及祖父母日後生活之照顧原判決未論及此事、未和被害人徐義鑫當庭辯論祖父母\n    內容之情節、松山分局函送之錄音帶數目不同，認符合刑事訴訟法第四百二十條\n    第一項第六款發現確實之新證據之情形，向本院聲請再審。然而，再審聲請人所\n    舉未接到起訴書、松山分局函送之錄音帶數目不同一節，核與本件再審聲請人是\n    否應受無罪、免訴、免刑或輕於原判決所認罪名之判決無關，不足以動搖原確定\n    判決。至於聲請人所舉之錄音帶及通聯紀錄內容，或被害人徐義鑫部分，於前開\n    確定判決偵審程序中，徐義鑫於九十年三月十五日、同年三月二十一日警訊、同\n    年九月三十日檢察官偵訊時，分別出面指證被告涉犯恐嚇罪嫌，並提出錄音帶二\n    捲為證。九十年九月五日原審法官開庭審理時，經檢察官陳述有錄音帶二捲、錄\n    音帶譯文、通聯紀錄及告訴人即被害人徐義鑫證詞為本件之證據方法後，再審聲\n    請人則陳稱對於檢察官提出之證據形式真正不否認一詞，且除請求勘驗錄音帶外\n    ，並陳述無其他之書證、人證為證據方法等語，有該日訊問筆錄可稽。俟經原審\n    法官播放該二捲錄音帶，並製作勘驗內容，於九十一年一月四日庭訊提示並訊問\n    再審聲請人對錄音帶勘驗結果有何意見時，再審聲請人則陳述沒有意見等語，並\n    於原審法官訊問有無其他證據需要調查時，復陳稱沒有等詞，亦有該日訊問筆錄\n    足參。則再審聲請人所舉之錄音帶及通聯紀錄內容、被害人徐義鑫等證據，業經\n    原審於公判庭，提示予再審聲請人辯論，並於判決理由一、二予以斟酌，顯非原\n    審審判當時為法院及當事人所不知，不及調查斟酌，至其後始行發見之「確實之\n    新證據」甚明。揆諸前開裁定意旨，再審聲請人之聲請為無理由，應予駁回。\n據上論斷，應依刑事訴訟法第四百三十四條第一項，裁定如主文。\n中    華    民    國      九十一      年      六      月      六        日\n                                      臺灣臺北地方法院刑事第八庭\n                                          審判長法  官  王淑滿\n                                                法  官  胡宏文\n                                                法  官  鄭佾瑩\n右正本證明與原本無異。\n如不服本裁定應於送達後五日內向本院提出抗告狀\n                                                書記官  何適熹\n中    華    民    國      九十一       年     六      月        七      日\n",
  "structure": {
    "main": "再審之聲請駁回。",
    "reason": "一、聲請再審意旨詳如附件刑事聲請再審狀、刑事聲請抗告狀所載。\n二、按有罪之判決確定後，因發現確實之新證據，足認受有罪判決之人應受無罪、免\n    訴、免刑或輕於原判決所認罪名之判決者，為受判決人之利益，得聲請再審，刑\n    事訴訟法第四百二十條第一項第六款固有明文，惟該款所稱「確實之新證據」，\n    係指就新證據之本身形式上觀察，毋須經調查程序，顯然可認為足以動搖原確定\n    判決者而言；且發現之新證據，須該證據當時已經存在，為法院及當事人所不知\n    ，不及調查斟酌，至其後始行發見者而言，此有最高法院四十年臺抗字第二號判\n    例、八十五年臺抗字第三○八號裁定可資參照。\n三、經查，本件再審聲請人前因妨害自由案件，經本院以九十年度簡上字第二七六號\n    判決確定，有上開刑事卷宗可稽。再審聲請人雖以其未接到臺灣臺北地方法院檢\n    察署檢察官的起訴書、未聽過錄音帶內容、通聯紀錄內容提及和被害人徐義鑫談\n    及祖父母日後生活之照顧原判決未論及此事、未和被害人徐義鑫當庭辯論祖父母\n    內容之情節、松山分局函送之錄音帶數目不同，認符合刑事訴訟法第四百二十條\n    第一項第六款發現確實之新證據之情形，向本院聲請再審。然而，再審聲請人所\n    舉未接到起訴書、松山分局函送之錄音帶數目不同一節，核與本件再審聲請人是\n    否應受無罪、免訴、免刑或輕於原判決所認罪名之判決無關，不足以動搖原確定\n    判決。至於聲請人所舉之錄音帶及通聯紀錄內容，或被害人徐義鑫部分，於前開\n    確定判決偵審程序中，徐義鑫於九十年三月十五日、同年三月二十一日警訊、同\n    年九月三十日檢察官偵訊時，分別出面指證被告涉犯恐嚇罪嫌，並提出錄音帶二\n    捲為證。九十年九月五日原審法官開庭審理時，經檢察官陳述有錄音帶二捲、錄\n    音帶譯文、通聯紀錄及告訴人即被害人徐義鑫證詞為本件之證據方法後，再審聲\n    請人則陳稱對於檢察官提出之證據形式真正不否認一詞，且除請求勘驗錄音帶外\n    ，並陳述無其他之書證、人證為證據方法等語，有該日訊問筆錄可稽。俟經原審\n    法官播放該二捲錄音帶，並製作勘驗內容，於九十一年一月四日庭訊提示並訊問\n    再審聲請人對錄音帶勘驗結果有何意見時，再審聲請人則陳述沒有意見等語，並\n    於原審法官訊問有無其他證據需要調查時，復陳稱沒有等詞，亦有該日訊問筆錄\n    足參。則再審聲請人所舉之錄音帶及通聯紀錄內容、被害人徐義鑫等證據，業經\n    原審於公判庭，提示予再審聲請人辯論，並於判決理由一、二予以斟酌，顯非原\n    審審判當時為法院及當事人所不知，不及調查斟酌，至其後始行發見之「確實之\n    新證據」甚明。揆諸前開裁定意旨，再審聲請人之聲請為無理由，應予駁回。\n據上論斷，應依刑事訴訟法第四百三十四條第一項，裁定如主文。"
  },
  "search": "臺灣臺北地方法院刑事裁定九十一年度聲再字第一四號再審聲請人即受判決人甲○○右列再審聲請人因妨害自由案件，對於本院中華民國九十一年三月十二日第二審確定判決（九十年度簡上字第二七六號），聲請再審，本院裁定如左：主文再審之聲請駁回。理由一、聲請再審意旨詳如附件刑事聲請再審狀、刑事聲請抗告狀所載。二、按有罪之判決確定後，因發現確實之新證據，足認受有罪判決之人應受無罪、免訴、免刑或輕於原判決所認罪名之判決者，為受判決人之利益，得聲請再審，刑事訴訟法第四百二十條第一項第六款固有明文，惟該款所稱「確實之新證據」，係指就新證據之本身形式上觀察，毋須經調查程序，顯然可認為足以動搖原確定判決者而言；且發現之新證據，須該證據當時已經存在，為法院及當事人所不知，不及調查斟酌，至其後始行發見者而言，此有最高法院四十年臺抗字第二號判例、八十五年臺抗字第三○八號裁定可資參照。三、經查，本件再審聲請人前因妨害自由案件，經本院以九十年度簡上字第二七六號判決確定，有上開刑事卷宗可稽。再審聲請人雖以其未接到臺灣臺北地方法院檢察署檢察官的起訴書、未聽過錄音帶內容、通聯紀錄內容提及和被害人徐義鑫談及祖父母日後生活之照顧原判決未論及此事、未和被害人徐義鑫當庭辯論祖父母內容之情節、松山分局函送之錄音帶數目不同，認符合刑事訴訟法第四百二十條第一項第六款發現確實之新證據之情形，向本院聲請再審。然而，再審聲請人所舉未接到起訴書、松山分局函送之錄音帶數目不同一節，核與本件再審聲請人是否應受無罪、免訴、免刑或輕於原判決所認罪名之判決無關，不足以動搖原確定判決。至於聲請人所舉之錄音帶及通聯紀錄內容，或被害人徐義鑫部分，於前開確定判決偵審程序中，徐義鑫於九十年三月十五日、同年三月二十一日警訊、同年九月三十日檢察官偵訊時，分別出面指證被告涉犯恐嚇罪嫌，並提出錄音帶二捲為證。九十年九月五日原審法官開庭審理時，經檢察官陳述有錄音帶二捲、錄音帶譯文、通聯紀錄及告訴人即被害人徐義鑫證詞為本件之證據方法後，再審聲請人則陳稱對於檢察官提出之證據形式真正不否認一詞，且除請求勘驗錄音帶外，並陳述無其他之書證、人證為證據方法等語，有該日訊問筆錄可稽。俟經原審法官播放該二捲錄音帶，並製作勘驗內容，於九十一年一月四日庭訊提示並訊問再審聲請人對錄音帶勘驗結果有何意見時，再審聲請人則陳述沒有意見等語，並於原審法官訊問有無其他證據需要調查時，復陳稱沒有等詞，亦有該日訊問筆錄足參。則再審聲請人所舉之錄音帶及通聯紀錄內容、被害人徐義鑫等證據，業經原審於公判庭，提示予再審聲請人辯論，並於判決理由一、二予以斟酌，顯非原審審判當時為法院及當事人所不知，不及調查斟酌，至其後始行發見之「確實之新證據」甚明。揆諸前開裁定意旨，再審聲請人之聲請為無理由，應予駁回。據上論斷，應依刑事訴訟法第四百三十四條第一項，裁定如主文。中華民國九十一年六月六日臺灣臺北地方法院刑事第八庭審判長法官王淑滿法官胡宏文法官鄭佾瑩右正本證明與原本無異。如不服本裁定應於送達後五日內向本院提出抗告狀書記官何適熹中華民國九十一年六月七日",
  "characters": {
    "judges": [
      "王淑滿",
      "胡宏文",
      "鄭佾瑩"
    ],
    "prosecutors": [

    ],
    "lawyers": [

    ],
    "clerks": [
      "何適熹"
    ],
    "plaintiffs": [

    ],
    "defendants": [

    ],
    "prosecutor_office": [

    ],
    "creditors": [

    ],
    "debtors": [

    ],
    "judicial_associate_officer": [

    ]
  },
  "adjudged_at": "2002-06-06",
  "created_at": "2016-02-05 15:56:21",
  "updated_at": "2016-02-05 15:56:21"
}