{
  "identify": "CYD-100-聲-262-20110419-2",
  "court": {
    "name": "臺灣嘉義地方法院",
    "code": "CYD"
  },
  "division": {
    "name": "刑事",
    "code": "M"
  },
  "year": 100,
  "word": "聲",
  "number": "262",
  "jcheck": "2",
  "reason": "定應執行刑",
  "content": "臺灣嘉義地方法院刑事裁定              100年度聲字第262號\n聲  請  人  臺灣嘉義地方法院檢察署檢察官\n抗  告  人\n即受 刑 人  張祖豫\n上列抗告人因定應執行刑案件，不服本院中華民國100年3月11日\n裁定（臺灣嘉義地方法院檢察署100年度執字第573號）提起抗告\n，本院更正裁定如下：\n    主  文\n原裁定撤銷。\n張祖豫所犯附表（一）、（三）、（四）所示之罪，所處有期徒\n刑部分，應執行有期徒刑拾壹月，如易科罰金，以新臺幣壹仟元\n折算壹日。\n其他聲請駁回\n    理  由\n一、抗告人即受刑人張祖豫抗告意旨略以：本件附表編號（二）\n    所示之罪，業經臺灣桃園地方法院前於民國100年2月24日，\n    以100年度聲字第497號與另案裁定應執行刑在案，本件有重\n    複裁定之誤等語。\n二、按「當事人對於法院之裁定有不服者，除有特別規定外，得\n    抗告於直接上級法院」、「原審法院認為抗告有理由者，應\n    更正其裁定」，刑事訴訟法第403條第1項及第408條第2項前\n    段分別定有明文。又按數罪併罰，有2裁判以上者，依刑法\n    第51條之規定，定其應執行之刑；宣告多數有期徒刑者，於\n    各刑中之最長期以上，各刑合併之刑期以下定其刑期，但不\n    得逾30年。同法第53條、第51條第5款分別定有明文。\n三、原聲請意旨略以：受刑人因附表編號（一）至（四）所示之\n    違反毒品危害防制條例等案件，先後經法院判決確定，應依\n    刑法第53條、第51條第5款規定定其應執行之刑，爰依刑事\n    訴訟法第477條第1項聲請裁定等語。\n四、經查，本件受刑人前因犯附表編號（一）所示之罪，經法院\n    判刑確定，而受刑人於前揭判決確定前，另犯附表編號（三\n    ）、（四）所示之罪，亦經本院判刑確定，均詳如附表所載\n    ，且有各該判決書及臺灣高等法院被告前案紀錄表附卷可稽\n    。而本院為上開犯罪事實最後判決之法院，茲由臺灣嘉義地\n    方法院檢察署檢察官聲請就受刑人上開所判處之徒刑部分定\n    其應執行之刑，本院審核各有關案卷判決後認聲請為正當，\n    應定其應執行之刑。此外，原確定判決中關於沒收部分，不\n    在本件定應執行刑之列，應合併執行，併此敘明。\n五、至附表編號（二）所示之罪，業經臺灣桃園地方法院前於10\n    0年2月24日，以100年度聲字第497號與另案裁定應執行刑，\n    並於100年4月6日確定在案，有該裁定書及臺灣高等法院被\n    告前案紀錄表存卷可查，堪認無誤，聲請人就此部分重複聲\n    請裁定，於法未合，自應予以駁回。本院審核上情，認為抗\n    告有理由，而原裁定逕將附表所示之4罪合併定應執行刑，\n    尚有違誤，揆諸前揭規定，應將原裁定撤銷，並更正如主文\n    第2、3項所示。\n據上論斷，應依刑事訴訟法第408條第2項、第477條第1項、第22\n0條，刑法第53條、第51條第5款、第41條第1項前段、第8項，裁\n定如主文。\n中    華    民    國   100    年    4     月    19    日\n                  刑事第四庭    法  官  吳育霖\n上列正本證明與原本無異。\n如不服本裁定，應於裁定送達後5日內向本院提出抗告狀（應附\n繕本）。\n中    華    民    國   100    年    4     月    19    日\n                                書記官  陳俊男\n附表：\n（一）因於99年6月13日，犯毒品危害防制條例第10條第2項之施\n      用第二級毒品罪，經臺灣桃園地方法院以99年度壢簡字第\n      1739號判決判處有期徒刑3月，如易科罰金，以新臺幣1,0\n      00元折算1日，於99年8月30日確定。\n（二）因於99年4月16日，犯毒品危害防制條例第10條第2項之施\n      用第二級毒品罪，經臺灣桃園地方法院以99年度壢簡字第\n      1515號判決判處有期徒刑5月，如易科罰金，以新臺幣1,0\n      00元折算1日，於99年11月1日確定。\n（三）因於99年6月28日，犯毒品危害防制條例第10條第2項之施\n      用第二級毒品罪，經本院以99年度嘉簡字第1790號判決判\n      處有期徒刑5月，如易科罰金，以新臺幣1,000元折算1日\n      ，於100年1月17日確定。\n（四）因於99年7月14日，犯毒品危害防制條例第10條第2項之施\n      用第二級毒品罪，經本院以99年度嘉簡字第1790號判決判\n      處有期徒刑5月，如易科罰金，以新臺幣1,000元折算1日\n      ，於100年1月17日確定。（以上2罪並經該判決定應執行\n      有期徒刑9月，如易科罰金，以新臺幣1,000元折算1日確\n      定）\n（以下空白）",
  "structure": {
    "main": "原裁定撤銷。\n張祖豫所犯附表（一）、（三）、（四）所示之罪，所處有期徒\n刑部分，應執行有期徒刑拾壹月，如易科罰金，以新臺幣壹仟元\n折算壹日。\n其他聲請駁回",
    "reason": "一、抗告人即受刑人張祖豫抗告意旨略以：本件附表編號（二）\n    所示之罪，業經臺灣桃園地方法院前於民國100年2月24日，\n    以100年度聲字第497號與另案裁定應執行刑在案，本件有重\n    複裁定之誤等語。\n二、按「當事人對於法院之裁定有不服者，除有特別規定外，得\n    抗告於直接上級法院」、「原審法院認為抗告有理由者，應\n    更正其裁定」，刑事訴訟法第403條第1項及第408條第2項前\n    段分別定有明文。又按數罪併罰，有2裁判以上者，依刑法\n    第51條之規定，定其應執行之刑；宣告多數有期徒刑者，於\n    各刑中之最長期以上，各刑合併之刑期以下定其刑期，但不\n    得逾30年。同法第53條、第51條第5款分別定有明文。\n三、原聲請意旨略以：受刑人因附表編號（一）至（四）所示之\n    違反毒品危害防制條例等案件，先後經法院判決確定，應依\n    刑法第53條、第51條第5款規定定其應執行之刑，爰依刑事\n    訴訟法第477條第1項聲請裁定等語。\n四、經查，本件受刑人前因犯附表編號（一）所示之罪，經法院\n    判刑確定，而受刑人於前揭判決確定前，另犯附表編號（三\n    ）、（四）所示之罪，亦經本院判刑確定，均詳如附表所載\n    ，且有各該判決書及臺灣高等法院被告前案紀錄表附卷可稽\n    。而本院為上開犯罪事實最後判決之法院，茲由臺灣嘉義地\n    方法院檢察署檢察官聲請就受刑人上開所判處之徒刑部分定\n    其應執行之刑，本院審核各有關案卷判決後認聲請為正當，\n    應定其應執行之刑。此外，原確定判決中關於沒收部分，不\n    在本件定應執行刑之列，應合併執行，併此敘明。\n五、至附表編號（二）所示之罪，業經臺灣桃園地方法院前於10\n    0年2月24日，以100年度聲字第497號與另案裁定應執行刑，\n    並於100年4月6日確定在案，有該裁定書及臺灣高等法院被\n    告前案紀錄表存卷可查，堪認無誤，聲請人就此部分重複聲\n    請裁定，於法未合，自應予以駁回。本院審核上情，認為抗\n    告有理由，而原裁定逕將附表所示之4罪合併定應執行刑，\n    尚有違誤，揆諸前揭規定，應將原裁定撤銷，並更正如主文\n    第2、3項所示。\n據上論斷，應依刑事訴訟法第408條第2項、第477條第1項、第22\n0條，刑法第53條、第51條第5款、第41條第1項前段、第8項，裁\n定如主文。"
  },
  "search": "臺灣嘉義地方法院刑事裁定100年度聲字第262號聲請人臺灣嘉義地方法院檢察署檢察官抗告人即受刑人張祖豫上列抗告人因定應執行刑案件，不服本院中華民國100年3月11日裁定（臺灣嘉義地方法院檢察署100年度執字第573號）提起抗告，本院更正裁定如下：主文原裁定撤銷。張祖豫所犯附表（一）、（三）、（四）所示之罪，所處有期徒刑部分，應執行有期徒刑拾壹月，如易科罰金，以新臺幣壹仟元折算壹日。其他聲請駁回理由一、抗告人即受刑人張祖豫抗告意旨略以：本件附表編號（二）所示之罪，業經臺灣桃園地方法院前於民國100年2月24日，以100年度聲字第497號與另案裁定應執行刑在案，本件有重複裁定之誤等語。二、按「當事人對於法院之裁定有不服者，除有特別規定外，得抗告於直接上級法院」、「原審法院認為抗告有理由者，應更正其裁定」，刑事訴訟法第403條第1項及第408條第2項前段分別定有明文。又按數罪併罰，有2裁判以上者，依刑法第51條之規定，定其應執行之刑；宣告多數有期徒刑者，於各刑中之最長期以上，各刑合併之刑期以下定其刑期，但不得逾30年。同法第53條、第51條第5款分別定有明文。三、原聲請意旨略以：受刑人因附表編號（一）至（四）所示之違反毒品危害防制條例等案件，先後經法院判決確定，應依刑法第53條、第51條第5款規定定其應執行之刑，爰依刑事訴訟法第477條第1項聲請裁定等語。四、經查，本件受刑人前因犯附表編號（一）所示之罪，經法院判刑確定，而受刑人於前揭判決確定前，另犯附表編號（三）、（四）所示之罪，亦經本院判刑確定，均詳如附表所載，且有各該判決書及臺灣高等法院被告前案紀錄表附卷可稽。而本院為上開犯罪事實最後判決之法院，茲由臺灣嘉義地方法院檢察署檢察官聲請就受刑人上開所判處之徒刑部分定其應執行之刑，本院審核各有關案卷判決後認聲請為正當，應定其應執行之刑。此外，原確定判決中關於沒收部分，不在本件定應執行刑之列，應合併執行，併此敘明。五、至附表編號（二）所示之罪，業經臺灣桃園地方法院前於100年2月24日，以100年度聲字第497號與另案裁定應執行刑，並於100年4月6日確定在案，有該裁定書及臺灣高等法院被告前案紀錄表存卷可查，堪認無誤，聲請人就此部分重複聲請裁定，於法未合，自應予以駁回。本院審核上情，認為抗告有理由，而原裁定逕將附表所示之4罪合併定應執行刑，尚有違誤，揆諸前揭規定，應將原裁定撤銷，並更正如主文第2、3項所示。據上論斷，應依刑事訴訟法第408條第2項、第477條第1項、第220條，刑法第53條、第51條第5款、第41條第1項前段、第8項，裁定如主文。中華民國100年4月19日刑事第四庭法官吳育霖上列正本證明與原本無異。如不服本裁定，應於裁定送達後5日內向本院提出抗告狀（應附繕本）。中華民國100年4月19日書記官陳俊男附表：（一）因於99年6月13日，犯毒品危害防制條例第10條第2項之施用第二級毒品罪，經臺灣桃園地方法院以99年度壢簡字第1739號判決判處有期徒刑3月，如易科罰金，以新臺幣1,000元折算1日，於99年8月30日確定。（二）因於99年4月16日，犯毒品危害防制條例第10條第2項之施用第二級毒品罪，經臺灣桃園地方法院以99年度壢簡字第1515號判決判處有期徒刑5月，如易科罰金，以新臺幣1,000元折算1日，於99年11月1日確定。（三）因於99年6月28日，犯毒品危害防制條例第10條第2項之施用第二級毒品罪，經本院以99年度嘉簡字第1790號判決判處有期徒刑5月，如易科罰金，以新臺幣1,000元折算1日，於100年1月17日確定。（四）因於99年7月14日，犯毒品危害防制條例第10條第2項之施用第二級毒品罪，經本院以99年度嘉簡字第1790號判決判處有期徒刑5月，如易科罰金，以新臺幣1,000元折算1日，於100年1月17日確定。（以上2罪並經該判決定應執行有期徒刑9月，如易科罰金，以新臺幣1,000元折算1日確定）（以下空白）",
  "characters": {
    "judges": [
      "吳育霖"
    ],
    "prosecutors": [

    ],
    "lawyers": [

    ],
    "clerks": [
      "陳俊男"
    ],
    "plaintiffs": [

    ],
    "defendants": [

    ],
    "prosecutor_office": [
      "臺灣嘉義地方法院檢察署檢察官"
    ],
    "creditors": [

    ],
    "debtors": [

    ],
    "judicial_associate_officer": [

    ]
  },
  "adjudged_at": "2011-04-19",
  "created_at": "2016-02-12 11:22:08",
  "updated_at": "2016-02-12 11:22:08"
}