{
  "identify": "CHD-98-簡上-152-20111025-2",
  "court": {
    "name": "臺灣彰化地方法院",
    "code": "CHD"
  },
  "division": {
    "name": "民事",
    "code": "V"
  },
  "year": 98,
  "word": "簡上",
  "number": "152",
  "jcheck": "2",
  "reason": "分割共有物",
  "content": "臺灣彰化地方法院民事判決  98年度簡上字第152號\n上  訴  人  游禎賜\n訴訟代理人  游祥棵\n上  訴  人  游禎翹\n            游禎達\n上三人共同\n訴訟代理人  胡宗智律師\n複代理人    邱寶弘律師\n上  訴  人  高志誠（即賴彥佑之承當訴訟人）\n訴訟代理人  徐秋秀\n視同上訴人  游祥顯\n                      巷8弄5號\n視同上訴人  游美\n                      巷16弄14號\n上訴人兼上\n二人共同\n訴訟代理人  游祥啟\n                      巷8弄5號\n視同上訴人  游祥湧\n                      2弄23號\n視同上訴人  林游美津\n上訴人兼上\n二人共同\n訴訟代理人  游祥源\n                      巷16弄14號\n視同上訴人  郭惠研\n被上訴人    楊金勝\n訴訟參加人  彰化縣員林鎮農會\n法定代理人  張永府\n訴訟代理人  蕭志雄\n上列當事人間請求分割共有物事件，上訴人對於民國98年11月3\n日本院員林簡易庭第一審判決（98年度員簡字第43號），提起上\n訴，本院於民國100年10月11日言詞辯論終結，判決如下：\n    主      文\n原判決廢棄。\n兩造共有坐落彰化縣員林鎮○○段第110號、地目田、面積21,23\n6平方公尺土地，其分割方法為如附圖一（即彰化縣員林地政事\n務所收件日期文號民國100年7月28日第1354號土地複丈成果圖）\n所示：編號Ａ、Ｂ、Ｃ部分面積依序為3106.95、3445.45、999.\n13平方公尺分歸被上訴人楊金勝及視同上訴人郭惠研按原應有部\n分比例共同取得，編號Ｄ、Ｈ部分面積依序為2057.99、5493.52\n平方公尺分歸上訴人游禎賜、高志誠按原應有部分比例共同取得\n，編號Ｅ部分面積1678.12平方公尺分歸上訴人游禎翹取得，編\n號Ｆ、Ｊ部分面積依序為1009.23、668.89平方公尺分歸上訴人\n游禎達取得，編號Ｉ部分面積1693.38平方公尺分歸視同上訴人\n游祥湧、游祥啟、游祥顯、游祥源、游美、林游美津按原應有\n部分比例共同取得，編號Ｇ部分面積1083.34平方公尺分歸上訴\n人游禎賜、高志誠、游禎翹、游禎達、視同上訴人游祥湧、游祥\n啟、游祥顯、游祥源、林游美津、郭惠研及被上訴人楊金勝按原\n應有部分比例共同取得。\n第一、二審訴訟費用由兩造按附表所示應有部分之比例負擔。\n參加人之訴訟費用由參加人負擔。\n    事實及理由\n壹、程序部分：\n  一按訴訟繫屬中為訴訟標的之法律關係，雖移轉於第三人，於\n    訴訟無影響。但第三人如經兩造同意，得聲請代當事人承當\n    訴訟。前項但書情形，僅他造不同意者，移轉之當事人或第\n    三人得聲請法院以裁定許第三人承當訴訟，民事訴訟法第25\n    4條第1、2項定有明文。查兩造共有坐落彰化縣員林鎮○○\n    段第110號、地目田、面積21,236平方公尺土地，於本件起\n    訴時原共有人登記為游禎賜、游禎翹、游禎達、郭惠研、楊\n    金勝、賴彥佑及游禎（游禎於起訴前已死亡，其應有部\n    分由其繼承人即視同上訴人游祥顯、游美、游祥啟、游祥\n    湧、林游美津、游祥源，於98年4月13日訴訟程序進行中辦\n    理分割繼承登記）等，於訴訟程序進行中，訴外人賴彥佑將\n    其應有部分於98年7月27日移轉讓與上訴人高志誠，並完成\n    登記在案等情，此有系爭土地登記謄本可按，第三人高志誠\n    具狀聲明承當訴訟，惟被上訴人楊金勝不同意，本院於100\n    年6月14日為准予承當訴訟之裁定，因上開裁定未以合議行\n    之，故本院於本案判決時同時裁定許由高志誠為賴彥佑之承\n    當訴訟人，續行訴訟，合先敘明。\n  二本件上訴人高志誠、視同上訴人游祥湧、林游美津、游祥源\n    均受合法通知，未於最後言詞辯論期日到場，核無民事訴訟\n    法第386條各款所列情形，爰依被上訴人之聲請，由其一造\n    辯論而為判決。\n貳、實體部分：\n  一被上訴人楊金勝於起訴時及上訴審主張：\n    (一)兩造共有坐落彰化縣員林鎮○○段110號、地目田、面積2\n      1236平方公尺土地（下稱系爭土地），各人之應有部分如\n      附表所示，該土地無不能分割之情形，兩造間亦無不分割\n      之特約，且就分割方法不能達成協議，爰依民法第823條\n      第1項、第824條第2項規定，請求裁判分割如附圖二（即\n      員林地政事務所複丈日期民國98年1月12日土地複丈成果\n      圖）所示。\n    (二)被上訴人楊金勝之妻即視同上訴人郭惠研向蔡瑞讚買土地\n      前編號A、B、C的部分即有填高土地，蔡瑞讚為搶建房屋\n      ，但又不符合法令規定，只能作罷，因此被上訴人楊金勝\n      與其妻購買時並沒有分編號，希望購買後能興建房屋，雖\n      曾在其上種植水果達6.7年，但是因為土地遭他人傾倒垃\n      圾，現在租給別人作停車場，而購買時應是前手已種植水\n      果於其上，非被上訴人所種植，因為農地要買賣移轉上面\n      必須要種植，被上訴人楊金勝只是承接。\n    (三)上訴人的分割方案對被上訴人不公平，因為被上訴人分配\n      的位置太過分散，希望能分成直線，再者，上訴人游禎賜\n      等人所提分割方案將土地細分，尤其被上訴人及視同上訴\n      人郭惠研二人分得之土地竟零碎細分為三筆，依農業發展\n      條例第16條第1項第4款規定，本案土地於89年1月4日前土\n      地所有權僅有5人，而被上訴人之土地係自視同上訴人郭\n      惠研移轉而來，所以分割後，需二人維持共有，上訴人高\n      志誠之土地持分係自上訴人游禎賜移轉取得，需二人維持\n      共有，上訴人游祥源、上訴人游祥、上訴人游啟祥、視\n      同上訴人游祥顯、視同上訴人游美、視同上訴人游祥湧\n      、視同上訴人林游美津等六人係繼受自被繼承人游禎之\n      土地持分而來，需六人維持共有，縱依同條第1項第3款規\n      定，亦須待六人取得一筆共有土地，才能再行分割，本案\n      僅上訴人游禎達、上訴人游禎翹、上訴人游禎賜各取得單\n      獨一筆土地，換言之，縱經判決准予分割為十筆土地，惟\n      因違反農業發展條例，地政事務所亦無法受理登記。\n    (四)上訴人游禎達等人主張依原審判決所示方案現有道路無法\n      通行，既成道路將無法保留，且會影響鄰近數公頃良田及\n      住宅之排水云云，顯為不實之言，被上訴人早於第一審中\n      所提陳報狀已提出現有道路維持現狀，被上訴人分得之土\n      地再撥出部分土地將現有南側道路拓寬增加2米寬，再撥\n      出1米作為水溝供上訴人游禎賜排水，既不會造成被上訴\n      人分割後土地零散，亦顧慮到上訴人游禎賜達到基本之排\n      水需求，實為一舉三得，且上訴人游禎達等人所提分割方\n      案將被上訴人及視同上訴人郭惠研分得之土地細分為三之\n      肇因乃係水溝，實際上該水溝僅供上訴人游禎賜排水使用\n      ，何來影響數公頃良田及住宅排水，誇大之詞顯不足採，\n      且如前述，被上訴人願提供土地供其水溝改道，實為兩全\n      其美之法。\n    (五)且依原審判決，被上訴人及視同上訴人郭惠研所分得土地\n      上有高壓電塔及電纜線，已嚴重減損土地價值，倘再細分\n      為三筆土地，則更大大降低渠等二人之土地經濟價值及使\n      用效益，更是渠等二人無法集中管理，顯不利於渠等二人\n      。\n    (六)況上訴人游禎達等人所提分割方案，藉由一條約0.26m 至\n      1.5m寬之水溝將被上訴人應分得之土地細分為編號A、B\n      、C，被上訴人如何通行至編號C耕作？假使上訴人游禎賜\n      或其繼受人或承買之第三人築起籬笆或圍牆時，被不利被\n      上訴人通行，則編號C將成為毫無經濟價值之裏地，被上\n      訴人使用上及管理上即生困難。再就排水問題，因為任一\n      分割，因土地高度地形或高或低，縱因天災地辯或地震位\n      移導致土地凸起，或地下水超抽導致地層下陷，土地所有\n      權人須視情況填土或移除土方以利排水、耕作或使用管理\n      ，豈有地形地貌百年不變之理。\n    (七)原審所為判決已兼顧各共有人所分得土地皆臨路、臨排水\n      溝渠，已符合土地分割最基本之需求，且臨路巷道均已為\n      既成巷道，通行數十年之久，任何人皆不得有妨礙他人通\n      行之行為且由各共有人共同負擔巷道持分，尤以被上訴人\n      及視同上訴人郭惠研負擔最多，尚符合公平正義，本件土\n      地數十年來從未訂有不分割協議，亦無訂立分管契約來約\n      定使用位置，歷代各共有人為滿足私心且秉持先佔先贏之\n      理念，爭先占有土地使用至今，被上訴人及視同上訴人郭\n      惠研購買係爭土地持分時，賣方亦僅告知目前可供使用之\n      剩餘土地範圍約略位置，但無論被上訴人有無耕作、如何\n      使用、使用範圍及位置為何，依法各共有人實際分割位置\n      需以將來分割結果為準等情。原審判決兩造共有坐落彰化\n      縣員林鎮○○段110號、地目田、面積21,236平方公尺土\n      地，依如附圖二所示之方案分割，被上訴人於本院為駁回\n      上訴之聲明。\n  二上訴人及視同上訴人則以：\n    (一)上訴人游禎達、游禎翹、游禎賜、賴彥佑部分：\n      1.原審判決謂：「…再者，依附圖一所示方案分割，雖無\n        法保留被告等（被告郭惠研除外）所稱之現有排水溝渠\n        ，但系爭土地東側已有一條與界址線相平行之排水溝渠\n        ，西北側於地籍圖上亦有一條與界址線相平行之溝渠（\n        同段358 號土地），此觀卷附地籍圖甚明，並經本院勘\n        驗現場無誤，如被告等（被告郭惠研除外）另行施作溝\n        渠使之往北或往東與上開排水溝渠相連接，其農田排水\n        之問題即可解決，並非只有通過被告等所稱之現有排水\n        溝渠始能排水。…」云云，核與事實不符。蓋原審所稱\n        東側之溝渠，較西側田地地勢為高，故系爭現有既有溝\n        渠根本無法排水於此，至於原審所稱西北側之溝渠，係\n        屬灌溉溝渠，並非排水溝渠，且該灌溉溝渠地勢比系爭\n        共有土地及南邊田地、屋宅高，故無法供系爭共有土地\n        及南邊田地、屋宅排水使用。殊不知，原審未查明及此\n        ，遽為被上訴人有利之認定，尚屬有誤。尤甚者；若採\n        用被上訴人所提之分割方案，系爭現有既有溝渠將被廢\n        棄。蓋系爭現有既有溝渠，於上訴人游禎賜23年出生起\n        就有該既成溝渠，且上訴人游禎賜之父游文熙年輕時就\n        有該溝渠，而系爭現有既有溝渠，係供鄰近數甲公頃良\n        田及住宅排水使用，此有證人即大埔里前後里長游祥嘉\n        …等可證。故若採用被上訴人所提分割方案，首當其衝\n        者，上訴人游禎賜及游禎翹、游禎達現耕作之農田，將\n        無法耕作使用，甚至連住宅亦無法排水，益徵被上訴人\n        所提分割方案僅顧一己之私，顯屬不公允。\n      2.再依被上訴人所提分割方案，其分得位置不符合各共有\n        人原本使用各百餘年之現況，且上訴人游禎賜分得之位\n        置即編號丙呈畸零形，顯不利於使用，亦乏土地利用價\n        值公平性。另，上訴人賴彥佑向上訴人游禎賜購買系爭\n        土地持分時，即係要利用上訴人游禎賜所提分割方案編\n        號H東邊現有小通路做為其住宅之出入口，但如依被上\n        訴人所提方案分割，上訴人賴彥佑其住宅將無法通路出\n        入，故亦有不當。詎原審未查明及此，遽認：「…原告\n        及被告郭惠研主張依附圖一所示方案分割，…大致兼顧\n        各共有人占有使用現況，亦使附圖三所示F及B部分之既\n        成巷道較為公平分配於各共有人。…」云云，尚屬有誤\n        。\n      3.被上訴人於98年12月24日言詞辯論期日自承「郭惠研是\n        向蔡瑞讚買土地，蔡瑞讚在賣給我太太之前已經在A、B\n        、C 的部分有填高土地，蔡瑞讚為了要搶建房屋後來法\n        令又規定不可以蓋房子，所以就沒有耕作，我及我太太\n        買了土地持份後有在A、B、C三個部分有種植水果，但\n        是因為土地有被他人倒垃圾，現在我有租給別人作停車\n        場，我種植香蕉6、7年，停車場包含A、B部分，C部分\n        有種過水果，我當初買土地是希望將來能蓋房子。」、\n        「…賣方有告知他（即郭惠研）在使用的是哪壹塊特定\n        的位置，所以我才會種植水果，…」云云，足證系爭被\n        上訴人之配偶郭惠研向其前手購買特定位置（即編號A\n        、B、C），且知其前手為了要搶建房屋，早已在前開位\n        置填高土地；被上訴人之配偶郭惠研當初買土地亦是希\n        望將來能蓋房子。而前開編號A、B、C三個部分土地，\n        被上訴人亦均有在使用，此有前開筆錄可稽。詎於100\n        年6月28日言詞辯論期日時，被上訴人之配偶郭惠研辯\n        稱「…我分配的土地是要耕種…」、「…編號C部分有\n        人耕種，但不知道是誰在使用，不是被上訴人、視同上\n        訴人郭惠研在耕作。」云云；被上訴人及其配偶郭惠研\n        辯稱「否認編號C部分是我們在使用，而且也沒有租人\n        放車子。」、「土地是跟誰買的要看合約書。我是買土\n        地的持份，買土地時賣給我的人沒有告訴我說他用哪幾\n        塊，…編號C部分我們沒有租給別人及放車子，我們只\n        有買持份沒有使用特定部分…」云云，顯為不實之言。\n      4.況被上訴人配偶即視同上訴人郭惠研前手填土石堆高約\n        5 尺高觀之，足見該地現顯非為做為農業耕作之用，且\n        現亦已不能為正常農業耕作之用，此參彰化縣政府於99\n        年3月17日與員林鎮公所及員林地政事務所至現場會勘\n        ，其會勘結論即謂「1.本筆土地包含有稻田區、廢園區\n        、及未辦理保存登記之加強磚造屋、私設巷道、石棉瓦\n        屋，被舖設水泥之球場兼停車場。一部分荒廢未使用之\n        農地被廢棄物及廢土石墊高。2.本案作為農業使用的只\n        有水稻、芋頭區、芭樂、景觀木區及混植區。」足見前\n        開編號A、B、C位置之農地，以前可以從事農業使用，\n        但現已無法從事農業使用，此有本院附卷之會勘紀錄可\n        稽。而前開編號A、B、C 位置使用之情形，被上訴人及\n        其配偶郭惠研於82年1月間即知悉，其會欣然同意購買\n        ，蓋其乃意在日後想利用該地建築之用，根本並非買來\n        務農耕作之用。況查，被上訴人於98年12月24日言詞辯\n        論期日即自承「…我當初買土地是希望將來能蓋房子。\n        」云云，此有本院筆錄記載可稽。是則，前開已不能正\n        常耕作之農地（即編號A、B、C位置），分歸給被上訴\n        人及其配偶即視同上訴人郭惠研依持分比例維持共有取\n        得，乃合情合理、天經地義之事。被上訴人豈可要求將\n        前開無法耕作之農地分歸上訴人（真正務農的共有人）\n        呢？原審判決卻謂「…原告及被告郭惠研主張依附圖一\n        所示方案分割，且依該方案分割，各共有人分得部分較\n        為完整、方正，無細分農地之情形，有利農地之經營、\n        使用，符合農業發展條例第16條之立法意旨，…惟附圖\n        二所示方案不但使原告及被告郭惠研分得部分細分成A\n        、B 、C三筆，…更造成其中編號C部分（面積764.44平\n        方公尺）…之面積在0.25公頃以下，實不利農地之經營\n        、使用，顯與農業發展條例第16條所揭櫫之防止耕地細\n        分、以利農場經營管理之立法意旨不合，…」云云，核\n        與事實不符。蓋被上訴人配偶郭惠研早在82年1月間向\n        其前手購買系爭土地（即上訴人游禎賜在原審所提新乙\n        案編號A、B、C之位置），而該位置在郭惠研購買時早\n        已在數年前填土石堆高約5尺高（約150公分高），致前\n        開編號A、B、C之位置，顯高於鄰近農田，惟郭惠研之\n        前手在填土石堆高時，即已留下當時現有既成溝渠，由\n        此觀之，足見系爭現有既有溝渠確係供鄰近數甲公頃良\n        田及住宅排水使用。況，被上訴人配偶郭惠研前手填土\n        石堆高約5尺高觀之，足見該地顯非為做為農業耕作之\n        用，否則，何以致之？尤甚者，被上訴人夫婦從82年迄\n        今前後近17年之久，從未見被上訴人夫婦在前開編號A\n        、B、C土地上耕種，此於原審現場勘驗即明前開編號A\n        、B、C土地早已荒廢不能耕種使用。益徵原審判決依農\n        業發展條例規定俾讓被上訴人能有利於農地之經營、使\n        用乙節，誠屬緣木求魚。\n      5.倘依上訴人游禎達等人所提分割方案分割，日後被上訴\n        人及其配偶即視同上訴人郭惠研若要由編號A至B，或要\n        由編號B至C位置，上訴人游禎賜及上訴人高志誠（即賴\n        彥佑之承當訴訟人）同意讓渠等設橋通過，但其不能影\n        響或妨礙系爭溝渠排水功能。至於編號D之系爭溝渠，\n        分歸上訴人游禎賜及上訴人高志誠只要是鄰近農地有正\n        常使用系爭溝渠之必要，上訴人游禎賜及上訴人高志誠\n        均同意其使用。\n      6.上訴人游禎達等人修正原第一審所提分割方案，將編號\n        G部分，僅由游禎賜、高志誠、游禎翹、游禎達、游祥\n        湧、游祥啟、游祥顯、游祥源、游美、林游美津等人\n        依應有部分之比例保持共有（其中被上訴人及郭惠研並\n        不用負擔），作為道路使用。是則，即無原審指摘：「\n        …，被告等（被告郭惠研除外）主張之附圖二所示方案\n        ，亦將附圖三所示B部分之既成巷道分歸原告及被告郭\n        惠研取得，何以該方案即不致造成無路可走之情形？…\n        」之缺失。\n      7.若採上訴人游禎達等人所提方案分割，則無前開被上訴\n        人方案之缺點，不僅現有既有溝渠得以保留，讓鄰近數\n        公頃良田及住宅得以排水。且各共有人分得位置，亦符\n        合原本使用之現況位置。而上訴人分得之位置，亦較便\n        於利用。另，上訴人新修正之方案分割，現供公眾使用\n        百餘年之既成道路亦得以保留，俾共有人及附近里民有\n        路可通行。且被上訴人及其配偶郭惠研需負擔巷道之面\n        積為411.97平方公尺，占渠等持分比例為百分之五（即\n        411.97平方公尺÷7963.49平方公尺＝0.0511），而上\n        訴人游禎賜、游禎翹、游禎達、高志誠及游祥湧、游祥\n        啟、游祥顯、游祥源、林游美津等人所需負擔巷道之面\n        積為671.37平方公尺，占渠等持分比例為百分之五（即\n        671.37平方公尺÷13272.51平方公尺＝0.0511），故就\n        負擔巷道面積之部分，如依上訴人游禎達等人所提方案\n        加以分割，對被上訴人及其配偶郭惠研而言，因系爭土\n        地係農地，彼此又係依持分比例分攤，故分攤比例上大\n        致約相符。故被上訴人辯稱被上訴人及其配偶郭惠研負\n        擔巷道之面積為最多云云，恐屬誤會。\n      8.且查，系爭土地為農地，並非建地，且農地之間，本來\n        就有水溝或田埂，而農地每一區塊與每一區塊之間，無\n        論是灌溉或排水用之水溝，或田埂，都是一區塊越過一\n        區塊，並無不能使用之情形。除非將系爭農地違法當作\n        建地使用，否則，系爭農地分割後，並無不能使用之情\n        形。故本件被上訴人及其配偶郭惠研之主張，尚不足採\n        。若採上訴人方案分割，則不僅現有既有溝渠得以保留\n        ，讓鄰近數公頃良田（含員大路南邊之農田流經員大路\n        ，再抵系爭溝渠）及住宅得以排水。且各共有人分得位\n        置，亦符合原本使用之現況位置。而上訴人分得之位置\n        ，亦較便於利用。另，現供公眾使用百餘年之既成道路\n        （即上訴人分割方案編號G部分）亦得以保留，俾供共\n        有人及附近里民出入通行。反之，若採被上訴人方案分\n        割，則不僅現有既有溝渠不能保留，鄰近數公頃良田（\n        含員大路南邊之農田流經員大路，再抵系爭溝渠）及住\n        宅無法排水。且現供公眾使用百餘年之既成道路將被廢\n        棄，共有人及附近里民將無法出入通行。益徵被上訴人\n        所提方案分割，尚非允當。\n      9.綜上所陳，原審判決採用被上訴人所提分割方案，誠屬\n        不當。依上訴人游禎達等人所提方案分割，較符合公平\n        原則，應為較妥適之分割方法等語為辯。並聲明：原\n        判決廢棄。兩造共有系爭土地准予依如附圖一（即員\n        林地政事務所收件日期文號100年7月28日第1354號土地\n        複丈成果圖）所示之方案分割，判決如主文第二項所示\n        。第一、二審訴訟費用由被上訴人負擔。\n    (二)參加人彰化縣員林鎮農會（即上訴人游禎賜之訴訟參加人\n      ）部分：同意上訴人游禎達等人所提如附圖一所示之分割\n      方案。\n    (三)上訴人游祥源、上訴人游祥、視同上訴人游祥顯、視同\n      上訴人游美、視同上訴人游祥湧、視同上訴人林游美津\n      部分：同意依上訴人游禎達等人所提如附圖一所示之方案\n      分割。\n    (四)上訴人高志誠（即賴彥佑之承當訴訟人）部分：同意與上\n      訴人游禎賜分割後依持分比例維持共有，並同意依上訴人\n      游禎達等人所提分割方案分割。\n    (五)視同上訴人郭惠研則以：被上訴人游禎賜等人的方案將視\n      同上訴人郭惠研取得土地分為三塊零散土地，不利於使用\n      ，且有高壓電塔、電纜線，編號C的部分無對外通路且無\n      經濟價值，上訴人游禎賜等人稱水果是視同上訴人郭惠研\n      6 、7年種植，並非事實，香蕉是被上訴人楊金勝及視同\n      上訴人郭惠研跟前手買土地時前手就已經種植其上，香蕉\n      會延生擴大，欲恢復耕作但有困難，排水可以排別的地方\n      ，不一定要照上訴人游禎賜等人方案，希望能維持原判等\n      語。並聲明：上訴駁回。\n  三查本件被上訴人楊金勝起訴主張坐落彰化縣員林鎮○○段11\n    0地號、地目田、面積21,236平方公尺土地，為兩造所共有\n    ，應有部分如附表所示，且兩造間就共有土地不能協議分割\n    ，又無因物之使用目的不能分割，或約定不分割之情形等情\n    ，業據提出土地登記簿謄本為證，復為上訴人及視同上訴人\n    等所不爭執，自堪信為真實。兩造間既無不分割之約定，亦\n    無因物之使用目的不能分割之情形，就分割方法又不能達成\n    協議，故被上訴人訴請准予原物裁判分割，揆諸民法第824\n    條第2項第1款、第5項規定，核無不合，應予准許。\n  四次查，系爭土地為特定農業區農牧用地，為東西短南北狹長\n    之不規則地形，如附圖三所示其中編號A1、B2及H2部分為水\n    溝供做灌溉溝渠使用，編號A2、F及B6部分為現有巷道，編\n    號C部分之鐵造及磚造平房係上訴人游禎賜所有，H部分種植\n    木瓜等蔬菜、編號I部分種植芭樂等，編號A、B、B1及H部分\n    等空地為視同上訴人郭惠研於82年間向前共有人蔡瑞讚購買\n    應有部分時，即由蔡瑞讚於數年前為搶建房屋而填高土地，\n    嗣視同上訴人郭惠研於97年間將應有部分之一部以夫妻贈與\n    為由移轉登記予被上訴人楊金勝，其餘部分為空地則由其他\n    共有人分別耕種使用等情，此有土地登記謄本及異動索引附\n    卷可稽，亦經本院再至現場會同彰化縣員林地政事務所人員\n    履勘測量明確，並製有勘驗筆錄及員林地政事務所收件日期\n    文號99年5月27日第848號土地複丈成果圖（即附圖三）在卷\n    可按，復經被上訴人楊金勝於本院98年12月24日行準備程序\n    時自承：「郭惠研是向蔡瑞讚買土地，蔡瑞讚在賣給我太太\n    之前已經在A、B、C（係指附圖一所示分割方案中之編號A、\n    B、C部分，與附圖三所示編號A、B、B1及H部分係屬同一位\n    置）的部分有填高土地，蔡瑞讚為了要搶建房屋後來法令又\n    規定不可以蓋房子，所以就沒有耕作，我及我太太買了土地\n    持份後有在A、B、C三個部分有種植水果，但是因為土地有\n    被他人倒垃圾，現在我有租給別人作停車場，我種植香蕉6\n    、7年，停車場包含A、B部分，C部分有種過水果，我當初買\n    土地是希望將來能蓋房子。」、「賣方有告知她（指郭惠研\n    ）在使用的是哪壹塊特定的位置，所以我才會種植水果」等\n    語無訛，亦為上訴人及視同上訴人（郭惠研除外）等所不爭\n    執；另本院囑託台灣省測量技師公會鑑測系爭土地相關位置\n    高程點及排水方向，經鑑測結果：…五依據測量系爭土地之\n    各高程點顯示，若不考慮分割方案圖（指附圖三）中A、B、\n    B1、H等區塊之地形業經人為填土而增高部份，就整體而言\n    ，整塊系爭土地係屬南側較高逐向北側漸低之地形走向，故\n    現況水流方向亦顯現自南往北之流向。六本案系爭土地若擬\n    另闢水流溝渠，可自圖內（如附圖四即鑑定報告書之測量成\n    果圖）B區塊南側之G1往G2方向或自G3沿現況路邊往G2方向\n    另闢水流溝漕，惟依地形高低差狀況，僅能導引分割方案圖\n    中C筆地以南之水流，C筆土地以北之水流仍須依現況地形水\n    流方向往北側導流等情，此有台灣省測量技師公會99年8月9\n    日鑑測成果報告書附卷可考，復經鑑定人測量技師周渙文於\n    本院到庭結證：鑑定報告書第六項中「分割方案圖C筆土地\n    」係指員林地政事務所收件日期文號99年5月27日第848號土\n    地複丈成果圖（即附圖三）之編號C部分，依照原審判決分\n    割方案丁、戊部分要另闢水溝往鑑定圖（即附圖四）所述之\n    G2 方向引流，乙、丙部分兩筆土地的水流沒有辦法往G2方\n    向引流，必須要從甲部分這塊土地與丙部分的北側方向走即\n    現況圖現有的水溝B2部分往北流，如果丙、乙部分不走北方\n    B2 部分的水溝引流，廢棄B2部分水溝的話，而另闢水溝會\n    使用到西側別人106、103地號土地，因為附近其他的土地都\n    已經比較高等語屬實，故系爭土地既屬特定農業區農牧用地\n    ，自應考慮分割後各筆土地之排水溝渠可否順利引流以達農\n    地農用之效力，依鑑定人所述附圖三現況圖中C筆土地以北\n    之水流仍須依現況地形水流方向往北側導流，即從原審判決\n    之分割方案中編號甲部分土地與丙部分的北側方向走，故縱\n    使廢棄B2部分之水溝，附圖一所示分割方案中之編號D部分\n    土地仍必需使用編號A或B部分土地來引流排水，否則即需使\n    用鄰地，然各共有人如已得從自有之系爭土地排水，實不得\n    因分割而阻斷系爭土地之排水，轉而向毗鄰之他人土地要求\n    排水權，造成鄰地之不利益，因此分割後如將附圖一所示之\n    編號A、B部分連成一整塊即如原審判決分割方案之甲部份土\n    地，將來分配取得附圖一編號D部分位置之共有人，仍需向\n    分配取得編號A、B部分之共有人請求自然流水之排水權，如\n    採用原審判決之分割方案，屆時取得甲部份土地之共有人亦\n    無法整塊完整使用該筆土地，且因系爭土地北側及東側三分\n    之二土地均分配予被上訴人楊金勝及視同上訴人郭惠研，其\n    他共有人顯無法如原審判決所述得以在系爭土地上另行開闢\n    往北或往東之溝渠，縱被上訴人楊金勝及視同上訴人郭惠研\n    陳稱願提供1米寬之土地供作水溝之用，但水溝留設位置是\n    否足以達到排水目的尚無可知，且此為使用借貸之關係，將\n    來如楊金勝及郭惠研二人將分配取得之土地轉讓他人，他人\n    並不受此使用借貸關係之拘束，如附圖一編號D部分土地仍\n    有產生無法排水糾紛之虞，徒增鄰地所有人間之困擾，蓋系\n    爭土地原來即有如附圖三現況圖所示之編號B2水溝可供附圖\n    一所示編號D部分土地引流排水，自無再另闢其他水溝之必\n    要，因而將附圖三編號B2部分水溝之土地分配予附圖一編號\n    D部分土地共有人取得，實有利於土地之利用，原審判決如\n    附圖二所示之分割方案就關於分割後各筆土地排水問題未通\n    盤考量，尚非允當。\n  五又查，附圖三現況圖所示編號A2、B6及F部分為現有巷道，\n    除供系爭土地共有人通行外，亦作為附近東側多筆鄰地對外\n    聯絡使用，原審判決如附圖二所示分割方案未將上開現有巷\n    道使用系爭土地之部分仍留設做為道路使用，而分配予共有\n    人各自取得，以致該現有巷道土地如仍留作道路使用，將使\n    分配取得道路部分土地之共有人須以自有土地供公眾通行顯\n    為不利，如不再供做道路使用予以圍阻，亦會影響附近鄰地\n    對外之通行聯絡，是原審判決未就此部分予以考量亦有未洽\n    ，上訴人所主張如附圖一所示之分割方案將上開附圖三編號\n    A2 、B6及F部分之現有巷道，劃歸為附圖一所示編號G部分\n    供作道路使用，顯較符合現狀使用之需要。\n  六另附圖一所示編號A、B、C部分雖分割為三塊由被上訴人楊\n    金勝及視同上訴人郭惠研共有取得，惟此三部份於82年間視\n    同上訴人郭惠研向前手買受系爭土地應有部分時即已填高，\n    視同上訴人郭惠研亦係以為得以變更地目，為搶建房屋而買\n    受系爭土地，前手亦將上開部分交付予視同上訴人郭惠研及\n    被上訴人楊金勝使用至今，惟郭惠研之前手雖填高A、B、C\n    部份土地卻仍保留附圖三所示編號B2部分之水溝未填埋，顯\n    然亦知該溝渠有保留之必要，視同上訴人郭惠研及被上訴人\n    楊金勝並非欲作農業使用而買受系爭農地，自應承受前手為\n    搶建房屋填高三塊土地之不利益，況農地中留有溝渠或田埂\n    為常情所見，附圖一所示編號A、B、C等部分之面積達3000\n    及近1000平方公尺，作農業使用並無困難，視同上訴人郭惠\n    研及被上訴人楊金勝以建地搭蓋房屋須完整一塊較好利用之\n    思維來分配使用系爭農地，尚無可採。\n  七再查，系爭土地於89年1月4日農業發展條例第16條修正施行\n    前，共有人為游禎賜、游禎翹、游禎達、郭惠研及游禎等\n    5人，修正施行後，游禎賜於96年間將應有部分之一部以買\n    賣為由移轉登記予賴彥佑（即應有部分0000000分之10975，\n    面積為105.8平方公尺），賴彥佑於99年間將應有部分全部\n    轉賣高志誠，郭惠研於97年間將應有部分之一部，以夫妻贈\n    與為由移轉登記予楊金勝（即應有部分5000分之39，面積為\n    165. 64平方公尺），共有人游禎於97年2月8日死亡，由\n    其繼承人即上訴人游祥啟、游祥源及視同上訴人游祥顯、游\n    美、游祥湧、林游美津等6人，於98年4月13日辦理繼承登\n    記為分別共有等情，此有土地謄本及異動索引足憑，依農業\n    發展條例第16條第2項規定，每宗耕地分割後每人所有面積\n    未達0.25公頃者，不得分割，但有第3款「本條例中華民國\n    八十九年一月四日修正施行後所繼承之耕地，得分割為單獨\n    所有」及第4款「本條例中華民國八十九年一月四日修正施\n    行前之共有耕地，得分割為單獨所有」之情形，不在此限，\n    同條第2項則規定，前項第3款及第4款所定共有耕地，辦理\n    分割為單獨所有者，應先取得共有人之協議或法院確定判決\n    ，其分割後之宗數，不得超過共有人人數。故上訴人賴彥佑\n    及被上訴人楊金勝因係於89年1月4日取得共有土地且面積均\n    未達0.25公頃，故於分割時不得為單獨所有，上訴人賴彥佑\n    仍需與上訴人游禎賜於分割後繼續保持共有，被上訴人楊金\n    勝需與視同上訴人郭惠研於分割後保持共有，惟游禎賜及郭\n    惠研因均係於89年1月4日以前共有系爭耕地，故分割取得之\n    面積不受0.25公頃之限制，另視同上訴人游祥啟、游祥源、\n    游祥顯、游美、游祥湧、林游美津等6人係於89年1月4日\n    以後繼承系爭耕地，因此亦不受最小分割面積之限制得分割\n    為單獨所有，故本件系爭土地分割後之宗數依上開規定可分\n    割為10筆等情，此有彰化縣員林地政事務所98年4月6日員地\n    二字第0980002216號函在卷可考，是附圖一所示之分割方案\n    將系爭土地分割為10筆，未逾上開農業發展條例第16條第2\n    項規定之筆數，而高志誠與游禎賜、楊金勝與郭惠研亦分別\n    維持共有取得，且編號C、D、E、F、J、I及G部分之面積雖\n    未達0.25公頃，但依前揭說明並不受此面積規定之限制，自\n    無違反上開農業發展條例第16條第1項規定之情事，併此敘\n    明。\n  八復按法院定分割方法時，必須考量兩造之利益、意願，由土\n    地上建物現況、各共有人原使用位置、分割後各共有人分得\n    土地之方整及利用價值，予以衡量。經審酌附圖一所示之分\n    割方案兩造分配取得之部分土地，均位於各共有人現占有使\n    用之處，各筆土地亦堪方整有利於使用，並保留現有溝渠以\n    利耕種，且將編號G部分作為道路使用，由兩造（視同上訴\n    人游美除外）保持共有，以利共有人及附近鄰地之通行，\n    另被上訴人楊金勝與視同上訴人郭惠研、上訴人游禎賜與高\n    志誠分別依法仍維持共有關係，視同上訴人游祥啟、游祥源\n    、游祥顯、游美、游祥湧、林游美津等6人表示於分割後\n    願繼續保持共有，因此將附圖一所示編號A、B、C部分由被\n    上訴人楊金勝與視同上訴人郭惠研共有取得，編號D、H 部\n    分由上訴人游禎賜與高志誠共有取得、編號I部分由視同上\n    訴人游祥啟、游祥源、游祥顯、游美、游祥湧、林游美津\n    等6人共有取得，應無不妥，被上訴人楊金勝與視同上訴人\n    郭惠研分配取得之部分雖分為三塊，但此係為使編號D部分\n    土地得以順利自然排水，以免將來產生排水糾紛而為之分割\n    方式，但編號A、B、C部分每塊地形尚屬方整，面積達3000\n    多及近1000平方公尺，縱分為三塊仍無礙於農耕使用，反之\n    原審判決如附圖二所示之分割方案未保留水溝排水，亦未考\n    慮維持現有道路以利通行，實有未洽，故本件改依如附圖一\n    所示之分割方案予以分割，較有利於日後土地利用，應足採\n    用。從而，原審所為之分割方案，既應作上述部分之調整，\n    即有未洽，上訴意旨，指摘原判決不當，求予廢棄改判，為\n    有理由，乃爰判決如主文第二項所示。\n  九末按應有部分有抵押權或質權者，其權利不因共有物之分割\n    而受影響。但有下列情形之一者，其權利移存於抵押人或出\n    質人所分得之部分：一權利人同意分割。二權利人已參加共\n    有物分割訴訟。三權利人經共有人告知訴訟而未參加。前項\n    但書情形，於以價金分配或以金錢補償者，準用第881條第1\n    項、第2項或第899條第1項規定。訴訟之結果，於第三人有\n    法律上利害關係者，法院得於第一審或第二審言詞辯論終結\n    前相當時期，將訴訟事件及進行程度以書面通知該第三人；\n    前項受通知人得於通知送達後5日內，為第242條第1項之請\n    求；第1項受通知人得依第58條規定參加訴訟者，準用前條\n    之規定，民法第824條之1第2、3項、民事訴訟法第67條之1\n    分別定有明文。查本件系爭土地共有人游禎賜於93年3月16\n    日將其應有部份0000000分之815150，設定新台幣650萬元抵\n    押權予訴外人彰化縣員林鎮農會，此有土地登記謄本附卷可\n    稽，業經本院告知抵押權人參加訴訟，故本件土地分割後抵\n    押權人彰化縣員林鎮農會之抵押權應只移存於上訴人游禎賜\n    及高志誠所分得之如附圖一所示編號Ｄ、Ｈ部分土地，併此\n    敘明。\n  十結論：本件上訴為有理由，依民事訴訟法第436條之1第3項\n    、第450條、第463條、第385條第1項前段、第78條、第80條\n    之1、第85條第1項但書、第86條第1項前段，判決如主文。\n中    華    民    國   100    年    10    月    25    日\n                  民事第一庭  審判長法  官  康弼周\n                                    法  官  王鏡明\n                                    法  官  黃倩玲\n中    華    民    國   100    年    10    月    25    日\n                                    書記官  黃幼華\n附表\n┌─────────────┬─────────┐\n│共有人                    │應   有   部   分 │\n├─────────────┼─────────┤\n│游禎賜                    │00000000/00000000 │\n├─────────────┼─────────┤\n│游禎翹                    │0000000/00000000  │\n├─────────────┼─────────┤\n│游禎達                    │0000000/00000000  │\n├─────────────┼─────────┤\n│郭惠研                    │00000000/00000000 │\n├─────────────┼─────────┤\n│賴彥佑                    │493875/00000000   │\n├─────────────┼─────────┤\n│楊金勝                    │773253/00000000   │\n├─────────────┼─────────┤\n│游祥湧                    │0000000/00000000  │\n├─────────────┼─────────┤\n│游祥啟                    │0000000/00000000  │\n├─────────────┼─────────┤\n│游祥顯                    │0000000/00000000  │\n├─────────────┼─────────┤\n│游祥源                    │0000000/00000000  │\n├─────────────┼─────────┤\n│游美                    │0000000/00000000  │\n├─────────────┼─────────┤\n│林游美津                  │0000000/00000000  │\n└─────────────┴─────────┘\n本判決不得上訴。",
  "structure": {
    "main": "原判決廢棄。\n兩造共有坐落彰化縣員林鎮○○段第110號、地目田、面積21,23\n6平方公尺土地，其分割方法為如附圖一（即彰化縣員林地政事\n務所收件日期文號民國100年7月28日第1354號土地複丈成果圖）\n所示：編號Ａ、Ｂ、Ｃ部分面積依序為3106.95、3445.45、999.\n13平方公尺分歸被上訴人楊金勝及視同上訴人郭惠研按原應有部\n分比例共同取得，編號Ｄ、Ｈ部分面積依序為2057.99、5493.52\n平方公尺分歸上訴人游禎賜、高志誠按原應有部分比例共同取得\n，編號Ｅ部分面積1678.12平方公尺分歸上訴人游禎翹取得，編\n號Ｆ、Ｊ部分面積依序為1009.23、668.89平方公尺分歸上訴人\n游禎達取得，編號Ｉ部分面積1693.38平方公尺分歸視同上訴人\n游祥湧、游祥啟、游祥顯、游祥源、游美、林游美津按原應有\n部分比例共同取得，編號Ｇ部分面積1083.34平方公尺分歸上訴\n人游禎賜、高志誠、游禎翹、游禎達、視同上訴人游祥湧、游祥\n啟、游祥顯、游祥源、林游美津、郭惠研及被上訴人楊金勝按原\n應有部分比例共同取得。\n第一、二審訴訟費用由兩造按附表所示應有部分之比例負擔。\n參加人之訴訟費用由參加人負擔。",
    "fact": "壹、程序部分：\n  一按訴訟繫屬中為訴訟標的之法律關係，雖移轉於第三人，於\n    訴訟無影響。但第三人如經兩造同意，得聲請代當事人承當\n    訴訟。前項但書情形，僅他造不同意者，移轉之當事人或第\n    三人得聲請法院以裁定許第三人承當訴訟，民事訴訟法第25\n    4條第1、2項定有明文。查兩造共有坐落彰化縣員林鎮○○\n    段第110號、地目田、面積21,236平方公尺土地，於本件起\n    訴時原共有人登記為游禎賜、游禎翹、游禎達、郭惠研、楊\n    金勝、賴彥佑及游禎（游禎於起訴前已死亡，其應有部\n    分由其繼承人即視同上訴人游祥顯、游美、游祥啟、游祥\n    湧、林游美津、游祥源，於98年4月13日訴訟程序進行中辦\n    理分割繼承登記）等，於訴訟程序進行中，訴外人賴彥佑將\n    其應有部分於98年7月27日移轉讓與上訴人高志誠，並完成\n    登記在案等情，此有系爭土地登記謄本可按，第三人高志誠\n    具狀聲明承當訴訟，惟被上訴人楊金勝不同意，本院於100\n    年6月14日為准予承當訴訟之裁定，因上開裁定未以合議行\n    之，故本院於本案判決時同時裁定許由高志誠為賴彥佑之承\n    當訴訟人，續行訴訟，合先敘明。\n  二本件上訴人高志誠、視同上訴人游祥湧、林游美津、游祥源\n    均受合法通知，未於最後言詞辯論期日到場，核無民事訴訟\n    法第386條各款所列情形，爰依被上訴人之聲請，由其一造\n    辯論而為判決。\n貳、實體部分：\n  一被上訴人楊金勝於起訴時及上訴審主張：\n    (一)兩造共有坐落彰化縣員林鎮○○段110號、地目田、面積2\n      1236平方公尺土地（下稱系爭土地），各人之應有部分如\n      附表所示，該土地無不能分割之情形，兩造間亦無不分割\n      之特約，且就分割方法不能達成協議，爰依民法第823條\n      第1項、第824條第2項規定，請求裁判分割如附圖二（即\n      員林地政事務所複丈日期民國98年1月12日土地複丈成果\n      圖）所示。\n    (二)被上訴人楊金勝之妻即視同上訴人郭惠研向蔡瑞讚買土地\n      前編號A、B、C的部分即有填高土地，蔡瑞讚為搶建房屋\n      ，但又不符合法令規定，只能作罷，因此被上訴人楊金勝\n      與其妻購買時並沒有分編號，希望購買後能興建房屋，雖\n      曾在其上種植水果達6.7年，但是因為土地遭他人傾倒垃\n      圾，現在租給別人作停車場，而購買時應是前手已種植水\n      果於其上，非被上訴人所種植，因為農地要買賣移轉上面\n      必須要種植，被上訴人楊金勝只是承接。\n    (三)上訴人的分割方案對被上訴人不公平，因為被上訴人分配\n      的位置太過分散，希望能分成直線，再者，上訴人游禎賜\n      等人所提分割方案將土地細分，尤其被上訴人及視同上訴\n      人郭惠研二人分得之土地竟零碎細分為三筆，依農業發展\n      條例第16條第1項第4款規定，本案土地於89年1月4日前土\n      地所有權僅有5人，而被上訴人之土地係自視同上訴人郭\n      惠研移轉而來，所以分割後，需二人維持共有，上訴人高\n      志誠之土地持分係自上訴人游禎賜移轉取得，需二人維持\n      共有，上訴人游祥源、上訴人游祥、上訴人游啟祥、視\n      同上訴人游祥顯、視同上訴人游美、視同上訴人游祥湧\n      、視同上訴人林游美津等六人係繼受自被繼承人游禎之\n      土地持分而來，需六人維持共有，縱依同條第1項第3款規\n      定，亦須待六人取得一筆共有土地，才能再行分割，本案\n      僅上訴人游禎達、上訴人游禎翹、上訴人游禎賜各取得單\n      獨一筆土地，換言之，縱經判決准予分割為十筆土地，惟\n      因違反農業發展條例，地政事務所亦無法受理登記。\n    (四)上訴人游禎達等人主張依原審判決所示方案現有道路無法\n      通行，既成道路將無法保留，且會影響鄰近數公頃良田及\n      住宅之排水云云，顯為不實之言，被上訴人早於第一審中\n      所提陳報狀已提出現有道路維持現狀，被上訴人分得之土\n      地再撥出部分土地將現有南側道路拓寬增加2米寬，再撥\n      出1米作為水溝供上訴人游禎賜排水，既不會造成被上訴\n      人分割後土地零散，亦顧慮到上訴人游禎賜達到基本之排\n      水需求，實為一舉三得，且上訴人游禎達等人所提分割方\n      案將被上訴人及視同上訴人郭惠研分得之土地細分為三之\n      肇因乃係水溝，實際上該水溝僅供上訴人游禎賜排水使用\n      ，何來影響數公頃良田及住宅排水，誇大之詞顯不足採，\n      且如前述，被上訴人願提供土地供其水溝改道，實為兩全\n      其美之法。\n    (五)且依原審判決，被上訴人及視同上訴人郭惠研所分得土地\n      上有高壓電塔及電纜線，已嚴重減損土地價值，倘再細分\n      為三筆土地，則更大大降低渠等二人之土地經濟價值及使\n      用效益，更是渠等二人無法集中管理，顯不利於渠等二人\n      。\n    (六)況上訴人游禎達等人所提分割方案，藉由一條約0.26m 至\n      1.5m寬之水溝將被上訴人應分得之土地細分為編號A、B\n      、C，被上訴人如何通行至編號C耕作？假使上訴人游禎賜\n      或其繼受人或承買之第三人築起籬笆或圍牆時，被不利被\n      上訴人通行，則編號C將成為毫無經濟價值之裏地，被上\n      訴人使用上及管理上即生困難。再就排水問題，因為任一\n      分割，因土地高度地形或高或低，縱因天災地辯或地震位\n      移導致土地凸起，或地下水超抽導致地層下陷，土地所有\n      權人須視情況填土或移除土方以利排水、耕作或使用管理\n      ，豈有地形地貌百年不變之理。\n    (七)原審所為判決已兼顧各共有人所分得土地皆臨路、臨排水\n      溝渠，已符合土地分割最基本之需求，且臨路巷道均已為\n      既成巷道，通行數十年之久，任何人皆不得有妨礙他人通\n      行之行為且由各共有人共同負擔巷道持分，尤以被上訴人\n      及視同上訴人郭惠研負擔最多，尚符合公平正義，本件土\n      地數十年來從未訂有不分割協議，亦無訂立分管契約來約\n      定使用位置，歷代各共有人為滿足私心且秉持先佔先贏之\n      理念，爭先占有土地使用至今，被上訴人及視同上訴人郭\n      惠研購買係爭土地持分時，賣方亦僅告知目前可供使用之\n      剩餘土地範圍約略位置，但無論被上訴人有無耕作、如何\n      使用、使用範圍及位置為何，依法各共有人實際分割位置\n      需以將來分割結果為準等情。原審判決兩造共有坐落彰化\n      縣員林鎮○○段110號、地目田、面積21,236平方公尺土\n      地，依如附圖二所示之方案分割，被上訴人於本院為駁回\n      上訴之聲明。\n  二上訴人及視同上訴人則以：\n    (一)上訴人游禎達、游禎翹、游禎賜、賴彥佑部分：\n      1.原審判決謂：「…再者，依附圖一所示方案分割，雖無\n        法保留被告等（被告郭惠研除外）所稱之現有排水溝渠\n        ，但系爭土地東側已有一條與界址線相平行之排水溝渠\n        ，西北側於地籍圖上亦有一條與界址線相平行之溝渠（\n        同段358 號土地），此觀卷附地籍圖甚明，並經本院勘\n        驗現場無誤，如被告等（被告郭惠研除外）另行施作溝\n        渠使之往北或往東與上開排水溝渠相連接，其農田排水\n        之問題即可解決，並非只有通過被告等所稱之現有排水\n        溝渠始能排水。…」云云，核與事實不符。蓋原審所稱\n        東側之溝渠，較西側田地地勢為高，故系爭現有既有溝\n        渠根本無法排水於此，至於原審所稱西北側之溝渠，係\n        屬灌溉溝渠，並非排水溝渠，且該灌溉溝渠地勢比系爭\n        共有土地及南邊田地、屋宅高，故無法供系爭共有土地\n        及南邊田地、屋宅排水使用。殊不知，原審未查明及此\n        ，遽為被上訴人有利之認定，尚屬有誤。尤甚者；若採\n        用被上訴人所提之分割方案，系爭現有既有溝渠將被廢\n        棄。蓋系爭現有既有溝渠，於上訴人游禎賜23年出生起\n        就有該既成溝渠，且上訴人游禎賜之父游文熙年輕時就\n        有該溝渠，而系爭現有既有溝渠，係供鄰近數甲公頃良\n        田及住宅排水使用，此有證人即大埔里前後里長游祥嘉\n        …等可證。故若採用被上訴人所提分割方案，首當其衝\n        者，上訴人游禎賜及游禎翹、游禎達現耕作之農田，將\n        無法耕作使用，甚至連住宅亦無法排水，益徵被上訴人\n        所提分割方案僅顧一己之私，顯屬不公允。\n      2.再依被上訴人所提分割方案，其分得位置不符合各共有\n        人原本使用各百餘年之現況，且上訴人游禎賜分得之位\n        置即編號丙呈畸零形，顯不利於使用，亦乏土地利用價\n        值公平性。另，上訴人賴彥佑向上訴人游禎賜購買系爭\n        土地持分時，即係要利用上訴人游禎賜所提分割方案編\n        號H東邊現有小通路做為其住宅之出入口，但如依被上\n        訴人所提方案分割，上訴人賴彥佑其住宅將無法通路出\n        入，故亦有不當。詎原審未查明及此，遽認：「…原告\n        及被告郭惠研主張依附圖一所示方案分割，…大致兼顧\n        各共有人占有使用現況，亦使附圖三所示F及B部分之既\n        成巷道較為公平分配於各共有人。…」云云，尚屬有誤\n        。\n      3.被上訴人於98年12月24日言詞辯論期日自承「郭惠研是\n        向蔡瑞讚買土地，蔡瑞讚在賣給我太太之前已經在A、B\n        、C 的部分有填高土地，蔡瑞讚為了要搶建房屋後來法\n        令又規定不可以蓋房子，所以就沒有耕作，我及我太太\n        買了土地持份後有在A、B、C三個部分有種植水果，但\n        是因為土地有被他人倒垃圾，現在我有租給別人作停車\n        場，我種植香蕉6、7年，停車場包含A、B部分，C部分\n        有種過水果，我當初買土地是希望將來能蓋房子。」、\n        「…賣方有告知他（即郭惠研）在使用的是哪壹塊特定\n        的位置，所以我才會種植水果，…」云云，足證系爭被\n        上訴人之配偶郭惠研向其前手購買特定位置（即編號A\n        、B、C），且知其前手為了要搶建房屋，早已在前開位\n        置填高土地；被上訴人之配偶郭惠研當初買土地亦是希\n        望將來能蓋房子。而前開編號A、B、C三個部分土地，\n        被上訴人亦均有在使用，此有前開筆錄可稽。詎於100\n        年6月28日言詞辯論期日時，被上訴人之配偶郭惠研辯\n        稱「…我分配的土地是要耕種…」、「…編號C部分有\n        人耕種，但不知道是誰在使用，不是被上訴人、視同上\n        訴人郭惠研在耕作。」云云；被上訴人及其配偶郭惠研\n        辯稱「否認編號C部分是我們在使用，而且也沒有租人\n        放車子。」、「土地是跟誰買的要看合約書。我是買土\n        地的持份，買土地時賣給我的人沒有告訴我說他用哪幾\n        塊，…編號C部分我們沒有租給別人及放車子，我們只\n        有買持份沒有使用特定部分…」云云，顯為不實之言。\n      4.況被上訴人配偶即視同上訴人郭惠研前手填土石堆高約\n        5 尺高觀之，足見該地現顯非為做為農業耕作之用，且\n        現亦已不能為正常農業耕作之用，此參彰化縣政府於99\n        年3月17日與員林鎮公所及員林地政事務所至現場會勘\n        ，其會勘結論即謂「1.本筆土地包含有稻田區、廢園區\n        、及未辦理保存登記之加強磚造屋、私設巷道、石棉瓦\n        屋，被舖設水泥之球場兼停車場。一部分荒廢未使用之\n        農地被廢棄物及廢土石墊高。2.本案作為農業使用的只\n        有水稻、芋頭區、芭樂、景觀木區及混植區。」足見前\n        開編號A、B、C位置之農地，以前可以從事農業使用，\n        但現已無法從事農業使用，此有本院附卷之會勘紀錄可\n        稽。而前開編號A、B、C 位置使用之情形，被上訴人及\n        其配偶郭惠研於82年1月間即知悉，其會欣然同意購買\n        ，蓋其乃意在日後想利用該地建築之用，根本並非買來\n        務農耕作之用。況查，被上訴人於98年12月24日言詞辯\n        論期日即自承「…我當初買土地是希望將來能蓋房子。\n        」云云，此有本院筆錄記載可稽。是則，前開已不能正\n        常耕作之農地（即編號A、B、C位置），分歸給被上訴\n        人及其配偶即視同上訴人郭惠研依持分比例維持共有取\n        得，乃合情合理、天經地義之事。被上訴人豈可要求將\n        前開無法耕作之農地分歸上訴人（真正務農的共有人）\n        呢？原審判決卻謂「…原告及被告郭惠研主張依附圖一\n        所示方案分割，且依該方案分割，各共有人分得部分較\n        為完整、方正，無細分農地之情形，有利農地之經營、\n        使用，符合農業發展條例第16條之立法意旨，…惟附圖\n        二所示方案不但使原告及被告郭惠研分得部分細分成A\n        、B 、C三筆，…更造成其中編號C部分（面積764.44平\n        方公尺）…之面積在0.25公頃以下，實不利農地之經營\n        、使用，顯與農業發展條例第16條所揭櫫之防止耕地細\n        分、以利農場經營管理之立法意旨不合，…」云云，核\n        與事實不符。蓋被上訴人配偶郭惠研早在82年1月間向\n        其前手購買系爭土地（即上訴人游禎賜在原審所提新乙\n        案編號A、B、C之位置），而該位置在郭惠研購買時早\n        已在數年前填土石堆高約5尺高（約150公分高），致前\n        開編號A、B、C之位置，顯高於鄰近農田，惟郭惠研之\n        前手在填土石堆高時，即已留下當時現有既成溝渠，由\n        此觀之，足見系爭現有既有溝渠確係供鄰近數甲公頃良\n        田及住宅排水使用。況，被上訴人配偶郭惠研前手填土\n        石堆高約5尺高觀之，足見該地顯非為做為農業耕作之\n        用，否則，何以致之？尤甚者，被上訴人夫婦從82年迄\n        今前後近17年之久，從未見被上訴人夫婦在前開編號A\n        、B、C土地上耕種，此於原審現場勘驗即明前開編號A\n        、B、C土地早已荒廢不能耕種使用。益徵原審判決依農\n        業發展條例規定俾讓被上訴人能有利於農地之經營、使\n        用乙節，誠屬緣木求魚。\n      5.倘依上訴人游禎達等人所提分割方案分割，日後被上訴\n        人及其配偶即視同上訴人郭惠研若要由編號A至B，或要\n        由編號B至C位置，上訴人游禎賜及上訴人高志誠（即賴\n        彥佑之承當訴訟人）同意讓渠等設橋通過，但其不能影\n        響或妨礙系爭溝渠排水功能。至於編號D之系爭溝渠，\n        分歸上訴人游禎賜及上訴人高志誠只要是鄰近農地有正\n        常使用系爭溝渠之必要，上訴人游禎賜及上訴人高志誠\n        均同意其使用。\n      6.上訴人游禎達等人修正原第一審所提分割方案，將編號\n        G部分，僅由游禎賜、高志誠、游禎翹、游禎達、游祥\n        湧、游祥啟、游祥顯、游祥源、游美、林游美津等人\n        依應有部分之比例保持共有（其中被上訴人及郭惠研並\n        不用負擔），作為道路使用。是則，即無原審指摘：「\n        …，被告等（被告郭惠研除外）主張之附圖二所示方案\n        ，亦將附圖三所示B部分之既成巷道分歸原告及被告郭\n        惠研取得，何以該方案即不致造成無路可走之情形？…\n        」之缺失。\n      7.若採上訴人游禎達等人所提方案分割，則無前開被上訴\n        人方案之缺點，不僅現有既有溝渠得以保留，讓鄰近數\n        公頃良田及住宅得以排水。且各共有人分得位置，亦符\n        合原本使用之現況位置。而上訴人分得之位置，亦較便\n        於利用。另，上訴人新修正之方案分割，現供公眾使用\n        百餘年之既成道路亦得以保留，俾共有人及附近里民有\n        路可通行。且被上訴人及其配偶郭惠研需負擔巷道之面\n        積為411.97平方公尺，占渠等持分比例為百分之五（即\n        411.97平方公尺÷7963.49平方公尺＝0.0511），而上\n        訴人游禎賜、游禎翹、游禎達、高志誠及游祥湧、游祥\n        啟、游祥顯、游祥源、林游美津等人所需負擔巷道之面\n        積為671.37平方公尺，占渠等持分比例為百分之五（即\n        671.37平方公尺÷13272.51平方公尺＝0.0511），故就\n        負擔巷道面積之部分，如依上訴人游禎達等人所提方案\n        加以分割，對被上訴人及其配偶郭惠研而言，因系爭土\n        地係農地，彼此又係依持分比例分攤，故分攤比例上大\n        致約相符。故被上訴人辯稱被上訴人及其配偶郭惠研負\n        擔巷道之面積為最多云云，恐屬誤會。\n      8.且查，系爭土地為農地，並非建地，且農地之間，本來\n        就有水溝或田埂，而農地每一區塊與每一區塊之間，無\n        論是灌溉或排水用之水溝，或田埂，都是一區塊越過一\n        區塊，並無不能使用之情形。除非將系爭農地違法當作\n        建地使用，否則，系爭農地分割後，並無不能使用之情\n        形。故本件被上訴人及其配偶郭惠研之主張，尚不足採\n        。若採上訴人方案分割，則不僅現有既有溝渠得以保留\n        ，讓鄰近數公頃良田（含員大路南邊之農田流經員大路\n        ，再抵系爭溝渠）及住宅得以排水。且各共有人分得位\n        置，亦符合原本使用之現況位置。而上訴人分得之位置\n        ，亦較便於利用。另，現供公眾使用百餘年之既成道路\n        （即上訴人分割方案編號G部分）亦得以保留，俾供共\n        有人及附近里民出入通行。反之，若採被上訴人方案分\n        割，則不僅現有既有溝渠不能保留，鄰近數公頃良田（\n        含員大路南邊之農田流經員大路，再抵系爭溝渠）及住\n        宅無法排水。且現供公眾使用百餘年之既成道路將被廢\n        棄，共有人及附近里民將無法出入通行。益徵被上訴人\n        所提方案分割，尚非允當。\n      9.綜上所陳，原審判決採用被上訴人所提分割方案，誠屬\n        不當。依上訴人游禎達等人所提方案分割，較符合公平\n        原則，應為較妥適之分割方法等語為辯。並聲明：原\n        判決廢棄。兩造共有系爭土地准予依如附圖一（即員\n        林地政事務所收件日期文號100年7月28日第1354號土地\n        複丈成果圖）所示之方案分割，判決如主文第二項所示\n        。第一、二審訴訟費用由被上訴人負擔。\n    (二)參加人彰化縣員林鎮農會（即上訴人游禎賜之訴訟參加人\n      ）部分：同意上訴人游禎達等人所提如附圖一所示之分割\n      方案。\n    (三)上訴人游祥源、上訴人游祥、視同上訴人游祥顯、視同\n      上訴人游美、視同上訴人游祥湧、視同上訴人林游美津\n      部分：同意依上訴人游禎達等人所提如附圖一所示之方案\n      分割。\n    (四)上訴人高志誠（即賴彥佑之承當訴訟人）部分：同意與上\n      訴人游禎賜分割後依持分比例維持共有，並同意依上訴人\n      游禎達等人所提分割方案分割。\n    (五)視同上訴人郭惠研則以：被上訴人游禎賜等人的方案將視\n      同上訴人郭惠研取得土地分為三塊零散土地，不利於使用\n      ，且有高壓電塔、電纜線，編號C的部分無對外通路且無\n      經濟價值，上訴人游禎賜等人稱水果是視同上訴人郭惠研\n      6 、7年種植，並非事實，香蕉是被上訴人楊金勝及視同\n      上訴人郭惠研跟前手買土地時前手就已經種植其上，香蕉\n      會延生擴大，欲恢復耕作但有困難，排水可以排別的地方\n      ，不一定要照上訴人游禎賜等人方案，希望能維持原判等\n      語。並聲明：上訴駁回。\n  三查本件被上訴人楊金勝起訴主張坐落彰化縣員林鎮○○段11\n    0地號、地目田、面積21,236平方公尺土地，為兩造所共有\n    ，應有部分如附表所示，且兩造間就共有土地不能協議分割\n    ，又無因物之使用目的不能分割，或約定不分割之情形等情\n    ，業據提出土地登記簿謄本為證，復為上訴人及視同上訴人\n    等所不爭執，自堪信為真實。兩造間既無不分割之約定，亦\n    無因物之使用目的不能分割之情形，就分割方法又不能達成\n    協議，故被上訴人訴請准予原物裁判分割，揆諸民法第824\n    條第2項第1款、第5項規定，核無不合，應予准許。\n  四次查，系爭土地為特定農業區農牧用地，為東西短南北狹長\n    之不規則地形，如附圖三所示其中編號A1、B2及H2部分為水\n    溝供做灌溉溝渠使用，編號A2、F及B6部分為現有巷道，編\n    號C部分之鐵造及磚造平房係上訴人游禎賜所有，H部分種植\n    木瓜等蔬菜、編號I部分種植芭樂等，編號A、B、B1及H部分\n    等空地為視同上訴人郭惠研於82年間向前共有人蔡瑞讚購買\n    應有部分時，即由蔡瑞讚於數年前為搶建房屋而填高土地，\n    嗣視同上訴人郭惠研於97年間將應有部分之一部以夫妻贈與\n    為由移轉登記予被上訴人楊金勝，其餘部分為空地則由其他\n    共有人分別耕種使用等情，此有土地登記謄本及異動索引附\n    卷可稽，亦經本院再至現場會同彰化縣員林地政事務所人員\n    履勘測量明確，並製有勘驗筆錄及員林地政事務所收件日期\n    文號99年5月27日第848號土地複丈成果圖（即附圖三）在卷\n    可按，復經被上訴人楊金勝於本院98年12月24日行準備程序\n    時自承：「郭惠研是向蔡瑞讚買土地，蔡瑞讚在賣給我太太\n    之前已經在A、B、C（係指附圖一所示分割方案中之編號A、\n    B、C部分，與附圖三所示編號A、B、B1及H部分係屬同一位\n    置）的部分有填高土地，蔡瑞讚為了要搶建房屋後來法令又\n    規定不可以蓋房子，所以就沒有耕作，我及我太太買了土地\n    持份後有在A、B、C三個部分有種植水果，但是因為土地有\n    被他人倒垃圾，現在我有租給別人作停車場，我種植香蕉6\n    、7年，停車場包含A、B部分，C部分有種過水果，我當初買\n    土地是希望將來能蓋房子。」、「賣方有告知她（指郭惠研\n    ）在使用的是哪壹塊特定的位置，所以我才會種植水果」等\n    語無訛，亦為上訴人及視同上訴人（郭惠研除外）等所不爭\n    執；另本院囑託台灣省測量技師公會鑑測系爭土地相關位置\n    高程點及排水方向，經鑑測結果：…五依據測量系爭土地之\n    各高程點顯示，若不考慮分割方案圖（指附圖三）中A、B、\n    B1、H等區塊之地形業經人為填土而增高部份，就整體而言\n    ，整塊系爭土地係屬南側較高逐向北側漸低之地形走向，故\n    現況水流方向亦顯現自南往北之流向。六本案系爭土地若擬\n    另闢水流溝渠，可自圖內（如附圖四即鑑定報告書之測量成\n    果圖）B區塊南側之G1往G2方向或自G3沿現況路邊往G2方向\n    另闢水流溝漕，惟依地形高低差狀況，僅能導引分割方案圖\n    中C筆地以南之水流，C筆土地以北之水流仍須依現況地形水\n    流方向往北側導流等情，此有台灣省測量技師公會99年8月9\n    日鑑測成果報告書附卷可考，復經鑑定人測量技師周渙文於\n    本院到庭結證：鑑定報告書第六項中「分割方案圖C筆土地\n    」係指員林地政事務所收件日期文號99年5月27日第848號土\n    地複丈成果圖（即附圖三）之編號C部分，依照原審判決分\n    割方案丁、戊部分要另闢水溝往鑑定圖（即附圖四）所述之\n    G2 方向引流，乙、丙部分兩筆土地的水流沒有辦法往G2方\n    向引流，必須要從甲部分這塊土地與丙部分的北側方向走即\n    現況圖現有的水溝B2部分往北流，如果丙、乙部分不走北方\n    B2 部分的水溝引流，廢棄B2部分水溝的話，而另闢水溝會\n    使用到西側別人106、103地號土地，因為附近其他的土地都\n    已經比較高等語屬實，故系爭土地既屬特定農業區農牧用地\n    ，自應考慮分割後各筆土地之排水溝渠可否順利引流以達農\n    地農用之效力，依鑑定人所述附圖三現況圖中C筆土地以北\n    之水流仍須依現況地形水流方向往北側導流，即從原審判決\n    之分割方案中編號甲部分土地與丙部分的北側方向走，故縱\n    使廢棄B2部分之水溝，附圖一所示分割方案中之編號D部分\n    土地仍必需使用編號A或B部分土地來引流排水，否則即需使\n    用鄰地，然各共有人如已得從自有之系爭土地排水，實不得\n    因分割而阻斷系爭土地之排水，轉而向毗鄰之他人土地要求\n    排水權，造成鄰地之不利益，因此分割後如將附圖一所示之\n    編號A、B部分連成一整塊即如原審判決分割方案之甲部份土\n    地，將來分配取得附圖一編號D部分位置之共有人，仍需向\n    分配取得編號A、B部分之共有人請求自然流水之排水權，如\n    採用原審判決之分割方案，屆時取得甲部份土地之共有人亦\n    無法整塊完整使用該筆土地，且因系爭土地北側及東側三分\n    之二土地均分配予被上訴人楊金勝及視同上訴人郭惠研，其\n    他共有人顯無法如原審判決所述得以在系爭土地上另行開闢\n    往北或往東之溝渠，縱被上訴人楊金勝及視同上訴人郭惠研\n    陳稱願提供1米寬之土地供作水溝之用，但水溝留設位置是\n    否足以達到排水目的尚無可知，且此為使用借貸之關係，將\n    來如楊金勝及郭惠研二人將分配取得之土地轉讓他人，他人\n    並不受此使用借貸關係之拘束，如附圖一編號D部分土地仍\n    有產生無法排水糾紛之虞，徒增鄰地所有人間之困擾，蓋系\n    爭土地原來即有如附圖三現況圖所示之編號B2水溝可供附圖\n    一所示編號D部分土地引流排水，自無再另闢其他水溝之必\n    要，因而將附圖三編號B2部分水溝之土地分配予附圖一編號\n    D部分土地共有人取得，實有利於土地之利用，原審判決如\n    附圖二所示之分割方案就關於分割後各筆土地排水問題未通\n    盤考量，尚非允當。\n  五又查，附圖三現況圖所示編號A2、B6及F部分為現有巷道，\n    除供系爭土地共有人通行外，亦作為附近東側多筆鄰地對外\n    聯絡使用，原審判決如附圖二所示分割方案未將上開現有巷\n    道使用系爭土地之部分仍留設做為道路使用，而分配予共有\n    人各自取得，以致該現有巷道土地如仍留作道路使用，將使\n    分配取得道路部分土地之共有人須以自有土地供公眾通行顯\n    為不利，如不再供做道路使用予以圍阻，亦會影響附近鄰地\n    對外之通行聯絡，是原審判決未就此部分予以考量亦有未洽\n    ，上訴人所主張如附圖一所示之分割方案將上開附圖三編號\n    A2 、B6及F部分之現有巷道，劃歸為附圖一所示編號G部分\n    供作道路使用，顯較符合現狀使用之需要。\n  六另附圖一所示編號A、B、C部分雖分割為三塊由被上訴人楊\n    金勝及視同上訴人郭惠研共有取得，惟此三部份於82年間視\n    同上訴人郭惠研向前手買受系爭土地應有部分時即已填高，\n    視同上訴人郭惠研亦係以為得以變更地目，為搶建房屋而買\n    受系爭土地，前手亦將上開部分交付予視同上訴人郭惠研及\n    被上訴人楊金勝使用至今，惟郭惠研之前手雖填高A、B、C\n    部份土地卻仍保留附圖三所示編號B2部分之水溝未填埋，顯\n    然亦知該溝渠有保留之必要，視同上訴人郭惠研及被上訴人\n    楊金勝並非欲作農業使用而買受系爭農地，自應承受前手為\n    搶建房屋填高三塊土地之不利益，況農地中留有溝渠或田埂\n    為常情所見，附圖一所示編號A、B、C等部分之面積達3000\n    及近1000平方公尺，作農業使用並無困難，視同上訴人郭惠\n    研及被上訴人楊金勝以建地搭蓋房屋須完整一塊較好利用之\n    思維來分配使用系爭農地，尚無可採。\n  七再查，系爭土地於89年1月4日農業發展條例第16條修正施行\n    前，共有人為游禎賜、游禎翹、游禎達、郭惠研及游禎等\n    5人，修正施行後，游禎賜於96年間將應有部分之一部以買\n    賣為由移轉登記予賴彥佑（即應有部分0000000分之10975，\n    面積為105.8平方公尺），賴彥佑於99年間將應有部分全部\n    轉賣高志誠，郭惠研於97年間將應有部分之一部，以夫妻贈\n    與為由移轉登記予楊金勝（即應有部分5000分之39，面積為\n    165. 64平方公尺），共有人游禎於97年2月8日死亡，由\n    其繼承人即上訴人游祥啟、游祥源及視同上訴人游祥顯、游\n    美、游祥湧、林游美津等6人，於98年4月13日辦理繼承登\n    記為分別共有等情，此有土地謄本及異動索引足憑，依農業\n    發展條例第16條第2項規定，每宗耕地分割後每人所有面積\n    未達0.25公頃者，不得分割，但有第3款「本條例中華民國\n    八十九年一月四日修正施行後所繼承之耕地，得分割為單獨\n    所有」及第4款「本條例中華民國八十九年一月四日修正施\n    行前之共有耕地，得分割為單獨所有」之情形，不在此限，\n    同條第2項則規定，前項第3款及第4款所定共有耕地，辦理\n    分割為單獨所有者，應先取得共有人之協議或法院確定判決\n    ，其分割後之宗數，不得超過共有人人數。故上訴人賴彥佑\n    及被上訴人楊金勝因係於89年1月4日取得共有土地且面積均\n    未達0.25公頃，故於分割時不得為單獨所有，上訴人賴彥佑\n    仍需與上訴人游禎賜於分割後繼續保持共有，被上訴人楊金\n    勝需與視同上訴人郭惠研於分割後保持共有，惟游禎賜及郭\n    惠研因均係於89年1月4日以前共有系爭耕地，故分割取得之\n    面積不受0.25公頃之限制，另視同上訴人游祥啟、游祥源、\n    游祥顯、游美、游祥湧、林游美津等6人係於89年1月4日\n    以後繼承系爭耕地，因此亦不受最小分割面積之限制得分割\n    為單獨所有，故本件系爭土地分割後之宗數依上開規定可分\n    割為10筆等情，此有彰化縣員林地政事務所98年4月6日員地\n    二字第0980002216號函在卷可考，是附圖一所示之分割方案\n    將系爭土地分割為10筆，未逾上開農業發展條例第16條第2\n    項規定之筆數，而高志誠與游禎賜、楊金勝與郭惠研亦分別\n    維持共有取得，且編號C、D、E、F、J、I及G部分之面積雖\n    未達0.25公頃，但依前揭說明並不受此面積規定之限制，自\n    無違反上開農業發展條例第16條第1項規定之情事，併此敘\n    明。\n  八復按法院定分割方法時，必須考量兩造之利益、意願，由土\n    地上建物現況、各共有人原使用位置、分割後各共有人分得\n    土地之方整及利用價值，予以衡量。經審酌附圖一所示之分\n    割方案兩造分配取得之部分土地，均位於各共有人現占有使\n    用之處，各筆土地亦堪方整有利於使用，並保留現有溝渠以\n    利耕種，且將編號G部分作為道路使用，由兩造（視同上訴\n    人游美除外）保持共有，以利共有人及附近鄰地之通行，\n    另被上訴人楊金勝與視同上訴人郭惠研、上訴人游禎賜與高\n    志誠分別依法仍維持共有關係，視同上訴人游祥啟、游祥源\n    、游祥顯、游美、游祥湧、林游美津等6人表示於分割後\n    願繼續保持共有，因此將附圖一所示編號A、B、C部分由被\n    上訴人楊金勝與視同上訴人郭惠研共有取得，編號D、H 部\n    分由上訴人游禎賜與高志誠共有取得、編號I部分由視同上\n    訴人游祥啟、游祥源、游祥顯、游美、游祥湧、林游美津\n    等6人共有取得，應無不妥，被上訴人楊金勝與視同上訴人\n    郭惠研分配取得之部分雖分為三塊，但此係為使編號D部分\n    土地得以順利自然排水，以免將來產生排水糾紛而為之分割\n    方式，但編號A、B、C部分每塊地形尚屬方整，面積達3000\n    多及近1000平方公尺，縱分為三塊仍無礙於農耕使用，反之\n    原審判決如附圖二所示之分割方案未保留水溝排水，亦未考\n    慮維持現有道路以利通行，實有未洽，故本件改依如附圖一\n    所示之分割方案予以分割，較有利於日後土地利用，應足採\n    用。從而，原審所為之分割方案，既應作上述部分之調整，\n    即有未洽，上訴意旨，指摘原判決不當，求予廢棄改判，為\n    有理由，乃爰判決如主文第二項所示。\n  九末按應有部分有抵押權或質權者，其權利不因共有物之分割\n    而受影響。但有下列情形之一者，其權利移存於抵押人或出\n    質人所分得之部分：一權利人同意分割。二權利人已參加共\n    有物分割訴訟。三權利人經共有人告知訴訟而未參加。前項\n    但書情形，於以價金分配或以金錢補償者，準用第881條第1\n    項、第2項或第899條第1項規定。訴訟之結果，於第三人有\n    法律上利害關係者，法院得於第一審或第二審言詞辯論終結\n    前相當時期，將訴訟事件及進行程度以書面通知該第三人；\n    前項受通知人得於通知送達後5日內，為第242條第1項之請\n    求；第1項受通知人得依第58條規定參加訴訟者，準用前條\n    之規定，民法第824條之1第2、3項、民事訴訟法第67條之1\n    分別定有明文。查本件系爭土地共有人游禎賜於93年3月16\n    日將其應有部份0000000分之815150，設定新台幣650萬元抵\n    押權予訴外人彰化縣員林鎮農會，此有土地登記謄本附卷可\n    稽，業經本院告知抵押權人參加訴訟，故本件土地分割後抵\n    押權人彰化縣員林鎮農會之抵押權應只移存於上訴人游禎賜\n    及高志誠所分得之如附圖一所示編號Ｄ、Ｈ部分土地，併此\n    敘明。\n  十結論：本件上訴為有理由，依民事訴訟法第436條之1第3項\n    、第450條、第463條、第385條第1項前段、第78條、第80條\n    之1、第85條第1項但書、第86條第1項前段，判決如主文。",
    "reason": "壹、程序部分：\n  一按訴訟繫屬中為訴訟標的之法律關係，雖移轉於第三人，於\n    訴訟無影響。但第三人如經兩造同意，得聲請代當事人承當\n    訴訟。前項但書情形，僅他造不同意者，移轉之當事人或第\n    三人得聲請法院以裁定許第三人承當訴訟，民事訴訟法第25\n    4條第1、2項定有明文。查兩造共有坐落彰化縣員林鎮○○\n    段第110號、地目田、面積21,236平方公尺土地，於本件起\n    訴時原共有人登記為游禎賜、游禎翹、游禎達、郭惠研、楊\n    金勝、賴彥佑及游禎（游禎於起訴前已死亡，其應有部\n    分由其繼承人即視同上訴人游祥顯、游美、游祥啟、游祥\n    湧、林游美津、游祥源，於98年4月13日訴訟程序進行中辦\n    理分割繼承登記）等，於訴訟程序進行中，訴外人賴彥佑將\n    其應有部分於98年7月27日移轉讓與上訴人高志誠，並完成\n    登記在案等情，此有系爭土地登記謄本可按，第三人高志誠\n    具狀聲明承當訴訟，惟被上訴人楊金勝不同意，本院於100\n    年6月14日為准予承當訴訟之裁定，因上開裁定未以合議行\n    之，故本院於本案判決時同時裁定許由高志誠為賴彥佑之承\n    當訴訟人，續行訴訟，合先敘明。\n  二本件上訴人高志誠、視同上訴人游祥湧、林游美津、游祥源\n    均受合法通知，未於最後言詞辯論期日到場，核無民事訴訟\n    法第386條各款所列情形，爰依被上訴人之聲請，由其一造\n    辯論而為判決。\n貳、實體部分：\n  一被上訴人楊金勝於起訴時及上訴審主張：\n    (一)兩造共有坐落彰化縣員林鎮○○段110號、地目田、面積2\n      1236平方公尺土地（下稱系爭土地），各人之應有部分如\n      附表所示，該土地無不能分割之情形，兩造間亦無不分割\n      之特約，且就分割方法不能達成協議，爰依民法第823條\n      第1項、第824條第2項規定，請求裁判分割如附圖二（即\n      員林地政事務所複丈日期民國98年1月12日土地複丈成果\n      圖）所示。\n    (二)被上訴人楊金勝之妻即視同上訴人郭惠研向蔡瑞讚買土地\n      前編號A、B、C的部分即有填高土地，蔡瑞讚為搶建房屋\n      ，但又不符合法令規定，只能作罷，因此被上訴人楊金勝\n      與其妻購買時並沒有分編號，希望購買後能興建房屋，雖\n      曾在其上種植水果達6.7年，但是因為土地遭他人傾倒垃\n      圾，現在租給別人作停車場，而購買時應是前手已種植水\n      果於其上，非被上訴人所種植，因為農地要買賣移轉上面\n      必須要種植，被上訴人楊金勝只是承接。\n    (三)上訴人的分割方案對被上訴人不公平，因為被上訴人分配\n      的位置太過分散，希望能分成直線，再者，上訴人游禎賜\n      等人所提分割方案將土地細分，尤其被上訴人及視同上訴\n      人郭惠研二人分得之土地竟零碎細分為三筆，依農業發展\n      條例第16條第1項第4款規定，本案土地於89年1月4日前土\n      地所有權僅有5人，而被上訴人之土地係自視同上訴人郭\n      惠研移轉而來，所以分割後，需二人維持共有，上訴人高\n      志誠之土地持分係自上訴人游禎賜移轉取得，需二人維持\n      共有，上訴人游祥源、上訴人游祥、上訴人游啟祥、視\n      同上訴人游祥顯、視同上訴人游美、視同上訴人游祥湧\n      、視同上訴人林游美津等六人係繼受自被繼承人游禎之\n      土地持分而來，需六人維持共有，縱依同條第1項第3款規\n      定，亦須待六人取得一筆共有土地，才能再行分割，本案\n      僅上訴人游禎達、上訴人游禎翹、上訴人游禎賜各取得單\n      獨一筆土地，換言之，縱經判決准予分割為十筆土地，惟\n      因違反農業發展條例，地政事務所亦無法受理登記。\n    (四)上訴人游禎達等人主張依原審判決所示方案現有道路無法\n      通行，既成道路將無法保留，且會影響鄰近數公頃良田及\n      住宅之排水云云，顯為不實之言，被上訴人早於第一審中\n      所提陳報狀已提出現有道路維持現狀，被上訴人分得之土\n      地再撥出部分土地將現有南側道路拓寬增加2米寬，再撥\n      出1米作為水溝供上訴人游禎賜排水，既不會造成被上訴\n      人分割後土地零散，亦顧慮到上訴人游禎賜達到基本之排\n      水需求，實為一舉三得，且上訴人游禎達等人所提分割方\n      案將被上訴人及視同上訴人郭惠研分得之土地細分為三之\n      肇因乃係水溝，實際上該水溝僅供上訴人游禎賜排水使用\n      ，何來影響數公頃良田及住宅排水，誇大之詞顯不足採，\n      且如前述，被上訴人願提供土地供其水溝改道，實為兩全\n      其美之法。\n    (五)且依原審判決，被上訴人及視同上訴人郭惠研所分得土地\n      上有高壓電塔及電纜線，已嚴重減損土地價值，倘再細分\n      為三筆土地，則更大大降低渠等二人之土地經濟價值及使\n      用效益，更是渠等二人無法集中管理，顯不利於渠等二人\n      。\n    (六)況上訴人游禎達等人所提分割方案，藉由一條約0.26m 至\n      1.5m寬之水溝將被上訴人應分得之土地細分為編號A、B\n      、C，被上訴人如何通行至編號C耕作？假使上訴人游禎賜\n      或其繼受人或承買之第三人築起籬笆或圍牆時，被不利被\n      上訴人通行，則編號C將成為毫無經濟價值之裏地，被上\n      訴人使用上及管理上即生困難。再就排水問題，因為任一\n      分割，因土地高度地形或高或低，縱因天災地辯或地震位\n      移導致土地凸起，或地下水超抽導致地層下陷，土地所有\n      權人須視情況填土或移除土方以利排水、耕作或使用管理\n      ，豈有地形地貌百年不變之理。\n    (七)原審所為判決已兼顧各共有人所分得土地皆臨路、臨排水\n      溝渠，已符合土地分割最基本之需求，且臨路巷道均已為\n      既成巷道，通行數十年之久，任何人皆不得有妨礙他人通\n      行之行為且由各共有人共同負擔巷道持分，尤以被上訴人\n      及視同上訴人郭惠研負擔最多，尚符合公平正義，本件土\n      地數十年來從未訂有不分割協議，亦無訂立分管契約來約\n      定使用位置，歷代各共有人為滿足私心且秉持先佔先贏之\n      理念，爭先占有土地使用至今，被上訴人及視同上訴人郭\n      惠研購買係爭土地持分時，賣方亦僅告知目前可供使用之\n      剩餘土地範圍約略位置，但無論被上訴人有無耕作、如何\n      使用、使用範圍及位置為何，依法各共有人實際分割位置\n      需以將來分割結果為準等情。原審判決兩造共有坐落彰化\n      縣員林鎮○○段110號、地目田、面積21,236平方公尺土\n      地，依如附圖二所示之方案分割，被上訴人於本院為駁回\n      上訴之聲明。\n  二上訴人及視同上訴人則以：\n    (一)上訴人游禎達、游禎翹、游禎賜、賴彥佑部分：\n      1.原審判決謂：「…再者，依附圖一所示方案分割，雖無\n        法保留被告等（被告郭惠研除外）所稱之現有排水溝渠\n        ，但系爭土地東側已有一條與界址線相平行之排水溝渠\n        ，西北側於地籍圖上亦有一條與界址線相平行之溝渠（\n        同段358 號土地），此觀卷附地籍圖甚明，並經本院勘\n        驗現場無誤，如被告等（被告郭惠研除外）另行施作溝\n        渠使之往北或往東與上開排水溝渠相連接，其農田排水\n        之問題即可解決，並非只有通過被告等所稱之現有排水\n        溝渠始能排水。…」云云，核與事實不符。蓋原審所稱\n        東側之溝渠，較西側田地地勢為高，故系爭現有既有溝\n        渠根本無法排水於此，至於原審所稱西北側之溝渠，係\n        屬灌溉溝渠，並非排水溝渠，且該灌溉溝渠地勢比系爭\n        共有土地及南邊田地、屋宅高，故無法供系爭共有土地\n        及南邊田地、屋宅排水使用。殊不知，原審未查明及此\n        ，遽為被上訴人有利之認定，尚屬有誤。尤甚者；若採\n        用被上訴人所提之分割方案，系爭現有既有溝渠將被廢\n        棄。蓋系爭現有既有溝渠，於上訴人游禎賜23年出生起\n        就有該既成溝渠，且上訴人游禎賜之父游文熙年輕時就\n        有該溝渠，而系爭現有既有溝渠，係供鄰近數甲公頃良\n        田及住宅排水使用，此有證人即大埔里前後里長游祥嘉\n        …等可證。故若採用被上訴人所提分割方案，首當其衝\n        者，上訴人游禎賜及游禎翹、游禎達現耕作之農田，將\n        無法耕作使用，甚至連住宅亦無法排水，益徵被上訴人\n        所提分割方案僅顧一己之私，顯屬不公允。\n      2.再依被上訴人所提分割方案，其分得位置不符合各共有\n        人原本使用各百餘年之現況，且上訴人游禎賜分得之位\n        置即編號丙呈畸零形，顯不利於使用，亦乏土地利用價\n        值公平性。另，上訴人賴彥佑向上訴人游禎賜購買系爭\n        土地持分時，即係要利用上訴人游禎賜所提分割方案編\n        號H東邊現有小通路做為其住宅之出入口，但如依被上\n        訴人所提方案分割，上訴人賴彥佑其住宅將無法通路出\n        入，故亦有不當。詎原審未查明及此，遽認：「…原告\n        及被告郭惠研主張依附圖一所示方案分割，…大致兼顧\n        各共有人占有使用現況，亦使附圖三所示F及B部分之既\n        成巷道較為公平分配於各共有人。…」云云，尚屬有誤\n        。\n      3.被上訴人於98年12月24日言詞辯論期日自承「郭惠研是\n        向蔡瑞讚買土地，蔡瑞讚在賣給我太太之前已經在A、B\n        、C 的部分有填高土地，蔡瑞讚為了要搶建房屋後來法\n        令又規定不可以蓋房子，所以就沒有耕作，我及我太太\n        買了土地持份後有在A、B、C三個部分有種植水果，但\n        是因為土地有被他人倒垃圾，現在我有租給別人作停車\n        場，我種植香蕉6、7年，停車場包含A、B部分，C部分\n        有種過水果，我當初買土地是希望將來能蓋房子。」、\n        「…賣方有告知他（即郭惠研）在使用的是哪壹塊特定\n        的位置，所以我才會種植水果，…」云云，足證系爭被\n        上訴人之配偶郭惠研向其前手購買特定位置（即編號A\n        、B、C），且知其前手為了要搶建房屋，早已在前開位\n        置填高土地；被上訴人之配偶郭惠研當初買土地亦是希\n        望將來能蓋房子。而前開編號A、B、C三個部分土地，\n        被上訴人亦均有在使用，此有前開筆錄可稽。詎於100\n        年6月28日言詞辯論期日時，被上訴人之配偶郭惠研辯\n        稱「…我分配的土地是要耕種…」、「…編號C部分有\n        人耕種，但不知道是誰在使用，不是被上訴人、視同上\n        訴人郭惠研在耕作。」云云；被上訴人及其配偶郭惠研\n        辯稱「否認編號C部分是我們在使用，而且也沒有租人\n        放車子。」、「土地是跟誰買的要看合約書。我是買土\n        地的持份，買土地時賣給我的人沒有告訴我說他用哪幾\n        塊，…編號C部分我們沒有租給別人及放車子，我們只\n        有買持份沒有使用特定部分…」云云，顯為不實之言。\n      4.況被上訴人配偶即視同上訴人郭惠研前手填土石堆高約\n        5 尺高觀之，足見該地現顯非為做為農業耕作之用，且\n        現亦已不能為正常農業耕作之用，此參彰化縣政府於99\n        年3月17日與員林鎮公所及員林地政事務所至現場會勘\n        ，其會勘結論即謂「1.本筆土地包含有稻田區、廢園區\n        、及未辦理保存登記之加強磚造屋、私設巷道、石棉瓦\n        屋，被舖設水泥之球場兼停車場。一部分荒廢未使用之\n        農地被廢棄物及廢土石墊高。2.本案作為農業使用的只\n        有水稻、芋頭區、芭樂、景觀木區及混植區。」足見前\n        開編號A、B、C位置之農地，以前可以從事農業使用，\n        但現已無法從事農業使用，此有本院附卷之會勘紀錄可\n        稽。而前開編號A、B、C 位置使用之情形，被上訴人及\n        其配偶郭惠研於82年1月間即知悉，其會欣然同意購買\n        ，蓋其乃意在日後想利用該地建築之用，根本並非買來\n        務農耕作之用。況查，被上訴人於98年12月24日言詞辯\n        論期日即自承「…我當初買土地是希望將來能蓋房子。\n        」云云，此有本院筆錄記載可稽。是則，前開已不能正\n        常耕作之農地（即編號A、B、C位置），分歸給被上訴\n        人及其配偶即視同上訴人郭惠研依持分比例維持共有取\n        得，乃合情合理、天經地義之事。被上訴人豈可要求將\n        前開無法耕作之農地分歸上訴人（真正務農的共有人）\n        呢？原審判決卻謂「…原告及被告郭惠研主張依附圖一\n        所示方案分割，且依該方案分割，各共有人分得部分較\n        為完整、方正，無細分農地之情形，有利農地之經營、\n        使用，符合農業發展條例第16條之立法意旨，…惟附圖\n        二所示方案不但使原告及被告郭惠研分得部分細分成A\n        、B 、C三筆，…更造成其中編號C部分（面積764.44平\n        方公尺）…之面積在0.25公頃以下，實不利農地之經營\n        、使用，顯與農業發展條例第16條所揭櫫之防止耕地細\n        分、以利農場經營管理之立法意旨不合，…」云云，核\n        與事實不符。蓋被上訴人配偶郭惠研早在82年1月間向\n        其前手購買系爭土地（即上訴人游禎賜在原審所提新乙\n        案編號A、B、C之位置），而該位置在郭惠研購買時早\n        已在數年前填土石堆高約5尺高（約150公分高），致前\n        開編號A、B、C之位置，顯高於鄰近農田，惟郭惠研之\n        前手在填土石堆高時，即已留下當時現有既成溝渠，由\n        此觀之，足見系爭現有既有溝渠確係供鄰近數甲公頃良\n        田及住宅排水使用。況，被上訴人配偶郭惠研前手填土\n        石堆高約5尺高觀之，足見該地顯非為做為農業耕作之\n        用，否則，何以致之？尤甚者，被上訴人夫婦從82年迄\n        今前後近17年之久，從未見被上訴人夫婦在前開編號A\n        、B、C土地上耕種，此於原審現場勘驗即明前開編號A\n        、B、C土地早已荒廢不能耕種使用。益徵原審判決依農\n        業發展條例規定俾讓被上訴人能有利於農地之經營、使\n        用乙節，誠屬緣木求魚。\n      5.倘依上訴人游禎達等人所提分割方案分割，日後被上訴\n        人及其配偶即視同上訴人郭惠研若要由編號A至B，或要\n        由編號B至C位置，上訴人游禎賜及上訴人高志誠（即賴\n        彥佑之承當訴訟人）同意讓渠等設橋通過，但其不能影\n        響或妨礙系爭溝渠排水功能。至於編號D之系爭溝渠，\n        分歸上訴人游禎賜及上訴人高志誠只要是鄰近農地有正\n        常使用系爭溝渠之必要，上訴人游禎賜及上訴人高志誠\n        均同意其使用。\n      6.上訴人游禎達等人修正原第一審所提分割方案，將編號\n        G部分，僅由游禎賜、高志誠、游禎翹、游禎達、游祥\n        湧、游祥啟、游祥顯、游祥源、游美、林游美津等人\n        依應有部分之比例保持共有（其中被上訴人及郭惠研並\n        不用負擔），作為道路使用。是則，即無原審指摘：「\n        …，被告等（被告郭惠研除外）主張之附圖二所示方案\n        ，亦將附圖三所示B部分之既成巷道分歸原告及被告郭\n        惠研取得，何以該方案即不致造成無路可走之情形？…\n        」之缺失。\n      7.若採上訴人游禎達等人所提方案分割，則無前開被上訴\n        人方案之缺點，不僅現有既有溝渠得以保留，讓鄰近數\n        公頃良田及住宅得以排水。且各共有人分得位置，亦符\n        合原本使用之現況位置。而上訴人分得之位置，亦較便\n        於利用。另，上訴人新修正之方案分割，現供公眾使用\n        百餘年之既成道路亦得以保留，俾共有人及附近里民有\n        路可通行。且被上訴人及其配偶郭惠研需負擔巷道之面\n        積為411.97平方公尺，占渠等持分比例為百分之五（即\n        411.97平方公尺÷7963.49平方公尺＝0.0511），而上\n        訴人游禎賜、游禎翹、游禎達、高志誠及游祥湧、游祥\n        啟、游祥顯、游祥源、林游美津等人所需負擔巷道之面\n        積為671.37平方公尺，占渠等持分比例為百分之五（即\n        671.37平方公尺÷13272.51平方公尺＝0.0511），故就\n        負擔巷道面積之部分，如依上訴人游禎達等人所提方案\n        加以分割，對被上訴人及其配偶郭惠研而言，因系爭土\n        地係農地，彼此又係依持分比例分攤，故分攤比例上大\n        致約相符。故被上訴人辯稱被上訴人及其配偶郭惠研負\n        擔巷道之面積為最多云云，恐屬誤會。\n      8.且查，系爭土地為農地，並非建地，且農地之間，本來\n        就有水溝或田埂，而農地每一區塊與每一區塊之間，無\n        論是灌溉或排水用之水溝，或田埂，都是一區塊越過一\n        區塊，並無不能使用之情形。除非將系爭農地違法當作\n        建地使用，否則，系爭農地分割後，並無不能使用之情\n        形。故本件被上訴人及其配偶郭惠研之主張，尚不足採\n        。若採上訴人方案分割，則不僅現有既有溝渠得以保留\n        ，讓鄰近數公頃良田（含員大路南邊之農田流經員大路\n        ，再抵系爭溝渠）及住宅得以排水。且各共有人分得位\n        置，亦符合原本使用之現況位置。而上訴人分得之位置\n        ，亦較便於利用。另，現供公眾使用百餘年之既成道路\n        （即上訴人分割方案編號G部分）亦得以保留，俾供共\n        有人及附近里民出入通行。反之，若採被上訴人方案分\n        割，則不僅現有既有溝渠不能保留，鄰近數公頃良田（\n        含員大路南邊之農田流經員大路，再抵系爭溝渠）及住\n        宅無法排水。且現供公眾使用百餘年之既成道路將被廢\n        棄，共有人及附近里民將無法出入通行。益徵被上訴人\n        所提方案分割，尚非允當。\n      9.綜上所陳，原審判決採用被上訴人所提分割方案，誠屬\n        不當。依上訴人游禎達等人所提方案分割，較符合公平\n        原則，應為較妥適之分割方法等語為辯。並聲明：原\n        判決廢棄。兩造共有系爭土地准予依如附圖一（即員\n        林地政事務所收件日期文號100年7月28日第1354號土地\n        複丈成果圖）所示之方案分割，判決如主文第二項所示\n        。第一、二審訴訟費用由被上訴人負擔。\n    (二)參加人彰化縣員林鎮農會（即上訴人游禎賜之訴訟參加人\n      ）部分：同意上訴人游禎達等人所提如附圖一所示之分割\n      方案。\n    (三)上訴人游祥源、上訴人游祥、視同上訴人游祥顯、視同\n      上訴人游美、視同上訴人游祥湧、視同上訴人林游美津\n      部分：同意依上訴人游禎達等人所提如附圖一所示之方案\n      分割。\n    (四)上訴人高志誠（即賴彥佑之承當訴訟人）部分：同意與上\n      訴人游禎賜分割後依持分比例維持共有，並同意依上訴人\n      游禎達等人所提分割方案分割。\n    (五)視同上訴人郭惠研則以：被上訴人游禎賜等人的方案將視\n      同上訴人郭惠研取得土地分為三塊零散土地，不利於使用\n      ，且有高壓電塔、電纜線，編號C的部分無對外通路且無\n      經濟價值，上訴人游禎賜等人稱水果是視同上訴人郭惠研\n      6 、7年種植，並非事實，香蕉是被上訴人楊金勝及視同\n      上訴人郭惠研跟前手買土地時前手就已經種植其上，香蕉\n      會延生擴大，欲恢復耕作但有困難，排水可以排別的地方\n      ，不一定要照上訴人游禎賜等人方案，希望能維持原判等\n      語。並聲明：上訴駁回。\n  三查本件被上訴人楊金勝起訴主張坐落彰化縣員林鎮○○段11\n    0地號、地目田、面積21,236平方公尺土地，為兩造所共有\n    ，應有部分如附表所示，且兩造間就共有土地不能協議分割\n    ，又無因物之使用目的不能分割，或約定不分割之情形等情\n    ，業據提出土地登記簿謄本為證，復為上訴人及視同上訴人\n    等所不爭執，自堪信為真實。兩造間既無不分割之約定，亦\n    無因物之使用目的不能分割之情形，就分割方法又不能達成\n    協議，故被上訴人訴請准予原物裁判分割，揆諸民法第824\n    條第2項第1款、第5項規定，核無不合，應予准許。\n  四次查，系爭土地為特定農業區農牧用地，為東西短南北狹長\n    之不規則地形，如附圖三所示其中編號A1、B2及H2部分為水\n    溝供做灌溉溝渠使用，編號A2、F及B6部分為現有巷道，編\n    號C部分之鐵造及磚造平房係上訴人游禎賜所有，H部分種植\n    木瓜等蔬菜、編號I部分種植芭樂等，編號A、B、B1及H部分\n    等空地為視同上訴人郭惠研於82年間向前共有人蔡瑞讚購買\n    應有部分時，即由蔡瑞讚於數年前為搶建房屋而填高土地，\n    嗣視同上訴人郭惠研於97年間將應有部分之一部以夫妻贈與\n    為由移轉登記予被上訴人楊金勝，其餘部分為空地則由其他\n    共有人分別耕種使用等情，此有土地登記謄本及異動索引附\n    卷可稽，亦經本院再至現場會同彰化縣員林地政事務所人員\n    履勘測量明確，並製有勘驗筆錄及員林地政事務所收件日期\n    文號99年5月27日第848號土地複丈成果圖（即附圖三）在卷\n    可按，復經被上訴人楊金勝於本院98年12月24日行準備程序\n    時自承：「郭惠研是向蔡瑞讚買土地，蔡瑞讚在賣給我太太\n    之前已經在A、B、C（係指附圖一所示分割方案中之編號A、\n    B、C部分，與附圖三所示編號A、B、B1及H部分係屬同一位\n    置）的部分有填高土地，蔡瑞讚為了要搶建房屋後來法令又\n    規定不可以蓋房子，所以就沒有耕作，我及我太太買了土地\n    持份後有在A、B、C三個部分有種植水果，但是因為土地有\n    被他人倒垃圾，現在我有租給別人作停車場，我種植香蕉6\n    、7年，停車場包含A、B部分，C部分有種過水果，我當初買\n    土地是希望將來能蓋房子。」、「賣方有告知她（指郭惠研\n    ）在使用的是哪壹塊特定的位置，所以我才會種植水果」等\n    語無訛，亦為上訴人及視同上訴人（郭惠研除外）等所不爭\n    執；另本院囑託台灣省測量技師公會鑑測系爭土地相關位置\n    高程點及排水方向，經鑑測結果：…五依據測量系爭土地之\n    各高程點顯示，若不考慮分割方案圖（指附圖三）中A、B、\n    B1、H等區塊之地形業經人為填土而增高部份，就整體而言\n    ，整塊系爭土地係屬南側較高逐向北側漸低之地形走向，故\n    現況水流方向亦顯現自南往北之流向。六本案系爭土地若擬\n    另闢水流溝渠，可自圖內（如附圖四即鑑定報告書之測量成\n    果圖）B區塊南側之G1往G2方向或自G3沿現況路邊往G2方向\n    另闢水流溝漕，惟依地形高低差狀況，僅能導引分割方案圖\n    中C筆地以南之水流，C筆土地以北之水流仍須依現況地形水\n    流方向往北側導流等情，此有台灣省測量技師公會99年8月9\n    日鑑測成果報告書附卷可考，復經鑑定人測量技師周渙文於\n    本院到庭結證：鑑定報告書第六項中「分割方案圖C筆土地\n    」係指員林地政事務所收件日期文號99年5月27日第848號土\n    地複丈成果圖（即附圖三）之編號C部分，依照原審判決分\n    割方案丁、戊部分要另闢水溝往鑑定圖（即附圖四）所述之\n    G2 方向引流，乙、丙部分兩筆土地的水流沒有辦法往G2方\n    向引流，必須要從甲部分這塊土地與丙部分的北側方向走即\n    現況圖現有的水溝B2部分往北流，如果丙、乙部分不走北方\n    B2 部分的水溝引流，廢棄B2部分水溝的話，而另闢水溝會\n    使用到西側別人106、103地號土地，因為附近其他的土地都\n    已經比較高等語屬實，故系爭土地既屬特定農業區農牧用地\n    ，自應考慮分割後各筆土地之排水溝渠可否順利引流以達農\n    地農用之效力，依鑑定人所述附圖三現況圖中C筆土地以北\n    之水流仍須依現況地形水流方向往北側導流，即從原審判決\n    之分割方案中編號甲部分土地與丙部分的北側方向走，故縱\n    使廢棄B2部分之水溝，附圖一所示分割方案中之編號D部分\n    土地仍必需使用編號A或B部分土地來引流排水，否則即需使\n    用鄰地，然各共有人如已得從自有之系爭土地排水，實不得\n    因分割而阻斷系爭土地之排水，轉而向毗鄰之他人土地要求\n    排水權，造成鄰地之不利益，因此分割後如將附圖一所示之\n    編號A、B部分連成一整塊即如原審判決分割方案之甲部份土\n    地，將來分配取得附圖一編號D部分位置之共有人，仍需向\n    分配取得編號A、B部分之共有人請求自然流水之排水權，如\n    採用原審判決之分割方案，屆時取得甲部份土地之共有人亦\n    無法整塊完整使用該筆土地，且因系爭土地北側及東側三分\n    之二土地均分配予被上訴人楊金勝及視同上訴人郭惠研，其\n    他共有人顯無法如原審判決所述得以在系爭土地上另行開闢\n    往北或往東之溝渠，縱被上訴人楊金勝及視同上訴人郭惠研\n    陳稱願提供1米寬之土地供作水溝之用，但水溝留設位置是\n    否足以達到排水目的尚無可知，且此為使用借貸之關係，將\n    來如楊金勝及郭惠研二人將分配取得之土地轉讓他人，他人\n    並不受此使用借貸關係之拘束，如附圖一編號D部分土地仍\n    有產生無法排水糾紛之虞，徒增鄰地所有人間之困擾，蓋系\n    爭土地原來即有如附圖三現況圖所示之編號B2水溝可供附圖\n    一所示編號D部分土地引流排水，自無再另闢其他水溝之必\n    要，因而將附圖三編號B2部分水溝之土地分配予附圖一編號\n    D部分土地共有人取得，實有利於土地之利用，原審判決如\n    附圖二所示之分割方案就關於分割後各筆土地排水問題未通\n    盤考量，尚非允當。\n  五又查，附圖三現況圖所示編號A2、B6及F部分為現有巷道，\n    除供系爭土地共有人通行外，亦作為附近東側多筆鄰地對外\n    聯絡使用，原審判決如附圖二所示分割方案未將上開現有巷\n    道使用系爭土地之部分仍留設做為道路使用，而分配予共有\n    人各自取得，以致該現有巷道土地如仍留作道路使用，將使\n    分配取得道路部分土地之共有人須以自有土地供公眾通行顯\n    為不利，如不再供做道路使用予以圍阻，亦會影響附近鄰地\n    對外之通行聯絡，是原審判決未就此部分予以考量亦有未洽\n    ，上訴人所主張如附圖一所示之分割方案將上開附圖三編號\n    A2 、B6及F部分之現有巷道，劃歸為附圖一所示編號G部分\n    供作道路使用，顯較符合現狀使用之需要。\n  六另附圖一所示編號A、B、C部分雖分割為三塊由被上訴人楊\n    金勝及視同上訴人郭惠研共有取得，惟此三部份於82年間視\n    同上訴人郭惠研向前手買受系爭土地應有部分時即已填高，\n    視同上訴人郭惠研亦係以為得以變更地目，為搶建房屋而買\n    受系爭土地，前手亦將上開部分交付予視同上訴人郭惠研及\n    被上訴人楊金勝使用至今，惟郭惠研之前手雖填高A、B、C\n    部份土地卻仍保留附圖三所示編號B2部分之水溝未填埋，顯\n    然亦知該溝渠有保留之必要，視同上訴人郭惠研及被上訴人\n    楊金勝並非欲作農業使用而買受系爭農地，自應承受前手為\n    搶建房屋填高三塊土地之不利益，況農地中留有溝渠或田埂\n    為常情所見，附圖一所示編號A、B、C等部分之面積達3000\n    及近1000平方公尺，作農業使用並無困難，視同上訴人郭惠\n    研及被上訴人楊金勝以建地搭蓋房屋須完整一塊較好利用之\n    思維來分配使用系爭農地，尚無可採。\n  七再查，系爭土地於89年1月4日農業發展條例第16條修正施行\n    前，共有人為游禎賜、游禎翹、游禎達、郭惠研及游禎等\n    5人，修正施行後，游禎賜於96年間將應有部分之一部以買\n    賣為由移轉登記予賴彥佑（即應有部分0000000分之10975，\n    面積為105.8平方公尺），賴彥佑於99年間將應有部分全部\n    轉賣高志誠，郭惠研於97年間將應有部分之一部，以夫妻贈\n    與為由移轉登記予楊金勝（即應有部分5000分之39，面積為\n    165. 64平方公尺），共有人游禎於97年2月8日死亡，由\n    其繼承人即上訴人游祥啟、游祥源及視同上訴人游祥顯、游\n    美、游祥湧、林游美津等6人，於98年4月13日辦理繼承登\n    記為分別共有等情，此有土地謄本及異動索引足憑，依農業\n    發展條例第16條第2項規定，每宗耕地分割後每人所有面積\n    未達0.25公頃者，不得分割，但有第3款「本條例中華民國\n    八十九年一月四日修正施行後所繼承之耕地，得分割為單獨\n    所有」及第4款「本條例中華民國八十九年一月四日修正施\n    行前之共有耕地，得分割為單獨所有」之情形，不在此限，\n    同條第2項則規定，前項第3款及第4款所定共有耕地，辦理\n    分割為單獨所有者，應先取得共有人之協議或法院確定判決\n    ，其分割後之宗數，不得超過共有人人數。故上訴人賴彥佑\n    及被上訴人楊金勝因係於89年1月4日取得共有土地且面積均\n    未達0.25公頃，故於分割時不得為單獨所有，上訴人賴彥佑\n    仍需與上訴人游禎賜於分割後繼續保持共有，被上訴人楊金\n    勝需與視同上訴人郭惠研於分割後保持共有，惟游禎賜及郭\n    惠研因均係於89年1月4日以前共有系爭耕地，故分割取得之\n    面積不受0.25公頃之限制，另視同上訴人游祥啟、游祥源、\n    游祥顯、游美、游祥湧、林游美津等6人係於89年1月4日\n    以後繼承系爭耕地，因此亦不受最小分割面積之限制得分割\n    為單獨所有，故本件系爭土地分割後之宗數依上開規定可分\n    割為10筆等情，此有彰化縣員林地政事務所98年4月6日員地\n    二字第0980002216號函在卷可考，是附圖一所示之分割方案\n    將系爭土地分割為10筆，未逾上開農業發展條例第16條第2\n    項規定之筆數，而高志誠與游禎賜、楊金勝與郭惠研亦分別\n    維持共有取得，且編號C、D、E、F、J、I及G部分之面積雖\n    未達0.25公頃，但依前揭說明並不受此面積規定之限制，自\n    無違反上開農業發展條例第16條第1項規定之情事，併此敘\n    明。\n  八復按法院定分割方法時，必須考量兩造之利益、意願，由土\n    地上建物現況、各共有人原使用位置、分割後各共有人分得\n    土地之方整及利用價值，予以衡量。經審酌附圖一所示之分\n    割方案兩造分配取得之部分土地，均位於各共有人現占有使\n    用之處，各筆土地亦堪方整有利於使用，並保留現有溝渠以\n    利耕種，且將編號G部分作為道路使用，由兩造（視同上訴\n    人游美除外）保持共有，以利共有人及附近鄰地之通行，\n    另被上訴人楊金勝與視同上訴人郭惠研、上訴人游禎賜與高\n    志誠分別依法仍維持共有關係，視同上訴人游祥啟、游祥源\n    、游祥顯、游美、游祥湧、林游美津等6人表示於分割後\n    願繼續保持共有，因此將附圖一所示編號A、B、C部分由被\n    上訴人楊金勝與視同上訴人郭惠研共有取得，編號D、H 部\n    分由上訴人游禎賜與高志誠共有取得、編號I部分由視同上\n    訴人游祥啟、游祥源、游祥顯、游美、游祥湧、林游美津\n    等6人共有取得，應無不妥，被上訴人楊金勝與視同上訴人\n    郭惠研分配取得之部分雖分為三塊，但此係為使編號D部分\n    土地得以順利自然排水，以免將來產生排水糾紛而為之分割\n    方式，但編號A、B、C部分每塊地形尚屬方整，面積達3000\n    多及近1000平方公尺，縱分為三塊仍無礙於農耕使用，反之\n    原審判決如附圖二所示之分割方案未保留水溝排水，亦未考\n    慮維持現有道路以利通行，實有未洽，故本件改依如附圖一\n    所示之分割方案予以分割，較有利於日後土地利用，應足採\n    用。從而，原審所為之分割方案，既應作上述部分之調整，\n    即有未洽，上訴意旨，指摘原判決不當，求予廢棄改判，為\n    有理由，乃爰判決如主文第二項所示。\n  九末按應有部分有抵押權或質權者，其權利不因共有物之分割\n    而受影響。但有下列情形之一者，其權利移存於抵押人或出\n    質人所分得之部分：一權利人同意分割。二權利人已參加共\n    有物分割訴訟。三權利人經共有人告知訴訟而未參加。前項\n    但書情形，於以價金分配或以金錢補償者，準用第881條第1\n    項、第2項或第899條第1項規定。訴訟之結果，於第三人有\n    法律上利害關係者，法院得於第一審或第二審言詞辯論終結\n    前相當時期，將訴訟事件及進行程度以書面通知該第三人；\n    前項受通知人得於通知送達後5日內，為第242條第1項之請\n    求；第1項受通知人得依第58條規定參加訴訟者，準用前條\n    之規定，民法第824條之1第2、3項、民事訴訟法第67條之1\n    分別定有明文。查本件系爭土地共有人游禎賜於93年3月16\n    日將其應有部份0000000分之815150，設定新台幣650萬元抵\n    押權予訴外人彰化縣員林鎮農會，此有土地登記謄本附卷可\n    稽，業經本院告知抵押權人參加訴訟，故本件土地分割後抵\n    押權人彰化縣員林鎮農會之抵押權應只移存於上訴人游禎賜\n    及高志誠所分得之如附圖一所示編號Ｄ、Ｈ部分土地，併此\n    敘明。\n  十結論：本件上訴為有理由，依民事訴訟法第436條之1第3項\n    、第450條、第463條、第385條第1項前段、第78條、第80條\n    之1、第85條第1項但書、第86條第1項前段，判決如主文。"
  },
  "search": "臺灣彰化地方法院民事判決98年度簡上字第152號上訴人游禎賜訴訟代理人游祥棵上訴人游禎翹游禎達上三人共同訴訟代理人胡宗智律師複代理人邱寶弘律師上訴人高志誠（即賴彥佑之承當訴訟人）訴訟代理人徐秋秀視同上訴人游祥顯巷8弄5號視同上訴人游美巷16弄14號上訴人兼上二人共同訴訟代理人游祥啟巷8弄5號視同上訴人游祥湧2弄23號視同上訴人林游美津上訴人兼上二人共同訴訟代理人游祥源巷16弄14號視同上訴人郭惠研被上訴人楊金勝訴訟參加人彰化縣員林鎮農會法定代理人張永府訴訟代理人蕭志雄上列當事人間請求分割共有物事件，上訴人對於民國98年11月3日本院員林簡易庭第一審判決（98年度員簡字第43號），提起上訴，本院於民國100年10月11日言詞辯論終結，判決如下：主文原判決廢棄。兩造共有坐落彰化縣員林鎮○○段第110號、地目田、面積21,236平方公尺土地，其分割方法為如附圖一（即彰化縣員林地政事務所收件日期文號民國100年7月28日第1354號土地複丈成果圖）所示：編號Ａ、Ｂ、Ｃ部分面積依序為3106.95、3445.45、999.13平方公尺分歸被上訴人楊金勝及視同上訴人郭惠研按原應有部分比例共同取得，編號Ｄ、Ｈ部分面積依序為2057.99、5493.52平方公尺分歸上訴人游禎賜、高志誠按原應有部分比例共同取得，編號Ｅ部分面積1678.12平方公尺分歸上訴人游禎翹取得，編號Ｆ、Ｊ部分面積依序為1009.23、668.89平方公尺分歸上訴人游禎達取得，編號Ｉ部分面積1693.38平方公尺分歸視同上訴人游祥湧、游祥啟、游祥顯、游祥源、游美、林游美津按原應有部分比例共同取得，編號Ｇ部分面積1083.34平方公尺分歸上訴人游禎賜、高志誠、游禎翹、游禎達、視同上訴人游祥湧、游祥啟、游祥顯、游祥源、林游美津、郭惠研及被上訴人楊金勝按原應有部分比例共同取得。第一、二審訴訟費用由兩造按附表所示應有部分之比例負擔。參加人之訴訟費用由參加人負擔。事實及理由壹、程序部分：一按訴訟繫屬中為訴訟標的之法律關係，雖移轉於第三人，於訴訟無影響。但第三人如經兩造同意，得聲請代當事人承當訴訟。前項但書情形，僅他造不同意者，移轉之當事人或第三人得聲請法院以裁定許第三人承當訴訟，民事訴訟法第254條第1、2項定有明文。查兩造共有坐落彰化縣員林鎮○○段第110號、地目田、面積21,236平方公尺土地，於本件起訴時原共有人登記為游禎賜、游禎翹、游禎達、郭惠研、楊金勝、賴彥佑及游禎（游禎於起訴前已死亡，其應有部分由其繼承人即視同上訴人游祥顯、游美、游祥啟、游祥湧、林游美津、游祥源，於98年4月13日訴訟程序進行中辦理分割繼承登記）等，於訴訟程序進行中，訴外人賴彥佑將其應有部分於98年7月27日移轉讓與上訴人高志誠，並完成登記在案等情，此有系爭土地登記謄本可按，第三人高志誠具狀聲明承當訴訟，惟被上訴人楊金勝不同意，本院於100年6月14日為准予承當訴訟之裁定，因上開裁定未以合議行之，故本院於本案判決時同時裁定許由高志誠為賴彥佑之承當訴訟人，續行訴訟，合先敘明。二本件上訴人高志誠、視同上訴人游祥湧、林游美津、游祥源均受合法通知，未於最後言詞辯論期日到場，核無民事訴訟法第386條各款所列情形，爰依被上訴人之聲請，由其一造辯論而為判決。貳、實體部分：一被上訴人楊金勝於起訴時及上訴審主張：(一)兩造共有坐落彰化縣員林鎮○○段110號、地目田、面積21236平方公尺土地（下稱系爭土地），各人之應有部分如附表所示，該土地無不能分割之情形，兩造間亦無不分割之特約，且就分割方法不能達成協議，爰依民法第823條第1項、第824條第2項規定，請求裁判分割如附圖二（即員林地政事務所複丈日期民國98年1月12日土地複丈成果圖）所示。(二)被上訴人楊金勝之妻即視同上訴人郭惠研向蔡瑞讚買土地前編號A、B、C的部分即有填高土地，蔡瑞讚為搶建房屋，但又不符合法令規定，只能作罷，因此被上訴人楊金勝與其妻購買時並沒有分編號，希望購買後能興建房屋，雖曾在其上種植水果達6.7年，但是因為土地遭他人傾倒垃圾，現在租給別人作停車場，而購買時應是前手已種植水果於其上，非被上訴人所種植，因為農地要買賣移轉上面必須要種植，被上訴人楊金勝只是承接。(三)上訴人的分割方案對被上訴人不公平，因為被上訴人分配的位置太過分散，希望能分成直線，再者，上訴人游禎賜等人所提分割方案將土地細分，尤其被上訴人及視同上訴人郭惠研二人分得之土地竟零碎細分為三筆，依農業發展條例第16條第1項第4款規定，本案土地於89年1月4日前土地所有權僅有5人，而被上訴人之土地係自視同上訴人郭惠研移轉而來，所以分割後，需二人維持共有，上訴人高志誠之土地持分係自上訴人游禎賜移轉取得，需二人維持共有，上訴人游祥源、上訴人游祥、上訴人游啟祥、視同上訴人游祥顯、視同上訴人游美、視同上訴人游祥湧、視同上訴人林游美津等六人係繼受自被繼承人游禎之土地持分而來，需六人維持共有，縱依同條第1項第3款規定，亦須待六人取得一筆共有土地，才能再行分割，本案僅上訴人游禎達、上訴人游禎翹、上訴人游禎賜各取得單獨一筆土地，換言之，縱經判決准予分割為十筆土地，惟因違反農業發展條例，地政事務所亦無法受理登記。(四)上訴人游禎達等人主張依原審判決所示方案現有道路無法通行，既成道路將無法保留，且會影響鄰近數公頃良田及住宅之排水云云，顯為不實之言，被上訴人早於第一審中所提陳報狀已提出現有道路維持現狀，被上訴人分得之土地再撥出部分土地將現有南側道路拓寬增加2米寬，再撥出1米作為水溝供上訴人游禎賜排水，既不會造成被上訴人分割後土地零散，亦顧慮到上訴人游禎賜達到基本之排水需求，實為一舉三得，且上訴人游禎達等人所提分割方案將被上訴人及視同上訴人郭惠研分得之土地細分為三之肇因乃係水溝，實際上該水溝僅供上訴人游禎賜排水使用，何來影響數公頃良田及住宅排水，誇大之詞顯不足採，且如前述，被上訴人願提供土地供其水溝改道，實為兩全其美之法。(五)且依原審判決，被上訴人及視同上訴人郭惠研所分得土地上有高壓電塔及電纜線，已嚴重減損土地價值，倘再細分為三筆土地，則更大大降低渠等二人之土地經濟價值及使用效益，更是渠等二人無法集中管理，顯不利於渠等二人。(六)況上訴人游禎達等人所提分割方案，藉由一條約0.26m至1.5m寬之水溝將被上訴人應分得之土地細分為編號A、B、C，被上訴人如何通行至編號C耕作？假使上訴人游禎賜或其繼受人或承買之第三人築起籬笆或圍牆時，被不利被上訴人通行，則編號C將成為毫無經濟價值之裏地，被上訴人使用上及管理上即生困難。再就排水問題，因為任一分割，因土地高度地形或高或低，縱因天災地辯或地震位移導致土地凸起，或地下水超抽導致地層下陷，土地所有權人須視情況填土或移除土方以利排水、耕作或使用管理，豈有地形地貌百年不變之理。(七)原審所為判決已兼顧各共有人所分得土地皆臨路、臨排水溝渠，已符合土地分割最基本之需求，且臨路巷道均已為既成巷道，通行數十年之久，任何人皆不得有妨礙他人通行之行為且由各共有人共同負擔巷道持分，尤以被上訴人及視同上訴人郭惠研負擔最多，尚符合公平正義，本件土地數十年來從未訂有不分割協議，亦無訂立分管契約來約定使用位置，歷代各共有人為滿足私心且秉持先佔先贏之理念，爭先占有土地使用至今，被上訴人及視同上訴人郭惠研購買係爭土地持分時，賣方亦僅告知目前可供使用之剩餘土地範圍約略位置，但無論被上訴人有無耕作、如何使用、使用範圍及位置為何，依法各共有人實際分割位置需以將來分割結果為準等情。原審判決兩造共有坐落彰化縣員林鎮○○段110號、地目田、面積21,236平方公尺土地，依如附圖二所示之方案分割，被上訴人於本院為駁回上訴之聲明。二上訴人及視同上訴人則以：(一)上訴人游禎達、游禎翹、游禎賜、賴彥佑部分：1.原審判決謂：「…再者，依附圖一所示方案分割，雖無法保留被告等（被告郭惠研除外）所稱之現有排水溝渠，但系爭土地東側已有一條與界址線相平行之排水溝渠，西北側於地籍圖上亦有一條與界址線相平行之溝渠（同段358號土地），此觀卷附地籍圖甚明，並經本院勘驗現場無誤，如被告等（被告郭惠研除外）另行施作溝渠使之往北或往東與上開排水溝渠相連接，其農田排水之問題即可解決，並非只有通過被告等所稱之現有排水溝渠始能排水。…」云云，核與事實不符。蓋原審所稱東側之溝渠，較西側田地地勢為高，故系爭現有既有溝渠根本無法排水於此，至於原審所稱西北側之溝渠，係屬灌溉溝渠，並非排水溝渠，且該灌溉溝渠地勢比系爭共有土地及南邊田地、屋宅高，故無法供系爭共有土地及南邊田地、屋宅排水使用。殊不知，原審未查明及此，遽為被上訴人有利之認定，尚屬有誤。尤甚者；若採用被上訴人所提之分割方案，系爭現有既有溝渠將被廢棄。蓋系爭現有既有溝渠，於上訴人游禎賜23年出生起就有該既成溝渠，且上訴人游禎賜之父游文熙年輕時就有該溝渠，而系爭現有既有溝渠，係供鄰近數甲公頃良田及住宅排水使用，此有證人即大埔里前後里長游祥嘉…等可證。故若採用被上訴人所提分割方案，首當其衝者，上訴人游禎賜及游禎翹、游禎達現耕作之農田，將無法耕作使用，甚至連住宅亦無法排水，益徵被上訴人所提分割方案僅顧一己之私，顯屬不公允。2.再依被上訴人所提分割方案，其分得位置不符合各共有人原本使用各百餘年之現況，且上訴人游禎賜分得之位置即編號丙呈畸零形，顯不利於使用，亦乏土地利用價值公平性。另，上訴人賴彥佑向上訴人游禎賜購買系爭土地持分時，即係要利用上訴人游禎賜所提分割方案編號H東邊現有小通路做為其住宅之出入口，但如依被上訴人所提方案分割，上訴人賴彥佑其住宅將無法通路出入，故亦有不當。詎原審未查明及此，遽認：「…原告及被告郭惠研主張依附圖一所示方案分割，…大致兼顧各共有人占有使用現況，亦使附圖三所示F及B部分之既成巷道較為公平分配於各共有人。…」云云，尚屬有誤。3.被上訴人於98年12月24日言詞辯論期日自承「郭惠研是向蔡瑞讚買土地，蔡瑞讚在賣給我太太之前已經在A、B、C的部分有填高土地，蔡瑞讚為了要搶建房屋後來法令又規定不可以蓋房子，所以就沒有耕作，我及我太太買了土地持份後有在A、B、C三個部分有種植水果，但是因為土地有被他人倒垃圾，現在我有租給別人作停車場，我種植香蕉6、7年，停車場包含A、B部分，C部分有種過水果，我當初買土地是希望將來能蓋房子。」、「…賣方有告知他（即郭惠研）在使用的是哪壹塊特定的位置，所以我才會種植水果，…」云云，足證系爭被上訴人之配偶郭惠研向其前手購買特定位置（即編號A、B、C），且知其前手為了要搶建房屋，早已在前開位置填高土地；被上訴人之配偶郭惠研當初買土地亦是希望將來能蓋房子。而前開編號A、B、C三個部分土地，被上訴人亦均有在使用，此有前開筆錄可稽。詎於100年6月28日言詞辯論期日時，被上訴人之配偶郭惠研辯稱「…我分配的土地是要耕種…」、「…編號C部分有人耕種，但不知道是誰在使用，不是被上訴人、視同上訴人郭惠研在耕作。」云云；被上訴人及其配偶郭惠研辯稱「否認編號C部分是我們在使用，而且也沒有租人放車子。」、「土地是跟誰買的要看合約書。我是買土地的持份，買土地時賣給我的人沒有告訴我說他用哪幾塊，…編號C部分我們沒有租給別人及放車子，我們只有買持份沒有使用特定部分…」云云，顯為不實之言。4.況被上訴人配偶即視同上訴人郭惠研前手填土石堆高約5尺高觀之，足見該地現顯非為做為農業耕作之用，且現亦已不能為正常農業耕作之用，此參彰化縣政府於99年3月17日與員林鎮公所及員林地政事務所至現場會勘，其會勘結論即謂「1.本筆土地包含有稻田區、廢園區、及未辦理保存登記之加強磚造屋、私設巷道、石棉瓦屋，被舖設水泥之球場兼停車場。一部分荒廢未使用之農地被廢棄物及廢土石墊高。2.本案作為農業使用的只有水稻、芋頭區、芭樂、景觀木區及混植區。」足見前開編號A、B、C位置之農地，以前可以從事農業使用，但現已無法從事農業使用，此有本院附卷之會勘紀錄可稽。而前開編號A、B、C位置使用之情形，被上訴人及其配偶郭惠研於82年1月間即知悉，其會欣然同意購買，蓋其乃意在日後想利用該地建築之用，根本並非買來務農耕作之用。況查，被上訴人於98年12月24日言詞辯論期日即自承「…我當初買土地是希望將來能蓋房子。」云云，此有本院筆錄記載可稽。是則，前開已不能正常耕作之農地（即編號A、B、C位置），分歸給被上訴人及其配偶即視同上訴人郭惠研依持分比例維持共有取得，乃合情合理、天經地義之事。被上訴人豈可要求將前開無法耕作之農地分歸上訴人（真正務農的共有人）呢？原審判決卻謂「…原告及被告郭惠研主張依附圖一所示方案分割，且依該方案分割，各共有人分得部分較為完整、方正，無細分農地之情形，有利農地之經營、使用，符合農業發展條例第16條之立法意旨，…惟附圖二所示方案不但使原告及被告郭惠研分得部分細分成A、B、C三筆，…更造成其中編號C部分（面積764.44平方公尺）…之面積在0.25公頃以下，實不利農地之經營、使用，顯與農業發展條例第16條所揭櫫之防止耕地細分、以利農場經營管理之立法意旨不合，…」云云，核與事實不符。蓋被上訴人配偶郭惠研早在82年1月間向其前手購買系爭土地（即上訴人游禎賜在原審所提新乙案編號A、B、C之位置），而該位置在郭惠研購買時早已在數年前填土石堆高約5尺高（約150公分高），致前開編號A、B、C之位置，顯高於鄰近農田，惟郭惠研之前手在填土石堆高時，即已留下當時現有既成溝渠，由此觀之，足見系爭現有既有溝渠確係供鄰近數甲公頃良田及住宅排水使用。況，被上訴人配偶郭惠研前手填土石堆高約5尺高觀之，足見該地顯非為做為農業耕作之用，否則，何以致之？尤甚者，被上訴人夫婦從82年迄今前後近17年之久，從未見被上訴人夫婦在前開編號A、B、C土地上耕種，此於原審現場勘驗即明前開編號A、B、C土地早已荒廢不能耕種使用。益徵原審判決依農業發展條例規定俾讓被上訴人能有利於農地之經營、使用乙節，誠屬緣木求魚。5.倘依上訴人游禎達等人所提分割方案分割，日後被上訴人及其配偶即視同上訴人郭惠研若要由編號A至B，或要由編號B至C位置，上訴人游禎賜及上訴人高志誠（即賴彥佑之承當訴訟人）同意讓渠等設橋通過，但其不能影響或妨礙系爭溝渠排水功能。至於編號D之系爭溝渠，分歸上訴人游禎賜及上訴人高志誠只要是鄰近農地有正常使用系爭溝渠之必要，上訴人游禎賜及上訴人高志誠均同意其使用。6.上訴人游禎達等人修正原第一審所提分割方案，將編號G部分，僅由游禎賜、高志誠、游禎翹、游禎達、游祥湧、游祥啟、游祥顯、游祥源、游美、林游美津等人依應有部分之比例保持共有（其中被上訴人及郭惠研並不用負擔），作為道路使用。是則，即無原審指摘：「…，被告等（被告郭惠研除外）主張之附圖二所示方案，亦將附圖三所示B部分之既成巷道分歸原告及被告郭惠研取得，何以該方案即不致造成無路可走之情形？…」之缺失。7.若採上訴人游禎達等人所提方案分割，則無前開被上訴人方案之缺點，不僅現有既有溝渠得以保留，讓鄰近數公頃良田及住宅得以排水。且各共有人分得位置，亦符合原本使用之現況位置。而上訴人分得之位置，亦較便於利用。另，上訴人新修正之方案分割，現供公眾使用百餘年之既成道路亦得以保留，俾共有人及附近里民有路可通行。且被上訴人及其配偶郭惠研需負擔巷道之面積為411.97平方公尺，占渠等持分比例為百分之五（即411.97平方公尺÷7963.49平方公尺＝0.0511），而上訴人游禎賜、游禎翹、游禎達、高志誠及游祥湧、游祥啟、游祥顯、游祥源、林游美津等人所需負擔巷道之面積為671.37平方公尺，占渠等持分比例為百分之五（即671.37平方公尺÷13272.51平方公尺＝0.0511），故就負擔巷道面積之部分，如依上訴人游禎達等人所提方案加以分割，對被上訴人及其配偶郭惠研而言，因系爭土地係農地，彼此又係依持分比例分攤，故分攤比例上大致約相符。故被上訴人辯稱被上訴人及其配偶郭惠研負擔巷道之面積為最多云云，恐屬誤會。8.且查，系爭土地為農地，並非建地，且農地之間，本來就有水溝或田埂，而農地每一區塊與每一區塊之間，無論是灌溉或排水用之水溝，或田埂，都是一區塊越過一區塊，並無不能使用之情形。除非將系爭農地違法當作建地使用，否則，系爭農地分割後，並無不能使用之情形。故本件被上訴人及其配偶郭惠研之主張，尚不足採。若採上訴人方案分割，則不僅現有既有溝渠得以保留，讓鄰近數公頃良田（含員大路南邊之農田流經員大路，再抵系爭溝渠）及住宅得以排水。且各共有人分得位置，亦符合原本使用之現況位置。而上訴人分得之位置，亦較便於利用。另，現供公眾使用百餘年之既成道路（即上訴人分割方案編號G部分）亦得以保留，俾供共有人及附近里民出入通行。反之，若採被上訴人方案分割，則不僅現有既有溝渠不能保留，鄰近數公頃良田（含員大路南邊之農田流經員大路，再抵系爭溝渠）及住宅無法排水。且現供公眾使用百餘年之既成道路將被廢棄，共有人及附近里民將無法出入通行。益徵被上訴人所提方案分割，尚非允當。9.綜上所陳，原審判決採用被上訴人所提分割方案，誠屬不當。依上訴人游禎達等人所提方案分割，較符合公平原則，應為較妥適之分割方法等語為辯。並聲明：原判決廢棄。兩造共有系爭土地准予依如附圖一（即員林地政事務所收件日期文號100年7月28日第1354號土地複丈成果圖）所示之方案分割，判決如主文第二項所示。第一、二審訴訟費用由被上訴人負擔。(二)參加人彰化縣員林鎮農會（即上訴人游禎賜之訴訟參加人）部分：同意上訴人游禎達等人所提如附圖一所示之分割方案。(三)上訴人游祥源、上訴人游祥、視同上訴人游祥顯、視同上訴人游美、視同上訴人游祥湧、視同上訴人林游美津部分：同意依上訴人游禎達等人所提如附圖一所示之方案分割。(四)上訴人高志誠（即賴彥佑之承當訴訟人）部分：同意與上訴人游禎賜分割後依持分比例維持共有，並同意依上訴人游禎達等人所提分割方案分割。(五)視同上訴人郭惠研則以：被上訴人游禎賜等人的方案將視同上訴人郭惠研取得土地分為三塊零散土地，不利於使用，且有高壓電塔、電纜線，編號C的部分無對外通路且無經濟價值，上訴人游禎賜等人稱水果是視同上訴人郭惠研6、7年種植，並非事實，香蕉是被上訴人楊金勝及視同上訴人郭惠研跟前手買土地時前手就已經種植其上，香蕉會延生擴大，欲恢復耕作但有困難，排水可以排別的地方，不一定要照上訴人游禎賜等人方案，希望能維持原判等語。並聲明：上訴駁回。三查本件被上訴人楊金勝起訴主張坐落彰化縣員林鎮○○段110地號、地目田、面積21,236平方公尺土地，為兩造所共有，應有部分如附表所示，且兩造間就共有土地不能協議分割，又無因物之使用目的不能分割，或約定不分割之情形等情，業據提出土地登記簿謄本為證，復為上訴人及視同上訴人等所不爭執，自堪信為真實。兩造間既無不分割之約定，亦無因物之使用目的不能分割之情形，就分割方法又不能達成協議，故被上訴人訴請准予原物裁判分割，揆諸民法第824條第2項第1款、第5項規定，核無不合，應予准許。四次查，系爭土地為特定農業區農牧用地，為東西短南北狹長之不規則地形，如附圖三所示其中編號A1、B2及H2部分為水溝供做灌溉溝渠使用，編號A2、F及B6部分為現有巷道，編號C部分之鐵造及磚造平房係上訴人游禎賜所有，H部分種植木瓜等蔬菜、編號I部分種植芭樂等，編號A、B、B1及H部分等空地為視同上訴人郭惠研於82年間向前共有人蔡瑞讚購買應有部分時，即由蔡瑞讚於數年前為搶建房屋而填高土地，嗣視同上訴人郭惠研於97年間將應有部分之一部以夫妻贈與為由移轉登記予被上訴人楊金勝，其餘部分為空地則由其他共有人分別耕種使用等情，此有土地登記謄本及異動索引附卷可稽，亦經本院再至現場會同彰化縣員林地政事務所人員履勘測量明確，並製有勘驗筆錄及員林地政事務所收件日期文號99年5月27日第848號土地複丈成果圖（即附圖三）在卷可按，復經被上訴人楊金勝於本院98年12月24日行準備程序時自承：「郭惠研是向蔡瑞讚買土地，蔡瑞讚在賣給我太太之前已經在A、B、C（係指附圖一所示分割方案中之編號A、B、C部分，與附圖三所示編號A、B、B1及H部分係屬同一位置）的部分有填高土地，蔡瑞讚為了要搶建房屋後來法令又規定不可以蓋房子，所以就沒有耕作，我及我太太買了土地持份後有在A、B、C三個部分有種植水果，但是因為土地有被他人倒垃圾，現在我有租給別人作停車場，我種植香蕉6、7年，停車場包含A、B部分，C部分有種過水果，我當初買土地是希望將來能蓋房子。」、「賣方有告知她（指郭惠研）在使用的是哪壹塊特定的位置，所以我才會種植水果」等語無訛，亦為上訴人及視同上訴人（郭惠研除外）等所不爭執；另本院囑託台灣省測量技師公會鑑測系爭土地相關位置高程點及排水方向，經鑑測結果：…五依據測量系爭土地之各高程點顯示，若不考慮分割方案圖（指附圖三）中A、B、B1、H等區塊之地形業經人為填土而增高部份，就整體而言，整塊系爭土地係屬南側較高逐向北側漸低之地形走向，故現況水流方向亦顯現自南往北之流向。六本案系爭土地若擬另闢水流溝渠，可自圖內（如附圖四即鑑定報告書之測量成果圖）B區塊南側之G1往G2方向或自G3沿現況路邊往G2方向另闢水流溝漕，惟依地形高低差狀況，僅能導引分割方案圖中C筆地以南之水流，C筆土地以北之水流仍須依現況地形水流方向往北側導流等情，此有台灣省測量技師公會99年8月9日鑑測成果報告書附卷可考，復經鑑定人測量技師周渙文於本院到庭結證：鑑定報告書第六項中「分割方案圖C筆土地」係指員林地政事務所收件日期文號99年5月27日第848號土地複丈成果圖（即附圖三）之編號C部分，依照原審判決分割方案丁、戊部分要另闢水溝往鑑定圖（即附圖四）所述之G2方向引流，乙、丙部分兩筆土地的水流沒有辦法往G2方向引流，必須要從甲部分這塊土地與丙部分的北側方向走即現況圖現有的水溝B2部分往北流，如果丙、乙部分不走北方B2部分的水溝引流，廢棄B2部分水溝的話，而另闢水溝會使用到西側別人106、103地號土地，因為附近其他的土地都已經比較高等語屬實，故系爭土地既屬特定農業區農牧用地，自應考慮分割後各筆土地之排水溝渠可否順利引流以達農地農用之效力，依鑑定人所述附圖三現況圖中C筆土地以北之水流仍須依現況地形水流方向往北側導流，即從原審判決之分割方案中編號甲部分土地與丙部分的北側方向走，故縱使廢棄B2部分之水溝，附圖一所示分割方案中之編號D部分土地仍必需使用編號A或B部分土地來引流排水，否則即需使用鄰地，然各共有人如已得從自有之系爭土地排水，實不得因分割而阻斷系爭土地之排水，轉而向毗鄰之他人土地要求排水權，造成鄰地之不利益，因此分割後如將附圖一所示之編號A、B部分連成一整塊即如原審判決分割方案之甲部份土地，將來分配取得附圖一編號D部分位置之共有人，仍需向分配取得編號A、B部分之共有人請求自然流水之排水權，如採用原審判決之分割方案，屆時取得甲部份土地之共有人亦無法整塊完整使用該筆土地，且因系爭土地北側及東側三分之二土地均分配予被上訴人楊金勝及視同上訴人郭惠研，其他共有人顯無法如原審判決所述得以在系爭土地上另行開闢往北或往東之溝渠，縱被上訴人楊金勝及視同上訴人郭惠研陳稱願提供1米寬之土地供作水溝之用，但水溝留設位置是否足以達到排水目的尚無可知，且此為使用借貸之關係，將來如楊金勝及郭惠研二人將分配取得之土地轉讓他人，他人並不受此使用借貸關係之拘束，如附圖一編號D部分土地仍有產生無法排水糾紛之虞，徒增鄰地所有人間之困擾，蓋系爭土地原來即有如附圖三現況圖所示之編號B2水溝可供附圖一所示編號D部分土地引流排水，自無再另闢其他水溝之必要，因而將附圖三編號B2部分水溝之土地分配予附圖一編號D部分土地共有人取得，實有利於土地之利用，原審判決如附圖二所示之分割方案就關於分割後各筆土地排水問題未通盤考量，尚非允當。五又查，附圖三現況圖所示編號A2、B6及F部分為現有巷道，除供系爭土地共有人通行外，亦作為附近東側多筆鄰地對外聯絡使用，原審判決如附圖二所示分割方案未將上開現有巷道使用系爭土地之部分仍留設做為道路使用，而分配予共有人各自取得，以致該現有巷道土地如仍留作道路使用，將使分配取得道路部分土地之共有人須以自有土地供公眾通行顯為不利，如不再供做道路使用予以圍阻，亦會影響附近鄰地對外之通行聯絡，是原審判決未就此部分予以考量亦有未洽，上訴人所主張如附圖一所示之分割方案將上開附圖三編號A2、B6及F部分之現有巷道，劃歸為附圖一所示編號G部分供作道路使用，顯較符合現狀使用之需要。六另附圖一所示編號A、B、C部分雖分割為三塊由被上訴人楊金勝及視同上訴人郭惠研共有取得，惟此三部份於82年間視同上訴人郭惠研向前手買受系爭土地應有部分時即已填高，視同上訴人郭惠研亦係以為得以變更地目，為搶建房屋而買受系爭土地，前手亦將上開部分交付予視同上訴人郭惠研及被上訴人楊金勝使用至今，惟郭惠研之前手雖填高A、B、C部份土地卻仍保留附圖三所示編號B2部分之水溝未填埋，顯然亦知該溝渠有保留之必要，視同上訴人郭惠研及被上訴人楊金勝並非欲作農業使用而買受系爭農地，自應承受前手為搶建房屋填高三塊土地之不利益，況農地中留有溝渠或田埂為常情所見，附圖一所示編號A、B、C等部分之面積達3000及近1000平方公尺，作農業使用並無困難，視同上訴人郭惠研及被上訴人楊金勝以建地搭蓋房屋須完整一塊較好利用之思維來分配使用系爭農地，尚無可採。七再查，系爭土地於89年1月4日農業發展條例第16條修正施行前，共有人為游禎賜、游禎翹、游禎達、郭惠研及游禎等5人，修正施行後，游禎賜於96年間將應有部分之一部以買賣為由移轉登記予賴彥佑（即應有部分0000000分之10975，面積為105.8平方公尺），賴彥佑於99年間將應有部分全部轉賣高志誠，郭惠研於97年間將應有部分之一部，以夫妻贈與為由移轉登記予楊金勝（即應有部分5000分之39，面積為165.64平方公尺），共有人游禎於97年2月8日死亡，由其繼承人即上訴人游祥啟、游祥源及視同上訴人游祥顯、游美、游祥湧、林游美津等6人，於98年4月13日辦理繼承登記為分別共有等情，此有土地謄本及異動索引足憑，依農業發展條例第16條第2項規定，每宗耕地分割後每人所有面積未達0.25公頃者，不得分割，但有第3款「本條例中華民國八十九年一月四日修正施行後所繼承之耕地，得分割為單獨所有」及第4款「本條例中華民國八十九年一月四日修正施行前之共有耕地，得分割為單獨所有」之情形，不在此限，同條第2項則規定，前項第3款及第4款所定共有耕地，辦理分割為單獨所有者，應先取得共有人之協議或法院確定判決，其分割後之宗數，不得超過共有人人數。故上訴人賴彥佑及被上訴人楊金勝因係於89年1月4日取得共有土地且面積均未達0.25公頃，故於分割時不得為單獨所有，上訴人賴彥佑仍需與上訴人游禎賜於分割後繼續保持共有，被上訴人楊金勝需與視同上訴人郭惠研於分割後保持共有，惟游禎賜及郭惠研因均係於89年1月4日以前共有系爭耕地，故分割取得之面積不受0.25公頃之限制，另視同上訴人游祥啟、游祥源、游祥顯、游美、游祥湧、林游美津等6人係於89年1月4日以後繼承系爭耕地，因此亦不受最小分割面積之限制得分割為單獨所有，故本件系爭土地分割後之宗數依上開規定可分割為10筆等情，此有彰化縣員林地政事務所98年4月6日員地二字第0980002216號函在卷可考，是附圖一所示之分割方案將系爭土地分割為10筆，未逾上開農業發展條例第16條第2項規定之筆數，而高志誠與游禎賜、楊金勝與郭惠研亦分別維持共有取得，且編號C、D、E、F、J、I及G部分之面積雖未達0.25公頃，但依前揭說明並不受此面積規定之限制，自無違反上開農業發展條例第16條第1項規定之情事，併此敘明。八復按法院定分割方法時，必須考量兩造之利益、意願，由土地上建物現況、各共有人原使用位置、分割後各共有人分得土地之方整及利用價值，予以衡量。經審酌附圖一所示之分割方案兩造分配取得之部分土地，均位於各共有人現占有使用之處，各筆土地亦堪方整有利於使用，並保留現有溝渠以利耕種，且將編號G部分作為道路使用，由兩造（視同上訴人游美除外）保持共有，以利共有人及附近鄰地之通行，另被上訴人楊金勝與視同上訴人郭惠研、上訴人游禎賜與高志誠分別依法仍維持共有關係，視同上訴人游祥啟、游祥源、游祥顯、游美、游祥湧、林游美津等6人表示於分割後願繼續保持共有，因此將附圖一所示編號A、B、C部分由被上訴人楊金勝與視同上訴人郭惠研共有取得，編號D、H部分由上訴人游禎賜與高志誠共有取得、編號I部分由視同上訴人游祥啟、游祥源、游祥顯、游美、游祥湧、林游美津等6人共有取得，應無不妥，被上訴人楊金勝與視同上訴人郭惠研分配取得之部分雖分為三塊，但此係為使編號D部分土地得以順利自然排水，以免將來產生排水糾紛而為之分割方式，但編號A、B、C部分每塊地形尚屬方整，面積達3000多及近1000平方公尺，縱分為三塊仍無礙於農耕使用，反之原審判決如附圖二所示之分割方案未保留水溝排水，亦未考慮維持現有道路以利通行，實有未洽，故本件改依如附圖一所示之分割方案予以分割，較有利於日後土地利用，應足採用。從而，原審所為之分割方案，既應作上述部分之調整，即有未洽，上訴意旨，指摘原判決不當，求予廢棄改判，為有理由，乃爰判決如主文第二項所示。九末按應有部分有抵押權或質權者，其權利不因共有物之分割而受影響。但有下列情形之一者，其權利移存於抵押人或出質人所分得之部分：一權利人同意分割。二權利人已參加共有物分割訴訟。三權利人經共有人告知訴訟而未參加。前項但書情形，於以價金分配或以金錢補償者，準用第881條第1項、第2項或第899條第1項規定。訴訟之結果，於第三人有法律上利害關係者，法院得於第一審或第二審言詞辯論終結前相當時期，將訴訟事件及進行程度以書面通知該第三人；前項受通知人得於通知送達後5日內，為第242條第1項之請求；第1項受通知人得依第58條規定參加訴訟者，準用前條之規定，民法第824條之1第2、3項、民事訴訟法第67條之1分別定有明文。查本件系爭土地共有人游禎賜於93年3月16日將其應有部份0000000分之815150，設定新台幣650萬元抵押權予訴外人彰化縣員林鎮農會，此有土地登記謄本附卷可稽，業經本院告知抵押權人參加訴訟，故本件土地分割後抵押權人彰化縣員林鎮農會之抵押權應只移存於上訴人游禎賜及高志誠所分得之如附圖一所示編號Ｄ、Ｈ部分土地，併此敘明。十結論：本件上訴為有理由，依民事訴訟法第436條之1第3項、第450條、第463條、第385條第1項前段、第78條、第80條之1、第85條第1項但書、第86條第1項前段，判決如主文。中華民國100年10月25日民事第一庭審判長法官康弼周法官王鏡明法官黃倩玲中華民國100年10月25日書記官黃幼華附表┌─────────────┬─────────┐│共有人│應有部分│├─────────────┼─────────┤│游禎賜│00000000/00000000│├─────────────┼─────────┤│游禎翹│0000000/00000000│├─────────────┼─────────┤│游禎達│0000000/00000000│├─────────────┼─────────┤│郭惠研│00000000/00000000│├─────────────┼─────────┤│賴彥佑│493875/00000000│├─────────────┼─────────┤│楊金勝│773253/00000000│├─────────────┼─────────┤│游祥湧│0000000/00000000│├─────────────┼─────────┤│游祥啟│0000000/00000000│├─────────────┼─────────┤│游祥顯│0000000/00000000│├─────────────┼─────────┤│游祥源│0000000/00000000│├─────────────┼─────────┤│游美│0000000/00000000│├─────────────┼─────────┤│林游美津│0000000/00000000│└─────────────┴─────────┘本判決不得上訴。",
  "characters": {
    "judges": [
      "康弼周",
      "王鏡明",
      "黃倩玲"
    ],
    "prosecutors": [

    ],
    "lawyers": [
      "胡宗智",
      "邱寶弘"
    ],
    "clerks": [
      "黃幼華"
    ],
    "plaintiffs": [

    ],
    "defendants": [

    ],
    "prosecutor_office": [

    ],
    "creditors": [

    ],
    "debtors": [

    ],
    "judicial_associate_officer": [

    ]
  },
  "adjudged_at": "2011-10-25",
  "created_at": "2016-02-14 06:22:06",
  "updated_at": "2016-02-14 06:22:06"
}