{
  "identify": "KSH-100-上訴-882-20111024-4",
  "court": {
    "name": "臺灣高等法院",
    "code": "KSH"
  },
  "division": {
    "name": "刑事",
    "code": "M"
  },
  "year": 100,
  "word": "上訴",
  "number": "882",
  "jcheck": "4",
  "reason": "強盜等",
  "content": "臺灣高等法院高雄分院刑事裁定        100年度上訴字第882號\n上  訴  人\n即  被  告  張吉雄\n指定辯護人  公設辯護人孫妙岑\n上列被告因強盜等上訴案件，本院裁定如下：\n    主  文\n張吉雄羈押期間，自民國一百年十一月三日起，延長貳月。\n    理  由\n一、上訴人即被告張吉雄前經本院認為犯刑法第330 條第1 項攜\n    帶兇器強盜罪、槍砲彈藥刀械管制條例第8 條第4 項之罪嫌\n    疑重大，有刑事訴訟法第101 條第1 項第1 、3 款情形，非\n    予羈押，顯難進行審判或執行，於民國100年6 月3日執行羈\n    押（卷證於同日至本院），並自100 年9 月3 日第一次延長\n    羈押2 月，至100 年11月2 日羈押期間即將屆滿。\n二、茲本院於100 年10月19日詢問後，認被告張吉雄涉犯刑法第\n    330 條第1 項攜帶兇器強盜罪、槍砲彈藥刀械管制條例第8\n    條第4 項罪，有原判決所列之各該事證可佐，嫌疑重大。參\n    以有多次毒品、詐欺、搶奪等前科，甚至經執行出獄後旋再\n    犯本案，更曾因毒品搶奪等案件經通緝，足見守法觀念不足\n    ，確有逃亡之虞。前項原因依然存在，有繼續羈押之必要，\n    應自民國100 年11月3 日起，延長羈押2 月。爰依刑事訴訟\n    法第108 條第1 項、第5 項，裁定如主文。\n中    華    民    國  100     年    10    月    24    日\n                  刑事第一庭    審判長法  官  周賢銳\n                                      法  官  曾逸誠\n                                      法  官  洪碩垣\n以上正本證明與原本無異。\n如不服本裁定應於送達後5 日內向本院提出抗告狀。\n中    華    民    國   100    年    10    月    24    日\n                                      書記官  洪慧敏",
  "structure": {
    "main": "張吉雄羈押期間，自民國一百年十一月三日起，延長貳月。",
    "reason": "一、上訴人即被告張吉雄前經本院認為犯刑法第330 條第1 項攜\n    帶兇器強盜罪、槍砲彈藥刀械管制條例第8 條第4 項之罪嫌\n    疑重大，有刑事訴訟法第101 條第1 項第1 、3 款情形，非\n    予羈押，顯難進行審判或執行，於民國100年6 月3日執行羈\n    押（卷證於同日至本院），並自100 年9 月3 日第一次延長\n    羈押2 月，至100 年11月2 日羈押期間即將屆滿。\n二、茲本院於100 年10月19日詢問後，認被告張吉雄涉犯刑法第\n    330 條第1 項攜帶兇器強盜罪、槍砲彈藥刀械管制條例第8\n    條第4 項罪，有原判決所列之各該事證可佐，嫌疑重大。參\n    以有多次毒品、詐欺、搶奪等前科，甚至經執行出獄後旋再\n    犯本案，更曾因毒品搶奪等案件經通緝，足見守法觀念不足\n    ，確有逃亡之虞。前項原因依然存在，有繼續羈押之必要，\n    應自民國100 年11月3 日起，延長羈押2 月。爰依刑事訴訟\n    法第108 條第1 項、第5 項，裁定如主文。"
  },
  "search": "臺灣高等法院高雄分院刑事裁定100年度上訴字第882號上訴人即被告張吉雄指定辯護人公設辯護人孫妙岑上列被告因強盜等上訴案件，本院裁定如下：主文張吉雄羈押期間，自民國一百年十一月三日起，延長貳月。理由一、上訴人即被告張吉雄前經本院認為犯刑法第330條第1項攜帶兇器強盜罪、槍砲彈藥刀械管制條例第8條第4項之罪嫌疑重大，有刑事訴訟法第101條第1項第1、3款情形，非予羈押，顯難進行審判或執行，於民國100年6月3日執行羈押（卷證於同日至本院），並自100年9月3日第一次延長羈押2月，至100年11月2日羈押期間即將屆滿。二、茲本院於100年10月19日詢問後，認被告張吉雄涉犯刑法第330條第1項攜帶兇器強盜罪、槍砲彈藥刀械管制條例第8條第4項罪，有原判決所列之各該事證可佐，嫌疑重大。參以有多次毒品、詐欺、搶奪等前科，甚至經執行出獄後旋再犯本案，更曾因毒品搶奪等案件經通緝，足見守法觀念不足，確有逃亡之虞。前項原因依然存在，有繼續羈押之必要，應自民國100年11月3日起，延長羈押2月。爰依刑事訴訟法第108條第1項、第5項，裁定如主文。中華民國100年10月24日刑事第一庭審判長法官周賢銳法官曾逸誠法官洪碩垣以上正本證明與原本無異。如不服本裁定應於送達後5日內向本院提出抗告狀。中華民國100年10月24日書記官洪慧敏",
  "characters": {
    "judges": [
      "周賢銳",
      "曾逸誠",
      "洪碩垣"
    ],
    "prosecutors": [

    ],
    "lawyers": [

    ],
    "clerks": [

    ],
    "plaintiffs": [

    ],
    "defendants": [
      "張吉雄"
    ],
    "prosecutor_office": [

    ],
    "creditors": [

    ],
    "debtors": [

    ],
    "judicial_associate_officer": [

    ]
  },
  "adjudged_at": "2011-10-24",
  "created_at": "2016-02-14 06:17:46",
  "updated_at": "2016-02-14 06:17:46"
}