{
  "identify": "MLD-100-司促-7137-20111025-1",
  "court": {
    "name": "臺灣苗栗地方法院",
    "code": "MLD"
  },
  "division": {
    "name": "民事",
    "code": "V"
  },
  "year": 100,
  "word": "司促",
  "number": "7137",
  "jcheck": "1",
  "reason": "支付命令",
  "content": "臺灣苗栗地方法院支付命令           100年度司促字第7137號\n債  權  人  台新國際商業銀行股份有限公司\n法定代理人  蔡榮棟\n債  務  人  魏文漳\n一、債務人應向債權人給付新臺幣（下同）拾萬零伍佰肆拾\n    肆元，及其中壹拾柒萬肆仟佰伍拾玖元自民國一百年十月\n    十九日起至清償日止，按年息百分之二十計算之利息，並賠\n    償程序費用伍佰元，否則應於本命令送達後二十日之不變期\n    間內，向本院提出異議。\n二、債權人請求之原因事實如附件所載。\n三、如債務人未於第一項期間內提出異議，本命令與確定判決有\n    同一之效力。\n中    華    民    國   100    年    10    月    25    日\n                  民事庭司法事務官  林俊源\n以上正本係照原本作成\n註：\n    一、債權人、債務人嗣後遞狀時均請註明案號、股別。\n    二、案件一經確定，本院即依職權核發確定證明書，債權人\n        勿庸另行聲請。\n    三、自本院依據狀載地址核發支付命令時起，3 個月內不能\n        送達於債務人者，支付命令即失其效力，確定證明書恕\n        難核發，債權人得重新依督促程序聲請支付命令或另向\n        本院民事庭起訴。\n                        書記官  林得新\n中    華    民    國   100    年    10    月    25    日",
  "structure": {
  },
  "search": "臺灣苗栗地方法院支付命令100年度司促字第7137號債權人台新國際商業銀行股份有限公司法定代理人蔡榮棟債務人魏文漳一、債務人應向債權人給付新臺幣（下同）拾萬零伍佰肆拾肆元，及其中壹拾柒萬肆仟佰伍拾玖元自民國一百年十月十九日起至清償日止，按年息百分之二十計算之利息，並賠償程序費用伍佰元，否則應於本命令送達後二十日之不變期間內，向本院提出異議。二、債權人請求之原因事實如附件所載。三、如債務人未於第一項期間內提出異議，本命令與確定判決有同一之效力。中華民國100年10月25日民事庭司法事務官林俊源以上正本係照原本作成註：一、債權人、債務人嗣後遞狀時均請註明案號、股別。二、案件一經確定，本院即依職權核發確定證明書，債權人勿庸另行聲請。三、自本院依據狀載地址核發支付命令時起，3個月內不能送達於債務人者，支付命令即失其效力，確定證明書恕難核發，債權人得重新依督促程序聲請支付命令或另向本院民事庭起訴。書記官林得新中華民國100年10月25日",
  "characters": {
    "judges": [

    ],
    "prosecutors": [

    ],
    "lawyers": [

    ],
    "clerks": [
      "林得新"
    ],
    "plaintiffs": [

    ],
    "defendants": [

    ],
    "prosecutor_office": [

    ],
    "creditors": [
      "台新國際商業銀行股份有限公司"
    ],
    "debtors": [
      "魏文漳"
    ],
    "judicial_associate_officer": [
      "林俊源"
    ]
  },
  "adjudged_at": "2011-10-25",
  "created_at": "2016-02-14 06:32:30",
  "updated_at": "2016-02-14 06:32:30"
}