{
  "identify": "TPD-100-司促-23702-20111024-1",
  "court": {
    "name": "臺灣臺北地方法院",
    "code": "TPD"
  },
  "division": {
    "name": "民事",
    "code": "V"
  },
  "year": 100,
  "word": "司促",
  "number": "23702",
  "jcheck": "1",
  "reason": "支付命令",
  "content": "臺灣臺北地方法院支付命令          100年度司促字第23702號\n聲  請  人\n即債權人    第一商業銀行股份有限公司羅東分行\n\n法定代理人  林信枝\n代  理  人  郭肇安\n相  對  人\n即債務人    黃翠婉\n一、債務人應向債權人清償新臺幣壹佰捌拾萬貳仟玖佰捌拾玖\n    元，及自民國一百年七月十四日起至清償日止，按年息百分\n    之二．四三五計算之利息，暨自民國一百年八月十五日起至\n    清償日止，其逾期在六個月以內者，按上開利率百分之十，\n    逾期超過六個月者，按上開利率百分之二十計算之違約金。\n二、債務人應向債權人清償新臺幣柒拾萬玖仟柒佰拾肆元，\n    及自民國一百年七月十七日起至清償日止，按年息百分之二\n    ．九一計算之利息，暨自民國一百年八月十八日起至清償日\n    止，其逾期在六個月以內者，按上開利率百分之十，逾期超\n    過六個月者，按上開利率百分之二十計算之違約金。\n三、債務人應向債權人清償新臺幣壹佰拾捌萬捌仟柒佰貳拾玖\n    元，及自民國一百年九月三日起至清償日止，按年息百分之\n    三．八八計算之利息，暨自民國一百年十月四日起至清償日\n    止，其逾期在六個月以內者，按上開利率百分之十，逾期超\n    過六個月者，按上開利率百分之二十計算之違約金，並賠償\n    督促程序費用新臺幣伍佰元，否則應於本命令送達後二十日\n    之不變期間內，向本院提出異議。\n四、債權人請求之原因事實如附件所載。\n五、如債務人未於第三項期間內提出異議，本命令與確定判決有\n    同一效力。\n中    華    民    國   100    年    10    月    24    日\n                  民事庭司法事務官  林嘉怡",
  "structure": {
  },
  "search": "臺灣臺北地方法院支付命令100年度司促字第23702號聲請人即債權人第一商業銀行股份有限公司羅東分行法定代理人林信枝代理人郭肇安相對人即債務人黃翠婉一、債務人應向債權人清償新臺幣壹佰捌拾萬貳仟玖佰捌拾玖元，及自民國一百年七月十四日起至清償日止，按年息百分之二．四三五計算之利息，暨自民國一百年八月十五日起至清償日止，其逾期在六個月以內者，按上開利率百分之十，逾期超過六個月者，按上開利率百分之二十計算之違約金。二、債務人應向債權人清償新臺幣柒拾萬玖仟柒佰拾肆元，及自民國一百年七月十七日起至清償日止，按年息百分之二．九一計算之利息，暨自民國一百年八月十八日起至清償日止，其逾期在六個月以內者，按上開利率百分之十，逾期超過六個月者，按上開利率百分之二十計算之違約金。三、債務人應向債權人清償新臺幣壹佰拾捌萬捌仟柒佰貳拾玖元，及自民國一百年九月三日起至清償日止，按年息百分之三．八八計算之利息，暨自民國一百年十月四日起至清償日止，其逾期在六個月以內者，按上開利率百分之十，逾期超過六個月者，按上開利率百分之二十計算之違約金，並賠償督促程序費用新臺幣伍佰元，否則應於本命令送達後二十日之不變期間內，向本院提出異議。四、債權人請求之原因事實如附件所載。五、如債務人未於第三項期間內提出異議，本命令與確定判決有同一效力。中華民國100年10月24日民事庭司法事務官林嘉怡",
  "characters": {
    "judges": [

    ],
    "prosecutors": [

    ],
    "lawyers": [

    ],
    "clerks": [

    ],
    "plaintiffs": [

    ],
    "defendants": [

    ],
    "prosecutor_office": [

    ],
    "creditors": [
      "第一商業銀行股份有限公司羅東分行"
    ],
    "debtors": [

    ],
    "judicial_associate_officer": [
      "林嘉怡"
    ]
  },
  "adjudged_at": "2011-10-24",
  "created_at": "2016-02-14 06:36:58",
  "updated_at": "2016-02-14 06:36:58"
}