{
  "identify": "KMD-100-司促-588-20110723-1",
  "court": {
    "name": "福建金門地方法院",
    "code": "KMD"
  },
  "division": {
    "name": "民事",
    "code": "V"
  },
  "year": 100,
  "word": "司促",
  "number": "588",
  "jcheck": "1",
  "reason": "支付命令",
  "content": "福建金門地方法院支付命令            100年度司促字第588號\n債  權  人  兆豐國際商業銀行股份有限公司\n法定代理人  蔡友才\n債  務  人  張清泉\n一、債務人應於本命令送達後二十日之不變期間內，向債權人給\n    付新台幣(下同)貳拾伍萬壹仟肆佰貳拾肆元，及其中壹拾貳\n    萬壹仟佰肆拾壹元自民國100年7月7日起至清償日止，按\n    年息百分之19.71計算之利息，暨按延滯第一個月當月計付\n    佰元，延滯第二個月當月計付肆佰元，延滯第三個月（含\n    ）以上，當月計付伍佰元之逾期手續費，延滯連續三個月以\n    上（含）者，其應計付之逾期手續費，以三個月為上限，並\n    賠償督促程序費用伍佰元。\n二、本件聲請意旨略以：中國國際商業銀行股份有限公司（下稱\n    中國商銀）自95年8月21日起與交通銀行股份有限公司合併\n    ，中國商銀係存續公司，又合併同時更名為兆豐國際商業銀\n    行股份有限公司（下稱兆豐商銀），一切權利義務由兆豐商\n    銀概括承受，合先敘明。又債務人與債權人於民國92年4月\n    間訂有信用卡使用契約，依約定債務人得於特約商店憑卡簽\n    帳消費，再於繳款截止日前清償該款項，詎債務人持卡簽帳\n    消費後，未依約清償等語。\n三、債務人對於本命令，得於第一項期間內向本院提出異議。\n四、如債務人未於第一項期間內提出異議，本命令與確定判決有\n    同一之效力。\n中    華    民    國   100    年    7     月    23    日\n                  民事庭  司法事務官  莊嘉聆\n以上正本係照原本作成。\n中    華    民    國   100    年    7     月    23    日\n                          書  記  官  陳添發",
  "structure": {
  },
  "search": "福建金門地方法院支付命令100年度司促字第588號債權人兆豐國際商業銀行股份有限公司法定代理人蔡友才債務人張清泉一、債務人應於本命令送達後二十日之不變期間內，向債權人給付新台幣(下同)貳拾伍萬壹仟肆佰貳拾肆元，及其中壹拾貳萬壹仟佰肆拾壹元自民國100年7月7日起至清償日止，按年息百分之19.71計算之利息，暨按延滯第一個月當月計付佰元，延滯第二個月當月計付肆佰元，延滯第三個月（含）以上，當月計付伍佰元之逾期手續費，延滯連續三個月以上（含）者，其應計付之逾期手續費，以三個月為上限，並賠償督促程序費用伍佰元。二、本件聲請意旨略以：中國國際商業銀行股份有限公司（下稱中國商銀）自95年8月21日起與交通銀行股份有限公司合併，中國商銀係存續公司，又合併同時更名為兆豐國際商業銀行股份有限公司（下稱兆豐商銀），一切權利義務由兆豐商銀概括承受，合先敘明。又債務人與債權人於民國92年4月間訂有信用卡使用契約，依約定債務人得於特約商店憑卡簽帳消費，再於繳款截止日前清償該款項，詎債務人持卡簽帳消費後，未依約清償等語。三、債務人對於本命令，得於第一項期間內向本院提出異議。四、如債務人未於第一項期間內提出異議，本命令與確定判決有同一之效力。中華民國100年7月23日民事庭司法事務官莊嘉聆以上正本係照原本作成。中華民國100年7月23日書記官陳添發",
  "characters": {
    "judges": [

    ],
    "prosecutors": [

    ],
    "lawyers": [

    ],
    "clerks": [

    ],
    "plaintiffs": [

    ],
    "defendants": [

    ],
    "prosecutor_office": [

    ],
    "creditors": [
      "兆豐國際商業銀行股份有限公司"
    ],
    "debtors": [
      "張清泉"
    ],
    "judicial_associate_officer": [
      "莊嘉聆"
    ]
  },
  "adjudged_at": "2011-07-23",
  "created_at": "2016-02-14 04:10:32",
  "updated_at": "2016-02-14 04:10:32"
}