{
  "identify": "TPD-100-司聲-1116-20110722-1",
  "court": {
    "name": "臺灣臺北地方法院",
    "code": "TPD"
  },
  "division": {
    "name": "民事",
    "code": "V"
  },
  "year": 100,
  "word": "司聲",
  "number": "1116",
  "jcheck": "1",
  "reason": "返還提存物",
  "content": "臺灣臺北地方法院民事裁定           100年度司聲字第1116號\n聲  請  人  凌巨科技股份有限公司\n法定代理人  黃洲杰\n相  對  人  高純純\n上列聲請人聲請返還提存物事件，本院裁定如下：\n    主  文\n本院一００年度存字第一三九二號提存事件聲請人為相對人高純\n純所提存之兆豐國際商業銀行可轉讓定期存單面額新臺幣伍佰萬\n元整壹張及面額新臺幣壹佰萬元整壹張，准予返還。\n    理  由\n一、本件聲請意旨略以：聲請人與相對人間假扣押事件，聲請人\n    前遵鈞院97年度裁全字第585 號民事裁定為擔保假扣押，曾\n    提供新臺幣600 萬元，並以鈞院97年度存字第646 號提存事\n    件提存，嗣經變換提存物，而以100 年度存字第1392號提存\n    在案；茲因聲請人已撤回假扣押執行之聲請，假扣押程序業\n    已終結，並聲請鈞院定20日期間催告受擔保利益人即相對人\n    行使權利而未行使，爰聲請返還本件提存物等語，並提出假\n    扣押裁定、民事執行處函及民事庭已通知行使權利函等件影\n    本為證。\n二、按返還擔保金，依民事訴訟法第106條準用第104條之規定，\n    須符合：(一)應供擔保之原因消滅者；(二)供擔保人證明受\n    擔保利益人同意返還者；(三)訴訟終結後供擔保人證明已定\n    20日以上之期間催告受擔保利益人行使權利而未行使，或法\n    院依供擔保人之聲請，通知受擔保利益人於一定期間內行使\n    權利並向法院為行使權利之證明而未證明者之要件，法院始\n    得裁定返還擔保金。\n三、本院依職權調閱本院100 年度存字第1392號、97年度裁全字\n    第585 號（含執全卷）、100 年度司聲字第526 號卷宗審核\n    ，經查聲請人業已撤回對相對人之假扣押執行，按諸上開說\n    明，應認訴訟已終結。相對人迄未對聲請人行使權利，亦有\n    本院民事紀錄科查詢表、臺灣苗栗地方法院函附卷可稽。從\n    而，聲請人聲請返還本件提存物，經核於法尚無不合，應予\n    准許。爰裁定如主文。\n四、如不服本裁定，應於裁定送達後10日內，以書狀向本院司法\n    事務官提出異議。\n中    華    民    國    100     年    7     月    22  日\n                  民事第二庭    司法事務官  鍾虎君",
  "structure": {
    "main": "本院一００年度存字第一三九二號提存事件聲請人為相對人高純\n純所提存之兆豐國際商業銀行可轉讓定期存單面額新臺幣伍佰萬\n元整壹張及面額新臺幣壹佰萬元整壹張，准予返還。",
    "reason": "一、本件聲請意旨略以：聲請人與相對人間假扣押事件，聲請人\n    前遵鈞院97年度裁全字第585 號民事裁定為擔保假扣押，曾\n    提供新臺幣600 萬元，並以鈞院97年度存字第646 號提存事\n    件提存，嗣經變換提存物，而以100 年度存字第1392號提存\n    在案；茲因聲請人已撤回假扣押執行之聲請，假扣押程序業\n    已終結，並聲請鈞院定20日期間催告受擔保利益人即相對人\n    行使權利而未行使，爰聲請返還本件提存物等語，並提出假\n    扣押裁定、民事執行處函及民事庭已通知行使權利函等件影\n    本為證。\n二、按返還擔保金，依民事訴訟法第106條準用第104條之規定，\n    須符合：(一)應供擔保之原因消滅者；(二)供擔保人證明受\n    擔保利益人同意返還者；(三)訴訟終結後供擔保人證明已定\n    20日以上之期間催告受擔保利益人行使權利而未行使，或法\n    院依供擔保人之聲請，通知受擔保利益人於一定期間內行使\n    權利並向法院為行使權利之證明而未證明者之要件，法院始\n    得裁定返還擔保金。\n三、本院依職權調閱本院100 年度存字第1392號、97年度裁全字\n    第585 號（含執全卷）、100 年度司聲字第526 號卷宗審核\n    ，經查聲請人業已撤回對相對人之假扣押執行，按諸上開說\n    明，應認訴訟已終結。相對人迄未對聲請人行使權利，亦有\n    本院民事紀錄科查詢表、臺灣苗栗地方法院函附卷可稽。從\n    而，聲請人聲請返還本件提存物，經核於法尚無不合，應予\n    准許。爰裁定如主文。\n四、如不服本裁定，應於裁定送達後10日內，以書狀向本院司法\n    事務官提出異議。"
  },
  "search": "臺灣臺北地方法院民事裁定100年度司聲字第1116號聲請人凌巨科技股份有限公司法定代理人黃洲杰相對人高純純上列聲請人聲請返還提存物事件，本院裁定如下：主文本院一００年度存字第一三九二號提存事件聲請人為相對人高純純所提存之兆豐國際商業銀行可轉讓定期存單面額新臺幣伍佰萬元整壹張及面額新臺幣壹佰萬元整壹張，准予返還。理由一、本件聲請意旨略以：聲請人與相對人間假扣押事件，聲請人前遵鈞院97年度裁全字第585號民事裁定為擔保假扣押，曾提供新臺幣600萬元，並以鈞院97年度存字第646號提存事件提存，嗣經變換提存物，而以100年度存字第1392號提存在案；茲因聲請人已撤回假扣押執行之聲請，假扣押程序業已終結，並聲請鈞院定20日期間催告受擔保利益人即相對人行使權利而未行使，爰聲請返還本件提存物等語，並提出假扣押裁定、民事執行處函及民事庭已通知行使權利函等件影本為證。二、按返還擔保金，依民事訴訟法第106條準用第104條之規定，須符合：(一)應供擔保之原因消滅者；(二)供擔保人證明受擔保利益人同意返還者；(三)訴訟終結後供擔保人證明已定20日以上之期間催告受擔保利益人行使權利而未行使，或法院依供擔保人之聲請，通知受擔保利益人於一定期間內行使權利並向法院為行使權利之證明而未證明者之要件，法院始得裁定返還擔保金。三、本院依職權調閱本院100年度存字第1392號、97年度裁全字第585號（含執全卷）、100年度司聲字第526號卷宗審核，經查聲請人業已撤回對相對人之假扣押執行，按諸上開說明，應認訴訟已終結。相對人迄未對聲請人行使權利，亦有本院民事紀錄科查詢表、臺灣苗栗地方法院函附卷可稽。從而，聲請人聲請返還本件提存物，經核於法尚無不合，應予准許。爰裁定如主文。四、如不服本裁定，應於裁定送達後10日內，以書狀向本院司法事務官提出異議。中華民國100年7月22日民事第二庭司法事務官鍾虎君",
  "characters": {
    "judges": [

    ],
    "prosecutors": [

    ],
    "lawyers": [

    ],
    "clerks": [

    ],
    "plaintiffs": [

    ],
    "defendants": [

    ],
    "prosecutor_office": [
      "凌巨科技股份有限公司"
    ],
    "creditors": [

    ],
    "debtors": [

    ],
    "judicial_associate_officer": [
      "鍾虎君"
    ]
  },
  "adjudged_at": "2011-07-22",
  "created_at": "2016-02-14 04:07:45",
  "updated_at": "2016-02-14 04:07:45"
}