{
  "identify": "KSD-100-司促-35650-20110819-1",
  "court": {
    "name": "臺灣高雄地方法院",
    "code": "KSD"
  },
  "division": {
    "name": "民事",
    "code": "V"
  },
  "year": 100,
  "word": "司促",
  "number": "35650",
  "jcheck": "1",
  "reason": "支付命令",
  "content": "臺灣高雄地方法院支付命令          100年度司促字第35650號\n債  權  人  合作金庫商業銀行股份有限公司\n法定代理人  劉燈城\n代  理  人  張簡泰谷\n債  務  人  許育禎\n債  務  人  蕭美玲\n一、債務人許育禎應向債權人給付新台幣壹仟貳佰捌拾壹萬壹仟\n    貳佰柒拾捌元，及自民國一百年六月十三日起至清償日止，\n    按年息百分之一點九六計算之利息，暨自民國一百年七月十\n    四日起至清償日止，其逾期在六個月以內者，按上開利率百\n    分之十，逾期超過六個月者，按上開利率百分之二十計算之\n    違約金，並賠償程序費用新台幣伍佰元，於債務人許育禎無\n    可供執行之財產時，由債務人蕭美玲負給付之責，否則應於\n    本命令送達後二十日之不變期間內，向本院提出異議。\n二、債權人請求之原因事實如債權人聲請狀所載。\n三、如債務人未於第一項期間內提出異議，本命令與確定判決有\n    同一效力。\n中    華    民    國   100    年    8     月    19    日\n                         臺灣高雄地方法院民事庭\n                                 司法事務官 黃思瑜\n附註：\n一、案件一經確定本院即依職權核發確定證明書，債權人毋庸具\n    狀申請。\n二、嗣後遞狀應註明案號及股別。",
  "structure": {
  },
  "search": "臺灣高雄地方法院支付命令100年度司促字第35650號債權人合作金庫商業銀行股份有限公司法定代理人劉燈城代理人張簡泰谷債務人許育禎債務人蕭美玲一、債務人許育禎應向債權人給付新台幣壹仟貳佰捌拾壹萬壹仟貳佰柒拾捌元，及自民國一百年六月十三日起至清償日止，按年息百分之一點九六計算之利息，暨自民國一百年七月十四日起至清償日止，其逾期在六個月以內者，按上開利率百分之十，逾期超過六個月者，按上開利率百分之二十計算之違約金，並賠償程序費用新台幣伍佰元，於債務人許育禎無可供執行之財產時，由債務人蕭美玲負給付之責，否則應於本命令送達後二十日之不變期間內，向本院提出異議。二、債權人請求之原因事實如債權人聲請狀所載。三、如債務人未於第一項期間內提出異議，本命令與確定判決有同一效力。中華民國100年8月19日臺灣高雄地方法院民事庭司法事務官黃思瑜附註：一、案件一經確定本院即依職權核發確定證明書，債權人毋庸具狀申請。二、嗣後遞狀應註明案號及股別。",
  "characters": {
    "judges": [

    ],
    "prosecutors": [

    ],
    "lawyers": [

    ],
    "clerks": [

    ],
    "plaintiffs": [

    ],
    "defendants": [

    ],
    "prosecutor_office": [

    ],
    "creditors": [
      "合作金庫商業銀行股份有限公司"
    ],
    "debtors": [
      "許育禎",
      "蕭美玲"
    ],
    "judicial_associate_officer": [
      "黃思瑜"
    ]
  },
  "adjudged_at": "2011-08-19",
  "created_at": "2016-02-12 20:38:20",
  "updated_at": "2016-02-12 20:38:20"
}