{
  "identify": "KSD-100-家聲-301-20110712-1",
  "court": {
    "name": "臺灣高雄地方法院",
    "code": "KSD"
  },
  "division": {
    "name": "民事",
    "code": "V"
  },
  "year": 100,
  "word": "家聲",
  "number": "301",
  "jcheck": "1",
  "reason": "大陸地區判決聲請承認之裁定",
  "content": "臺灣高雄地方法院民事裁定            100年度家聲字第301號\n聲  請  人  張志鴻\n相  對  人  張楠楠\n上當事人間大陸地區判決聲請承認之裁定事件，本院裁定如下：\n    主  文\n認可中華人民共和國吉林省舒蘭市人民法院西元2008年09月05日\n（2008）舒民一初字第60號民事確定判決。\n聲請費用新台幣壹仟元由聲請人負擔。\n    理    由\n一、按在大陸地區作成之文書，經行政院設立或指定之機構或委\n    託之民間團體驗證者，推定為真正；又在大陸地區作成之民\n    事確定判決、民事仲裁判斷，不違背臺灣地區公共秩序或善\n    良風俗者，得聲請法院裁定認可；前開規定，以在臺灣地區\n    作成之民事確定裁判、民事仲裁判斷，得聲請大陸地區法院\n    裁定認可或為執行名義者，始適用之，臺灣地區與大陸地區\n    人民關係條例第7 條、第74條第1 項、第3 項分別定有明文\n    。\n二、本件聲請意旨略以：聲請人張志鴻與相對人張楠楠原係夫妻\n    ，因感情破裂，業經中華人民共和國吉林省舒蘭市人民法院\n    判決被告即聲請人與原告即相對人離婚確定，已於西元2008\n    年09月22日生效，上開判決並經財團法人海峽交流基金會驗\n    證屬實，爰依前開規定聲請裁定認可，並提出中華人民共和\n    國吉林省舒蘭市人民法院西元2008年09月05日（2008）舒民\n    一初字第60號民事確定判決暨2008年09月22日生效之確定證\n    明書、中華人民共和國吉林省長春市信維公證處（2011）吉\n    長信維證字第13041 號、第13042 號公證書、財團法人海峽\n    交流基金會（100 ）南核字第058260號、第058261號證明書\n    各1 件為證。\n三、按在大陸地區作成之民事確定裁判、民事仲裁判斷，不違背\n    臺灣地區公共秩序或善良風俗者，得聲請法院裁定認可，臺\n    灣地區與大陸地區人民關係條例第74條第1 項定有明文。經\n    查：本件聲請認可之大陸地區判決書暨確定證明書，曾經財\n    團法人海峽交流基金會認證，有該基金會（100 ）南核字第\n    058260號、第058261號證明書在卷可稽，經審酌該判決書內\n    容，係以兩造婚後，因個性不合，雙方自2006年2 月起分居\n    迄今，長期分居導致夫妻感情破裂，原告請求離婚，符合有\n    關法律規定，應予准許。與我國民法第1052條第2 項之兩造\n    間有難以維持婚姻之重大事由相當，經核其判決內容亦與臺\n    灣地區之公共秩序或善良風俗並無相違，又大陸地區業於西\n    元1998年（即民國87年）1 月15日通過「最高人民法院關於\n    人民法院認可台灣地區有關法院民事判決的規定」，並自同\n    年5 月26日起施行，是在臺灣地區作成之民事確定裁判，已\n    得依該規定聲請大陸地區法院裁定認可，故我國法院依法亦\n    可認可大陸地區確定判決。揆諸首揭規定，本件聲請人之聲\n    請乃於法有據，應予認可。\n四、依非訟事件法第21條第1項、第24條第1項，裁定如主文。\n中    華    民    國  100     年    7     月    12    日\n                  家事法庭法  官  郭佳瑛\n上為正本係照原本作成。\n如對本裁定抗告須於裁定送達後10日內向本院提出抗告狀。\n中    華    民    國  100     年    7     月    12    日\n                          書記官  曾小玲",
  "structure": {
    "main": "認可中華人民共和國吉林省舒蘭市人民法院西元2008年09月05日\n（2008）舒民一初字第60號民事確定判決。\n聲請費用新台幣壹仟元由聲請人負擔。",
    "reason": "一、按在大陸地區作成之文書，經行政院設立或指定之機構或委\n    託之民間團體驗證者，推定為真正；又在大陸地區作成之民\n    事確定判決、民事仲裁判斷，不違背臺灣地區公共秩序或善\n    良風俗者，得聲請法院裁定認可；前開規定，以在臺灣地區\n    作成之民事確定裁判、民事仲裁判斷，得聲請大陸地區法院\n    裁定認可或為執行名義者，始適用之，臺灣地區與大陸地區\n    人民關係條例第7 條、第74條第1 項、第3 項分別定有明文\n    。\n二、本件聲請意旨略以：聲請人張志鴻與相對人張楠楠原係夫妻\n    ，因感情破裂，業經中華人民共和國吉林省舒蘭市人民法院\n    判決被告即聲請人與原告即相對人離婚確定，已於西元2008\n    年09月22日生效，上開判決並經財團法人海峽交流基金會驗\n    證屬實，爰依前開規定聲請裁定認可，並提出中華人民共和\n    國吉林省舒蘭市人民法院西元2008年09月05日（2008）舒民\n    一初字第60號民事確定判決暨2008年09月22日生效之確定證\n    明書、中華人民共和國吉林省長春市信維公證處（2011）吉\n    長信維證字第13041 號、第13042 號公證書、財團法人海峽\n    交流基金會（100 ）南核字第058260號、第058261號證明書\n    各1 件為證。\n三、按在大陸地區作成之民事確定裁判、民事仲裁判斷，不違背\n    臺灣地區公共秩序或善良風俗者，得聲請法院裁定認可，臺\n    灣地區與大陸地區人民關係條例第74條第1 項定有明文。經\n    查：本件聲請認可之大陸地區判決書暨確定證明書，曾經財\n    團法人海峽交流基金會認證，有該基金會（100 ）南核字第\n    058260號、第058261號證明書在卷可稽，經審酌該判決書內\n    容，係以兩造婚後，因個性不合，雙方自2006年2 月起分居\n    迄今，長期分居導致夫妻感情破裂，原告請求離婚，符合有\n    關法律規定，應予准許。與我國民法第1052條第2 項之兩造\n    間有難以維持婚姻之重大事由相當，經核其判決內容亦與臺\n    灣地區之公共秩序或善良風俗並無相違，又大陸地區業於西\n    元1998年（即民國87年）1 月15日通過「最高人民法院關於\n    人民法院認可台灣地區有關法院民事判決的規定」，並自同\n    年5 月26日起施行，是在臺灣地區作成之民事確定裁判，已\n    得依該規定聲請大陸地區法院裁定認可，故我國法院依法亦\n    可認可大陸地區確定判決。揆諸首揭規定，本件聲請人之聲\n    請乃於法有據，應予認可。\n四、依非訟事件法第21條第1項、第24條第1項，裁定如主文。"
  },
  "search": "臺灣高雄地方法院民事裁定100年度家聲字第301號聲請人張志鴻相對人張楠楠上當事人間大陸地區判決聲請承認之裁定事件，本院裁定如下：主文認可中華人民共和國吉林省舒蘭市人民法院西元2008年09月05日（2008）舒民一初字第60號民事確定判決。聲請費用新台幣壹仟元由聲請人負擔。理由一、按在大陸地區作成之文書，經行政院設立或指定之機構或委託之民間團體驗證者，推定為真正；又在大陸地區作成之民事確定判決、民事仲裁判斷，不違背臺灣地區公共秩序或善良風俗者，得聲請法院裁定認可；前開規定，以在臺灣地區作成之民事確定裁判、民事仲裁判斷，得聲請大陸地區法院裁定認可或為執行名義者，始適用之，臺灣地區與大陸地區人民關係條例第7條、第74條第1項、第3項分別定有明文。二、本件聲請意旨略以：聲請人張志鴻與相對人張楠楠原係夫妻，因感情破裂，業經中華人民共和國吉林省舒蘭市人民法院判決被告即聲請人與原告即相對人離婚確定，已於西元2008年09月22日生效，上開判決並經財團法人海峽交流基金會驗證屬實，爰依前開規定聲請裁定認可，並提出中華人民共和國吉林省舒蘭市人民法院西元2008年09月05日（2008）舒民一初字第60號民事確定判決暨2008年09月22日生效之確定證明書、中華人民共和國吉林省長春市信維公證處（2011）吉長信維證字第13041號、第13042號公證書、財團法人海峽交流基金會（100）南核字第058260號、第058261號證明書各1件為證。三、按在大陸地區作成之民事確定裁判、民事仲裁判斷，不違背臺灣地區公共秩序或善良風俗者，得聲請法院裁定認可，臺灣地區與大陸地區人民關係條例第74條第1項定有明文。經查：本件聲請認可之大陸地區判決書暨確定證明書，曾經財團法人海峽交流基金會認證，有該基金會（100）南核字第058260號、第058261號證明書在卷可稽，經審酌該判決書內容，係以兩造婚後，因個性不合，雙方自2006年2月起分居迄今，長期分居導致夫妻感情破裂，原告請求離婚，符合有關法律規定，應予准許。與我國民法第1052條第2項之兩造間有難以維持婚姻之重大事由相當，經核其判決內容亦與臺灣地區之公共秩序或善良風俗並無相違，又大陸地區業於西元1998年（即民國87年）1月15日通過「最高人民法院關於人民法院認可台灣地區有關法院民事判決的規定」，並自同年5月26日起施行，是在臺灣地區作成之民事確定裁判，已得依該規定聲請大陸地區法院裁定認可，故我國法院依法亦可認可大陸地區確定判決。揆諸首揭規定，本件聲請人之聲請乃於法有據，應予認可。四、依非訟事件法第21條第1項、第24條第1項，裁定如主文。中華民國100年7月12日家事法庭法官郭佳瑛上為正本係照原本作成。如對本裁定抗告須於裁定送達後10日內向本院提出抗告狀。中華民國100年7月12日書記官曾小玲",
  "characters": {
    "judges": [
      "郭佳瑛"
    ],
    "prosecutors": [

    ],
    "lawyers": [

    ],
    "clerks": [

    ],
    "plaintiffs": [

    ],
    "defendants": [

    ],
    "prosecutor_office": [
      "張志鴻"
    ],
    "creditors": [

    ],
    "debtors": [

    ],
    "judicial_associate_officer": [

    ]
  },
  "adjudged_at": "2011-07-12",
  "created_at": "2016-02-14 02:47:01",
  "updated_at": "2016-02-14 02:47:01"
}