{
  "identify": "PTD-100-婚-276-20111121-1",
  "court": {
    "name": "臺灣屏東地方法院",
    "code": "PTD"
  },
  "division": {
    "name": "民事",
    "code": "V"
  },
  "year": 100,
  "word": "婚",
  "number": "276",
  "jcheck": "1",
  "reason": "離婚等",
  "content": "臺灣屏東地方法院民事裁定              100年度婚字第276號\n原      告  陳育鈴\n上列當事人間請求離婚等事件，本院裁定如下：\n    主  文\n原告應於本裁定送達日起十日內補正下列事項，逾期未為補正即\n駁回其訴：\n應具狀依民事訴訟法第149 條第1 項第1 款聲請對被告童國雄公\n示送達。\n    理  由\n一、按原告之訴有起訴不合程式或不備其他要件者，法院應以裁\n    定駁回之，但其情形可以補正，審判長應定期間先命補正；\n    又當事人書狀，應記載當事人姓名、性別、年齡、職業及住\n    所或居所，民事訴訟法第249 條第1 項第6 款、第116 條第\n    1 項分別定有明文，此為法定必備之程式。又對於當事人之\n    送達，應為送達之處所不明者，受訴法院得依聲請，准為公\n    示送達，同法第149 條第1 項第1 款亦有明文。\n二、本件原告起訴狀上固記載明被告之住所址屏東縣佳冬鄉○○\n    村○○路77號且陳報戶籍謄本住址為證，惟本院依址送達準\n    備期日通知書未獲會晤而寄存石光派出所未經受領，本院復\n    依職權調取被告健保、漁保投保資料，查知被告另有居址屏\n    東縣佳冬鄉○○村○○街117 號，此有屏東縣林邊區漁會\n    100 年10月31日屏林漁會字第1000001290號函檢送之會員入\n    會申請書、養殖證明書等件在卷可稽。惟經本院送達該址及\n    再次送達被告戶籍址結果，均以無人收受而原件退回，有訴\n    訟文書不能送達事由報告書二件附卷足佐，是以本件被告送\n    達處所不明，無從為合法之送達，本院為免訴訟遲延，茲依\n    民事訴訟法第149 條第1 項第1 款規定，命原告具狀聲請對\n    被告童國雄為公示送達，爰裁定如主文所示。\n中    華    民    國   100    年    11    月    21    日\n                      家事庭  法  官  朱盈吉\n以上正本係照原本作成。\n本裁定不得抗告。\n中    華    民    國   100    年    11    月    21    日\n                              書記官  蔡明株",
  "structure": {
    "main": "原告應於本裁定送達日起十日內補正下列事項，逾期未為補正即\n駁回其訴：\n應具狀依民事訴訟法第149 條第1 項第1 款聲請對被告童國雄公\n示送達。",
    "reason": "一、按原告之訴有起訴不合程式或不備其他要件者，法院應以裁\n    定駁回之，但其情形可以補正，審判長應定期間先命補正；\n    又當事人書狀，應記載當事人姓名、性別、年齡、職業及住\n    所或居所，民事訴訟法第249 條第1 項第6 款、第116 條第\n    1 項分別定有明文，此為法定必備之程式。又對於當事人之\n    送達，應為送達之處所不明者，受訴法院得依聲請，准為公\n    示送達，同法第149 條第1 項第1 款亦有明文。\n二、本件原告起訴狀上固記載明被告之住所址屏東縣佳冬鄉○○\n    村○○路77號且陳報戶籍謄本住址為證，惟本院依址送達準\n    備期日通知書未獲會晤而寄存石光派出所未經受領，本院復\n    依職權調取被告健保、漁保投保資料，查知被告另有居址屏\n    東縣佳冬鄉○○村○○街117 號，此有屏東縣林邊區漁會\n    100 年10月31日屏林漁會字第1000001290號函檢送之會員入\n    會申請書、養殖證明書等件在卷可稽。惟經本院送達該址及\n    再次送達被告戶籍址結果，均以無人收受而原件退回，有訴\n    訟文書不能送達事由報告書二件附卷足佐，是以本件被告送\n    達處所不明，無從為合法之送達，本院為免訴訟遲延，茲依\n    民事訴訟法第149 條第1 項第1 款規定，命原告具狀聲請對\n    被告童國雄為公示送達，爰裁定如主文所示。"
  },
  "search": "臺灣屏東地方法院民事裁定100年度婚字第276號原告陳育鈴上列當事人間請求離婚等事件，本院裁定如下：主文原告應於本裁定送達日起十日內補正下列事項，逾期未為補正即駁回其訴：應具狀依民事訴訟法第149條第1項第1款聲請對被告童國雄公示送達。理由一、按原告之訴有起訴不合程式或不備其他要件者，法院應以裁定駁回之，但其情形可以補正，審判長應定期間先命補正；又當事人書狀，應記載當事人姓名、性別、年齡、職業及住所或居所，民事訴訟法第249條第1項第6款、第116條第1項分別定有明文，此為法定必備之程式。又對於當事人之送達，應為送達之處所不明者，受訴法院得依聲請，准為公示送達，同法第149條第1項第1款亦有明文。二、本件原告起訴狀上固記載明被告之住所址屏東縣佳冬鄉○○村○○路77號且陳報戶籍謄本住址為證，惟本院依址送達準備期日通知書未獲會晤而寄存石光派出所未經受領，本院復依職權調取被告健保、漁保投保資料，查知被告另有居址屏東縣佳冬鄉○○村○○街117號，此有屏東縣林邊區漁會100年10月31日屏林漁會字第1000001290號函檢送之會員入會申請書、養殖證明書等件在卷可稽。惟經本院送達該址及再次送達被告戶籍址結果，均以無人收受而原件退回，有訴訟文書不能送達事由報告書二件附卷足佐，是以本件被告送達處所不明，無從為合法之送達，本院為免訴訟遲延，茲依民事訴訟法第149條第1項第1款規定，命原告具狀聲請對被告童國雄為公示送達，爰裁定如主文所示。中華民國100年11月21日家事庭法官朱盈吉以上正本係照原本作成。本裁定不得抗告。中華民國100年11月21日書記官蔡明株",
  "characters": {
    "judges": [
      "朱盈吉"
    ],
    "prosecutors": [

    ],
    "lawyers": [

    ],
    "clerks": [

    ],
    "plaintiffs": [
      "陳育鈴"
    ],
    "defendants": [

    ],
    "prosecutor_office": [

    ],
    "creditors": [

    ],
    "debtors": [

    ],
    "judicial_associate_officer": [

    ]
  },
  "adjudged_at": "2011-11-21",
  "created_at": "2016-02-12 22:11:54",
  "updated_at": "2016-02-12 22:11:54"
}