{
  "identify": "TCD-93-訴-2402-20051219-3",
  "court": {
    "name": "臺灣臺中地方法院",
    "code": "TCD"
  },
  "division": {
    "name": "民事",
    "code": "V"
  },
  "year": 93,
  "word": "訴",
  "number": "2402",
  "jcheck": "3",
  "reason": "損害賠償",
  "content": "臺灣臺中地方法院民事裁定  93年度訴字第2402號\n上  訴  人  葉昕語\n         （即甲○○）\n被      告  東正王朝Ｂ棟管理委員會\n法定代理人  乙○○\n當事人間損害賠償事件，上訴人對於民國94年11月7日本院第一\n審判決提起上訴，本院裁定如下：\n    主    文\n上訴駁回。\n第二審訴訟費用由上訴人負擔。\n    理    由\n一、按提起民事第二審上訴，應依民事訴訟法第76條之16規定繳\n    納裁判費，此乃上訴必須具備之程式。\n二、本件上訴人提起第二審上訴，未據繳納裁判費，經本院於94\n    年11月21日裁定，命其於裁定送達後5日內補正，此項裁定\n    已於94年11月24日送達，有送達證書在卷可稽。\n三、上訴人逾期迄今仍未補正，其上訴自非合法，應予駁回。\n四、依民事訴訟法第442條第2項、第95條、第78條，裁定如主文\n    。\n中    華    民    國    94    年    12    月    19    日\n                  民事第三庭    法  官  陳毓秀\n正本係照原本作成\n如不服本裁定應於送達後10日內向本院提出抗告狀，並繳納抗告\n費新臺幣1,000元。\n中    華    民    國    94    年    12    月    19    日\n                                 書記官\n",
  "structure": {
    "main": "上訴駁回。\n第二審訴訟費用由上訴人負擔。",
    "reason": "一、按提起民事第二審上訴，應依民事訴訟法第76條之16規定繳\n    納裁判費，此乃上訴必須具備之程式。\n二、本件上訴人提起第二審上訴，未據繳納裁判費，經本院於94\n    年11月21日裁定，命其於裁定送達後5日內補正，此項裁定\n    已於94年11月24日送達，有送達證書在卷可稽。\n三、上訴人逾期迄今仍未補正，其上訴自非合法，應予駁回。\n四、依民事訴訟法第442條第2項、第95條、第78條，裁定如主文\n    。"
  },
  "search": "臺灣臺中地方法院民事裁定93年度訴字第2402號上訴人葉昕語（即甲○○）被告東正王朝Ｂ棟管理委員會法定代理人乙○○當事人間損害賠償事件，上訴人對於民國94年11月7日本院第一審判決提起上訴，本院裁定如下：主文上訴駁回。第二審訴訟費用由上訴人負擔。理由一、按提起民事第二審上訴，應依民事訴訟法第76條之16規定繳納裁判費，此乃上訴必須具備之程式。二、本件上訴人提起第二審上訴，未據繳納裁判費，經本院於94年11月21日裁定，命其於裁定送達後5日內補正，此項裁定已於94年11月24日送達，有送達證書在卷可稽。三、上訴人逾期迄今仍未補正，其上訴自非合法，應予駁回。四、依民事訴訟法第442條第2項、第95條、第78條，裁定如主文。中華民國94年12月19日民事第三庭法官陳毓秀正本係照原本作成如不服本裁定應於送達後10日內向本院提出抗告狀，並繳納抗告費新臺幣1,000元。中華民國94年12月19日書記官",
  "characters": {
    "judges": [
      "陳毓秀"
    ],
    "prosecutors": [

    ],
    "lawyers": [

    ],
    "clerks": [

    ],
    "plaintiffs": [

    ],
    "defendants": [
      "東正王朝Ｂ棟管理委員會"
    ],
    "prosecutor_office": [

    ],
    "creditors": [

    ],
    "debtors": [

    ],
    "judicial_associate_officer": [

    ]
  },
  "adjudged_at": "2005-12-19",
  "created_at": "2016-02-07 04:33:36",
  "updated_at": "2016-02-07 04:33:36"
}