{
  "identify": "KSD-94-簡-6222-20051027-1",
  "court": {
    "name": "臺灣高雄地方法院",
    "code": "KSD"
  },
  "division": {
    "name": "刑事",
    "code": "M"
  },
  "year": 94,
  "word": "簡",
  "number": "6222",
  "jcheck": "1",
  "reason": "贓物",
  "content": "臺灣高雄地方法院刑事簡易判決          94年度簡字第6222號\n聲  請  人  臺灣高雄地方法院檢察署檢察官\n被      告  甲○○\n上列被告因贓物案件，經檢察官聲請以簡易判決處刑（94年度偵\n字第11908號），本院判決如左：\n    主  文\n甲○○收受贓物，處拘役伍拾日，如易科罰金以佰元折算壹日\n。\n    事實及理由\n一、本件犯罪事實、證據及應適用之法條，均引用檢察官聲請簡\n    易判決處刑書之記載（如附件）。\n二、審酌被告任意收受他人竊取之機車使用，足見其尊重他人財\n    產權之觀念薄弱，顯有可議；惟該機車價值依據被害人乙○\n    ○於警訊時指述：為新臺幣3000元等語，其價值非鉅，且該\n    車業經發還被害人，有贓物認領保管收據在卷可稽，即被害\n    人所受之財產上損害尚非嚴重；另被告犯後坦承犯行態度尚\n    佳等，及其他一切情狀，量處如主文所示之刑，並諭知易科\n    罰金之折算標準，以示懲儆。\n三、依刑事訴訟法第449 條第1 項、第3 項、第454 條第2 項，\n    刑法第349 條第1 項、第41條第1 項，罰金罰鍰提高標準條\n    例第1條前段、第2條，逕以簡易判決處刑如主文。\n四、如不服本判決，得自收受送達之日起10日內，向本院提起上\n    訴。\n中    華    民    國    94    年    10    月    27    日\n                        鳳山簡易庭\n                            法官  邱明弘\n右正本證明與原本無異。\n中    華    民    國    94    年    10    月    27    日\n                          書記官  陳掌珠\n附錄本判決論罪之法條：\n中華民國刑法第349條：\n收受贓物者，處三年以下有期徒刑、拘役或五百元以下罰金。\n搬運、寄藏、故買贓物或為牙保者，處五年以下有期徒刑、拘役\n或科或併科一千元以下罰金。\n因贓物變得之財物，以贓物論。\n",
  "structure": {
    "main": "甲○○收受贓物，處拘役伍拾日，如易科罰金以佰元折算壹日\n。",
    "fact": "一、本件犯罪事實、證據及應適用之法條，均引用檢察官聲請簡\n    易判決處刑書之記載（如附件）。\n二、審酌被告任意收受他人竊取之機車使用，足見其尊重他人財\n    產權之觀念薄弱，顯有可議；惟該機車價值依據被害人乙○\n    ○於警訊時指述：為新臺幣3000元等語，其價值非鉅，且該\n    車業經發還被害人，有贓物認領保管收據在卷可稽，即被害\n    人所受之財產上損害尚非嚴重；另被告犯後坦承犯行態度尚\n    佳等，及其他一切情狀，量處如主文所示之刑，並諭知易科\n    罰金之折算標準，以示懲儆。\n三、依刑事訴訟法第449 條第1 項、第3 項、第454 條第2 項，\n    刑法第349 條第1 項、第41條第1 項，罰金罰鍰提高標準條\n    例第1條前段、第2條，逕以簡易判決處刑如主文。\n四、如不服本判決，得自收受送達之日起10日內，向本院提起上\n    訴。",
    "reason": "一、本件犯罪事實、證據及應適用之法條，均引用檢察官聲請簡\n    易判決處刑書之記載（如附件）。\n二、審酌被告任意收受他人竊取之機車使用，足見其尊重他人財\n    產權之觀念薄弱，顯有可議；惟該機車價值依據被害人乙○\n    ○於警訊時指述：為新臺幣3000元等語，其價值非鉅，且該\n    車業經發還被害人，有贓物認領保管收據在卷可稽，即被害\n    人所受之財產上損害尚非嚴重；另被告犯後坦承犯行態度尚\n    佳等，及其他一切情狀，量處如主文所示之刑，並諭知易科\n    罰金之折算標準，以示懲儆。\n三、依刑事訴訟法第449 條第1 項、第3 項、第454 條第2 項，\n    刑法第349 條第1 項、第41條第1 項，罰金罰鍰提高標準條\n    例第1條前段、第2條，逕以簡易判決處刑如主文。\n四、如不服本判決，得自收受送達之日起10日內，向本院提起上\n    訴。"
  },
  "search": "臺灣高雄地方法院刑事簡易判決94年度簡字第6222號聲請人臺灣高雄地方法院檢察署檢察官被告甲○○上列被告因贓物案件，經檢察官聲請以簡易判決處刑（94年度偵字第11908號），本院判決如左：主文甲○○收受贓物，處拘役伍拾日，如易科罰金以佰元折算壹日。事實及理由一、本件犯罪事實、證據及應適用之法條，均引用檢察官聲請簡易判決處刑書之記載（如附件）。二、審酌被告任意收受他人竊取之機車使用，足見其尊重他人財產權之觀念薄弱，顯有可議；惟該機車價值依據被害人乙○○於警訊時指述：為新臺幣3000元等語，其價值非鉅，且該車業經發還被害人，有贓物認領保管收據在卷可稽，即被害人所受之財產上損害尚非嚴重；另被告犯後坦承犯行態度尚佳等，及其他一切情狀，量處如主文所示之刑，並諭知易科罰金之折算標準，以示懲儆。三、依刑事訴訟法第449條第1項、第3項、第454條第2項，刑法第349條第1項、第41條第1項，罰金罰鍰提高標準條例第1條前段、第2條，逕以簡易判決處刑如主文。四、如不服本判決，得自收受送達之日起10日內，向本院提起上訴。中華民國94年10月27日鳳山簡易庭法官邱明弘右正本證明與原本無異。中華民國94年10月27日書記官陳掌珠附錄本判決論罪之法條：中華民國刑法第349條：收受贓物者，處三年以下有期徒刑、拘役或五百元以下罰金。搬運、寄藏、故買贓物或為牙保者，處五年以下有期徒刑、拘役或科或併科一千元以下罰金。因贓物變得之財物，以贓物論。",
  "characters": {
    "judges": [

    ],
    "prosecutors": [

    ],
    "lawyers": [

    ],
    "clerks": [
      "陳掌珠"
    ],
    "plaintiffs": [

    ],
    "defendants": [
      "甲○○"
    ],
    "prosecutor_office": [
      "臺灣高雄地方法院檢察署檢察官"
    ],
    "creditors": [

    ],
    "debtors": [

    ],
    "judicial_associate_officer": [

    ]
  },
  "adjudged_at": "2005-10-27",
  "created_at": "2016-02-07 10:08:55",
  "updated_at": "2016-02-07 10:08:55"
}