{
  "identify": "CHD-99-簡-2363-20110117-1",
  "court": {
    "name": "臺灣彰化地方法院",
    "code": "CHD"
  },
  "division": {
    "name": "刑事",
    "code": "M"
  },
  "year": 99,
  "word": "簡",
  "number": "2363",
  "jcheck": "1",
  "reason": "侵占",
  "content": "臺灣彰化地方法院刑事簡易判決          99年度簡字第2363號\n聲  請  人  臺灣彰化地方法院檢察署檢察官\n被      告  楊文亮\n上列被告因侵占案件，經檢察官聲請以簡易判決處刑（99年度偵\n字第10251 號），本院判決如下：\n    主  文\n楊文亮犯侵占離本人持有物罪，處罰金新臺幣壹萬貳仟元，如易\n服勞役，以新臺幣壹仟元折算壹日，減為罰金新臺幣陸仟元，如\n易服勞役，以新臺幣壹仟元折算壹日。\n    事  實  及  理  由\n一、犯罪事實：楊文亮於民國95年2 、3 月間，在臺中市○○區\n    ○○村○○道路旁，見該處有不詳之人所棄置，屬離本人持\n    有物之何潁東所有、車牌號碼QB-9379 號之車牌2 面，竟意\n    圖為自己不法之所有，基於侵占離本人持有物之犯意，將該\n    車牌2 面予以侵占入己，並將之帶回其位於彰化縣彰化市○\n    ○里○○路○ 段292 號住處，懸掛在其兄因交通違規為警查\n    扣車牌之自小客車上。嗣於99年9 月5 日晚間6 時5 分許，\n    因另涉毒品案件，經警前往其上開住處搜索而查獲。\n二、前項犯罪事實，有下列證據可資為佐：\n  (一)被告楊文亮於警詢、偵查中之供述及於本院訊問時之自白。\n  (二)被害人何潁東於警詢時之證言及其出具之贓物認領保管單1\n    紙。\n  (三)嘉義市政府警察局第二分局99年9 月5 日搜索扣押筆錄、扣\n    押物品目錄表各1 份。\n  (四)車牌號碼QB-9379 號之失車唯讀案件基本資料、嘉義市政府\n    警察局車輛尋獲電腦輸入單各1 紙。\n三、被告行為後，刑法已於94年1 月7 日修正、同年2 月2 日公\n    布，並於95年7 月1 日施行，修正前刑法第33條第5 款規定\n    ：「罰金：1 元以上」，修正後刑法第33條第5 款規定：「\n    罰金：新臺幣1,000 元以上，以百元計算之。」，依上開規\n    定比較修正前後刑法第337 條所定之罰金法定刑最低額，修\n    正後之規定並未較有利於被告，依刑法第2 條第1 項之規定\n    ，故仍適用被告行為時即修正前之刑法規定。核被告詹益嵩\n    所為，係犯刑法第337 條之侵占離本人持有物罪。查車牌號\n    碼QB-9379 號之車牌2 面，係被害人何潁東所失竊之物，已\n    據其於警詢時證述明確，且因無證據足認該車牌2 面為被告\n    所竊得之物，亦無其他積極證據可證明被告為侵占犯行時，\n    該車牌2 面仍在他人之持有支配中，是應認上開車牌2 面係\n    盜贓之後為人棄置，而屬離本人持有之物，被告侵占車牌號\n    碼QB-9379 號車牌2 面，應論以侵占離本人持有物罪，聲請\n    簡易判決處刑意旨認應成立同條之侵占遺失物罪，容有誤會\n    。又修正前刑法第42條第2 項前段規定：「易服勞役以1 元\n    以上3 元以下折算1 日」，而被告行為時之易服勞役折算標\n    準，依罰金罰鍰提高標準條例（已廢止）第2 條前段規定，\n    係就其原定數額提高為100 倍折算1 日，則被告行為時易服\n    勞役折算標準，應以銀元300 元即新臺幣900 元折算1 日。\n    而修正後之刑法第42條第3 項前段規定：「易服勞役以新臺\n    幣1,000 元、2,000 元或3,000 元折算1 日」，經比較修正\n    前後之易服勞役折算標準，以修正後之規定，較有利於被告\n    ，則依刑法第2 條第1 項但書規定，應適用修正後刑法第42\n    條第3 項前段規定，定其折算標準（行為後法律有變更，致\n    發生新舊法比較適用時，與罪刑無關之易刑處分，不必列入\n    綜合比較，得分別適用有利於行為人之法律）。末查被告犯\n    罪時間係在96年4 月24日以前，核與中華民國96年罪犯減刑\n    條例第2 條第1 項第3 款所定減刑條件相符，爰依同條例第\n    7 條之規定，於裁判時，減其宣告刑2 分之1 。\n四、依刑事訴訟法第449 條第1 項前段、第454 條第1 項，刑法\n    第2 條第1 項、第337 條、第42條第3 項前段，刑法施行法\n    第1 條之1 第1 項、第2 項前段，中華民國96年罪犯減刑條\n    例第2 條第1 項第3 款、第7 條，逕以簡易判決處如主文所\n    示之刑。\n五、如不服本判決，得於判決書送達之日起10日內，以書狀敘述\n    理由，向本院提出上訴。\n中    華    民    國   100    年    1     月    17    日\n                  刑事第八庭          法  官  王素珍\n以上正本證明與原本無異。\n不服本判決，應於判決送達後10日內，向本院提出上訴書狀，上\n訴書狀應「敘述具體上訴理由」，並按他造當事人之人數附繕本\n。「切勿逕送上級法院」。\n告訴人或被害人對於判決如有不服具備理由請求檢察官上訴者，\n其上訴期間之計算係以檢察官收受判決正本之日期為準。\n中    華    民    國   100    年    1     月    18    日\n                                     書記官  陳秀香\n附錄本案論罪科刑法條：\n中華民國刑法第337條\n意圖為自己或第三人不法之所有，而侵占遺失物、漂流物或其他\n離本人所持有之物者，處 5 百元以下罰金。",
  "structure": {
    "fact": "一、犯罪事實：楊文亮於民國95年2 、3 月間，在臺中市○○區\n    ○○村○○道路旁，見該處有不詳之人所棄置，屬離本人持\n    有物之何潁東所有、車牌號碼QB-9379 號之車牌2 面，竟意\n    圖為自己不法之所有，基於侵占離本人持有物之犯意，將該\n    車牌2 面予以侵占入己，並將之帶回其位於彰化縣彰化市○\n    ○里○○路○ 段292 號住處，懸掛在其兄因交通違規為警查\n    扣車牌之自小客車上。嗣於99年9 月5 日晚間6 時5 分許，\n    因另涉毒品案件，經警前往其上開住處搜索而查獲。\n二、前項犯罪事實，有下列證據可資為佐：\n  (一)被告楊文亮於警詢、偵查中之供述及於本院訊問時之自白。\n  (二)被害人何潁東於警詢時之證言及其出具之贓物認領保管單1\n    紙。\n  (三)嘉義市政府警察局第二分局99年9 月5 日搜索扣押筆錄、扣\n    押物品目錄表各1 份。\n  (四)車牌號碼QB-9379 號之失車唯讀案件基本資料、嘉義市政府\n    警察局車輛尋獲電腦輸入單各1 紙。\n三、被告行為後，刑法已於94年1 月7 日修正、同年2 月2 日公\n    布，並於95年7 月1 日施行，修正前刑法第33條第5 款規定\n    ：「罰金：1 元以上」，修正後刑法第33條第5 款規定：「\n    罰金：新臺幣1,000 元以上，以百元計算之。」，依上開規\n    定比較修正前後刑法第337 條所定之罰金法定刑最低額，修\n    正後之規定並未較有利於被告，依刑法第2 條第1 項之規定\n    ，故仍適用被告行為時即修正前之刑法規定。核被告詹益嵩\n    所為，係犯刑法第337 條之侵占離本人持有物罪。查車牌號\n    碼QB-9379 號之車牌2 面，係被害人何潁東所失竊之物，已\n    據其於警詢時證述明確，且因無證據足認該車牌2 面為被告\n    所竊得之物，亦無其他積極證據可證明被告為侵占犯行時，\n    該車牌2 面仍在他人之持有支配中，是應認上開車牌2 面係\n    盜贓之後為人棄置，而屬離本人持有之物，被告侵占車牌號\n    碼QB-9379 號車牌2 面，應論以侵占離本人持有物罪，聲請\n    簡易判決處刑意旨認應成立同條之侵占遺失物罪，容有誤會\n    。又修正前刑法第42條第2 項前段規定：「易服勞役以1 元\n    以上3 元以下折算1 日」，而被告行為時之易服勞役折算標\n    準，依罰金罰鍰提高標準條例（已廢止）第2 條前段規定，\n    係就其原定數額提高為100 倍折算1 日，則被告行為時易服\n    勞役折算標準，應以銀元300 元即新臺幣900 元折算1 日。\n    而修正後之刑法第42條第3 項前段規定：「易服勞役以新臺\n    幣1,000 元、2,000 元或3,000 元折算1 日」，經比較修正\n    前後之易服勞役折算標準，以修正後之規定，較有利於被告\n    ，則依刑法第2 條第1 項但書規定，應適用修正後刑法第42\n    條第3 項前段規定，定其折算標準（行為後法律有變更，致\n    發生新舊法比較適用時，與罪刑無關之易刑處分，不必列入\n    綜合比較，得分別適用有利於行為人之法律）。末查被告犯\n    罪時間係在96年4 月24日以前，核與中華民國96年罪犯減刑\n    條例第2 條第1 項第3 款所定減刑條件相符，爰依同條例第\n    7 條之規定，於裁判時，減其宣告刑2 分之1 。\n四、依刑事訴訟法第449 條第1 項前段、第454 條第1 項，刑法\n    第2 條第1 項、第337 條、第42條第3 項前段，刑法施行法\n    第1 條之1 第1 項、第2 項前段，中華民國96年罪犯減刑條\n    例第2 條第1 項第3 款、第7 條，逕以簡易判決處如主文所\n    示之刑。\n五、如不服本判決，得於判決書送達之日起10日內，以書狀敘述\n    理由，向本院提出上訴。"
  },
  "search": "臺灣彰化地方法院刑事簡易判決99年度簡字第2363號聲請人臺灣彰化地方法院檢察署檢察官被告楊文亮上列被告因侵占案件，經檢察官聲請以簡易判決處刑（99年度偵字第10251號），本院判決如下：主文楊文亮犯侵占離本人持有物罪，處罰金新臺幣壹萬貳仟元，如易服勞役，以新臺幣壹仟元折算壹日，減為罰金新臺幣陸仟元，如易服勞役，以新臺幣壹仟元折算壹日。事實及理由一、犯罪事實：楊文亮於民國95年2、3月間，在臺中市○○區○○村○○道路旁，見該處有不詳之人所棄置，屬離本人持有物之何潁東所有、車牌號碼QB-9379號之車牌2面，竟意圖為自己不法之所有，基於侵占離本人持有物之犯意，將該車牌2面予以侵占入己，並將之帶回其位於彰化縣彰化市○○里○○路○段292號住處，懸掛在其兄因交通違規為警查扣車牌之自小客車上。嗣於99年9月5日晚間6時5分許，因另涉毒品案件，經警前往其上開住處搜索而查獲。二、前項犯罪事實，有下列證據可資為佐：(一)被告楊文亮於警詢、偵查中之供述及於本院訊問時之自白。(二)被害人何潁東於警詢時之證言及其出具之贓物認領保管單1紙。(三)嘉義市政府警察局第二分局99年9月5日搜索扣押筆錄、扣押物品目錄表各1份。(四)車牌號碼QB-9379號之失車唯讀案件基本資料、嘉義市政府警察局車輛尋獲電腦輸入單各1紙。三、被告行為後，刑法已於94年1月7日修正、同年2月2日公布，並於95年7月1日施行，修正前刑法第33條第5款規定：「罰金：1元以上」，修正後刑法第33條第5款規定：「罰金：新臺幣1,000元以上，以百元計算之。」，依上開規定比較修正前後刑法第337條所定之罰金法定刑最低額，修正後之規定並未較有利於被告，依刑法第2條第1項之規定，故仍適用被告行為時即修正前之刑法規定。核被告詹益嵩所為，係犯刑法第337條之侵占離本人持有物罪。查車牌號碼QB-9379號之車牌2面，係被害人何潁東所失竊之物，已據其於警詢時證述明確，且因無證據足認該車牌2面為被告所竊得之物，亦無其他積極證據可證明被告為侵占犯行時，該車牌2面仍在他人之持有支配中，是應認上開車牌2面係盜贓之後為人棄置，而屬離本人持有之物，被告侵占車牌號碼QB-9379號車牌2面，應論以侵占離本人持有物罪，聲請簡易判決處刑意旨認應成立同條之侵占遺失物罪，容有誤會。又修正前刑法第42條第2項前段規定：「易服勞役以1元以上3元以下折算1日」，而被告行為時之易服勞役折算標準，依罰金罰鍰提高標準條例（已廢止）第2條前段規定，係就其原定數額提高為100倍折算1日，則被告行為時易服勞役折算標準，應以銀元300元即新臺幣900元折算1日。而修正後之刑法第42條第3項前段規定：「易服勞役以新臺幣1,000元、2,000元或3,000元折算1日」，經比較修正前後之易服勞役折算標準，以修正後之規定，較有利於被告，則依刑法第2條第1項但書規定，應適用修正後刑法第42條第3項前段規定，定其折算標準（行為後法律有變更，致發生新舊法比較適用時，與罪刑無關之易刑處分，不必列入綜合比較，得分別適用有利於行為人之法律）。末查被告犯罪時間係在96年4月24日以前，核與中華民國96年罪犯減刑條例第2條第1項第3款所定減刑條件相符，爰依同條例第7條之規定，於裁判時，減其宣告刑2分之1。四、依刑事訴訟法第449條第1項前段、第454條第1項，刑法第2條第1項、第337條、第42條第3項前段，刑法施行法第1條之1第1項、第2項前段，中華民國96年罪犯減刑條例第2條第1項第3款、第7條，逕以簡易判決處如主文所示之刑。五、如不服本判決，得於判決書送達之日起10日內，以書狀敘述理由，向本院提出上訴。中華民國100年1月17日刑事第八庭法官王素珍以上正本證明與原本無異。不服本判決，應於判決送達後10日內，向本院提出上訴書狀，上訴書狀應「敘述具體上訴理由」，並按他造當事人之人數附繕本。「切勿逕送上級法院」。告訴人或被害人對於判決如有不服具備理由請求檢察官上訴者，其上訴期間之計算係以檢察官收受判決正本之日期為準。中華民國100年1月18日書記官陳秀香附錄本案論罪科刑法條：中華民國刑法第337條意圖為自己或第三人不法之所有，而侵占遺失物、漂流物或其他離本人所持有之物者，處5百元以下罰金。",
  "characters": {
    "judges": [
      "王素珍"
    ],
    "prosecutors": [

    ],
    "lawyers": [

    ],
    "clerks": [
      "陳秀香"
    ],
    "plaintiffs": [

    ],
    "defendants": [
      "楊文亮"
    ],
    "prosecutor_office": [
      "臺灣彰化地方法院檢察署檢察官"
    ],
    "creditors": [

    ],
    "debtors": [

    ],
    "judicial_associate_officer": [

    ]
  },
  "adjudged_at": "2011-01-17",
  "created_at": "2016-02-13 09:31:42",
  "updated_at": "2016-02-13 09:31:42"
}