{
  "identify": "KSD-94-交聲-134-20050530-1",
  "court": {
    "name": "臺灣高雄地方法院",
    "code": "KSD"
  },
  "division": {
    "name": "刑事",
    "code": "M"
  },
  "year": 94,
  "word": "交聲",
  "number": "134",
  "jcheck": "1",
  "reason": "聲明異議",
  "content": "臺灣高雄地方法院刑事裁定             94年度交聲字第134號\n原處分機關  交通部公路總局高雄區監理所\n異  議  人  甲○○  男  55歲.\n上列受處分人對於交通部公路總局高雄區監理所94年3 月16日所\n為之處分（原處分：高監自字第裁80-Z00000000號），聲明異議\n，本院裁定如下：\n    主  文\n異議駁回。\n    理  由\n一、異議意旨略以：異議人甲○○於民國94年2 月13日11時15分\n    許，駕駛車號UG-7173 號自用小貨車行經國道3 號北向善化\n    收費站時，因該收費站維修、粉刷造成「標誌、指示」不明\n    ，已無標誌或號誌指示可憑遵守，現場又無公路警察指揮，\n    且該爭議入口即第6 分道，又無封閉標示或其他管制措施，\n    依道路交通標誌標線號誌設置規則第3 條規定：「一、標誌\n    ：以規定之符號、圖案或簡明文字繪於一定形狀之標牌上，\n    安裝於固定或可移動之支撐物體，設置於適當之地點，用以\n    預告或管制前方路況，促使車輛駕駛人與行人注意、遵守之\n    交通管制設施。二、標線：以規定之線條、圖形、標字或其\n    他導向裝置，劃設於路面或其他設施上，用以管制道路上車\n    輛駕駛人與行人行止之交通管制設施。三、號誌：以規定之\n    時間上交互更迭之光色訊號，設置於交岔路口或其他特殊地\n    點，用以將道路通行權指定給車輛駕駛人與行人，管制其行\n    止及轉向之交通管制設施。」，實不能期待用路人不誤駛車\n    道，據此提出異議等語。\n二、按道路交通管理處罰條例第33條第1 項規定：汽車行駛於高\n    速公路或設站管制之道路，而不遵管制之規定者，處汽車駕\n    駛人新臺幣3 千元以上6 千元以下罰鍰。又汽車駕駛人有左\n    列各款所列條款之一者，除依原條款處罰鍰外，並予記點：\n    一、有第33條情形者，記違規點數1 點，道路交通管理處罰\n    條例第63條第1 項第1 款，亦訂有明文。\n三、經查，異議人於94年2 月13日11時15分許，駕駛車號UG-717\n    3 號自用小貨車行經國道3 號北向善化收費站時，通過該收\n    費站第6 分道收票亭一事，業經異議人於本院調查時陳明在\n    卷，並提出該收費站94年2 月13日照片1 紙附卷可稽。雖異\n    議人通過之第6 分道車道，其上之標誌僅有藍色底色，未標\n    示任何文字，有該照片1 紙在卷可稽。惟照片上所示第1、2\n    、3 、4 分道為現金及回數票收費車道，以黃底藍字標示「\n    現金/ 回數票（第3 、4 分道）」、「Cash/Ticket （第1\n    、2 分道）」；第7 、8 車道為回數票收費車道，以藍底白\n    字標示「With Ticket （應係Car With Ticket ，因照片取\n    景關係，並非全部車道之景象）」，有該照片附卷可稽。惟\n    依異議人提出之94年4 月2 日該收費站之照片，比對其提出\n    該收費站94年2 月13日之照片觀之，善化收費站第5 、6 、\n    7 、8 、9 、10分道均屬回數票收費車道，以藍底白字標示\n    「持回數票小型車（第9 、10分道）」、「Car With Ticke\n    t （第7 、8 分道）」、「持回數票小型車（第5 、6 分道\n    ）」，有該照片附卷可資比對。從而，異議人於94年2 月13\n    日11時15分許，駕駛車號UG-7173 號自用小貨車行經國道3\n    號北向善化收費站時，第5 、6 車道雖僅有藍底而未有車道\n    收費類別之標示，然依該收費站票亭上第7 、8 、9 、10分\n    道均為藍底白字，標示「持回數票小型車（第9 、10分道）\n    、Car With Ticket （第7 、8 分道）」，且第6 分道為藍\n    色底色，緊鄰第7 分道，第5 分道為藍色底色並關閉收費，\n    第5 分道緊鄰之第4 、3 、2 、1 分道以黃底藍字標示「現\n    金/ 回數票（第3 、4 分道）」、「Cash/Ticket （第1、2\n    分道）」整體觀之，雖異議人通過之第6 分道並未有收費類\n    別之標示，因第5 分道已關閉收費，且該收費站上之藍底、\n    黃底之標示甚為明顯，亦不至於誤認藍色底色之第6 分道屬\n    現金收費車道，是難以第6 分道之標示僅有藍底，即遽認該\n    分道標示不明。況異議人自陳其在台汽客運公司開大客車已\n    20 年 ，載客路線為臺南至嘉義、台中、台北、屏東等地，\n    經常在高速公路行駛，則異議人對於收費站藍底標示之車道\n    為回數票車道、黃底標示之車道為使用現金車道，應知之甚\n    詳，是異議人以其通過之車道標示不清致其誤闖車道，顯不\n    可採。又異議人應到案日為94年2 月28日，異議人於到案日\n    前之94年2 月17日到案聽候裁決，有內政部警政署國道公路\n    警察局公警局交字第Z000 0000 號舉發違反道路交通事件通\n    知單、陳情書各1 份附卷可稽。從而，原處分機關援引前揭\n    規定，逕行裁處，並無不當。本件聲明異議為無理由，應予\n    駁回。\n三、據上論斷，應依道路交通案件處理辦法第19條，裁定如主文\n    。\n中    華    民    國    94    年    5     月    30    日\n                  交通法庭    法  官  黃惠玲\n以上正本證明與原本無異。\n如不服本裁定應於送達後5日內向本院提出抗告狀。\n中    華    民    國    94    年    6     月    2    日\n                              書記官  林秀珍\n",
  "structure": {
    "main": "異議駁回。",
    "reason": "一、異議意旨略以：異議人甲○○於民國94年2 月13日11時15分\n    許，駕駛車號UG-7173 號自用小貨車行經國道3 號北向善化\n    收費站時，因該收費站維修、粉刷造成「標誌、指示」不明\n    ，已無標誌或號誌指示可憑遵守，現場又無公路警察指揮，\n    且該爭議入口即第6 分道，又無封閉標示或其他管制措施，\n    依道路交通標誌標線號誌設置規則第3 條規定：「一、標誌\n    ：以規定之符號、圖案或簡明文字繪於一定形狀之標牌上，\n    安裝於固定或可移動之支撐物體，設置於適當之地點，用以\n    預告或管制前方路況，促使車輛駕駛人與行人注意、遵守之\n    交通管制設施。二、標線：以規定之線條、圖形、標字或其\n    他導向裝置，劃設於路面或其他設施上，用以管制道路上車\n    輛駕駛人與行人行止之交通管制設施。三、號誌：以規定之\n    時間上交互更迭之光色訊號，設置於交岔路口或其他特殊地\n    點，用以將道路通行權指定給車輛駕駛人與行人，管制其行\n    止及轉向之交通管制設施。」，實不能期待用路人不誤駛車\n    道，據此提出異議等語。\n二、按道路交通管理處罰條例第33條第1 項規定：汽車行駛於高\n    速公路或設站管制之道路，而不遵管制之規定者，處汽車駕\n    駛人新臺幣3 千元以上6 千元以下罰鍰。又汽車駕駛人有左\n    列各款所列條款之一者，除依原條款處罰鍰外，並予記點：\n    一、有第33條情形者，記違規點數1 點，道路交通管理處罰\n    條例第63條第1 項第1 款，亦訂有明文。\n三、經查，異議人於94年2 月13日11時15分許，駕駛車號UG-717\n    3 號自用小貨車行經國道3 號北向善化收費站時，通過該收\n    費站第6 分道收票亭一事，業經異議人於本院調查時陳明在\n    卷，並提出該收費站94年2 月13日照片1 紙附卷可稽。雖異\n    議人通過之第6 分道車道，其上之標誌僅有藍色底色，未標\n    示任何文字，有該照片1 紙在卷可稽。惟照片上所示第1、2\n    、3 、4 分道為現金及回數票收費車道，以黃底藍字標示「\n    現金/ 回數票（第3 、4 分道）」、「Cash/Ticket （第1\n    、2 分道）」；第7 、8 車道為回數票收費車道，以藍底白\n    字標示「With Ticket （應係Car With Ticket ，因照片取\n    景關係，並非全部車道之景象）」，有該照片附卷可稽。惟\n    依異議人提出之94年4 月2 日該收費站之照片，比對其提出\n    該收費站94年2 月13日之照片觀之，善化收費站第5 、6 、\n    7 、8 、9 、10分道均屬回數票收費車道，以藍底白字標示\n    「持回數票小型車（第9 、10分道）」、「Car With Ticke\n    t （第7 、8 分道）」、「持回數票小型車（第5 、6 分道\n    ）」，有該照片附卷可資比對。從而，異議人於94年2 月13\n    日11時15分許，駕駛車號UG-7173 號自用小貨車行經國道3\n    號北向善化收費站時，第5 、6 車道雖僅有藍底而未有車道\n    收費類別之標示，然依該收費站票亭上第7 、8 、9 、10分\n    道均為藍底白字，標示「持回數票小型車（第9 、10分道）\n    、Car With Ticket （第7 、8 分道）」，且第6 分道為藍\n    色底色，緊鄰第7 分道，第5 分道為藍色底色並關閉收費，\n    第5 分道緊鄰之第4 、3 、2 、1 分道以黃底藍字標示「現\n    金/ 回數票（第3 、4 分道）」、「Cash/Ticket （第1、2\n    分道）」整體觀之，雖異議人通過之第6 分道並未有收費類\n    別之標示，因第5 分道已關閉收費，且該收費站上之藍底、\n    黃底之標示甚為明顯，亦不至於誤認藍色底色之第6 分道屬\n    現金收費車道，是難以第6 分道之標示僅有藍底，即遽認該\n    分道標示不明。況異議人自陳其在台汽客運公司開大客車已\n    20 年 ，載客路線為臺南至嘉義、台中、台北、屏東等地，\n    經常在高速公路行駛，則異議人對於收費站藍底標示之車道\n    為回數票車道、黃底標示之車道為使用現金車道，應知之甚\n    詳，是異議人以其通過之車道標示不清致其誤闖車道，顯不\n    可採。又異議人應到案日為94年2 月28日，異議人於到案日\n    前之94年2 月17日到案聽候裁決，有內政部警政署國道公路\n    警察局公警局交字第Z000 0000 號舉發違反道路交通事件通\n    知單、陳情書各1 份附卷可稽。從而，原處分機關援引前揭\n    規定，逕行裁處，並無不當。本件聲明異議為無理由，應予\n    駁回。\n三、據上論斷，應依道路交通案件處理辦法第19條，裁定如主文\n    。"
  },
  "search": "臺灣高雄地方法院刑事裁定94年度交聲字第134號原處分機關交通部公路總局高雄區監理所異議人甲○○男55歲.上列受處分人對於交通部公路總局高雄區監理所94年3月16日所為之處分（原處分：高監自字第裁80-Z00000000號），聲明異議，本院裁定如下：主文異議駁回。理由一、異議意旨略以：異議人甲○○於民國94年2月13日11時15分許，駕駛車號UG-7173號自用小貨車行經國道3號北向善化收費站時，因該收費站維修、粉刷造成「標誌、指示」不明，已無標誌或號誌指示可憑遵守，現場又無公路警察指揮，且該爭議入口即第6分道，又無封閉標示或其他管制措施，依道路交通標誌標線號誌設置規則第3條規定：「一、標誌：以規定之符號、圖案或簡明文字繪於一定形狀之標牌上，安裝於固定或可移動之支撐物體，設置於適當之地點，用以預告或管制前方路況，促使車輛駕駛人與行人注意、遵守之交通管制設施。二、標線：以規定之線條、圖形、標字或其他導向裝置，劃設於路面或其他設施上，用以管制道路上車輛駕駛人與行人行止之交通管制設施。三、號誌：以規定之時間上交互更迭之光色訊號，設置於交岔路口或其他特殊地點，用以將道路通行權指定給車輛駕駛人與行人，管制其行止及轉向之交通管制設施。」，實不能期待用路人不誤駛車道，據此提出異議等語。二、按道路交通管理處罰條例第33條第1項規定：汽車行駛於高速公路或設站管制之道路，而不遵管制之規定者，處汽車駕駛人新臺幣3千元以上6千元以下罰鍰。又汽車駕駛人有左列各款所列條款之一者，除依原條款處罰鍰外，並予記點：一、有第33條情形者，記違規點數1點，道路交通管理處罰條例第63條第1項第1款，亦訂有明文。三、經查，異議人於94年2月13日11時15分許，駕駛車號UG-7173號自用小貨車行經國道3號北向善化收費站時，通過該收費站第6分道收票亭一事，業經異議人於本院調查時陳明在卷，並提出該收費站94年2月13日照片1紙附卷可稽。雖異議人通過之第6分道車道，其上之標誌僅有藍色底色，未標示任何文字，有該照片1紙在卷可稽。惟照片上所示第1、2、3、4分道為現金及回數票收費車道，以黃底藍字標示「現金/回數票（第3、4分道）」、「Cash/Ticket（第1、2分道）」；第7、8車道為回數票收費車道，以藍底白字標示「WithTicket（應係CarWithTicket，因照片取景關係，並非全部車道之景象）」，有該照片附卷可稽。惟依異議人提出之94年4月2日該收費站之照片，比對其提出該收費站94年2月13日之照片觀之，善化收費站第5、6、7、8、9、10分道均屬回數票收費車道，以藍底白字標示「持回數票小型車（第9、10分道）」、「CarWithTicket（第7、8分道）」、「持回數票小型車（第5、6分道）」，有該照片附卷可資比對。從而，異議人於94年2月13日11時15分許，駕駛車號UG-7173號自用小貨車行經國道3號北向善化收費站時，第5、6車道雖僅有藍底而未有車道收費類別之標示，然依該收費站票亭上第7、8、9、10分道均為藍底白字，標示「持回數票小型車（第9、10分道）、CarWithTicket（第7、8分道）」，且第6分道為藍色底色，緊鄰第7分道，第5分道為藍色底色並關閉收費，第5分道緊鄰之第4、3、2、1分道以黃底藍字標示「現金/回數票（第3、4分道）」、「Cash/Ticket（第1、2分道）」整體觀之，雖異議人通過之第6分道並未有收費類別之標示，因第5分道已關閉收費，且該收費站上之藍底、黃底之標示甚為明顯，亦不至於誤認藍色底色之第6分道屬現金收費車道，是難以第6分道之標示僅有藍底，即遽認該分道標示不明。況異議人自陳其在台汽客運公司開大客車已20年，載客路線為臺南至嘉義、台中、台北、屏東等地，經常在高速公路行駛，則異議人對於收費站藍底標示之車道為回數票車道、黃底標示之車道為使用現金車道，應知之甚詳，是異議人以其通過之車道標示不清致其誤闖車道，顯不可採。又異議人應到案日為94年2月28日，異議人於到案日前之94年2月17日到案聽候裁決，有內政部警政署國道公路警察局公警局交字第Z0000000號舉發違反道路交通事件通知單、陳情書各1份附卷可稽。從而，原處分機關援引前揭規定，逕行裁處，並無不當。本件聲明異議為無理由，應予駁回。三、據上論斷，應依道路交通案件處理辦法第19條，裁定如主文。中華民國94年5月30日交通法庭法官黃惠玲以上正本證明與原本無異。如不服本裁定應於送達後5日內向本院提出抗告狀。中華民國94年6月2日書記官林秀珍",
  "characters": {
    "judges": [
      "黃惠玲"
    ],
    "prosecutors": [

    ],
    "lawyers": [

    ],
    "clerks": [
      "林秀珍"
    ],
    "plaintiffs": [

    ],
    "defendants": [

    ],
    "prosecutor_office": [

    ],
    "creditors": [

    ],
    "debtors": [

    ],
    "judicial_associate_officer": [

    ]
  },
  "adjudged_at": "2005-05-30",
  "created_at": "2016-02-06 16:10:35",
  "updated_at": "2016-02-06 16:10:35"
}