{
  "identify": "TCD-93-重訴-344-20041231-1",
  "court": {
    "name": "臺灣臺中地方法院",
    "code": "TCD"
  },
  "division": {
    "name": "民事",
    "code": "V"
  },
  "year": 93,
  "word": "重訴",
  "number": "344",
  "jcheck": "1",
  "reason": "損害賠償",
  "content": "臺灣臺中地方法院民事判決  九十三年度重訴字第三四四號\n    原      告  丁○○\n    被      告  甲○○\n                戊○○\n    兼\n    訴訟代理人  乙○○\n    被      告  丙○○\n右被告因常業詐欺案件，經原告提起請求損害賠償之附帶民事訴訟（九十三年度附民\n字第三九號），經本院刑事庭裁定移送前來，本院於民國九十三年十二月二十一日言\n詞辯論終結，判決如左：\n    主      文\n被告應連帶給付原告新台幣柒佰零玖萬柒仟壹佰元，及自民國九十一年十一月二十二\n日起至清償日止，按週年利率百分之五計算之利息。\n訴訟費用由被告連帶負擔。\n本判決於原告以新台幣貳佰參拾陸萬陸仟元為被告供擔保後，得為假執行；但被告乙\n○○、甲○○、戊○○如以新台幣柒佰零玖萬柒仟壹佰元，為原告預供擔保後，得免\n為假執行。\n    事實及理由\n甲、程序方面\n壹、按言詞辯論期日，當事人之一造不到場者，得依到場當事人之聲請，由其一造辯\n    論而為判決，民事訴訟法第三百八十五條第一項前段定有明文。查被告均經合法\n    通知，而未於言詞辯論期日到場，且均核無民事訴訟法第三百八十六條各款所列\n    情形，爰依原告之聲請，由其一造辯論而為判決。\n貳、次按訴狀送達後，原告不得將原訴變更或追加他訴，但擴張或減縮應受判決事項\n    之聲明者，不在此限，民事訴訟法第二百五十五條第一項第三款定有明文。查本\n    件原告起訴時，係請求被告連帶給付新台幣（下同）七百四十七萬元，及自民國\n    （下同）九十一年十一月二十二日起至清償日止，按週年利率百分之六計算之利\n    息；嗣原告於九十三年十二月二十一日，請求被告連帶給付七百零九萬七千一百\n    元，及自九十一年十二月二十一日起至清償日止，按週年利率百分之五計算之利\n    息，是原告就前開請求，顯屬減縮應受判決事項之聲明，合於前揭條文之規定，\n    是其所為訴之聲明減縮，自應予以准許。\n參、再按民事訴訟法第一百八十三條所謂訴訟中有犯罪嫌疑牽涉其裁判，係指在民事\n    訴訟繫屬中，當事人或第三人涉有犯罪嫌疑，足以影響民事訴訟之裁判，非俟刑\n    事訴訟解決，民事法院即無從或難於判斷者而言；例如當事人或第三人於民事訴\n    訟繫屬中涉有偽造文書、證人偽證、鑑定人為不實之鑑定等罪嫌，始足當之；是\n    當事人在民事訴訟繫屬「以前」有犯罪行為，縱牽涉其裁判，亦不在同條所定得\n    裁定停止訴訟程序之列（最高法院九十二年度台上字第一六七三號判決、七十九\n    年台抗字第二一八號判例參照）。另按民事訴訟法第一百八十三條雖規定訴訟中\n    有犯罪嫌疑牽涉其裁判者，法院得命在刑事訴訟終結前，以裁定停止訴訟程序，\n    但應否停止訴訟程序，仍依法院之自由意見決之（最高法院三十八年度台上字第\n    一九三號判例、九十二年度台抗字第五六八號裁定參照）。查被告乙○○、甲○\n    ○、戊○○涉有前開常業詐欺刑事罪嫌，係在本件民事訴訟繫屬以前有涉有犯罪\n    行為，縱牽涉本件民事裁判，然依前開說明，並非民事訴訟法第一百八十三條所\n    謂訴訟中有犯罪嫌疑牽涉其裁判，不在得裁定停止訴訟程序之列；況本院就兩造\n    所爭執之事實，本得依職權獨立認定，而自行調查證據之結果，已足以形成心證\n    ，依前開說明，本院亦得不停止本件民事訴訟程序。是被告乙○○、甲○○、戊\n    ○○抗辯前開刑事訴訟程序既未終結，本件自應依民事訴訟法第一百八十三條之\n    規定裁定停止訴訟程序云云，自不可取。\n乙、實體方面\n壹、原告主張：一、被告乙○○、甲○○、戊○○共同組成「國浩集團」，以電腦抽\n    獎名義行詐財之行為，自九十一年十一月二十二日起至九十一年十二月二十日止\n    ，該集團成員以手機簡訊使原告陷於錯誤之方式，令原告匯款共七百零九萬七千\n    一百元至訴外人張林貴、張元聰、張誌松、賴岳毅、王進吉設於金融機構之帳戶\n    。被告乙○○、甲○○、戊○○因前開行為，遭檢察官以常業詐欺罪提起公訴。\n    而被告丙○○明知不法集團常誘使被害人將款項匯入人頭帳戶，竟掩飾其餘被告\n    常業詐欺之所得，係幫助犯，亦經檢察官提起公訴。二、原告因被告前開行為而\n    受有前開七百零九萬七千一百元之損害，爰依共同侵權行為之法律關係，請求被\n    告連帶賠償前開金額及其法定利息等語。並聲明：（一）被告應連帶給付原告七\n    百零九萬七千一百元及自九十一年十一月二十二日起至清償日止，按週年利率百\n    分之五計算之利息。（二）訴訟費用由被告連帶負擔。（三）陳明願供擔保請准\n    宣告假執行。\n貳、被告方面：\n一、被告乙○○、甲○○、戊○○則均以：（一）被告並未共組詐騙集團，亦未詐騙\n    原告；被告三人雖遭本院九十二年度訴字第二七八五號刑事判決認定有罪，惟均\n    已提起上訴中，尚不得據前開刑事判決即遽認被告有詐騙行為，被告自毋庸負損\n    害賠償責任。（二）前開刑事訴訟程序既未終結，且關係被告應否負損害賠償責\n    任，依民事訴訟法第一百八十三條之規定，自應裁定停止本件訴訟程序等語，資\n    為抗辯。並均聲明：（一）原告之訴駁回。（二）訴訟費用由原告負擔。（三）\n    如受不利之判決，請准供擔保免為假執行。\n二、被告丙○○則未於言詞辯論期日到場，亦未提出書狀為聲明或陳述。\n參、得心證之理由：\n一、按因故意或過失，不法侵害他人之權利者，負損害賠償責任，故意以背於善良風\n    俗之方法加損害於他人者亦同；數人共同不法侵害他人之權利者，連帶負損害賠\n    償責任，幫助人視為共同行為人，民法第一百八十四條第一項與第一百八十五條\n    第一項前段、第二項分別定有明文。查原告主張之事實，有存摺節影本、郵政國\n    內匯款單執據、自動櫃員機儲戶交易明細表、國內匯款聲請書、自動櫃員機交易\n    明細表、起訴書與本院九十二年度訴字第二七八五號刑事判決等為證，並經本院\n    調取本院九十二年度訴字第二七八五號刑事卷核閱無誤。另參酌被告丙○○出售\n    其所持有之謝敏吾所申請開立之名間松嶺郵局帳戶（局號０四０一一八、帳號０\n    ０六五七九）及賴岳毅所申請開立之水里郵局帳戶（局號0000000、帳號\n    0000000）予姓名年籍不詳綽號「小李」之成年男子作為詐騙集團匯款帳\n    戶使用之情，業據本院於九十二年七月二十一日以九十二年度金訴字第一九號判\n    處有期徒刑十月，經臺灣高等法院臺中分院於九十二年十一月四日以九十二年度\n    金上訴字第一七四八號駁回上訴，經最高法院於九十三年一月八日以九十三年度\n    臺上字第一二五號駁回上訴確定，此有最高法院九十三年臺上字第一二五號刑事\n    判決、臺灣高等法院臺中分院九十二年度金上訴字第一七四八號刑事判決、本院\n    九十二年度金訴字第一九號刑事判決附於本院前開九十二年度訴字第二七八五號\n    卷可稽；前開詐騙集團成員取得訴外人王進吉所設立之金融機構帳戶，而訴外人\n    即前開刑事案件之被害人張尤谷、周從貴、韋碧蓮、李玉梅、練麗華於前開刑事\n    卷之警詢及偵查中之指訴內容，被害人即本件原告丁○○由監聽錄音帶中明確指\n    認出被告乙○○、甲○○，被害人張尤谷則指認出被告乙○○、戊○○，被害人\n    周從貴指認出被告乙○○，被害人韋碧蓮指認出被告乙○○，被害人李玉梅指認\n    出被告乙○○，被害人練麗華於警詢中指認被告乙○○，且被害人丁○○、張尤\n    谷、周從貴、韋碧蓮、李玉梅、練歷華於警詢中並提出其個人之匯款單、刮刮樂\n    中獎單等書證為據，被告乙○○、甲○○、戊○○確參與前開詐騙集團，應堪認\n    定。再查訴外人即前開刑事案件之被害人王鴻堉、歐雨晴、葉供槐明確指認被告\n    乙○○、戊○○即為詐騙集團之成員，被害人韓政達、葉碧璐亦指認被告乙○○\n    為詐騙集團之成員，被害人王鴻堉、歐雨晴、韓政達、葉供槐、葉碧璐等人，與\n    被告乙○○、甲○○、戊○○素未謀面，亦不相識，自無可能蓄意誣指，且被害\n    人王鴻堉、歐雨晴、韓政達、葉供槐、葉碧璐等人係分別指認個人可以確認之聲\n    音，並非附和警察之查證而概括的指稱均為詐騙集團之成員，則被害人王鴻堉、\n    歐雨晴、韓政達、葉供槐、葉碧璐之指認，應係經過深思熟慮，且詳細聆聽比對\n    後之結果，被告乙○○、甲○○、戊○○確實參與前開詐騙集團，應無疑問。則\n    被告乙○○、甲○○、戊○○有前開共同詐欺行為，而被告丙○○幫助詐欺行為\n    ，均可認定。是依前開規定，被告對原告為前開行為，自應負共同侵權行為之賠\n    償責任。\n二、再按負損害賠償責任者，除法律另有規定或契約另有訂定外，應回復他方損害發\n    生前之原狀；因回復原狀而應給付金錢者，自損害發生時起，加給利息，民法第\n    二百十三條第一、二項定有明文。而損害賠償，除法律另有規定或契約另有訂定\n    外，應以填補債權人所受損害及所失利益為限，同法第二百十六條第一項亦有規\n    定。另按遲延之債務，以支付金錢為標的者，債權人得請求依法定利率計算之遲\n    延利息；應負利息之債務，其利率未經約定，亦無法律可據者，週年利率為百分\n    之五，亦為民法第二百三十三條第一項、第二百零三條所明定。查原告遭詐欺匯\n    款七百零九萬七千一百元，業如前述，則依前開各規定，原告請求被告連帶給付\n    七百零九萬七千一百元及自九十一年十一月二十二日起至清償日止，按週年利率\n    百分之五計算之利息，自屬有據，應予准許。\n三、綜上所述，原告基於共同侵權行為損害賠償請求權之法律關係，請求被告連帶給\n    付七百零九萬七千一百元，及自九十一年十一月二十二日起至清償日止，按年息\n    百分之五計算之利息部分，為有理由，應予准許。\n四、本件原告勝訴部分，原告及被告乙○○、甲○○、戊○○均陳明願供擔保，聲請\n    准予宣告假執行及免為假執行之宣告，經核無不符，爰均酌定相當之擔保金額准\n    許併宣告之。\n五、本件事證已臻明確，兩造所為之其他主張，陳述並所提之證據，經審酌後，認均\n    與本件之結論無礙，不再一一論述，併予敘明。\n丙、據上論結，本件原告之訴為有理由，依民事訴訟法第三百八十五條第一項前段、\n    第八十五條第二項、第三百九十條第二項、第三百九十二條第二項、第三項，判\n    決如主文。\n中      華      民      國      九十三    年    十二    月    三十一    日\n~B臺灣臺中地方法院民事第三庭\n~B  法    官  陳卿和\n一、右為正本係照原本作成。\n二、如不服本判決，應於判決送達後二十日內，向本院提出上訴狀。（須按他造當事\n    人之人數附繕本）。\n三、提起上訴，應以上訴狀表明(一)對於第一審判決不服之程度，及應如何廢棄或變更\n    之聲明，(二)上訴理由（民事訴訟法第四百四十一條第一項第三款、第四款），提\n    出於第一審法院。\n四、民事向第二審法院上訴，應依民事訴訟法第七十七條之十六、第七十七條之十三\n    之規定，預納裁判費，本件上訴人提起上訴，自應依法繳納上訴裁判費，關於上\n    訴裁判費計算式為新台幣十萬元以下部分為一千五百元、逾十萬元至一百萬元部\n    分為每萬元一百六十五元、逾一百萬元至一千萬元部分為每萬元一百四十八點五\n    元，逾一千萬元至一億元部分為每萬元一百三十二元（其畸零之數不滿萬元，以\n    萬元計算）。\n中      華      民      國      九十三    年    十二    月    三十一    日\n~B法院書記官  紀俊源\n",
  "structure": {
    "main": "被告應連帶給付原告新台幣柒佰零玖萬柒仟壹佰元，及自民國九十一年十一月二十二\n日起至清償日止，按週年利率百分之五計算之利息。\n訴訟費用由被告連帶負擔。\n本判決於原告以新台幣貳佰參拾陸萬陸仟元為被告供擔保後，得為假執行；但被告乙\n○○、甲○○、戊○○如以新台幣柒佰零玖萬柒仟壹佰元，為原告預供擔保後，得免\n為假執行。",
    "fact": "甲、程序方面\n壹、按言詞辯論期日，當事人之一造不到場者，得依到場當事人之聲請，由其一造辯\n    論而為判決，民事訴訟法第三百八十五條第一項前段定有明文。查被告均經合法\n    通知，而未於言詞辯論期日到場，且均核無民事訴訟法第三百八十六條各款所列\n    情形，爰依原告之聲請，由其一造辯論而為判決。\n貳、次按訴狀送達後，原告不得將原訴變更或追加他訴，但擴張或減縮應受判決事項\n    之聲明者，不在此限，民事訴訟法第二百五十五條第一項第三款定有明文。查本\n    件原告起訴時，係請求被告連帶給付新台幣（下同）七百四十七萬元，及自民國\n    （下同）九十一年十一月二十二日起至清償日止，按週年利率百分之六計算之利\n    息；嗣原告於九十三年十二月二十一日，請求被告連帶給付七百零九萬七千一百\n    元，及自九十一年十二月二十一日起至清償日止，按週年利率百分之五計算之利\n    息，是原告就前開請求，顯屬減縮應受判決事項之聲明，合於前揭條文之規定，\n    是其所為訴之聲明減縮，自應予以准許。\n參、再按民事訴訟法第一百八十三條所謂訴訟中有犯罪嫌疑牽涉其裁判，係指在民事\n    訴訟繫屬中，當事人或第三人涉有犯罪嫌疑，足以影響民事訴訟之裁判，非俟刑\n    事訴訟解決，民事法院即無從或難於判斷者而言；例如當事人或第三人於民事訴\n    訟繫屬中涉有偽造文書、證人偽證、鑑定人為不實之鑑定等罪嫌，始足當之；是\n    當事人在民事訴訟繫屬「以前」有犯罪行為，縱牽涉其裁判，亦不在同條所定得\n    裁定停止訴訟程序之列（最高法院九十二年度台上字第一六七三號判決、七十九\n    年台抗字第二一八號判例參照）。另按民事訴訟法第一百八十三條雖規定訴訟中\n    有犯罪嫌疑牽涉其裁判者，法院得命在刑事訴訟終結前，以裁定停止訴訟程序，\n    但應否停止訴訟程序，仍依法院之自由意見決之（最高法院三十八年度台上字第\n    一九三號判例、九十二年度台抗字第五六八號裁定參照）。查被告乙○○、甲○\n    ○、戊○○涉有前開常業詐欺刑事罪嫌，係在本件民事訴訟繫屬以前有涉有犯罪\n    行為，縱牽涉本件民事裁判，然依前開說明，並非民事訴訟法第一百八十三條所\n    謂訴訟中有犯罪嫌疑牽涉其裁判，不在得裁定停止訴訟程序之列；況本院就兩造\n    所爭執之事實，本得依職權獨立認定，而自行調查證據之結果，已足以形成心證\n    ，依前開說明，本院亦得不停止本件民事訴訟程序。是被告乙○○、甲○○、戊\n    ○○抗辯前開刑事訴訟程序既未終結，本件自應依民事訴訟法第一百八十三條之\n    規定裁定停止訴訟程序云云，自不可取。\n乙、實體方面\n壹、原告主張：一、被告乙○○、甲○○、戊○○共同組成「國浩集團」，以電腦抽\n    獎名義行詐財之行為，自九十一年十一月二十二日起至九十一年十二月二十日止\n    ，該集團成員以手機簡訊使原告陷於錯誤之方式，令原告匯款共七百零九萬七千\n    一百元至訴外人張林貴、張元聰、張誌松、賴岳毅、王進吉設於金融機構之帳戶\n    。被告乙○○、甲○○、戊○○因前開行為，遭檢察官以常業詐欺罪提起公訴。\n    而被告丙○○明知不法集團常誘使被害人將款項匯入人頭帳戶，竟掩飾其餘被告\n    常業詐欺之所得，係幫助犯，亦經檢察官提起公訴。二、原告因被告前開行為而\n    受有前開七百零九萬七千一百元之損害，爰依共同侵權行為之法律關係，請求被\n    告連帶賠償前開金額及其法定利息等語。並聲明：（一）被告應連帶給付原告七\n    百零九萬七千一百元及自九十一年十一月二十二日起至清償日止，按週年利率百\n    分之五計算之利息。（二）訴訟費用由被告連帶負擔。（三）陳明願供擔保請准\n    宣告假執行。\n貳、被告方面：\n一、被告乙○○、甲○○、戊○○則均以：（一）被告並未共組詐騙集團，亦未詐騙\n    原告；被告三人雖遭本院九十二年度訴字第二七八五號刑事判決認定有罪，惟均\n    已提起上訴中，尚不得據前開刑事判決即遽認被告有詐騙行為，被告自毋庸負損\n    害賠償責任。（二）前開刑事訴訟程序既未終結，且關係被告應否負損害賠償責\n    任，依民事訴訟法第一百八十三條之規定，自應裁定停止本件訴訟程序等語，資\n    為抗辯。並均聲明：（一）原告之訴駁回。（二）訴訟費用由原告負擔。（三）\n    如受不利之判決，請准供擔保免為假執行。\n二、被告丙○○則未於言詞辯論期日到場，亦未提出書狀為聲明或陳述。\n參、得心證之理由：\n一、按因故意或過失，不法侵害他人之權利者，負損害賠償責任，故意以背於善良風\n    俗之方法加損害於他人者亦同；數人共同不法侵害他人之權利者，連帶負損害賠\n    償責任，幫助人視為共同行為人，民法第一百八十四條第一項與第一百八十五條\n    第一項前段、第二項分別定有明文。查原告主張之事實，有存摺節影本、郵政國\n    內匯款單執據、自動櫃員機儲戶交易明細表、國內匯款聲請書、自動櫃員機交易\n    明細表、起訴書與本院九十二年度訴字第二七八五號刑事判決等為證，並經本院\n    調取本院九十二年度訴字第二七八五號刑事卷核閱無誤。另參酌被告丙○○出售\n    其所持有之謝敏吾所申請開立之名間松嶺郵局帳戶（局號０四０一一八、帳號０\n    ０六五七九）及賴岳毅所申請開立之水里郵局帳戶（局號0000000、帳號\n    0000000）予姓名年籍不詳綽號「小李」之成年男子作為詐騙集團匯款帳\n    戶使用之情，業據本院於九十二年七月二十一日以九十二年度金訴字第一九號判\n    處有期徒刑十月，經臺灣高等法院臺中分院於九十二年十一月四日以九十二年度\n    金上訴字第一七四八號駁回上訴，經最高法院於九十三年一月八日以九十三年度\n    臺上字第一二五號駁回上訴確定，此有最高法院九十三年臺上字第一二五號刑事\n    判決、臺灣高等法院臺中分院九十二年度金上訴字第一七四八號刑事判決、本院\n    九十二年度金訴字第一九號刑事判決附於本院前開九十二年度訴字第二七八五號\n    卷可稽；前開詐騙集團成員取得訴外人王進吉所設立之金融機構帳戶，而訴外人\n    即前開刑事案件之被害人張尤谷、周從貴、韋碧蓮、李玉梅、練麗華於前開刑事\n    卷之警詢及偵查中之指訴內容，被害人即本件原告丁○○由監聽錄音帶中明確指\n    認出被告乙○○、甲○○，被害人張尤谷則指認出被告乙○○、戊○○，被害人\n    周從貴指認出被告乙○○，被害人韋碧蓮指認出被告乙○○，被害人李玉梅指認\n    出被告乙○○，被害人練麗華於警詢中指認被告乙○○，且被害人丁○○、張尤\n    谷、周從貴、韋碧蓮、李玉梅、練歷華於警詢中並提出其個人之匯款單、刮刮樂\n    中獎單等書證為據，被告乙○○、甲○○、戊○○確參與前開詐騙集團，應堪認\n    定。再查訴外人即前開刑事案件之被害人王鴻堉、歐雨晴、葉供槐明確指認被告\n    乙○○、戊○○即為詐騙集團之成員，被害人韓政達、葉碧璐亦指認被告乙○○\n    為詐騙集團之成員，被害人王鴻堉、歐雨晴、韓政達、葉供槐、葉碧璐等人，與\n    被告乙○○、甲○○、戊○○素未謀面，亦不相識，自無可能蓄意誣指，且被害\n    人王鴻堉、歐雨晴、韓政達、葉供槐、葉碧璐等人係分別指認個人可以確認之聲\n    音，並非附和警察之查證而概括的指稱均為詐騙集團之成員，則被害人王鴻堉、\n    歐雨晴、韓政達、葉供槐、葉碧璐之指認，應係經過深思熟慮，且詳細聆聽比對\n    後之結果，被告乙○○、甲○○、戊○○確實參與前開詐騙集團，應無疑問。則\n    被告乙○○、甲○○、戊○○有前開共同詐欺行為，而被告丙○○幫助詐欺行為\n    ，均可認定。是依前開規定，被告對原告為前開行為，自應負共同侵權行為之賠\n    償責任。\n二、再按負損害賠償責任者，除法律另有規定或契約另有訂定外，應回復他方損害發\n    生前之原狀；因回復原狀而應給付金錢者，自損害發生時起，加給利息，民法第\n    二百十三條第一、二項定有明文。而損害賠償，除法律另有規定或契約另有訂定\n    外，應以填補債權人所受損害及所失利益為限，同法第二百十六條第一項亦有規\n    定。另按遲延之債務，以支付金錢為標的者，債權人得請求依法定利率計算之遲\n    延利息；應負利息之債務，其利率未經約定，亦無法律可據者，週年利率為百分\n    之五，亦為民法第二百三十三條第一項、第二百零三條所明定。查原告遭詐欺匯\n    款七百零九萬七千一百元，業如前述，則依前開各規定，原告請求被告連帶給付\n    七百零九萬七千一百元及自九十一年十一月二十二日起至清償日止，按週年利率\n    百分之五計算之利息，自屬有據，應予准許。\n三、綜上所述，原告基於共同侵權行為損害賠償請求權之法律關係，請求被告連帶給\n    付七百零九萬七千一百元，及自九十一年十一月二十二日起至清償日止，按年息\n    百分之五計算之利息部分，為有理由，應予准許。\n四、本件原告勝訴部分，原告及被告乙○○、甲○○、戊○○均陳明願供擔保，聲請\n    准予宣告假執行及免為假執行之宣告，經核無不符，爰均酌定相當之擔保金額准\n    許併宣告之。\n五、本件事證已臻明確，兩造所為之其他主張，陳述並所提之證據，經審酌後，認均\n    與本件之結論無礙，不再一一論述，併予敘明。\n丙、據上論結，本件原告之訴為有理由，依民事訴訟法第三百八十五條第一項前段、\n    第八十五條第二項、第三百九十條第二項、第三百九十二條第二項、第三項，判\n    決如主文。",
    "reason": "甲、程序方面\n壹、按言詞辯論期日，當事人之一造不到場者，得依到場當事人之聲請，由其一造辯\n    論而為判決，民事訴訟法第三百八十五條第一項前段定有明文。查被告均經合法\n    通知，而未於言詞辯論期日到場，且均核無民事訴訟法第三百八十六條各款所列\n    情形，爰依原告之聲請，由其一造辯論而為判決。\n貳、次按訴狀送達後，原告不得將原訴變更或追加他訴，但擴張或減縮應受判決事項\n    之聲明者，不在此限，民事訴訟法第二百五十五條第一項第三款定有明文。查本\n    件原告起訴時，係請求被告連帶給付新台幣（下同）七百四十七萬元，及自民國\n    （下同）九十一年十一月二十二日起至清償日止，按週年利率百分之六計算之利\n    息；嗣原告於九十三年十二月二十一日，請求被告連帶給付七百零九萬七千一百\n    元，及自九十一年十二月二十一日起至清償日止，按週年利率百分之五計算之利\n    息，是原告就前開請求，顯屬減縮應受判決事項之聲明，合於前揭條文之規定，\n    是其所為訴之聲明減縮，自應予以准許。\n參、再按民事訴訟法第一百八十三條所謂訴訟中有犯罪嫌疑牽涉其裁判，係指在民事\n    訴訟繫屬中，當事人或第三人涉有犯罪嫌疑，足以影響民事訴訟之裁判，非俟刑\n    事訴訟解決，民事法院即無從或難於判斷者而言；例如當事人或第三人於民事訴\n    訟繫屬中涉有偽造文書、證人偽證、鑑定人為不實之鑑定等罪嫌，始足當之；是\n    當事人在民事訴訟繫屬「以前」有犯罪行為，縱牽涉其裁判，亦不在同條所定得\n    裁定停止訴訟程序之列（最高法院九十二年度台上字第一六七三號判決、七十九\n    年台抗字第二一八號判例參照）。另按民事訴訟法第一百八十三條雖規定訴訟中\n    有犯罪嫌疑牽涉其裁判者，法院得命在刑事訴訟終結前，以裁定停止訴訟程序，\n    但應否停止訴訟程序，仍依法院之自由意見決之（最高法院三十八年度台上字第\n    一九三號判例、九十二年度台抗字第五六八號裁定參照）。查被告乙○○、甲○\n    ○、戊○○涉有前開常業詐欺刑事罪嫌，係在本件民事訴訟繫屬以前有涉有犯罪\n    行為，縱牽涉本件民事裁判，然依前開說明，並非民事訴訟法第一百八十三條所\n    謂訴訟中有犯罪嫌疑牽涉其裁判，不在得裁定停止訴訟程序之列；況本院就兩造\n    所爭執之事實，本得依職權獨立認定，而自行調查證據之結果，已足以形成心證\n    ，依前開說明，本院亦得不停止本件民事訴訟程序。是被告乙○○、甲○○、戊\n    ○○抗辯前開刑事訴訟程序既未終結，本件自應依民事訴訟法第一百八十三條之\n    規定裁定停止訴訟程序云云，自不可取。\n乙、實體方面\n壹、原告主張：一、被告乙○○、甲○○、戊○○共同組成「國浩集團」，以電腦抽\n    獎名義行詐財之行為，自九十一年十一月二十二日起至九十一年十二月二十日止\n    ，該集團成員以手機簡訊使原告陷於錯誤之方式，令原告匯款共七百零九萬七千\n    一百元至訴外人張林貴、張元聰、張誌松、賴岳毅、王進吉設於金融機構之帳戶\n    。被告乙○○、甲○○、戊○○因前開行為，遭檢察官以常業詐欺罪提起公訴。\n    而被告丙○○明知不法集團常誘使被害人將款項匯入人頭帳戶，竟掩飾其餘被告\n    常業詐欺之所得，係幫助犯，亦經檢察官提起公訴。二、原告因被告前開行為而\n    受有前開七百零九萬七千一百元之損害，爰依共同侵權行為之法律關係，請求被\n    告連帶賠償前開金額及其法定利息等語。並聲明：（一）被告應連帶給付原告七\n    百零九萬七千一百元及自九十一年十一月二十二日起至清償日止，按週年利率百\n    分之五計算之利息。（二）訴訟費用由被告連帶負擔。（三）陳明願供擔保請准\n    宣告假執行。\n貳、被告方面：\n一、被告乙○○、甲○○、戊○○則均以：（一）被告並未共組詐騙集團，亦未詐騙\n    原告；被告三人雖遭本院九十二年度訴字第二七八五號刑事判決認定有罪，惟均\n    已提起上訴中，尚不得據前開刑事判決即遽認被告有詐騙行為，被告自毋庸負損\n    害賠償責任。（二）前開刑事訴訟程序既未終結，且關係被告應否負損害賠償責\n    任，依民事訴訟法第一百八十三條之規定，自應裁定停止本件訴訟程序等語，資\n    為抗辯。並均聲明：（一）原告之訴駁回。（二）訴訟費用由原告負擔。（三）\n    如受不利之判決，請准供擔保免為假執行。\n二、被告丙○○則未於言詞辯論期日到場，亦未提出書狀為聲明或陳述。\n參、得心證之理由：\n一、按因故意或過失，不法侵害他人之權利者，負損害賠償責任，故意以背於善良風\n    俗之方法加損害於他人者亦同；數人共同不法侵害他人之權利者，連帶負損害賠\n    償責任，幫助人視為共同行為人，民法第一百八十四條第一項與第一百八十五條\n    第一項前段、第二項分別定有明文。查原告主張之事實，有存摺節影本、郵政國\n    內匯款單執據、自動櫃員機儲戶交易明細表、國內匯款聲請書、自動櫃員機交易\n    明細表、起訴書與本院九十二年度訴字第二七八五號刑事判決等為證，並經本院\n    調取本院九十二年度訴字第二七八五號刑事卷核閱無誤。另參酌被告丙○○出售\n    其所持有之謝敏吾所申請開立之名間松嶺郵局帳戶（局號０四０一一八、帳號０\n    ０六五七九）及賴岳毅所申請開立之水里郵局帳戶（局號0000000、帳號\n    0000000）予姓名年籍不詳綽號「小李」之成年男子作為詐騙集團匯款帳\n    戶使用之情，業據本院於九十二年七月二十一日以九十二年度金訴字第一九號判\n    處有期徒刑十月，經臺灣高等法院臺中分院於九十二年十一月四日以九十二年度\n    金上訴字第一七四八號駁回上訴，經最高法院於九十三年一月八日以九十三年度\n    臺上字第一二五號駁回上訴確定，此有最高法院九十三年臺上字第一二五號刑事\n    判決、臺灣高等法院臺中分院九十二年度金上訴字第一七四八號刑事判決、本院\n    九十二年度金訴字第一九號刑事判決附於本院前開九十二年度訴字第二七八五號\n    卷可稽；前開詐騙集團成員取得訴外人王進吉所設立之金融機構帳戶，而訴外人\n    即前開刑事案件之被害人張尤谷、周從貴、韋碧蓮、李玉梅、練麗華於前開刑事\n    卷之警詢及偵查中之指訴內容，被害人即本件原告丁○○由監聽錄音帶中明確指\n    認出被告乙○○、甲○○，被害人張尤谷則指認出被告乙○○、戊○○，被害人\n    周從貴指認出被告乙○○，被害人韋碧蓮指認出被告乙○○，被害人李玉梅指認\n    出被告乙○○，被害人練麗華於警詢中指認被告乙○○，且被害人丁○○、張尤\n    谷、周從貴、韋碧蓮、李玉梅、練歷華於警詢中並提出其個人之匯款單、刮刮樂\n    中獎單等書證為據，被告乙○○、甲○○、戊○○確參與前開詐騙集團，應堪認\n    定。再查訴外人即前開刑事案件之被害人王鴻堉、歐雨晴、葉供槐明確指認被告\n    乙○○、戊○○即為詐騙集團之成員，被害人韓政達、葉碧璐亦指認被告乙○○\n    為詐騙集團之成員，被害人王鴻堉、歐雨晴、韓政達、葉供槐、葉碧璐等人，與\n    被告乙○○、甲○○、戊○○素未謀面，亦不相識，自無可能蓄意誣指，且被害\n    人王鴻堉、歐雨晴、韓政達、葉供槐、葉碧璐等人係分別指認個人可以確認之聲\n    音，並非附和警察之查證而概括的指稱均為詐騙集團之成員，則被害人王鴻堉、\n    歐雨晴、韓政達、葉供槐、葉碧璐之指認，應係經過深思熟慮，且詳細聆聽比對\n    後之結果，被告乙○○、甲○○、戊○○確實參與前開詐騙集團，應無疑問。則\n    被告乙○○、甲○○、戊○○有前開共同詐欺行為，而被告丙○○幫助詐欺行為\n    ，均可認定。是依前開規定，被告對原告為前開行為，自應負共同侵權行為之賠\n    償責任。\n二、再按負損害賠償責任者，除法律另有規定或契約另有訂定外，應回復他方損害發\n    生前之原狀；因回復原狀而應給付金錢者，自損害發生時起，加給利息，民法第\n    二百十三條第一、二項定有明文。而損害賠償，除法律另有規定或契約另有訂定\n    外，應以填補債權人所受損害及所失利益為限，同法第二百十六條第一項亦有規\n    定。另按遲延之債務，以支付金錢為標的者，債權人得請求依法定利率計算之遲\n    延利息；應負利息之債務，其利率未經約定，亦無法律可據者，週年利率為百分\n    之五，亦為民法第二百三十三條第一項、第二百零三條所明定。查原告遭詐欺匯\n    款七百零九萬七千一百元，業如前述，則依前開各規定，原告請求被告連帶給付\n    七百零九萬七千一百元及自九十一年十一月二十二日起至清償日止，按週年利率\n    百分之五計算之利息，自屬有據，應予准許。\n三、綜上所述，原告基於共同侵權行為損害賠償請求權之法律關係，請求被告連帶給\n    付七百零九萬七千一百元，及自九十一年十一月二十二日起至清償日止，按年息\n    百分之五計算之利息部分，為有理由，應予准許。\n四、本件原告勝訴部分，原告及被告乙○○、甲○○、戊○○均陳明願供擔保，聲請\n    准予宣告假執行及免為假執行之宣告，經核無不符，爰均酌定相當之擔保金額准\n    許併宣告之。\n五、本件事證已臻明確，兩造所為之其他主張，陳述並所提之證據，經審酌後，認均\n    與本件之結論無礙，不再一一論述，併予敘明。\n丙、據上論結，本件原告之訴為有理由，依民事訴訟法第三百八十五條第一項前段、\n    第八十五條第二項、第三百九十條第二項、第三百九十二條第二項、第三項，判\n    決如主文。"
  },
  "search": "臺灣臺中地方法院民事判決九十三年度重訴字第三四四號原告丁○○被告甲○○戊○○兼訴訟代理人乙○○被告丙○○右被告因常業詐欺案件，經原告提起請求損害賠償之附帶民事訴訟（九十三年度附民字第三九號），經本院刑事庭裁定移送前來，本院於民國九十三年十二月二十一日言詞辯論終結，判決如左：主文被告應連帶給付原告新台幣柒佰零玖萬柒仟壹佰元，及自民國九十一年十一月二十二日起至清償日止，按週年利率百分之五計算之利息。訴訟費用由被告連帶負擔。本判決於原告以新台幣貳佰參拾陸萬陸仟元為被告供擔保後，得為假執行；但被告乙○○、甲○○、戊○○如以新台幣柒佰零玖萬柒仟壹佰元，為原告預供擔保後，得免為假執行。事實及理由甲、程序方面壹、按言詞辯論期日，當事人之一造不到場者，得依到場當事人之聲請，由其一造辯論而為判決，民事訴訟法第三百八十五條第一項前段定有明文。查被告均經合法通知，而未於言詞辯論期日到場，且均核無民事訴訟法第三百八十六條各款所列情形，爰依原告之聲請，由其一造辯論而為判決。貳、次按訴狀送達後，原告不得將原訴變更或追加他訴，但擴張或減縮應受判決事項之聲明者，不在此限，民事訴訟法第二百五十五條第一項第三款定有明文。查本件原告起訴時，係請求被告連帶給付新台幣（下同）七百四十七萬元，及自民國（下同）九十一年十一月二十二日起至清償日止，按週年利率百分之六計算之利息；嗣原告於九十三年十二月二十一日，請求被告連帶給付七百零九萬七千一百元，及自九十一年十二月二十一日起至清償日止，按週年利率百分之五計算之利息，是原告就前開請求，顯屬減縮應受判決事項之聲明，合於前揭條文之規定，是其所為訴之聲明減縮，自應予以准許。參、再按民事訴訟法第一百八十三條所謂訴訟中有犯罪嫌疑牽涉其裁判，係指在民事訴訟繫屬中，當事人或第三人涉有犯罪嫌疑，足以影響民事訴訟之裁判，非俟刑事訴訟解決，民事法院即無從或難於判斷者而言；例如當事人或第三人於民事訴訟繫屬中涉有偽造文書、證人偽證、鑑定人為不實之鑑定等罪嫌，始足當之；是當事人在民事訴訟繫屬「以前」有犯罪行為，縱牽涉其裁判，亦不在同條所定得裁定停止訴訟程序之列（最高法院九十二年度台上字第一六七三號判決、七十九年台抗字第二一八號判例參照）。另按民事訴訟法第一百八十三條雖規定訴訟中有犯罪嫌疑牽涉其裁判者，法院得命在刑事訴訟終結前，以裁定停止訴訟程序，但應否停止訴訟程序，仍依法院之自由意見決之（最高法院三十八年度台上字第一九三號判例、九十二年度台抗字第五六八號裁定參照）。查被告乙○○、甲○○、戊○○涉有前開常業詐欺刑事罪嫌，係在本件民事訴訟繫屬以前有涉有犯罪行為，縱牽涉本件民事裁判，然依前開說明，並非民事訴訟法第一百八十三條所謂訴訟中有犯罪嫌疑牽涉其裁判，不在得裁定停止訴訟程序之列；況本院就兩造所爭執之事實，本得依職權獨立認定，而自行調查證據之結果，已足以形成心證，依前開說明，本院亦得不停止本件民事訴訟程序。是被告乙○○、甲○○、戊○○抗辯前開刑事訴訟程序既未終結，本件自應依民事訴訟法第一百八十三條之規定裁定停止訴訟程序云云，自不可取。乙、實體方面壹、原告主張：一、被告乙○○、甲○○、戊○○共同組成「國浩集團」，以電腦抽獎名義行詐財之行為，自九十一年十一月二十二日起至九十一年十二月二十日止，該集團成員以手機簡訊使原告陷於錯誤之方式，令原告匯款共七百零九萬七千一百元至訴外人張林貴、張元聰、張誌松、賴岳毅、王進吉設於金融機構之帳戶。被告乙○○、甲○○、戊○○因前開行為，遭檢察官以常業詐欺罪提起公訴。而被告丙○○明知不法集團常誘使被害人將款項匯入人頭帳戶，竟掩飾其餘被告常業詐欺之所得，係幫助犯，亦經檢察官提起公訴。二、原告因被告前開行為而受有前開七百零九萬七千一百元之損害，爰依共同侵權行為之法律關係，請求被告連帶賠償前開金額及其法定利息等語。並聲明：（一）被告應連帶給付原告七百零九萬七千一百元及自九十一年十一月二十二日起至清償日止，按週年利率百分之五計算之利息。（二）訴訟費用由被告連帶負擔。（三）陳明願供擔保請准宣告假執行。貳、被告方面：一、被告乙○○、甲○○、戊○○則均以：（一）被告並未共組詐騙集團，亦未詐騙原告；被告三人雖遭本院九十二年度訴字第二七八五號刑事判決認定有罪，惟均已提起上訴中，尚不得據前開刑事判決即遽認被告有詐騙行為，被告自毋庸負損害賠償責任。（二）前開刑事訴訟程序既未終結，且關係被告應否負損害賠償責任，依民事訴訟法第一百八十三條之規定，自應裁定停止本件訴訟程序等語，資為抗辯。並均聲明：（一）原告之訴駁回。（二）訴訟費用由原告負擔。（三）如受不利之判決，請准供擔保免為假執行。二、被告丙○○則未於言詞辯論期日到場，亦未提出書狀為聲明或陳述。參、得心證之理由：一、按因故意或過失，不法侵害他人之權利者，負損害賠償責任，故意以背於善良風俗之方法加損害於他人者亦同；數人共同不法侵害他人之權利者，連帶負損害賠償責任，幫助人視為共同行為人，民法第一百八十四條第一項與第一百八十五條第一項前段、第二項分別定有明文。查原告主張之事實，有存摺節影本、郵政國內匯款單執據、自動櫃員機儲戶交易明細表、國內匯款聲請書、自動櫃員機交易明細表、起訴書與本院九十二年度訴字第二七八五號刑事判決等為證，並經本院調取本院九十二年度訴字第二七八五號刑事卷核閱無誤。另參酌被告丙○○出售其所持有之謝敏吾所申請開立之名間松嶺郵局帳戶（局號０四０一一八、帳號００六五七九）及賴岳毅所申請開立之水里郵局帳戶（局號0000000、帳號0000000）予姓名年籍不詳綽號「小李」之成年男子作為詐騙集團匯款帳戶使用之情，業據本院於九十二年七月二十一日以九十二年度金訴字第一九號判處有期徒刑十月，經臺灣高等法院臺中分院於九十二年十一月四日以九十二年度金上訴字第一七四八號駁回上訴，經最高法院於九十三年一月八日以九十三年度臺上字第一二五號駁回上訴確定，此有最高法院九十三年臺上字第一二五號刑事判決、臺灣高等法院臺中分院九十二年度金上訴字第一七四八號刑事判決、本院九十二年度金訴字第一九號刑事判決附於本院前開九十二年度訴字第二七八五號卷可稽；前開詐騙集團成員取得訴外人王進吉所設立之金融機構帳戶，而訴外人即前開刑事案件之被害人張尤谷、周從貴、韋碧蓮、李玉梅、練麗華於前開刑事卷之警詢及偵查中之指訴內容，被害人即本件原告丁○○由監聽錄音帶中明確指認出被告乙○○、甲○○，被害人張尤谷則指認出被告乙○○、戊○○，被害人周從貴指認出被告乙○○，被害人韋碧蓮指認出被告乙○○，被害人李玉梅指認出被告乙○○，被害人練麗華於警詢中指認被告乙○○，且被害人丁○○、張尤谷、周從貴、韋碧蓮、李玉梅、練歷華於警詢中並提出其個人之匯款單、刮刮樂中獎單等書證為據，被告乙○○、甲○○、戊○○確參與前開詐騙集團，應堪認定。再查訴外人即前開刑事案件之被害人王鴻堉、歐雨晴、葉供槐明確指認被告乙○○、戊○○即為詐騙集團之成員，被害人韓政達、葉碧璐亦指認被告乙○○為詐騙集團之成員，被害人王鴻堉、歐雨晴、韓政達、葉供槐、葉碧璐等人，與被告乙○○、甲○○、戊○○素未謀面，亦不相識，自無可能蓄意誣指，且被害人王鴻堉、歐雨晴、韓政達、葉供槐、葉碧璐等人係分別指認個人可以確認之聲音，並非附和警察之查證而概括的指稱均為詐騙集團之成員，則被害人王鴻堉、歐雨晴、韓政達、葉供槐、葉碧璐之指認，應係經過深思熟慮，且詳細聆聽比對後之結果，被告乙○○、甲○○、戊○○確實參與前開詐騙集團，應無疑問。則被告乙○○、甲○○、戊○○有前開共同詐欺行為，而被告丙○○幫助詐欺行為，均可認定。是依前開規定，被告對原告為前開行為，自應負共同侵權行為之賠償責任。二、再按負損害賠償責任者，除法律另有規定或契約另有訂定外，應回復他方損害發生前之原狀；因回復原狀而應給付金錢者，自損害發生時起，加給利息，民法第二百十三條第一、二項定有明文。而損害賠償，除法律另有規定或契約另有訂定外，應以填補債權人所受損害及所失利益為限，同法第二百十六條第一項亦有規定。另按遲延之債務，以支付金錢為標的者，債權人得請求依法定利率計算之遲延利息；應負利息之債務，其利率未經約定，亦無法律可據者，週年利率為百分之五，亦為民法第二百三十三條第一項、第二百零三條所明定。查原告遭詐欺匯款七百零九萬七千一百元，業如前述，則依前開各規定，原告請求被告連帶給付七百零九萬七千一百元及自九十一年十一月二十二日起至清償日止，按週年利率百分之五計算之利息，自屬有據，應予准許。三、綜上所述，原告基於共同侵權行為損害賠償請求權之法律關係，請求被告連帶給付七百零九萬七千一百元，及自九十一年十一月二十二日起至清償日止，按年息百分之五計算之利息部分，為有理由，應予准許。四、本件原告勝訴部分，原告及被告乙○○、甲○○、戊○○均陳明願供擔保，聲請准予宣告假執行及免為假執行之宣告，經核無不符，爰均酌定相當之擔保金額准許併宣告之。五、本件事證已臻明確，兩造所為之其他主張，陳述並所提之證據，經審酌後，認均與本件之結論無礙，不再一一論述，併予敘明。丙、據上論結，本件原告之訴為有理由，依民事訴訟法第三百八十五條第一項前段、第八十五條第二項、第三百九十條第二項、第三百九十二條第二項、第三項，判決如主文。中華民國九十三年十二月三十一日~B臺灣臺中地方法院民事第三庭~B法官陳卿和一、右為正本係照原本作成。二、如不服本判決，應於判決送達後二十日內，向本院提出上訴狀。（須按他造當事人之人數附繕本）。三、提起上訴，應以上訴狀表明(一)對於第一審判決不服之程度，及應如何廢棄或變更之聲明，(二)上訴理由（民事訴訟法第四百四十一條第一項第三款、第四款），提出於第一審法院。四、民事向第二審法院上訴，應依民事訴訟法第七十七條之十六、第七十七條之十三之規定，預納裁判費，本件上訴人提起上訴，自應依法繳納上訴裁判費，關於上訴裁判費計算式為新台幣十萬元以下部分為一千五百元、逾十萬元至一百萬元部分為每萬元一百六十五元、逾一百萬元至一千萬元部分為每萬元一百四十八點五元，逾一千萬元至一億元部分為每萬元一百三十二元（其畸零之數不滿萬元，以萬元計算）。中華民國九十三年十二月三十一日~B法院書記官紀俊源",
  "characters": {
    "judges": [
      "陳卿和"
    ],
    "prosecutors": [

    ],
    "lawyers": [

    ],
    "clerks": [

    ],
    "plaintiffs": [
      "丁"
    ],
    "defendants": [
      "甲○○",
      "丙○○",
      "右被告因常業詐欺案件，經原告提起請求損害賠償之附帶民事訴訟（九十三年度附民",
      "字第三九號），經本院刑事庭裁定移送前來，本院於民國九十三年十二月二十一日言",
      "詞辯論終結，判決如左："
    ],
    "prosecutor_office": [

    ],
    "creditors": [

    ],
    "debtors": [

    ],
    "judicial_associate_officer": [

    ]
  },
  "adjudged_at": "2004-12-31",
  "created_at": "2016-02-06 07:41:41",
  "updated_at": "2016-02-06 07:41:41"
}