{
  "identify": "MLD-100-苗小-289-20110721-1",
  "court": {
    "name": "臺灣苗栗地方法院",
    "code": "MLD"
  },
  "division": {
    "name": "民事",
    "code": "V"
  },
  "year": 100,
  "word": "苗小",
  "number": "289",
  "jcheck": "1",
  "reason": "返還消費借貸款",
  "content": "臺灣苗栗地方法院民事裁定            100年度苗小字第289號\n原      告  豐（台灣）商業銀行股份有限公司\n法定代理人  柯勝民\n被      告  莊程芳即莊陳芳\n上列當事人間請求返還消費借貸款事件，本院裁定如下：\n    主    文\n本件移送臺灣新竹地方法院。\n    理    由\n一、按訴訟，由被告住所地之法院管轄；訴訟之全部或一部，法\n    院認為無管轄權者，依原告聲請或依職權以裁定移送於其管\n    轄法院；民事訴訟法第1 條第1 項前段、第28條第1 項分別\n    定有明文。\n二、本件依原告起訴所請求之訴訟標的金額，為應適用小額訴訟\n    程序之事件，不適用民事訴訟法第24條關於合意管轄之規定\n    ，仍應依同法第1 條第1 項前段規定，由被告住所地法院管\n    轄。而依被告之最新戶籍謄本所載，其住所係在新竹市○○\n    區○○里○○鄰○○路160 巷16號，此有被告個人戶籍資料查\n    詢結果在卷可稽，是本件自應由臺灣新竹地方法院管轄；玆\n    原告向無管轄權之本院起訴，顯係違誤，爰依職權將本件移\n    送於該管轄法院。\n三、依首開法條規定，裁定如主文。\n中    華    民    國   100    年    7     月    21    日\n              苗栗簡易庭法  官  楊中琪\n以上正本係照原本作成。\n如不服本裁定應於送達後10日內向本院提出抗告狀，並繳納抗告\n費新臺幣1,000元。\n                        書記官  李曉君\n中    華    民    國   100    年    7     月    21    日",
  "structure": {
    "main": "本件移送臺灣新竹地方法院。",
    "reason": "一、按訴訟，由被告住所地之法院管轄；訴訟之全部或一部，法\n    院認為無管轄權者，依原告聲請或依職權以裁定移送於其管\n    轄法院；民事訴訟法第1 條第1 項前段、第28條第1 項分別\n    定有明文。\n二、本件依原告起訴所請求之訴訟標的金額，為應適用小額訴訟\n    程序之事件，不適用民事訴訟法第24條關於合意管轄之規定\n    ，仍應依同法第1 條第1 項前段規定，由被告住所地法院管\n    轄。而依被告之最新戶籍謄本所載，其住所係在新竹市○○\n    區○○里○○鄰○○路160 巷16號，此有被告個人戶籍資料查\n    詢結果在卷可稽，是本件自應由臺灣新竹地方法院管轄；玆\n    原告向無管轄權之本院起訴，顯係違誤，爰依職權將本件移\n    送於該管轄法院。\n三、依首開法條規定，裁定如主文。"
  },
  "search": "臺灣苗栗地方法院民事裁定100年度苗小字第289號原告豐（台灣）商業銀行股份有限公司法定代理人柯勝民被告莊程芳即莊陳芳上列當事人間請求返還消費借貸款事件，本院裁定如下：主文本件移送臺灣新竹地方法院。理由一、按訴訟，由被告住所地之法院管轄；訴訟之全部或一部，法院認為無管轄權者，依原告聲請或依職權以裁定移送於其管轄法院；民事訴訟法第1條第1項前段、第28條第1項分別定有明文。二、本件依原告起訴所請求之訴訟標的金額，為應適用小額訴訟程序之事件，不適用民事訴訟法第24條關於合意管轄之規定，仍應依同法第1條第1項前段規定，由被告住所地法院管轄。而依被告之最新戶籍謄本所載，其住所係在新竹市○○區○○里○○鄰○○路160巷16號，此有被告個人戶籍資料查詢結果在卷可稽，是本件自應由臺灣新竹地方法院管轄；玆原告向無管轄權之本院起訴，顯係違誤，爰依職權將本件移送於該管轄法院。三、依首開法條規定，裁定如主文。中華民國100年7月21日苗栗簡易庭法官楊中琪以上正本係照原本作成。如不服本裁定應於送達後10日內向本院提出抗告狀，並繳納抗告費新臺幣1,000元。書記官李曉君中華民國100年7月21日",
  "characters": {
    "judges": [
      "楊中琪"
    ],
    "prosecutors": [

    ],
    "lawyers": [

    ],
    "clerks": [
      "李曉君"
    ],
    "plaintiffs": [

    ],
    "defendants": [
      "莊程芳即莊陳芳"
    ],
    "prosecutor_office": [

    ],
    "creditors": [

    ],
    "debtors": [

    ],
    "judicial_associate_officer": [

    ]
  },
  "adjudged_at": "2011-07-21",
  "created_at": "2016-02-14 03:29:30",
  "updated_at": "2016-02-14 03:29:30"
}