{
  "identify": "TCD-100-家救-41-20110721-1",
  "court": {
    "name": "臺灣臺中地方法院",
    "code": "TCD"
  },
  "division": {
    "name": "民事",
    "code": "V"
  },
  "year": 100,
  "word": "家救",
  "number": "41",
  "jcheck": "1",
  "reason": "訴訟救助",
  "content": "臺灣臺中地方法院民事裁定  100年度家救字第41號\n聲  請  人  吳金春\n訴訟代理人  邱寶弘律師\n相  對  人  吳家華\n上列當事人間請求不當得利事件（本院100年度家訴字第319號）\n，聲請人聲請訴訟救助，本院裁定如下：\n    主      文\n本件准予訴訟救助。\n    理      由\n一、聲請意旨略以：聲請人與相對人間起訴請求不當得利事件（\n    本院100年度家訴字第319號），聲請人無資力支出訴訟費用\n    ，且經向財團法人法律扶助基金會臺中分會申請法律扶助，\n    經該分會審查決定准予法律扶助在案，為此聲請訴訟救助等\n    語。並提出戶籍謄本及財團法人法律扶助基金會臺中分會審\n    查決定通知書各1件以為釋明。\n二、按當事人無資力支出訴訟費用者，法院應依聲請，以裁定准\n    予訴訟救助，民事訴訟法第107條第1項前段定有明文；又經\n    財團法人法律扶助基金會之分會准予法律扶助之無資力者，\n    其於訴訟程序中，向法院聲請訴訟救助時，應准予訴訟救助\n    ，但另有不符法律扶助事實之證明者，不在此限，亦為法律\n    扶助法第62條所明定。\n三、本院查：聲請人主張之前開事實，業據聲請人提出前揭證物\n    可證，復有本院調取之上揭事件卷宗、稅務電子閘門財產、\n    所得調件明細表可稽，且查無不符法律扶助之事實，自堪信\n    為真實，則依前開規定，聲請人以其無資力支出訴訟費用為\n    由，聲請訴訟救助，經核無不合，應予准許。\n四、依民事訴訟法第107條第1項前段，裁定如主文。\n中    華    民    國    100    年    7    月    21    日\n                  家事法庭      法官  郭妙俐\n正本係照原本作成。\n如不服本裁定應於送達後10日內向本院提出抗告狀，並繳納抗告\n費新臺幣1,000元。\n中    華    民    國    100    年    7    月    21    日\n                                書記官",
  "structure": {
    "main": "本件准予訴訟救助。",
    "reason": "一、聲請意旨略以：聲請人與相對人間起訴請求不當得利事件（\n    本院100年度家訴字第319號），聲請人無資力支出訴訟費用\n    ，且經向財團法人法律扶助基金會臺中分會申請法律扶助，\n    經該分會審查決定准予法律扶助在案，為此聲請訴訟救助等\n    語。並提出戶籍謄本及財團法人法律扶助基金會臺中分會審\n    查決定通知書各1件以為釋明。\n二、按當事人無資力支出訴訟費用者，法院應依聲請，以裁定准\n    予訴訟救助，民事訴訟法第107條第1項前段定有明文；又經\n    財團法人法律扶助基金會之分會准予法律扶助之無資力者，\n    其於訴訟程序中，向法院聲請訴訟救助時，應准予訴訟救助\n    ，但另有不符法律扶助事實之證明者，不在此限，亦為法律\n    扶助法第62條所明定。\n三、本院查：聲請人主張之前開事實，業據聲請人提出前揭證物\n    可證，復有本院調取之上揭事件卷宗、稅務電子閘門財產、\n    所得調件明細表可稽，且查無不符法律扶助之事實，自堪信\n    為真實，則依前開規定，聲請人以其無資力支出訴訟費用為\n    由，聲請訴訟救助，經核無不合，應予准許。\n四、依民事訴訟法第107條第1項前段，裁定如主文。"
  },
  "search": "臺灣臺中地方法院民事裁定100年度家救字第41號聲請人吳金春訴訟代理人邱寶弘律師相對人吳家華上列當事人間請求不當得利事件（本院100年度家訴字第319號），聲請人聲請訴訟救助，本院裁定如下：主文本件准予訴訟救助。理由一、聲請意旨略以：聲請人與相對人間起訴請求不當得利事件（本院100年度家訴字第319號），聲請人無資力支出訴訟費用，且經向財團法人法律扶助基金會臺中分會申請法律扶助，經該分會審查決定准予法律扶助在案，為此聲請訴訟救助等語。並提出戶籍謄本及財團法人法律扶助基金會臺中分會審查決定通知書各1件以為釋明。二、按當事人無資力支出訴訟費用者，法院應依聲請，以裁定准予訴訟救助，民事訴訟法第107條第1項前段定有明文；又經財團法人法律扶助基金會之分會准予法律扶助之無資力者，其於訴訟程序中，向法院聲請訴訟救助時，應准予訴訟救助，但另有不符法律扶助事實之證明者，不在此限，亦為法律扶助法第62條所明定。三、本院查：聲請人主張之前開事實，業據聲請人提出前揭證物可證，復有本院調取之上揭事件卷宗、稅務電子閘門財產、所得調件明細表可稽，且查無不符法律扶助之事實，自堪信為真實，則依前開規定，聲請人以其無資力支出訴訟費用為由，聲請訴訟救助，經核無不合，應予准許。四、依民事訴訟法第107條第1項前段，裁定如主文。中華民國100年7月21日家事法庭法官郭妙俐正本係照原本作成。如不服本裁定應於送達後10日內向本院提出抗告狀，並繳納抗告費新臺幣1,000元。中華民國100年7月21日書記官",
  "characters": {
    "judges": [

    ],
    "prosecutors": [

    ],
    "lawyers": [
      "邱寶弘"
    ],
    "clerks": [

    ],
    "plaintiffs": [

    ],
    "defendants": [

    ],
    "prosecutor_office": [
      "吳金春"
    ],
    "creditors": [

    ],
    "debtors": [

    ],
    "judicial_associate_officer": [

    ]
  },
  "adjudged_at": "2011-07-21",
  "created_at": "2016-02-14 03:22:26",
  "updated_at": "2016-02-14 03:22:26"
}