{
  "identify": "TYD-100-桃簡-1349-20110721-1",
  "court": {
    "name": "臺灣桃園地方法院",
    "code": "TYD"
  },
  "division": {
    "name": "刑事",
    "code": "M"
  },
  "year": 100,
  "word": "桃簡",
  "number": "1349",
  "jcheck": "1",
  "reason": "妨害風化",
  "content": "臺灣桃園地方法院刑事簡易判決       100年度桃簡字第1349號\n聲  請  人  臺灣桃園地方法院檢察署檢察官\n被      告  陳佑政\n上列被告因妨害風化案件，經檢察官聲請以簡易判決處刑（100\n年度偵字第4394 號），本院判決如下：\n    主      文\n陳佑政意圖使女子與他人為猥褻之行為，而容留以營利，處有期\n徒刑肆月，如易科罰金，以新臺幣壹仟元折算壹日。\n    事實及理由                                           \n一、本件犯罪事實及證據，除檢察官聲請簡易判決處刑書犯罪事\n    實欄一第2 行「性交行為」之記載應更正為「猥褻行為」，\n    並於犯罪事實欄一第5 行後段更正為「猥褻半套性交易( 即\n    由女子撫摸男客之性器官至射精狀態) 」外，餘均引用檢察\n    官聲請簡易判決處刑書所載（如附件）。\n二、核被告所為，係犯刑法第231 條第1 項前段之意圖使女子與\n    他人為猥褻之行為，而容留以營利罪。按刑法第231 條第1\n    項所稱「媒介」，係指居間介紹，使男女因行為人之介紹牽\n    線行為而能與他人為性交、猥褻；「容留」指提供為性交、\n    猥褻之場所而言，如行為人引誘、媒介於前，復加以容留在\n    後，其引誘、媒介之低度行為應為容留之高度行為所吸收（\n    最高法院94年度台上第6002號判決意旨可參），故本件被告\n    媒介之低度行為應為容留之高度行為所吸收，不另論罪，又\n    自本件證人即男客賀治純證稱: 伊問小姐會不會幫伊口交，\n    小姐說再看，但至少會幫伊打手槍等語觀之，其與該名女子\n    間僅達成猥褻行為之性交易之合意，尚未達成性交行為之性\n    交易之合意，復查無其他證據證明被告有容留女子與他人為\n    性交行為之事實，是應認被告僅係容留女子與他人為猥褻行\n    為，故聲請人認本件應論意圖使女子與他人為性交之行為而\n    媒介、容留以營利罪部分，容有誤會，併此敘明。爰審酌被\n    告以媒介、容留女子與他人從事猥褻行為，將女性身體當作\n    交易籌碼，並藉此牟利，不唯破壞社會善良風俗，且將人身\n    體物化，嚴重扭曲社會之價值觀，並審酌被告之素行，犯罪\n    之動機、目的、手段，犯罪後否認犯行等一切情狀，量處如\n    主文所示之刑，並諭知易科罰金之折算標準，以示懲儆。\n三、據上論斷，應依刑事訴訟法第449 條第1 項前段、第3 項、\n    第454 條第2 項，刑法第231 條第1 項前段、第41條第1項\n    前段，刑法施行法第1 條之1 第1 項、第2 項但書，逕以簡\n    易判決處刑如主文。\n四、如不服本判決，應於判決送達之翌日起10日內，以書狀敘述\n    理向本院提出上訴狀（應附繕本），上訴於本院合議庭。\n中    華    民    國   100    年    7    月    21    日\n                  刑事第二庭    法  官  李麗珍\n\n附錄法條:\n刑法第231條",
  "structure": {
    "main": "陳佑政意圖使女子與他人為猥褻之行為，而容留以營利，處有期\n徒刑肆月，如易科罰金，以新臺幣壹仟元折算壹日。",
    "fact": "一、本件犯罪事實及證據，除檢察官聲請簡易判決處刑書犯罪事\n    實欄一第2 行「性交行為」之記載應更正為「猥褻行為」，\n    並於犯罪事實欄一第5 行後段更正為「猥褻半套性交易( 即\n    由女子撫摸男客之性器官至射精狀態) 」外，餘均引用檢察\n    官聲請簡易判決處刑書所載（如附件）。\n二、核被告所為，係犯刑法第231 條第1 項前段之意圖使女子與\n    他人為猥褻之行為，而容留以營利罪。按刑法第231 條第1\n    項所稱「媒介」，係指居間介紹，使男女因行為人之介紹牽\n    線行為而能與他人為性交、猥褻；「容留」指提供為性交、\n    猥褻之場所而言，如行為人引誘、媒介於前，復加以容留在\n    後，其引誘、媒介之低度行為應為容留之高度行為所吸收（\n    最高法院94年度台上第6002號判決意旨可參），故本件被告\n    媒介之低度行為應為容留之高度行為所吸收，不另論罪，又\n    自本件證人即男客賀治純證稱: 伊問小姐會不會幫伊口交，\n    小姐說再看，但至少會幫伊打手槍等語觀之，其與該名女子\n    間僅達成猥褻行為之性交易之合意，尚未達成性交行為之性\n    交易之合意，復查無其他證據證明被告有容留女子與他人為\n    性交行為之事實，是應認被告僅係容留女子與他人為猥褻行\n    為，故聲請人認本件應論意圖使女子與他人為性交之行為而\n    媒介、容留以營利罪部分，容有誤會，併此敘明。爰審酌被\n    告以媒介、容留女子與他人從事猥褻行為，將女性身體當作\n    交易籌碼，並藉此牟利，不唯破壞社會善良風俗，且將人身\n    體物化，嚴重扭曲社會之價值觀，並審酌被告之素行，犯罪\n    之動機、目的、手段，犯罪後否認犯行等一切情狀，量處如\n    主文所示之刑，並諭知易科罰金之折算標準，以示懲儆。\n三、據上論斷，應依刑事訴訟法第449 條第1 項前段、第3 項、\n    第454 條第2 項，刑法第231 條第1 項前段、第41條第1項\n    前段，刑法施行法第1 條之1 第1 項、第2 項但書，逕以簡\n    易判決處刑如主文。\n四、如不服本判決，應於判決送達之翌日起10日內，以書狀敘述\n    理向本院提出上訴狀（應附繕本），上訴於本院合議庭。",
    "reason": "一、本件犯罪事實及證據，除檢察官聲請簡易判決處刑書犯罪事\n    實欄一第2 行「性交行為」之記載應更正為「猥褻行為」，\n    並於犯罪事實欄一第5 行後段更正為「猥褻半套性交易( 即\n    由女子撫摸男客之性器官至射精狀態) 」外，餘均引用檢察\n    官聲請簡易判決處刑書所載（如附件）。\n二、核被告所為，係犯刑法第231 條第1 項前段之意圖使女子與\n    他人為猥褻之行為，而容留以營利罪。按刑法第231 條第1\n    項所稱「媒介」，係指居間介紹，使男女因行為人之介紹牽\n    線行為而能與他人為性交、猥褻；「容留」指提供為性交、\n    猥褻之場所而言，如行為人引誘、媒介於前，復加以容留在\n    後，其引誘、媒介之低度行為應為容留之高度行為所吸收（\n    最高法院94年度台上第6002號判決意旨可參），故本件被告\n    媒介之低度行為應為容留之高度行為所吸收，不另論罪，又\n    自本件證人即男客賀治純證稱: 伊問小姐會不會幫伊口交，\n    小姐說再看，但至少會幫伊打手槍等語觀之，其與該名女子\n    間僅達成猥褻行為之性交易之合意，尚未達成性交行為之性\n    交易之合意，復查無其他證據證明被告有容留女子與他人為\n    性交行為之事實，是應認被告僅係容留女子與他人為猥褻行\n    為，故聲請人認本件應論意圖使女子與他人為性交之行為而\n    媒介、容留以營利罪部分，容有誤會，併此敘明。爰審酌被\n    告以媒介、容留女子與他人從事猥褻行為，將女性身體當作\n    交易籌碼，並藉此牟利，不唯破壞社會善良風俗，且將人身\n    體物化，嚴重扭曲社會之價值觀，並審酌被告之素行，犯罪\n    之動機、目的、手段，犯罪後否認犯行等一切情狀，量處如\n    主文所示之刑，並諭知易科罰金之折算標準，以示懲儆。\n三、據上論斷，應依刑事訴訟法第449 條第1 項前段、第3 項、\n    第454 條第2 項，刑法第231 條第1 項前段、第41條第1項\n    前段，刑法施行法第1 條之1 第1 項、第2 項但書，逕以簡\n    易判決處刑如主文。\n四、如不服本判決，應於判決送達之翌日起10日內，以書狀敘述\n    理向本院提出上訴狀（應附繕本），上訴於本院合議庭。"
  },
  "search": "臺灣桃園地方法院刑事簡易判決100年度桃簡字第1349號聲請人臺灣桃園地方法院檢察署檢察官被告陳佑政上列被告因妨害風化案件，經檢察官聲請以簡易判決處刑（100年度偵字第4394號），本院判決如下：主文陳佑政意圖使女子與他人為猥褻之行為，而容留以營利，處有期徒刑肆月，如易科罰金，以新臺幣壹仟元折算壹日。事實及理由一、本件犯罪事實及證據，除檢察官聲請簡易判決處刑書犯罪事實欄一第2行「性交行為」之記載應更正為「猥褻行為」，並於犯罪事實欄一第5行後段更正為「猥褻半套性交易(即由女子撫摸男客之性器官至射精狀態)」外，餘均引用檢察官聲請簡易判決處刑書所載（如附件）。二、核被告所為，係犯刑法第231條第1項前段之意圖使女子與他人為猥褻之行為，而容留以營利罪。按刑法第231條第1項所稱「媒介」，係指居間介紹，使男女因行為人之介紹牽線行為而能與他人為性交、猥褻；「容留」指提供為性交、猥褻之場所而言，如行為人引誘、媒介於前，復加以容留在後，其引誘、媒介之低度行為應為容留之高度行為所吸收（最高法院94年度台上第6002號判決意旨可參），故本件被告媒介之低度行為應為容留之高度行為所吸收，不另論罪，又自本件證人即男客賀治純證稱:伊問小姐會不會幫伊口交，小姐說再看，但至少會幫伊打手槍等語觀之，其與該名女子間僅達成猥褻行為之性交易之合意，尚未達成性交行為之性交易之合意，復查無其他證據證明被告有容留女子與他人為性交行為之事實，是應認被告僅係容留女子與他人為猥褻行為，故聲請人認本件應論意圖使女子與他人為性交之行為而媒介、容留以營利罪部分，容有誤會，併此敘明。爰審酌被告以媒介、容留女子與他人從事猥褻行為，將女性身體當作交易籌碼，並藉此牟利，不唯破壞社會善良風俗，且將人身體物化，嚴重扭曲社會之價值觀，並審酌被告之素行，犯罪之動機、目的、手段，犯罪後否認犯行等一切情狀，量處如主文所示之刑，並諭知易科罰金之折算標準，以示懲儆。三、據上論斷，應依刑事訴訟法第449條第1項前段、第3項、第454條第2項，刑法第231條第1項前段、第41條第1項前段，刑法施行法第1條之1第1項、第2項但書，逕以簡易判決處刑如主文。四、如不服本判決，應於判決送達之翌日起10日內，以書狀敘述理向本院提出上訴狀（應附繕本），上訴於本院合議庭。中華民國100年7月21日刑事第二庭法官李麗珍附錄法條:刑法第231條",
  "characters": {
    "judges": [
      "李麗珍"
    ],
    "prosecutors": [

    ],
    "lawyers": [

    ],
    "clerks": [

    ],
    "plaintiffs": [

    ],
    "defendants": [
      "陳佑政"
    ],
    "prosecutor_office": [
      "臺灣桃園地方法院檢察署檢察官"
    ],
    "creditors": [

    ],
    "debtors": [

    ],
    "judicial_associate_officer": [

    ]
  },
  "adjudged_at": "2011-07-21",
  "created_at": "2016-02-14 03:49:35",
  "updated_at": "2016-02-14 03:49:35"
}