{
  "identify": "ULD-100-繼-237-20110721-1",
  "court": {
    "name": "臺灣雲林地方法院",
    "code": "ULD"
  },
  "division": {
    "name": "民事",
    "code": "V"
  },
  "year": 100,
  "word": "繼",
  "number": "237",
  "jcheck": "1",
  "reason": "陳報遺產清冊",
  "content": "臺灣雲林地方法院民事裁定              100年度繼字第237號\n聲  請  人  朱月照\n上列聲請人陳報遺產清冊事件，本院裁定如下：\n一、聲請人係被繼承人朱順福（男，民國○○年○ 月○○日生，國民\n    身分證統一編號：Ｚ000000000號，生前最後住所：雲林縣林\n    內鄉○○村○○鄰○○○路202 巷3 弄60號）之女，為其繼承\n    人。被繼承人於100年6月15日死亡，聲請人開具遺產清冊陳\n    報本院，經核並無不合，本院爰依法為公示催告。\n二、被繼承人之債權人應於本公示催告最後登載新聞紙之翌日起\n    6 個月內向繼承人報明其債權，如不為報明，而又為繼承人\n    所不知者，僅得就賸餘遺產行使其權利。\n三、聲請人應於收受本裁定之日起20日內將本裁定全文登載公報\n    、新聞紙或其他相類之傳播工具，並將登載證明檢送本院。\n四、程序費用新臺幣壹仟元由被繼承人朱順福之遺產負擔。\n中    華    民    國  100     年    7     月    21    日\n                  家事法庭    法      官  林秋火\n以上正本係照原本作成\n如對本裁定抗告須於裁定送達後10日內向本院提出抗告狀，並應\n繳納抗告費新臺幣1,000元整。\n中    華    民    國  100     年    7     月    21    日\n                              書  記  官  林麗娟",
  "structure": {
  },
  "search": "臺灣雲林地方法院民事裁定100年度繼字第237號聲請人朱月照上列聲請人陳報遺產清冊事件，本院裁定如下：一、聲請人係被繼承人朱順福（男，民國○○年○月○○日生，國民身分證統一編號：Ｚ000000000號，生前最後住所：雲林縣林內鄉○○村○○鄰○○○路202巷3弄60號）之女，為其繼承人。被繼承人於100年6月15日死亡，聲請人開具遺產清冊陳報本院，經核並無不合，本院爰依法為公示催告。二、被繼承人之債權人應於本公示催告最後登載新聞紙之翌日起6個月內向繼承人報明其債權，如不為報明，而又為繼承人所不知者，僅得就賸餘遺產行使其權利。三、聲請人應於收受本裁定之日起20日內將本裁定全文登載公報、新聞紙或其他相類之傳播工具，並將登載證明檢送本院。四、程序費用新臺幣壹仟元由被繼承人朱順福之遺產負擔。中華民國100年7月21日家事法庭法官林秋火以上正本係照原本作成如對本裁定抗告須於裁定送達後10日內向本院提出抗告狀，並應繳納抗告費新臺幣1,000元整。中華民國100年7月21日書記官林麗娟",
  "characters": {
    "judges": [
      "林秋火"
    ],
    "prosecutors": [

    ],
    "lawyers": [

    ],
    "clerks": [

    ],
    "plaintiffs": [

    ],
    "defendants": [

    ],
    "prosecutor_office": [
      "朱月照"
    ],
    "creditors": [

    ],
    "debtors": [

    ],
    "judicial_associate_officer": [

    ]
  },
  "adjudged_at": "2011-07-21",
  "created_at": "2016-02-14 03:32:11",
  "updated_at": "2016-02-14 03:32:11"
}