{
  "identify": "TCD-100-易-672-20110318-1",
  "court": {
    "name": "臺灣臺中地方法院",
    "code": "TCD"
  },
  "division": {
    "name": "刑事",
    "code": "M"
  },
  "year": 100,
  "word": "易",
  "number": "672",
  "jcheck": "1",
  "reason": "毒品危害防制條例",
  "content": "臺灣臺中地方法院宣示判決筆錄          100年度易字第672號\n公  訴  人  臺灣臺中地方法院檢察署檢察官\n被      告  林若家\n上列被告因毒品危害防制條例案件，經檢察官提起公訴（99年度\n毒偵字第4549號），並聲請認罪協商，本院進行認罪協商程序後\n，於中華民國100年3月18日下午4時，在本院第4法庭宣示判決，\n出席職員如下：\n                               法  官  羅智文\n                               書記官  洪菘臨\n法官起立朗讀判決主文、犯罪事實要旨、處罰條文，及告以上訴\n限制、期間並提出上訴狀之法院，且諭知記載其內容：\n一、主文\n    林若家施用第二級毒品，處有期徒刑參月，如易科罰金，以\n    新臺幣壹仟元折算壹日。\n二、犯罪事實要旨\n    林若家前因施用毒品案件，經觀察、勒戒結果，認無繼續施\n    用毒品之傾向，於民國95年3月21日執行完畢釋放。詎仍不\n    知戒絕，竟基於施用第二級毒品之犯意，於99年7月15日或\n    16日之某時，在臺中市西區某友人租屋處，以置於玻璃球燒\n    烤吸食煙霧之方式，施用甲基安非他命1次。嗣於99年7月19\n    日上午8時許，在臺中市太平區○○○路58巷56弄21號住處\n    為警查獲，經警採集其尿液送檢驗結果，呈甲基安非他命陽\n    性反應，而查悉上情。\n三、處罰條文\n    毒品危害防制條例第10條第2項\n    施用第二級毒品者，處3年以下有期徒刑。\n四、協商判決除有刑事訴訟法第455 條之4 第1 項第1 款於本訊\n    問程序終結前，被告撤銷協商合意或檢察官撤回協商聲請者\n    ；第2 款被告協商之意思非出於自由意志者；第4 款被告所\n    犯之罪非第455 條之2 第1 項所定得以協商判決者；第6 款\n    被告有其他較重之裁判上一罪之犯罪事實者；第7 款法院認\n    應諭知免刑或免訴、不受理者情形之一，及違反同條第2 項\n    「法院應於協商合意範圍內為判決；法院為協商判決所科之\n    刑，以宣告緩刑或2 年以下有期徒刑、拘役或罰金為限」之\n    規定者外，不得上訴。\n五、如有上開可得上訴情形，得自收受宣示判決筆錄送達之日起\n    10日內，向本院提出上訴書狀，上訴於第二審法院。\n中    華    民    國   100    年    3     月    18    日\n                  刑事第四庭          法  官  羅智文\n                                      書記官  洪菘臨\n上為正本係照原本作成。\n                                      書記官  洪菘臨\n中    華    民    國   100    年    3     月    18    日",
  "structure": {
  },
  "search": "臺灣臺中地方法院宣示判決筆錄100年度易字第672號公訴人臺灣臺中地方法院檢察署檢察官被告林若家上列被告因毒品危害防制條例案件，經檢察官提起公訴（99年度毒偵字第4549號），並聲請認罪協商，本院進行認罪協商程序後，於中華民國100年3月18日下午4時，在本院第4法庭宣示判決，出席職員如下：法官羅智文書記官洪菘臨法官起立朗讀判決主文、犯罪事實要旨、處罰條文，及告以上訴限制、期間並提出上訴狀之法院，且諭知記載其內容：一、主文林若家施用第二級毒品，處有期徒刑參月，如易科罰金，以新臺幣壹仟元折算壹日。二、犯罪事實要旨林若家前因施用毒品案件，經觀察、勒戒結果，認無繼續施用毒品之傾向，於民國95年3月21日執行完畢釋放。詎仍不知戒絕，竟基於施用第二級毒品之犯意，於99年7月15日或16日之某時，在臺中市西區某友人租屋處，以置於玻璃球燒烤吸食煙霧之方式，施用甲基安非他命1次。嗣於99年7月19日上午8時許，在臺中市太平區○○○路58巷56弄21號住處為警查獲，經警採集其尿液送檢驗結果，呈甲基安非他命陽性反應，而查悉上情。三、處罰條文毒品危害防制條例第10條第2項施用第二級毒品者，處3年以下有期徒刑。四、協商判決除有刑事訴訟法第455條之4第1項第1款於本訊問程序終結前，被告撤銷協商合意或檢察官撤回協商聲請者；第2款被告協商之意思非出於自由意志者；第4款被告所犯之罪非第455條之2第1項所定得以協商判決者；第6款被告有其他較重之裁判上一罪之犯罪事實者；第7款法院認應諭知免刑或免訴、不受理者情形之一，及違反同條第2項「法院應於協商合意範圍內為判決；法院為協商判決所科之刑，以宣告緩刑或2年以下有期徒刑、拘役或罰金為限」之規定者外，不得上訴。五、如有上開可得上訴情形，得自收受宣示判決筆錄送達之日起10日內，向本院提出上訴書狀，上訴於第二審法院。中華民國100年3月18日刑事第四庭法官羅智文書記官洪菘臨上為正本係照原本作成。書記官洪菘臨中華民國100年3月18日",
  "characters": {
    "judges": [
      "羅智文",
      "羅智文"
    ],
    "prosecutors": [

    ],
    "lawyers": [

    ],
    "clerks": [
      "洪菘臨",
      "洪菘臨",
      "洪菘臨"
    ],
    "plaintiffs": [

    ],
    "defendants": [
      "林若家"
    ],
    "prosecutor_office": [
      "臺灣臺中地方法院檢察署檢察官"
    ],
    "creditors": [

    ],
    "debtors": [

    ],
    "judicial_associate_officer": [

    ]
  },
  "adjudged_at": "2011-03-18",
  "created_at": "2016-02-13 19:12:52",
  "updated_at": "2016-02-13 19:12:52"
}