{
  "identify": "TTD-100-司促-359-20110125-2",
  "court": {
    "name": "臺灣臺東地方法院",
    "code": "TTD"
  },
  "division": {
    "name": "民事",
    "code": "V"
  },
  "year": 100,
  "word": "司促",
  "number": "359",
  "jcheck": "2",
  "reason": "支付命令",
  "content": "臺灣臺東地方法院支付命令            100年度司促字第359號\n債  權  人  永豐商業銀行股份有限公司\n法定代理人  邱正雄\n債  務  人  羅文華\n一、債務人應向債權人給付新臺幣肆萬玖仟玖佰肆拾伍元，及自\n    民國九十三年一月二十日起至清償日止，按週年利率百分之\n    十五計算之利息，暨自民國九十三年二月二十日起至清償日\n    止，其逾期在六個月以內者，按上開利率百分之十，逾期超\n    過六個月者，按上開利率百分之二十計算之違約金，並負擔\n    督促程序費用新臺幣伍佰元，否則應於本命令送達後二十日\n    之不變期間內，向本院提出異議。\n二、債權人請求之原因事實：\n（一）台北國際商業銀行股份有限公司」與「建華商業銀行股份\n      有限公司」於95年11月13日合併，並更名為「永豐商業銀\n      行股份有限公司」，此合先敘明。\n（二）債務人羅文華於92年10月7日向債權人訂立有現金卡短期\n      循環融資契約書，自核卡日起為期一年，期滿時，如立約\n      人不為反對續約之意思，得以同一內容繼續延長一年，不\n      另換約（短期循環融資契約第一條）。經本行調整額度為\n      50,000元，依約應於每月20日結算一次，並依年息百分之\n      十五按日計息（短期循環融資契約第二條）。上開債務，\n      相對人如未按期本息攤還時，除按原訂利率付息並喪失期\n      限利益外，自逾期之日起六個月以內按原訂利率之一成，\n      逾期六個月以上則按原訂利率之二成計算加付違約金（短\n      期循環融資契約第三條）。債務人至93年1月19日尚積欠\n      本金49,945元，覆經催討，迄未清償。\n三、如債務人未於第一項期間內提出異議，本命令與確定判決有\n    同一效力。\n中    華    民    國   100    年    1     月    25    日\n              簡易庭司法事務官  洪子嵐",
  "structure": {
  },
  "search": "臺灣臺東地方法院支付命令100年度司促字第359號債權人永豐商業銀行股份有限公司法定代理人邱正雄債務人羅文華一、債務人應向債權人給付新臺幣肆萬玖仟玖佰肆拾伍元，及自民國九十三年一月二十日起至清償日止，按週年利率百分之十五計算之利息，暨自民國九十三年二月二十日起至清償日止，其逾期在六個月以內者，按上開利率百分之十，逾期超過六個月者，按上開利率百分之二十計算之違約金，並負擔督促程序費用新臺幣伍佰元，否則應於本命令送達後二十日之不變期間內，向本院提出異議。二、債權人請求之原因事實：（一）台北國際商業銀行股份有限公司」與「建華商業銀行股份有限公司」於95年11月13日合併，並更名為「永豐商業銀行股份有限公司」，此合先敘明。（二）債務人羅文華於92年10月7日向債權人訂立有現金卡短期循環融資契約書，自核卡日起為期一年，期滿時，如立約人不為反對續約之意思，得以同一內容繼續延長一年，不另換約（短期循環融資契約第一條）。經本行調整額度為50,000元，依約應於每月20日結算一次，並依年息百分之十五按日計息（短期循環融資契約第二條）。上開債務，相對人如未按期本息攤還時，除按原訂利率付息並喪失期限利益外，自逾期之日起六個月以內按原訂利率之一成，逾期六個月以上則按原訂利率之二成計算加付違約金（短期循環融資契約第三條）。債務人至93年1月19日尚積欠本金49,945元，覆經催討，迄未清償。三、如債務人未於第一項期間內提出異議，本命令與確定判決有同一效力。中華民國100年1月25日簡易庭司法事務官洪子嵐",
  "characters": {
    "judges": [

    ],
    "prosecutors": [

    ],
    "lawyers": [

    ],
    "clerks": [

    ],
    "plaintiffs": [

    ],
    "defendants": [

    ],
    "prosecutor_office": [

    ],
    "creditors": [
      "永豐商業銀行股份有限公司"
    ],
    "debtors": [
      "羅文華"
    ],
    "judicial_associate_officer": [
      "洪子嵐"
    ]
  },
  "adjudged_at": "2011-01-25",
  "created_at": "2016-02-13 06:41:37",
  "updated_at": "2016-02-13 06:41:37"
}