{
  "identify": "KSD-100-聲-5809-20111221-1",
  "court": {
    "name": "臺灣高雄地方法院",
    "code": "KSD"
  },
  "division": {
    "name": "刑事",
    "code": "M"
  },
  "year": 100,
  "word": "聲",
  "number": "5809",
  "jcheck": "1",
  "reason": "聲請宣告沒收",
  "content": "臺灣高雄地方法院刑事裁定             100年度聲字第5809號\n聲  請  人  臺灣高雄地方法院檢察署檢察官\n被      告  朱亮明\n上列聲請人因被告違反偽造貨幣案件，聲請宣告沒收（100 年度\n聲沒字第641 號），本院裁定如下：\n    主  文\n扣案之偽造新臺幣壹仟元紙鈔肆拾肆張（票號均為：CT921187BY\n號）均沒收之。\n    理  由\n一、聲請意旨略以：被告朱亮明涉嫌意圖行使而收集偽造貨幣案\n    件，因罪嫌不足業經臺灣高雄地方法院檢察署92年偵續一字\n    第7 號為不起訴處分確定，惟查獲扣案之偽造新臺幣1,000\n    元紙鈔44張，經送中央印製廠鑑定為偽鈔，此有中央銀行發\n    行局函一紙可憑。按偽造通用貨幣，不問屬於犯人與否，沒\n    收之，刑法第200 條定有明文，爰依法聲請宣告沒收等語。\n二、按違禁物或專科沒收之物，得單獨宣告沒收，刑法第40條第\n    2 項定有明文。又依刑法第200 條沒收之偽造紙幣，以構成\n    同法分則第12章所定各罪之偽造紙幣為限，此有最高法院30\n    年度上字第2014號判例、55年度臺上字第820 號、80年度臺\n    上字第124 號、5058號判決可資參照。則刑法第200 條之沒\n    收規定，係指得沒收之物以犯刑法偽造貨幣罪章之罪為限。\n    惟觀諸刑法第40條第2 項於94年2 月2 日修正之立法理由謂\n    「刑法分則或刑事特別法關於專科沒收之物，例如偽造之印\n    章、印文、有價證券、信用卡、貨幣，雖非違禁物，然其性\n    質究不宜任令在外流通，自有單獨宣告沒收之必要，爰於第\n    2 項增訂之」等語，考其立法目的，無非係刑法分則或刑事\n    特別法關於專科沒收之物，雖非違禁物，惟在缺乏主刑之情\n    況下，其性質究不宜任令在外流通，自有單獨宣告沒收之必\n    要。故於被告經判決無罪或經不起訴處分而缺乏主刑之情況\n    下，自得依刑法第40條第2 項之規定單獨宣告沒收。\n三、經查：被告朱亮明所涉犯偽造貨幣案件，業經臺灣高雄地方\n    法院檢察署檢察官以92年度偵續一字第7 號為不起訴處分，\n    並經駁回再議而告確定等情，有上揭不起訴處分書及92年度\n    上職議字第230 號處分書附卷足稽。該案所查扣之1,000 元\n    紙鈔共計44張（號碼均為：CT921187BY號），經送鑑定後認\n    屬偽造紙幣，有中央銀行發行局90年9 月25日（90）台央發\n    字第030050732 號函一紙可參，依上揭說明，應認得依法單\n    獨宣告沒收，是本件聲請並無不合，應予准許。\n四、依刑事訴訟法第220 條，刑法第200 條、第40條第2 項，裁\n    定如主文。\n中    華    民    國  100    年    12    月    21     日\n                  刑事第十六庭  法  官  施柏宏\n以上正本證明與原本無異。\n如不服本裁定，應於送達後5日內，向本院提出抗告狀。\n中    華    民    國  100    年    12    月    21     日\n                                書記官  胡樂寧",
  "structure": {
    "main": "扣案之偽造新臺幣壹仟元紙鈔肆拾肆張（票號均為：CT921187BY\n號）均沒收之。",
    "reason": "一、聲請意旨略以：被告朱亮明涉嫌意圖行使而收集偽造貨幣案\n    件，因罪嫌不足業經臺灣高雄地方法院檢察署92年偵續一字\n    第7 號為不起訴處分確定，惟查獲扣案之偽造新臺幣1,000\n    元紙鈔44張，經送中央印製廠鑑定為偽鈔，此有中央銀行發\n    行局函一紙可憑。按偽造通用貨幣，不問屬於犯人與否，沒\n    收之，刑法第200 條定有明文，爰依法聲請宣告沒收等語。\n二、按違禁物或專科沒收之物，得單獨宣告沒收，刑法第40條第\n    2 項定有明文。又依刑法第200 條沒收之偽造紙幣，以構成\n    同法分則第12章所定各罪之偽造紙幣為限，此有最高法院30\n    年度上字第2014號判例、55年度臺上字第820 號、80年度臺\n    上字第124 號、5058號判決可資參照。則刑法第200 條之沒\n    收規定，係指得沒收之物以犯刑法偽造貨幣罪章之罪為限。\n    惟觀諸刑法第40條第2 項於94年2 月2 日修正之立法理由謂\n    「刑法分則或刑事特別法關於專科沒收之物，例如偽造之印\n    章、印文、有價證券、信用卡、貨幣，雖非違禁物，然其性\n    質究不宜任令在外流通，自有單獨宣告沒收之必要，爰於第\n    2 項增訂之」等語，考其立法目的，無非係刑法分則或刑事\n    特別法關於專科沒收之物，雖非違禁物，惟在缺乏主刑之情\n    況下，其性質究不宜任令在外流通，自有單獨宣告沒收之必\n    要。故於被告經判決無罪或經不起訴處分而缺乏主刑之情況\n    下，自得依刑法第40條第2 項之規定單獨宣告沒收。\n三、經查：被告朱亮明所涉犯偽造貨幣案件，業經臺灣高雄地方\n    法院檢察署檢察官以92年度偵續一字第7 號為不起訴處分，\n    並經駁回再議而告確定等情，有上揭不起訴處分書及92年度\n    上職議字第230 號處分書附卷足稽。該案所查扣之1,000 元\n    紙鈔共計44張（號碼均為：CT921187BY號），經送鑑定後認\n    屬偽造紙幣，有中央銀行發行局90年9 月25日（90）台央發\n    字第030050732 號函一紙可參，依上揭說明，應認得依法單\n    獨宣告沒收，是本件聲請並無不合，應予准許。\n四、依刑事訴訟法第220 條，刑法第200 條、第40條第2 項，裁\n    定如主文。"
  },
  "search": "臺灣高雄地方法院刑事裁定100年度聲字第5809號聲請人臺灣高雄地方法院檢察署檢察官被告朱亮明上列聲請人因被告違反偽造貨幣案件，聲請宣告沒收（100年度聲沒字第641號），本院裁定如下：主文扣案之偽造新臺幣壹仟元紙鈔肆拾肆張（票號均為：CT921187BY號）均沒收之。理由一、聲請意旨略以：被告朱亮明涉嫌意圖行使而收集偽造貨幣案件，因罪嫌不足業經臺灣高雄地方法院檢察署92年偵續一字第7號為不起訴處分確定，惟查獲扣案之偽造新臺幣1,000元紙鈔44張，經送中央印製廠鑑定為偽鈔，此有中央銀行發行局函一紙可憑。按偽造通用貨幣，不問屬於犯人與否，沒收之，刑法第200條定有明文，爰依法聲請宣告沒收等語。二、按違禁物或專科沒收之物，得單獨宣告沒收，刑法第40條第2項定有明文。又依刑法第200條沒收之偽造紙幣，以構成同法分則第12章所定各罪之偽造紙幣為限，此有最高法院30年度上字第2014號判例、55年度臺上字第820號、80年度臺上字第124號、5058號判決可資參照。則刑法第200條之沒收規定，係指得沒收之物以犯刑法偽造貨幣罪章之罪為限。惟觀諸刑法第40條第2項於94年2月2日修正之立法理由謂「刑法分則或刑事特別法關於專科沒收之物，例如偽造之印章、印文、有價證券、信用卡、貨幣，雖非違禁物，然其性質究不宜任令在外流通，自有單獨宣告沒收之必要，爰於第2項增訂之」等語，考其立法目的，無非係刑法分則或刑事特別法關於專科沒收之物，雖非違禁物，惟在缺乏主刑之情況下，其性質究不宜任令在外流通，自有單獨宣告沒收之必要。故於被告經判決無罪或經不起訴處分而缺乏主刑之情況下，自得依刑法第40條第2項之規定單獨宣告沒收。三、經查：被告朱亮明所涉犯偽造貨幣案件，業經臺灣高雄地方法院檢察署檢察官以92年度偵續一字第7號為不起訴處分，並經駁回再議而告確定等情，有上揭不起訴處分書及92年度上職議字第230號處分書附卷足稽。該案所查扣之1,000元紙鈔共計44張（號碼均為：CT921187BY號），經送鑑定後認屬偽造紙幣，有中央銀行發行局90年9月25日（90）台央發字第030050732號函一紙可參，依上揭說明，應認得依法單獨宣告沒收，是本件聲請並無不合，應予准許。四、依刑事訴訟法第220條，刑法第200條、第40條第2項，裁定如主文。中華民國100年12月21日刑事第十六庭法官施柏宏以上正本證明與原本無異。如不服本裁定，應於送達後5日內，向本院提出抗告狀。中華民國100年12月21日書記官胡樂寧",
  "characters": {
    "judges": [
      "施柏宏"
    ],
    "prosecutors": [

    ],
    "lawyers": [

    ],
    "clerks": [

    ],
    "plaintiffs": [

    ],
    "defendants": [
      "朱亮明"
    ],
    "prosecutor_office": [
      "臺灣高雄地方法院檢察署檢察官"
    ],
    "creditors": [

    ],
    "debtors": [

    ],
    "judicial_associate_officer": [

    ]
  },
  "adjudged_at": "2011-12-21",
  "created_at": "2016-02-13 10:52:05",
  "updated_at": "2016-02-13 10:52:05"
}