{
  "identify": "PTD-100-婚-277-20111222-2",
  "court": {
    "name": "臺灣屏東地方法院",
    "code": "PTD"
  },
  "division": {
    "name": "民事",
    "code": "V"
  },
  "year": 100,
  "word": "婚",
  "number": "277",
  "jcheck": "2",
  "reason": "離婚等",
  "content": "臺灣屏東地方法院民事裁定              100年度婚字第277號\n原      告  陳敏忠\n被      告  吳愛夢    曾住屏東.\n上列當事人間請求離婚等事件，本院裁定如下：\n    主  文\n原告之訴駁回。\n訴訟費用由原告負擔。\n    理  由\n一、按起訴不合程式或不備其他要件，依其情形可以補正，經審\n    判長定期間命其補正而不補正者，法院應以裁定駁回之，民\n    事訴訟法第249 條第1 項第6 款定有明文。又當事人書狀，\n    依同法第116 條第1 項第1 款規定，應記載當事人姓名及住\n    所或居所，此為法定必須具備之程式，是原告所具訴狀內未\n    記載被告之住居所或其應為送達之處所不明，原告不遵\n    審判長所定期限補陳或聲請為公示送達者，應認原告起訴不\n    合程式以裁定駁回其訴（最高法院84年度台抗字第219 號裁\n    判參考）。\n二、本件原告起訴請求判決與被告吳愛夢離婚，僅於起訴狀記載\n    被告為印尼國人，住屏東縣長治鄉○○村○○○ 街31號。然\n    經本院向內政部入出國及移民署函查得知被告於民國（下同\n    ）96年7 月13日出境即未入境臺灣，可見上開地址並非被告\n    應受送達處所，有該署100 年9 月9 日移署資處雲字第1000\n    141083號函檢送之被告入出境資料附卷足佐。本院於100 年\n    10月31日裁定命原告應於裁定送達日起10日內補正被告之外\n    國（印尼）住所或其應受送達處所，並繕具起訴狀繕本及送\n    達證書之印尼文譯本俾便送達被告，該裁定業於同年11月18\n    日合法送達原告，有該送達證書附卷可參，惟原告逾期迄未\n    補正上開事項，致本院無從依法對被告進行送達。依前揭法\n    律規定，其起訴不備法定要件，亦未於期限內補正，本院應\n    裁定駁回原告之訴。\n三、依民事訴訟法第249 條第1 項第6 款、第95條、第78條，裁\n    定如主文。\n中    華    民    國   100    年    12    月    22    日\n                        家事庭法  官  朱盈吉\n以上正本係照原本作成。\n如不服本裁定應於送達後10日內向本院提出抗告狀，並繳納抗告\n費新臺幣1,000元。\n中    華    民    國   100    年    12    月    22    日\n                              書記官  蔡明株",
  "structure": {
    "main": "原告之訴駁回。\n訴訟費用由原告負擔。",
    "reason": "一、按起訴不合程式或不備其他要件，依其情形可以補正，經審\n    判長定期間命其補正而不補正者，法院應以裁定駁回之，民\n    事訴訟法第249 條第1 項第6 款定有明文。又當事人書狀，\n    依同法第116 條第1 項第1 款規定，應記載當事人姓名及住\n    所或居所，此為法定必須具備之程式，是原告所具訴狀內未\n    記載被告之住居所或其應為送達之處所不明，原告不遵\n    審判長所定期限補陳或聲請為公示送達者，應認原告起訴不\n    合程式以裁定駁回其訴（最高法院84年度台抗字第219 號裁\n    判參考）。\n二、本件原告起訴請求判決與被告吳愛夢離婚，僅於起訴狀記載\n    被告為印尼國人，住屏東縣長治鄉○○村○○○ 街31號。然\n    經本院向內政部入出國及移民署函查得知被告於民國（下同\n    ）96年7 月13日出境即未入境臺灣，可見上開地址並非被告\n    應受送達處所，有該署100 年9 月9 日移署資處雲字第1000\n    141083號函檢送之被告入出境資料附卷足佐。本院於100 年\n    10月31日裁定命原告應於裁定送達日起10日內補正被告之外\n    國（印尼）住所或其應受送達處所，並繕具起訴狀繕本及送\n    達證書之印尼文譯本俾便送達被告，該裁定業於同年11月18\n    日合法送達原告，有該送達證書附卷可參，惟原告逾期迄未\n    補正上開事項，致本院無從依法對被告進行送達。依前揭法\n    律規定，其起訴不備法定要件，亦未於期限內補正，本院應\n    裁定駁回原告之訴。\n三、依民事訴訟法第249 條第1 項第6 款、第95條、第78條，裁\n    定如主文。"
  },
  "search": "臺灣屏東地方法院民事裁定100年度婚字第277號原告陳敏忠被告吳愛夢曾住屏東.上列當事人間請求離婚等事件，本院裁定如下：主文原告之訴駁回。訴訟費用由原告負擔。理由一、按起訴不合程式或不備其他要件，依其情形可以補正，經審判長定期間命其補正而不補正者，法院應以裁定駁回之，民事訴訟法第249條第1項第6款定有明文。又當事人書狀，依同法第116條第1項第1款規定，應記載當事人姓名及住所或居所，此為法定必須具備之程式，是原告所具訴狀內未記載被告之住居所或其應為送達之處所不明，原告不遵審判長所定期限補陳或聲請為公示送達者，應認原告起訴不合程式以裁定駁回其訴（最高法院84年度台抗字第219號裁判參考）。二、本件原告起訴請求判決與被告吳愛夢離婚，僅於起訴狀記載被告為印尼國人，住屏東縣長治鄉○○村○○○街31號。然經本院向內政部入出國及移民署函查得知被告於民國（下同）96年7月13日出境即未入境臺灣，可見上開地址並非被告應受送達處所，有該署100年9月9日移署資處雲字第1000141083號函檢送之被告入出境資料附卷足佐。本院於100年10月31日裁定命原告應於裁定送達日起10日內補正被告之外國（印尼）住所或其應受送達處所，並繕具起訴狀繕本及送達證書之印尼文譯本俾便送達被告，該裁定業於同年11月18日合法送達原告，有該送達證書附卷可參，惟原告逾期迄未補正上開事項，致本院無從依法對被告進行送達。依前揭法律規定，其起訴不備法定要件，亦未於期限內補正，本院應裁定駁回原告之訴。三、依民事訴訟法第249條第1項第6款、第95條、第78條，裁定如主文。中華民國100年12月22日家事庭法官朱盈吉以上正本係照原本作成。如不服本裁定應於送達後10日內向本院提出抗告狀，並繳納抗告費新臺幣1,000元。中華民國100年12月22日書記官蔡明株",
  "characters": {
    "judges": [
      "朱盈吉"
    ],
    "prosecutors": [

    ],
    "lawyers": [

    ],
    "clerks": [

    ],
    "plaintiffs": [
      "陳敏忠"
    ],
    "defendants": [
      "吳愛夢    曾住屏東."
    ],
    "prosecutor_office": [

    ],
    "creditors": [

    ],
    "debtors": [

    ],
    "judicial_associate_officer": [

    ]
  },
  "adjudged_at": "2011-12-22",
  "created_at": "2016-02-13 10:43:24",
  "updated_at": "2016-02-13 10:43:24"
}