{
  "identify": "KSD-100-司促-28389-20110706-1",
  "court": {
    "name": "臺灣高雄地方法院",
    "code": "KSD"
  },
  "division": {
    "name": "民事",
    "code": "V"
  },
  "year": 100,
  "word": "司促",
  "number": "28389",
  "jcheck": "1",
  "reason": "支付命令",
  "content": "臺灣高雄地方法院支付命令          100年度司促字第28389號\n債  權  人  中國信託商業銀行股份有限公司\n法定代理人  辜松\n債  務  人  邱美齡\n一、債務人應向債權人清償新臺幣柒萬零肆佰貳拾柒元，及如附\n    表所示之利息，並賠償督促程序費用新臺幣伍佰元，否則應\n    於本命令送達後二十日之不變期間內，向本院提出異議。\n二、債權人請求之原因事實：債務人邱美齡於92年7 月24日向債\n    權人借款30,000元，約定自92年7 月24日起至93年7 月24日\n    日止按月清償本息，利息按年利率百分之18.25 採固定利率\n    計算，依約定如有停止付款或經票據交換所通知拒絕往來者\n    ，或任何一宗債務不依約清償本金或付息者等「喪失期限利\n    益之加速條款」情形之一時，借款債務視為全部到期，此有\n    借據為證。又依據貸款申請書規定: 『立約人( 即債務人)\n    同意授權貴行( 即聲請人) 依立約人借款當時之信用狀況核\n    定及填載之。立約人同意貴行得依立約人信用狀況隨時調整\n    借款額度』，故債權人於債務人繳款狀況正常下可調整其借\n    款額度。詎債務人未依約履行債務依雙方所立借據約定當即\n    喪失期限之利益，上述借款視為全部到期，債務人至100 年\n    7 月1 日止累計70,427元正未給付，其中31,226元為本金；\n    38,580元為利息；621 元為依約定條款計算之其他費用，債\n    務人依約除應給付上開款項外，另應給付如附表所示之利息\n    。\n三、如債務人未於第一項期間內提出異議，本命令與確定判決有\n    同一效力。\n中    華    民    國   100    年    7     月    6     日\n                        民事庭司法事務官  黃思瑜\n附表100 年度司促字第28389 號利息：\n┌──┬───┬─────┬──────┬──────┬───────┐\n│本金│ 本金 │相關債務人│ 利息起算日 │ 利息截止日 │ 利息計算方式 │\n│序號│      │          │            │            │              │\n├──┼───┼─────┼──────┼──────┼───────┤\n│ 001│新臺幣│邱美齡    │100年7月2日 │至清償日止  │按年利率18.25%│\n│    │31226 │          │            │            │計算之利息。  │\n│    │元    │          │            │            │              │\n└──┴───┴─────┴──────┴──────┴───────┘\n附註：\n一、案件一經確定本院即依職權核發確定證明書，債權人毋庸具\n    狀申請。\n二、嗣後遞狀應註明案號及股別。",
  "structure": {
  },
  "search": "臺灣高雄地方法院支付命令100年度司促字第28389號債權人中國信託商業銀行股份有限公司法定代理人辜松債務人邱美齡一、債務人應向債權人清償新臺幣柒萬零肆佰貳拾柒元，及如附表所示之利息，並賠償督促程序費用新臺幣伍佰元，否則應於本命令送達後二十日之不變期間內，向本院提出異議。二、債權人請求之原因事實：債務人邱美齡於92年7月24日向債權人借款30,000元，約定自92年7月24日起至93年7月24日日止按月清償本息，利息按年利率百分之18.25採固定利率計算，依約定如有停止付款或經票據交換所通知拒絕往來者，或任何一宗債務不依約清償本金或付息者等「喪失期限利益之加速條款」情形之一時，借款債務視為全部到期，此有借據為證。又依據貸款申請書規定:『立約人(即債務人)同意授權貴行(即聲請人)依立約人借款當時之信用狀況核定及填載之。立約人同意貴行得依立約人信用狀況隨時調整借款額度』，故債權人於債務人繳款狀況正常下可調整其借款額度。詎債務人未依約履行債務依雙方所立借據約定當即喪失期限之利益，上述借款視為全部到期，債務人至100年7月1日止累計70,427元正未給付，其中31,226元為本金；38,580元為利息；621元為依約定條款計算之其他費用，債務人依約除應給付上開款項外，另應給付如附表所示之利息。三、如債務人未於第一項期間內提出異議，本命令與確定判決有同一效力。中華民國100年7月6日民事庭司法事務官黃思瑜附表100年度司促字第28389號利息：┌──┬───┬─────┬──────┬──────┬───────┐│本金│本金│相關債務人│利息起算日│利息截止日│利息計算方式││序號││││││├──┼───┼─────┼──────┼──────┼───────┤│001│新臺幣│邱美齡│100年7月2日│至清償日止│按年利率18.25%│││31226││││計算之利息。│││元│││││└──┴───┴─────┴──────┴──────┴───────┘附註：一、案件一經確定本院即依職權核發確定證明書，債權人毋庸具狀申請。二、嗣後遞狀應註明案號及股別。",
  "characters": {
    "judges": [

    ],
    "prosecutors": [

    ],
    "lawyers": [

    ],
    "clerks": [

    ],
    "plaintiffs": [

    ],
    "defendants": [

    ],
    "prosecutor_office": [

    ],
    "creditors": [
      "中國信託商業銀行股份有限公司"
    ],
    "debtors": [
      "邱美齡"
    ],
    "judicial_associate_officer": [
      "黃思瑜"
    ]
  },
  "adjudged_at": "2011-07-06",
  "created_at": "2016-02-14 03:07:51",
  "updated_at": "2016-02-14 03:07:51"
}