{
  "identify": "MLD-100-聲-294-20110413-1",
  "court": {
    "name": "臺灣苗栗地方法院",
    "code": "MLD"
  },
  "division": {
    "name": "刑事",
    "code": "M"
  },
  "year": 100,
  "word": "聲",
  "number": "294",
  "jcheck": "1",
  "reason": "聲請沒收",
  "content": "臺灣苗栗地方法院刑事裁定             100年度聲字第294號\n聲  請  人  臺灣苗栗地方法院檢察署檢察官\n被      告  康元智\n上列聲請人因違禁物事件，聲請單獨宣告沒收（100 年度聲沒字\n第30號、99年度毒偵字第1843號）案件，本院裁定如下：\n    主  文\n扣案之第二級毒品甲基安非他命壹包（驗餘後淨重零點零捌陸貳\n公克）沒收銷燬之。\n    理  由\n一、本件聲請意旨略以：被告因施用毒品案件，經觀察、勒戒後\n    ，認無繼續施用毒品之傾向，業經臺灣苗栗地方法院檢察署\n    檢察官為不起訴處分（99年度毒偵字第1843號），惟查扣案\n    之第二級毒品甲基安非他命1包（驗餘後淨重0.0862 公克）\n    ，核為違禁物，爰依刑法第40條第2 項，毒品危害防制條例\n    第18條第1 項前段，聲請沒收銷燬之等語。\n二、按違禁物不問屬於何人所有，均得單獨宣告沒收，刑法第40\n    條第2 項定有明文。又查獲之第一、二級毒品，不問屬於犯\n    人與否，均沒收銷燬之，毒品危害防制條例第18條第1 項前\n    段亦定有明文。經查，被告經警查獲之上開違反毒品危害防\n    制條例案件，業由聲請人以99年度毒偵字第1843號為不起訴\n    處分確定，有該不起訴處分書附卷可稽；次查，扣案之甲基\n    安非他命1包（驗餘後淨重0.0862 公克），經行政院衛生署\n    草屯療養院鑑驗結果，呈甲基安非他命反應，有行政院衛生\n    署草屯療養院100 年2 月15日草療鑑字第1000200034號鑑定\n    書1 紙在卷可稽（見99年度毒偵字第1843號卷第60頁），係\n    屬毒品危害防制條例第2 條第2 項第2 款所定之第二級毒品\n    ；另有扣押物品清單1 紙（詳見同上卷第39頁）、查獲照片\n    7 張（詳見同上卷第26頁至第29頁）附卷可考。是聲請人之\n    聲請，核無違誤，應予准許。\n三、依刑事訴訟法第220 條，刑法第40條第2 項，毒品危害防制\n    條例第18條第1 項前段，裁定如主文。\n中    華    民    國   100    年    4     月    13    日\n                  刑事第一庭    法  官  周靜妮\n以上正本與原本無異\n如不服本裁定應於送達後5日內向本院提出抗告狀\n                                書記官  巫  穎\n中    華    民    國   100    年    4     月    13    日",
  "structure": {
    "main": "扣案之第二級毒品甲基安非他命壹包（驗餘後淨重零點零捌陸貳\n公克）沒收銷燬之。",
    "reason": "一、本件聲請意旨略以：被告因施用毒品案件，經觀察、勒戒後\n    ，認無繼續施用毒品之傾向，業經臺灣苗栗地方法院檢察署\n    檢察官為不起訴處分（99年度毒偵字第1843號），惟查扣案\n    之第二級毒品甲基安非他命1包（驗餘後淨重0.0862 公克）\n    ，核為違禁物，爰依刑法第40條第2 項，毒品危害防制條例\n    第18條第1 項前段，聲請沒收銷燬之等語。\n二、按違禁物不問屬於何人所有，均得單獨宣告沒收，刑法第40\n    條第2 項定有明文。又查獲之第一、二級毒品，不問屬於犯\n    人與否，均沒收銷燬之，毒品危害防制條例第18條第1 項前\n    段亦定有明文。經查，被告經警查獲之上開違反毒品危害防\n    制條例案件，業由聲請人以99年度毒偵字第1843號為不起訴\n    處分確定，有該不起訴處分書附卷可稽；次查，扣案之甲基\n    安非他命1包（驗餘後淨重0.0862 公克），經行政院衛生署\n    草屯療養院鑑驗結果，呈甲基安非他命反應，有行政院衛生\n    署草屯療養院100 年2 月15日草療鑑字第1000200034號鑑定\n    書1 紙在卷可稽（見99年度毒偵字第1843號卷第60頁），係\n    屬毒品危害防制條例第2 條第2 項第2 款所定之第二級毒品\n    ；另有扣押物品清單1 紙（詳見同上卷第39頁）、查獲照片\n    7 張（詳見同上卷第26頁至第29頁）附卷可考。是聲請人之\n    聲請，核無違誤，應予准許。\n三、依刑事訴訟法第220 條，刑法第40條第2 項，毒品危害防制\n    條例第18條第1 項前段，裁定如主文。"
  },
  "search": "臺灣苗栗地方法院刑事裁定100年度聲字第294號聲請人臺灣苗栗地方法院檢察署檢察官被告康元智上列聲請人因違禁物事件，聲請單獨宣告沒收（100年度聲沒字第30號、99年度毒偵字第1843號）案件，本院裁定如下：主文扣案之第二級毒品甲基安非他命壹包（驗餘後淨重零點零捌陸貳公克）沒收銷燬之。理由一、本件聲請意旨略以：被告因施用毒品案件，經觀察、勒戒後，認無繼續施用毒品之傾向，業經臺灣苗栗地方法院檢察署檢察官為不起訴處分（99年度毒偵字第1843號），惟查扣案之第二級毒品甲基安非他命1包（驗餘後淨重0.0862公克），核為違禁物，爰依刑法第40條第2項，毒品危害防制條例第18條第1項前段，聲請沒收銷燬之等語。二、按違禁物不問屬於何人所有，均得單獨宣告沒收，刑法第40條第2項定有明文。又查獲之第一、二級毒品，不問屬於犯人與否，均沒收銷燬之，毒品危害防制條例第18條第1項前段亦定有明文。經查，被告經警查獲之上開違反毒品危害防制條例案件，業由聲請人以99年度毒偵字第1843號為不起訴處分確定，有該不起訴處分書附卷可稽；次查，扣案之甲基安非他命1包（驗餘後淨重0.0862公克），經行政院衛生署草屯療養院鑑驗結果，呈甲基安非他命反應，有行政院衛生署草屯療養院100年2月15日草療鑑字第1000200034號鑑定書1紙在卷可稽（見99年度毒偵字第1843號卷第60頁），係屬毒品危害防制條例第2條第2項第2款所定之第二級毒品；另有扣押物品清單1紙（詳見同上卷第39頁）、查獲照片7張（詳見同上卷第26頁至第29頁）附卷可考。是聲請人之聲請，核無違誤，應予准許。三、依刑事訴訟法第220條，刑法第40條第2項，毒品危害防制條例第18條第1項前段，裁定如主文。中華民國100年4月13日刑事第一庭法官周靜妮以上正本與原本無異如不服本裁定應於送達後5日內向本院提出抗告狀書記官巫穎中華民國100年4月13日",
  "characters": {
    "judges": [
      "周靜妮"
    ],
    "prosecutors": [

    ],
    "lawyers": [

    ],
    "clerks": [
      "巫穎"
    ],
    "plaintiffs": [

    ],
    "defendants": [
      "康元智"
    ],
    "prosecutor_office": [
      "臺灣苗栗地方法院檢察署檢察官"
    ],
    "creditors": [

    ],
    "debtors": [

    ],
    "judicial_associate_officer": [

    ]
  },
  "adjudged_at": "2011-04-13",
  "created_at": "2016-02-12 07:50:52",
  "updated_at": "2016-02-12 07:50:52"
}