{
  "identify": "TYD-94-訴-911-20050624-1",
  "court": {
    "name": "臺灣桃園地方法院",
    "code": "TYD"
  },
  "division": {
    "name": "刑事",
    "code": "M"
  },
  "year": 94,
  "word": "訴",
  "number": "911",
  "jcheck": "1",
  "reason": "毒品危害防制條例",
  "content": "臺灣桃園地方法院刑事判決               94年度訴字第911號\n公  訴  人  臺灣桃園地方法院檢察署檢察官\n被      告  乙○○  男  22歲.\n                      一中隊).\n指定辯護人  本院公設辯護人甲○○\n上列被告因違反毒品危害防制條例案件，經檢察官提起公訴（94\n年度毒偵字第1173號）後，聲請改依協商程序而為判決，本院判\n決如下：\n    主  文\n乙○○連續施用第一級毒品，處有期徒刑柒月，扣案海洛因壹包\n驗餘淨重零點貳公克沒收銷燬之；又連續施用第二級毒品，處有\n期徒刑伍月。應執行有期徒刑拾月，扣案海洛因壹包驗餘淨重零\n點貳公克沒收銷毀之。\n    事實及證據\n一、乙○○前因施用毒品案件，經本院裁定送觀察、勒戒後，認\n    無繼續施用毒品之傾向，由臺灣桃園地方法院檢察署檢察官\n    於民國91年8 月7 日，以91年度毒偵1780號為不起訴處分。\n    詎其仍未戒除毒癮，基於施用第1 、2 級毒品海洛因及安非\n    他命之概括犯意，自94年1 月間某日起，在桃園縣八德市○\n    ○○街42號住處，施用第1 級毒品海洛因及第2 級毒品安非\n    他命各2 至3 次，嗣於94年1 月25日14時許，在桃園縣桃園\n    市○○路與長春路口查獲。並扣得第1 級毒品海洛因1 小包\n    驗餘淨重0.2 公克。案經桃園縣政府警察局大園分局報請臺\n    灣桃園地方法院檢察署檢察官偵查起訴。\n二、證據：\n    (1)被告乙○○於本院訊問中之自白。\n    (2)台灣尖端先進生技醫藥股份有限公司濫用藥物檢驗報告1\n      份、法務部調查局鑑定通知書1份。\n    (3)扣案海洛因1小包驗餘淨重0.2公克。\n四、本件經檢察官與被告及辯護人於審判外達成協商之合意，且\n    被告已認罪，其合意內容為：被告願受科刑範圍為施用第1\n    級毒品部分為有期徒刑7 月，施用第2 級毒品部分為有期徒\n    刑5 月，應執行有期徒刑10月。經查上開合意並無刑事訴訟\n    法第455 之4 第1 項所列情形之一，檢察官聲請改依協商程\n    序而為判決，本院爰不經言詞辯論，於協商合意範圍內為協\n    商判決。\n五、應適用之法條：刑事訴訟法第455 之4 第2 項、第455 之8\n    ，毒品危害防制條例第10條第1 、2 項、第18條第1 項前段\n    ，刑法第11條前段、第56條、第51條第5 款。\n六、本判決除有刑事訴訟法第455 之4 第1 項第1 、2 、4 、6\n    、7 款所定情形之一，或違反同條第2 項規定者外，不得上\n    訴。\n七、如不服本判決，得自收受判決送達之日起10日內，向本院提\n    出上訴書狀，上訴於第二審法院。\n中    華    民    國    94    年    6     月    24    日\n                  刑事第九庭    法  官  黃斯偉\n以上正本證明與原本無異。\n                                書記官  李珈慧\n中    華    民    國    94    年    6     月    24    日\n論罪法條之依據：\n毒品危害防制條例第10條\n施用第一級毒品者，處 6 月以上 5 年以下有期徒刑。\n施用第二級毒品者，處 3 年以下有期徒刑。\n毒品危害防制條例第18條\n查獲之第一、二級毒品及專供製造或施用第一、二級毒品之器具\n，不問屬於犯人與否，均沒收銷燬之；查獲之第三、四級毒品及\n製造或施用毒品之器具，無正當理由而擅自持有者，均沒入銷燬\n之。但合於醫藥、研究或訓練之用者，得不予銷燬。\n前項合於醫藥、研究或訓練用毒品或器具之管理辦法，由法務部\n會同行政院衛生署定之。\n",
  "structure": {
  },
  "search": "臺灣桃園地方法院刑事判決94年度訴字第911號公訴人臺灣桃園地方法院檢察署檢察官被告乙○○男22歲.一中隊).指定辯護人本院公設辯護人甲○○上列被告因違反毒品危害防制條例案件，經檢察官提起公訴（94年度毒偵字第1173號）後，聲請改依協商程序而為判決，本院判決如下：主文乙○○連續施用第一級毒品，處有期徒刑柒月，扣案海洛因壹包驗餘淨重零點貳公克沒收銷燬之；又連續施用第二級毒品，處有期徒刑伍月。應執行有期徒刑拾月，扣案海洛因壹包驗餘淨重零點貳公克沒收銷毀之。事實及證據一、乙○○前因施用毒品案件，經本院裁定送觀察、勒戒後，認無繼續施用毒品之傾向，由臺灣桃園地方法院檢察署檢察官於民國91年8月7日，以91年度毒偵1780號為不起訴處分。詎其仍未戒除毒癮，基於施用第1、2級毒品海洛因及安非他命之概括犯意，自94年1月間某日起，在桃園縣八德市○○○街42號住處，施用第1級毒品海洛因及第2級毒品安非他命各2至3次，嗣於94年1月25日14時許，在桃園縣桃園市○○路與長春路口查獲。並扣得第1級毒品海洛因1小包驗餘淨重0.2公克。案經桃園縣政府警察局大園分局報請臺灣桃園地方法院檢察署檢察官偵查起訴。二、證據：(1)被告乙○○於本院訊問中之自白。(2)台灣尖端先進生技醫藥股份有限公司濫用藥物檢驗報告1份、法務部調查局鑑定通知書1份。(3)扣案海洛因1小包驗餘淨重0.2公克。四、本件經檢察官與被告及辯護人於審判外達成協商之合意，且被告已認罪，其合意內容為：被告願受科刑範圍為施用第1級毒品部分為有期徒刑7月，施用第2級毒品部分為有期徒刑5月，應執行有期徒刑10月。經查上開合意並無刑事訴訟法第455之4第1項所列情形之一，檢察官聲請改依協商程序而為判決，本院爰不經言詞辯論，於協商合意範圍內為協商判決。五、應適用之法條：刑事訴訟法第455之4第2項、第455之8，毒品危害防制條例第10條第1、2項、第18條第1項前段，刑法第11條前段、第56條、第51條第5款。六、本判決除有刑事訴訟法第455之4第1項第1、2、4、6、7款所定情形之一，或違反同條第2項規定者外，不得上訴。七、如不服本判決，得自收受判決送達之日起10日內，向本院提出上訴書狀，上訴於第二審法院。中華民國94年6月24日刑事第九庭法官黃斯偉以上正本證明與原本無異。書記官李珈慧中華民國94年6月24日論罪法條之依據：毒品危害防制條例第10條施用第一級毒品者，處6月以上5年以下有期徒刑。施用第二級毒品者，處3年以下有期徒刑。毒品危害防制條例第18條查獲之第一、二級毒品及專供製造或施用第一、二級毒品之器具，不問屬於犯人與否，均沒收銷燬之；查獲之第三、四級毒品及製造或施用毒品之器具，無正當理由而擅自持有者，均沒入銷燬之。但合於醫藥、研究或訓練之用者，得不予銷燬。前項合於醫藥、研究或訓練用毒品或器具之管理辦法，由法務部會同行政院衛生署定之。",
  "characters": {
    "judges": [
      "黃斯偉"
    ],
    "prosecutors": [

    ],
    "lawyers": [

    ],
    "clerks": [
      "李珈慧"
    ],
    "plaintiffs": [

    ],
    "defendants": [
      "乙○○  男  22歲."
    ],
    "prosecutor_office": [
      "臺灣桃園地方法院檢察署檢察官"
    ],
    "creditors": [

    ],
    "debtors": [

    ],
    "judicial_associate_officer": [

    ]
  },
  "adjudged_at": "2005-06-24",
  "created_at": "2016-02-07 05:29:18",
  "updated_at": "2016-02-07 05:29:18"
}