{
  "identify": "CHD-94-交聲-227-20050715-1",
  "court": {
    "name": "臺灣彰化地方法院",
    "code": "CHD"
  },
  "division": {
    "name": "刑事",
    "code": "M"
  },
  "year": 94,
  "word": "交聲",
  "number": "227",
  "jcheck": "1",
  "reason": "聲明異議",
  "content": "臺灣彰化地方法院交通事件裁定         94年度交聲字第227號\n移送機關    交通部公路總局台中區監理所彰化監理站\n異  議  人\n即受處分人  甲○○  女  57歲.\n                    住彰化縣員.\n上列受處分人因違反道路交通管理處罰條例案件，對於交通部公\n路總局台中區監理所彰化監理站94年5月2日彰監四字第裁64-I00\n000000號裁決聲明異議，本院裁定如下：\n    主  文\n異議駁回。\n    理  由\n一、本件異議意旨略以：異議人即受處分人甲○○所持有之小型\n    車駕駛執照因超速違規為移送機關所吊扣，吊扣期間異議人\n    確係無照，如再駕駛汽車，依法應吊銷駕駛執照，然異議人\n    於民國94年4月10日騎乘機車為警查獲，按持有汽車駕駛執\n    照，如騎乘重型機車，仍視為無照駕駛，機車駕駛執照與汽\n    車駕駛執照分屬不同類別之駕駛範圍，是異議人駕駛重型機\n    車無照與汽車駕駛執照吊扣應無必然之關聯性，今遽然接獲\n    被依違反道路交通管理處罰條例第21條第1項第7款吊銷汽車\n    駕駛執照不生訝異，希異議人勿擴張該條之解釋，再異議人\n    因無照駕駛機車已遭吊銷汽車駕駛執照，又被科處罰鍰新台\n    幣（下同）9千元，亦有一罪數罰之嫌，為此提出本件異議\n    ，請求撤銷原處分等語。\n二、按汽車駕駛人，因違反道路交通管處罰條例及道路交通安全\n    規則之規定，受吊扣或吊銷駕駛執照處分時，吊扣或吊銷其\n    持有各級車類之駕駛執照，道路交通管理處罰條例第六十八\n    條定有明文。又汽車駕駛人駕駛執照吊扣期間駕車者，處新\n    台幣6千元以上1萬2千元以下罰鍰，當場禁止騎駕駛及扣留\n    其車輛牌照，並吊銷其駕駛執照，道路交通管理處罰條例第\n    21 條第1項第7款、第4項並規定甚明。\n三、查異議人於民國94年1月17日，因交通違規事件，為移送機\n    關吊扣其普通小客車駕駛執照，吊扣期間至同年4月16日；\n    惟於吊扣期間之94年4月10日11時11分許，異議人因無照騎\n    乘車牌號碼KID-333號重型機車，行經彰化縣員林鎮○○路\n    與靜修路口時為警查獲，隨經移送機關於同年5月2日，以彰\n    監四字第裁64-I00000000號裁決書，裁處異議人罰鍰9千元\n    ，並吊銷其駕駛執照等情，有移送機關汽車駕照基本資料、\n    上揭裁決書及彰化縣警察局舉發違反道路交通管理事件通知\n    單等附卷可稽，且為異議人所是認。按道路交通安全規則第\n    53條雖就汽車駕駛執照區分為小型車、大貨車、大客車、聯\n    結車、輕型機車及重型機車駕駛執照等，並於小型車以上駕\n    駛執照再區分普通及職業部分，惟其係為應我我國車輛分類\n    所為之區分，各類駕駛執照應考資格雖有一同之經歷需求，\n    但其考驗及格，獲准駕車行駛道路之權利則為一致，而有關\n    違反道路交通管理處罰條例第68條規定致須接受吊扣或吊銷\n    駕駛執照處分者，意謂其違規行為對道路交通秩序之維持及\n    道路交通安全已生較大之影響，故前述條例第68條規定吊扣\n    或吊銷其持有各級車類之駕駛執照，以限制其繼續駕車行駛\n    道路之權利，其係屬駕駛行為之限制，並不因所持駕駛執照\n    種類不同而有所差異，故前述條例第68條所指「吊扣或吊銷\n    其持有各級車類之駕駛執照」，係指前述規則第53條分類所\n    指之駕駛執照外，亦包括同規則第61條所准予駕駛較低級車\n    類之駕駛資格（交通部93年8月10日交路字第093000822 7號\n    函釋參照），是汽車駕駛人於受吊扣駕駛執照期間，除吊扣\n    其持有各級車類之駕駛執照外，尚禁止其駕駛較低級車類之\n    駕駛資格。準此，本件異議人於小型車駕駛執照遭吊扣期間\n    ，復無照騎乘重型機車，自已非單純無照駕駛之問題，而係\n    於駕駛執照吊扣期間再行駕車之違規，況參照交通部90年11\n    月28日交路九十字第065987號函釋之內容，亦同此認定，是\n    移送機關援引道路交通管理處罰條例第21條第1項第7款、第\n    4項之規定，對異議人裁罰9千元並吊銷其汽車駕駛執照，依\n    法並無違誤，所處金額亦無不當，從而，本件異議人之異議\n    為無理由，應予駁回。\n四、據上論斷，應依道路交通案件處理辦法第19條，裁定如主文\n    。\n中    華    民    國    94    年    7     月    15    日\n                  交通法庭            法  官  王義閔\n以上正本證明與原本無異\n如不服本裁定，應於裁定送達後5日內，向本院提出抗告狀。\n中    華    民    國    94    年    7     月    15    日\n                                      書記官  詹國立\n",
  "structure": {
    "main": "異議駁回。",
    "reason": "一、本件異議意旨略以：異議人即受處分人甲○○所持有之小型\n    車駕駛執照因超速違規為移送機關所吊扣，吊扣期間異議人\n    確係無照，如再駕駛汽車，依法應吊銷駕駛執照，然異議人\n    於民國94年4月10日騎乘機車為警查獲，按持有汽車駕駛執\n    照，如騎乘重型機車，仍視為無照駕駛，機車駕駛執照與汽\n    車駕駛執照分屬不同類別之駕駛範圍，是異議人駕駛重型機\n    車無照與汽車駕駛執照吊扣應無必然之關聯性，今遽然接獲\n    被依違反道路交通管理處罰條例第21條第1項第7款吊銷汽車\n    駕駛執照不生訝異，希異議人勿擴張該條之解釋，再異議人\n    因無照駕駛機車已遭吊銷汽車駕駛執照，又被科處罰鍰新台\n    幣（下同）9千元，亦有一罪數罰之嫌，為此提出本件異議\n    ，請求撤銷原處分等語。\n二、按汽車駕駛人，因違反道路交通管處罰條例及道路交通安全\n    規則之規定，受吊扣或吊銷駕駛執照處分時，吊扣或吊銷其\n    持有各級車類之駕駛執照，道路交通管理處罰條例第六十八\n    條定有明文。又汽車駕駛人駕駛執照吊扣期間駕車者，處新\n    台幣6千元以上1萬2千元以下罰鍰，當場禁止騎駕駛及扣留\n    其車輛牌照，並吊銷其駕駛執照，道路交通管理處罰條例第\n    21 條第1項第7款、第4項並規定甚明。\n三、查異議人於民國94年1月17日，因交通違規事件，為移送機\n    關吊扣其普通小客車駕駛執照，吊扣期間至同年4月16日；\n    惟於吊扣期間之94年4月10日11時11分許，異議人因無照騎\n    乘車牌號碼KID-333號重型機車，行經彰化縣員林鎮○○路\n    與靜修路口時為警查獲，隨經移送機關於同年5月2日，以彰\n    監四字第裁64-I00000000號裁決書，裁處異議人罰鍰9千元\n    ，並吊銷其駕駛執照等情，有移送機關汽車駕照基本資料、\n    上揭裁決書及彰化縣警察局舉發違反道路交通管理事件通知\n    單等附卷可稽，且為異議人所是認。按道路交通安全規則第\n    53條雖就汽車駕駛執照區分為小型車、大貨車、大客車、聯\n    結車、輕型機車及重型機車駕駛執照等，並於小型車以上駕\n    駛執照再區分普通及職業部分，惟其係為應我我國車輛分類\n    所為之區分，各類駕駛執照應考資格雖有一同之經歷需求，\n    但其考驗及格，獲准駕車行駛道路之權利則為一致，而有關\n    違反道路交通管理處罰條例第68條規定致須接受吊扣或吊銷\n    駕駛執照處分者，意謂其違規行為對道路交通秩序之維持及\n    道路交通安全已生較大之影響，故前述條例第68條規定吊扣\n    或吊銷其持有各級車類之駕駛執照，以限制其繼續駕車行駛\n    道路之權利，其係屬駕駛行為之限制，並不因所持駕駛執照\n    種類不同而有所差異，故前述條例第68條所指「吊扣或吊銷\n    其持有各級車類之駕駛執照」，係指前述規則第53條分類所\n    指之駕駛執照外，亦包括同規則第61條所准予駕駛較低級車\n    類之駕駛資格（交通部93年8月10日交路字第093000822 7號\n    函釋參照），是汽車駕駛人於受吊扣駕駛執照期間，除吊扣\n    其持有各級車類之駕駛執照外，尚禁止其駕駛較低級車類之\n    駕駛資格。準此，本件異議人於小型車駕駛執照遭吊扣期間\n    ，復無照騎乘重型機車，自已非單純無照駕駛之問題，而係\n    於駕駛執照吊扣期間再行駕車之違規，況參照交通部90年11\n    月28日交路九十字第065987號函釋之內容，亦同此認定，是\n    移送機關援引道路交通管理處罰條例第21條第1項第7款、第\n    4項之規定，對異議人裁罰9千元並吊銷其汽車駕駛執照，依\n    法並無違誤，所處金額亦無不當，從而，本件異議人之異議\n    為無理由，應予駁回。\n四、據上論斷，應依道路交通案件處理辦法第19條，裁定如主文\n    。"
  },
  "search": "臺灣彰化地方法院交通事件裁定94年度交聲字第227號移送機關交通部公路總局台中區監理所彰化監理站異議人即受處分人甲○○女57歲.住彰化縣員.上列受處分人因違反道路交通管理處罰條例案件，對於交通部公路總局台中區監理所彰化監理站94年5月2日彰監四字第裁64-I00000000號裁決聲明異議，本院裁定如下：主文異議駁回。理由一、本件異議意旨略以：異議人即受處分人甲○○所持有之小型車駕駛執照因超速違規為移送機關所吊扣，吊扣期間異議人確係無照，如再駕駛汽車，依法應吊銷駕駛執照，然異議人於民國94年4月10日騎乘機車為警查獲，按持有汽車駕駛執照，如騎乘重型機車，仍視為無照駕駛，機車駕駛執照與汽車駕駛執照分屬不同類別之駕駛範圍，是異議人駕駛重型機車無照與汽車駕駛執照吊扣應無必然之關聯性，今遽然接獲被依違反道路交通管理處罰條例第21條第1項第7款吊銷汽車駕駛執照不生訝異，希異議人勿擴張該條之解釋，再異議人因無照駕駛機車已遭吊銷汽車駕駛執照，又被科處罰鍰新台幣（下同）9千元，亦有一罪數罰之嫌，為此提出本件異議，請求撤銷原處分等語。二、按汽車駕駛人，因違反道路交通管處罰條例及道路交通安全規則之規定，受吊扣或吊銷駕駛執照處分時，吊扣或吊銷其持有各級車類之駕駛執照，道路交通管理處罰條例第六十八條定有明文。又汽車駕駛人駕駛執照吊扣期間駕車者，處新台幣6千元以上1萬2千元以下罰鍰，當場禁止騎駕駛及扣留其車輛牌照，並吊銷其駕駛執照，道路交通管理處罰條例第21條第1項第7款、第4項並規定甚明。三、查異議人於民國94年1月17日，因交通違規事件，為移送機關吊扣其普通小客車駕駛執照，吊扣期間至同年4月16日；惟於吊扣期間之94年4月10日11時11分許，異議人因無照騎乘車牌號碼KID-333號重型機車，行經彰化縣員林鎮○○路與靜修路口時為警查獲，隨經移送機關於同年5月2日，以彰監四字第裁64-I00000000號裁決書，裁處異議人罰鍰9千元，並吊銷其駕駛執照等情，有移送機關汽車駕照基本資料、上揭裁決書及彰化縣警察局舉發違反道路交通管理事件通知單等附卷可稽，且為異議人所是認。按道路交通安全規則第53條雖就汽車駕駛執照區分為小型車、大貨車、大客車、聯結車、輕型機車及重型機車駕駛執照等，並於小型車以上駕駛執照再區分普通及職業部分，惟其係為應我我國車輛分類所為之區分，各類駕駛執照應考資格雖有一同之經歷需求，但其考驗及格，獲准駕車行駛道路之權利則為一致，而有關違反道路交通管理處罰條例第68條規定致須接受吊扣或吊銷駕駛執照處分者，意謂其違規行為對道路交通秩序之維持及道路交通安全已生較大之影響，故前述條例第68條規定吊扣或吊銷其持有各級車類之駕駛執照，以限制其繼續駕車行駛道路之權利，其係屬駕駛行為之限制，並不因所持駕駛執照種類不同而有所差異，故前述條例第68條所指「吊扣或吊銷其持有各級車類之駕駛執照」，係指前述規則第53條分類所指之駕駛執照外，亦包括同規則第61條所准予駕駛較低級車類之駕駛資格（交通部93年8月10日交路字第0930008227號函釋參照），是汽車駕駛人於受吊扣駕駛執照期間，除吊扣其持有各級車類之駕駛執照外，尚禁止其駕駛較低級車類之駕駛資格。準此，本件異議人於小型車駕駛執照遭吊扣期間，復無照騎乘重型機車，自已非單純無照駕駛之問題，而係於駕駛執照吊扣期間再行駕車之違規，況參照交通部90年11月28日交路九十字第065987號函釋之內容，亦同此認定，是移送機關援引道路交通管理處罰條例第21條第1項第7款、第4項之規定，對異議人裁罰9千元並吊銷其汽車駕駛執照，依法並無違誤，所處金額亦無不當，從而，本件異議人之異議為無理由，應予駁回。四、據上論斷，應依道路交通案件處理辦法第19條，裁定如主文。中華民國94年7月15日交通法庭法官王義閔以上正本證明與原本無異如不服本裁定，應於裁定送達後5日內，向本院提出抗告狀。中華民國94年7月15日書記官詹國立",
  "characters": {
    "judges": [
      "王義閔"
    ],
    "prosecutors": [

    ],
    "lawyers": [

    ],
    "clerks": [
      "詹國立"
    ],
    "plaintiffs": [

    ],
    "defendants": [

    ],
    "prosecutor_office": [

    ],
    "creditors": [

    ],
    "debtors": [

    ],
    "judicial_associate_officer": [

    ]
  },
  "adjudged_at": "2005-07-15",
  "created_at": "2016-02-07 08:36:18",
  "updated_at": "2016-02-07 08:36:18"
}