{
  "identify": "TCD-94-婚-370-20051003-4",
  "court": {
    "name": "臺灣臺中地方法院",
    "code": "TCD"
  },
  "division": {
    "name": "民事",
    "code": "V"
  },
  "year": 94,
  "word": "婚",
  "number": "370",
  "jcheck": "4",
  "reason": "離婚等",
  "content": "臺灣臺中地方法院民事裁定               94年度婚字第370號\n抗  告  人  乙○○\n即  原  告\n相  對  人  甲○○\n即  被  告\n上列當事人間請求離婚等事件，對於本院民國94年8月19日所\n為裁定，提起抗告，本院裁定如下：\n    主  文\n原裁定撤銷。\n抗告費用由相對人負擔。\n    理  由\n一、抗告意旨略以：本件抗告人於原審起訴狀上載明送達處所為\n    「台中縣霧峰鄉○○路四七一號」，詎原審未察，竟將原審\n    判決送達於抗告人之戶籍地，而不獲會晤後即以寄存送達以\n    為送達，所為送達顯屬不合法，原審既未合法寄存送達，則\n    上訴之二十日不變期間即無從起算。嗣後，原審重新送達判\n    決書，抗告人同居人係於九十四年八月十日始收受原審判決\n    書，則抗告人上訴之二十日不變期間，應自九十四年八月十\n    日之翌日即八月十一日起算至八月三十一日止，從而抗告人\n    於九十四年八月十一日提起第二審上訴並未逾期，自屬合法\n    ，爰依法提起抗告，狀請撤銷原裁定，以保權益等語。\n二、經核本院前依原告戶籍址送達判決書，嗣後發現未依起訴狀\n    所載原告送達處所送達判決書，乃重新送達判決書，原告同\n    居人於九十四年八月十日收受，有送達證書在卷可稽，是以\n    原告之上訴不變期間應自翌日即九十四年八月十一日起算，\n    本院原裁定以其逾期上訴駁回其上訴之裁定，確有不當，原\n    告抗告聲明廢棄原裁定，即難謂無理由，原裁定應予撤銷，\n    並裁定如主文所示。\n三、依民事訴訟法第四百九十條第一項、第九十五條、第七十八\n    條裁定如主文。\n中    華    民    國    94    年    10    月    3     日\n                  家事法庭    法  官  陳學德\n以上正本係照原本作成\n如對本裁定抗告須於裁定送達後十日內向本院提出抗告狀\n中    華    民    國    94    年    10    月    3      日\n                              書記官\n",
  "structure": {
    "main": "原裁定撤銷。\n抗告費用由相對人負擔。",
    "reason": "一、抗告意旨略以：本件抗告人於原審起訴狀上載明送達處所為\n    「台中縣霧峰鄉○○路四七一號」，詎原審未察，竟將原審\n    判決送達於抗告人之戶籍地，而不獲會晤後即以寄存送達以\n    為送達，所為送達顯屬不合法，原審既未合法寄存送達，則\n    上訴之二十日不變期間即無從起算。嗣後，原審重新送達判\n    決書，抗告人同居人係於九十四年八月十日始收受原審判決\n    書，則抗告人上訴之二十日不變期間，應自九十四年八月十\n    日之翌日即八月十一日起算至八月三十一日止，從而抗告人\n    於九十四年八月十一日提起第二審上訴並未逾期，自屬合法\n    ，爰依法提起抗告，狀請撤銷原裁定，以保權益等語。\n二、經核本院前依原告戶籍址送達判決書，嗣後發現未依起訴狀\n    所載原告送達處所送達判決書，乃重新送達判決書，原告同\n    居人於九十四年八月十日收受，有送達證書在卷可稽，是以\n    原告之上訴不變期間應自翌日即九十四年八月十一日起算，\n    本院原裁定以其逾期上訴駁回其上訴之裁定，確有不當，原\n    告抗告聲明廢棄原裁定，即難謂無理由，原裁定應予撤銷，\n    並裁定如主文所示。\n三、依民事訴訟法第四百九十條第一項、第九十五條、第七十八\n    條裁定如主文。"
  },
  "search": "臺灣臺中地方法院民事裁定94年度婚字第370號抗告人乙○○即原告相對人甲○○即被告上列當事人間請求離婚等事件，對於本院民國94年8月19日所為裁定，提起抗告，本院裁定如下：主文原裁定撤銷。抗告費用由相對人負擔。理由一、抗告意旨略以：本件抗告人於原審起訴狀上載明送達處所為「台中縣霧峰鄉○○路四七一號」，詎原審未察，竟將原審判決送達於抗告人之戶籍地，而不獲會晤後即以寄存送達以為送達，所為送達顯屬不合法，原審既未合法寄存送達，則上訴之二十日不變期間即無從起算。嗣後，原審重新送達判決書，抗告人同居人係於九十四年八月十日始收受原審判決書，則抗告人上訴之二十日不變期間，應自九十四年八月十日之翌日即八月十一日起算至八月三十一日止，從而抗告人於九十四年八月十一日提起第二審上訴並未逾期，自屬合法，爰依法提起抗告，狀請撤銷原裁定，以保權益等語。二、經核本院前依原告戶籍址送達判決書，嗣後發現未依起訴狀所載原告送達處所送達判決書，乃重新送達判決書，原告同居人於九十四年八月十日收受，有送達證書在卷可稽，是以原告之上訴不變期間應自翌日即九十四年八月十一日起算，本院原裁定以其逾期上訴駁回其上訴之裁定，確有不當，原告抗告聲明廢棄原裁定，即難謂無理由，原裁定應予撤銷，並裁定如主文所示。三、依民事訴訟法第四百九十條第一項、第九十五條、第七十八條裁定如主文。中華民國94年10月3日家事法庭法官陳學德以上正本係照原本作成如對本裁定抗告須於裁定送達後十日內向本院提出抗告狀中華民國94年10月3日書記官",
  "characters": {
    "judges": [
      "陳學德"
    ],
    "prosecutors": [

    ],
    "lawyers": [

    ],
    "clerks": [

    ],
    "plaintiffs": [
      "相"
    ],
    "defendants": [
      "上列當事人間請求離婚等事件"
    ],
    "prosecutor_office": [

    ],
    "creditors": [

    ],
    "debtors": [

    ],
    "judicial_associate_officer": [

    ]
  },
  "adjudged_at": "2005-10-03",
  "created_at": "2016-02-07 10:20:29",
  "updated_at": "2016-02-07 10:20:29"
}