{
  "identify": "TPD-100-訴-4111-20111103-1",
  "court": {
    "name": "臺灣臺北地方法院",
    "code": "TPD"
  },
  "division": {
    "name": "民事",
    "code": "V"
  },
  "year": 100,
  "word": "訴",
  "number": "4111",
  "jcheck": "1",
  "reason": "確認董事委任關係不存在",
  "content": "臺灣臺北地方法院民事裁定             100年度訴字第4111號\n聲  請  人\n即  原  告  黃極榮\n相  對  人\n即  被  告  鈺傑企業管理顧問股份有限公司\n特別代理人  李華楓\n上列當事人間請求確認董事委任關係不存在事件，原告聲請選任\n被告鈺傑企業管理顧問股份有限公司特別代理人，本院裁定如下\n：\n    主  文\n選任李華楓（身分證統一編號：Ｚ000000000號）於本\n院一百年度訴字第四一一一號確認董事委任關係不存在事件，為\n被告鈺傑企業管理顧問股份有限公司之特別代理人。\n    理  由\n一、按對於無訴訟能力人為訴訟行為，因其無法定代理人，或其\n    法定代理人不能行使代理權，恐致久延而受損害者，得聲請\n    受訴法院之審判長選任特別代理人，民事訴訟法第51 條第1\n    項定有明文。\n二、查聲請人起訴請求確認其與相對人鈺傑企業管理顧問股份有\n    限公司（下稱鈺傑公司）間之董事委任關係不存在，惟因聲\n    請人現仍登記為鈺傑公司之董事，有相對人鈺傑公司之公司\n    變更登記事項卡在卷足稽，故聲請人與鈺傑公司間之訴訟，\n    依公司法第213 條規定，本應由監察人代表公司。然鈺傑公\n    司之監察人原為李華楓，其係由鈺傑公司之法人股東中央租\n    賃股份有限公司（下稱中央租賃公司）所指派，惟李華楓已\n    於民國97年3 月10日發函辭任監察人，迄至鈺傑公司因開始\n    營業後自行停止營業6 個月以上，經主管機關即臺北市政府\n    於98年6 月11日命令解散時止，中央租賃公司均未改派新任\n    監察人，業經本院調閱鈺傑公司之登記案卷確認無誤。\n三、從而，相對人鈺傑公司現無法定代理人即監察人可行使代理\n    權，依首揭說明，自有就本件訴訟為鈺傑公司選任特別代理\n    人之必要。聲請人雖建議選任陳田鈺或李華楓為相對人之特\n    別代理人，惟本院審酌陳田鈺前為相對人鈺傑公司之董事長\n    ，與聲請人同為公司董事，如以其為本件訴訟相對人之特別\n    代理人，實有違公司法第213 條避免董事長代表公司應訴而\n    有循私之舉之規範意旨。而李華楓原為鈺傑公司之監察人，\n    目前亦為鈺傑公司之唯一股東中央租賃公司之清算人，有本\n    院99年度司字第83號裁定附卷可佐，其對相對人鈺傑公司之\n    事務應有相當暸解，本件訴訟由其擔任特別代理人，堪認允\n    當，爰選任李華楓於本件聲請人與相對人鈺傑公司間確認董\n    事委任關係不存在事件，為相對人鈺傑公司之特別代理人。\n四、依民事訴訟法第51條第1項，裁定如主文。\n中    華    民    國   100    年    11    月    3     日\n                  民事第五庭    法  官  陳蒨儀\n以上正本係照原本作成。\n本裁定不得抗告。\n中    華    民    國   100    年    11    月    3     日\n                                書記官  吳貞瑩",
  "structure": {
    "main": "選任李華楓（身分證統一編號：Ｚ000000000號）於本\n院一百年度訴字第四一一一號確認董事委任關係不存在事件，為\n被告鈺傑企業管理顧問股份有限公司之特別代理人。",
    "reason": "一、按對於無訴訟能力人為訴訟行為，因其無法定代理人，或其\n    法定代理人不能行使代理權，恐致久延而受損害者，得聲請\n    受訴法院之審判長選任特別代理人，民事訴訟法第51 條第1\n    項定有明文。\n二、查聲請人起訴請求確認其與相對人鈺傑企業管理顧問股份有\n    限公司（下稱鈺傑公司）間之董事委任關係不存在，惟因聲\n    請人現仍登記為鈺傑公司之董事，有相對人鈺傑公司之公司\n    變更登記事項卡在卷足稽，故聲請人與鈺傑公司間之訴訟，\n    依公司法第213 條規定，本應由監察人代表公司。然鈺傑公\n    司之監察人原為李華楓，其係由鈺傑公司之法人股東中央租\n    賃股份有限公司（下稱中央租賃公司）所指派，惟李華楓已\n    於民國97年3 月10日發函辭任監察人，迄至鈺傑公司因開始\n    營業後自行停止營業6 個月以上，經主管機關即臺北市政府\n    於98年6 月11日命令解散時止，中央租賃公司均未改派新任\n    監察人，業經本院調閱鈺傑公司之登記案卷確認無誤。\n三、從而，相對人鈺傑公司現無法定代理人即監察人可行使代理\n    權，依首揭說明，自有就本件訴訟為鈺傑公司選任特別代理\n    人之必要。聲請人雖建議選任陳田鈺或李華楓為相對人之特\n    別代理人，惟本院審酌陳田鈺前為相對人鈺傑公司之董事長\n    ，與聲請人同為公司董事，如以其為本件訴訟相對人之特別\n    代理人，實有違公司法第213 條避免董事長代表公司應訴而\n    有循私之舉之規範意旨。而李華楓原為鈺傑公司之監察人，\n    目前亦為鈺傑公司之唯一股東中央租賃公司之清算人，有本\n    院99年度司字第83號裁定附卷可佐，其對相對人鈺傑公司之\n    事務應有相當暸解，本件訴訟由其擔任特別代理人，堪認允\n    當，爰選任李華楓於本件聲請人與相對人鈺傑公司間確認董\n    事委任關係不存在事件，為相對人鈺傑公司之特別代理人。\n四、依民事訴訟法第51條第1項，裁定如主文。"
  },
  "search": "臺灣臺北地方法院民事裁定100年度訴字第4111號聲請人即原告黃極榮相對人即被告鈺傑企業管理顧問股份有限公司特別代理人李華楓上列當事人間請求確認董事委任關係不存在事件，原告聲請選任被告鈺傑企業管理顧問股份有限公司特別代理人，本院裁定如下：主文選任李華楓（身分證統一編號：Ｚ000000000號）於本院一百年度訴字第四一一一號確認董事委任關係不存在事件，為被告鈺傑企業管理顧問股份有限公司之特別代理人。理由一、按對於無訴訟能力人為訴訟行為，因其無法定代理人，或其法定代理人不能行使代理權，恐致久延而受損害者，得聲請受訴法院之審判長選任特別代理人，民事訴訟法第51條第1項定有明文。二、查聲請人起訴請求確認其與相對人鈺傑企業管理顧問股份有限公司（下稱鈺傑公司）間之董事委任關係不存在，惟因聲請人現仍登記為鈺傑公司之董事，有相對人鈺傑公司之公司變更登記事項卡在卷足稽，故聲請人與鈺傑公司間之訴訟，依公司法第213條規定，本應由監察人代表公司。然鈺傑公司之監察人原為李華楓，其係由鈺傑公司之法人股東中央租賃股份有限公司（下稱中央租賃公司）所指派，惟李華楓已於民國97年3月10日發函辭任監察人，迄至鈺傑公司因開始營業後自行停止營業6個月以上，經主管機關即臺北市政府於98年6月11日命令解散時止，中央租賃公司均未改派新任監察人，業經本院調閱鈺傑公司之登記案卷確認無誤。三、從而，相對人鈺傑公司現無法定代理人即監察人可行使代理權，依首揭說明，自有就本件訴訟為鈺傑公司選任特別代理人之必要。聲請人雖建議選任陳田鈺或李華楓為相對人之特別代理人，惟本院審酌陳田鈺前為相對人鈺傑公司之董事長，與聲請人同為公司董事，如以其為本件訴訟相對人之特別代理人，實有違公司法第213條避免董事長代表公司應訴而有循私之舉之規範意旨。而李華楓原為鈺傑公司之監察人，目前亦為鈺傑公司之唯一股東中央租賃公司之清算人，有本院99年度司字第83號裁定附卷可佐，其對相對人鈺傑公司之事務應有相當暸解，本件訴訟由其擔任特別代理人，堪認允當，爰選任李華楓於本件聲請人與相對人鈺傑公司間確認董事委任關係不存在事件，為相對人鈺傑公司之特別代理人。四、依民事訴訟法第51條第1項，裁定如主文。中華民國100年11月3日民事第五庭法官陳蒨儀以上正本係照原本作成。本裁定不得抗告。中華民國100年11月3日書記官吳貞瑩",
  "characters": {
    "judges": [
      "陳蒨儀"
    ],
    "prosecutors": [

    ],
    "lawyers": [

    ],
    "clerks": [

    ],
    "plaintiffs": [
      "黃極榮"
    ],
    "defendants": [
      "鈺傑企業管理顧問股份有限公司"
    ],
    "prosecutor_office": [

    ],
    "creditors": [

    ],
    "debtors": [

    ],
    "judicial_associate_officer": [

    ]
  },
  "adjudged_at": "2011-11-03",
  "created_at": "2016-02-13 00:07:39",
  "updated_at": "2016-02-13 00:07:39"
}