{
  "identify": "TCD-94-交聲-290-20050804-2",
  "court": {
    "name": "臺灣臺中地方法院",
    "code": "TCD"
  },
  "division": {
    "name": "刑事",
    "code": "M"
  },
  "year": 94,
  "word": "交聲",
  "number": "290",
  "jcheck": "2",
  "reason": "聲明異議",
  "content": "臺灣臺中地方法院交通事件裁定         94年度交聲字第290號\n    原處分機關  交通部公路總局台中區監理所\n    受處分人    歐美雅企業有限公司\n    代 表 人    黃作光\n上列受處分人因聲明異議案件，本院於94年6月30日所為之裁定\n之原本及其正本，茲發現有誤，應裁定更正如下：\n    主  文\n原裁定之原本及其正本標題原載之「治安法庭裁定」更正為「交\n通事件裁定」。\n    理  由\n一、按刑事裁定文字，顯係誤寫，而不影響於全案情節與裁定之\n    本旨者，參照民事訴訟法第二百三十二條、第二百三十九條\n    規定，原審法院得以裁定更正之。業經司法院大法官會議釋\n    字第四三號解釋在案；另交通聲明異議案件之處理，準用刑\n    事訴訟法有關規定，道路交通案件處理辦法第四條前段定有\n    明文。\n二、本件原裁定之原本及其正本標題有如主文所示之顯然錯誤，\n    自應予更正。\n三、爰依刑事訴訟法第二百二十條裁定如主文。\n中    華    民    國    94    年    8     月    4     日\n                 臺灣臺中地方法院交通法庭\n                       法  官 王靜秋\n上正本證明與原本無異。\n如不服本裁定，應於送達後五日內，向本院提出抗告狀。\n中    華    民    國    94    年    8     月    4     日\n                        書記官  林淑慧\n",
  "structure": {
    "main": "原裁定之原本及其正本標題原載之「治安法庭裁定」更正為「交\n通事件裁定」。",
    "reason": "一、按刑事裁定文字，顯係誤寫，而不影響於全案情節與裁定之\n    本旨者，參照民事訴訟法第二百三十二條、第二百三十九條\n    規定，原審法院得以裁定更正之。業經司法院大法官會議釋\n    字第四三號解釋在案；另交通聲明異議案件之處理，準用刑\n    事訴訟法有關規定，道路交通案件處理辦法第四條前段定有\n    明文。\n二、本件原裁定之原本及其正本標題有如主文所示之顯然錯誤，\n    自應予更正。\n三、爰依刑事訴訟法第二百二十條裁定如主文。"
  },
  "search": "臺灣臺中地方法院交通事件裁定94年度交聲字第290號原處分機關交通部公路總局台中區監理所受處分人歐美雅企業有限公司代表人黃作光上列受處分人因聲明異議案件，本院於94年6月30日所為之裁定之原本及其正本，茲發現有誤，應裁定更正如下：主文原裁定之原本及其正本標題原載之「治安法庭裁定」更正為「交通事件裁定」。理由一、按刑事裁定文字，顯係誤寫，而不影響於全案情節與裁定之本旨者，參照民事訴訟法第二百三十二條、第二百三十九條規定，原審法院得以裁定更正之。業經司法院大法官會議釋字第四三號解釋在案；另交通聲明異議案件之處理，準用刑事訴訟法有關規定，道路交通案件處理辦法第四條前段定有明文。二、本件原裁定之原本及其正本標題有如主文所示之顯然錯誤，自應予更正。三、爰依刑事訴訟法第二百二十條裁定如主文。中華民國94年8月4日臺灣臺中地方法院交通法庭法官王靜秋上正本證明與原本無異。如不服本裁定，應於送達後五日內，向本院提出抗告狀。中華民國94年8月4日書記官林淑慧",
  "characters": {
    "judges": [
      "王靜秋"
    ],
    "prosecutors": [

    ],
    "lawyers": [

    ],
    "clerks": [
      "林淑慧"
    ],
    "plaintiffs": [

    ],
    "defendants": [

    ],
    "prosecutor_office": [

    ],
    "creditors": [

    ],
    "debtors": [

    ],
    "judicial_associate_officer": [

    ]
  },
  "adjudged_at": "2005-08-04",
  "created_at": "2016-02-06 22:24:54",
  "updated_at": "2016-02-06 22:24:54"
}