{
  "identify": "TND-100-撤緩-69-20110714-2",
  "court": {
    "name": "臺灣臺南地方法院",
    "code": "TND"
  },
  "division": {
    "name": "刑事",
    "code": "M"
  },
  "year": 100,
  "word": "撤緩",
  "number": "69",
  "jcheck": "2",
  "reason": "撤銷緩刑",
  "content": "臺灣臺南地方法院刑事裁定             100年度撤緩字第69號\n聲  請  人  臺灣臺南地方法院檢察署檢察官\n受  刑  人  林慧真\n上列受刑人因撤銷緩刑案件，本院於民國100年6月30日所為之裁\n定原本及其正本，茲發現有誤，應更正如下：\n    主  文\n原裁定原本及其正本理由欄三、(一)第一列之「本件受刑人前因施\n用毒品案件」應更正為「本件受刑人前因侵占案件」。\n    理  由\n一、按刑事判決文字，顯係誤寫，而不影響於全案情節與判決之\n    本旨者，參照民事訴訟法第232條規定，原審法院得以裁定\n    更正之，業經大法官會議釋字第43號解釋在案。又民事訴訟\n    法第232條第1項係規定：「判決如有誤寫、誤算或其他類此\n    之顯然錯誤者，法院得依聲請或依職權以裁定更正」。\n二、本件原裁定原本及其正本理由欄三、(一)第一列之「本件受刑\n    人前因施用毒品案件」之記載，有如主文所示之顯然錯誤，\n    惟因不影響於全案情節與判決本旨，茲參照前開說明，更正\n    如主文所示。\n三、依刑事訴訟法第220條，裁定如主文。\n中    華    民    國   100    年    7     月    14    日\n                  刑事第十二庭  法  官  盧鳳田\n以上正本證明與原本無異。\n如不服本裁定，應於收受送達後5日內向本院提出抗告狀。（應\n附繕本）\n                                書記官  黃憶筑\n中    華    民    國   100    年    7     月    14    日",
  "structure": {
    "main": "原裁定原本及其正本理由欄三、(一)第一列之「本件受刑人前因施\n用毒品案件」應更正為「本件受刑人前因侵占案件」。",
    "reason": "一、按刑事判決文字，顯係誤寫，而不影響於全案情節與判決之\n    本旨者，參照民事訴訟法第232條規定，原審法院得以裁定\n    更正之，業經大法官會議釋字第43號解釋在案。又民事訴訟\n    法第232條第1項係規定：「判決如有誤寫、誤算或其他類此\n    之顯然錯誤者，法院得依聲請或依職權以裁定更正」。\n二、本件原裁定原本及其正本理由欄三、(一)第一列之「本件受刑\n    人前因施用毒品案件」之記載，有如主文所示之顯然錯誤，\n    惟因不影響於全案情節與判決本旨，茲參照前開說明，更正\n    如主文所示。\n三、依刑事訴訟法第220條，裁定如主文。"
  },
  "search": "臺灣臺南地方法院刑事裁定100年度撤緩字第69號聲請人臺灣臺南地方法院檢察署檢察官受刑人林慧真上列受刑人因撤銷緩刑案件，本院於民國100年6月30日所為之裁定原本及其正本，茲發現有誤，應更正如下：主文原裁定原本及其正本理由欄三、(一)第一列之「本件受刑人前因施用毒品案件」應更正為「本件受刑人前因侵占案件」。理由一、按刑事判決文字，顯係誤寫，而不影響於全案情節與判決之本旨者，參照民事訴訟法第232條規定，原審法院得以裁定更正之，業經大法官會議釋字第43號解釋在案。又民事訴訟法第232條第1項係規定：「判決如有誤寫、誤算或其他類此之顯然錯誤者，法院得依聲請或依職權以裁定更正」。二、本件原裁定原本及其正本理由欄三、(一)第一列之「本件受刑人前因施用毒品案件」之記載，有如主文所示之顯然錯誤，惟因不影響於全案情節與判決本旨，茲參照前開說明，更正如主文所示。三、依刑事訴訟法第220條，裁定如主文。中華民國100年7月14日刑事第十二庭法官盧鳳田以上正本證明與原本無異。如不服本裁定，應於收受送達後5日內向本院提出抗告狀。（應附繕本）書記官黃憶筑中華民國100年7月14日",
  "characters": {
    "judges": [
      "盧鳳田"
    ],
    "prosecutors": [

    ],
    "lawyers": [

    ],
    "clerks": [
      "黃憶筑"
    ],
    "plaintiffs": [

    ],
    "defendants": [

    ],
    "prosecutor_office": [
      "臺灣臺南地方法院檢察署檢察官"
    ],
    "creditors": [

    ],
    "debtors": [

    ],
    "judicial_associate_officer": [

    ]
  },
  "adjudged_at": "2011-07-14",
  "created_at": "2016-02-14 00:39:33",
  "updated_at": "2016-02-14 00:39:33"
}