{
  "identify": "TPD-100-家聲-591-20110715-1",
  "court": {
    "name": "臺灣臺北地方法院",
    "code": "TPD"
  },
  "division": {
    "name": "民事",
    "code": "V"
  },
  "year": 100,
  "word": "家聲",
  "number": "591",
  "jcheck": "1",
  "reason": "閱卷",
  "content": "臺灣臺北地方法院民事裁定            100年度家聲字第591號\n聲  請  人  國泰世華商業銀行股份有限公司\n法定代理人  汪國華\n代  理  人  王秀蘭\n上列聲請人聲請閱覽被繼承人張贊池死亡後，其繼承人聲請繼承\n之事件卷宗，本院裁定如下：\n    主  文\n准許聲請人閱覽本院96年度繼字第158 號民事聲請事件卷內文書\n。\n    理  由\n一、按「當事人得向法院書記官聲請閱覽、抄錄或攝影卷內文書\n    ，或預納費用聲請付與繕本、影本或節本」、「第三人經當\n    事人同意或釋明有法律上之利害關係，而為前項之聲請者，\n    應經法院裁定許可」，民事訴訟法第242 條第1項、第2項分\n    別定有明文。\n二、查本件聲請意旨略以：聲請人為被繼承人張贊池之債權人，\n    因被繼承人死亡，茲聲請人為明瞭被繼承人張贊池之繼承人\n    其聲請繼承之情形，爰為本件聲請等語。\n三、經查，聲請人就其乃被繼承人張贊池之債權人乙節，據其提\n    出支付命令聲請狀、本院支付命令與委任書為證，堪認聲請\n    人已盡釋明與前揭事件之法律上利害關係之能事。是參酌前\n    述說明，聲請人所為本件聲請，於法有據，應可准許。\n四、又本件聲請人既為前揭事件之第三人，則其閱卷規則，亦應\n    參酌民事訴訟法第242條第6項之規定為之，合此說明。\n中    華    民    國    100    年    7    月    15    日\n                  家事法庭法  官   郭淑貞\n以上正本證明與原本無異。\n本件不得抗告。\n中    華    民    國    100    年    7    月    15    日\n                          書記官   張詠忻",
  "structure": {
    "main": "准許聲請人閱覽本院96年度繼字第158 號民事聲請事件卷內文書\n。",
    "reason": "一、按「當事人得向法院書記官聲請閱覽、抄錄或攝影卷內文書\n    ，或預納費用聲請付與繕本、影本或節本」、「第三人經當\n    事人同意或釋明有法律上之利害關係，而為前項之聲請者，\n    應經法院裁定許可」，民事訴訟法第242 條第1項、第2項分\n    別定有明文。\n二、查本件聲請意旨略以：聲請人為被繼承人張贊池之債權人，\n    因被繼承人死亡，茲聲請人為明瞭被繼承人張贊池之繼承人\n    其聲請繼承之情形，爰為本件聲請等語。\n三、經查，聲請人就其乃被繼承人張贊池之債權人乙節，據其提\n    出支付命令聲請狀、本院支付命令與委任書為證，堪認聲請\n    人已盡釋明與前揭事件之法律上利害關係之能事。是參酌前\n    述說明，聲請人所為本件聲請，於法有據，應可准許。\n四、又本件聲請人既為前揭事件之第三人，則其閱卷規則，亦應\n    參酌民事訴訟法第242條第6項之規定為之，合此說明。"
  },
  "search": "臺灣臺北地方法院民事裁定100年度家聲字第591號聲請人國泰世華商業銀行股份有限公司法定代理人汪國華代理人王秀蘭上列聲請人聲請閱覽被繼承人張贊池死亡後，其繼承人聲請繼承之事件卷宗，本院裁定如下：主文准許聲請人閱覽本院96年度繼字第158號民事聲請事件卷內文書。理由一、按「當事人得向法院書記官聲請閱覽、抄錄或攝影卷內文書，或預納費用聲請付與繕本、影本或節本」、「第三人經當事人同意或釋明有法律上之利害關係，而為前項之聲請者，應經法院裁定許可」，民事訴訟法第242條第1項、第2項分別定有明文。二、查本件聲請意旨略以：聲請人為被繼承人張贊池之債權人，因被繼承人死亡，茲聲請人為明瞭被繼承人張贊池之繼承人其聲請繼承之情形，爰為本件聲請等語。三、經查，聲請人就其乃被繼承人張贊池之債權人乙節，據其提出支付命令聲請狀、本院支付命令與委任書為證，堪認聲請人已盡釋明與前揭事件之法律上利害關係之能事。是參酌前述說明，聲請人所為本件聲請，於法有據，應可准許。四、又本件聲請人既為前揭事件之第三人，則其閱卷規則，亦應參酌民事訴訟法第242條第6項之規定為之，合此說明。中華民國100年7月15日家事法庭法官郭淑貞以上正本證明與原本無異。本件不得抗告。中華民國100年7月15日書記官張詠忻",
  "characters": {
    "judges": [
      "郭淑貞"
    ],
    "prosecutors": [

    ],
    "lawyers": [

    ],
    "clerks": [

    ],
    "plaintiffs": [

    ],
    "defendants": [

    ],
    "prosecutor_office": [
      "國泰世華商業銀行股份有限公司"
    ],
    "creditors": [

    ],
    "debtors": [

    ],
    "judicial_associate_officer": [

    ]
  },
  "adjudged_at": "2011-07-15",
  "created_at": "2016-02-14 00:18:37",
  "updated_at": "2016-02-14 00:18:37"
}