{
  "identify": "TND-100-司繼-1442-20110908-1",
  "court": {
    "name": "臺灣臺南地方法院",
    "code": "TND"
  },
  "division": {
    "name": "民事",
    "code": "V"
  },
  "year": 100,
  "word": "司繼",
  "number": "1442",
  "jcheck": "1",
  "reason": "拋棄繼承",
  "content": "臺灣臺南地方法院民事裁定           100年度司繼字第1442號\n聲  明  人  毛竣榆\n            毛翊哲\n            毛靜雯\n上三人共同\n法定代理人  毛海瑞\n            陳麗妃\n上聲明人聲明拋棄繼承事件，本院裁定如下：\n   主  文\n聲明駁回。\n聲明程序費用由聲明人負擔。\n   理  由\n一、按繼承權人始得拋棄繼承權，無繼承權之人，自無拋棄繼承\n    權之必要，此參民法繼承篇有關拋棄繼承之規定自明。而遺\n    產繼承人，除配偶外，依左列順序定之：一、直系血親卑親\n    屬，二、父母，三、兄弟姊妹，四、祖父母，為民法第1138\n    條所明定；次按民法第1138條所定第一順位之繼承人，以親\n    等近者為先，為民法第1139條定有明文。\n二、本件聲明狀意旨略以：被繼承人陳登發(男，民國○○年○月○○\n    日生，身分證統一編號：Ｚ000000000，生前最後住所：臺南\n    市新市區大社里34鄰大社525號)，於100年6月7日死亡，聲\n    明人毛竣榆、毛翊哲、毛靜雯為被繼承人之孫子女，檢具相\n    關文件，具狀聲明拋棄繼承云云。\n三、經查，聲明人毛竣榆、毛翊哲、毛靜雯為被繼承人陳登發之\n    孫子女，有聲明人提出之繼承系統表、戶籍謄本為證，惟被\n    繼承人尚存第1順位繼承人即被繼承人子女張秀琴、張獻文\n    、陳玉民、代位繼承人郭智信並未拋棄繼承，其中張秀琴並\n    已向法院陳報遺產清冊，有本院索引卡1件附卷可稽，並經\n    本院依職權調閱100年度司繼字第1793號陳報遺產清冊案件\n    ，查核屬實，堪以認定。既如上述，聲明人毛竣榆、毛翊哲\n    、毛靜雯尚無繼承被繼承人陳登發遺產之權，自無拋棄繼承\n    權之必要。從而，本件聲明，於法不合，應予駁回。\n四、依非訟事件法第21條第1項前段、第23條、第24條第1項，裁\n    定如主文。\n中    華    民    國   100    年    9     月    8     日\n                  家事法庭    司法事務官  林可婷\n以上正本係照原本作成。\n如對本裁定抗告須於裁定送達後10日內向本院提出抗告狀，並應\n繳納抗告費新臺幣1,000元整。\n中    華    民    國   100    年    9     月    9     日\n                              書  記  官  郭春慧",
  "structure": {
    "main": "聲明駁回。\n聲明程序費用由聲明人負擔。",
    "reason": "一、按繼承權人始得拋棄繼承權，無繼承權之人，自無拋棄繼承\n    權之必要，此參民法繼承篇有關拋棄繼承之規定自明。而遺\n    產繼承人，除配偶外，依左列順序定之：一、直系血親卑親\n    屬，二、父母，三、兄弟姊妹，四、祖父母，為民法第1138\n    條所明定；次按民法第1138條所定第一順位之繼承人，以親\n    等近者為先，為民法第1139條定有明文。\n二、本件聲明狀意旨略以：被繼承人陳登發(男，民國○○年○月○○\n    日生，身分證統一編號：Ｚ000000000，生前最後住所：臺南\n    市新市區大社里34鄰大社525號)，於100年6月7日死亡，聲\n    明人毛竣榆、毛翊哲、毛靜雯為被繼承人之孫子女，檢具相\n    關文件，具狀聲明拋棄繼承云云。\n三、經查，聲明人毛竣榆、毛翊哲、毛靜雯為被繼承人陳登發之\n    孫子女，有聲明人提出之繼承系統表、戶籍謄本為證，惟被\n    繼承人尚存第1順位繼承人即被繼承人子女張秀琴、張獻文\n    、陳玉民、代位繼承人郭智信並未拋棄繼承，其中張秀琴並\n    已向法院陳報遺產清冊，有本院索引卡1件附卷可稽，並經\n    本院依職權調閱100年度司繼字第1793號陳報遺產清冊案件\n    ，查核屬實，堪以認定。既如上述，聲明人毛竣榆、毛翊哲\n    、毛靜雯尚無繼承被繼承人陳登發遺產之權，自無拋棄繼承\n    權之必要。從而，本件聲明，於法不合，應予駁回。\n四、依非訟事件法第21條第1項前段、第23條、第24條第1項，裁\n    定如主文。"
  },
  "search": "臺灣臺南地方法院民事裁定100年度司繼字第1442號聲明人毛竣榆毛翊哲毛靜雯上三人共同法定代理人毛海瑞陳麗妃上聲明人聲明拋棄繼承事件，本院裁定如下：主文聲明駁回。聲明程序費用由聲明人負擔。理由一、按繼承權人始得拋棄繼承權，無繼承權之人，自無拋棄繼承權之必要，此參民法繼承篇有關拋棄繼承之規定自明。而遺產繼承人，除配偶外，依左列順序定之：一、直系血親卑親屬，二、父母，三、兄弟姊妹，四、祖父母，為民法第1138條所明定；次按民法第1138條所定第一順位之繼承人，以親等近者為先，為民法第1139條定有明文。二、本件聲明狀意旨略以：被繼承人陳登發(男，民國○○年○月○○日生，身分證統一編號：Ｚ000000000，生前最後住所：臺南市新市區大社里34鄰大社525號)，於100年6月7日死亡，聲明人毛竣榆、毛翊哲、毛靜雯為被繼承人之孫子女，檢具相關文件，具狀聲明拋棄繼承云云。三、經查，聲明人毛竣榆、毛翊哲、毛靜雯為被繼承人陳登發之孫子女，有聲明人提出之繼承系統表、戶籍謄本為證，惟被繼承人尚存第1順位繼承人即被繼承人子女張秀琴、張獻文、陳玉民、代位繼承人郭智信並未拋棄繼承，其中張秀琴並已向法院陳報遺產清冊，有本院索引卡1件附卷可稽，並經本院依職權調閱100年度司繼字第1793號陳報遺產清冊案件，查核屬實，堪以認定。既如上述，聲明人毛竣榆、毛翊哲、毛靜雯尚無繼承被繼承人陳登發遺產之權，自無拋棄繼承權之必要。從而，本件聲明，於法不合，應予駁回。四、依非訟事件法第21條第1項前段、第23條、第24條第1項，裁定如主文。中華民國100年9月8日家事法庭司法事務官林可婷以上正本係照原本作成。如對本裁定抗告須於裁定送達後10日內向本院提出抗告狀，並應繳納抗告費新臺幣1,000元整。中華民國100年9月9日書記官郭春慧",
  "characters": {
    "judges": [

    ],
    "prosecutors": [

    ],
    "lawyers": [

    ],
    "clerks": [

    ],
    "plaintiffs": [

    ],
    "defendants": [

    ],
    "prosecutor_office": [

    ],
    "creditors": [

    ],
    "debtors": [

    ],
    "judicial_associate_officer": [
      "林可婷"
    ]
  },
  "adjudged_at": "2011-09-08",
  "created_at": "2016-02-12 13:16:45",
  "updated_at": "2016-02-12 13:16:45"
}