{
  "identify": "KSD-100-司促-28747-20110708-1",
  "court": {
    "name": "臺灣高雄地方法院",
    "code": "KSD"
  },
  "division": {
    "name": "民事",
    "code": "V"
  },
  "year": 100,
  "word": "司促",
  "number": "28747",
  "jcheck": "1",
  "reason": "支付命令",
  "content": "臺灣高雄地方法院支付命令          100年度司促字第28747號\n債  權  人  亞太電信股份有限公司\n法定代理人  邱純枝\n債  務  人  張家琪\n法定代理人  丁正\n兼法定代理  張鴻哲\n人\n一、債務人應向債權人連帶清償新臺幣壹萬貳仟肆佰肆拾壹元，\n    及其中新臺幣壹萬零貳佰玖拾肆元，自支付命令送達之翌日\n    起至清償日止，按週年利率百分之五計算之利息，並連帶賠\n    償督促程序費用新臺幣伍佰元，否則應於本命令送達後二十\n    日之不變期間內，向本院提出異議。\n二、債權人請求之原因事實：\n    相對人張家琪向聲請人申請電信服務使用代表門號00000000\n    00,經法定代理人張鴻哲同意於申請書上簽章,並表示相對人\n    如積欠申請人任何費用時,願負連帶清償責任。現累積多期\n    帳款未繳已違反契約相關規定,幾經催討仍未獲清償,迄今尚\n    有電信費10,294元,專案補償款2,117元,共計新臺幣12,411\n    元未作繳納，相對人張家琪與張鴻哲須負連帶清償責任。\n三、如債務人未於第一項期間內提出異議，本命令與確定判決有\n    同一效力。\n中    華    民    國   100    年    7     月    8     日\n                        民事庭司法事務官  周士翔\n附註：\n一、案件一經確定本院即依職權核發確定證明書，債權人毋庸具\n    狀申請。\n二、嗣後遞狀應註明案號及股別。",
  "structure": {
  },
  "search": "臺灣高雄地方法院支付命令100年度司促字第28747號債權人亞太電信股份有限公司法定代理人邱純枝債務人張家琪法定代理人丁正兼法定代理張鴻哲人一、債務人應向債權人連帶清償新臺幣壹萬貳仟肆佰肆拾壹元，及其中新臺幣壹萬零貳佰玖拾肆元，自支付命令送達之翌日起至清償日止，按週年利率百分之五計算之利息，並連帶賠償督促程序費用新臺幣伍佰元，否則應於本命令送達後二十日之不變期間內，向本院提出異議。二、債權人請求之原因事實：相對人張家琪向聲請人申請電信服務使用代表門號0000000000,經法定代理人張鴻哲同意於申請書上簽章,並表示相對人如積欠申請人任何費用時,願負連帶清償責任。現累積多期帳款未繳已違反契約相關規定,幾經催討仍未獲清償,迄今尚有電信費10,294元,專案補償款2,117元,共計新臺幣12,411元未作繳納，相對人張家琪與張鴻哲須負連帶清償責任。三、如債務人未於第一項期間內提出異議，本命令與確定判決有同一效力。中華民國100年7月8日民事庭司法事務官周士翔附註：一、案件一經確定本院即依職權核發確定證明書，債權人毋庸具狀申請。二、嗣後遞狀應註明案號及股別。",
  "characters": {
    "judges": [

    ],
    "prosecutors": [

    ],
    "lawyers": [

    ],
    "clerks": [

    ],
    "plaintiffs": [

    ],
    "defendants": [

    ],
    "prosecutor_office": [

    ],
    "creditors": [
      "亞太電信股份有限公司"
    ],
    "debtors": [
      "張家琪"
    ],
    "judicial_associate_officer": [
      "周士翔"
    ]
  },
  "adjudged_at": "2011-07-08",
  "created_at": "2016-02-14 01:32:12",
  "updated_at": "2016-02-14 01:32:12"
}