{
  "identify": "TPD-99-消債清-97-20110411-1",
  "court": {
    "name": "臺灣臺北地方法院",
    "code": "TPD"
  },
  "division": {
    "name": "民事",
    "code": "V"
  },
  "year": 99,
  "word": "消債清",
  "number": "97",
  "jcheck": "1",
  "reason": "清算事件",
  "content": "臺灣臺北地方法院民事裁定            99年度消債清字第97號\n聲  請  人\n即 債務 人  劉力榮\n上列當事人聲請消費者債務清算事件，本院裁定如下：\n    主  文\n聲請人應於本裁定送達後七日內，補提如附件所示資料到院，逾\n期未補正，則駁回其清算之聲請。\n    理  由\n一、按聲請更生或清算不合程式或不備其他要件者，法院應以裁\n    定駁回之，但其情形可以補正者，法院應定期間先命補正，\n    消費者債務清理條例第八條定有明文。\n二、經查，本件聲請人具狀聲請清算，但漏未提出如附表所示資\n    料到院，爰定期命補正，如逾期未補正，則駁回其聲請。\n中    華    民    國   100    年    4     月    11    日\n                  民事第七庭    法  官  賴錦華\n以上正本係照原本作成。\n本裁定不得抗告。\n中    華    民    國   100    年    4     月    11    日\n                                書記官  沈世儒\n附件：\n一、提出財產及收入狀況說明書（請依法定程式臚列每月膳食、\n    交通、電話、水電、瓦斯、日常生活用品、租金、勞健保、\n    醫療及扶養費用等必要支出，並檢附相關證據詳加說明），\n    其中應再敘明：\n  (一)說明位於臺北市○○區○○路五段150 巷441 弄12號1 樓之\n    住所是否為承租？是否與配偶、子女或其他親友同住？若為\n    承租，並提出最新租賃契約、聲請前兩年內每月繳付租金之\n    證明文件。\n  (二)說明劉郁男、李淑美有無其他扶養義務人，聲請人與其他扶\n    養義務人如何分擔劉郁男、李淑美之扶養費用，並提出證明\n    文件；且補正劉郁男、李淑美之全體扶養義務人最新戶籍謄\n    本（記事欄勿省略）。\n  (三)說明聲請人與配偶關岱嵐如何分擔家庭生活費用及所生子女\n    之扶養費用，並提出證明文件、各該子女之最新戶籍謄本（\n    記事欄勿省略）。\n二、提出債務人清冊（依法定程式填載）。\n三、提出關岱嵐、劉郁男、李淑美最新戶籍謄本（記事不得省略\n    ）及其97、98、99年度綜合所得稅各類所得資料清單、財產\n    歸屬資料清單、現有收入證明（在職證明、薪水帳戶存摺影\n    本、扣繳憑單、綜合所得稅結算申報書等）。\n四、提出聲請人及配偶關岱嵐於各金融機構之全部存摺及證券存\n    摺完整影本（須附完整清晰內頁並補登存摺至本裁定送達日\n    之後）。\n五、說明有無以聲請人為要保人或受益人之人壽保單及儲蓄性、\n    投資型保單，若有，並陳報現有保單價值準備金及依約已可\n    領取之保險給付項目、金額。\n六、說明聲請人及受扶養人是否有領取殘障補助、老人津貼、低\n    收入戶補助或其他補助？若有，其期間及金額，並應檢附相\n    關證明文件。\n七、據實報告清算聲請前二年內財產變動之狀況，且提出97、98\n    、99年度綜合所得稅各類所得資料清單、財產歸屬資料清單\n    。",
  "structure": {
    "main": "聲請人應於本裁定送達後七日內，補提如附件所示資料到院，逾\n期未補正，則駁回其清算之聲請。",
    "reason": "一、按聲請更生或清算不合程式或不備其他要件者，法院應以裁\n    定駁回之，但其情形可以補正者，法院應定期間先命補正，\n    消費者債務清理條例第八條定有明文。\n二、經查，本件聲請人具狀聲請清算，但漏未提出如附表所示資\n    料到院，爰定期命補正，如逾期未補正，則駁回其聲請。"
  },
  "search": "臺灣臺北地方法院民事裁定99年度消債清字第97號聲請人即債務人劉力榮上列當事人聲請消費者債務清算事件，本院裁定如下：主文聲請人應於本裁定送達後七日內，補提如附件所示資料到院，逾期未補正，則駁回其清算之聲請。理由一、按聲請更生或清算不合程式或不備其他要件者，法院應以裁定駁回之，但其情形可以補正者，法院應定期間先命補正，消費者債務清理條例第八條定有明文。二、經查，本件聲請人具狀聲請清算，但漏未提出如附表所示資料到院，爰定期命補正，如逾期未補正，則駁回其聲請。中華民國100年4月11日民事第七庭法官賴錦華以上正本係照原本作成。本裁定不得抗告。中華民國100年4月11日書記官沈世儒附件：一、提出財產及收入狀況說明書（請依法定程式臚列每月膳食、交通、電話、水電、瓦斯、日常生活用品、租金、勞健保、醫療及扶養費用等必要支出，並檢附相關證據詳加說明），其中應再敘明：(一)說明位於臺北市○○區○○路五段150巷441弄12號1樓之住所是否為承租？是否與配偶、子女或其他親友同住？若為承租，並提出最新租賃契約、聲請前兩年內每月繳付租金之證明文件。(二)說明劉郁男、李淑美有無其他扶養義務人，聲請人與其他扶養義務人如何分擔劉郁男、李淑美之扶養費用，並提出證明文件；且補正劉郁男、李淑美之全體扶養義務人最新戶籍謄本（記事欄勿省略）。(三)說明聲請人與配偶關岱嵐如何分擔家庭生活費用及所生子女之扶養費用，並提出證明文件、各該子女之最新戶籍謄本（記事欄勿省略）。二、提出債務人清冊（依法定程式填載）。三、提出關岱嵐、劉郁男、李淑美最新戶籍謄本（記事不得省略）及其97、98、99年度綜合所得稅各類所得資料清單、財產歸屬資料清單、現有收入證明（在職證明、薪水帳戶存摺影本、扣繳憑單、綜合所得稅結算申報書等）。四、提出聲請人及配偶關岱嵐於各金融機構之全部存摺及證券存摺完整影本（須附完整清晰內頁並補登存摺至本裁定送達日之後）。五、說明有無以聲請人為要保人或受益人之人壽保單及儲蓄性、投資型保單，若有，並陳報現有保單價值準備金及依約已可領取之保險給付項目、金額。六、說明聲請人及受扶養人是否有領取殘障補助、老人津貼、低收入戶補助或其他補助？若有，其期間及金額，並應檢附相關證明文件。七、據實報告清算聲請前二年內財產變動之狀況，且提出97、98、99年度綜合所得稅各類所得資料清單、財產歸屬資料清單。",
  "characters": {
    "judges": [
      "賴錦華"
    ],
    "prosecutors": [

    ],
    "lawyers": [

    ],
    "clerks": [
      "沈世儒"
    ],
    "plaintiffs": [

    ],
    "defendants": [

    ],
    "prosecutor_office": [

    ],
    "creditors": [

    ],
    "debtors": [

    ],
    "judicial_associate_officer": [

    ]
  },
  "adjudged_at": "2011-04-11",
  "created_at": "2016-02-12 09:38:47",
  "updated_at": "2016-02-12 09:38:47"
}