{
  "identify": "TCH-100-抗-103-20110307-1",
  "court": {
    "name": "臺灣高等法院",
    "code": "TCH"
  },
  "division": {
    "name": "民事",
    "code": "V"
  },
  "year": 100,
  "word": "抗",
  "number": "103",
  "jcheck": "1",
  "reason": "國家賠償",
  "content": "臺灣高等法院臺中分院民事裁定  100年度抗字第103號\n抗  告  人  吳吉村\n相  對  人  劉欣雅\n上列抗告人與相對人因國家賠償事件，對於民國100年1月14日臺\n灣彰化地方法院100年度補字第33號裁定，提起抗告，本院裁定\n如下：\n    主  文\n抗告駁回。\n抗告程序費用由抗告人負擔。\n    理  由\n一、抗告意旨略以：本件國家賠事件確係相對人違背法律，一再\n    違失，故應由相對人負擔訴訟費用，因而請求廢棄原裁定等\n    語。\n二、按訴訟程序中所為之裁定，除別有規定外，不得抗告，民訴\n    訟法第四百八十三條定有明文，故依法不得抗告者，並不因\n    原法院裁定正本載得抗告，而變為得抗告。查抗告人於原審\n    起訴請求國家賠償事件，訴之聲明為請求相對人給付新台幣\n    二百萬元，為訴訟標的金額（原裁定誤認為價額）之主張，\n    依上開說明，為不得抗告。再因財產權起訴者，應由原告依\n    同法第七十七條之十三條規定預納之，此觀之該條規定甚明\n    。至將來審理結果如為敗訴時，始依同法第七十八條規定由\n    敗訴之當事人負擔，乃抗告人主張，於起訴時即應由相對人\n    預納，自難謂適法，是抗告人提起本件抗告，為不合法，應\n    予駁回其抗告。\n三、據上論結，本件抗告為不合法，依民事訴訟法第四百九十五\n    條之一第一項、第四百四十四條第一項、第九十五條、第七\n    十八條，裁定如主文。\n中    華    民    國   100    年    3     月    7     日\n                民事第六庭    審判長法  官  袁再興\n                                    法  官  吳惠郁\n                                    法  官  盧江陽\n以上正本係照原本作成。\n不得再抗告。\n                                    書記官  陳麗玉\n中    華    民    國   100    年    3     月    7     日\n                                                      Ｓ",
  "structure": {
    "main": "抗告駁回。\n抗告程序費用由抗告人負擔。",
    "reason": "一、抗告意旨略以：本件國家賠事件確係相對人違背法律，一再\n    違失，故應由相對人負擔訴訟費用，因而請求廢棄原裁定等\n    語。\n二、按訴訟程序中所為之裁定，除別有規定外，不得抗告，民訴\n    訟法第四百八十三條定有明文，故依法不得抗告者，並不因\n    原法院裁定正本載得抗告，而變為得抗告。查抗告人於原審\n    起訴請求國家賠償事件，訴之聲明為請求相對人給付新台幣\n    二百萬元，為訴訟標的金額（原裁定誤認為價額）之主張，\n    依上開說明，為不得抗告。再因財產權起訴者，應由原告依\n    同法第七十七條之十三條規定預納之，此觀之該條規定甚明\n    。至將來審理結果如為敗訴時，始依同法第七十八條規定由\n    敗訴之當事人負擔，乃抗告人主張，於起訴時即應由相對人\n    預納，自難謂適法，是抗告人提起本件抗告，為不合法，應\n    予駁回其抗告。\n三、據上論結，本件抗告為不合法，依民事訴訟法第四百九十五\n    條之一第一項、第四百四十四條第一項、第九十五條、第七\n    十八條，裁定如主文。"
  },
  "search": "臺灣高等法院臺中分院民事裁定100年度抗字第103號抗告人吳吉村相對人劉欣雅上列抗告人與相對人因國家賠償事件，對於民國100年1月14日臺灣彰化地方法院100年度補字第33號裁定，提起抗告，本院裁定如下：主文抗告駁回。抗告程序費用由抗告人負擔。理由一、抗告意旨略以：本件國家賠事件確係相對人違背法律，一再違失，故應由相對人負擔訴訟費用，因而請求廢棄原裁定等語。二、按訴訟程序中所為之裁定，除別有規定外，不得抗告，民訴訟法第四百八十三條定有明文，故依法不得抗告者，並不因原法院裁定正本載得抗告，而變為得抗告。查抗告人於原審起訴請求國家賠償事件，訴之聲明為請求相對人給付新台幣二百萬元，為訴訟標的金額（原裁定誤認為價額）之主張，依上開說明，為不得抗告。再因財產權起訴者，應由原告依同法第七十七條之十三條規定預納之，此觀之該條規定甚明。至將來審理結果如為敗訴時，始依同法第七十八條規定由敗訴之當事人負擔，乃抗告人主張，於起訴時即應由相對人預納，自難謂適法，是抗告人提起本件抗告，為不合法，應予駁回其抗告。三、據上論結，本件抗告為不合法，依民事訴訟法第四百九十五條之一第一項、第四百四十四條第一項、第九十五條、第七十八條，裁定如主文。中華民國100年3月7日民事第六庭審判長法官袁再興法官吳惠郁法官盧江陽以上正本係照原本作成。不得再抗告。書記官陳麗玉中華民國100年3月7日Ｓ",
  "characters": {
    "judges": [
      "袁再興",
      "吳惠郁",
      "盧江陽"
    ],
    "prosecutors": [

    ],
    "lawyers": [

    ],
    "clerks": [
      "陳麗玉"
    ],
    "plaintiffs": [

    ],
    "defendants": [

    ],
    "prosecutor_office": [

    ],
    "creditors": [

    ],
    "debtors": [

    ],
    "judicial_associate_officer": [

    ]
  },
  "adjudged_at": "2011-03-07",
  "created_at": "2016-02-13 21:30:52",
  "updated_at": "2016-02-13 21:30:52"
}