{
  "identify": "SLD-100-司聲-132-20110504-1",
  "court": {
    "name": "臺灣士林地方法院",
    "code": "SLD"
  },
  "division": {
    "name": "民事",
    "code": "V"
  },
  "year": 100,
  "word": "司聲",
  "number": "132",
  "jcheck": "1",
  "reason": "返還擔保金",
  "content": "臺灣士林地方法院民事裁定            100年度司聲字第132號\n聲  請  人  陳孫玉雲\n相  對  人  黃慧美\n聲請人聲請返還擔保金事件，本院裁定如下：\n    主  文\n本院九十八年存字第一八四四號提存事件聲請人所提存之擔保金\n新台幣貳佰柒拾萬元，准予返還。\n    理  由\n一、按訴訟終結後，法院依供擔保人之聲請，通知受擔保利益人\n    於一定期間內行使權利並向法院為行使權利之證明而未證明\n    者，法院應依供擔保人之聲請，以裁定命返還其提存物，民\n    事訴訟法第104 條第1 項第3 款後段定有明文。另依同法第\n    106 條，前開規定於其他依法令供訴訟上之擔保者準用之。\n二、本件聲請人主張：其與相對人間損害賠償事件，聲請人前遵\n    本院98年度司裁全字第415 號民事裁定，為擔保假扣押，曾\n    提供新台幣2,700,000 元為擔保金，並以本院98年度存字第\n    1844號提存事件提存在案。茲因該事件經兩造達成和解，聲\n    請人業已聲請撤銷假扣押裁定及撤回假扣押強制執行，聲請\n    人並聲請本院定期通知相對人行使權利及提出行使權利之證\n    明，而相對人逾期迄未向本院提出行使權利之證明，為此聲\n    請裁定准予返還擔保金等情，業據其提出提存書、調解筆錄\n    、民事裁定、本院民事執行處函、本院民事庭行使權利事件\n    函（均影本）等為證，並經本院調取相關卷證審核無誤，揆\n    諸首開法條，聲請人聲請返還擔保金，自無不合，應予准許\n    。爰裁定如主文。\n三、如不服本裁定，應於裁定送達後10日內，以書狀向本院司法\n    事務官提出異議。\n中    華    民    國  100     年    5     月    4     日\n                  民事庭  司法事務官",
  "structure": {
    "main": "本院九十八年存字第一八四四號提存事件聲請人所提存之擔保金\n新台幣貳佰柒拾萬元，准予返還。",
    "reason": "一、按訴訟終結後，法院依供擔保人之聲請，通知受擔保利益人\n    於一定期間內行使權利並向法院為行使權利之證明而未證明\n    者，法院應依供擔保人之聲請，以裁定命返還其提存物，民\n    事訴訟法第104 條第1 項第3 款後段定有明文。另依同法第\n    106 條，前開規定於其他依法令供訴訟上之擔保者準用之。\n二、本件聲請人主張：其與相對人間損害賠償事件，聲請人前遵\n    本院98年度司裁全字第415 號民事裁定，為擔保假扣押，曾\n    提供新台幣2,700,000 元為擔保金，並以本院98年度存字第\n    1844號提存事件提存在案。茲因該事件經兩造達成和解，聲\n    請人業已聲請撤銷假扣押裁定及撤回假扣押強制執行，聲請\n    人並聲請本院定期通知相對人行使權利及提出行使權利之證\n    明，而相對人逾期迄未向本院提出行使權利之證明，為此聲\n    請裁定准予返還擔保金等情，業據其提出提存書、調解筆錄\n    、民事裁定、本院民事執行處函、本院民事庭行使權利事件\n    函（均影本）等為證，並經本院調取相關卷證審核無誤，揆\n    諸首開法條，聲請人聲請返還擔保金，自無不合，應予准許\n    。爰裁定如主文。\n三、如不服本裁定，應於裁定送達後10日內，以書狀向本院司法\n    事務官提出異議。"
  },
  "search": "臺灣士林地方法院民事裁定100年度司聲字第132號聲請人陳孫玉雲相對人黃慧美聲請人聲請返還擔保金事件，本院裁定如下：主文本院九十八年存字第一八四四號提存事件聲請人所提存之擔保金新台幣貳佰柒拾萬元，准予返還。理由一、按訴訟終結後，法院依供擔保人之聲請，通知受擔保利益人於一定期間內行使權利並向法院為行使權利之證明而未證明者，法院應依供擔保人之聲請，以裁定命返還其提存物，民事訴訟法第104條第1項第3款後段定有明文。另依同法第106條，前開規定於其他依法令供訴訟上之擔保者準用之。二、本件聲請人主張：其與相對人間損害賠償事件，聲請人前遵本院98年度司裁全字第415號民事裁定，為擔保假扣押，曾提供新台幣2,700,000元為擔保金，並以本院98年度存字第1844號提存事件提存在案。茲因該事件經兩造達成和解，聲請人業已聲請撤銷假扣押裁定及撤回假扣押強制執行，聲請人並聲請本院定期通知相對人行使權利及提出行使權利之證明，而相對人逾期迄未向本院提出行使權利之證明，為此聲請裁定准予返還擔保金等情，業據其提出提存書、調解筆錄、民事裁定、本院民事執行處函、本院民事庭行使權利事件函（均影本）等為證，並經本院調取相關卷證審核無誤，揆諸首開法條，聲請人聲請返還擔保金，自無不合，應予准許。爰裁定如主文。三、如不服本裁定，應於裁定送達後10日內，以書狀向本院司法事務官提出異議。中華民國100年5月4日民事庭司法事務官",
  "characters": {
    "judges": [

    ],
    "prosecutors": [

    ],
    "lawyers": [

    ],
    "clerks": [

    ],
    "plaintiffs": [

    ],
    "defendants": [

    ],
    "prosecutor_office": [
      "陳孫玉雲"
    ],
    "creditors": [

    ],
    "debtors": [

    ],
    "judicial_associate_officer": [

    ]
  },
  "adjudged_at": "2011-05-04",
  "created_at": "2016-02-12 02:23:13",
  "updated_at": "2016-02-12 02:23:13"
}