{
  "identify": "CYD-100-嘉簡-570-20110331-1",
  "court": {
    "name": "臺灣嘉義地方法院",
    "code": "CYD"
  },
  "division": {
    "name": "刑事",
    "code": "M"
  },
  "year": 100,
  "word": "嘉簡",
  "number": "570",
  "jcheck": "1",
  "reason": "詐欺",
  "content": "臺灣嘉義地方法院刑事簡易判決        100年度嘉簡字第570號\n聲  請  人  臺灣嘉義地方法院檢察署檢察官\n被      告  王谷民\n上列被告因詐欺案件，經檢察官聲請以簡易判決處刑（100 年度\n偵字第1629號），本院判決如下：\n    主  文\n王谷民共同犯詐欺取財罪，處有期徒刑參月，如易科罰金，以新\n臺幣壹仟元折算壹日。\n    犯 罪 事 實 及 理 由\n一、本件犯罪事實及證據，除犯罪事實一第14列「林中平」應更\n    正為「林忠平」、第15列「之指示」後應增加「於99年9 月\n    28日12時49分許，」外，其餘均引用檢察官聲請簡易判決處\n    刑書之記載（如附件）。\n二、按現行刑法關於正犯、從犯之區別，係以其主觀之犯意及客\n    觀之犯行為標準，凡以自己犯罪之意思而參與犯罪，無論其\n    所參與者是否係犯罪構成要件之行為，皆為正犯，其以幫助\n    他人犯罪之意思而參與犯罪，其所參與者，苟係犯罪構成要\n    件之行為，亦為正犯，必以幫助他人犯罪之意思而參與犯罪\n    ，其所參與者又為犯罪構成要件以外之行為，始為從犯，最\n    高法院25年上字第2253號判例可資參照。查本件被告王谷民\n    除提供上開帳戶供詐騙集團成員使用外，另擔負提領款項之\n    角色，揆其情節，顯然知悉詐欺取財之犯罪情節，並直接參\n    與犯罪構成要件之行為，是參諸上開說明，被告即應以正犯\n    論處。是核其所為，係犯刑法第339 條第1 項之詐欺取財罪\n    ，其與真實姓名、年籍不詳「小雅」之成年女子，有犯意聯\n    絡及行為分擔，應論以共同正犯。爰審酌被告素行尚佳，有\n    臺灣高等法院被告前案紀錄表1 份在卷可參，竟提供帳戶供\n    詐騙成員行騙之用，並直接協助詐騙成員提領詐騙所得之款\n    項，然考量其提供帳戶供詐騙成員使用，助長詐騙成功機率\n    ，復參與行騙過程中取款角色，影響社會治安，惟詐騙金額\n    非鉅，犯後尚知坦承犯行等一切情狀，量處如主文所示之刑\n    ，並諭知易科罰金之折算標準，以示懲儆。\n三、依刑事訴訟法第449 條第1 項前段、第454 條第2 項，刑法\n    第28條、第339 條第1 項、第41條第1 項前段，刑法施行法\n    第1 條之1 第1 項、第2 項前段，逕以簡易判決如主文所示\n    之刑。\n四、如不服本判決，得於判決書送達之日起10日內，以書狀敘述\n    理由，向本院提出上訴（須附繕本）。\n中    華    民    國   100    年     3    月    31    日\n                  嘉義簡易庭法  官  張志偉\n上列正本證明與原本無異。\n如不服本判決，應於判決送達後10日內向本院提出上訴狀（應附\n繕本）。告訴人或被害人如對於本判決不服者，應具備理由請求\n檢察官上訴，其上訴期間之計算係以檢察官收受判決正本之日期\n為準。\n中    華    民    國   100    年    3     月    31    日\n                            書記官  張子涵\n附錄法條：\n刑法第339 條第1 項\n（普通詐欺罪）\n意圖為自己或第三人不法之所有，以詐術使人將本人或第三人之\n物交付者，處 5 年以下有期徒刑、拘役或科或併科 1 千元以下\n罰金。\n以前項方法得財產上不法之利益或使第三人得之者，亦同。\n前二項之未遂犯罰之。",
  "structure": {
  },
  "search": "臺灣嘉義地方法院刑事簡易判決100年度嘉簡字第570號聲請人臺灣嘉義地方法院檢察署檢察官被告王谷民上列被告因詐欺案件，經檢察官聲請以簡易判決處刑（100年度偵字第1629號），本院判決如下：主文王谷民共同犯詐欺取財罪，處有期徒刑參月，如易科罰金，以新臺幣壹仟元折算壹日。犯罪事實及理由一、本件犯罪事實及證據，除犯罪事實一第14列「林中平」應更正為「林忠平」、第15列「之指示」後應增加「於99年9月28日12時49分許，」外，其餘均引用檢察官聲請簡易判決處刑書之記載（如附件）。二、按現行刑法關於正犯、從犯之區別，係以其主觀之犯意及客觀之犯行為標準，凡以自己犯罪之意思而參與犯罪，無論其所參與者是否係犯罪構成要件之行為，皆為正犯，其以幫助他人犯罪之意思而參與犯罪，其所參與者，苟係犯罪構成要件之行為，亦為正犯，必以幫助他人犯罪之意思而參與犯罪，其所參與者又為犯罪構成要件以外之行為，始為從犯，最高法院25年上字第2253號判例可資參照。查本件被告王谷民除提供上開帳戶供詐騙集團成員使用外，另擔負提領款項之角色，揆其情節，顯然知悉詐欺取財之犯罪情節，並直接參與犯罪構成要件之行為，是參諸上開說明，被告即應以正犯論處。是核其所為，係犯刑法第339條第1項之詐欺取財罪，其與真實姓名、年籍不詳「小雅」之成年女子，有犯意聯絡及行為分擔，應論以共同正犯。爰審酌被告素行尚佳，有臺灣高等法院被告前案紀錄表1份在卷可參，竟提供帳戶供詐騙成員行騙之用，並直接協助詐騙成員提領詐騙所得之款項，然考量其提供帳戶供詐騙成員使用，助長詐騙成功機率，復參與行騙過程中取款角色，影響社會治安，惟詐騙金額非鉅，犯後尚知坦承犯行等一切情狀，量處如主文所示之刑，並諭知易科罰金之折算標準，以示懲儆。三、依刑事訴訟法第449條第1項前段、第454條第2項，刑法第28條、第339條第1項、第41條第1項前段，刑法施行法第1條之1第1項、第2項前段，逕以簡易判決如主文所示之刑。四、如不服本判決，得於判決書送達之日起10日內，以書狀敘述理由，向本院提出上訴（須附繕本）。中華民國100年3月31日嘉義簡易庭法官張志偉上列正本證明與原本無異。如不服本判決，應於判決送達後10日內向本院提出上訴狀（應附繕本）。告訴人或被害人如對於本判決不服者，應具備理由請求檢察官上訴，其上訴期間之計算係以檢察官收受判決正本之日期為準。中華民國100年3月31日書記官張子涵附錄法條：刑法第339條第1項（普通詐欺罪）意圖為自己或第三人不法之所有，以詐術使人將本人或第三人之物交付者，處5年以下有期徒刑、拘役或科或併科1千元以下罰金。以前項方法得財產上不法之利益或使第三人得之者，亦同。前二項之未遂犯罰之。",
  "characters": {
    "judges": [
      "張志偉"
    ],
    "prosecutors": [

    ],
    "lawyers": [

    ],
    "clerks": [
      "張子涵"
    ],
    "plaintiffs": [

    ],
    "defendants": [
      "王谷民"
    ],
    "prosecutor_office": [
      "臺灣嘉義地方法院檢察署檢察官"
    ],
    "creditors": [

    ],
    "debtors": [

    ],
    "judicial_associate_officer": [

    ]
  },
  "adjudged_at": "2011-03-31",
  "created_at": "2016-02-13 23:04:30",
  "updated_at": "2016-02-13 23:04:30"
}