{
  "identify": "CYD-100-嘉簡-563-20110331-1",
  "court": {
    "name": "臺灣嘉義地方法院",
    "code": "CYD"
  },
  "division": {
    "name": "刑事",
    "code": "M"
  },
  "year": 100,
  "word": "嘉簡",
  "number": "563",
  "jcheck": "1",
  "reason": "賭博",
  "content": "臺灣嘉義地方法院刑事簡易判決        100年度嘉簡字第563號\n聲  請  人  臺灣嘉義地方法院檢察署檢察官\n被      告  蕭霈宜\n上列被告因賭博案件，經檢察官聲請以簡易判決處刑（100 年度\n偵字第1400號），本院判決如下：\n    主  文\n蕭霈宜犯圖利聚眾賭博罪，累犯，處有期徒刑肆月，如易科罰金\n，以新臺幣壹仟元折算壹日。扣案之簽單拾柒張均沒收。\n    犯 罪 事 實 及 理 由\n一、本件犯罪事實及證據，均引用檢察官聲請簡易判決處刑書之\n    記載（如附件）。\n二、按刑法第268 條規定之「供給賭博場所」，係指提供特定處\n    所供人從事賭博行為而言；所稱「聚眾賭博」，係指聚集不\n    特定人參與賭博之行為，縱未於現實上同時糾集多數人於同\n    一處所，而係聚集眾人之財物進行賭博者，例如職棒簽賭及\n    六合彩組頭以電話、傳真之方式供人簽賭之行為，亦屬之。\n    經查，被告蕭霈宜係基於營利之意圖，提供其處所之公眾得\n    出入之場所，聚集多數人或供不特定多數人簽注賭博，並參\n    與輸贏之賭注，核被告所為，係犯刑法第268 條前段之意圖\n    營利供給賭博場所罪、同條後段之意圖營利聚眾賭博罪及同\n    法第266 條第1 項前段在公眾得出入之場所賭博財物罪。復\n    按刑事法若干犯罪行為態樣，本質上原具有反覆、延續實行\n    之特徵，立法時既予特別歸類，定為犯罪構成要件之行為要\n    素，則行為人基於概括之犯意，在密切接近之一定時、地持\n    續實行之複次行為，倘依社會通念，於客觀上認為符合一個\n    反覆、延續性之行為觀念者，於刑法評價上，即應僅成立一\n    罪；學理上所稱「集合犯」之職業性、營業性或收集性等具\n    有重複特質之犯罪均屬之，例如經營、從事業務、收集、販\n    賣、製造、散佈等行為概念者是（最高法院96年度臺上字第\n    172 號、96年度臺上字第1500號判決意旨參照）。被告自民\n    國99年2 月2 日至4 日，提供上開公眾得出入之場所，聚集\n    不特定賭客簽賭，主持多次賭博行為，藉此牟利，本質上具\n    有反覆性，於刑法評價上，應認係集合犯，僅成立一罪。被\n    告所犯上開3 罪，係基於一賭博犯意之決定，以達成同一犯\n    罪之各個舉動，屬於法律概念之一行為，其以一行為觸犯數\n    罪名，為想像競合犯，其應依刑法第55條之規定，從一情節\n    較重之意圖營利聚眾賭博罪處斷。被告前因賭博案件，經本\n    院以95年度嘉簡字第137 號判處有期徒刑3 月確定，於95年\n    4 月20日易科罰金執行完畢，有臺灣高等法院被告前案紀錄\n    表在卷可查，其受有期徒刑執行完畢後5 年內，故意再犯本\n    件有期徒刑以上之罪，為累犯，應依刑法第47條第1 項之規\n    定，加重其刑。\n三、爰審酌被告經營簽賭對社會善良風俗所產生不良影響，惟其\n    犯後坦承犯行，所經營賭博之時間尚短及規模非大，及其初\n    中畢業之智識程度、家境勉持暨被告於偵查中同意檢察官具\n    體求處有期徒刑4 月（見偵查卷第14頁）等一切情狀，量處\n    如主文所示之刑，並諭知易科罰金之折算標準。查獲之簽單\n    17張，係被告所有，記載賭客簽賭情形，為供本件犯行所用\n    之物，爰依刑法第38條第1 項第2 款宣告沒收之。\n四、依刑事訴訟法第449 條第1 項前段、第450 條第1 項、第\n    454 條第2 項，刑法第266 條第1 項前段、第268 條、第55\n    條、第47條第1 項、第41條第1 項前段、第38條第1 項第2\n    款，刑法施行法第1 條之1 第1 項、第2 項前段，逕以簡易\n    判決處刑如主文所示。\n五、依刑事訴訟法第455 條之1 第2 項之規定，當事人不得上訴\n    。\n中    華    民    國   100    年    3     月    31    日\n                  嘉義簡易庭  法  官   梁淑美\n以上正本證明與原本無異。\n如不服本判決應於收受判決後10日內向本院提出上訴書狀，並應\n敘述具體理由；其未敘述上訴理由者，應於上訴期間屆滿後20日\n內向本院補提理由書（均須按他造當事人之人數附繕本）「切勿\n逕送上級法院」。\n中    華    民    國   100    年    3     月    31    日\n                              書記官   林金福\n附錄本判決論罪法條全文\n中華民國刑法第266條\n（普通賭博罪與沒收物）\n在公共場所或公眾得出入之場所賭博財物者，處1千元以下罰金\n。但以供人暫時娛樂之物為賭者，不在此限。\n當場賭博之器具與在賭檯或兌換籌碼處之財物，不問屬於犯人與\n否，沒收之。\n中華民國刑法第268條\n（圖利供給賭場或聚眾賭博罪）\n意圖營利，供給賭博場所或聚眾賭博者，處 3 年以下有期徒刑，\n得併科3千元以下罰金。\n附件：\n100年度偵字第1400號聲請簡易判決處刑書。",
  "structure": {
  },
  "search": "臺灣嘉義地方法院刑事簡易判決100年度嘉簡字第563號聲請人臺灣嘉義地方法院檢察署檢察官被告蕭霈宜上列被告因賭博案件，經檢察官聲請以簡易判決處刑（100年度偵字第1400號），本院判決如下：主文蕭霈宜犯圖利聚眾賭博罪，累犯，處有期徒刑肆月，如易科罰金，以新臺幣壹仟元折算壹日。扣案之簽單拾柒張均沒收。犯罪事實及理由一、本件犯罪事實及證據，均引用檢察官聲請簡易判決處刑書之記載（如附件）。二、按刑法第268條規定之「供給賭博場所」，係指提供特定處所供人從事賭博行為而言；所稱「聚眾賭博」，係指聚集不特定人參與賭博之行為，縱未於現實上同時糾集多數人於同一處所，而係聚集眾人之財物進行賭博者，例如職棒簽賭及六合彩組頭以電話、傳真之方式供人簽賭之行為，亦屬之。經查，被告蕭霈宜係基於營利之意圖，提供其處所之公眾得出入之場所，聚集多數人或供不特定多數人簽注賭博，並參與輸贏之賭注，核被告所為，係犯刑法第268條前段之意圖營利供給賭博場所罪、同條後段之意圖營利聚眾賭博罪及同法第266條第1項前段在公眾得出入之場所賭博財物罪。復按刑事法若干犯罪行為態樣，本質上原具有反覆、延續實行之特徵，立法時既予特別歸類，定為犯罪構成要件之行為要素，則行為人基於概括之犯意，在密切接近之一定時、地持續實行之複次行為，倘依社會通念，於客觀上認為符合一個反覆、延續性之行為觀念者，於刑法評價上，即應僅成立一罪；學理上所稱「集合犯」之職業性、營業性或收集性等具有重複特質之犯罪均屬之，例如經營、從事業務、收集、販賣、製造、散佈等行為概念者是（最高法院96年度臺上字第172號、96年度臺上字第1500號判決意旨參照）。被告自民國99年2月2日至4日，提供上開公眾得出入之場所，聚集不特定賭客簽賭，主持多次賭博行為，藉此牟利，本質上具有反覆性，於刑法評價上，應認係集合犯，僅成立一罪。被告所犯上開3罪，係基於一賭博犯意之決定，以達成同一犯罪之各個舉動，屬於法律概念之一行為，其以一行為觸犯數罪名，為想像競合犯，其應依刑法第55條之規定，從一情節較重之意圖營利聚眾賭博罪處斷。被告前因賭博案件，經本院以95年度嘉簡字第137號判處有期徒刑3月確定，於95年4月20日易科罰金執行完畢，有臺灣高等法院被告前案紀錄表在卷可查，其受有期徒刑執行完畢後5年內，故意再犯本件有期徒刑以上之罪，為累犯，應依刑法第47條第1項之規定，加重其刑。三、爰審酌被告經營簽賭對社會善良風俗所產生不良影響，惟其犯後坦承犯行，所經營賭博之時間尚短及規模非大，及其初中畢業之智識程度、家境勉持暨被告於偵查中同意檢察官具體求處有期徒刑4月（見偵查卷第14頁）等一切情狀，量處如主文所示之刑，並諭知易科罰金之折算標準。查獲之簽單17張，係被告所有，記載賭客簽賭情形，為供本件犯行所用之物，爰依刑法第38條第1項第2款宣告沒收之。四、依刑事訴訟法第449條第1項前段、第450條第1項、第454條第2項，刑法第266條第1項前段、第268條、第55條、第47條第1項、第41條第1項前段、第38條第1項第2款，刑法施行法第1條之1第1項、第2項前段，逕以簡易判決處刑如主文所示。五、依刑事訴訟法第455條之1第2項之規定，當事人不得上訴。中華民國100年3月31日嘉義簡易庭法官梁淑美以上正本證明與原本無異。如不服本判決應於收受判決後10日內向本院提出上訴書狀，並應敘述具體理由；其未敘述上訴理由者，應於上訴期間屆滿後20日內向本院補提理由書（均須按他造當事人之人數附繕本）「切勿逕送上級法院」。中華民國100年3月31日書記官林金福附錄本判決論罪法條全文中華民國刑法第266條（普通賭博罪與沒收物）在公共場所或公眾得出入之場所賭博財物者，處1千元以下罰金。但以供人暫時娛樂之物為賭者，不在此限。當場賭博之器具與在賭檯或兌換籌碼處之財物，不問屬於犯人與否，沒收之。中華民國刑法第268條（圖利供給賭場或聚眾賭博罪）意圖營利，供給賭博場所或聚眾賭博者，處3年以下有期徒刑，得併科3千元以下罰金。附件：100年度偵字第1400號聲請簡易判決處刑書。",
  "characters": {
    "judges": [
      "梁淑美"
    ],
    "prosecutors": [

    ],
    "lawyers": [

    ],
    "clerks": [
      "林金福"
    ],
    "plaintiffs": [

    ],
    "defendants": [
      "蕭霈宜"
    ],
    "prosecutor_office": [
      "臺灣嘉義地方法院檢察署檢察官"
    ],
    "creditors": [

    ],
    "debtors": [

    ],
    "judicial_associate_officer": [

    ]
  },
  "adjudged_at": "2011-03-31",
  "created_at": "2016-02-13 22:54:30",
  "updated_at": "2016-02-13 22:54:30"
}