{
  "identify": "TYD-94-聲-555-20050504-1",
  "court": {
    "name": "臺灣桃園地方法院",
    "code": "TYD"
  },
  "division": {
    "name": "民事",
    "code": "V"
  },
  "year": 94,
  "word": "聲",
  "number": "555",
  "jcheck": "1",
  "reason": "返還提存物",
  "content": "臺灣桃園地方法院民事裁定               94年度聲字第555號\n聲  請  人  新竹國際商業銀行股份有限公司\n法定代理人  乙○○\n相  對  人  甲○○\n上列聲請人聲請返還提存物事件，本院裁定如下：\n    主  文\n本八十七年度存字第二五七六號提存事件聲請人所提存之擔保金\n中央政府建設公債八十四年度甲類第一期債票參張（面額均為新\n台幣伍拾萬元、號碼八四Ａ七九四○─七九四二Ｃ），面額總計\n新台幣壹佰伍拾萬元，准予返還。\n    理  由\n一、按訴訟終結後，供擔保人證明已定20日以上之期間，催告受\n    擔保利益人行使權利而未行使者，法院應依供擔保人之聲請\n    ，以裁定命返還其提存物，民事訴訟法第104 條第1 項第3\n    款前段定有明文。又該條之規定，於其他依法令供訴訟上之\n    擔保者，準用之，同法第106 條亦定有明文。而此所謂訴訟\n    終結，應從廣義解釋，包括執行程序終結在內（最高法院75\n    年台抗字第261號裁判意旨參照）。\n二、本件聲請意旨略以：聲請人前遵鈞院87年度全四字第2997號\n    假扣押裁定，曾提供中央政府建設公債84年度甲類第1 期債\n    票，面額共計新台幣（下同）1,500,000 元為擔保，聲請鈞\n    院對相對人之財產為假扣押。聲請人已聲請撤銷上開假扣押\n    裁定確定，且定20日以上期間催告相對人行使權利而未行使\n    ，爰聲請返還上開提存物等語，並提出提存書、撤銷假扣押\n    裁定及確定證明書、存證信函及回執為證。\n三、經查，聲請人與相對人間因清償債務事件，聲請人依本院87\n    年度全四字第2997號假扣押裁定，曾提供中央政府建設公債\n    84年度甲類第1 期債票3 張、面額均為500,000 元為擔保，\n    以本院87年度存字第2576號提存事件提存後，由本院以87年\n    度執全字第2166號對相對人之財產執行假扣押在案，又前開\n    假扣押事件所查扣之相對人財產，業經本院91年度執定第\n    19343 調卷拍賣完畢，聲請人並已聲請本院以93年度全聲字\n    第220 號撤銷前開假扣押裁定確定，已據本院依職權調閱前\n    開假扣押卷、假扣押執行卷、提存卷，查核屬實。且聲請人\n    業定20日以上期間催告相對人行使權利，有聲請人提出之存\n    證信函及回執為證，惟相對人迄未行使權利，有本院民事紀\n    錄科查詢表2 紙、台灣新竹地方法院94年4 月22日新院月民\n    慎字第06914 號函為憑，是聲請人聲請返還提存物，核無不\n    合，應予准許，爰裁定如主文所示。\n中    華    民    國    94    年    5     月    4     日\n                  民事第一庭    法  官  賴惠慈\n以上正本係照原本作成\n如對本裁定抗告須於裁定送達後10日內向本院提出抗告狀，並應\n繳納抗告裁判費新台幣1,000 元。\n中    華    民    國    94    年    5     月    4     日\n                                書記官  黃泰能\n",
  "structure": {
    "main": "本八十七年度存字第二五七六號提存事件聲請人所提存之擔保金\n中央政府建設公債八十四年度甲類第一期債票參張（面額均為新\n台幣伍拾萬元、號碼八四Ａ七九四○─七九四二Ｃ），面額總計\n新台幣壹佰伍拾萬元，准予返還。",
    "reason": "一、按訴訟終結後，供擔保人證明已定20日以上之期間，催告受\n    擔保利益人行使權利而未行使者，法院應依供擔保人之聲請\n    ，以裁定命返還其提存物，民事訴訟法第104 條第1 項第3\n    款前段定有明文。又該條之規定，於其他依法令供訴訟上之\n    擔保者，準用之，同法第106 條亦定有明文。而此所謂訴訟\n    終結，應從廣義解釋，包括執行程序終結在內（最高法院75\n    年台抗字第261號裁判意旨參照）。\n二、本件聲請意旨略以：聲請人前遵鈞院87年度全四字第2997號\n    假扣押裁定，曾提供中央政府建設公債84年度甲類第1 期債\n    票，面額共計新台幣（下同）1,500,000 元為擔保，聲請鈞\n    院對相對人之財產為假扣押。聲請人已聲請撤銷上開假扣押\n    裁定確定，且定20日以上期間催告相對人行使權利而未行使\n    ，爰聲請返還上開提存物等語，並提出提存書、撤銷假扣押\n    裁定及確定證明書、存證信函及回執為證。\n三、經查，聲請人與相對人間因清償債務事件，聲請人依本院87\n    年度全四字第2997號假扣押裁定，曾提供中央政府建設公債\n    84年度甲類第1 期債票3 張、面額均為500,000 元為擔保，\n    以本院87年度存字第2576號提存事件提存後，由本院以87年\n    度執全字第2166號對相對人之財產執行假扣押在案，又前開\n    假扣押事件所查扣之相對人財產，業經本院91年度執定第\n    19343 調卷拍賣完畢，聲請人並已聲請本院以93年度全聲字\n    第220 號撤銷前開假扣押裁定確定，已據本院依職權調閱前\n    開假扣押卷、假扣押執行卷、提存卷，查核屬實。且聲請人\n    業定20日以上期間催告相對人行使權利，有聲請人提出之存\n    證信函及回執為證，惟相對人迄未行使權利，有本院民事紀\n    錄科查詢表2 紙、台灣新竹地方法院94年4 月22日新院月民\n    慎字第06914 號函為憑，是聲請人聲請返還提存物，核無不\n    合，應予准許，爰裁定如主文所示。"
  },
  "search": "臺灣桃園地方法院民事裁定94年度聲字第555號聲請人新竹國際商業銀行股份有限公司法定代理人乙○○相對人甲○○上列聲請人聲請返還提存物事件，本院裁定如下：主文本八十七年度存字第二五七六號提存事件聲請人所提存之擔保金中央政府建設公債八十四年度甲類第一期債票參張（面額均為新台幣伍拾萬元、號碼八四Ａ七九四○─七九四二Ｃ），面額總計新台幣壹佰伍拾萬元，准予返還。理由一、按訴訟終結後，供擔保人證明已定20日以上之期間，催告受擔保利益人行使權利而未行使者，法院應依供擔保人之聲請，以裁定命返還其提存物，民事訴訟法第104條第1項第3款前段定有明文。又該條之規定，於其他依法令供訴訟上之擔保者，準用之，同法第106條亦定有明文。而此所謂訴訟終結，應從廣義解釋，包括執行程序終結在內（最高法院75年台抗字第261號裁判意旨參照）。二、本件聲請意旨略以：聲請人前遵鈞院87年度全四字第2997號假扣押裁定，曾提供中央政府建設公債84年度甲類第1期債票，面額共計新台幣（下同）1,500,000元為擔保，聲請鈞院對相對人之財產為假扣押。聲請人已聲請撤銷上開假扣押裁定確定，且定20日以上期間催告相對人行使權利而未行使，爰聲請返還上開提存物等語，並提出提存書、撤銷假扣押裁定及確定證明書、存證信函及回執為證。三、經查，聲請人與相對人間因清償債務事件，聲請人依本院87年度全四字第2997號假扣押裁定，曾提供中央政府建設公債84年度甲類第1期債票3張、面額均為500,000元為擔保，以本院87年度存字第2576號提存事件提存後，由本院以87年度執全字第2166號對相對人之財產執行假扣押在案，又前開假扣押事件所查扣之相對人財產，業經本院91年度執定第19343調卷拍賣完畢，聲請人並已聲請本院以93年度全聲字第220號撤銷前開假扣押裁定確定，已據本院依職權調閱前開假扣押卷、假扣押執行卷、提存卷，查核屬實。且聲請人業定20日以上期間催告相對人行使權利，有聲請人提出之存證信函及回執為證，惟相對人迄未行使權利，有本院民事紀錄科查詢表2紙、台灣新竹地方法院94年4月22日新院月民慎字第06914號函為憑，是聲請人聲請返還提存物，核無不合，應予准許，爰裁定如主文所示。中華民國94年5月4日民事第一庭法官賴惠慈以上正本係照原本作成如對本裁定抗告須於裁定送達後10日內向本院提出抗告狀，並應繳納抗告裁判費新台幣1,000元。中華民國94年5月4日書記官黃泰能",
  "characters": {
    "judges": [
      "賴惠慈"
    ],
    "prosecutors": [

    ],
    "lawyers": [

    ],
    "clerks": [
      "黃泰能"
    ],
    "plaintiffs": [

    ],
    "defendants": [

    ],
    "prosecutor_office": [
      "新竹國際商業銀行股份有限公司"
    ],
    "creditors": [

    ],
    "debtors": [

    ],
    "judicial_associate_officer": [

    ]
  },
  "adjudged_at": "2005-05-04",
  "created_at": "2016-02-06 16:02:18",
  "updated_at": "2016-02-06 16:02:18"
}