{
  "identify": "PHD-100-補-39-20111216-1",
  "court": {
    "name": "臺灣澎湖地方法院",
    "code": "PHD"
  },
  "division": {
    "name": "民事",
    "code": "V"
  },
  "year": 100,
  "word": "補",
  "number": "39",
  "jcheck": "1",
  "reason": "確認界址",
  "content": "臺灣澎湖地方法院民事裁定               100年度補字第39號\n原      告  陳文澤\n\n被      告  盧田村\n上列當事人間確認界址事件，原告應於收受本裁定之日起5 日內\n，依民事訴訟法第249 條第1 項但書規定補正下列事項，逾期不\n補，即駁回其訴，特此裁定。\n    應補正之事項：\n一、澎湖縣湖西鄉○○段第1748地號及同段第1749地號土地登記\n    謄本。\n二、原告主張澎湖縣湖西鄉○○段第1748地號土地之界址與被告\n    主張之界址間差距之面積。\n三、被告之最新戶籍謄本（記事欄勿省略）。\n四、原告起訴未據繳納裁判費，復未於訴狀載明系爭訴訟標的價\n    額，使本院無法核定訴訟標的價額，以裁定命原告補繳裁判\n    費。茲限原告於收受本裁定送達5 日內，查報系爭訴訟標的\n    價額（即原告主張澎湖縣湖西鄉○○段第1748地號土地之界\n    址與被告主張之界址間差距之面積土地登記謄本所示公告\n    土地現值），並依民事訴訟法第77條之13所定費率，按系爭\n    訴訟標的價額補繳裁判費。若無法查報訴訟標的價額者，則\n    應依同法第77條之12規定，暫先繳納新臺幣17,335元。\n中    華    民    國   100    年    12    月    16    日\n                        民事庭  法  官  鍾孟容\n以上正本係照原本作成。\n如不服本裁定關於訴訟標的價額之核定，得於收受裁定正本後10\n日內向本院提出抗告狀，並繳納抗告裁判費新臺幣1,000元。\n中    華    民    國   100    年    12    月    16    日\n                                書記官  林長義",
  "structure": {
  },
  "search": "臺灣澎湖地方法院民事裁定100年度補字第39號原告陳文澤被告盧田村上列當事人間確認界址事件，原告應於收受本裁定之日起5日內，依民事訴訟法第249條第1項但書規定補正下列事項，逾期不補，即駁回其訴，特此裁定。應補正之事項：一、澎湖縣湖西鄉○○段第1748地號及同段第1749地號土地登記謄本。二、原告主張澎湖縣湖西鄉○○段第1748地號土地之界址與被告主張之界址間差距之面積。三、被告之最新戶籍謄本（記事欄勿省略）。四、原告起訴未據繳納裁判費，復未於訴狀載明系爭訴訟標的價額，使本院無法核定訴訟標的價額，以裁定命原告補繳裁判費。茲限原告於收受本裁定送達5日內，查報系爭訴訟標的價額（即原告主張澎湖縣湖西鄉○○段第1748地號土地之界址與被告主張之界址間差距之面積土地登記謄本所示公告土地現值），並依民事訴訟法第77條之13所定費率，按系爭訴訟標的價額補繳裁判費。若無法查報訴訟標的價額者，則應依同法第77條之12規定，暫先繳納新臺幣17,335元。中華民國100年12月16日民事庭法官鍾孟容以上正本係照原本作成。如不服本裁定關於訴訟標的價額之核定，得於收受裁定正本後10日內向本院提出抗告狀，並繳納抗告裁判費新臺幣1,000元。中華民國100年12月16日書記官林長義",
  "characters": {
    "judges": [
      "鍾孟容"
    ],
    "prosecutors": [

    ],
    "lawyers": [

    ],
    "clerks": [

    ],
    "plaintiffs": [
      "陳文澤"
    ],
    "defendants": [
      "盧田村"
    ],
    "prosecutor_office": [

    ],
    "creditors": [

    ],
    "debtors": [

    ],
    "judicial_associate_officer": [

    ]
  },
  "adjudged_at": "2011-12-16",
  "created_at": "2016-02-13 10:13:44",
  "updated_at": "2016-02-13 10:13:44"
}