{
  "identify": "ULD-100-司聲-277-20111216-1",
  "court": {
    "name": "臺灣雲林地方法院",
    "code": "ULD"
  },
  "division": {
    "name": "民事",
    "code": "V"
  },
  "year": 100,
  "word": "司聲",
  "number": "277",
  "jcheck": "1",
  "reason": "返還擔保金",
  "content": "臺灣雲林地方法院民事裁定            100年度司聲字第277號\n聲  請  人  張義結\n聲  請  人  籃秀微\n相  對  人  潘俊佳\n            張春汝\n            潘俊岳\n上列聲請人聲請返還擔保金事件，本院裁定如下：\n    主  文\n聲請人關於為相對人潘俊佳、張春汝於本院九十五年度存字第一\n五七九號擔保提存事件所提存之擔保金新臺幣壹拾萬元，准予返\n還。\n聲請人其餘聲請駁回。\n聲請程序費用由相對人潘俊佳、張春汝連帶負擔。\n    理  由\n一、按訴訟終結後，供擔保人證明已定20日以上之期間，催告受\n    擔保利益人行使權利而未行使者，或法院依供擔保利益人之\n    聲請，通知受擔保利益人於一定期間內行使權利並向法院為\n    行使權利之證明而未證明者，法院應依供擔保人之聲請，以\n    裁定命返還其提存物或保證書，民事訴訟法第104條第1項第\n    3款定有明文，依同法第106條之規定，於其他依法令供訴訟\n    上之擔保者，亦準用之。其中所謂訴訟終結，在因假扣押或\n    假處分所供擔保之場合，因該擔保係為保障受擔保利益人因\n    該假扣押或假處分所受損害而設，倘執行法院已依假扣押或\n    假處分裁定為假扣押或假處分之執行，則在供擔保人撤回假\n    扣押或假處分之執行前，受擔保利益人所受損害仍可能繼續\n    發生，損害額既尚未確定，自難強令其行使權利，必待供擔\n    保人已撤回假扣押或假處分之執行，始得謂為訴訟終結（最\n    高法院98年台抗字第49號、87年台抗字第234 號裁定意旨參\n    照）。又所謂應供擔保原因消滅，係擔保債務人因假扣押所\n    受之損害，故必待無損害發生，或債權人本案勝訴確定，或\n    就所生之損害已經賠償時，始得謂應供擔保之原因消滅（最\n    高法院53年度臺抗字第279 號判例意旨參照）。\n二、本件聲請意旨略以：聲請人與相對人間因假扣押事件，前依\n    本院95年度裁全字第2780號民事裁定，曾提供新臺幣（下同\n    ）100,000 元為擔保，聲請對相對人為假扣押執行在案。茲\n    因聲請人與相對人潘俊佳、張春汝間之本案訴訟，業經97年\n    度訴字第419 號民事判決確定在案，其與相對人潘俊岳間之\n    本案訴訟則於撤回訴訟後以存證信函催告相對人潘俊岳行使\n    權利而未行使，爰依法聲請返還前開擔保金等語，並提出本\n    院95年度裁全字第2780號民事裁定、95年度存字第1579號提\n    存書、97年度訴字第419 號民事判決確定證明書等件影本為\n    證。\n三、經查，聲請人聲請本院以95年度裁全字第2780號裁定，准許\n    聲請人供擔保後得對相對人之財產於1,000,000 元之範圍內\n    為假扣押，聲請人於供擔保後，據以聲請本院以95年度執全\n    字第1530號案件對相對人之財產予以假扣押等情，業據本院\n    依職權調取前開卷宗核閱屬實。嗣聲請人與相對人潘俊佳、\n    張春汝間之本案訴訟，業經97年度訴字第419 號判決合計命\n    相對人潘俊佳、張春汝應連帶給付聲請人張義結506,000 元\n    ，聲請人籃秀微914,926 元，及各自民國（下同）97年9 月\n    2 日起至清償日止，按年息百分之五計算之利息，並於98年\n    5 月21日確定在案，亦據本院依職權調取前開訴訟卷宗查明\n    無訛，則聲請人對相對人潘俊佳、張春汝之本案請求雖未獲\n    全部勝訴，但就其勝訴部分金額為1,420,926 元，已逾假扣\n    押所保全之請求金額1,000,000 元，就其假扣押之範圍而言\n    ，實已獲得全部勝訴，是本件受擔保利益人即相對人潘俊佳\n    、張春汝即無因上開假扣押裁定聲請執行而受有損害發生之\n    可能，故應認其應供擔保之原因已消滅，是本件受擔保利益\n    人即相對人潘俊佳、張春汝即無因上開假扣押裁定聲請執行\n    而受有損害發生之可能，故應認其應供擔保之原因已消滅，\n    揆諸前揭法條之規定，聲請人關於相對人潘俊佳、張春汝之\n    聲請即有理由，應予准許。\n四、又聲請人雖於100 年11月3 日以虎尾圓環郵局第149 號存證\n    信函催告相對人潘俊岳行使權利，惟其迄未撤回相對人潘俊\n    岳部分之假扣押執行程序一節，業據本院依職權調閱本院95\n    年度執全字第1530號假扣押執行案卷查明屬實，揆諸前開說\n    明，聲請人既未撤回假扣押之執行程序，受擔保利益人即相\n    對人潘俊岳可能發生之損害尚未確定，自無強令其行使權利\n    之理。本件聲請人既係於撤回假扣押執行程序前以存證信函\n    通知相對人潘俊岳行使權利，揆諸前揭說明，顯與民事訴訟\n    法第106 條準用同法第104 條第1 項第3 款於「訴訟終結後\n    」定20日以上期間催告受擔保利益人行使權利而未行使之要\n    件不符。又聲請人並未提出相對人潘俊岳無損害發生、本案\n    訴訟獲全部勝訴確定或就相對人潘俊岳因假扣押執行所生之\n    損害已經賠償之證明，難認符合供擔保原因消滅之要件，又\n    聲請人未證明相對人潘俊岳已同意返還本件擔保金。是聲請\n    人就相對人潘俊岳部分之聲請於法尚有未合，不能准許。\n五、爰依民事訴訟法第95條、第79條、第85條第2 項，裁定如主\n    文。\n六、如不服本裁定，應於裁定送達後10日內，以書狀向司法事務\n    官提出異議。\n中    華    民    國   100    年    12    月    16    日\n                  民事第一庭    司法事務官",
  "structure": {
    "main": "聲請人關於為相對人潘俊佳、張春汝於本院九十五年度存字第一\n五七九號擔保提存事件所提存之擔保金新臺幣壹拾萬元，准予返\n還。\n聲請人其餘聲請駁回。\n聲請程序費用由相對人潘俊佳、張春汝連帶負擔。",
    "reason": "一、按訴訟終結後，供擔保人證明已定20日以上之期間，催告受\n    擔保利益人行使權利而未行使者，或法院依供擔保利益人之\n    聲請，通知受擔保利益人於一定期間內行使權利並向法院為\n    行使權利之證明而未證明者，法院應依供擔保人之聲請，以\n    裁定命返還其提存物或保證書，民事訴訟法第104條第1項第\n    3款定有明文，依同法第106條之規定，於其他依法令供訴訟\n    上之擔保者，亦準用之。其中所謂訴訟終結，在因假扣押或\n    假處分所供擔保之場合，因該擔保係為保障受擔保利益人因\n    該假扣押或假處分所受損害而設，倘執行法院已依假扣押或\n    假處分裁定為假扣押或假處分之執行，則在供擔保人撤回假\n    扣押或假處分之執行前，受擔保利益人所受損害仍可能繼續\n    發生，損害額既尚未確定，自難強令其行使權利，必待供擔\n    保人已撤回假扣押或假處分之執行，始得謂為訴訟終結（最\n    高法院98年台抗字第49號、87年台抗字第234 號裁定意旨參\n    照）。又所謂應供擔保原因消滅，係擔保債務人因假扣押所\n    受之損害，故必待無損害發生，或債權人本案勝訴確定，或\n    就所生之損害已經賠償時，始得謂應供擔保之原因消滅（最\n    高法院53年度臺抗字第279 號判例意旨參照）。\n二、本件聲請意旨略以：聲請人與相對人間因假扣押事件，前依\n    本院95年度裁全字第2780號民事裁定，曾提供新臺幣（下同\n    ）100,000 元為擔保，聲請對相對人為假扣押執行在案。茲\n    因聲請人與相對人潘俊佳、張春汝間之本案訴訟，業經97年\n    度訴字第419 號民事判決確定在案，其與相對人潘俊岳間之\n    本案訴訟則於撤回訴訟後以存證信函催告相對人潘俊岳行使\n    權利而未行使，爰依法聲請返還前開擔保金等語，並提出本\n    院95年度裁全字第2780號民事裁定、95年度存字第1579號提\n    存書、97年度訴字第419 號民事判決確定證明書等件影本為\n    證。\n三、經查，聲請人聲請本院以95年度裁全字第2780號裁定，准許\n    聲請人供擔保後得對相對人之財產於1,000,000 元之範圍內\n    為假扣押，聲請人於供擔保後，據以聲請本院以95年度執全\n    字第1530號案件對相對人之財產予以假扣押等情，業據本院\n    依職權調取前開卷宗核閱屬實。嗣聲請人與相對人潘俊佳、\n    張春汝間之本案訴訟，業經97年度訴字第419 號判決合計命\n    相對人潘俊佳、張春汝應連帶給付聲請人張義結506,000 元\n    ，聲請人籃秀微914,926 元，及各自民國（下同）97年9 月\n    2 日起至清償日止，按年息百分之五計算之利息，並於98年\n    5 月21日確定在案，亦據本院依職權調取前開訴訟卷宗查明\n    無訛，則聲請人對相對人潘俊佳、張春汝之本案請求雖未獲\n    全部勝訴，但就其勝訴部分金額為1,420,926 元，已逾假扣\n    押所保全之請求金額1,000,000 元，就其假扣押之範圍而言\n    ，實已獲得全部勝訴，是本件受擔保利益人即相對人潘俊佳\n    、張春汝即無因上開假扣押裁定聲請執行而受有損害發生之\n    可能，故應認其應供擔保之原因已消滅，是本件受擔保利益\n    人即相對人潘俊佳、張春汝即無因上開假扣押裁定聲請執行\n    而受有損害發生之可能，故應認其應供擔保之原因已消滅，\n    揆諸前揭法條之規定，聲請人關於相對人潘俊佳、張春汝之\n    聲請即有理由，應予准許。\n四、又聲請人雖於100 年11月3 日以虎尾圓環郵局第149 號存證\n    信函催告相對人潘俊岳行使權利，惟其迄未撤回相對人潘俊\n    岳部分之假扣押執行程序一節，業據本院依職權調閱本院95\n    年度執全字第1530號假扣押執行案卷查明屬實，揆諸前開說\n    明，聲請人既未撤回假扣押之執行程序，受擔保利益人即相\n    對人潘俊岳可能發生之損害尚未確定，自無強令其行使權利\n    之理。本件聲請人既係於撤回假扣押執行程序前以存證信函\n    通知相對人潘俊岳行使權利，揆諸前揭說明，顯與民事訴訟\n    法第106 條準用同法第104 條第1 項第3 款於「訴訟終結後\n    」定20日以上期間催告受擔保利益人行使權利而未行使之要\n    件不符。又聲請人並未提出相對人潘俊岳無損害發生、本案\n    訴訟獲全部勝訴確定或就相對人潘俊岳因假扣押執行所生之\n    損害已經賠償之證明，難認符合供擔保原因消滅之要件，又\n    聲請人未證明相對人潘俊岳已同意返還本件擔保金。是聲請\n    人就相對人潘俊岳部分之聲請於法尚有未合，不能准許。\n五、爰依民事訴訟法第95條、第79條、第85條第2 項，裁定如主\n    文。\n六、如不服本裁定，應於裁定送達後10日內，以書狀向司法事務\n    官提出異議。"
  },
  "search": "臺灣雲林地方法院民事裁定100年度司聲字第277號聲請人張義結聲請人籃秀微相對人潘俊佳張春汝潘俊岳上列聲請人聲請返還擔保金事件，本院裁定如下：主文聲請人關於為相對人潘俊佳、張春汝於本院九十五年度存字第一五七九號擔保提存事件所提存之擔保金新臺幣壹拾萬元，准予返還。聲請人其餘聲請駁回。聲請程序費用由相對人潘俊佳、張春汝連帶負擔。理由一、按訴訟終結後，供擔保人證明已定20日以上之期間，催告受擔保利益人行使權利而未行使者，或法院依供擔保利益人之聲請，通知受擔保利益人於一定期間內行使權利並向法院為行使權利之證明而未證明者，法院應依供擔保人之聲請，以裁定命返還其提存物或保證書，民事訴訟法第104條第1項第3款定有明文，依同法第106條之規定，於其他依法令供訴訟上之擔保者，亦準用之。其中所謂訴訟終結，在因假扣押或假處分所供擔保之場合，因該擔保係為保障受擔保利益人因該假扣押或假處分所受損害而設，倘執行法院已依假扣押或假處分裁定為假扣押或假處分之執行，則在供擔保人撤回假扣押或假處分之執行前，受擔保利益人所受損害仍可能繼續發生，損害額既尚未確定，自難強令其行使權利，必待供擔保人已撤回假扣押或假處分之執行，始得謂為訴訟終結（最高法院98年台抗字第49號、87年台抗字第234號裁定意旨參照）。又所謂應供擔保原因消滅，係擔保債務人因假扣押所受之損害，故必待無損害發生，或債權人本案勝訴確定，或就所生之損害已經賠償時，始得謂應供擔保之原因消滅（最高法院53年度臺抗字第279號判例意旨參照）。二、本件聲請意旨略以：聲請人與相對人間因假扣押事件，前依本院95年度裁全字第2780號民事裁定，曾提供新臺幣（下同）100,000元為擔保，聲請對相對人為假扣押執行在案。茲因聲請人與相對人潘俊佳、張春汝間之本案訴訟，業經97年度訴字第419號民事判決確定在案，其與相對人潘俊岳間之本案訴訟則於撤回訴訟後以存證信函催告相對人潘俊岳行使權利而未行使，爰依法聲請返還前開擔保金等語，並提出本院95年度裁全字第2780號民事裁定、95年度存字第1579號提存書、97年度訴字第419號民事判決確定證明書等件影本為證。三、經查，聲請人聲請本院以95年度裁全字第2780號裁定，准許聲請人供擔保後得對相對人之財產於1,000,000元之範圍內為假扣押，聲請人於供擔保後，據以聲請本院以95年度執全字第1530號案件對相對人之財產予以假扣押等情，業據本院依職權調取前開卷宗核閱屬實。嗣聲請人與相對人潘俊佳、張春汝間之本案訴訟，業經97年度訴字第419號判決合計命相對人潘俊佳、張春汝應連帶給付聲請人張義結506,000元，聲請人籃秀微914,926元，及各自民國（下同）97年9月2日起至清償日止，按年息百分之五計算之利息，並於98年5月21日確定在案，亦據本院依職權調取前開訴訟卷宗查明無訛，則聲請人對相對人潘俊佳、張春汝之本案請求雖未獲全部勝訴，但就其勝訴部分金額為1,420,926元，已逾假扣押所保全之請求金額1,000,000元，就其假扣押之範圍而言，實已獲得全部勝訴，是本件受擔保利益人即相對人潘俊佳、張春汝即無因上開假扣押裁定聲請執行而受有損害發生之可能，故應認其應供擔保之原因已消滅，是本件受擔保利益人即相對人潘俊佳、張春汝即無因上開假扣押裁定聲請執行而受有損害發生之可能，故應認其應供擔保之原因已消滅，揆諸前揭法條之規定，聲請人關於相對人潘俊佳、張春汝之聲請即有理由，應予准許。四、又聲請人雖於100年11月3日以虎尾圓環郵局第149號存證信函催告相對人潘俊岳行使權利，惟其迄未撤回相對人潘俊岳部分之假扣押執行程序一節，業據本院依職權調閱本院95年度執全字第1530號假扣押執行案卷查明屬實，揆諸前開說明，聲請人既未撤回假扣押之執行程序，受擔保利益人即相對人潘俊岳可能發生之損害尚未確定，自無強令其行使權利之理。本件聲請人既係於撤回假扣押執行程序前以存證信函通知相對人潘俊岳行使權利，揆諸前揭說明，顯與民事訴訟法第106條準用同法第104條第1項第3款於「訴訟終結後」定20日以上期間催告受擔保利益人行使權利而未行使之要件不符。又聲請人並未提出相對人潘俊岳無損害發生、本案訴訟獲全部勝訴確定或就相對人潘俊岳因假扣押執行所生之損害已經賠償之證明，難認符合供擔保原因消滅之要件，又聲請人未證明相對人潘俊岳已同意返還本件擔保金。是聲請人就相對人潘俊岳部分之聲請於法尚有未合，不能准許。五、爰依民事訴訟法第95條、第79條、第85條第2項，裁定如主文。六、如不服本裁定，應於裁定送達後10日內，以書狀向司法事務官提出異議。中華民國100年12月16日民事第一庭司法事務官",
  "characters": {
    "judges": [

    ],
    "prosecutors": [

    ],
    "lawyers": [

    ],
    "clerks": [

    ],
    "plaintiffs": [

    ],
    "defendants": [

    ],
    "prosecutor_office": [
      "張義結",
      "籃秀微"
    ],
    "creditors": [

    ],
    "debtors": [

    ],
    "judicial_associate_officer": [

    ]
  },
  "adjudged_at": "2011-12-16",
  "created_at": "2016-02-13 10:20:42",
  "updated_at": "2016-02-13 10:20:42"
}